{"GUID":"AkKsEQACHt+fl92lrPjowg==","MATNR":"HZ-TOL","MAKTX":"Toluene","WERKS":"0001","LGORT":"0001","LGOBE":"Lager 0001","SECTION_ID":2,"SECTION_HEADER":"Hazard(s) identification","SECTION_CONTENT":"This chemical is considered hazardous by the 2012 OSHA Hazard Communication Standard (29 CFR 1910.1200)\nFlammable liquids\nCategory 2\nSkin Corrosion/Irritation\nCategory 2\nSerious Eye Damage/Eye Irritation\nCategory 2\nReproductive Toxicity\nCategory 2\nSpecific target organ toxicity (single exposure)\nCategory 3\nTarget Organs - Respiratory system, Central nervous system (CNS).\nSpecific target organ toxicity - (repeated exposure)\nCategory 2\nTarget Organs - Kidney, Liver, spleen, Blood, Neurological effects, Eyes, Ears.\nAspiration Toxicity\nCategory 1\nLabel Elements\nSignal Word\nDanger","REVISED_CONTENT":"Product ID:HZ-TOL,Product Description:Toluene,Storage Location:0001,Storage Location Description:Lager 0001,Plant:0001,Section Id:2,Section Header:Hazard(s) identification,Section Content:This chemical is considered hazardous by the 2012 OSHA Hazard Communication Standard (29 CFR 1910.1200)\nFlammable liquids\nCategory 2\nSkin Corrosion/Irritation\nCategory 2\nSerious Eye Damage/Eye Irritation\nCategory 2\nReproductive Toxicity\nCategory 2\nSpecific target organ toxicity (single exposure)\nCategory 3\nTarget Organs - Respiratory system, Central nervous system (CNS).\nSpecific target organ toxicity - (repeated exposure)\nCategory 2\nTarget Organs - Kidney, Liver, spleen, Blood, Neurological effects, Eyes, Ears.\nAspiration Toxicity\nCategory 1\nLabel Elements\nSignal Word\nDanger"}