{"GUID":"AkKsEQACHt+fl92lrPbowg==","MATNR":"HZ-TNT","MAKTX":"TNT","WERKS":"0001","LGORT":"0004","LGOBE":"Explosives","SECTION_ID":2,"SECTION_HEADER":"Hazard(s) identification","SECTION_CONTENT":"Classification of the substance or mixture\nGHS02 Flame\nFlam. Liq. 2 H225 Highly flammable liquid and vapor.\nGHS06 Skull and crossbones\nAcute Tox. 3 H331 Toxic if inhaled.\nGHS08 Health hazard\nSTOT SE 1 H370 Causes damage to organs.\n• Label elements\n• GHS label elements The product is classified and labeled according to the Globally Harmonized System (GHS).\nHazard pictograms\nGHS02 GHS06 GHS08\n• Signal word Danger\n· Hazard-determining components of labeling:\nmethanol\nacetonitrile\n2,4,6-trinitrotoluene\n• Hazard statements\nH225 Highly flammable liquid and vapor.\nH331 Toxic if inhaled.\nH370 Causes damage to organs.\n• Precautionary statements\nIf medical advice is needed, have product container or label at hand.\nKeep out of reach of children.\nRead label before use.\nKeep away from heat/sparks/open flames/hot surfaces. - No smoking.\nUse explosion-proof electrical/ventilating/lighting/equipment.\nDo not breathe dust/fume/gas/mist/vapors/spray.\nIf on skin (or hair): Take off immediately all contaminated clothing. Rinse skin with water/shower.\nStore locked up.\nDispose of contents/container in accordance with local/regional/national/international regulations.","REVISED_CONTENT":"Product ID:HZ-TNT,Product Description:TNT,Storage Location:0004,Storage Location Description:Explosives,Plant:0001,Section Id:2,Section Header:Hazard(s) identification,Section Content:Classification of the substance or mixture\nGHS02 Flame\nFlam. Liq. 2 H225 Highly flammable liquid and vapor.\nGHS06 Skull and crossbones\nAcute Tox. 3 H331 Toxic if inhaled.\nGHS08 Health hazard\nSTOT SE 1 H370 Causes damage to organs.\n• Label elements\n• GHS label elements The product is classified and labeled according to the Globally Harmonized System (GHS).\nHazard pictograms\nGHS02 GHS06 GHS08\n• Signal word Danger\n· Hazard-determining components of labeling:\nmethanol\nacetonitrile\n2,4,6-trinitrotoluene\n• Hazard statements\nH225 Highly flammable liquid and vapor.\nH331 Toxic if inhaled.\nH370 Causes damage to organs.\n• Precautionary statements\nIf medical advice is needed, have product container or label at hand.\nKeep out of reach of children.\nRead label before use.\nKeep away from heat/sparks/open flames/hot surfaces. - No smoking.\nUse explosion-proof electrical/ventilating/lighting/equipment.\nDo not breathe dust/fume/gas/mist/vapors/spray.\nIf on skin (or hair): Take off immediately all contaminated clothing. Rinse skin with water/shower.\nStore locked up.\nDispose of contents/container in accordance with local/regional/national/international regulations."}