{"GUID":"AkKsEQACHt+fl92lpszowg==","MATNR":"HZ-HEL","MAKTX":"Helium","WERKS":"0001","LGORT":"0001","LGOBE":"Lager 0001","SECTION_ID":2,"SECTION_HEADER":"Hazard(s) identification","SECTION_CONTENT":"Physical hazards\nGases under pressure\nHealth hazards\nNot classified.\nOSHA defined hazards\nNot classified.\nLabel elements\nCompressed gas\nSignal word\nWarning\nHazard statement\nContains gas under pressure; may explode if heated.\nMay displace oxygen and cause rapid suffocation.\nPrecautionary statement\nPrevention\nObserve good industrial hygiene practices.\nResponse\nWash hands after handling.\nStorage\nProtect from sunlight. Store in a well-ventilated place.\nDisposal\nDispose of waste and residues in accordance with local authority requirements.\nHazard(s) not otherwise\nclassified (HNOC)\nNone known.\nSupplemental information\nNot applicable.","REVISED_CONTENT":"Product ID:HZ-HEL,Product Description:Helium,Storage Location:0001,Storage Location Description:Lager 0001,Plant:0001,Section Id:2,Section Header:Hazard(s) identification,Section Content:Physical hazards\nGases under pressure\nHealth hazards\nNot classified.\nOSHA defined hazards\nNot classified.\nLabel elements\nCompressed gas\nSignal word\nWarning\nHazard statement\nContains gas under pressure; may explode if heated.\nMay displace oxygen and cause rapid suffocation.\nPrecautionary statement\nPrevention\nObserve good industrial hygiene practices.\nResponse\nWash hands after handling.\nStorage\nProtect from sunlight. Store in a well-ventilated place.\nDisposal\nDispose of waste and residues in accordance with local authority requirements.\nHazard(s) not otherwise\nclassified (HNOC)\nNone known.\nSupplemental information\nNot applicable."}