{"GUID":"AkKsEQACHt+fl92lpuYIwg==","MATNR":"HZ-OXY","MAKTX":"Oxygen","WERKS":"0001","LGORT":"0001","LGOBE":"Lager 0001","SECTION_ID":11,"SECTION_HEADER":"Toxicological information","SECTION_CONTENT":"Information on toxicological effects\nAcute toxicity : Not available.\nIrritation/Corrosion : Not available.\nSensitization : Not available.\nMutagenicity : Not available.\nCarcinogenicity : Not available.\nReproductive toxicity : Not available.\nTeratogenicity : Not available.\nSpecific target organ toxicity (single exposure) : Not available.\nSpecific target organ toxicity (repeated exposure) : Not available.\nAspiration hazard : Not available.\nInformation on the likely\nroutes of exposure : Not available.\nPotential acute health effects\nEye contact : Contact with rapidly expanding gas may cause burns or frostbite.\nInhalation : No known significant effects or critical hazards.\nSkin contact : Contact with rapidly expanding gas may cause burns or frostbite.\nIngestion : As this product is a gas, refer to the inhalation section.","REVISED_CONTENT":"Product ID:HZ-OXY,Product Description:Oxygen,Storage Location:0001,Storage Location Description:Lager 0001,Plant:0001,Section Id:11,Section Header:Toxicological information,Section Content:Information on toxicological effects\nAcute toxicity : Not available.\nIrritation/Corrosion : Not available.\nSensitization : Not available.\nMutagenicity : Not available.\nCarcinogenicity : Not available.\nReproductive toxicity : Not available.\nTeratogenicity : Not available.\nSpecific target organ toxicity (single exposure) : Not available.\nSpecific target organ toxicity (repeated exposure) : Not available.\nAspiration hazard : Not available.\nInformation on the likely\nroutes of exposure : Not available.\nPotential acute health effects\nEye contact : Contact with rapidly expanding gas may cause burns or frostbite.\nInhalation : No known significant effects or critical hazards.\nSkin contact : Contact with rapidly expanding gas may cause burns or frostbite.\nIngestion : As this product is a gas, refer to the inhalation section."}