{"GUID":"AkKsEQACHt+fl92lo1uIwg==","MATNR":"HZ-DYN","MAKTX":"Dynamite Gray","WERKS":"0001","LGORT":"0004","LGOBE":"Explosives","SECTION_ID":3,"SECTION_HEADER":"Composition / information on ingredients","SECTION_CONTENT":"Substance/mixture\nChemical name\n:\nMixture\n:\nMixture\nOther means of identification\n:\nCC10227370\nCAS number/other identifiers\nIngredient name\nTitanium dioxide\n%\n30-60\nCAS number\n13463-67-7\nAny concentration shown as a range is to protect confidentiality or is due to batch variation.\nThere are no additional ingredients present which, within the current knowledge of the supplier and in the\nconcentrations applicable, are classified as hazardous to health or the environment and hence require\nreporting in this section.\nOccupational exposure limits, if available, are listed in Section 8.","REVISED_CONTENT":"Product ID:HZ-DYN,Product Description:Dynamite Gray,Storage Location:0004,Storage Location Description:Explosives,Plant:0001,Section Id:3,Section Header:Composition / information on ingredients,Section Content:Substance/mixture\nChemical name\n:\nMixture\n:\nMixture\nOther means of identification\n:\nCC10227370\nCAS number/other identifiers\nIngredient name\nTitanium dioxide\n%\n30-60\nCAS number\n13463-67-7\nAny concentration shown as a range is to protect confidentiality or is due to batch variation.\nThere are no additional ingredients present which, within the current knowledge of the supplier and in the\nconcentrations applicable, are classified as hazardous to health or the environment and hence require\nreporting in this section.\nOccupational exposure limits, if available, are listed in Section 8."}