{"GUID":"AkKsEQACHt+fl92loTVowg==","MATNR":"HZ-BUT","MAKTX":"Butane","WERKS":"0001","LGORT":"0001","LGOBE":"Lager 0001","SECTION_ID":4,"SECTION_HEADER":"First-aid measures","SECTION_CONTENT":"SECTION 4: First aid measures\n4.1 Description of first-aid measures\nGeneral advice\nShow this material safety data sheet to the doctor in attendance.\nIf inhaled\nAfter inhalation: fresh air.\nIn case of skin contact\nIn case of skin contact: Take off immediately all contaminated clothing. Rinse skin with\nwater/ shower.\nIn case of eye contact\nAfter eye contact: rinse out with plenty of water. Remove contact lenses.\nIf swallowed\nAfter swallowing: make victim drink water (two glasses at most). Consult doctor if feeling\nunwell.","REVISED_CONTENT":"Product ID:HZ-BUT,Product Description:Butane,Storage Location:0001,Storage Location Description:Lager 0001,Plant:0001,Section Id:4,Section Header:First-aid measures,Section Content:SECTION 4: First aid measures\n4.1 Description of first-aid measures\nGeneral advice\nShow this material safety data sheet to the doctor in attendance.\nIf inhaled\nAfter inhalation: fresh air.\nIn case of skin contact\nIn case of skin contact: Take off immediately all contaminated clothing. Rinse skin with\nwater/ shower.\nIn case of eye contact\nAfter eye contact: rinse out with plenty of water. Remove contact lenses.\nIf swallowed\nAfter swallowing: make victim drink water (two glasses at most). Consult doctor if feeling\nunwell."}