{"GUID":"AkKsEQACHt+fl92lptLowg==","MATNR":"HZ-LEA","MAKTX":"Lead","WERKS":"0001","LGORT":"0088","LGOBE":"Lager 0088 (WM)","SECTION_ID":2,"SECTION_HEADER":"Hazard(s) identification","SECTION_CONTENT":"Classification\nThis chemical is considered hazardous by the 2012 OSHA Hazard Communication Standard (29 CFR 1910.1200)\nAcute oral toxicity\nAcute Inhalation Toxicity - Dusts and Mists\nCarcinogenicity\nReproductive Toxicity\nSpecific target organ toxicity - (repeated exposure)\nLabel Elements\nSignal Word\nDanger\nHazard Statements\nHarmful if swallowed\nHarmful if inhaled\nSuspected of causing cancer\nMay damage the unborn child. Suspected of damaging fertility\nMay cause damage to organs through prolonged or repeated exposure\nCategory 4\nCategory 4\nCategory 2\nCategory 1A\nCategory 2","REVISED_CONTENT":"Product ID:HZ-LEA,Product Description:Lead,Storage Location:0088,Storage Location Description:Lager 0088 (WM),Plant:0001,Section Id:2,Section Header:Hazard(s) identification,Section Content:Classification\nThis chemical is considered hazardous by the 2012 OSHA Hazard Communication Standard (29 CFR 1910.1200)\nAcute oral toxicity\nAcute Inhalation Toxicity - Dusts and Mists\nCarcinogenicity\nReproductive Toxicity\nSpecific target organ toxicity - (repeated exposure)\nLabel Elements\nSignal Word\nDanger\nHazard Statements\nHarmful if swallowed\nHarmful if inhaled\nSuspected of causing cancer\nMay damage the unborn child. Suspected of damaging fertility\nMay cause damage to organs through prolonged or repeated exposure\nCategory 4\nCategory 4\nCategory 2\nCategory 1A\nCategory 2"}