{"GUID":"AkKsEQACHt+fl92lrOQIwg==","MATNR":"HZ-POH","MAKTX":"Potassium hydroxide","WERKS":"0001","LGORT":"0003","LGOBE":"Corrosive Items","SECTION_ID":11,"SECTION_HEADER":"Toxicological information","SECTION_CONTENT":"Information on likely routes of exposure\nInhalation:\nCauses severe burns.\nSkin Contact:\nCauses severe skin burns.\nEye contact:\nCauses serious eye damage.\nIngestion:\nMay cause burns of the gastrointestinal tract if swallowed.\nInformation on toxicological effects\nAcute toxicity (list all possible routes of exposure)\nOral\nProduct:\nATEmix (Rat): 303.3 mg/kg\nDermal\nProduct:\nNo data available.\nInhalation\nProduct:\nNo data available.\nRepeated dose toxicity\nProduct:\nNo data available.\nSkin Corrosion/Irritation\nProduct:\nCauses severe skin burns.\nSerious Eye Damage/Eye Irritation\nProduct:\nCauses serious eye damage.\nRespiratory or Skin Sensitization\nProduct:\nNot a skin nor a respiratory sensitizer.\nCarcinogenicity\nProduct:\nThis substance has no evidence of carcinogenic properties.\nIARC Monographs on the Evaluation of Carcinogenic Risks to Humans:\nNo carcinogenic components identified\nUS. National Toxicology Program (NTP) Report on Carcinogens:\nNo carcinogenic components identified\nUS. OSHA Specifically Regulated Substances (29 CFR 1910.1001-1050):\nNo carcinogenic components identified\nGerm Cell Mutagenicity\nIn vitro\nProduct:\nNo mutagenic components identified\nIn vivo\nProduct:\nNo mutagenic components identified\nReproductive toxicity\nProduct:\nNo components toxic to reproduction","REVISED_CONTENT":"Product ID:HZ-POH,Product Description:Potassium hydroxide,Storage Location:0003,Storage Location Description:Corrosive Items,Plant:0001,Section Id:11,Section Header:Toxicological information,Section Content:Information on likely routes of exposure\nInhalation:\nCauses severe burns.\nSkin Contact:\nCauses severe skin burns.\nEye contact:\nCauses serious eye damage.\nIngestion:\nMay cause burns of the gastrointestinal tract if swallowed.\nInformation on toxicological effects\nAcute toxicity (list all possible routes of exposure)\nOral\nProduct:\nATEmix (Rat): 303.3 mg/kg\nDermal\nProduct:\nNo data available.\nInhalation\nProduct:\nNo data available.\nRepeated dose toxicity\nProduct:\nNo data available.\nSkin Corrosion/Irritation\nProduct:\nCauses severe skin burns.\nSerious Eye Damage/Eye Irritation\nProduct:\nCauses serious eye damage.\nRespiratory or Skin Sensitization\nProduct:\nNot a skin nor a respiratory sensitizer.\nCarcinogenicity\nProduct:\nThis substance has no evidence of carcinogenic properties.\nIARC Monographs on the Evaluation of Carcinogenic Risks to Humans:\nNo carcinogenic components identified\nUS. National Toxicology Program (NTP) Report on Carcinogens:\nNo carcinogenic components identified\nUS. OSHA Specifically Regulated Substances (29 CFR 1910.1001-1050):\nNo carcinogenic components identified\nGerm Cell Mutagenicity\nIn vitro\nProduct:\nNo mutagenic components identified\nIn vivo\nProduct:\nNo mutagenic components identified\nReproductive toxicity\nProduct:\nNo components toxic to reproduction"}