{"GUID":"AkKsEQACHt+fl92lps1owg==","MATNR":"HZ-HEL","MAKTX":"Helium","WERKS":"0001","LGORT":"0001","LGOBE":"Lager 0001","SECTION_ID":6,"SECTION_HEADER":"Accidental release measures","SECTION_CONTENT":"Personal precautions, protective equipment and\nemergency procedures\nKeep unnecessary personnel away. Ensure adequate ventilation. Avoid breathing gas. For\npersonal protection, see Section 8 of the SDS. In the event of a leak evacuate all personnel until\nventilation can restore oxygen concentrations to safe levels.\nMethods and materials for\ncontainment and cleaning up\nStop the flow of material, if this is without risk. For waste disposal, see Section 13 of the SDS.\nEnvironmental precautions\nAvoid discharge into drains, water courses or onto the ground.","REVISED_CONTENT":"Product ID:HZ-HEL,Product Description:Helium,Storage Location:0001,Storage Location Description:Lager 0001,Plant:0001,Section Id:6,Section Header:Accidental release measures,Section Content:Personal precautions, protective equipment and\nemergency procedures\nKeep unnecessary personnel away. Ensure adequate ventilation. Avoid breathing gas. For\npersonal protection, see Section 8 of the SDS. In the event of a leak evacuate all personnel until\nventilation can restore oxygen concentrations to safe levels.\nMethods and materials for\ncontainment and cleaning up\nStop the flow of material, if this is without risk. For waste disposal, see Section 13 of the SDS.\nEnvironmental precautions\nAvoid discharge into drains, water courses or onto the ground."}