{"GUID":"AkKsEQACHt+fl92lrPKIwg==","MATNR":"HZ-SOM","MAKTX":"Sodium metal","WERKS":"0001","LGORT":"0001","LGOBE":"Lager 0001","SECTION_ID":15,"SECTION_HEADER":"Regulatory information","SECTION_CONTENT":"TSCA Listed: All components are listed.\nRegulation (EC) No 1272/2008 (CLP) : Substances and mixtures which, in contact with water, emit flammable gases, category 1, Skin corrosion/irritation,\ncategory 1B, Eye damage/irritation, category 1.\nCanada WHMIS Classification (CPR, SOR/88-66): Substances and mixtures which, in contact with water, emit flammable gases, Skin corrosion/irritation,\nSerious eye damage/eye irritation.\nHMIS Ratings: Health : 3 Flammability: 3 Physical : 2\nNFPA Ratings: Health : 3 Flammability: 3 Instability: 2 Special Hazard: W\nChemical Safety Assessment: A chemical safety assessment has not been carried out.","REVISED_CONTENT":"Product ID:HZ-SOM,Product Description:Sodium metal,Storage Location:0001,Storage Location Description:Lager 0001,Plant:0001,Section Id:15,Section Header:Regulatory information,Section Content:TSCA Listed: All components are listed.\nRegulation (EC) No 1272/2008 (CLP) : Substances and mixtures which, in contact with water, emit flammable gases, category 1, Skin corrosion/irritation,\ncategory 1B, Eye damage/irritation, category 1.\nCanada WHMIS Classification (CPR, SOR/88-66): Substances and mixtures which, in contact with water, emit flammable gases, Skin corrosion/irritation,\nSerious eye damage/eye irritation.\nHMIS Ratings: Health : 3 Flammability: 3 Physical : 2\nNFPA Ratings: Health : 3 Flammability: 3 Instability: 2 Special Hazard: W\nChemical Safety Assessment: A chemical safety assessment has not been carried out."}