{"GUID":"AkKsEQACHt+fl92lo10Iwg==","MATNR":"HZ-DYN","MAKTX":"Dynamite Gray","WERKS":"0001","LGORT":"0004","LGOBE":"Explosives","SECTION_ID":15,"SECTION_HEADER":"Regulatory information","SECTION_CONTENT":"U.S. Federal regulations\n:\nUnited States - TSCA 12(b) - Chemical export notification: None\nof the components are listed.\nUnited States - TSCA 4(a) - Final Test Rules: Not listed\nUnited States - TSCA 4(a) - ITC Priority list: Not listed\nUnited States - TSCA 4(a) - Proposed test rules: Not listed\nUnited States - TSCA 4(f) - Priority risk review: Not listed\nUnited States - TSCA 5(a)2 - Final significant new use rules: Not\nlisted\nUnited States - TSCA 5(a)2 - Proposed significant new use rules:\nNot listed\nUnited States - TSCA 5(e) - Substances consent order: Not listed\nUnited States - TSCA 6 - Final risk management: Not listed\nUnited States - TSCA 6 - Proposed risk management: Not listed\nUnited States - TSCA 8(a) - Chemical risk rules: Not listed\nUnited States - TSCA 8(a) - Dioxin/Furane precusor: Not listed\nUnited States - TSCA 8(a) - Chemical Data Reporting (CDR): Not\ndetermined\nUnited States - TSCA 8(a) - Preliminary assessment report\n(PAIR): Not listed\nUnited States - TSCA 8(c) - Significant adverse reaction (SAR):\nNot listed\nUnited States - TSCA 8(d) - Health and safety studies: Not listed\nUnited States - EPA Clean water act (CWA) section 307 - Priority\npollutants: Not listed\nUnited States - EPA Clean water act (CWA) section 311 -\nHazardous substances: Not listed\nUnited States - EPA Clean air act (CAA) section 112 - Accidental\nrelease prevention - Flammable substances: Not listed\nUnited States - EPA Clean air act (CAA) section 112 - Accidental\nrelease prevention - Toxic substances: Not listed\nUnited States - Department of commerce - Precursor chemical:\nNot listed\nClean Air Act Section 112(b)\nHazardous Air Pollutants (HAPS)\nClean Air Act Section 602 Class I\nSubstances\n:\nNot listed\n:\nNot listed\n:\nNot listed\nClean Air Act Section 602 Class II\nSubstances\n:\nNot listed","REVISED_CONTENT":"Product ID:HZ-DYN,Product Description:Dynamite Gray,Storage Location:0004,Storage Location Description:Explosives,Plant:0001,Section Id:15,Section Header:Regulatory information,Section Content:U.S. Federal regulations\n:\nUnited States - TSCA 12(b) - Chemical export notification: None\nof the components are listed.\nUnited States - TSCA 4(a) - Final Test Rules: Not listed\nUnited States - TSCA 4(a) - ITC Priority list: Not listed\nUnited States - TSCA 4(a) - Proposed test rules: Not listed\nUnited States - TSCA 4(f) - Priority risk review: Not listed\nUnited States - TSCA 5(a)2 - Final significant new use rules: Not\nlisted\nUnited States - TSCA 5(a)2 - Proposed significant new use rules:\nNot listed\nUnited States - TSCA 5(e) - Substances consent order: Not listed\nUnited States - TSCA 6 - Final risk management: Not listed\nUnited States - TSCA 6 - Proposed risk management: Not listed\nUnited States - TSCA 8(a) - Chemical risk rules: Not listed\nUnited States - TSCA 8(a) - Dioxin/Furane precusor: Not listed\nUnited States - TSCA 8(a) - Chemical Data Reporting (CDR): Not\ndetermined\nUnited States - TSCA 8(a) - Preliminary assessment report\n(PAIR): Not listed\nUnited States - TSCA 8(c) - Significant adverse reaction (SAR):\nNot listed\nUnited States - TSCA 8(d) - Health and safety studies: Not listed\nUnited States - EPA Clean water act (CWA) section 307 - Priority\npollutants: Not listed\nUnited States - EPA Clean water act (CWA) section 311 -\nHazardous substances: Not listed\nUnited States - EPA Clean air act (CAA) section 112 - Accidental\nrelease prevention - Flammable substances: Not listed\nUnited States - EPA Clean air act (CAA) section 112 - Accidental\nrelease prevention - Toxic substances: Not listed\nUnited States - Department of commerce - Precursor chemical:\nNot listed\nClean Air Act Section 112(b)\nHazardous Air Pollutants (HAPS)\nClean Air Act Section 602 Class I\nSubstances\n:\nNot listed\n:\nNot listed\n:\nNot listed\nClean Air Act Section 602 Class II\nSubstances\n:\nNot listed"}