{"GUID":"AkKsEQACHt+fl92loTIIwg==","MATNR":"HZ-ATR","MAKTX":"Atrazine","WERKS":"0001","LGORT":"0088","LGOBE":"Lager 0088 (WM)","SECTION_ID":9,"SECTION_HEADER":"Physical and chemical properties","SECTION_CONTENT":"Physical State and Appearance: Solid.\nOdor: Not available.\nTaste: Not available.\nMolecular Weight: 215.68 g/mole\nColor: Not available.\npH(1% soln/water): Not available.\nBoiling Point: Not available.\nMelting Point: Not available.\nCritical Temperature: Not available.\nSpecific Gravity: Not available.\nVapour Pressure: Not available.\nVapor Density: Not available.\nVolatility: Not available.\nOdor Threshold: Not available.\nWater/Oil Dist. Coeff: Not available.\nIonicity (in Water): Not available.\nDispersion Properties: Not available.\nSolubility: Soluble in chloroform","REVISED_CONTENT":"Product ID:HZ-ATR,Product Description:Atrazine,Storage Location:0088,Storage Location Description:Lager 0088 (WM),Plant:0001,Section Id:9,Section Header:Physical and chemical properties,Section Content:Physical State and Appearance: Solid.\nOdor: Not available.\nTaste: Not available.\nMolecular Weight: 215.68 g/mole\nColor: Not available.\npH(1% soln/water): Not available.\nBoiling Point: Not available.\nMelting Point: Not available.\nCritical Temperature: Not available.\nSpecific Gravity: Not available.\nVapour Pressure: Not available.\nVapor Density: Not available.\nVolatility: Not available.\nOdor Threshold: Not available.\nWater/Oil Dist. Coeff: Not available.\nIonicity (in Water): Not available.\nDispersion Properties: Not available.\nSolubility: Soluble in chloroform"}