{"GUID":"AkKsEQACHt+fl92lptfowg==","MATNR":"HZ-MAG","MAKTX":"Magnesium","WERKS":"0001","LGORT":"0001","LGOBE":"Lager 0001","SECTION_ID":10,"SECTION_HEADER":"Stability and reactivity","SECTION_CONTENT":"Reactive Hazard\nYes\nStability\nStable under normal conditions. Air sensitive. Water reactive.\nConditions to Avoid\nProtect from water. Exposure to air. Incompatible products. Exposure to moist air or water.\nIncompatible Materials\nAcids, Strong oxidizing agents, Halogens, Acid chlorides\nHazardous Decomposition Products Magnesium oxides\nHazardous Polymerization\nHazardous Reactions\nHazardous polymerization does not occur.\nNone under normal processing.","REVISED_CONTENT":"Product ID:HZ-MAG,Product Description:Magnesium,Storage Location:0001,Storage Location Description:Lager 0001,Plant:0001,Section Id:10,Section Header:Stability and reactivity,Section Content:Reactive Hazard\nYes\nStability\nStable under normal conditions. Air sensitive. Water reactive.\nConditions to Avoid\nProtect from water. Exposure to air. Incompatible products. Exposure to moist air or water.\nIncompatible Materials\nAcids, Strong oxidizing agents, Halogens, Acid chlorides\nHazardous Decomposition Products Magnesium oxides\nHazardous Polymerization\nHazardous Reactions\nHazardous polymerization does not occur.\nNone under normal processing."}