{"GUID":"AkKsEQACHt+fl92lo1dowg==","MATNR":"HZ-CLG","MAKTX":"Chlorine gas","WERKS":"0001","LGORT":"0001","LGOBE":"Lager 0001","SECTION_ID":2,"SECTION_HEADER":"Hazard identification","SECTION_CONTENT":"Classification of the substance or mixture\nGHS03 Flame over circle\nOxid. Gas 1 H270 May cause or intensify fire; oxidizer.\nGHS04 Gas cylinder\nPress. Gas H280 Contains gas under pressure; may explode if heated.\nGHS06 Skull and crossbones\nAcute Tox. 2 H330 Fatal if inhaled.\n! GHS07\nSkin Irrit. 2 H315 Causes skin irritation.\nEye Irrit. 2A H319 Causes serious eye irritation.\nSTOT SE 3 H335 May cause respiratory irritation.\nLabel elements\nGHS label elements The substance is classified and labeled according to the Globally Harmonized System (GHS).","REVISED_CONTENT":"Product ID:HZ-CLG,Product Description:Chlorine gas,Storage Location:0001,Storage Location Description:Lager 0001,Plant:0001,Section Id:2,Section Header:Hazard identification,Section Content:Classification of the substance or mixture\nGHS03 Flame over circle\nOxid. Gas 1 H270 May cause or intensify fire; oxidizer.\nGHS04 Gas cylinder\nPress. Gas H280 Contains gas under pressure; may explode if heated.\nGHS06 Skull and crossbones\nAcute Tox. 2 H330 Fatal if inhaled.\n! GHS07\nSkin Irrit. 2 H315 Causes skin irritation.\nEye Irrit. 2A H319 Causes serious eye irritation.\nSTOT SE 3 H335 May cause respiratory irritation.\nLabel elements\nGHS label elements The substance is classified and labeled according to the Globally Harmonized System (GHS)."}