{"GUID":"AkKsEQACHt+fl92lpuCIwg==","MATNR":"HZ-MET","MAKTX":"Methane","WERKS":"0001","LGORT":"0001","LGOBE":"Lager 0001","SECTION_ID":15,"SECTION_HEADER":"Regulatory information","SECTION_CONTENT":"U.S. Federal regulations\nClean Air Act Section 112\n(b) Hazardous Air\nPollutants (HAPS)\nClean Air Act Section 602\nClass I Substances\nClean Air Act Section 602\nClass II Substances\nDEA List I Chemicals\n(Precursor Chemicals)\nDEA List II Chemicals\n(Essential Chemicals)\nSARA 302/304\nComposition/information on ingredients\nSARA 304 RQ\nSARA 311/312\nClassification\nState regulations\nMassachusetts\nNew York\nNew Jersey\nPennsylvania\nInternational regulations\nChemical Weapon Convention List Schedules I, II & III Chemicals\nMontreal Protocol\nStockholm Convention on Persistent Organic Pollutants\nRotterdam Convention on Prior Informed Consent (PIC)\nUNECE Aarhus Protocol on POPs and Heavy Metals\nInventory list\nAustralia\nCanada\nChina\nEurope\nJapan\nNew Zealand\nPhilippines\nRepublic of Korea\nTaiwan : TSCA 8(a) CDR Exempt/Partial exemption: Not determined\nClean Air Act (CAA) 112 regulated flammable substances: methane\n: Not listed\n: Not listed\n: Not listed\n: Not listed\n: Not listed\n: Not listed\nNo products were found.\n: Not applicable.\n: Refer to Section 2: Hazards Identification of this SDS for classification of substance.\n: This material is listed.\n: This material is not listed.\n: This material is listed.\n: This material is listed.\nNot listed.\nNot listed.\nNot listed.\nNot listed.\nNot listed.\n: This material is listed or exempted.\n: This material is listed or exempted.\n: This material is listed or exempted.\n: This material is listed or exempted.\n: Japan inventory (ENCS): This material is listed or exempted.\nJapan inventory (ISHL): Not determined.\n: This material is listed or exempted.\n: This material is listed or exempted.\n: This material is listed or exempted.\n: This material is listed or exempted.","REVISED_CONTENT":"Product ID:HZ-MET,Product Description:Methane,Storage Location:0001,Storage Location Description:Lager 0001,Plant:0001,Section Id:15,Section Header:Regulatory information,Section Content:U.S. Federal regulations\nClean Air Act Section 112\n(b) Hazardous Air\nPollutants (HAPS)\nClean Air Act Section 602\nClass I Substances\nClean Air Act Section 602\nClass II Substances\nDEA List I Chemicals\n(Precursor Chemicals)\nDEA List II Chemicals\n(Essential Chemicals)\nSARA 302/304\nComposition/information on ingredients\nSARA 304 RQ\nSARA 311/312\nClassification\nState regulations\nMassachusetts\nNew York\nNew Jersey\nPennsylvania\nInternational regulations\nChemical Weapon Convention List Schedules I, II & III Chemicals\nMontreal Protocol\nStockholm Convention on Persistent Organic Pollutants\nRotterdam Convention on Prior Informed Consent (PIC)\nUNECE Aarhus Protocol on POPs and Heavy Metals\nInventory list\nAustralia\nCanada\nChina\nEurope\nJapan\nNew Zealand\nPhilippines\nRepublic of Korea\nTaiwan : TSCA 8(a) CDR Exempt/Partial exemption: Not determined\nClean Air Act (CAA) 112 regulated flammable substances: methane\n: Not listed\n: Not listed\n: Not listed\n: Not listed\n: Not listed\n: Not listed\nNo products were found.\n: Not applicable.\n: Refer to Section 2: Hazards Identification of this SDS for classification of substance.\n: This material is listed.\n: This material is not listed.\n: This material is listed.\n: This material is listed.\nNot listed.\nNot listed.\nNot listed.\nNot listed.\nNot listed.\n: This material is listed or exempted.\n: This material is listed or exempted.\n: This material is listed or exempted.\n: This material is listed or exempted.\n: Japan inventory (ENCS): This material is listed or exempted.\nJapan inventory (ISHL): Not determined.\n: This material is listed or exempted.\n: This material is listed or exempted.\n: This material is listed or exempted.\n: This material is listed or exempted."}