{"GUID":"AkKsEQACHt+fl92lptUowg==","MATNR":"HZ-LIT","MAKTX":"Lithium","WERKS":"0001","LGORT":"0001","LGOBE":"Lager 0001","SECTION_ID":4,"SECTION_HEADER":"FIRST AID MEASURES","SECTION_CONTENT":"Immediately call a POISON CENTER or physician (P310).\nIf inhaled: Remove victim to fresh air and keep at rest in a position comfortable for breathing (P304+P340). If in eyes: Rinse cautiously\nwith water for several minutes. Remove contact lenses if present and easy to do so. Continue rinsing (P305+P351+P338).\nIf on skin or hair: Immediately remove all contaminated clothing. Rinse skin with water (P303+P361+P353). Brush off loose particles from\nskin (P335). If swallowed: Rinse mouth. Do NOT induce vomiting (P301+P330+P331).\nWash contaminated clothing before reuse (P363).","REVISED_CONTENT":"Product ID:HZ-LIT,Product Description:Lithium,Storage Location:0001,Storage Location Description:Lager 0001,Plant:0001,Section Id:4,Section Header:FIRST AID MEASURES,Section Content:Immediately call a POISON CENTER or physician (P310).\nIf inhaled: Remove victim to fresh air and keep at rest in a position comfortable for breathing (P304+P340). If in eyes: Rinse cautiously\nwith water for several minutes. Remove contact lenses if present and easy to do so. Continue rinsing (P305+P351+P338).\nIf on skin or hair: Immediately remove all contaminated clothing. Rinse skin with water (P303+P361+P353). Brush off loose particles from\nskin (P335). If swallowed: Rinse mouth. Do NOT induce vomiting (P301+P330+P331).\nWash contaminated clothing before reuse (P363)."}