{"GUID":"AkKsEQACHt+fl92lo1sowg==","MATNR":"HZ-CMO","MAKTX":"Carbon monoxide","WERKS":"0001","LGORT":"0001","LGOBE":"Lager 0001","SECTION_ID":16,"SECTION_HEADER":"Other information","SECTION_CONTENT":"Revision date\nOther information\nFull text of H-phrases:\nH220\nH280\nH331\nH360\nH372\nNFPA health hazard\nNFPA fire hazard\nNFPA reactivity\n: 08/13/2019\n: This Safety Data Sheet is offered pursuant to OSHA's Hazard Communication Standard, 29\nCFR, 1910.1200. Other government regulations must be reviewed for applicability to this\nproduct.\n: Extremely flammable gas\nContains gas under pressure; may explode if heated\nToxic if inhaled\nMay damage fertility or the unborn child\nCauses damage to organs through prolonged or repeated exposure\n: 3 - Materials that, under emergency conditions, can cause\nserious or permanent injury.\n: 4 - Materials that rapidly or completely vaporize at\natmospheric pressure and normal ambient temperature or\nthat are readily dispersed in air and burn readily.\n: 0 - Material that in themselves are normally stable, even\nunder fire conditions.","REVISED_CONTENT":"Product ID:HZ-CMO,Product Description:Carbon monoxide,Storage Location:0001,Storage Location Description:Lager 0001,Plant:0001,Section Id:16,Section Header:Other information,Section Content:Revision date\nOther information\nFull text of H-phrases:\nH220\nH280\nH331\nH360\nH372\nNFPA health hazard\nNFPA fire hazard\nNFPA reactivity\n: 08/13/2019\n: This Safety Data Sheet is offered pursuant to OSHA's Hazard Communication Standard, 29\nCFR, 1910.1200. Other government regulations must be reviewed for applicability to this\nproduct.\n: Extremely flammable gas\nContains gas under pressure; may explode if heated\nToxic if inhaled\nMay damage fertility or the unborn child\nCauses damage to organs through prolonged or repeated exposure\n: 3 - Materials that, under emergency conditions, can cause\nserious or permanent injury.\n: 4 - Materials that rapidly or completely vaporize at\natmospheric pressure and normal ambient temperature or\nthat are readily dispersed in air and burn readily.\n: 0 - Material that in themselves are normally stable, even\nunder fire conditions."}