{"GUID":"AkKsEQACHt+fl92lpuTIwg==","MATNR":"HZ-OXY","MAKTX":"Oxygen","WERKS":"0001","LGORT":"0001","LGOBE":"Lager 0001","SECTION_ID":1,"SECTION_HEADER":"Identification","SECTION_CONTENT":"GHS product identifier : Oxygen\nChemical name : oxygen\nOther means of\nidentification : Molecular oxygen; Oxygen molecule; Pure oxygen; O2; UN 1072; Dioxygen; Oxygen\nUSP, Aviator's Breathing Oxygen (ABO)\nProduct type : Gas.\nProduct use : Synthetic/Analytical chemistry.\nSynonym : Molecular oxygen; Oxygen molecule; Pure oxygen; O2; UN 1072; Dioxygen; Oxygen\nUSP, Aviator's Breathing Oxygen (ABO)\nSDS # : 001043\nSupplier's details : Airgas USA, LLC and its affiliates\n259 North Radnor-Chester Road\nSuite 100\nRadnor, PA 19087-5283\n1-610-687-5253\n24-hour telephone : 1-866-734-3438","REVISED_CONTENT":"Product ID:HZ-OXY,Product Description:Oxygen,Storage Location:0001,Storage Location Description:Lager 0001,Plant:0001,Section Id:1,Section Header:Identification,Section Content:GHS product identifier : Oxygen\nChemical name : oxygen\nOther means of\nidentification : Molecular oxygen; Oxygen molecule; Pure oxygen; O2; UN 1072; Dioxygen; Oxygen\nUSP, Aviator's Breathing Oxygen (ABO)\nProduct type : Gas.\nProduct use : Synthetic/Analytical chemistry.\nSynonym : Molecular oxygen; Oxygen molecule; Pure oxygen; O2; UN 1072; Dioxygen; Oxygen\nUSP, Aviator's Breathing Oxygen (ABO)\nSDS # : 001043\nSupplier's details : Airgas USA, LLC and its affiliates\n259 North Radnor-Chester Road\nSuite 100\nRadnor, PA 19087-5283\n1-610-687-5253\n24-hour telephone : 1-866-734-3438"}