{"GUID":"AkKsEQACHt+fl92lptyIwg==","MATNR":"HZ-MEO","MAKTX":"Methanol","WERKS":"0001","LGORT":"0001","LGOBE":"Lager 0001","SECTION_ID":15,"SECTION_HEADER":"Regulatory information","SECTION_CONTENT":"Labelling according to EC Directives.\nSymbol: F, T; Flammable. Toxic.\nR-phrases: 11-23/24/25-39/23/24/25; Highly flammable. Toxic by inhalation, in contact with skin and if swallowed. Toxic: danger of very\nseriouse irreversible effects through inhalation, in contact with skin and if swallowed.\nS-phrases: 7-16-36/37-45; Кеер container tightly closed. Keep away from sources of ignition - No smoking. In case of accident or if you\nfeel unwell, seek medical advice immediately (show the label where possible). Wear suitable protective clothing and gloves.\nEC label.","REVISED_CONTENT":"Product ID:HZ-MEO,Product Description:Methanol,Storage Location:0001,Storage Location Description:Lager 0001,Plant:0001,Section Id:15,Section Header:Regulatory information,Section Content:Labelling according to EC Directives.\nSymbol: F, T; Flammable. Toxic.\nR-phrases: 11-23/24/25-39/23/24/25; Highly flammable. Toxic by inhalation, in contact with skin and if swallowed. Toxic: danger of very\nseriouse irreversible effects through inhalation, in contact with skin and if swallowed.\nS-phrases: 7-16-36/37-45; Кеер container tightly closed. Keep away from sources of ignition - No smoking. In case of accident or if you\nfeel unwell, seek medical advice immediately (show the label where possible). Wear suitable protective clothing and gloves.\nEC label."}