{"GUID":"AkKsEQACHt+fl92loTMIwg==","MATNR":"HZ-BEN","MAKTX":"Benzene","WERKS":"0001","LGORT":"0001","LGOBE":"Lager 0001","SECTION_ID":1,"SECTION_HEADER":"Identification","SECTION_CONTENT":"• Product identifier\n• Trade name: Benzene\nPart number: RAB-041\nCAS Number:\n71-43-2\n• EC number:\n200-753-7\n• Index number:\n601-020-00-8\n· Application of the substance / the mixture Reagents and Standards for Analytical Chemical Laboratory Use\n• Details of the supplier of the safety data sheet\nManufacturer/Supplier:\nAgilent Technologies, Inc.\n5301 Stevens Creek Blvd.\nSanta Clara, CA 95051 USA\n• Information department:\nTelephone: 800-227-9770\ne-mail: pdl-msds_author@agilent.com\nEmergency telephone number: CHEMTREC®: 1-800-424-9300","REVISED_CONTENT":"Product ID:HZ-BEN,Product Description:Benzene,Storage Location:0001,Storage Location Description:Lager 0001,Plant:0001,Section Id:1,Section Header:Identification,Section Content:• Product identifier\n• Trade name: Benzene\nPart number: RAB-041\nCAS Number:\n71-43-2\n• EC number:\n200-753-7\n• Index number:\n601-020-00-8\n· Application of the substance / the mixture Reagents and Standards for Analytical Chemical Laboratory Use\n• Details of the supplier of the safety data sheet\nManufacturer/Supplier:\nAgilent Technologies, Inc.\n5301 Stevens Creek Blvd.\nSanta Clara, CA 95051 USA\n• Information department:\nTelephone: 800-227-9770\ne-mail: pdl-msds_author@agilent.com\nEmergency telephone number: CHEMTREC®: 1-800-424-9300"}