{"GUID":"AkKsEQACHt+fl92lrPKowg==","MATNR":"HZ-SOM","MAKTX":"Sodium metal","WERKS":"0001","LGORT":"0001","LGOBE":"Lager 0001","SECTION_ID":16,"SECTION_HEADER":"Other information","SECTION_CONTENT":"The information contained in this document is based on the state of our knowledge at the time of publication and is believed to be correct, but does not\npurport to be all inclusive and shall be used only as a guide. ESPI Metals makes no representation, warranty, or guarantee of any kind with respect to the\ninformation contained in this document or any use of the product based on this information. ESPI Metals shall not be held liable for any damages resulting\nfrom handling or from contact with the above product. Users should satisfy themselves that they have all current data relevant to their particular use.\nPrepared by: ESPI Metals\nRevised/Reviewed: July 2015","REVISED_CONTENT":"Product ID:HZ-SOM,Product Description:Sodium metal,Storage Location:0001,Storage Location Description:Lager 0001,Plant:0001,Section Id:16,Section Header:Other information,Section Content:The information contained in this document is based on the state of our knowledge at the time of publication and is believed to be correct, but does not\npurport to be all inclusive and shall be used only as a guide. ESPI Metals makes no representation, warranty, or guarantee of any kind with respect to the\ninformation contained in this document or any use of the product based on this information. ESPI Metals shall not be held liable for any damages resulting\nfrom handling or from contact with the above product. Users should satisfy themselves that they have all current data relevant to their particular use.\nPrepared by: ESPI Metals\nRevised/Reviewed: July 2015"}