{"GUID":"AkKsEQACHt+fl92lrOEowg==","MATNR":"HZ-PLU","MAKTX":"Plutonium nitrate","WERKS":"0001","LGORT":"0088","LGOBE":"Lager 0088 (WM)","SECTION_ID":4,"SECTION_HEADER":"First-aid measures","SECTION_CONTENT":"INHALATION: Remove from exposure area to a restricted area with fresh air as quickly as\npossible. If breathing has stopped, perform artificial respiration, preferably by administering\noxygen; alternatively, mouth-to-mouth resuscitation may be performed, however this may result\nin exposure to the person rendering first aid.\nSKIN CONTACT: Remove victim to a suitable area for decontamination as quickly as possible.\nRemove clothing and shoes immediately. Thoroughly wash the victim with soap and water,\npaying particular attention, to the head, fingernails and palms of the hands.\nEYE CONTACT: Remove victim to a restricted area for decontamination. Thoroughly wash eyes\nwith large amounts of water, occasionally lifting the upper and lower lids (approximately 15\nminutes).\nINGESTION: In the case of ingestion of radioactive substances, the mouth should be rinsed out\nimmediately after the accident, care being taken not to swallow the water used for this purpose.\nVomiting should be induced either mechanically, or with syrup of ipecac. Do not induce\nvomiting in an unconscious person. Lavage may be useful. Care should be taken to avoid\naspiration.","REVISED_CONTENT":"Product ID:HZ-PLU,Product Description:Plutonium nitrate,Storage Location:0088,Storage Location Description:Lager 0088 (WM),Plant:0001,Section Id:4,Section Header:First-aid measures,Section Content:INHALATION: Remove from exposure area to a restricted area with fresh air as quickly as\npossible. If breathing has stopped, perform artificial respiration, preferably by administering\noxygen; alternatively, mouth-to-mouth resuscitation may be performed, however this may result\nin exposure to the person rendering first aid.\nSKIN CONTACT: Remove victim to a suitable area for decontamination as quickly as possible.\nRemove clothing and shoes immediately. Thoroughly wash the victim with soap and water,\npaying particular attention, to the head, fingernails and palms of the hands.\nEYE CONTACT: Remove victim to a restricted area for decontamination. Thoroughly wash eyes\nwith large amounts of water, occasionally lifting the upper and lower lids (approximately 15\nminutes).\nINGESTION: In the case of ingestion of radioactive substances, the mouth should be rinsed out\nimmediately after the accident, care being taken not to swallow the water used for this purpose.\nVomiting should be induced either mechanically, or with syrup of ipecac. Do not induce\nvomiting in an unconscious person. Lavage may be useful. Care should be taken to avoid\naspiration."}