{"GUID":"AkKsEQACHt+fl92lrPfowg==","MATNR":"HZ-TNT","MAKTX":"TNT","WERKS":"0001","LGORT":"0004","LGOBE":"Explosives","SECTION_ID":10,"SECTION_HEADER":"Stability and reactivity","SECTION_CONTENT":"• Reactivity No further relevant information available.\nChemical stability\n· Thermal decomposition / conditions to be avoided: No decomposition if used according to specifications.\nPossibility of hazardous reactions No dangerous reactions known.\nConditions to avoid No further relevant information available.\nIncompatible materials: No further relevant information available.\nHazardous decomposition products: No dangerous decomposition products known.","REVISED_CONTENT":"Product ID:HZ-TNT,Product Description:TNT,Storage Location:0004,Storage Location Description:Explosives,Plant:0001,Section Id:10,Section Header:Stability and reactivity,Section Content:• Reactivity No further relevant information available.\nChemical stability\n· Thermal decomposition / conditions to be avoided: No decomposition if used according to specifications.\nPossibility of hazardous reactions No dangerous reactions known.\nConditions to avoid No further relevant information available.\nIncompatible materials: No further relevant information available.\nHazardous decomposition products: No dangerous decomposition products known."}