{"GUID":"AkKsEQACHt+fl92lpteIwg==","MATNR":"HZ-MAG","MAKTX":"Magnesium","WERKS":"0001","LGORT":"0001","LGOBE":"Lager 0001","SECTION_ID":7,"SECTION_HEADER":"Handling and storage","SECTION_CONTENT":"Avoid contact with skin and eyes. Do not breathe dust. Use explosion-proof equipment. Use\nonly non-sparking tools. Wash hands before breaks and immediately after handling the\nproduct. Ensure adequate ventilation. Wear personal protective equipment. Avoid dust\nformation.\nKeep in a dry, cool and well-ventilated place. Keep container tightly closed. Keep away\nfrom heat and sources of ignition. Never allow product to get in contact with water during\nstorage. Store under an inert atmosphere.","REVISED_CONTENT":"Product ID:HZ-MAG,Product Description:Magnesium,Storage Location:0001,Storage Location Description:Lager 0001,Plant:0001,Section Id:7,Section Header:Handling and storage,Section Content:Avoid contact with skin and eyes. Do not breathe dust. Use explosion-proof equipment. Use\nonly non-sparking tools. Wash hands before breaks and immediately after handling the\nproduct. Ensure adequate ventilation. Wear personal protective equipment. Avoid dust\nformation.\nKeep in a dry, cool and well-ventilated place. Keep container tightly closed. Keep away\nfrom heat and sources of ignition. Never allow product to get in contact with water during\nstorage. Store under an inert atmosphere."}