{"GUID":"AkKsEQACHt+fl92lrOeowg==","MATNR":"HZ-PRO","MAKTX":"Propane","WERKS":"0001","LGORT":"0001","LGOBE":"Lager 0001","SECTION_ID":8,"SECTION_HEADER":"Exposure controls / personal protection","SECTION_CONTENT":"Simple Asphyxiant\n1800 mg/m続\n1000 ppm\n2100 ppm (10% LEL)\n1800 mg/m続\n1000 ppm\nEnsure exposure is below occupational exposure limits (where available). Provide adequate\ngeneral and local exhaust ventilation. Systems under pressure should be regularly checked for\nleakages. Oxygen detectors should be used when asphyxiating gases may be released.\nConsider the use of a work permit system e.g. for maintenance activities.\nRefer to local regulations for restriction of emissions to the atmosphere. See section 13 for\nspecific methods for waste gas treatment.\nWear working gloves when handling gas containers. 29 CFR 1910.138: Hand protection\nWear safety glasses with side shields. 29 CFR 1910.133: Eye and Face Protection\nWear suitable protective clothing, e.g. lab coats, coveralls or flame resistant clothing.\nNone necessary during normal and routine operations. See Sections 5 & 6.\nNone necessary during normal and routine operations.\nWear safety shoes while handling containers. 29 CFR 1910.136: Foot Protection.","REVISED_CONTENT":"Product ID:HZ-PRO,Product Description:Propane,Storage Location:0001,Storage Location Description:Lager 0001,Plant:0001,Section Id:8,Section Header:Exposure controls / personal protection,Section Content:Simple Asphyxiant\n1800 mg/m続\n1000 ppm\n2100 ppm (10% LEL)\n1800 mg/m続\n1000 ppm\nEnsure exposure is below occupational exposure limits (where available). Provide adequate\ngeneral and local exhaust ventilation. Systems under pressure should be regularly checked for\nleakages. Oxygen detectors should be used when asphyxiating gases may be released.\nConsider the use of a work permit system e.g. for maintenance activities.\nRefer to local regulations for restriction of emissions to the atmosphere. See section 13 for\nspecific methods for waste gas treatment.\nWear working gloves when handling gas containers. 29 CFR 1910.138: Hand protection\nWear safety glasses with side shields. 29 CFR 1910.133: Eye and Face Protection\nWear suitable protective clothing, e.g. lab coats, coveralls or flame resistant clothing.\nNone necessary during normal and routine operations. See Sections 5 & 6.\nNone necessary during normal and routine operations.\nWear safety shoes while handling containers. 29 CFR 1910.136: Foot Protection."}