{"GUID":"AkKsEQACHt+fl92lrPDowg==","MATNR":"HZ-SOM","MAKTX":"Sodium metal","WERKS":"0001","LGORT":"0001","LGOBE":"Lager 0001","SECTION_ID":2,"SECTION_HEADER":"Hazard identification","SECTION_CONTENT":"GHS Classification (29 CFR 1910.1200): Substances and mixtures which, in contact with water, emit flammable gases, category 1, Skin\ncorrosion/irritation, category 1B, Eye damage/irritation, category 1.\nGHS Label Elements :\nSignal Word: Danger\nHazard Statements: H260 In contact with water releases flammable gases which may ignite spontaneously, H314 Causes severe skin burns and eye\ndamage.\nPrecautionary Statements: P223 Keep away from any possible contact with water, because of violent reaction and possible flash fire, P231+P232 Handle\nunder inert gas. Protect from moisture, P260 Do not breath dust or fume, P264 Wash skin thoroughly after handling, P280 Wear protective gloves/protective\nclothing/eye protection/face protection, P301+P330+P331 IF SWALLOWED: rinse mouth. Do NOT induce vomiting, P303+P361+P353 IF ON SKIN (or hair):\nRemove/Take off immediately all contaminated clothing. Rinse SKIN with water/shower, P335+P334 Brush off loose particles from skin and immerse in cool\nwater/wrap in wet bandages, P304+P340 IF INHALED: Remove victim to fresh air and keep at rest in a position comfortable for breathing, P305+P351+P338 IF\nIN EYES: rinse cautiously with water for several minutes. Remove contact lenses, if present and easy to do. Continue rinsing, P310 Immediately call a POISON\nCENTER or doctor/physician, P363 Wash contaminated clothing before reuse, P370+P378 In case of fire: Use class D metal extinguishing agent for extinction,\ndo not use water, P402+P404 Store in a dry place. Store in a closed container, P405 Store locked up, P501 Dispose of contents/container in accordance with\nlocal, state or federal regulations.","REVISED_CONTENT":"Product ID:HZ-SOM,Product Description:Sodium metal,Storage Location:0001,Storage Location Description:Lager 0001,Plant:0001,Section Id:2,Section Header:Hazard identification,Section Content:GHS Classification (29 CFR 1910.1200): Substances and mixtures which, in contact with water, emit flammable gases, category 1, Skin\ncorrosion/irritation, category 1B, Eye damage/irritation, category 1.\nGHS Label Elements :\nSignal Word: Danger\nHazard Statements: H260 In contact with water releases flammable gases which may ignite spontaneously, H314 Causes severe skin burns and eye\ndamage.\nPrecautionary Statements: P223 Keep away from any possible contact with water, because of violent reaction and possible flash fire, P231+P232 Handle\nunder inert gas. Protect from moisture, P260 Do not breath dust or fume, P264 Wash skin thoroughly after handling, P280 Wear protective gloves/protective\nclothing/eye protection/face protection, P301+P330+P331 IF SWALLOWED: rinse mouth. Do NOT induce vomiting, P303+P361+P353 IF ON SKIN (or hair):\nRemove/Take off immediately all contaminated clothing. Rinse SKIN with water/shower, P335+P334 Brush off loose particles from skin and immerse in cool\nwater/wrap in wet bandages, P304+P340 IF INHALED: Remove victim to fresh air and keep at rest in a position comfortable for breathing, P305+P351+P338 IF\nIN EYES: rinse cautiously with water for several minutes. Remove contact lenses, if present and easy to do. Continue rinsing, P310 Immediately call a POISON\nCENTER or doctor/physician, P363 Wash contaminated clothing before reuse, P370+P378 In case of fire: Use class D metal extinguishing agent for extinction,\ndo not use water, P402+P404 Store in a dry place. Store in a closed container, P405 Store locked up, P501 Dispose of contents/container in accordance with\nlocal, state or federal regulations."}