{"GUID":"AkKsEQACHt+fl92lo1Xowg==","MATNR":"HZ-CHL","MAKTX":"Chlorine","WERKS":"0001","LGORT":"0001","LGOBE":"Lager 0001","SECTION_ID":6,"SECTION_HEADER":"Accidental release measures","SECTION_CONTENT":"6.1. Personal precautions, protective equipment and emergency procedures\nGeneral measures\n6.1.1. For non-emergency personnel\nProtective equipment\nEmergency procedures\n6.1.2. For emergency responders\nProtective equipment\nEmergency procedures\n6.2. Environmental precautions\n6.3. Methods and material for containment and cleaning up\nFor containment\nMethods for cleaning up\n: Ensure adequate ventilation.\n: Wear protective equipment consistent with the site emergency plan.\n: Evacuate personnel to a safe area. Close doors and windows of adjacent premises. Keep\ncontainers closed. Mark the danger area. Seal off low-lying areas. Keep upwind. Evacuate\nunnecessary personnel.\n: Standard protective clothing and equipment (e.g, Self Contained Breathing Apparatus) for fire\nfighters. Equip cleanup crew with proper protection.\n: Evacuate and limit access. Ventilate area. Stop leak if safe to do so.\n: Try to stop release if without risk. Prevent entry to sewers and public waters. Notify authorities if liquid enters sewers or public waters.\n: Try to stop release if without risk.\n: Dispose of contents/container in accordance with local/regional/national/international regulations.\nStore away from other materials.\nMethods and material for containment and cleaning: Hose down area with water. Wash contaminated equipment or sites of leaks with copious\nup\n6.4. Reference to other sections\nSee also Sections 8 and 13.\nquantities of water.","REVISED_CONTENT":"Product ID:HZ-CHL,Product Description:Chlorine,Storage Location:0001,Storage Location Description:Lager 0001,Plant:0001,Section Id:6,Section Header:Accidental release measures,Section Content:6.1. Personal precautions, protective equipment and emergency procedures\nGeneral measures\n6.1.1. For non-emergency personnel\nProtective equipment\nEmergency procedures\n6.1.2. For emergency responders\nProtective equipment\nEmergency procedures\n6.2. Environmental precautions\n6.3. Methods and material for containment and cleaning up\nFor containment\nMethods for cleaning up\n: Ensure adequate ventilation.\n: Wear protective equipment consistent with the site emergency plan.\n: Evacuate personnel to a safe area. Close doors and windows of adjacent premises. Keep\ncontainers closed. Mark the danger area. Seal off low-lying areas. Keep upwind. Evacuate\nunnecessary personnel.\n: Standard protective clothing and equipment (e.g, Self Contained Breathing Apparatus) for fire\nfighters. Equip cleanup crew with proper protection.\n: Evacuate and limit access. Ventilate area. Stop leak if safe to do so.\n: Try to stop release if without risk. Prevent entry to sewers and public waters. Notify authorities if liquid enters sewers or public waters.\n: Try to stop release if without risk.\n: Dispose of contents/container in accordance with local/regional/national/international regulations.\nStore away from other materials.\nMethods and material for containment and cleaning: Hose down area with water. Wash contaminated equipment or sites of leaks with copious\nup\n6.4. Reference to other sections\nSee also Sections 8 and 13.\nquantities of water."}