{"GUID":"AkKsEQACHt+fl92lrPaIwg==","MATNR":"HZ-TNT","MAKTX":"TNT","WERKS":"0001","LGORT":"0002","LGOBE":"Cold Storage","SECTION_ID":15,"SECTION_HEADER":"Regulatory information","SECTION_CONTENT":"• Safety, health and environmental regulations/legislation specific for the substance or mixture\nSara\nSection 313 (Specific toxic chemical listings):\n67-56-1 methanol\n75-05-8 acetonitrile\nTSCA (Toxic Substances Control Act):\nAll ingredients are listed.\n• Proposition 65\nChemicals known to cause cancer:\n118-96-7 2,4,6-trinitrotoluene\nChemicals known to cause reproductive toxicity for females:\nNone of the ingredients is listed.\nChemicals known to cause reproductive toxicity for males:\nNone of the ingredients is listed.\nChemicals known to cause developmental toxicity:\n67-56-1 methanol\nCarcinogenic categories\nEPA (Environmental Protection Agency)\n75-05-8 acetonitrile\n118-96-7 2,4,6-trinitrotoluene\nTLV (Threshold Limit Value established by ACGIH)\n75-05-8 acetonitrile\nNIOSH-Ca (National Institute for Occupational Safety and Health)\nNone of the ingredients is listed.\n• GHS label elements The product is classified and labeled according to the Globally Harmonized System (GHS).\n• Hazard pictograms\nGHS02 GHS06 GHS08\n• Signal word Danger","REVISED_CONTENT":"Product ID:HZ-TNT,Product Description:TNT,Storage Location:0002,Storage Location Description:Cold Storage,Plant:0001,Section Id:15,Section Header:Regulatory information,Section Content:• Safety, health and environmental regulations/legislation specific for the substance or mixture\nSara\nSection 313 (Specific toxic chemical listings):\n67-56-1 methanol\n75-05-8 acetonitrile\nTSCA (Toxic Substances Control Act):\nAll ingredients are listed.\n• Proposition 65\nChemicals known to cause cancer:\n118-96-7 2,4,6-trinitrotoluene\nChemicals known to cause reproductive toxicity for females:\nNone of the ingredients is listed.\nChemicals known to cause reproductive toxicity for males:\nNone of the ingredients is listed.\nChemicals known to cause developmental toxicity:\n67-56-1 methanol\nCarcinogenic categories\nEPA (Environmental Protection Agency)\n75-05-8 acetonitrile\n118-96-7 2,4,6-trinitrotoluene\nTLV (Threshold Limit Value established by ACGIH)\n75-05-8 acetonitrile\nNIOSH-Ca (National Institute for Occupational Safety and Health)\nNone of the ingredients is listed.\n• GHS label elements The product is classified and labeled according to the Globally Harmonized System (GHS).\n• Hazard pictograms\nGHS02 GHS06 GHS08\n• Signal word Danger"}