{"GUID":"AkKsEQACHt+fl92lrOHowg==","MATNR":"HZ-PLU","MAKTX":"Plutonium nitrate","WERKS":"0001","LGORT":"0088","LGOBE":"Lager 0088 (WM)","SECTION_ID":10,"SECTION_HEADER":"Stability and reactivity","SECTION_CONTENT":"REACTIVITY\nCONDITIONS TO AVOID - Radiation hazard, do not allow material to spread or contaminate\nwater sources.\nCare must be taken in the handling of large quantities of plutonium compounds to avoid\nunintentional formation of a critical mass . Plutonium in liquid solutions is more apt to become\ncritical than plutonium contained in solid forms.\nINCOMPATIBILITIES:\nNo specific incompatibilities could be found. Nitrates are powerful oxidizing agents that may cause\nviolent reactions with reducing materials.\nHAZARDOUS DECOMPOSITION:\nWhen heated to decomposition it emits toxic fumes of NOx.\nPOLYMERIZATION:\nHazardous polymerization has not been reported to occur under normal temperature and\npressure.","REVISED_CONTENT":"Product ID:HZ-PLU,Product Description:Plutonium nitrate,Storage Location:0088,Storage Location Description:Lager 0088 (WM),Plant:0001,Section Id:10,Section Header:Stability and reactivity,Section Content:REACTIVITY\nCONDITIONS TO AVOID - Radiation hazard, do not allow material to spread or contaminate\nwater sources.\nCare must be taken in the handling of large quantities of plutonium compounds to avoid\nunintentional formation of a critical mass . Plutonium in liquid solutions is more apt to become\ncritical than plutonium contained in solid forms.\nINCOMPATIBILITIES:\nNo specific incompatibilities could be found. Nitrates are powerful oxidizing agents that may cause\nviolent reactions with reducing materials.\nHAZARDOUS DECOMPOSITION:\nWhen heated to decomposition it emits toxic fumes of NOx.\nPOLYMERIZATION:\nHazardous polymerization has not been reported to occur under normal temperature and\npressure."}