{"GUID":"AkKsEQACHt+fl92loTBowg==","MATNR":"HZ-ACE","MAKTX":"Acetone","WERKS":"0001","LGORT":"0001","LGOBE":"Lager 0001","SECTION_ID":12,"SECTION_HEADER":"Ecological information","SECTION_CONTENT":"Ecotoxicity\nComponent\nAcetone\nFreshwater Algae\nNOEC = 430 mg/l (algae; 96\nh)\nFreshwater Fish\nOncorhynchus mykiss: LC50 =\n5540 mg/l 96h\nAlburnus alburnus: LC50 =\n11000 mg/l 96h\nLeuciscus idus: LC50 =\n11300 mg/L/48h\nSalmo gairdneri: LC50 =\n6100 mg/L/24h\nMicrotox\nEC50 = 14500 mg/L/15 min\nWater Flea\nEC50 = 8800 mg/L/48h\nEC50 = 12700 mg/L/48h\nEC50 = 12600 mg/L/48h\nPersistence and Degradability Persistence is unlikely based on information available.\nBioaccumulation/ Accumulation No information available.\nMobility Will likely be mobile in the environment due to its volatility.\nComponent\nlog Pow\nAcetone\n-0.24","REVISED_CONTENT":"Product ID:HZ-ACE,Product Description:Acetone,Storage Location:0001,Storage Location Description:Lager 0001,Plant:0001,Section Id:12,Section Header:Ecological information,Section Content:Ecotoxicity\nComponent\nAcetone\nFreshwater Algae\nNOEC = 430 mg/l (algae; 96\nh)\nFreshwater Fish\nOncorhynchus mykiss: LC50 =\n5540 mg/l 96h\nAlburnus alburnus: LC50 =\n11000 mg/l 96h\nLeuciscus idus: LC50 =\n11300 mg/L/48h\nSalmo gairdneri: LC50 =\n6100 mg/L/24h\nMicrotox\nEC50 = 14500 mg/L/15 min\nWater Flea\nEC50 = 8800 mg/L/48h\nEC50 = 12700 mg/L/48h\nEC50 = 12600 mg/L/48h\nPersistence and Degradability Persistence is unlikely based on information available.\nBioaccumulation/ Accumulation No information available.\nMobility Will likely be mobile in the environment due to its volatility.\nComponent\nlog Pow\nAcetone\n-0.24"}