{"GUID":"AkKsEQACHt+fl92lrPuowg==","MATNR":"HZ-TOL","MAKTX":"Toluene","WERKS":"0001","LGORT":"0002","LGOBE":"Cold Storage","SECTION_ID":8,"SECTION_HEADER":"Exposure controls / personal protection","SECTION_CONTENT":"Exposure Guidelines\nComponent\nToluene\nACGIH TLV\nTWA: 20 ppm\nOSHA PEL\n(Vacated) TWA: 100 ppm\n(Vacated) TWA: 375 mg/m³\nCeiling: 300 ppm\n(Vacated) STEL: 150 ppm\n(Vacated) STEL: 560 mg/m³\nNIOSH IDLH\nIDLH: 500 ppm\nTWA: 100 ppm\nTWA: 375 mg/m³\nSTEL: 150 ppm\nSTEL: 560 mg/m³\nMexico OEL (TWA)\nTWA: 20 ppm\nLegend\nACGIH - American Conference of Governmental Industrial Hygienists\nOSHA - Occupational Safety and Health Administration\nNIOSH IDLH: NIOSH - National Institute for Occupational Safety and Health\nEngineering Measures\nEnsure that eyewash stations and safety showers are close to the workstation location. Use\nexplosion-proof electrical/ventilating/lighting equipment. Ensure adequate ventilation,\nespecially in confined areas.\nPersonal Protective Equipment\nEye/face Protection\nWear appropriate protective eyeglasses or chemical safety goggles as described by\nOSHA's eye and face protection regulations in 29 CFR 1910.133 or European Standard\nEN166.\nSkin and body protection\nWear appropriate protective gloves and clothing to prevent skin exposure.\nRespiratory Protection\nFollow the OSHA respirator regulations found in 29 CFR 1910.134 or European Standard\nEN 149. Use a NIOSH/MSHA or European Standard EN 149 approved respirator if\nexposure limits are exceeded or if irritation or other symptoms are experienced.\nHygiene Measures\nHandle in accordance with good industrial hygiene and safety practice.","REVISED_CONTENT":"Product ID:HZ-TOL,Product Description:Toluene,Storage Location:0002,Storage Location Description:Cold Storage,Plant:0001,Section Id:8,Section Header:Exposure controls / personal protection,Section Content:Exposure Guidelines\nComponent\nToluene\nACGIH TLV\nTWA: 20 ppm\nOSHA PEL\n(Vacated) TWA: 100 ppm\n(Vacated) TWA: 375 mg/m³\nCeiling: 300 ppm\n(Vacated) STEL: 150 ppm\n(Vacated) STEL: 560 mg/m³\nNIOSH IDLH\nIDLH: 500 ppm\nTWA: 100 ppm\nTWA: 375 mg/m³\nSTEL: 150 ppm\nSTEL: 560 mg/m³\nMexico OEL (TWA)\nTWA: 20 ppm\nLegend\nACGIH - American Conference of Governmental Industrial Hygienists\nOSHA - Occupational Safety and Health Administration\nNIOSH IDLH: NIOSH - National Institute for Occupational Safety and Health\nEngineering Measures\nEnsure that eyewash stations and safety showers are close to the workstation location. Use\nexplosion-proof electrical/ventilating/lighting equipment. Ensure adequate ventilation,\nespecially in confined areas.\nPersonal Protective Equipment\nEye/face Protection\nWear appropriate protective eyeglasses or chemical safety goggles as described by\nOSHA's eye and face protection regulations in 29 CFR 1910.133 or European Standard\nEN166.\nSkin and body protection\nWear appropriate protective gloves and clothing to prevent skin exposure.\nRespiratory Protection\nFollow the OSHA respirator regulations found in 29 CFR 1910.134 or European Standard\nEN 149. Use a NIOSH/MSHA or European Standard EN 149 approved respirator if\nexposure limits are exceeded or if irritation or other symptoms are experienced.\nHygiene Measures\nHandle in accordance with good industrial hygiene and safety practice."}