{"GUID":"AkKsEQACHt+fl92lrOPowg==","MATNR":"HZ-POH","MAKTX":"Potassium hydroxide","WERKS":"0001","LGORT":"0003","LGOBE":"Corrosive Items","SECTION_ID":10,"SECTION_HEADER":"Stability and reactivity","SECTION_CONTENT":"Reactivity:\nReacts violently with strong acids.\nChemical Stability:\nMaterial is stable under normal conditions.\nPossibility of hazardous\nreactions:\nHazardous polymerization does not occur. The substance is hygroscopic\nand will absorb water by contact with the moisture in the air.\nConditions to avoid:\nAvoid contact with oxidizing agents. Reacts violently with strong acids.\nHeat. Moisture.\nIncompatible Materials:\nMoisture. Oxidizing agents. Acids. Maleic Anhydride Halogens.\nNitromethane. Contact with metals may evolve flammable hydrogen gas.\nHazardous Decomposition\nProducts:\nOxides of potassium.","REVISED_CONTENT":"Product ID:HZ-POH,Product Description:Potassium hydroxide,Storage Location:0003,Storage Location Description:Corrosive Items,Plant:0001,Section Id:10,Section Header:Stability and reactivity,Section Content:Reactivity:\nReacts violently with strong acids.\nChemical Stability:\nMaterial is stable under normal conditions.\nPossibility of hazardous\nreactions:\nHazardous polymerization does not occur. The substance is hygroscopic\nand will absorb water by contact with the moisture in the air.\nConditions to avoid:\nAvoid contact with oxidizing agents. Reacts violently with strong acids.\nHeat. Moisture.\nIncompatible Materials:\nMoisture. Oxidizing agents. Acids. Maleic Anhydride Halogens.\nNitromethane. Contact with metals may evolve flammable hydrogen gas.\nHazardous Decomposition\nProducts:\nOxides of potassium."}