{"GUID":"AkKsEQACHt+fl92lrOYowg==","MATNR":"HZ-PPM","MAKTX":"Potassium permanganate","WERKS":"0001","LGORT":"0088","LGOBE":"Lager 0088 (WM)","SECTION_ID":12,"SECTION_HEADER":"Ecological information","SECTION_CONTENT":"The product contains following substances which are hazardous for the environment. Very toxic to aquatic organisms, may cause\nlong-term adverse effects in the aquatic environment. May cause long-term adverse effects in the environment. Do not allow\nmaterial to contaminate ground water system.\nComponent\nPotassium permanganate\nFreshwater Algae\n0.41 mg/l/72h EC50\nFreshwater Fish\n2.97-3.11 mg/L LC50 96 h\n3.16-3.77 mg/L LC50 96 h\n3.3-3.93 mg/L LC50 96 h\n2.3 mg/L LC50 96 h\n0.769-1.27 mg/L LC50 96 h\n1.08-1.38 mg/L LC50 96 h\n1.8-5.6 mg/L LC50 96 h\n2.7 mg/L LC50 96 h\nMay persist based on information available.\nNo information available.\nWill likely be mobile in the environment due to its water solubility.\nComponent\nPotassium permanganate\nMicrotox\nNot listed\nWater Flea\nNot listed\nlog Pow\n-1.73","REVISED_CONTENT":"Product ID:HZ-PPM,Product Description:Potassium permanganate,Storage Location:0088,Storage Location Description:Lager 0088 (WM),Plant:0001,Section Id:12,Section Header:Ecological information,Section Content:The product contains following substances which are hazardous for the environment. Very toxic to aquatic organisms, may cause\nlong-term adverse effects in the aquatic environment. May cause long-term adverse effects in the environment. Do not allow\nmaterial to contaminate ground water system.\nComponent\nPotassium permanganate\nFreshwater Algae\n0.41 mg/l/72h EC50\nFreshwater Fish\n2.97-3.11 mg/L LC50 96 h\n3.16-3.77 mg/L LC50 96 h\n3.3-3.93 mg/L LC50 96 h\n2.3 mg/L LC50 96 h\n0.769-1.27 mg/L LC50 96 h\n1.08-1.38 mg/L LC50 96 h\n1.8-5.6 mg/L LC50 96 h\n2.7 mg/L LC50 96 h\nMay persist based on information available.\nNo information available.\nWill likely be mobile in the environment due to its water solubility.\nComponent\nPotassium permanganate\nMicrotox\nNot listed\nWater Flea\nNot listed\nlog Pow\n-1.73"}