{"GUID":"AkKsEQACHt+fl92loTWIwg==","MATNR":"HZ-BUT","MAKTX":"Butane","WERKS":"0001","LGORT":"0001","LGOBE":"Lager 0001","SECTION_ID":5,"SECTION_HEADER":"Fire-fighting measures","SECTION_CONTENT":"SECTION 5: Firefighting measures\n5.1 Extinguishing media\nSuitable extinguishing media\nWater Foam Carbon dioxide (CO2) Dry powder\nUnsuitable extinguishing media\nFor this substance/mixture no limitations of extinguishing agents are given.\n5.2 Special hazards arising from the substance or mixture\nCarbon oxides\nCombustible.\nPay attention to flashback.\nDevelopment of hazardous combustion gases or vapours possible in the event of fire.\n5.3 Advice for firefighters\nIn the event of fire, wear self-contained breathing apparatus.\n5.4 Further information\nRemove container from danger zone and cool with water.","REVISED_CONTENT":"Product ID:HZ-BUT,Product Description:Butane,Storage Location:0001,Storage Location Description:Lager 0001,Plant:0001,Section Id:5,Section Header:Fire-fighting measures,Section Content:SECTION 5: Firefighting measures\n5.1 Extinguishing media\nSuitable extinguishing media\nWater Foam Carbon dioxide (CO2) Dry powder\nUnsuitable extinguishing media\nFor this substance/mixture no limitations of extinguishing agents are given.\n5.2 Special hazards arising from the substance or mixture\nCarbon oxides\nCombustible.\nPay attention to flashback.\nDevelopment of hazardous combustion gases or vapours possible in the event of fire.\n5.3 Advice for firefighters\nIn the event of fire, wear self-contained breathing apparatus.\n5.4 Further information\nRemove container from danger zone and cool with water."}