{"GUID":"AkKsEQACHt+fl92lo1Powg==","MATNR":"HZ-CES","MAKTX":"Cesium","WERKS":"0001","LGORT":"0088","LGOBE":"Lager 0088 (WM)","SECTION_ID":6,"SECTION_HEADER":"Accidental release measures","SECTION_CONTENT":"SECTION 6: Accidental release measures\n6.1 Personal precautions, protective equipment and emergency procedures\nUse personal protective equipment. Avoid dust formation. Avoid breathing vapors, mist or\ngas. Ensure adequate ventilation. Evacuate personnel to safe areas. Avoid breathing dust.\nFor personal protection see section 8.\n6.2 Environmental precautions\nPrevent further leakage or spillage if safe to do so. Do not let product enter drains.","REVISED_CONTENT":"Product ID:HZ-CES,Product Description:Cesium,Storage Location:0088,Storage Location Description:Lager 0088 (WM),Plant:0001,Section Id:6,Section Header:Accidental release measures,Section Content:SECTION 6: Accidental release measures\n6.1 Personal precautions, protective equipment and emergency procedures\nUse personal protective equipment. Avoid dust formation. Avoid breathing vapors, mist or\ngas. Ensure adequate ventilation. Evacuate personnel to safe areas. Avoid breathing dust.\nFor personal protection see section 8.\n6.2 Environmental precautions\nPrevent further leakage or spillage if safe to do so. Do not let product enter drains."}