{"GUID":"AkKsEQACHt+fl92lptSIwg==","MATNR":"HZ-LEA","MAKTX":"Lead","WERKS":"0001","LGORT":"0088","LGOBE":"Lager 0088 (WM)","SECTION_ID":15,"SECTION_HEADER":"Regulatory information","SECTION_CONTENT":"International Inventories\nComponent\nLead\nLegend:\nX - Listed\nE - Indicates a substance that is the subject of a Section 5(e) Consent order under TSCA.\nF - Indicates a substance that is the subject of a Section 5(f) Rule under TSCA.\nN - Indicates a polymeric substance containing no free-radical initiator in its inventory name but is considered to cover the designated\npolymer made with any free-radical initiator regardless of the amount used.\nP - Indicates a commenced PMN substance\nR - Indicates a substance that is the subject of a Section 6 risk management rule under TSCA.\nS - Indicates a substance that is identified in a proposed or final Significant New Use Rule\nT - Indicates a substance that is the subject of a Section 4 test rule under TSCA.\nXU - Indicates a substance exempt from reporting under the Inventory Update Rule, i.e. Partial Updating of the TSCA Inventory Data Base\nProduction and Site Reports (40 CFR 710(Β).\nY1 - Indicates an exempt polymer that has a number-average molecular weight of 1,000 or greater.\nY2 - Indicates an exempt polymer that is a polyester and is made only from reactants included in a specified list of low concern reactants\nthat comprises one of the eligibility criteria for the exemption rule.\nU.S. Federal Regulations\nTSCA 12(b)\nNot applicable\nSARA 313\nComponent\nLead\nSARA 311/312 Hazardous Categorization\nAcute Health Hazard\nChronic Health Hazard\nFire Hazard\nSudden Release of Pressure Hazard\nReactive Hazard\nClean Water Act\nComponent\nLead\nClean Air Act\nComponent\nLead\nTSCA\nX\nDSL NDSL EINECS ELINCS NLP PICCS ENCS AICS IECSC KECL\nX\n231-100-4\nX\nX\nX\nX\nX\nX\nX\nCAS-No\nWeight %\n7439-92-1\n>95\nSARA 313 - Threshold\nValues %\n0.1\nYes\nYes\nNo\nNo\nNo\nCWA - Hazardous\nSubstances\nX\nNot applicable\nHAPS Data\nX\nCWA - Reportable\nQuantities\nX\nCWA - Toxic Pollutants\nX\nCWA - Priority Pollutants\nX\nClass 1 Ozone Depletors\nClass 2 Ozone Depletors","REVISED_CONTENT":"Product ID:HZ-LEA,Product Description:Lead,Storage Location:0088,Storage Location Description:Lager 0088 (WM),Plant:0001,Section Id:15,Section Header:Regulatory information,Section Content:International Inventories\nComponent\nLead\nLegend:\nX - Listed\nE - Indicates a substance that is the subject of a Section 5(e) Consent order under TSCA.\nF - Indicates a substance that is the subject of a Section 5(f) Rule under TSCA.\nN - Indicates a polymeric substance containing no free-radical initiator in its inventory name but is considered to cover the designated\npolymer made with any free-radical initiator regardless of the amount used.\nP - Indicates a commenced PMN substance\nR - Indicates a substance that is the subject of a Section 6 risk management rule under TSCA.\nS - Indicates a substance that is identified in a proposed or final Significant New Use Rule\nT - Indicates a substance that is the subject of a Section 4 test rule under TSCA.\nXU - Indicates a substance exempt from reporting under the Inventory Update Rule, i.e. Partial Updating of the TSCA Inventory Data Base\nProduction and Site Reports (40 CFR 710(Β).\nY1 - Indicates an exempt polymer that has a number-average molecular weight of 1,000 or greater.\nY2 - Indicates an exempt polymer that is a polyester and is made only from reactants included in a specified list of low concern reactants\nthat comprises one of the eligibility criteria for the exemption rule.\nU.S. Federal Regulations\nTSCA 12(b)\nNot applicable\nSARA 313\nComponent\nLead\nSARA 311/312 Hazardous Categorization\nAcute Health Hazard\nChronic Health Hazard\nFire Hazard\nSudden Release of Pressure Hazard\nReactive Hazard\nClean Water Act\nComponent\nLead\nClean Air Act\nComponent\nLead\nTSCA\nX\nDSL NDSL EINECS ELINCS NLP PICCS ENCS AICS IECSC KECL\nX\n231-100-4\nX\nX\nX\nX\nX\nX\nX\nCAS-No\nWeight %\n7439-92-1\n>95\nSARA 313 - Threshold\nValues %\n0.1\nYes\nYes\nNo\nNo\nNo\nCWA - Hazardous\nSubstances\nX\nNot applicable\nHAPS Data\nX\nCWA - Reportable\nQuantities\nX\nCWA - Toxic Pollutants\nX\nCWA - Priority Pollutants\nX\nClass 1 Ozone Depletors\nClass 2 Ozone Depletors"}