{"GUID":"AkKsEQACHt+fl92lo1wIwg==","MATNR":"HZ-DYN","MAKTX":"Dynamite Gray","WERKS":"0001","LGORT":"0004","LGOBE":"Explosives","SECTION_ID":7,"SECTION_HEADER":"Handling and storage","SECTION_CONTENT":"Precautions for safe handling\nProtective measures\nAdvice on general occupational\nhygiene\n:\nPut on appropriate personal protective equipment (see Section 8).\nEating, drinking and smoking should be prohibited in areas where this\nmaterial is handled, stored and processed. Workers should wash hands\nand face before eating, drinking and smoking. Remove contaminated\nclothing and protective equipment before entering eating areas. See\nalso Section 8 for additional information on hygiene measures.\nConditions for safe storage,\nincluding any incompatibilities\n:\nStore in accordance with local regulations. Store in original container\nprotected from direct sunlight in a dry, cool and well-ventilated area,\naway from incompatible materials (see Section 10) and food and\ndrink. Keep container tightly closed and sealed until ready for use.\nContainers that have been opened must be carefully resealed and kept\nupright to prevent leakage. Do not store in unlabeled containers. Use\nappropriate containment to avoid environmental contamination.","REVISED_CONTENT":"Product ID:HZ-DYN,Product Description:Dynamite Gray,Storage Location:0004,Storage Location Description:Explosives,Plant:0001,Section Id:7,Section Header:Handling and storage,Section Content:Precautions for safe handling\nProtective measures\nAdvice on general occupational\nhygiene\n:\nPut on appropriate personal protective equipment (see Section 8).\nEating, drinking and smoking should be prohibited in areas where this\nmaterial is handled, stored and processed. Workers should wash hands\nand face before eating, drinking and smoking. Remove contaminated\nclothing and protective equipment before entering eating areas. See\nalso Section 8 for additional information on hygiene measures.\nConditions for safe storage,\nincluding any incompatibilities\n:\nStore in accordance with local regulations. Store in original container\nprotected from direct sunlight in a dry, cool and well-ventilated area,\naway from incompatible materials (see Section 10) and food and\ndrink. Keep container tightly closed and sealed until ready for use.\nContainers that have been opened must be carefully resealed and kept\nupright to prevent leakage. Do not store in unlabeled containers. Use\nappropriate containment to avoid environmental contamination."}