{"GUID":"AkKsEQACHt+fl92lrONowg==","MATNR":"HZ-POH","MAKTX":"Potassium hydroxide","WERKS":"0001","LGORT":"0003","LGOBE":"Corrosive Items","SECTION_ID":6,"SECTION_HEADER":"Accidental release measures","SECTION_CONTENT":"Personal precautions, protective equipment and\nemergency procedures:\nKeep unauthorized personnel away. Ventilate closed spaces before\nentering them. Use personal protective equipment. See Section 8 of the\nSDS for Personal Protective Equipment. Do not touch damaged containers\nor spilled material unless wearing appropriate protective clothing.\nMethods and material for\ncontainment and cleaning\nup:\nSweep up and place in a clearly labeled container for chemical waste.\nClean surface thoroughly to remove residual contamination. Neutralize spill\narea and washings with dilute acetic acid.\nNotification Procedures:\nDike for later disposal. Prevent entry into waterways, sewer, basements or\nconfined areas. Stop the flow of material, if this is without risk. Inform\nauthorities if large amounts are involved.","REVISED_CONTENT":"Product ID:HZ-POH,Product Description:Potassium hydroxide,Storage Location:0003,Storage Location Description:Corrosive Items,Plant:0001,Section Id:6,Section Header:Accidental release measures,Section Content:Personal precautions, protective equipment and\nemergency procedures:\nKeep unauthorized personnel away. Ventilate closed spaces before\nentering them. Use personal protective equipment. See Section 8 of the\nSDS for Personal Protective Equipment. Do not touch damaged containers\nor spilled material unless wearing appropriate protective clothing.\nMethods and material for\ncontainment and cleaning\nup:\nSweep up and place in a clearly labeled container for chemical waste.\nClean surface thoroughly to remove residual contamination. Neutralize spill\narea and washings with dilute acetic acid.\nNotification Procedures:\nDike for later disposal. Prevent entry into waterways, sewer, basements or\nconfined areas. Stop the flow of material, if this is without risk. Inform\nauthorities if large amounts are involved."}