{"GUID":"AkKsEQACHt+fl92lo1qowg==","MATNR":"HZ-CMO","MAKTX":"Carbon monoxide","WERKS":"0001","LGORT":"0001","LGOBE":"Lager 0001","SECTION_ID":12,"SECTION_HEADER":"Ecological information","SECTION_CONTENT":"Toxicity\nCarbon Monoxide (630-08-0)\nLC50-96 h - fish [mg/l]\nEC50 48h - Daphnia magna [mg/l]\nEC50 72h Algae [mg/l]\nPersistence and degradability\nCarbon Monoxide (630-08-0)\nPersistence and degradability\nBioaccumulative potential\nCarbon Monoxide (630-08-0)\nLog Pow\nBioaccumulative potential\n: Study scientifically unjustified.\n: Study scientifically unjustified.\n: Study scientifically unjustified.\n: Will not undergo hydrolysis. Not readily biodegradable. Not applicable for inorganic products\n: 1.78\n: Not expected to bioaccumulate due to the low log Kow (log Kow < 4). Refer to section 9.","REVISED_CONTENT":"Product ID:HZ-CMO,Product Description:Carbon monoxide,Storage Location:0001,Storage Location Description:Lager 0001,Plant:0001,Section Id:12,Section Header:Ecological information,Section Content:Toxicity\nCarbon Monoxide (630-08-0)\nLC50-96 h - fish [mg/l]\nEC50 48h - Daphnia magna [mg/l]\nEC50 72h Algae [mg/l]\nPersistence and degradability\nCarbon Monoxide (630-08-0)\nPersistence and degradability\nBioaccumulative potential\nCarbon Monoxide (630-08-0)\nLog Pow\nBioaccumulative potential\n: Study scientifically unjustified.\n: Study scientifically unjustified.\n: Study scientifically unjustified.\n: Will not undergo hydrolysis. Not readily biodegradable. Not applicable for inorganic products\n: 1.78\n: Not expected to bioaccumulate due to the low log Kow (log Kow < 4). Refer to section 9."}