{"GUID":"AkKsEQACHt+fl92lptFowg==","MATNR":"HZ-HYS","MAKTX":"Hydrogen sulfide","WERKS":"0001","LGORT":"0001","LGOBE":"Lager 0001","SECTION_ID":6,"SECTION_HEADER":"Accidental release measures","SECTION_CONTENT":"Personal precautions, protective equipment and emergency procedures\nGeneral measures\nFor non-emergency personnel\nFor emergency responders\nEnvironmental precautions\nMethods and material for containment and cleaning up\nReference to other sections\n: DANGER! Toxic, flammable liquefied gas. Forms explosive mixtures with air and oxidizing\nagents. Immediately evacuate all personnel from danger area. Use self-contained breathing\napparatus where needed. Remove all sources of ignition if safe to do so. Reduce vapors with\nfog or fine water spray, taking care not to spread liquid with water. Shut off flow if safe to do so.\nVentilate area or move container to a well-ventilated area. Flammable vapors may spread from\nleak and could explode if reignited by sparks or flames. Explosive atmospheres may linger.\nBefore entering area, especially confined areas, check atmosphere with an appropriate device.\nNo additional information available\nNo additional information available\nTry to stop release. Reduce vapour with fog or fine water spray. Prevent waste from contaminating\nthe surrounding environment. Prevent soil and water pollution. Dispose of contents/container in\naccordance with container supplier/owner instructions.\nNo additional information available\nSee also sections 8 and 13.","REVISED_CONTENT":"Product ID:HZ-HYS,Product Description:Hydrogen sulfide,Storage Location:0001,Storage Location Description:Lager 0001,Plant:0001,Section Id:6,Section Header:Accidental release measures,Section Content:Personal precautions, protective equipment and emergency procedures\nGeneral measures\nFor non-emergency personnel\nFor emergency responders\nEnvironmental precautions\nMethods and material for containment and cleaning up\nReference to other sections\n: DANGER! Toxic, flammable liquefied gas. Forms explosive mixtures with air and oxidizing\nagents. Immediately evacuate all personnel from danger area. Use self-contained breathing\napparatus where needed. Remove all sources of ignition if safe to do so. Reduce vapors with\nfog or fine water spray, taking care not to spread liquid with water. Shut off flow if safe to do so.\nVentilate area or move container to a well-ventilated area. Flammable vapors may spread from\nleak and could explode if reignited by sparks or flames. Explosive atmospheres may linger.\nBefore entering area, especially confined areas, check atmosphere with an appropriate device.\nNo additional information available\nNo additional information available\nTry to stop release. Reduce vapour with fog or fine water spray. Prevent waste from contaminating\nthe surrounding environment. Prevent soil and water pollution. Dispose of contents/container in\naccordance with container supplier/owner instructions.\nNo additional information available\nSee also sections 8 and 13."}