{"GUID":"AkKsEQACHt+fl92lpuXIwg==","MATNR":"HZ-OXY","MAKTX":"Oxygen","WERKS":"0001","LGORT":"0001","LGOBE":"Lager 0001","SECTION_ID":9,"SECTION_HEADER":"Physical and chemical properties","SECTION_CONTENT":"Appearance : Gas. [Compressed gas.]\nPhysical state : Colorless. Blue.\nColor : Odorless.\nOdor : Not available.\nOdor threshold : Not available.\npH : Not available.\nMelting point : -218.4°C (-361.1°F)\nBoiling point : -183°C (-297.4°F)\nCritical temperature : -118.15°C (-180.7°F)\nFlash point : [Product does not sustain combustion.]\nEvaporation rate : Not available.\nFlammability (solid, gas) : Extremely flammable in the presence of the following materials or conditions: reducing\nmaterials, combustible materials and organic materials.\nLower and upper explosive\n(flammable) limits : Not available.\nVapor pressure : Not available.\nVapor density : 1.1 (Air = 1)\nSpecific Volume (ft 3/lb) : 12.0482\nGas Density (lb/ft³) : 0.083\nRelative density : Not applicable.\nSolubility : Not available.\nSolubility in water : Not available.\nPartition coefficient: n-\noctanol/water : 0.65\nAuto-ignition temperature : Not available.\nDecomposition temperature: Not available.\nViscosity : Not applicable.\nFlow time (ISO 2431) : Not available.\nMolecular weight : 32 g/mole","REVISED_CONTENT":"Product ID:HZ-OXY,Product Description:Oxygen,Storage Location:0001,Storage Location Description:Lager 0001,Plant:0001,Section Id:9,Section Header:Physical and chemical properties,Section Content:Appearance : Gas. [Compressed gas.]\nPhysical state : Colorless. Blue.\nColor : Odorless.\nOdor : Not available.\nOdor threshold : Not available.\npH : Not available.\nMelting point : -218.4°C (-361.1°F)\nBoiling point : -183°C (-297.4°F)\nCritical temperature : -118.15°C (-180.7°F)\nFlash point : [Product does not sustain combustion.]\nEvaporation rate : Not available.\nFlammability (solid, gas) : Extremely flammable in the presence of the following materials or conditions: reducing\nmaterials, combustible materials and organic materials.\nLower and upper explosive\n(flammable) limits : Not available.\nVapor pressure : Not available.\nVapor density : 1.1 (Air = 1)\nSpecific Volume (ft 3/lb) : 12.0482\nGas Density (lb/ft³) : 0.083\nRelative density : Not applicable.\nSolubility : Not available.\nSolubility in water : Not available.\nPartition coefficient: n-\noctanol/water : 0.65\nAuto-ignition temperature : Not available.\nDecomposition temperature: Not available.\nViscosity : Not applicable.\nFlow time (ISO 2431) : Not available.\nMolecular weight : 32 g/mole"}