{"GUID":"AkKsEQACHt+fl92lo1Gowg==","MATNR":"HZ-CAD","MAKTX":"Cadmium","WERKS":"0001","LGORT":"0088","LGOBE":"Lager 0088 (WM)","SECTION_ID":4,"SECTION_HEADER":"First-aid measures","SECTION_CONTENT":"Eye Contact: No known effect on eye contact, rinse with water for a few minutes.\nSkin Contact:\nAfter contact with skin, wash immediately with plenty of water. Gently and thoroughly wash the contaminated skin with running\nwater and non-abrasive soap. Be particularly careful to clean folds, crevices, creases and groin. Cover the irritated skin with an\nemollient. If irritation persists, seek medical attention. Wash contaminated clothing before reusing.\nSerious Skin Contact: Not available.\nInhalation: Allow the victim to rest in a well ventilated area. Seek immediate medical attention.\nSerious Inhalation:\nEvacuate the victim to a safe area as soon as possible. Loosen tight clothing such as a collar, tie, belt or waistband. If\nbreathing is difficult, administer oxygen. If the victim is not breathing, perform mouth-to-mouth resuscitation. WARNING: It may\nbe hazardous to the person providing aid to give mouth-to-mouth resuscitation when the inhaled material is toxic, infectious or\ncorrosive. Seek immediate medical attention.\nIngestion:\nDo not induce vomiting. Examine the lips and mouth to ascertain whether the tissues are damaged, a possible indication that\nthe toxic material was ingested; the absence of such signs, however, is not conclusive. Loosen tight clothing such as a collar,\ntie, belt or waistband. If the victim is not breathing, perform mouth-to-mouth resuscitation. Seek immediate medical attention.\nSerious Ingestion: Not available.","REVISED_CONTENT":"Product ID:HZ-CAD,Product Description:Cadmium,Storage Location:0088,Storage Location Description:Lager 0088 (WM),Plant:0001,Section Id:4,Section Header:First-aid measures,Section Content:Eye Contact: No known effect on eye contact, rinse with water for a few minutes.\nSkin Contact:\nAfter contact with skin, wash immediately with plenty of water. Gently and thoroughly wash the contaminated skin with running\nwater and non-abrasive soap. Be particularly careful to clean folds, crevices, creases and groin. Cover the irritated skin with an\nemollient. If irritation persists, seek medical attention. Wash contaminated clothing before reusing.\nSerious Skin Contact: Not available.\nInhalation: Allow the victim to rest in a well ventilated area. Seek immediate medical attention.\nSerious Inhalation:\nEvacuate the victim to a safe area as soon as possible. Loosen tight clothing such as a collar, tie, belt or waistband. If\nbreathing is difficult, administer oxygen. If the victim is not breathing, perform mouth-to-mouth resuscitation. WARNING: It may\nbe hazardous to the person providing aid to give mouth-to-mouth resuscitation when the inhaled material is toxic, infectious or\ncorrosive. Seek immediate medical attention.\nIngestion:\nDo not induce vomiting. Examine the lips and mouth to ascertain whether the tissues are damaged, a possible indication that\nthe toxic material was ingested; the absence of such signs, however, is not conclusive. Loosen tight clothing such as a collar,\ntie, belt or waistband. If the victim is not breathing, perform mouth-to-mouth resuscitation. Seek immediate medical attention.\nSerious Ingestion: Not available."}