{"GUID":"AkKsEQACHt+fl92lpuDIwg==","MATNR":"HZ-NAC","MAKTX":"Nitric acid","WERKS":"0001","LGORT":"0003","LGOBE":"Corrosive Items","SECTION_ID":1,"SECTION_HEADER":"Identification","SECTION_CONTENT":"Product name : Nitric acid\nNumber : 000000021241\nProduct Use Description : Laboratory chemicals\nManufacturer or supplier's\ndetails : Honeywell International Inc.\n1953 South Harvey Street\nMuskegon, MI 49442\nFor more information call : 1-800-368-0050\n+1-231-726-3171(Monday-Friday, 9:00am-5:00pm)\nIn case of emergency call : Medical: 1-800-498-5701 or +1-303-389-1414\nTransportation (CHEMTREC): 1-800-424-9300 or\n+1-703-527-3887\n: (24 hours/day, 7 days/week)","REVISED_CONTENT":"Product ID:HZ-NAC,Product Description:Nitric acid,Storage Location:0003,Storage Location Description:Corrosive Items,Plant:0001,Section Id:1,Section Header:Identification,Section Content:Product name : Nitric acid\nNumber : 000000021241\nProduct Use Description : Laboratory chemicals\nManufacturer or supplier's\ndetails : Honeywell International Inc.\n1953 South Harvey Street\nMuskegon, MI 49442\nFor more information call : 1-800-368-0050\n+1-231-726-3171(Monday-Friday, 9:00am-5:00pm)\nIn case of emergency call : Medical: 1-800-498-5701 or +1-303-389-1414\nTransportation (CHEMTREC): 1-800-424-9300 or\n+1-703-527-3887\n: (24 hours/day, 7 days/week)"}