{"GUID":"AkKsEQACHt+fl92lptTowg==","MATNR":"HZ-LIT","MAKTX":"Lithium","WERKS":"0001","LGORT":"0001","LGOBE":"Lager 0001","SECTION_ID":2,"SECTION_HEADER":"HAZARDS IDENTIFICATION","SECTION_CONTENT":"Hazard class: Substances and mixtures which, in contact with water, emit flammable gases (Category 1). In contact with water\nreleases flammable gases which may ignite spontaneously (H260). Handle under inert gas. Protect from moisture (P231+P232).\nKeep away from any possible contact with water, because of violent reaction and possible flash fire (P223).\nHazard class: Skin corrosion or irritation (Category 1). Causes severe skin burns and eye damage (H314). Do not breathe dust\nor fumes (P260).","REVISED_CONTENT":"Product ID:HZ-LIT,Product Description:Lithium,Storage Location:0001,Storage Location Description:Lager 0001,Plant:0001,Section Id:2,Section Header:HAZARDS IDENTIFICATION,Section Content:Hazard class: Substances and mixtures which, in contact with water, emit flammable gases (Category 1). In contact with water\nreleases flammable gases which may ignite spontaneously (H260). Handle under inert gas. Protect from moisture (P231+P232).\nKeep away from any possible contact with water, because of violent reaction and possible flash fire (P223).\nHazard class: Skin corrosion or irritation (Category 1). Causes severe skin burns and eye damage (H314). Do not breathe dust\nor fumes (P260)."}