{"GUID":"AkKsEQACHt+fl92lrPGowg==","MATNR":"HZ-SOM","MAKTX":"Sodium metal","WERKS":"0001","LGORT":"0001","LGOBE":"Lager 0001","SECTION_ID":8,"SECTION_HEADER":"Exposure controls / personal protection","SECTION_CONTENT":"Exposure Limits :\nSodium\nOSHA/PEL : No exposure limit established\nACGIH/TLV: No exposure limit established\nAppropriate Engineering Controls: Handle in an inert gas such as argon. Handle in an enclosed, controlled process. Use local exhaust to maintain\nexposure at low levels. Whenever possible the use of local exhaust ventilation or other engineering controls is the preferred method of controlling exposure to\nairborne dust and fume to meet established occupational exposure limits. Do not use tobacco or food in work area. Wash thoroughly before eating or smoking.\nDo not blow dust off clothing or skin with compressed air. Prepare for the possibility of a fire. Keep extinguishing agents, tools for handling and protective\nclothing readily available.\nIndividual Protection Measures, such as Personal Protective Equipment :\nRespiratory Protection: Wear a NIOSH/MSHA approved respirator when high concentrations are present.\nEye Protection: Always wear approved chemical splash proof goggles.\nSkin Protection: Rubber gloves, flame retardant protective work clothing.","REVISED_CONTENT":"Product ID:HZ-SOM,Product Description:Sodium metal,Storage Location:0001,Storage Location Description:Lager 0001,Plant:0001,Section Id:8,Section Header:Exposure controls / personal protection,Section Content:Exposure Limits :\nSodium\nOSHA/PEL : No exposure limit established\nACGIH/TLV: No exposure limit established\nAppropriate Engineering Controls: Handle in an inert gas such as argon. Handle in an enclosed, controlled process. Use local exhaust to maintain\nexposure at low levels. Whenever possible the use of local exhaust ventilation or other engineering controls is the preferred method of controlling exposure to\nairborne dust and fume to meet established occupational exposure limits. Do not use tobacco or food in work area. Wash thoroughly before eating or smoking.\nDo not blow dust off clothing or skin with compressed air. Prepare for the possibility of a fire. Keep extinguishing agents, tools for handling and protective\nclothing readily available.\nIndividual Protection Measures, such as Personal Protective Equipment :\nRespiratory Protection: Wear a NIOSH/MSHA approved respirator when high concentrations are present.\nEye Protection: Always wear approved chemical splash proof goggles.\nSkin Protection: Rubber gloves, flame retardant protective work clothing."}