{"GUID":"AkKsEQACHt+fl92lrPvowg==","MATNR":"HZ-TOL","MAKTX":"Toluene","WERKS":"0001","LGORT":"0002","LGOBE":"Cold Storage","SECTION_ID":10,"SECTION_HEADER":"Stability and reactivity","SECTION_CONTENT":"Reactive Hazard\nNone known, based on information available\nStability\nStable under normal conditions.\nConditions to Avoid\nIncompatible products. Excess heat. Keep away from open flames, hot surfaces and\nsources of ignition.\nIncompatible Materials\nStrong oxidizing agents, Strong acids, Strong bases, Halogenated compounds\nHazardous Decomposition Products Carbon monoxide (CO), Carbon dioxide (CO2)\nHazardous Polymerization\nHazardous polymerization does not occur.\nHazardous Reactions\nNone under normal processing.","REVISED_CONTENT":"Product ID:HZ-TOL,Product Description:Toluene,Storage Location:0002,Storage Location Description:Cold Storage,Plant:0001,Section Id:10,Section Header:Stability and reactivity,Section Content:Reactive Hazard\nNone known, based on information available\nStability\nStable under normal conditions.\nConditions to Avoid\nIncompatible products. Excess heat. Keep away from open flames, hot surfaces and\nsources of ignition.\nIncompatible Materials\nStrong oxidizing agents, Strong acids, Strong bases, Halogenated compounds\nHazardous Decomposition Products Carbon monoxide (CO), Carbon dioxide (CO2)\nHazardous Polymerization\nHazardous polymerization does not occur.\nHazardous Reactions\nNone under normal processing."}