{"GUID":"AkKsEQACHt+fl92loTAIwg==","MATNR":"HZ-ACE","MAKTX":"Acetone","WERKS":"0001","LGORT":"0001","LGOBE":"Lager 0001","SECTION_ID":9,"SECTION_HEADER":"Physical and chemical properties","SECTION_CONTENT":"Physical State Liquid\nAppearance Colorless\nOdor sweet\nOdor Threshold 19.8 ppm\npH 7\nMelting Point/Range -95 °C/-139 °F\nBoiling Point/Range 56 °C / 132.8 °F\nFlash Point -20 °C / -4 °F\nMethod - Closed cup\nEvaporation Rate 5.6 (Butyl Acetate = 1.0)\nFlammability (solid,gas) Not applicable\nFlammability or explosive limits\nUpper 12.8 vol %\nLower 2.5 vol%\nVapor Pressure 247 mbar @ 20 °C\nVapor Density 2.0\nRelative Density 0.790\nSolubility Soluble in water\nPartition coefficient; n-octanol/water No data available","REVISED_CONTENT":"Product ID:HZ-ACE,Product Description:Acetone,Storage Location:0001,Storage Location Description:Lager 0001,Plant:0001,Section Id:9,Section Header:Physical and chemical properties,Section Content:Physical State Liquid\nAppearance Colorless\nOdor sweet\nOdor Threshold 19.8 ppm\npH 7\nMelting Point/Range -95 °C/-139 °F\nBoiling Point/Range 56 °C / 132.8 °F\nFlash Point -20 °C / -4 °F\nMethod - Closed cup\nEvaporation Rate 5.6 (Butyl Acetate = 1.0)\nFlammability (solid,gas) Not applicable\nFlammability or explosive limits\nUpper 12.8 vol %\nLower 2.5 vol%\nVapor Pressure 247 mbar @ 20 °C\nVapor Density 2.0\nRelative Density 0.790\nSolubility Soluble in water\nPartition coefficient; n-octanol/water No data available"}