{"GUID":"AkKsEQACHt+fl92lrOkowg==","MATNR":"HZ-SAC","MAKTX":"Sulfuric acid","WERKS":"0001","LGORT":"0003","LGOBE":"Corrosive Items","SECTION_ID":4,"SECTION_HEADER":"First-aid measures","SECTION_CONTENT":"Eye Contact Rinse immediately with plenty of water, also under the eyelids, for at least 15 minutes. Immediate medical attention is required. Skin Contact Wash off immediately with plenty of water for at least 15 minutes. Immediate medical attention is required. Inhalation Move to fresh air. If breathing is difficult, give oxygen. Do not use mouth-to-mouth resuscitation if victim ingested or inhaled the substance; induce artificial respiration with a respiratory medical device. Immediate medical attention is required. Ingestion Do not induce vomiting. Call a physician or Poison Control Center immediately. Most important symptoms/effects Causes burns by all exposure routes.. Product is a corrosive material. Use of gastric lavage or emesis is contraindicated. Possible perforation of stomach or esophagus should be investigated: Ingestion causes severe swelling, severe damage to the delicate tissue and danger of perforation Notes to Physician Treat symptomatically","REVISED_CONTENT":"Product ID:HZ-SAC,Product Description:Sulfuric acid,Storage Location:0003,Storage Location Description:Corrosive Items,Plant:0001,Section Id:4,Section Header:First-aid measures,Section Content:Eye Contact Rinse immediately with plenty of water, also under the eyelids, for at least 15 minutes. Immediate medical attention is required. Skin Contact Wash off immediately with plenty of water for at least 15 minutes. Immediate medical attention is required. Inhalation Move to fresh air. If breathing is difficult, give oxygen. Do not use mouth-to-mouth resuscitation if victim ingested or inhaled the substance; induce artificial respiration with a respiratory medical device. Immediate medical attention is required. Ingestion Do not induce vomiting. Call a physician or Poison Control Center immediately. Most important symptoms/effects Causes burns by all exposure routes.. Product is a corrosive material. Use of gastric lavage or emesis is contraindicated. Possible perforation of stomach or esophagus should be investigated: Ingestion causes severe swelling, severe damage to the delicate tissue and danger of perforation Notes to Physician Treat symptomatically"}