{"GUID":"AkKsEQACHt+fl92lpuKowg==","MATNR":"HZ-NAC","MAKTX":"Nitric acid","WERKS":"0001","LGORT":"0003","LGOBE":"Corrosive Items","SECTION_ID":16,"SECTION_HEADER":"Other information","SECTION_CONTENT":"HMIS III NFPA\nHealth hazard : 4 4\nFlammability : 0 0\nPhysical Hazard : 3 0\nInstability : 0\nSpecial hazard : OX\nHazard rating and rating systems (e.g. HMIS® III, NFPA): This information is intended solely for the use\nof individuals trained in the particular system.\nFurther information\nThe information provided in this Safety Data Sheet is correct to the best of our knowledge, information\nand belief at the date of its publication. The information given is designed only as a guidance for safe\nhandling, use, processing, storage, transportation, disposal and release and is not to be considered a\nwarranty or quality specification. The information relates only to the specific material designated and\nmay not be valid for such material used in combination with any other materials or in any process,\nunless specified in the text. Final determination of suitability of any material is the sole responsibility of\nthe user. This information should not constitute a guarantee for any specific product properties.\nChanges since the last version are highlighted in the margin. This version replaces all previous\nversions.\nPrevious Issue Date: 02/28/2018\nPrepared by Honeywell Performance Materials and Technologies Product Stewardship Group","REVISED_CONTENT":"Product ID:HZ-NAC,Product Description:Nitric acid,Storage Location:0003,Storage Location Description:Corrosive Items,Plant:0001,Section Id:16,Section Header:Other information,Section Content:HMIS III NFPA\nHealth hazard : 4 4\nFlammability : 0 0\nPhysical Hazard : 3 0\nInstability : 0\nSpecial hazard : OX\nHazard rating and rating systems (e.g. HMIS® III, NFPA): This information is intended solely for the use\nof individuals trained in the particular system.\nFurther information\nThe information provided in this Safety Data Sheet is correct to the best of our knowledge, information\nand belief at the date of its publication. The information given is designed only as a guidance for safe\nhandling, use, processing, storage, transportation, disposal and release and is not to be considered a\nwarranty or quality specification. The information relates only to the specific material designated and\nmay not be valid for such material used in combination with any other materials or in any process,\nunless specified in the text. Final determination of suitability of any material is the sole responsibility of\nthe user. This information should not constitute a guarantee for any specific product properties.\nChanges since the last version are highlighted in the margin. This version replaces all previous\nversions.\nPrevious Issue Date: 02/28/2018\nPrepared by Honeywell Performance Materials and Technologies Product Stewardship Group"}