{"GUID":"AkKsEQACHt+fl92lptHIwg==","MATNR":"HZ-HYS","MAKTX":"Hydrogen sulfide","WERKS":"0001","LGORT":"0001","LGOBE":"Lager 0001","SECTION_ID":9,"SECTION_HEADER":"Physical and chemical properties","SECTION_CONTENT":"Information on basic physical and chemical properties\nPhysical state\nAppearance\nMolecular mass\nColour\nOdour\nOdour threshold\npH\nRelative evaporation rate (butylacetate=1)\nRelative evaporation rate (ether=1)\nMelting point\nFreezing point\nBoiling point\nFlash point\nCritical temperature\nAuto-ignition temperature\nDecomposition temperature\nFlammability (solid, gas)\nVapour pressure\nCritical pressure\nRelative vapour density at 20 °C\nRelative density\nRelative gas density\nSolubility\nPartition coefficient n-octanol/water (Log Pow)\nPartition coefficient n-octanol/water (Log Kow)\nViscosity, kinematic\nViscosity, dynamic\nExplosive properties\nOxidizing properties\nExplosive limits\nGas group\nOther information\nAdditional information\n: Gas\n: Colourless gas. Colorless liquid at low temperature or under high pressure.\n: 34 g/mol\n: Colourless.\n: Odour can persist. Poor warning properties at low concentrations. Rotten eggs.\n: Odour threshold is subjective and inadequate to warn of overexposure.\n: Not applicable.\n: No data available\n: Not applicable.\n: -86 °C\n: No data available\n: -60.3 °C\n: Not applicable.\n: 100.4 °C\n: 260 °C\n: No data available\n: 4.346 vol %\n: 1880 kPa\n: 8940 kPa\n: No data available\n: No data available\n: 1.2\n: Water: 3980 mg/l\n: Not applicable.\n: Not applicable.\n: Not applicable.\n: Not applicable.\n: Not applicable.\n: None.\n: No data available\n: Press. Gas (Liq.)\n: Gas/vapour heavier than air. May accumulate in confined spaces, particularly at or below\nground level.","REVISED_CONTENT":"Product ID:HZ-HYS,Product Description:Hydrogen sulfide,Storage Location:0001,Storage Location Description:Lager 0001,Plant:0001,Section Id:9,Section Header:Physical and chemical properties,Section Content:Information on basic physical and chemical properties\nPhysical state\nAppearance\nMolecular mass\nColour\nOdour\nOdour threshold\npH\nRelative evaporation rate (butylacetate=1)\nRelative evaporation rate (ether=1)\nMelting point\nFreezing point\nBoiling point\nFlash point\nCritical temperature\nAuto-ignition temperature\nDecomposition temperature\nFlammability (solid, gas)\nVapour pressure\nCritical pressure\nRelative vapour density at 20 °C\nRelative density\nRelative gas density\nSolubility\nPartition coefficient n-octanol/water (Log Pow)\nPartition coefficient n-octanol/water (Log Kow)\nViscosity, kinematic\nViscosity, dynamic\nExplosive properties\nOxidizing properties\nExplosive limits\nGas group\nOther information\nAdditional information\n: Gas\n: Colourless gas. Colorless liquid at low temperature or under high pressure.\n: 34 g/mol\n: Colourless.\n: Odour can persist. Poor warning properties at low concentrations. Rotten eggs.\n: Odour threshold is subjective and inadequate to warn of overexposure.\n: Not applicable.\n: No data available\n: Not applicable.\n: -86 °C\n: No data available\n: -60.3 °C\n: Not applicable.\n: 100.4 °C\n: 260 °C\n: No data available\n: 4.346 vol %\n: 1880 kPa\n: 8940 kPa\n: No data available\n: No data available\n: 1.2\n: Water: 3980 mg/l\n: Not applicable.\n: Not applicable.\n: Not applicable.\n: Not applicable.\n: Not applicable.\n: None.\n: No data available\n: Press. Gas (Liq.)\n: Gas/vapour heavier than air. May accumulate in confined spaces, particularly at or below\nground level."}