{"GUID":"AkKsEQACHt+fl92lrOPIwg==","MATNR":"HZ-POH","MAKTX":"Potassium hydroxide","WERKS":"0001","LGORT":"0003","LGOBE":"Corrosive Items","SECTION_ID":9,"SECTION_HEADER":"Physical and chemical properties","SECTION_CONTENT":"Appearance\nPhysical state:\nSolid\nForm:\nSolid\nColor:\nWhite\nOdor:\nOdorless\nOdor threshold:\nNo data available.\npH:\n13.5 (5.61 g/l, 20 °C)\nMelting point/freezing point:\n360 °C\nInitial boiling point and boiling range:\n1,320 °C\nFlash Point:\nNo data available.\nEvaporation rate:\nNo data available.\nFlammability (solid, gas):\nNo data available.\nUpper/lower limit on flammability or explosive limits\nFlammability limit - upper (%):\nNo data available.\nFlammability limit - lower (%):\nNo data available.\nExplosive limit - upper (%):\nNo data available.\nExplosive limit - lower (%):\nNo data available.\nVapor pressure:\n0.1 kPa (714 °C)\nVapor density:\nNo data available.\nDensity:\n2.04 g/ml (20 °C)\nRelative density:\n2.04 (20 °C)\nSolubility(ies)\nSolubility in water:\nSoluble\nSolubility (other):\nNo data available.\nPartition coefficient (n-octanol/water):\nNo data available.\nAuto-ignition temperature:\nNo data available.\nDecomposition temperature:\nNo data available.\nViscosity:\nNo data available.\nOther information\nMolecular weight:\n56.11 g/mol","REVISED_CONTENT":"Product ID:HZ-POH,Product Description:Potassium hydroxide,Storage Location:0003,Storage Location Description:Corrosive Items,Plant:0001,Section Id:9,Section Header:Physical and chemical properties,Section Content:Appearance\nPhysical state:\nSolid\nForm:\nSolid\nColor:\nWhite\nOdor:\nOdorless\nOdor threshold:\nNo data available.\npH:\n13.5 (5.61 g/l, 20 °C)\nMelting point/freezing point:\n360 °C\nInitial boiling point and boiling range:\n1,320 °C\nFlash Point:\nNo data available.\nEvaporation rate:\nNo data available.\nFlammability (solid, gas):\nNo data available.\nUpper/lower limit on flammability or explosive limits\nFlammability limit - upper (%):\nNo data available.\nFlammability limit - lower (%):\nNo data available.\nExplosive limit - upper (%):\nNo data available.\nExplosive limit - lower (%):\nNo data available.\nVapor pressure:\n0.1 kPa (714 °C)\nVapor density:\nNo data available.\nDensity:\n2.04 g/ml (20 °C)\nRelative density:\n2.04 (20 °C)\nSolubility(ies)\nSolubility in water:\nSoluble\nSolubility (other):\nNo data available.\nPartition coefficient (n-octanol/water):\nNo data available.\nAuto-ignition temperature:\nNo data available.\nDecomposition temperature:\nNo data available.\nViscosity:\nNo data available.\nOther information\nMolecular weight:\n56.11 g/mol"}