{"GUID":"AkKsEQACHt+fl92lrP4Iwg==","MATNR":"HZ-URA","MAKTX":"URANIUM - WP","WERKS":"0001","LGORT":"0002","LGOBE":"Cold Storage","SECTION_ID":11,"SECTION_HEADER":"Toxicological information","SECTION_CONTENT":"SECTION 11: Toxicological information\n11.1 Information on toxicological effects\nMixture\nAcute toxicity\nSymptoms: Irritations of mucous membranes in the mouth, pharynx, oesophagus and\ngastrointestinal tract.\nInhalation: No data available\nAcute toxicity estimate Inhalation - 4 h - 75.71 mg/l - vapor(Calculation method)\nSymptoms: Possible symptoms:, mucosal irritations\nDermal: No data available\nSkin corrosion/irritation\nMixture causes skin irritation.\nSerious eye damage/eye irritation\nMixture causes serious eye damage.","REVISED_CONTENT":"Product ID:HZ-URA,Product Description:URANIUM - WP,Storage Location:0002,Storage Location Description:Cold Storage,Plant:0001,Section Id:11,Section Header:Toxicological information,Section Content:SECTION 11: Toxicological information\n11.1 Information on toxicological effects\nMixture\nAcute toxicity\nSymptoms: Irritations of mucous membranes in the mouth, pharynx, oesophagus and\ngastrointestinal tract.\nInhalation: No data available\nAcute toxicity estimate Inhalation - 4 h - 75.71 mg/l - vapor(Calculation method)\nSymptoms: Possible symptoms:, mucosal irritations\nDermal: No data available\nSkin corrosion/irritation\nMixture causes skin irritation.\nSerious eye damage/eye irritation\nMixture causes serious eye damage."}