{"GUID":"AkKsEQACHt+fl92loTUIwg==","MATNR":"HZ-BUT","MAKTX":"Butane","WERKS":"0001","LGORT":"0001","LGOBE":"Lager 0001","SECTION_ID":1,"SECTION_HEADER":"Identification","SECTION_CONTENT":"SECTION 1: Identification of the substance/mixture and of the company/undertaking\n1.1 Product identifiers\nProduct name\n: Butane\nProduct Number\n: 494402\nBrand\n: Aldrich\nIndex-No.\n: 601-004-00-0\nCAS-No.\n: 106-97-8\n1.2 Relevant identified uses of the substance or mixture and uses advised against\nIdentified uses\n: Laboratory chemicals, Synthesis of substances\n1.3 Details of the supplier of the safety data sheet\nCompany\n: Sigma-Aldrich Inc.\n3050 SPRUCE ST\nST. LOUIS MO 63103\nUNITED STATES\nTelephone\n: +1 314 771-5765\nFax\n: +1 800 325-5052\n1.4 Emergency telephone\nEmergency Phone #\n: 800-424-9300 CHEMTREC (USA) +1-703-\n527-3887 CHEMTREC (International) 24\nHours/day; 7 Days/week","REVISED_CONTENT":"Product ID:HZ-BUT,Product Description:Butane,Storage Location:0001,Storage Location Description:Lager 0001,Plant:0001,Section Id:1,Section Header:Identification,Section Content:SECTION 1: Identification of the substance/mixture and of the company/undertaking\n1.1 Product identifiers\nProduct name\n: Butane\nProduct Number\n: 494402\nBrand\n: Aldrich\nIndex-No.\n: 601-004-00-0\nCAS-No.\n: 106-97-8\n1.2 Relevant identified uses of the substance or mixture and uses advised against\nIdentified uses\n: Laboratory chemicals, Synthesis of substances\n1.3 Details of the supplier of the safety data sheet\nCompany\n: Sigma-Aldrich Inc.\n3050 SPRUCE ST\nST. LOUIS MO 63103\nUNITED STATES\nTelephone\n: +1 314 771-5765\nFax\n: +1 800 325-5052\n1.4 Emergency telephone\nEmergency Phone #\n: 800-424-9300 CHEMTREC (USA) +1-703-\n527-3887 CHEMTREC (International) 24\nHours/day; 7 Days/week"}