{"GUID":"AkKsEQACHt+fl92lpuMowg==","MATNR":"HZ-NIT","MAKTX":"Nitrogen","WERKS":"0001","LGORT":"0001","LGOBE":"Lager 0001","SECTION_ID":4,"SECTION_HEADER":"First-aid measures","SECTION_CONTENT":"4.1. Description of first aid measures\nFirst-aid measures after inhalation\nFirst-aid measures after skin contact\nFirst-aid measures after eye contact\nFirst-aid measures after ingestion\n4.2.\nSymptoms/effects after inhalation\nSymptoms/effects after skin contact\nSymptoms/effects after eye contact\nSymptoms/effects after ingestion\nSymptoms/effects upon intravenous administration\nChronic symptoms\n4.3.\nImmediate medical attention and special treatment, if necessary\nIf breathing is difficult, give oxygen. Obtain medical attention if breathing difficulty persists.\n: Remove victim to fresh air and keep at rest in a position comfortable for breathing. If you feel unwell, seek medical advice.\n: Adverse effects not expected from this product.\n: Adverse effects not expected from this product.\n: Ingestion is not considered a potential route of exposure.\n: May displace oxygen and cause rapid suffocation. If you feel unwell, seek medical advice.\n: Adverse effects not expected from this product.\n: Adverse effects not expected from this product.\n: Ingestion is not considered a potential route of exposure.\n: Not known.\n: None known.","REVISED_CONTENT":"Product ID:HZ-NIT,Product Description:Nitrogen,Storage Location:0001,Storage Location Description:Lager 0001,Plant:0001,Section Id:4,Section Header:First-aid measures,Section Content:4.1. Description of first aid measures\nFirst-aid measures after inhalation\nFirst-aid measures after skin contact\nFirst-aid measures after eye contact\nFirst-aid measures after ingestion\n4.2.\nSymptoms/effects after inhalation\nSymptoms/effects after skin contact\nSymptoms/effects after eye contact\nSymptoms/effects after ingestion\nSymptoms/effects upon intravenous administration\nChronic symptoms\n4.3.\nImmediate medical attention and special treatment, if necessary\nIf breathing is difficult, give oxygen. Obtain medical attention if breathing difficulty persists.\n: Remove victim to fresh air and keep at rest in a position comfortable for breathing. If you feel unwell, seek medical advice.\n: Adverse effects not expected from this product.\n: Adverse effects not expected from this product.\n: Ingestion is not considered a potential route of exposure.\n: May displace oxygen and cause rapid suffocation. If you feel unwell, seek medical advice.\n: Adverse effects not expected from this product.\n: Adverse effects not expected from this product.\n: Ingestion is not considered a potential route of exposure.\n: Not known.\n: None known."}