{"GUID":"AkKsEQACHt+fl92lps7owg==","MATNR":"HZ-HYP","MAKTX":"Hydrogen Peroxide 3%","WERKS":"0001","LGORT":"0002","LGOBE":"Cold Storage","SECTION_ID":2,"SECTION_HEADER":"Hazard(s) identification","SECTION_CONTENT":"Classification\nThis chemical is considered hazardous by the 2012 OSHA Hazard Communication Standard (29 CFR 1910.1200)\nSerious Eye Damage/Eye Irritation\nLabel Elements\nSignal Word\nDanger\nHazard Statements\nCauses serious eye irritation\n!Category 2\nPrecautionary Statements\nPrevention\nWash face, hands and any exposed skin thoroughly after handling\nWear protective gloves/protective clothing/eye protection/face protection","REVISED_CONTENT":"Product ID:HZ-HYP,Product Description:Hydrogen Peroxide 3%,Storage Location:0002,Storage Location Description:Cold Storage,Plant:0001,Section Id:2,Section Header:Hazard(s) identification,Section Content:Classification\nThis chemical is considered hazardous by the 2012 OSHA Hazard Communication Standard (29 CFR 1910.1200)\nSerious Eye Damage/Eye Irritation\nLabel Elements\nSignal Word\nDanger\nHazard Statements\nCauses serious eye irritation\n!Category 2\nPrecautionary Statements\nPrevention\nWash face, hands and any exposed skin thoroughly after handling\nWear protective gloves/protective clothing/eye protection/face protection"}