{"GUID":"AkKsEQACHt+fl92lo1dIwg==","MATNR":"HZ-CLG","MAKTX":"Chlorine gas","WERKS":"0001","LGORT":"0001","LGOBE":"Lager 0001","SECTION_ID":1,"SECTION_HEADER":"Identification","SECTION_CONTENT":"Product identifier\nTrade name: Chlorine Gas\nArticle number: C3560\nCAS Number:\n7782-50-5\nEC number:\n231-959-5\n• Index number:\n017-001-00-7\n• Details of the supplier of the safety data sheet\n• Manufacturer/Supplier:\nAqua Solutions, Inc.\n6913 Highway 225\nDEER PARK, TX 77536\nUSA\n800-256-2586\nInformation department:\nTechnical Coordinator\nSherman Nelson shermann@aquasolutions.org\nEmergency telephone number:\nChemtrec: 800-424-9300\nCanutec: 613-996-6666","REVISED_CONTENT":"Product ID:HZ-CLG,Product Description:Chlorine gas,Storage Location:0001,Storage Location Description:Lager 0001,Plant:0001,Section Id:1,Section Header:Identification,Section Content:Product identifier\nTrade name: Chlorine Gas\nArticle number: C3560\nCAS Number:\n7782-50-5\nEC number:\n231-959-5\n• Index number:\n017-001-00-7\n• Details of the supplier of the safety data sheet\n• Manufacturer/Supplier:\nAqua Solutions, Inc.\n6913 Highway 225\nDEER PARK, TX 77536\nUSA\n800-256-2586\nInformation department:\nTechnical Coordinator\nSherman Nelson shermann@aquasolutions.org\nEmergency telephone number:\nChemtrec: 800-424-9300\nCanutec: 613-996-6666"}