{"GUID":"AkKsEQACHt+fl92lrPjIwg==","MATNR":"HZ-TOL","MAKTX":"Toluene","WERKS":"0001","LGORT":"0001","LGOBE":"Lager 0001","SECTION_ID":1,"SECTION_HEADER":"Identification","SECTION_CONTENT":"Product Name\nToluene\nCat No. :\nAC610950000; AC610951000\nCAS No\n108-88-3\nSynonyms\nTol; Methylbenzene\nRecommended Use\nLaboratory chemicals.\nUses advised against\nFood, drug, pesticide or biocidal product use.\nDetails of the supplier of the safety data sheet\nCompany\nFisher Scientific Company\nOne Reagent Lane\nFair Lawn, NJ 07410\nTel: (201) 796-7100\nEmergency Telephone Number\nAcros Organics\nOne Reagent Lane\nFair Lawn, NJ 07410\nFor information US call: 001-800-ACROS-01 / Europe call: +32 14 57 52 11\nEmergency Number US:001-201-796-7100 / Europe: +32 14 57 52 99\nCHEMTREC Tel. No.US:001-800-424-9300 / Europe:001-703-527-3887","REVISED_CONTENT":"Product ID:HZ-TOL,Product Description:Toluene,Storage Location:0001,Storage Location Description:Lager 0001,Plant:0001,Section Id:1,Section Header:Identification,Section Content:Product Name\nToluene\nCat No. :\nAC610950000; AC610951000\nCAS No\n108-88-3\nSynonyms\nTol; Methylbenzene\nRecommended Use\nLaboratory chemicals.\nUses advised against\nFood, drug, pesticide or biocidal product use.\nDetails of the supplier of the safety data sheet\nCompany\nFisher Scientific Company\nOne Reagent Lane\nFair Lawn, NJ 07410\nTel: (201) 796-7100\nEmergency Telephone Number\nAcros Organics\nOne Reagent Lane\nFair Lawn, NJ 07410\nFor information US call: 001-800-ACROS-01 / Europe call: +32 14 57 52 11\nEmergency Number US:001-201-796-7100 / Europe: +32 14 57 52 99\nCHEMTREC Tel. No.US:001-800-424-9300 / Europe:001-703-527-3887"}