{"GUID":"AkKsEQACHt+fl92lo1eowg==","MATNR":"HZ-CLG","MAKTX":"Chlorine gas","WERKS":"0001","LGORT":"0001","LGOBE":"Lager 0001","SECTION_ID":4,"SECTION_HEADER":"First-aid measures","SECTION_CONTENT":"Description of first aid measures\nGeneral information:\nImmediately remove any clothing soiled by the product.\nRemove breathing apparatus only after contaminated clothing have been completely removed.\nIn case of irregular breathing or respiratory arrest provide artificial respiration.\n· After inhalation:\nSupply fresh air or oxygen; call for doctor.\nIn case of unconsciousness place patient stably in side position for transportation.\n• After skin contact: Immediately wash with water and soap and rinse thoroughly.\n• After eye contact:\nRinse opened eye for several minutes under running water. If symptoms persist, consult a doctor.\n· After swallowing: If symptoms persist consult doctor.\nInformation for doctor:\nMost important symptoms and effects, both acute and delayed No further relevant information available.\nIndication of any immediate medical attention and special treatment needed\nNo further relevant information available.","REVISED_CONTENT":"Product ID:HZ-CLG,Product Description:Chlorine gas,Storage Location:0001,Storage Location Description:Lager 0001,Plant:0001,Section Id:4,Section Header:First-aid measures,Section Content:Description of first aid measures\nGeneral information:\nImmediately remove any clothing soiled by the product.\nRemove breathing apparatus only after contaminated clothing have been completely removed.\nIn case of irregular breathing or respiratory arrest provide artificial respiration.\n· After inhalation:\nSupply fresh air or oxygen; call for doctor.\nIn case of unconsciousness place patient stably in side position for transportation.\n• After skin contact: Immediately wash with water and soap and rinse thoroughly.\n• After eye contact:\nRinse opened eye for several minutes under running water. If symptoms persist, consult a doctor.\n· After swallowing: If symptoms persist consult doctor.\nInformation for doctor:\nMost important symptoms and effects, both acute and delayed No further relevant information available.\nIndication of any immediate medical attention and special treatment needed\nNo further relevant information available."}