{"GUID":"AkKsEQACHt+fl92lo1xowg==","MATNR":"HZ-DYN","MAKTX":"Dynamite Gray","WERKS":"0001","LGORT":"0004","LGOBE":"Explosives","SECTION_ID":10,"SECTION_HEADER":"Stability and reactivity","SECTION_CONTENT":"Reactivity\nChemical stability\n:\nNo specific test data related to reactivity available for this product or\nits ingredients.\n:\nStable under recommended storage and handling conditions (see\nSection 7).\nPossibility of hazardous reactions\n:\nUnder normal conditions of storage and use, hazardous reactions will\nnot occur.\nConditions to avoid\n:\nKeep away from extreme heat and oxidizing agents.\nIncompatible materials\n:\nKeep away from strong acids.\nOxidizer.\nHazardous decomposition\n:\nproducts\nUnder normal conditions of storage and use, hazardous decomposition\nproducts should not be produced.","REVISED_CONTENT":"Product ID:HZ-DYN,Product Description:Dynamite Gray,Storage Location:0004,Storage Location Description:Explosives,Plant:0001,Section Id:10,Section Header:Stability and reactivity,Section Content:Reactivity\nChemical stability\n:\nNo specific test data related to reactivity available for this product or\nits ingredients.\n:\nStable under recommended storage and handling conditions (see\nSection 7).\nPossibility of hazardous reactions\n:\nUnder normal conditions of storage and use, hazardous reactions will\nnot occur.\nConditions to avoid\n:\nKeep away from extreme heat and oxidizing agents.\nIncompatible materials\n:\nKeep away from strong acids.\nOxidizer.\nHazardous decomposition\n:\nproducts\nUnder normal conditions of storage and use, hazardous decomposition\nproducts should not be produced."}