{"GUID":"AkKsEQACHt+fl92lrOTowg==","MATNR":"HZ-PPM","MAKTX":"Potassium permanganate","WERKS":"0001","LGORT":"0088","LGOBE":"Lager 0088 (WM)","SECTION_ID":2,"SECTION_HEADER":"Hazard(s) identification","SECTION_CONTENT":"This chemical is considered hazardous by the 2012 OSHA Hazard Communication Standard (29 CFR 1910.1200)\nOxidizing solids\nCategory 2\nAcute oral toxicity\nCategory 4\nSkin Corrosion/Irritation\nCategory 1 C\nSerious Eye Damage/Eye Irritation\nCategory 1\nReproductive Toxicity\nCategory 2\nSpecific target organ toxicity (single exposure)\nCategory 3\nTarget Organs - Respiratory system, Central nervous system (CNS).\nSpecific target organ toxicity - (repeated exposure)\nCategory 2\nTarget Organs - Brain.\nLabel Elements\nSignal Word\nDanger","REVISED_CONTENT":"Product ID:HZ-PPM,Product Description:Potassium permanganate,Storage Location:0088,Storage Location Description:Lager 0088 (WM),Plant:0001,Section Id:2,Section Header:Hazard(s) identification,Section Content:This chemical is considered hazardous by the 2012 OSHA Hazard Communication Standard (29 CFR 1910.1200)\nOxidizing solids\nCategory 2\nAcute oral toxicity\nCategory 4\nSkin Corrosion/Irritation\nCategory 1 C\nSerious Eye Damage/Eye Irritation\nCategory 1\nReproductive Toxicity\nCategory 2\nSpecific target organ toxicity (single exposure)\nCategory 3\nTarget Organs - Respiratory system, Central nervous system (CNS).\nSpecific target organ toxicity - (repeated exposure)\nCategory 2\nTarget Organs - Brain.\nLabel Elements\nSignal Word\nDanger"}