{"GUID":"AkKsEQACHt+fl92lps8owg==","MATNR":"HZ-HYP","MAKTX":"Hydrogen Peroxide 3%","WERKS":"0001","LGORT":"0002","LGOBE":"Cold Storage","SECTION_ID":4,"SECTION_HEADER":"First-aid measures","SECTION_CONTENT":"Eye Contact\nRinse immediately with plenty of water, also under the eyelids, for at least 15 minutes.\nObtain medical attention.\nSkin Contact\nWash off immediately with plenty of water for at least 15 minutes. Get medical attention\nimmediately if symptoms occur.\nInhalation\nMove to fresh air. If breathing is difficult, give oxygen. Get medical attention immediately if\nsymptoms occur.\nIngestion\nDo not induce vomiting. Obtain medical attention.\nMost important symptoms/effects\nCauses eye burns.\nNotes to Physician\nTreat symptomatically","REVISED_CONTENT":"Product ID:HZ-HYP,Product Description:Hydrogen Peroxide 3%,Storage Location:0002,Storage Location Description:Cold Storage,Plant:0001,Section Id:4,Section Header:First-aid measures,Section Content:Eye Contact\nRinse immediately with plenty of water, also under the eyelids, for at least 15 minutes.\nObtain medical attention.\nSkin Contact\nWash off immediately with plenty of water for at least 15 minutes. Get medical attention\nimmediately if symptoms occur.\nInhalation\nMove to fresh air. If breathing is difficult, give oxygen. Get medical attention immediately if\nsymptoms occur.\nIngestion\nDo not induce vomiting. Obtain medical attention.\nMost important symptoms/effects\nCauses eye burns.\nNotes to Physician\nTreat symptomatically"}