{"GUID":"AkKsEQACHt+fl92lpubIwg==","MATNR":"HZ-PHO","MAKTX":"Phosphorus","WERKS":"0001","LGORT":"0088","LGOBE":"Lager 0088 (WM)","SECTION_ID":1,"SECTION_HEADER":"Identification","SECTION_CONTENT":"1.1. Product identifier\nProduct Code/Catalogue\nNumber:\nSDS Number:\nProduct Name\n981890, 981891\nD15206_SDS_Phosphorus, reagent A, reagent B_EN\nPhosphorus\n1.2. Relevant identified uses of the substance or mixture and uses advised against\nRecommended Use\nUses advised against\nIn vitro diagnostic.\nNo Information available\n1.3. Details of the supplier of the safety data sheet\nCompany\nTelephone number\nE-mail address\n1.4. Emergency telephone number\nThermo Fisher Scientific Oy\nRatastie 2,\nFI-01620 Vantaa, Finland\n+358 10 329200\nsystem.support.fi@thermofisher.com\nCHEMTREC INTERNATIONAL +1 703-741-5970","REVISED_CONTENT":"Product ID:HZ-PHO,Product Description:Phosphorus,Storage Location:0088,Storage Location Description:Lager 0088 (WM),Plant:0001,Section Id:1,Section Header:Identification,Section Content:1.1. Product identifier\nProduct Code/Catalogue\nNumber:\nSDS Number:\nProduct Name\n981890, 981891\nD15206_SDS_Phosphorus, reagent A, reagent B_EN\nPhosphorus\n1.2. Relevant identified uses of the substance or mixture and uses advised against\nRecommended Use\nUses advised against\nIn vitro diagnostic.\nNo Information available\n1.3. Details of the supplier of the safety data sheet\nCompany\nTelephone number\nE-mail address\n1.4. Emergency telephone number\nThermo Fisher Scientific Oy\nRatastie 2,\nFI-01620 Vantaa, Finland\n+358 10 329200\nsystem.support.fi@thermofisher.com\nCHEMTREC INTERNATIONAL +1 703-741-5970"}