{"GUID":"AkKsEQACHt+fl92loS/owg==","MATNR":"HZ-ACE","MAKTX":"Acetone","WERKS":"0001","LGORT":"0001","LGOBE":"Lager 0001","SECTION_ID":8,"SECTION_HEADER":"Exposure controls / personal protection","SECTION_CONTENT":"Exposure Guidelines\nComponent\nAcetone\nACGIH TLV\nTWA: 500 ppm\nSTEL: 750 ppm\nOSHA PEL\n(Vacated) TWA: 750 ppm\n(Vacated) TWA: 1800 mg/m³\n(Vacated) STEL: 2400 mg/m³\n(Vacated) STEL: 1000 ppm\nTWA: 1000 ppm\nTWA: 2400 mg/m³\nNIOSH IDLH\nIDLH: 2500 ppm\nTWA: 250 ppm\nTWA: 590 mg/m³\nLegend\nComponent\nAcetone\nQuebec\nTWA: 500 ppm\nTWA: 1190 mg/m³\nSTEL: 1000 ppm\nSTEL: 2380 mg/m³\nMexico OEL (TWA)\nTWA: 1000 ppm\nTWA: 2400 mg/m³\nSTEL: 1260 ppm\nSTEL: 3000 mg/m³\nOntario TWAEV\nTWA: 500 ppm\nSTEL: 750 ppm\nACGIH - American Conference of Governmental Industrial Hygienists\nOSHA - Occupational Safety and Health Administration\nNIOSH IDLH: The National Institute for Occupational Safety and Health Immediately Dangerous to Life or Health\nEngineering Measures Ensure adequate ventilation, especially in confined areas. Ensure that eyewash stations\nand safety showers are close to the workstation location. Use explosion-proof\nelectrical/ventilating/lighting/equipment.\nPersonal Protective Equipment\nEye/face Protection Wear appropriate protective eyeglasses or chemical safety goggles as described by\nOSHA's eye and face protection regulations in 29 CFR 1910.133 or European Standard\nEN166.\nSkin and body protection Wear appropriate protective gloves and clothing to prevent skin exposure.\nRespiratory Protection Follow the OSHA respirator regulations found in 29 CFR 1910.134 or European Standard\nEN 149. Use a NIOSH/MSHA or European Standard EN 149 approved respirator if\nexposure limits are exceeded or if irritation or other symptoms are experienced.\nHygiene Measures Handle in accordance with good industrial hygiene and safety practice.","REVISED_CONTENT":"Product ID:HZ-ACE,Product Description:Acetone,Storage Location:0001,Storage Location Description:Lager 0001,Plant:0001,Section Id:8,Section Header:Exposure controls / personal protection,Section Content:Exposure Guidelines\nComponent\nAcetone\nACGIH TLV\nTWA: 500 ppm\nSTEL: 750 ppm\nOSHA PEL\n(Vacated) TWA: 750 ppm\n(Vacated) TWA: 1800 mg/m³\n(Vacated) STEL: 2400 mg/m³\n(Vacated) STEL: 1000 ppm\nTWA: 1000 ppm\nTWA: 2400 mg/m³\nNIOSH IDLH\nIDLH: 2500 ppm\nTWA: 250 ppm\nTWA: 590 mg/m³\nLegend\nComponent\nAcetone\nQuebec\nTWA: 500 ppm\nTWA: 1190 mg/m³\nSTEL: 1000 ppm\nSTEL: 2380 mg/m³\nMexico OEL (TWA)\nTWA: 1000 ppm\nTWA: 2400 mg/m³\nSTEL: 1260 ppm\nSTEL: 3000 mg/m³\nOntario TWAEV\nTWA: 500 ppm\nSTEL: 750 ppm\nACGIH - American Conference of Governmental Industrial Hygienists\nOSHA - Occupational Safety and Health Administration\nNIOSH IDLH: The National Institute for Occupational Safety and Health Immediately Dangerous to Life or Health\nEngineering Measures Ensure adequate ventilation, especially in confined areas. Ensure that eyewash stations\nand safety showers are close to the workstation location. Use explosion-proof\nelectrical/ventilating/lighting/equipment.\nPersonal Protective Equipment\nEye/face Protection Wear appropriate protective eyeglasses or chemical safety goggles as described by\nOSHA's eye and face protection regulations in 29 CFR 1910.133 or European Standard\nEN166.\nSkin and body protection Wear appropriate protective gloves and clothing to prevent skin exposure.\nRespiratory Protection Follow the OSHA respirator regulations found in 29 CFR 1910.134 or European Standard\nEN 149. Use a NIOSH/MSHA or European Standard EN 149 approved respirator if\nexposure limits are exceeded or if irritation or other symptoms are experienced.\nHygiene Measures Handle in accordance with good industrial hygiene and safety practice."}