{"GUID":"AkKsEQACHt+fl92lpuTowg==","MATNR":"HZ-OXY","MAKTX":"Oxygen","WERKS":"0001","LGORT":"0001","LGOBE":"Lager 0001","SECTION_ID":2,"SECTION_HEADER":"Hazard identification","SECTION_CONTENT":"OSHA/HCS status : This material is considered hazardous by the OSHA Hazard Communication Standard\n(29 CFR 1910.1200).\nClassification of the\nsubstance or mixture : OXIDIZING GASES - Category 1\nGASES UNDER PRESSURE - Compressed gas\nGHS label elements\nHazard pictograms : \nSignal word : Danger\nHazard statements : May cause or intensify fire; oxidizer.\nContains gas under pressure; may explode if heated.\nPrecautionary statements\nGeneral : Read and follow all Safety Data Sheets (SDS'S) before use. Read label before use.\nKeep out of reach of children. If medical advice is needed, have product container or\nlabel at hand. Close valve after each use and when empty. Use equipment rated for\ncylinder pressure. Do not open valve until connected to equipment prepared for use.\nUse a back flow preventative device in the piping. Use only equipment of compatible\nmaterials of construction. Open valve slowly. Use only with equipment cleaned for\nOxygen service.\nPrevention : Keep away from clothing and other combustible materials. Keep reduction valves,\nvalves and fittings free from oil and grease.\nResponse : In case of fire: Stop leak if safe to do so.\nStorage : Protect from sunlight. Store in a well-ventilated place.\nDisposal : Not applicable.\nHazards not otherwise\nclassified : None known.","REVISED_CONTENT":"Product ID:HZ-OXY,Product Description:Oxygen,Storage Location:0001,Storage Location Description:Lager 0001,Plant:0001,Section Id:2,Section Header:Hazard identification,Section Content:OSHA/HCS status : This material is considered hazardous by the OSHA Hazard Communication Standard\n(29 CFR 1910.1200).\nClassification of the\nsubstance or mixture : OXIDIZING GASES - Category 1\nGASES UNDER PRESSURE - Compressed gas\nGHS label elements\nHazard pictograms : \nSignal word : Danger\nHazard statements : May cause or intensify fire; oxidizer.\nContains gas under pressure; may explode if heated.\nPrecautionary statements\nGeneral : Read and follow all Safety Data Sheets (SDS'S) before use. Read label before use.\nKeep out of reach of children. If medical advice is needed, have product container or\nlabel at hand. Close valve after each use and when empty. Use equipment rated for\ncylinder pressure. Do not open valve until connected to equipment prepared for use.\nUse a back flow preventative device in the piping. Use only equipment of compatible\nmaterials of construction. Open valve slowly. Use only with equipment cleaned for\nOxygen service.\nPrevention : Keep away from clothing and other combustible materials. Keep reduction valves,\nvalves and fittings free from oil and grease.\nResponse : In case of fire: Stop leak if safe to do so.\nStorage : Protect from sunlight. Store in a well-ventilated place.\nDisposal : Not applicable.\nHazards not otherwise\nclassified : None known."}