{"GUID":"AkKsEQACHt+fl92lrPSIwg==","MATNR":"HZ-SUL","MAKTX":"Sulfur","WERKS":"0001","LGORT":"0001","LGOBE":"Lager 0001","SECTION_ID":15,"SECTION_HEADER":"Regulatory information","SECTION_CONTENT":"15.1. US Federal Regulations\nSulfur\nSARA Section 311/312 Hazard Classes\nPhysical hazard - Flammable (gases, aerosols, liquids, or solids)\nPhysical hazard - Combustible dust\nHealth hazard - Skin corrosion or Irritation\nSulfur (7704-34-9)\nListed on the United States TSCA (Toxic Substances Control Act) inventory\nHydrogen sulfide (7783-06-4)\nListed on the United States TSCA (Toxic Substances Control Act) inventory\nListed on the United States SARA Section 302\nSubject to reporting requirements of United States SARA Section 313\nCERCLA RQ\nSARA Section 302 Threshold Planning Quantity (TPQ)\nSARA Section 313 - Emission Reporting\n15.2.\nUS State Regulations\nSulfur (7704-34-9)\nU.S. - Massachusetts - Right To Know List\nU.S. - New Jersey - Right to Know Hazardous Substance List\nU.S. - Pennsylvania - RTK (Right to Know) List\nHydrogen sulfide (7783-06-4)\nU.S. - Massachusetts - Right To Know List\nU.S. - New Jersey - Right to Know Hazardous Substance List\nU.S. - Pennsylvania - RTK (Right to Know) - Environmental Hazard List\nU.S. - Pennsylvania - RTK (Right to Know) List","REVISED_CONTENT":"Product ID:HZ-SUL,Product Description:Sulfur,Storage Location:0001,Storage Location Description:Lager 0001,Plant:0001,Section Id:15,Section Header:Regulatory information,Section Content:15.1. US Federal Regulations\nSulfur\nSARA Section 311/312 Hazard Classes\nPhysical hazard - Flammable (gases, aerosols, liquids, or solids)\nPhysical hazard - Combustible dust\nHealth hazard - Skin corrosion or Irritation\nSulfur (7704-34-9)\nListed on the United States TSCA (Toxic Substances Control Act) inventory\nHydrogen sulfide (7783-06-4)\nListed on the United States TSCA (Toxic Substances Control Act) inventory\nListed on the United States SARA Section 302\nSubject to reporting requirements of United States SARA Section 313\nCERCLA RQ\nSARA Section 302 Threshold Planning Quantity (TPQ)\nSARA Section 313 - Emission Reporting\n15.2.\nUS State Regulations\nSulfur (7704-34-9)\nU.S. - Massachusetts - Right To Know List\nU.S. - New Jersey - Right to Know Hazardous Substance List\nU.S. - Pennsylvania - RTK (Right to Know) List\nHydrogen sulfide (7783-06-4)\nU.S. - Massachusetts - Right To Know List\nU.S. - New Jersey - Right to Know Hazardous Substance List\nU.S. - Pennsylvania - RTK (Right to Know) - Environmental Hazard List\nU.S. - Pennsylvania - RTK (Right to Know) List"}