{"GUID":"AkKsEQACHt+fl92lptpowg==","MATNR":"HZ-MAL","MAKTX":"Malathion","WERKS":"0001","LGORT":"0088","LGOBE":"Lager 0088 (WM)","SECTION_ID":14,"SECTION_HEADER":"Transport information","SECTION_CONTENT":"DOT (US)\nUN number: 3082 Class: 9\nPacking group: III\nProper shipping name: Environmentally hazardous substance, liquid, n.o.s. (Malathion)\nReportable Quantity (RQ): 100 lbs\nMarine pollutant: yes\nPoison Inhalation Hazard: No\nIMDG\nUN number: 3082 Class: 9\nPacking group: III\nEMS-No: F-A, S-F\nProper shipping name: ENVIRONMENTALLY HAZARDOUS SUBSTANCE, LIQUID, N.O.S.\n(Malathion)\nMarine pollutant : yes\nMarine pollutant: no\nIATA\nUN number: 3082 Class: 9\nPacking group: III\nProper shipping name: Environmentally hazardous substance, liquid, n.o.s. (Malathion)\nFurther information\nEHS-Mark required (ADR 2.2.9.1.10, IMDG code 2.10.3) for single packagings and\ncombination packagings containing inner packagings with Dangerous Goods > 5L for liquids\nor > 5kg for solids.","REVISED_CONTENT":"Product ID:HZ-MAL,Product Description:Malathion,Storage Location:0088,Storage Location Description:Lager 0088 (WM),Plant:0001,Section Id:14,Section Header:Transport information,Section Content:DOT (US)\nUN number: 3082 Class: 9\nPacking group: III\nProper shipping name: Environmentally hazardous substance, liquid, n.o.s. (Malathion)\nReportable Quantity (RQ): 100 lbs\nMarine pollutant: yes\nPoison Inhalation Hazard: No\nIMDG\nUN number: 3082 Class: 9\nPacking group: III\nEMS-No: F-A, S-F\nProper shipping name: ENVIRONMENTALLY HAZARDOUS SUBSTANCE, LIQUID, N.O.S.\n(Malathion)\nMarine pollutant : yes\nMarine pollutant: no\nIATA\nUN number: 3082 Class: 9\nPacking group: III\nProper shipping name: Environmentally hazardous substance, liquid, n.o.s. (Malathion)\nFurther information\nEHS-Mark required (ADR 2.2.9.1.10, IMDG code 2.10.3) for single packagings and\ncombination packagings containing inner packagings with Dangerous Goods > 5L for liquids\nor > 5kg for solids."}