{"GUID":"AkKsEQACHt+fl92loTGIwg==","MATNR":"HZ-ATR","MAKTX":"Atrazine","WERKS":"0001","LGORT":"0088","LGOBE":"Lager 0088 (WM)","SECTION_ID":5,"SECTION_HEADER":"Fire-fighting measures","SECTION_CONTENT":"Flammability of the Product: May be combustible at high temperature.\nAuto-Ignition Temperature: Not available.\nFlash Points: Not available.\nFlammable Limits: Not available.\nProduct of Combustion: Carbon monoxide, Carbon dioxide.\nFire Hazards in Presence of Various Substances: Not available.\nExplosion Hazards in Presence of Various Substances:\nNot available.\nFire Fighting Media and Instructions:\nSMALL FIRE: Dry chemical powder.\nLARGE FIRE: Water spray. Carbon dioxide, dry chemical powder, or appropriate foam.\nSpecial Remarks on Fire Hazards: Not available.\nSpecial Remarks on Explosion Hazards: Not available.","REVISED_CONTENT":"Product ID:HZ-ATR,Product Description:Atrazine,Storage Location:0088,Storage Location Description:Lager 0088 (WM),Plant:0001,Section Id:5,Section Header:Fire-fighting measures,Section Content:Flammability of the Product: May be combustible at high temperature.\nAuto-Ignition Temperature: Not available.\nFlash Points: Not available.\nFlammable Limits: Not available.\nProduct of Combustion: Carbon monoxide, Carbon dioxide.\nFire Hazards in Presence of Various Substances: Not available.\nExplosion Hazards in Presence of Various Substances:\nNot available.\nFire Fighting Media and Instructions:\nSMALL FIRE: Dry chemical powder.\nLARGE FIRE: Water spray. Carbon dioxide, dry chemical powder, or appropriate foam.\nSpecial Remarks on Fire Hazards: Not available.\nSpecial Remarks on Explosion Hazards: Not available."}