{"GUID":"AkKsEQACHt+fl92loTPowg==","MATNR":"HZ-BEN","MAKTX":"Benzene","WERKS":"0001","LGORT":"0001","LGOBE":"Lager 0001","SECTION_ID":8,"SECTION_HEADER":"Exposure controls/personal protection","SECTION_CONTENT":"· Additional information about design of technical systems: No further data; see item 7.\nControl parameters\nComponents with limit values that require monitoring at the workplace:\n71-43-2 benzene\nPEL Short-term value: 15* mg/m³, 5* ppm\nLong-term value: 3* mg/m³, 1* ppm\n*table Z-2 for exclusions in 29CFR1910.1028(d)\nREL Short-term value: 1 ppm\nLong-term value: 0.1 ppm\nSee Pocket Guide App. A\nTLV Short-term value: 8 mg/m³, 2.5 ppm\nLong-term value: 1.6 mg/m³, 0.5 ppm\nSkin; BEI\n• Ingredients with biological limit values:\n71-43-2 benzene\nBEI 25 µg/g creatinine\nMedium: urine\nTime: end of shift Parameter\nParameter: S-Phenylmercapturic acid (background\n500 µg/g creatinine\nMedium: urine\nTime: end of shift\nParameter: t,t-Muconic acid (background)\n· Additional information: The lists that were valid during the creation were used as basis.\nExposure controls\nPersonal protective equipment:\nGeneral protective and hygienic measures:\nKeep away from foodstuffs, beverages and feed.\nImmediately remove all soiled and contaminated clothing.\nWash hands before breaks and at the end of work.\nStore protective clothing separately.\nAvoid contact with the eyes and skin.\n· Breathing equipment:\nWhen used as intended with Agilent instruments, the use of the product under normal laboratory conditions and\nwith standard practices does not result in significant airborne exposures and therefore respiratory protection is not\nneeded.\nUnder an emergency condition where a respirator is deemed necessary, use a NIOSH or equivalent approved\ndevice/equipment with appropriate organic or acid gas cartridge.\nProtection of hands:\nAlthough not recommended for constant contact with the chemicals or for clean-up, nitrile gloves 11-13 mil\nthickness are recommended for normal use. The breakthrough time is 1 hr. For cleaning a spill where there is\ndirect contact of the chemical, butyl rubber gloves are recommended 12-15 mil thickness with breakthrough times\nexceeding 4 hrs. Supplier recommendations should be followed.","REVISED_CONTENT":"Product ID:HZ-BEN,Product Description:Benzene,Storage Location:0001,Storage Location Description:Lager 0001,Plant:0001,Section Id:8,Section Header:Exposure controls/personal protection,Section Content:· Additional information about design of technical systems: No further data; see item 7.\nControl parameters\nComponents with limit values that require monitoring at the workplace:\n71-43-2 benzene\nPEL Short-term value: 15* mg/m³, 5* ppm\nLong-term value: 3* mg/m³, 1* ppm\n*table Z-2 for exclusions in 29CFR1910.1028(d)\nREL Short-term value: 1 ppm\nLong-term value: 0.1 ppm\nSee Pocket Guide App. A\nTLV Short-term value: 8 mg/m³, 2.5 ppm\nLong-term value: 1.6 mg/m³, 0.5 ppm\nSkin; BEI\n• Ingredients with biological limit values:\n71-43-2 benzene\nBEI 25 µg/g creatinine\nMedium: urine\nTime: end of shift Parameter\nParameter: S-Phenylmercapturic acid (background\n500 µg/g creatinine\nMedium: urine\nTime: end of shift\nParameter: t,t-Muconic acid (background)\n· Additional information: The lists that were valid during the creation were used as basis.\nExposure controls\nPersonal protective equipment:\nGeneral protective and hygienic measures:\nKeep away from foodstuffs, beverages and feed.\nImmediately remove all soiled and contaminated clothing.\nWash hands before breaks and at the end of work.\nStore protective clothing separately.\nAvoid contact with the eyes and skin.\n· Breathing equipment:\nWhen used as intended with Agilent instruments, the use of the product under normal laboratory conditions and\nwith standard practices does not result in significant airborne exposures and therefore respiratory protection is not\nneeded.\nUnder an emergency condition where a respirator is deemed necessary, use a NIOSH or equivalent approved\ndevice/equipment with appropriate organic or acid gas cartridge.\nProtection of hands:\nAlthough not recommended for constant contact with the chemicals or for clean-up, nitrile gloves 11-13 mil\nthickness are recommended for normal use. The breakthrough time is 1 hr. For cleaning a spill where there is\ndirect contact of the chemical, butyl rubber gloves are recommended 12-15 mil thickness with breakthrough times\nexceeding 4 hrs. Supplier recommendations should be followed."}