{"GUID":"AkKsEQACHt+fl92lo2BIwg==","MATNR":"HZ-GAS","MAKTX":"Gasoline","WERKS":"0001","LGORT":"0001","LGOBE":"Lager 0001","SECTION_ID":9,"SECTION_HEADER":"Physical and chemical properties","SECTION_CONTENT":"Note: Physical and chemical properties are provided for safety, health and environmental considerations only\nand may not fully represent product specifications. Contact the Supplier for additional information.\nGENERAL INFORMATION\nPhysical State: Liquid\nColour: Pale Yellow\nOdour: Characteristic\nOdour Threshold:\nN/D\nIMPORTANT HEALTH, SAFETY, AND ENVIRONMENTAL INFORMATION\nRelative Density (at 15 °C):\n< 1\nDensity (at 15 °C): 620 kg/m3 (5.17 lbs/gal, 0.62 kg/dm3) - 880 kg/m3 (7.34 lbs/gal, 0.88 kg/dm3)\nFlammability (Solid, Gas): N/A\nFlash Point [Method]: <-35°C (-31°F) [IP 170/70]\nFlammable Limits (Approximate volume % in air): LEL: 1.4\nUEL: 7.6\nAutoignition Temperature: >250°C (482°F)\nDecomposition Temperature: N/D\nVapour Density (Air = 1): > 1 at 101 kPa\nBoiling Point / Range: 28°C (82°F) - 210°C (410°F) [ASTM D86]\nVapour Pressure: [N/D at 20°C] | 4 kPa (30 mm Hg) at 37.8 °C - 240 kPa (1800 mm Hg) at 37.8°C\nEvaporation Rate (n-butyl acetate = 1):\n> 3.5\npH:\nN/D\nLog Pow (n-Octanol/Water Partition Coefficient):\nN/A\nSolubility in Water: Negligible for the hydrocarbon components. Ether oxygenates are significantly more\nsoluble.\nViscosity: <1 cSt (1 mm2/sec) at 40°C\nOxidizing Properties: See Hazards Identification Section.\nOTHER INFORMATION\nFreezing Point:\nN/D\nMelting Point:\nN/D","REVISED_CONTENT":"Product ID:HZ-GAS,Product Description:Gasoline,Storage Location:0001,Storage Location Description:Lager 0001,Plant:0001,Section Id:9,Section Header:Physical and chemical properties,Section Content:Note: Physical and chemical properties are provided for safety, health and environmental considerations only\nand may not fully represent product specifications. Contact the Supplier for additional information.\nGENERAL INFORMATION\nPhysical State: Liquid\nColour: Pale Yellow\nOdour: Characteristic\nOdour Threshold:\nN/D\nIMPORTANT HEALTH, SAFETY, AND ENVIRONMENTAL INFORMATION\nRelative Density (at 15 °C):\n< 1\nDensity (at 15 °C): 620 kg/m3 (5.17 lbs/gal, 0.62 kg/dm3) - 880 kg/m3 (7.34 lbs/gal, 0.88 kg/dm3)\nFlammability (Solid, Gas): N/A\nFlash Point [Method]: <-35°C (-31°F) [IP 170/70]\nFlammable Limits (Approximate volume % in air): LEL: 1.4\nUEL: 7.6\nAutoignition Temperature: >250°C (482°F)\nDecomposition Temperature: N/D\nVapour Density (Air = 1): > 1 at 101 kPa\nBoiling Point / Range: 28°C (82°F) - 210°C (410°F) [ASTM D86]\nVapour Pressure: [N/D at 20°C] | 4 kPa (30 mm Hg) at 37.8 °C - 240 kPa (1800 mm Hg) at 37.8°C\nEvaporation Rate (n-butyl acetate = 1):\n> 3.5\npH:\nN/D\nLog Pow (n-Octanol/Water Partition Coefficient):\nN/A\nSolubility in Water: Negligible for the hydrocarbon components. Ether oxygenates are significantly more\nsoluble.\nViscosity: <1 cSt (1 mm2/sec) at 40°C\nOxidizing Properties: See Hazards Identification Section.\nOTHER INFORMATION\nFreezing Point:\nN/D\nMelting Point:\nN/D"}