{"GUID":"AkKsEQACHt+fl92loTYIwg==","MATNR":"HZ-BUT","MAKTX":"Butane","WERKS":"0001","LGORT":"0001","LGOBE":"Lager 0001","SECTION_ID":9,"SECTION_HEADER":"Physical and chemical properties","SECTION_CONTENT":"SECTION 9: Physical and chemical properties\n9.1 Information on basic physical and chemical properties\na) Appearance\nForm: gaseous\nb) Odor\nodorless\nc) Odor Threshold\nNo data available\nd) pH\nNo data available\ne) Melting\npoint/freezing point\nMelting point/range: -138 °C (-216 °F) - lit.\nf) Initial boiling point\nand boiling range\n-0.5 °C 31.1 °F - lit.\ng) Flash point\nNo data available\nh) Evaporation rate\nNo data available\ni) Flammability (solid,\ngas)\nNo data available\nj) Upper/lower\nflammability or\nexplosive limits\nUpper explosion limit: 8.4%(V)\nLower explosion limit: 1.8%(V)\nk) Vapor pressure\n3,556.67 hPa at 37.7 °C (99.9 °F)\nl) Vapor density\n2.33\nm) Density\n0.579 g/mL at 20 °C (68 °F) - lit.\nn) Water solubility\nNo data available\no) Partition coefficient:\nn-octanol/water\nlog Pow: 2.89\np) Autoignition\ntemperature\nNo data available\nq) Decomposition\ntemperature\nNo data available\nr) Viscosity\nNo data available\ns) Explosive properties No data available\nt) Oxidizing properties\nnone\n9.2 Other safety information\nRelative vapor\ndensity\n2.33","REVISED_CONTENT":"Product ID:HZ-BUT,Product Description:Butane,Storage Location:0001,Storage Location Description:Lager 0001,Plant:0001,Section Id:9,Section Header:Physical and chemical properties,Section Content:SECTION 9: Physical and chemical properties\n9.1 Information on basic physical and chemical properties\na) Appearance\nForm: gaseous\nb) Odor\nodorless\nc) Odor Threshold\nNo data available\nd) pH\nNo data available\ne) Melting\npoint/freezing point\nMelting point/range: -138 °C (-216 °F) - lit.\nf) Initial boiling point\nand boiling range\n-0.5 °C 31.1 °F - lit.\ng) Flash point\nNo data available\nh) Evaporation rate\nNo data available\ni) Flammability (solid,\ngas)\nNo data available\nj) Upper/lower\nflammability or\nexplosive limits\nUpper explosion limit: 8.4%(V)\nLower explosion limit: 1.8%(V)\nk) Vapor pressure\n3,556.67 hPa at 37.7 °C (99.9 °F)\nl) Vapor density\n2.33\nm) Density\n0.579 g/mL at 20 °C (68 °F) - lit.\nn) Water solubility\nNo data available\no) Partition coefficient:\nn-octanol/water\nlog Pow: 2.89\np) Autoignition\ntemperature\nNo data available\nq) Decomposition\ntemperature\nNo data available\nr) Viscosity\nNo data available\ns) Explosive properties No data available\nt) Oxidizing properties\nnone\n9.2 Other safety information\nRelative vapor\ndensity\n2.33"}