{"GUID":"AkKsEQACHt+fl92lo1mowg==","MATNR":"HZ-CMO","MAKTX":"Carbon monoxide","WERKS":"0001","LGORT":"0001","LGOBE":"Lager 0001","SECTION_ID":4,"SECTION_HEADER":"First-aid measures","SECTION_CONTENT":"Description of first aid measures\nFirst-aid measures after inhalation\nFirst-aid measures after skin contact\nFirst-aid measures after eye contact\nFirst-aid measures after ingestion\nMost important symptoms and effects (acute and delayed)\nSymptoms/effects after inhalation\nSymptoms/effects after skin contact\nSymptoms/effects after eye contact\nSymptoms/effects after ingestion\nSymptoms/effects upon intravenous\nadministration\nMost important symptoms and effects, both\nacute and delayed\nChronic symptoms\n: Remove victim to fresh air and keep at rest in a position comfortable for breathing. Apply\nartificial respiration with bag and mask if breathing stopped. Get immediate medical\nadvice/attention.\n: Adverse effects not expected from this product.\n: Adverse effects not expected from this product.\n: Ingestion is not considered a potential route of exposure.\n: Toxic if inhaled.\n: Adverse effects not expected from this product.\n: Adverse effects not expected from this product.\n: Ingestion is not considered a potential route of exposure.\n: Not known.\n: Symptoms may include dizziness, headache, nausea and loss of co-ordination. Delayed\nadverse effects possible. Refer to section 11.\n: May damage fertility. May damage the unborn child. Causes damage to organs (central\nnervous system) through prolonged or repeated exposure (Inhalation).","REVISED_CONTENT":"Product ID:HZ-CMO,Product Description:Carbon monoxide,Storage Location:0001,Storage Location Description:Lager 0001,Plant:0001,Section Id:4,Section Header:First-aid measures,Section Content:Description of first aid measures\nFirst-aid measures after inhalation\nFirst-aid measures after skin contact\nFirst-aid measures after eye contact\nFirst-aid measures after ingestion\nMost important symptoms and effects (acute and delayed)\nSymptoms/effects after inhalation\nSymptoms/effects after skin contact\nSymptoms/effects after eye contact\nSymptoms/effects after ingestion\nSymptoms/effects upon intravenous\nadministration\nMost important symptoms and effects, both\nacute and delayed\nChronic symptoms\n: Remove victim to fresh air and keep at rest in a position comfortable for breathing. Apply\nartificial respiration with bag and mask if breathing stopped. Get immediate medical\nadvice/attention.\n: Adverse effects not expected from this product.\n: Adverse effects not expected from this product.\n: Ingestion is not considered a potential route of exposure.\n: Toxic if inhaled.\n: Adverse effects not expected from this product.\n: Adverse effects not expected from this product.\n: Ingestion is not considered a potential route of exposure.\n: Not known.\n: Symptoms may include dizziness, headache, nausea and loss of co-ordination. Delayed\nadverse effects possible. Refer to section 11.\n: May damage fertility. May damage the unborn child. Causes damage to organs (central\nnervous system) through prolonged or repeated exposure (Inhalation)."}