{"GUID":"AkKsEQACHt+fl92lo19owg==","MATNR":"HZ-GAS","MAKTX":"Gasoline","WERKS":"0001","LGORT":"0001","LGOBE":"Lager 0001","SECTION_ID":2,"SECTION_HEADER":"Hazard identification","SECTION_CONTENT":"This material is hazardous according to UN GHS Criteria. Classification includes all GHS hazard classes. For hazard\ncategories with two cut-off/concentration limits, classification was based on the higher limit.\nGHS CLASSIFICATION:\nFlammable liquid: Category 1.\nSkin irritation: Category 2.\nGerm Cell Mutagen: Category 1B.\nCarcinogen: Category 1B.\nReproductive toxicant (developmental): Category 2.\nSpecific target organ toxicant (central nervous system): Category 3.\nAspiration toxicant: Category 1.\nAcute aquatic toxicant: Category 2.\nChronic aquatic toxicant: Category 2.\nGHS Label Elements:\nPictogram:\n!\nSignal Word: Danger\nHazard Statements:\nPhysical:\nH224: Extremely flammable liquid and vapour.\nHealth:\nH304: May be fatal if swallowed and enters airways. H315: Causes skin irritation. H336: May\ncause drowsiness or dizziness. H340: May cause genetic defects.\nH350: May cause cancer. H361: Suspected","REVISED_CONTENT":"Product ID:HZ-GAS,Product Description:Gasoline,Storage Location:0001,Storage Location Description:Lager 0001,Plant:0001,Section Id:2,Section Header:Hazard identification,Section Content:This material is hazardous according to UN GHS Criteria. Classification includes all GHS hazard classes. For hazard\ncategories with two cut-off/concentration limits, classification was based on the higher limit.\nGHS CLASSIFICATION:\nFlammable liquid: Category 1.\nSkin irritation: Category 2.\nGerm Cell Mutagen: Category 1B.\nCarcinogen: Category 1B.\nReproductive toxicant (developmental): Category 2.\nSpecific target organ toxicant (central nervous system): Category 3.\nAspiration toxicant: Category 1.\nAcute aquatic toxicant: Category 2.\nChronic aquatic toxicant: Category 2.\nGHS Label Elements:\nPictogram:\n!\nSignal Word: Danger\nHazard Statements:\nPhysical:\nH224: Extremely flammable liquid and vapour.\nHealth:\nH304: May be fatal if swallowed and enters airways. H315: Causes skin irritation. H336: May\ncause drowsiness or dizziness. H340: May cause genetic defects.\nH350: May cause cancer. H361: Suspected"}