{"GUID":"AkKsEQACHt+fl92lrOcowg==","MATNR":"HZ-PRO","MAKTX":"Propane","WERKS":"0001","LGORT":"0001","LGOBE":"Lager 0001","SECTION_ID":4,"SECTION_HEADER":"First-aid measures","SECTION_CONTENT":"Remove victim to fresh air and keep at rest in a position comfortable for breathing. If you feel\nunwell, seek medical advice.\nThaw frosted parts with lukewarm water. Do not rub affected area. Get immediate medical\nadvice/attention.\nImmediately flush eyes thoroughly with water for at least 15 minutes. Remove contact lenses, if\npresent and easy to do. Continue rinsing. Get immediate medical advice/attention.\nIngestion is not considered a potential route of exposure.\nMay displace oxygen and cause rapid suffocation.\nMay cause frostbite.\nContact with the product may cause cold burns or frostbite.\nIngestion is not considered a potential route of exposure.\nNot known.\nIn high concentrations may cause asphyxiation. Symptoms may include loss of\nmobility/consciousness. Victim may not be aware of asphyxiation. In low concentrations may\ncause narcotic effects. Symptoms may include dizziness, headache, nausea and loss of co-\nordination.\nAdverse effects not expected from this product.\nIf you feel unwell, seek medical advice. If breathing is difficult, give oxygen.","REVISED_CONTENT":"Product ID:HZ-PRO,Product Description:Propane,Storage Location:0001,Storage Location Description:Lager 0001,Plant:0001,Section Id:4,Section Header:First-aid measures,Section Content:Remove victim to fresh air and keep at rest in a position comfortable for breathing. If you feel\nunwell, seek medical advice.\nThaw frosted parts with lukewarm water. Do not rub affected area. Get immediate medical\nadvice/attention.\nImmediately flush eyes thoroughly with water for at least 15 minutes. Remove contact lenses, if\npresent and easy to do. Continue rinsing. Get immediate medical advice/attention.\nIngestion is not considered a potential route of exposure.\nMay displace oxygen and cause rapid suffocation.\nMay cause frostbite.\nContact with the product may cause cold burns or frostbite.\nIngestion is not considered a potential route of exposure.\nNot known.\nIn high concentrations may cause asphyxiation. Symptoms may include loss of\nmobility/consciousness. Victim may not be aware of asphyxiation. In low concentrations may\ncause narcotic effects. Symptoms may include dizziness, headache, nausea and loss of co-\nordination.\nAdverse effects not expected from this product.\nIf you feel unwell, seek medical advice. If breathing is difficult, give oxygen."}