{"GUID":"AkKsEQACHt+fl92lo1nIwg==","MATNR":"HZ-CMO","MAKTX":"Carbon monoxide","WERKS":"0001","LGORT":"0001","LGOBE":"Lager 0001","SECTION_ID":5,"SECTION_HEADER":"Fire-fighting measures","SECTION_CONTENT":"Suitable (and unsuitable) extinguishing media\nSuitable extinguishing media\nUnsuitable extinguishing media\nSpecific hazards arising from the chemical\nFire hazard\nExplosion hazard\nReactivity\nHazardous combustion products\nSpecial protective equipment and precautions for fire-fighters\nFirefighting instructions\nProtection during firefighting\n: Use extinguishing media appropriate for surrounding fire.\n: Do not use water jet to extinguish.\n: This product is flammable.\n: Heat may build pressure, rupturing closed containers, spreading fire and increasing risk of\nburns and injuries. May form flammable/explosive vapor-air mixture.\n: None known.\n: None.\n: In case of fire: Evacuate area. Fight fire remotely due to the risk of explosion. Use water spray\nor fog for cooling exposed containers. Exercise caution when fighting any chemical fire.\n: Standard protective clothing and equipment (e.g, Self Contained Breathing Apparatus) for fire\nfighters. Do not enter fire area without proper protective equipment, including respiratory\nprotection.","REVISED_CONTENT":"Product ID:HZ-CMO,Product Description:Carbon monoxide,Storage Location:0001,Storage Location Description:Lager 0001,Plant:0001,Section Id:5,Section Header:Fire-fighting measures,Section Content:Suitable (and unsuitable) extinguishing media\nSuitable extinguishing media\nUnsuitable extinguishing media\nSpecific hazards arising from the chemical\nFire hazard\nExplosion hazard\nReactivity\nHazardous combustion products\nSpecial protective equipment and precautions for fire-fighters\nFirefighting instructions\nProtection during firefighting\n: Use extinguishing media appropriate for surrounding fire.\n: Do not use water jet to extinguish.\n: This product is flammable.\n: Heat may build pressure, rupturing closed containers, spreading fire and increasing risk of\nburns and injuries. May form flammable/explosive vapor-air mixture.\n: None known.\n: None.\n: In case of fire: Evacuate area. Fight fire remotely due to the risk of explosion. Use water spray\nor fog for cooling exposed containers. Exercise caution when fighting any chemical fire.\n: Standard protective clothing and equipment (e.g, Self Contained Breathing Apparatus) for fire\nfighters. Do not enter fire area without proper protective equipment, including respiratory\nprotection."}