{"GUID":"AkKsEQACHt+fl92lpuEowg==","MATNR":"HZ-NAC","MAKTX":"Nitric acid","WERKS":"0001","LGORT":"0003","LGOBE":"Corrosive Items","SECTION_ID":4,"SECTION_HEADER":"First-aid measures","SECTION_CONTENT":"General advice : First aider needs to protect himself. Move out of dangerous\n: area. Immediately take off contaminated clothing and rinse\nbody with plenty of water.\nInhalation : Remove to fresh air. If breathing is difficult, give oxygen. Use\noxygen as required, provided a qualified operator is present.\nCall a physician immediately.\nSkin contact : Wash off immediately with plenty of water for at least 15\nminutes. Take off contaminated clothing and shoes immediately.\nWash contaminated clothing before re-use. Call a physician\nimmediately.\nEye contact : Protect unharmed eye. Irrigate eyes for at least 15 minutes with\ncopious quantities of water, keeping eyelids apart and away\nIngestion : from eyeballs during irrigation. Call a physician immediately.\n: Gently wipe or rinse the inside of the mouth with water. Do NOT\ninduce vomiting. Call a physician immediately.\nNotes to physician\nMost important\nsymptoms/effects, acute and\ndeleyed : No information available\nIndication of immediate\nmedical attention and\nspecial treatment needed, if\nnecessary : Health injuries may be delayed. Medical supervision for\nminimum 48 hours.","REVISED_CONTENT":"Product ID:HZ-NAC,Product Description:Nitric acid,Storage Location:0003,Storage Location Description:Corrosive Items,Plant:0001,Section Id:4,Section Header:First-aid measures,Section Content:General advice : First aider needs to protect himself. Move out of dangerous\n: area. Immediately take off contaminated clothing and rinse\nbody with plenty of water.\nInhalation : Remove to fresh air. If breathing is difficult, give oxygen. Use\noxygen as required, provided a qualified operator is present.\nCall a physician immediately.\nSkin contact : Wash off immediately with plenty of water for at least 15\nminutes. Take off contaminated clothing and shoes immediately.\nWash contaminated clothing before re-use. Call a physician\nimmediately.\nEye contact : Protect unharmed eye. Irrigate eyes for at least 15 minutes with\ncopious quantities of water, keeping eyelids apart and away\nIngestion : from eyeballs during irrigation. Call a physician immediately.\n: Gently wipe or rinse the inside of the mouth with water. Do NOT\ninduce vomiting. Call a physician immediately.\nNotes to physician\nMost important\nsymptoms/effects, acute and\ndeleyed : No information available\nIndication of immediate\nmedical attention and\nspecial treatment needed, if\nnecessary : Health injuries may be delayed. Medical supervision for\nminimum 48 hours."}