{"GUID":"AkKsEQACHt+fl92lpsjIwg==","MATNR":"HZ-GLY","MAKTX":"Glyphosate","WERKS":"0001","LGORT":"0088","LGOBE":"Lager 0088 (WM)","SECTION_ID":1,"SECTION_HEADER":"Identification","SECTION_CONTENT":"Product Name\nGlyphosate\nCat No. : AC466180000; AC466180010; AC466180050\nCAS No 1071-83-6\nSynonyms No information available\nRecommended Use Laboratory chemicals.\nUses advised against Food, drug, pesticide or biocidal product use.\nDetails of the supplier of the safety data sheet\nCompany Fisher Scientific Company One Reagent Lane\nFair Lawn, NJ 07410\nTel: (201) 796-7100\nEmergency Telephone Number For information US call: 001-800-ACROS-01 / Europe call: +32 14 57 52 11\nEmergency Number US:001-201-796-7100 / Europe: +32 14 57 52 99\nCHEMTREC Tel. No.US:001-800-424-9300 / Europe:001-703-527-3887","REVISED_CONTENT":"Product ID:HZ-GLY,Product Description:Glyphosate,Storage Location:0088,Storage Location Description:Lager 0088 (WM),Plant:0001,Section Id:1,Section Header:Identification,Section Content:Product Name\nGlyphosate\nCat No. : AC466180000; AC466180010; AC466180050\nCAS No 1071-83-6\nSynonyms No information available\nRecommended Use Laboratory chemicals.\nUses advised against Food, drug, pesticide or biocidal product use.\nDetails of the supplier of the safety data sheet\nCompany Fisher Scientific Company One Reagent Lane\nFair Lawn, NJ 07410\nTel: (201) 796-7100\nEmergency Telephone Number For information US call: 001-800-ACROS-01 / Europe call: +32 14 57 52 11\nEmergency Number US:001-201-796-7100 / Europe: +32 14 57 52 99\nCHEMTREC Tel. No.US:001-800-424-9300 / Europe:001-703-527-3887"}