{"GUID":"AkKsEQACHt+fl92loTOowg==","MATNR":"HZ-BEN","MAKTX":"Benzene","WERKS":"0001","LGORT":"0001","LGOBE":"Lager 0001","SECTION_ID":6,"SECTION_HEADER":"Accidental release measures","SECTION_CONTENT":"Personal precautions, protective equipment and emergency procedures\nMount respiratory protective device.\nWear protective equipment. Keep unprotected persons away.\nEnvironmental precautions: Do not allow to enter sewers/ surface or ground water.\nMethods and material for containment and cleaning up:\nAbsorb with liquid-binding material (sand, diatomite, acid binders, universal binders, sawdust).\nDispose contaminated material as waste according to item 13.\nEnsure adequate ventilation.\n• Reference to other sections\nSee Section 7 for information on safe handling.\nSee Section 8 for information on personal protection equipment.\nSee Section 13 for disposal information.\nProtective Action Criteria for Chemicals\n• PAC-1:\n• PAC-2:\n• PAC-3:","REVISED_CONTENT":"Product ID:HZ-BEN,Product Description:Benzene,Storage Location:0001,Storage Location Description:Lager 0001,Plant:0001,Section Id:6,Section Header:Accidental release measures,Section Content:Personal precautions, protective equipment and emergency procedures\nMount respiratory protective device.\nWear protective equipment. Keep unprotected persons away.\nEnvironmental precautions: Do not allow to enter sewers/ surface or ground water.\nMethods and material for containment and cleaning up:\nAbsorb with liquid-binding material (sand, diatomite, acid binders, universal binders, sawdust).\nDispose contaminated material as waste according to item 13.\nEnsure adequate ventilation.\n• Reference to other sections\nSee Section 7 for information on safe handling.\nSee Section 8 for information on personal protection equipment.\nSee Section 13 for disposal information.\nProtective Action Criteria for Chemicals\n• PAC-1:\n• PAC-2:\n• PAC-3:"}