{"GUID":"AkKsEQACHt+fl92lrODowg==","MATNR":"HZ-PLU","MAKTX":"Plutonium nitrate","WERKS":"0001","LGORT":"0088","LGOBE":"Lager 0088 (WM)","SECTION_ID":2,"SECTION_HEADER":"Hazard identification","SECTION_CONTENT":"Radiological Hazard (Pu)\nWarning: THIS MATERIAL SHOULD ONLY BE USED BY PERSONS QUALIFIED TO\nHANDLE RADIOACTIVE MATERIAL! This product contains licensed radioactive material and is\ntherefore subject to the requirements of 10 CFR Part 20 (e.g., public and occupational exposure limits,\nwaste disposal). At a minimum, the basic radiation safety principles of time, distance, and shielding,\nand appropriate radiation contamination control should be practiced to avoid/minimize any external\nand/or internal exposure. Consult with your Radiation Safety office for your facility's radiation safety\nrequirements/precautions specific to the radionuclide(s) (including its activity and chemical/physical\nform) in this Radioactive CRM.\nThis CRM is a radioactive material. The specific activities of the various plutonium isotopes\n(and 241 Am) are described in Section 9. The CRM is in a nitric acid solution. During the decay\nof plutonium, three types of radiation are released-alpha, beta, and gamma. Alpha radiation","REVISED_CONTENT":"Product ID:HZ-PLU,Product Description:Plutonium nitrate,Storage Location:0088,Storage Location Description:Lager 0088 (WM),Plant:0001,Section Id:2,Section Header:Hazard identification,Section Content:Radiological Hazard (Pu)\nWarning: THIS MATERIAL SHOULD ONLY BE USED BY PERSONS QUALIFIED TO\nHANDLE RADIOACTIVE MATERIAL! This product contains licensed radioactive material and is\ntherefore subject to the requirements of 10 CFR Part 20 (e.g., public and occupational exposure limits,\nwaste disposal). At a minimum, the basic radiation safety principles of time, distance, and shielding,\nand appropriate radiation contamination control should be practiced to avoid/minimize any external\nand/or internal exposure. Consult with your Radiation Safety office for your facility's radiation safety\nrequirements/precautions specific to the radionuclide(s) (including its activity and chemical/physical\nform) in this Radioactive CRM.\nThis CRM is a radioactive material. The specific activities of the various plutonium isotopes\n(and 241 Am) are described in Section 9. The CRM is in a nitric acid solution. During the decay\nof plutonium, three types of radiation are released-alpha, beta, and gamma. Alpha radiation"}