{"GUID":"AkKsEQACHt+fl92lpuBIwg==","MATNR":"HZ-MET","MAKTX":"Methane","WERKS":"0001","LGORT":"0001","LGOBE":"Lager 0001","SECTION_ID":13,"SECTION_HEADER":"Disposal considerations","SECTION_CONTENT":"Disposal methods : The generation of waste should be avoided or minimized wherever possible. Disposal\nof this product, solutions and any by-products should at all times comply with the\nrequirements of environmental protection and waste disposal legislation and any\nregional local authority requirements. Dispose of surplus and non-recyclable products\nvia a licensed waste disposal contractor. Waste should not be disposed of untreated to\nthe sewer unless fully compliant with the requirements of all authorities with jurisdiction.\nEmpty Airgas-owned pressure vessels should be returned to Airgas. Waste packaging\nshould be recycled. Incineration or landfill should only be considered when recycling is\nnot feasible. This material and its container must be disposed of in a safe way. Empty\ncontainers or liners may retain some product residues. Do not puncture or incinerate\ncontainer.","REVISED_CONTENT":"Product ID:HZ-MET,Product Description:Methane,Storage Location:0001,Storage Location Description:Lager 0001,Plant:0001,Section Id:13,Section Header:Disposal considerations,Section Content:Disposal methods : The generation of waste should be avoided or minimized wherever possible. Disposal\nof this product, solutions and any by-products should at all times comply with the\nrequirements of environmental protection and waste disposal legislation and any\nregional local authority requirements. Dispose of surplus and non-recyclable products\nvia a licensed waste disposal contractor. Waste should not be disposed of untreated to\nthe sewer unless fully compliant with the requirements of all authorities with jurisdiction.\nEmpty Airgas-owned pressure vessels should be returned to Airgas. Waste packaging\nshould be recycled. Incineration or landfill should only be considered when recycling is\nnot feasible. This material and its container must be disposed of in a safe way. Empty\ncontainers or liners may retain some product residues. Do not puncture or incinerate\ncontainer."}