{"GUID":"AkKsEQACHt+fl92lpstIwg==","MATNR":"HZ-HAC","MAKTX":"Hydrochloric acid","WERKS":"0001","LGORT":"0003","LGOBE":"Corrosive Items","SECTION_ID":5,"SECTION_HEADER":"Fire-fighting measures","SECTION_CONTENT":"Suitable Extinguishing Media\nSubstance is nonflammable; use agent most appropriate to extinguish surrounding fire.\nUnsuitable Extinguishing Media\nNo information available\nFlash Point\nNo information available\nMethod -\nNo information available\nAutoignition Temperature\nNo information available\nUpper\nNo data available\nLower\nNo data available\nExplosion Limits\nSensitivity to Mechanical Impact No information available\nSensitivity to Static Discharge No information available\nSpecific Hazards Arising from the Chemical\nCorrosive Material. Causes burns by all exposure routes. Thermal decomposition can lead to release of irritating gases and vapors.\nHazardous Combustion Products\nHydrogen chloride gas\nProtective Equipment and Precautions for Firefighters\nAs in any fire, wear self-contained breathing apparatus pressure-demand, MSHA/NIOSH (approved or equivalent) and full\nprotective gear.","REVISED_CONTENT":"Product ID:HZ-HAC,Product Description:Hydrochloric acid,Storage Location:0003,Storage Location Description:Corrosive Items,Plant:0001,Section Id:5,Section Header:Fire-fighting measures,Section Content:Suitable Extinguishing Media\nSubstance is nonflammable; use agent most appropriate to extinguish surrounding fire.\nUnsuitable Extinguishing Media\nNo information available\nFlash Point\nNo information available\nMethod -\nNo information available\nAutoignition Temperature\nNo information available\nUpper\nNo data available\nLower\nNo data available\nExplosion Limits\nSensitivity to Mechanical Impact No information available\nSensitivity to Static Discharge No information available\nSpecific Hazards Arising from the Chemical\nCorrosive Material. Causes burns by all exposure routes. Thermal decomposition can lead to release of irritating gases and vapors.\nHazardous Combustion Products\nHydrogen chloride gas\nProtective Equipment and Precautions for Firefighters\nAs in any fire, wear self-contained breathing apparatus pressure-demand, MSHA/NIOSH (approved or equivalent) and full\nprotective gear."}