{"GUID":"AkKsEQACHt+fl92lo1YIwg==","MATNR":"HZ-CHL","MAKTX":"Chlorine","WERKS":"0001","LGORT":"0001","LGOBE":"Lager 0001","SECTION_ID":7,"SECTION_HEADER":"Handling and storage","SECTION_CONTENT":"7.1. Precautions for safe handling\nAdditional hazards when processed\nPrecautions for safe handling\nHygiene measures\n: Pressurized container: Do not pierce or burn, even after use. Use only with equipment rated for\ncylinder pressure. Close valve after each use and when empty.\n: Do not handle until all safety precautions have been read and understood. Use only outdoors or\nin a well-ventilated area. Wash hands and other exposed areas with mild soap and water before\neating, drinking or smoking and when leaving work. Provide good ventilation in process area to\nprevent formation of vapor. Keep reduction valves free from grease and oil. Do not breathe\ndust/fume/gas/mist/vapors/spray. Avoid contact during pregnancy/while nursing. Avoid breathing\ndust/fume/gas/mist/vapors/spray.\n: Do not eat, drink or smoke when using this product. Wash hands, forearms and face thoroughly\nafter handling.\n7.2. Conditions for safe storage, including any incompatibilities\nTechnical measures\nStorage conditions\nIncompatible products\nIncompatible materials\n: Comply with applicable regulations.\n: Do not expose to temperatures exceeding 52 째C/ 125 째F. Protect containers from physical\ndamage; do not drag, roll, slide or drop. Store in well ventilated area. Store locked up. Keep only\nin the original container in a cool, well ventilated place away from: Keep container tightly closed.\n: None known. Strong bases. Strong acids.\n: Flammable materials. Combustible materials. Reducing agents. Sources of ignition. Direct\nsunlight.","REVISED_CONTENT":"Product ID:HZ-CHL,Product Description:Chlorine,Storage Location:0001,Storage Location Description:Lager 0001,Plant:0001,Section Id:7,Section Header:Handling and storage,Section Content:7.1. Precautions for safe handling\nAdditional hazards when processed\nPrecautions for safe handling\nHygiene measures\n: Pressurized container: Do not pierce or burn, even after use. Use only with equipment rated for\ncylinder pressure. Close valve after each use and when empty.\n: Do not handle until all safety precautions have been read and understood. Use only outdoors or\nin a well-ventilated area. Wash hands and other exposed areas with mild soap and water before\neating, drinking or smoking and when leaving work. Provide good ventilation in process area to\nprevent formation of vapor. Keep reduction valves free from grease and oil. Do not breathe\ndust/fume/gas/mist/vapors/spray. Avoid contact during pregnancy/while nursing. Avoid breathing\ndust/fume/gas/mist/vapors/spray.\n: Do not eat, drink or smoke when using this product. Wash hands, forearms and face thoroughly\nafter handling.\n7.2. Conditions for safe storage, including any incompatibilities\nTechnical measures\nStorage conditions\nIncompatible products\nIncompatible materials\n: Comply with applicable regulations.\n: Do not expose to temperatures exceeding 52 째C/ 125 째F. Protect containers from physical\ndamage; do not drag, roll, slide or drop. Store in well ventilated area. Store locked up. Keep only\nin the original container in a cool, well ventilated place away from: Keep container tightly closed.\n: None known. Strong bases. Strong acids.\n: Flammable materials. Combustible materials. Reducing agents. Sources of ignition. Direct\nsunlight."}