{"GUID":"AkKsEQACHt+fl92lrOiowg==","MATNR":"HZ-PRO","MAKTX":"Propane","WERKS":"0001","LGORT":"0001","LGOBE":"Lager 0001","SECTION_ID":16,"SECTION_HEADER":"Other information","SECTION_CONTENT":"12/07/2018\nThis Safety Data Sheet is offered pursuant to OSHA's Hazard Communication Standard, 29\nCFR, 1910.1200. Other government regulations must be reviewed for applicability to this\nproduct.\nExtremely flammable gas\nContains gas under pressure; may explode if heated\nThis Safety Data Sheet is offered pursuant to OSHA's Hazard Communication Standard, 29 CFR, 1910.1200. Other government regulations must be reviewed for applicability to this product. To the best\nof Air Liquide USA LLC and its affiliates' knowledge, the information contained herein is reliable and accurate as of this date; however, accuracy, suitability or completeness are not guaranteed and no\nwarranties of any type, either express or implied, are provided. The information contained herein relates only to this specific product. If this product is combined with other materials, all component\nproperties must be considered. Data may be changed from time to time. Be sure to consult the latest edition.","REVISED_CONTENT":"Product ID:HZ-PRO,Product Description:Propane,Storage Location:0001,Storage Location Description:Lager 0001,Plant:0001,Section Id:16,Section Header:Other information,Section Content:12/07/2018\nThis Safety Data Sheet is offered pursuant to OSHA's Hazard Communication Standard, 29\nCFR, 1910.1200. Other government regulations must be reviewed for applicability to this\nproduct.\nExtremely flammable gas\nContains gas under pressure; may explode if heated\nThis Safety Data Sheet is offered pursuant to OSHA's Hazard Communication Standard, 29 CFR, 1910.1200. Other government regulations must be reviewed for applicability to this product. To the best\nof Air Liquide USA LLC and its affiliates' knowledge, the information contained herein is reliable and accurate as of this date; however, accuracy, suitability or completeness are not guaranteed and no\nwarranties of any type, either express or implied, are provided. The information contained herein relates only to this specific product. If this product is combined with other materials, all component\nproperties must be considered. Data may be changed from time to time. Be sure to consult the latest edition."}