{"GUID":"AkKsEQACHt+fl92lptAowg==","MATNR":"HZ-HYP","MAKTX":"Hydrogen Peroxide 3%","WERKS":"0001","LGORT":"0002","LGOBE":"Cold Storage","SECTION_ID":12,"SECTION_HEADER":"Ecological information","SECTION_CONTENT":"Contains a substance which is:. Toxic to aquatic organisms. The product contains following substances which are hazardous for\nthe environment.\nComponent\nHydrogen peroxide\nFreshwater Algae\nEC50 2.5 mg/L/72h\nFreshwater Fish\nLC50: 16.4 mg/L/96h\n(P.promelas)\nMicrotox\nNot listed\nPersistence and Degradability\nBioaccumulation/ Accumulation\nMobility\nSoluble in water Persistence is unlikely based on information available.\nNo information available.\nWill likely be mobile in the environment due to its water solubility.\nComponent\nHydrogen peroxide\nlog Pow\n-1.1\nWater Flea\nEC50 7.7 mg/L/24h","REVISED_CONTENT":"Product ID:HZ-HYP,Product Description:Hydrogen Peroxide 3%,Storage Location:0002,Storage Location Description:Cold Storage,Plant:0001,Section Id:12,Section Header:Ecological information,Section Content:Contains a substance which is:. Toxic to aquatic organisms. The product contains following substances which are hazardous for\nthe environment.\nComponent\nHydrogen peroxide\nFreshwater Algae\nEC50 2.5 mg/L/72h\nFreshwater Fish\nLC50: 16.4 mg/L/96h\n(P.promelas)\nMicrotox\nNot listed\nPersistence and Degradability\nBioaccumulation/ Accumulation\nMobility\nSoluble in water Persistence is unlikely based on information available.\nNo information available.\nWill likely be mobile in the environment due to its water solubility.\nComponent\nHydrogen peroxide\nlog Pow\n-1.1\nWater Flea\nEC50 7.7 mg/L/24h"}