{"GUID":"AkKsEQACHt+fl92lpuVIwg==","MATNR":"HZ-OXY","MAKTX":"Oxygen","WERKS":"0001","LGORT":"0001","LGOBE":"Lager 0001","SECTION_ID":5,"SECTION_HEADER":"Fire-fighting measures","SECTION_CONTENT":"Extinguishing media\nSuitable extinguishing\nmedia : Use an extinguishing agent suitable for the surrounding fire.\nUnsuitable extinguishing\nmedia : None known.\nSpecific hazards arising\nfrom the chemical : Contains gas under pressure. Oxidizing material. This material increases the risk of\nfire and may aid combustion. Contact with combustible material may cause fire. In a\nfire or if heated, a pressure increase will occur and the container may burst or explode.\nHazardous thermal\ndecomposition products : No specific data.\nSpecial protective actions\nfor fire-fighters : Promptly isolate the scene by removing all persons from the vicinity of the incident if\nthere is a fire. No action shall be taken involving any personal risk or without suitable\ntraining. Contact supplier immediately for specialist advice. Move containers from fire\narea if this can be done without risk. Use water spray to keep fire-exposed containers\ncool. If involved in fire, shut off flow immediately if it can be done without risk.\nSpecial protective\nequipment for fire-fighters : Fire-fighters should wear appropriate protective equipment and self-contained breathing\napparatus (SCBA) with a full face-piece operated in positive pressure mode.","REVISED_CONTENT":"Product ID:HZ-OXY,Product Description:Oxygen,Storage Location:0001,Storage Location Description:Lager 0001,Plant:0001,Section Id:5,Section Header:Fire-fighting measures,Section Content:Extinguishing media\nSuitable extinguishing\nmedia : Use an extinguishing agent suitable for the surrounding fire.\nUnsuitable extinguishing\nmedia : None known.\nSpecific hazards arising\nfrom the chemical : Contains gas under pressure. Oxidizing material. This material increases the risk of\nfire and may aid combustion. Contact with combustible material may cause fire. In a\nfire or if heated, a pressure increase will occur and the container may burst or explode.\nHazardous thermal\ndecomposition products : No specific data.\nSpecial protective actions\nfor fire-fighters : Promptly isolate the scene by removing all persons from the vicinity of the incident if\nthere is a fire. No action shall be taken involving any personal risk or without suitable\ntraining. Contact supplier immediately for specialist advice. Move containers from fire\narea if this can be done without risk. Use water spray to keep fire-exposed containers\ncool. If involved in fire, shut off flow immediately if it can be done without risk.\nSpecial protective\nequipment for fire-fighters : Fire-fighters should wear appropriate protective equipment and self-contained breathing\napparatus (SCBA) with a full face-piece operated in positive pressure mode."}