{"GUID":"AkKsEQACHt+fl92lpuRowg==","MATNR":"HZ-NIT","MAKTX":"Nitrogen","WERKS":"0001","LGORT":"0001","LGOBE":"Lager 0001","SECTION_ID":14,"SECTION_HEADER":"Transport information","SECTION_CONTENT":"Department of Transportation (DOT)\nIn accordance with DOT\nTransport document description\nUN-No.(DOT)\nProper Shipping Name (DOT)\nClass (DOT)\nHazard labels (DOT)\nDOT Packaging Non Bulk (49 CFR 173.xxx)\nDOT Packaging Bulk (49 CFR 173.xxx)\nDOT Packaging Exceptions (49 CFR 173.xxx)\nDOT Quantity Limitations Passenger aircraft/rail: 75 kg\n(49 CFR 173.27)\nDOT Quantity Limitations Cargo aircraft only (49: 150 kg\nCFR 175.75)\nDOT Vessel Stowage Location\nOther information\nTransportation of Dangerous Goods\nTransport by sea\nTransport document description (IMDG)\nUN-No. (IMDG)\nProper Shipping Name (IMDG)\nClass (IMDG)\nLimited quantities (IMDG)\nAir transport\nTransport document description (IATA)\nUN-No. (IATA)\nProper Shipping Name (IATA)\nClass (IATA)\n: UN1066 Nitrogen, compressed, 2.2\n: UN1066\n: Nitrogen, compressed\n: 2.2 - Class 2.2 - Non-flammable compressed gas 49 CFR 173.115\n: 2.2 - Non-flammable gas\n: 302\n: 314;315\n: 306;307\n: A - The material may be stowed \"on deck\" or \"under deck\" on a cargo vessel and on a passenger vessel.\n: No supplementary information available.\n: UN 1066 COMPRESSED GAS, N.O.S., 2.2\n: 1066\n: COMPRESSED GAS, N.O.S.\n: 2.2 - Non-flammable, non-toxic gases\n: 120 ml\n: UN 1066 COMPRESSED GAS, N.O.S., 2.2\n: 1066\n: COMPRESSED GAS, N.O.S.\n: 2","REVISED_CONTENT":"Product ID:HZ-NIT,Product Description:Nitrogen,Storage Location:0001,Storage Location Description:Lager 0001,Plant:0001,Section Id:14,Section Header:Transport information,Section Content:Department of Transportation (DOT)\nIn accordance with DOT\nTransport document description\nUN-No.(DOT)\nProper Shipping Name (DOT)\nClass (DOT)\nHazard labels (DOT)\nDOT Packaging Non Bulk (49 CFR 173.xxx)\nDOT Packaging Bulk (49 CFR 173.xxx)\nDOT Packaging Exceptions (49 CFR 173.xxx)\nDOT Quantity Limitations Passenger aircraft/rail: 75 kg\n(49 CFR 173.27)\nDOT Quantity Limitations Cargo aircraft only (49: 150 kg\nCFR 175.75)\nDOT Vessel Stowage Location\nOther information\nTransportation of Dangerous Goods\nTransport by sea\nTransport document description (IMDG)\nUN-No. (IMDG)\nProper Shipping Name (IMDG)\nClass (IMDG)\nLimited quantities (IMDG)\nAir transport\nTransport document description (IATA)\nUN-No. (IATA)\nProper Shipping Name (IATA)\nClass (IATA)\n: UN1066 Nitrogen, compressed, 2.2\n: UN1066\n: Nitrogen, compressed\n: 2.2 - Class 2.2 - Non-flammable compressed gas 49 CFR 173.115\n: 2.2 - Non-flammable gas\n: 302\n: 314;315\n: 306;307\n: A - The material may be stowed \"on deck\" or \"under deck\" on a cargo vessel and on a passenger vessel.\n: No supplementary information available.\n: UN 1066 COMPRESSED GAS, N.O.S., 2.2\n: 1066\n: COMPRESSED GAS, N.O.S.\n: 2.2 - Non-flammable, non-toxic gases\n: 120 ml\n: UN 1066 COMPRESSED GAS, N.O.S., 2.2\n: 1066\n: COMPRESSED GAS, N.O.S.\n: 2"}