{"GUID":"AkKsEQACHt+fl92lrPGIwg==","MATNR":"HZ-SOM","MAKTX":"Sodium metal","WERKS":"0001","LGORT":"0001","LGOBE":"Lager 0001","SECTION_ID":7,"SECTION_HEADER":"Handling and storage","SECTION_CONTENT":"Precautions for Safe Handling: It is strongly recommended that at least two persons be involved in the handling and use of this material. Sodium should\nonly be handled by trained personnel wearing proper protective clothing and equipment specified in section 8. Handle in an enclosed, controlled process\nunder dry protective gas such as argon. Make certain that all equipment and tools to be used in handling are absolutely dry. Protect from air and moisture.\nProtect from heat, flame and sources of ignition. It is advisable to keep a container of dry sand or soda ash readily available in the work area. Keep\ncombustible materials out of the work area. Avoid contact with skin and eyes. Avoid creating dust. Avoid breathing dust or fumes. Wash thoroughly before\neating or smoking.\nConditions for Safe Storage, Including Any Incompatibilities: Protect from oxygen and water. Protect from moisture/humidity. Store under dry inert gas\nsuch as argon. Store in a sealed container. Storage containers should be labeled to indicate their contents. Containers should be inspected periodically to\ncheck for container integrity. Storage area should be free of combustibles and ignition sources. Do not store together with acids, oxidizers, halogens,\nhalocarbons or alcohols. See section 10 for more information on incompatible materials.","REVISED_CONTENT":"Product ID:HZ-SOM,Product Description:Sodium metal,Storage Location:0001,Storage Location Description:Lager 0001,Plant:0001,Section Id:7,Section Header:Handling and storage,Section Content:Precautions for Safe Handling: It is strongly recommended that at least two persons be involved in the handling and use of this material. Sodium should\nonly be handled by trained personnel wearing proper protective clothing and equipment specified in section 8. Handle in an enclosed, controlled process\nunder dry protective gas such as argon. Make certain that all equipment and tools to be used in handling are absolutely dry. Protect from air and moisture.\nProtect from heat, flame and sources of ignition. It is advisable to keep a container of dry sand or soda ash readily available in the work area. Keep\ncombustible materials out of the work area. Avoid contact with skin and eyes. Avoid creating dust. Avoid breathing dust or fumes. Wash thoroughly before\neating or smoking.\nConditions for Safe Storage, Including Any Incompatibilities: Protect from oxygen and water. Protect from moisture/humidity. Store under dry inert gas\nsuch as argon. Store in a sealed container. Storage containers should be labeled to indicate their contents. Containers should be inspected periodically to\ncheck for container integrity. Storage area should be free of combustibles and ignition sources. Do not store together with acids, oxidizers, halogens,\nhalocarbons or alcohols. See section 10 for more information on incompatible materials."}