{"GUID":"AkKsEQACHt+fl92lo1Zowg==","MATNR":"HZ-CHL","MAKTX":"Chlorine","WERKS":"0001","LGORT":"0001","LGOBE":"Lager 0001","SECTION_ID":10,"SECTION_HEADER":"Stability and reactivity","SECTION_CONTENT":"10.1. Reactivity\nReacts with water to form corrosive acids. Corrosive vapors. Thermal decomposition generates:\n10.2. Chemical stability\nStable under normal conditions. Not established.\n10.3. Possibility of hazardous reactions\nMay react violently with reducing agents. Can form explosive mixtures with flammable materials. Not established.\n10.4. Conditions to avoid\nMoisture. Direct sunlight. Extremely high or low temperatures.\n10.5. Incompatible materials\nCombustible materials. Flammable materials. Reducing agents. Strong acids. Strong bases.\n10.6. Hazardous decomposition products\nUnder normal conditions of storage and use, hazardous decomposition products should not be produced. fume. Carbon monoxide. Carbon dioxide.\nThermal decomposition generates: Corrosive vapors.","REVISED_CONTENT":"Product ID:HZ-CHL,Product Description:Chlorine,Storage Location:0001,Storage Location Description:Lager 0001,Plant:0001,Section Id:10,Section Header:Stability and reactivity,Section Content:10.1. Reactivity\nReacts with water to form corrosive acids. Corrosive vapors. Thermal decomposition generates:\n10.2. Chemical stability\nStable under normal conditions. Not established.\n10.3. Possibility of hazardous reactions\nMay react violently with reducing agents. Can form explosive mixtures with flammable materials. Not established.\n10.4. Conditions to avoid\nMoisture. Direct sunlight. Extremely high or low temperatures.\n10.5. Incompatible materials\nCombustible materials. Flammable materials. Reducing agents. Strong acids. Strong bases.\n10.6. Hazardous decomposition products\nUnder normal conditions of storage and use, hazardous decomposition products should not be produced. fume. Carbon monoxide. Carbon dioxide.\nThermal decomposition generates: Corrosive vapors."}