{"GUID":"AkKsEQACHt+fl92lo16owg==","MATNR":"HZ-ETH","MAKTX":"Ethanol","WERKS":"0001","LGORT":"0001","LGOBE":"Lager 0001","SECTION_ID":12,"SECTION_HEADER":"Ecological information","SECTION_CONTENT":"Toxicity\n· Aquatic toxicity: No further relevant information available.\nPersistence and degradability No further relevant information available.\nBehavior in environmental systems:\nBioaccumulative potential No further relevant information available.\nMobility in soil No further relevant information available.\nAdditional ecological information:\nGeneral notes:\nWater hazard class 1 (Assessment by list): slightly hazardous for water\nDo not allow undiluted product or large quantities of it to reach ground water, water course or sewage system.\nResults of PBT and vPvB assessment\n• PBT: Not applicable.\nvPvB: Not applicable.\nOther adverse effects No further relevant information available.","REVISED_CONTENT":"Product ID:HZ-ETH,Product Description:Ethanol,Storage Location:0001,Storage Location Description:Lager 0001,Plant:0001,Section Id:12,Section Header:Ecological information,Section Content:Toxicity\n· Aquatic toxicity: No further relevant information available.\nPersistence and degradability No further relevant information available.\nBehavior in environmental systems:\nBioaccumulative potential No further relevant information available.\nMobility in soil No further relevant information available.\nAdditional ecological information:\nGeneral notes:\nWater hazard class 1 (Assessment by list): slightly hazardous for water\nDo not allow undiluted product or large quantities of it to reach ground water, water course or sewage system.\nResults of PBT and vPvB assessment\n• PBT: Not applicable.\nvPvB: Not applicable.\nOther adverse effects No further relevant information available."}