{"GUID":"AkKsEQACHt+fl92lrOeIwg==","MATNR":"HZ-PRO","MAKTX":"Propane","WERKS":"0001","LGORT":"0001","LGOBE":"Lager 0001","SECTION_ID":7,"SECTION_HEADER":"Handling and storage","SECTION_CONTENT":"Pressurized container: Do not pierce or burn, even after use. Use only with equipment rated for\ncylinder pressure. Close valve after each use and when empty. Handle empty containers with\ncare because residual vapors are flammable. In use, may form flammable vapor-air mixture.\nDo not handle until all safety precautions have been read and understood. Use only outdoors or\nin a well-ventilated area. Keep away from heat/sparks/open flames/hot surfaces. – No smoking.\nUse only non-sparking tools.\nDo not eat, drink or smoke when using this product.\nComply with applicable regulations. Proper grounding procedures to avoid static electricity\nshould be followed.\nDo not expose to temperatures exceeding 52 °C/ 125 °F. Keep container closed when not in\nuse. Protect cylinders from physical damage; do not drag, roll, slide or drop. Store in well\nventilated area.\nNone known.\nOxidizing materials. Air.\nObserve all regulations and local requirements regarding storage of containers. Containers\nshould not be stored in conditions likely to encourage corrosion. Container valve guards or\ncaps should be in place. Containers should be stored in the vertical position and properly\nsecured to prevent them from falling over. Stored containers should be periodically checked for\ngeneral condition and leakage. Keep container below 50°C in a well ventilated place. Store\ncontainers in location free from fire risk and away from sources of heat and ignition. Keep away\nfrom combustible materials. Segregate from oxidant gases and other oxidants in store. All\nelectrical equipment in the storage areas should be compatible with the risk of a potentially\nexplosive atmosphere.","REVISED_CONTENT":"Product ID:HZ-PRO,Product Description:Propane,Storage Location:0001,Storage Location Description:Lager 0001,Plant:0001,Section Id:7,Section Header:Handling and storage,Section Content:Pressurized container: Do not pierce or burn, even after use. Use only with equipment rated for\ncylinder pressure. Close valve after each use and when empty. Handle empty containers with\ncare because residual vapors are flammable. In use, may form flammable vapor-air mixture.\nDo not handle until all safety precautions have been read and understood. Use only outdoors or\nin a well-ventilated area. Keep away from heat/sparks/open flames/hot surfaces. – No smoking.\nUse only non-sparking tools.\nDo not eat, drink or smoke when using this product.\nComply with applicable regulations. Proper grounding procedures to avoid static electricity\nshould be followed.\nDo not expose to temperatures exceeding 52 °C/ 125 °F. Keep container closed when not in\nuse. Protect cylinders from physical damage; do not drag, roll, slide or drop. Store in well\nventilated area.\nNone known.\nOxidizing materials. Air.\nObserve all regulations and local requirements regarding storage of containers. Containers\nshould not be stored in conditions likely to encourage corrosion. Container valve guards or\ncaps should be in place. Containers should be stored in the vertical position and properly\nsecured to prevent them from falling over. Stored containers should be periodically checked for\ngeneral condition and leakage. Keep container below 50°C in a well ventilated place. Store\ncontainers in location free from fire risk and away from sources of heat and ignition. Keep away\nfrom combustible materials. Segregate from oxidant gases and other oxidants in store. All\nelectrical equipment in the storage areas should be compatible with the risk of a potentially\nexplosive atmosphere."}