{"GUID":"AkKsEQACHt+fl92lpuNowg==","MATNR":"HZ-NIT","MAKTX":"Nitrogen","WERKS":"0001","LGORT":"0001","LGOBE":"Lager 0001","SECTION_ID":6,"SECTION_HEADER":"Accidental release measures","SECTION_CONTENT":"6.1. Personal precautions, protective equipment and emergency procedures\nGeneral measures\n6.1.1. For non-emergency personnel\nProtective equipment\nEmergency procedures\n6.1.2. For emergency responders\nProtective equipment\nEmergency procedures\n6.2.\nEnvironmental precautions\nTry to stop release if without risk.\nMethods and material for containment and cleaning up\n6.3.\nFor containment\nMethods for cleaning up\n6.4.\nReference to other sections\nSee also Sections 8 and 13.\n: Ensure adequate ventilation.\n: Wear protective equipment consistent with the site emergency plan.\n: Evacuate personnel to a safe area. Close doors and windows of adjacent premises. Keep containers closed. Mark the danger area. Seal off low-lying areas. Keep upwind.\n: Standard protective clothing and equipment (e.g, Self Contained Breathing Apparatus) for fire fighters. Equip cleanup crew with proper protection.\n: Evacuate and limit access. Ventilate area.\n: Try to stop release if without risk.\n: Dispose of contents/container in accordance with local/regional/national/international regulations.","REVISED_CONTENT":"Product ID:HZ-NIT,Product Description:Nitrogen,Storage Location:0001,Storage Location Description:Lager 0001,Plant:0001,Section Id:6,Section Header:Accidental release measures,Section Content:6.1. Personal precautions, protective equipment and emergency procedures\nGeneral measures\n6.1.1. For non-emergency personnel\nProtective equipment\nEmergency procedures\n6.1.2. For emergency responders\nProtective equipment\nEmergency procedures\n6.2.\nEnvironmental precautions\nTry to stop release if without risk.\nMethods and material for containment and cleaning up\n6.3.\nFor containment\nMethods for cleaning up\n6.4.\nReference to other sections\nSee also Sections 8 and 13.\n: Ensure adequate ventilation.\n: Wear protective equipment consistent with the site emergency plan.\n: Evacuate personnel to a safe area. Close doors and windows of adjacent premises. Keep containers closed. Mark the danger area. Seal off low-lying areas. Keep upwind.\n: Standard protective clothing and equipment (e.g, Self Contained Breathing Apparatus) for fire fighters. Equip cleanup crew with proper protection.\n: Evacuate and limit access. Ventilate area.\n: Try to stop release if without risk.\n: Dispose of contents/container in accordance with local/regional/national/international regulations."}