{"GUID":"AkKsEQACHt+fl92loTFIwg==","MATNR":"HZ-ATR","MAKTX":"Atrazine","WERKS":"0001","LGORT":"0088","LGOBE":"Lager 0088 (WM)","SECTION_ID":3,"SECTION_HEADER":"Hazard identification","SECTION_CONTENT":"Potential Acute Health Effects: Harmful if swallowed. Risk of serious damage to eyes. May cause sensitization by skin\ncontact. Harmful: danger of serious damage to health by prolonged exposure if swallowed. Very toxic to aquatic\norganisms, may cause long-term adverse effects in the aquatic environment.\nTarget organ(s): Central nervous system. Blood.\nPotential Chronic Health Effects:\nCARCINOGENIC EFFECTS: Possible carcinogen.\nMUTAGENIC EFFECTS: Suspected mutagen.\nTERATOGENIC EFFECTS: Suspected teratogen.\nDEVELOPMENTAL TOXICITY: Maternal effects.","REVISED_CONTENT":"Product ID:HZ-ATR,Product Description:Atrazine,Storage Location:0088,Storage Location Description:Lager 0088 (WM),Plant:0001,Section Id:3,Section Header:Hazard identification,Section Content:Potential Acute Health Effects: Harmful if swallowed. Risk of serious damage to eyes. May cause sensitization by skin\ncontact. Harmful: danger of serious damage to health by prolonged exposure if swallowed. Very toxic to aquatic\norganisms, may cause long-term adverse effects in the aquatic environment.\nTarget organ(s): Central nervous system. Blood.\nPotential Chronic Health Effects:\nCARCINOGENIC EFFECTS: Possible carcinogen.\nMUTAGENIC EFFECTS: Suspected mutagen.\nTERATOGENIC EFFECTS: Suspected teratogen.\nDEVELOPMENTAL TOXICITY: Maternal effects."}