{"GUID":"AkKsEQACHt+fl92loTBIwg==","MATNR":"HZ-ACE","MAKTX":"Acetone","WERKS":"0001","LGORT":"0001","LGOBE":"Lager 0001","SECTION_ID":11,"SECTION_HEADER":"Toxicological information","SECTION_CONTENT":"Acute Toxicity\nProduct Information\nComponent Information\nComponent\nAcetone\nLD50 Oral\n5800 mg/kg (Rat)\nToxicologically Synergistic\nProducts\nLD50 Dermal\nLC50 Inhalation\nCarbon tetrachloride; Chloroform; Trichloroethylene; Bromodichloromethane;\n> 15800 mg/kg (rabbit)\n> 7400 mg/kg (rat)\nAcetonitrile, 2,5-Hexanedione; Ethanol; 1,2-Dichlorobenzene\nDibromochloromethane; N-nitrosodimethylamine; 1,1,2-Trichloroethane; Styrene;\nDelayed and immediate effects as well as chronic effects from short and long-term exposure\nIrritation Irritating to eyes and skin\nSensitization No information available\nCarcinogenicity The table below indicates whether each agency has listed any ingredient as a carcinogen.\nComponent\nAcetone\nCAS-No\nIARC\nNTP\nACGIH\nOSHA\nMexico\n67-64-1\nNot listed\nNot listed\nNot listed\nNot listed\nNot listed\nMutagenic Effects No information available\nReproductive Effects No information available.\nDevelopmental Effects No information available.\nTeratogenicity No information available.\nSTOT - single exposure Central nervous system (CNS)\nSTOT - repeated exposure Kidney Liver spleen Blood\nAspiration hazard No information available\nSymptoms / effects, both acute and Symptoms of overexposure may be headache, dizziness, tiredness, nausea and vomiting:","REVISED_CONTENT":"Product ID:HZ-ACE,Product Description:Acetone,Storage Location:0001,Storage Location Description:Lager 0001,Plant:0001,Section Id:11,Section Header:Toxicological information,Section Content:Acute Toxicity\nProduct Information\nComponent Information\nComponent\nAcetone\nLD50 Oral\n5800 mg/kg (Rat)\nToxicologically Synergistic\nProducts\nLD50 Dermal\nLC50 Inhalation\nCarbon tetrachloride; Chloroform; Trichloroethylene; Bromodichloromethane;\n> 15800 mg/kg (rabbit)\n> 7400 mg/kg (rat)\nAcetonitrile, 2,5-Hexanedione; Ethanol; 1,2-Dichlorobenzene\nDibromochloromethane; N-nitrosodimethylamine; 1,1,2-Trichloroethane; Styrene;\nDelayed and immediate effects as well as chronic effects from short and long-term exposure\nIrritation Irritating to eyes and skin\nSensitization No information available\nCarcinogenicity The table below indicates whether each agency has listed any ingredient as a carcinogen.\nComponent\nAcetone\nCAS-No\nIARC\nNTP\nACGIH\nOSHA\nMexico\n67-64-1\nNot listed\nNot listed\nNot listed\nNot listed\nNot listed\nMutagenic Effects No information available\nReproductive Effects No information available.\nDevelopmental Effects No information available.\nTeratogenicity No information available.\nSTOT - single exposure Central nervous system (CNS)\nSTOT - repeated exposure Kidney Liver spleen Blood\nAspiration hazard No information available\nSymptoms / effects, both acute and Symptoms of overexposure may be headache, dizziness, tiredness, nausea and vomiting:"}