{"GUID":"AkKsEQACHt+fl92loS+Iwg==","MATNR":"HZ-ACE","MAKTX":"Acetone","WERKS":"0001","LGORT":"0001","LGOBE":"Lager 0001","SECTION_ID":5,"SECTION_HEADER":"Fire-fighting measures","SECTION_CONTENT":"Suitable Extinguishing Media CO 2, dry chemical, dry sand, alcohol-resistant foam. Water spray. Cool closed containers\nexposed to fire with water spray.\nUnsuitable Extinguishing Media Water may be ineffective\nFlash Point -20 °C / -4 °F\nMethod - Closed cup\nAutoignition Temperature 465 °C/869 °F\nExplosion Limits\nUpper 12.8 vol %\nLower 2.5 vol%\nOxidizing Properties Not oxidising\nSensitivity to Mechanical Impact No information available\nSensitivity to Static Discharge No information available\nSpecific Hazards Arising from the Chemical Flammable. Risk of ignition. Containers may explode when heated. Vapors may form explosive mixtures with air. Vapors may\ntravel to source of ignition and flash back.\nHazardous Combustion Products Carbon monoxide (CO) Carbon dioxide (CO2) Formaldehyde Methanol\nProtective Equipment and Precautions for Firefighters As in any fire, wear self-contained breathing apparatus pressure-demand, MSHA/NIOSH (approved or equivalent) and full\nprotective gear. Thermal decomposition can lead to release of irritating gases and vapors.\nNFPA\nHealth 1\nFlammability 3\nInstability 0\nPhysical hazards N/A","REVISED_CONTENT":"Product ID:HZ-ACE,Product Description:Acetone,Storage Location:0001,Storage Location Description:Lager 0001,Plant:0001,Section Id:5,Section Header:Fire-fighting measures,Section Content:Suitable Extinguishing Media CO 2, dry chemical, dry sand, alcohol-resistant foam. Water spray. Cool closed containers\nexposed to fire with water spray.\nUnsuitable Extinguishing Media Water may be ineffective\nFlash Point -20 °C / -4 °F\nMethod - Closed cup\nAutoignition Temperature 465 °C/869 °F\nExplosion Limits\nUpper 12.8 vol %\nLower 2.5 vol%\nOxidizing Properties Not oxidising\nSensitivity to Mechanical Impact No information available\nSensitivity to Static Discharge No information available\nSpecific Hazards Arising from the Chemical Flammable. Risk of ignition. Containers may explode when heated. Vapors may form explosive mixtures with air. Vapors may\ntravel to source of ignition and flash back.\nHazardous Combustion Products Carbon monoxide (CO) Carbon dioxide (CO2) Formaldehyde Methanol\nProtective Equipment and Precautions for Firefighters As in any fire, wear self-contained breathing apparatus pressure-demand, MSHA/NIOSH (approved or equivalent) and full\nprotective gear. Thermal decomposition can lead to release of irritating gases and vapors.\nNFPA\nHealth 1\nFlammability 3\nInstability 0\nPhysical hazards N/A"}