{"GUID":"AkKsEQACHt+fl92lo2DIwg==","MATNR":"HZ-GAS","MAKTX":"Gasoline","WERKS":"0001","LGORT":"0001","LGOBE":"Lager 0001","SECTION_ID":13,"SECTION_HEADER":"Disposal considerations","SECTION_CONTENT":"Disposal must be in accordance with current applicable\nlaws and regulations, and material characteristics at time of disposal.\nMARPOL - see International Convention for the Prevention of Pollution from Ships (MARPOL 73/78) which provides\ntechnical aspects at controlling pollutions from ships.\nDISPOSAL RECOMMENDATIONS\nProduct is suitable for burning in an enclosed controlled burner for fuel value or disposal by supervised\nincineration at very high temperatures to prevent formation of undesirable combustion products.\nEmpty Container Warning Empty Container Warning (where applicable): Empty containers may contain residue\nand can be dangerous. Do not attempt to refill or clean containers without proper instructions. Empty drums should\nbe completely drained and safely stored until appropriately reconditioned or disposed. Empty containers should be\ntaken for recycling, recovery, or disposal through suitably qualified or licensed contractor and in accordance with\ngovernmental regulations. DO NOT PRESSURISE, CUT, WELD, BRAZE, SOLDER, DRILL, GRIND, OR EXPOSE\nSUCH CONTAINERS TO HEAT, FLAME, SPARKS, STATIC ELECTRICITY, OR OTHER SOURCES OF IGNITION.\nTHEY MAY EXPLODE AND CAUSE INJURY OR DEATH.","REVISED_CONTENT":"Product ID:HZ-GAS,Product Description:Gasoline,Storage Location:0001,Storage Location Description:Lager 0001,Plant:0001,Section Id:13,Section Header:Disposal considerations,Section Content:Disposal must be in accordance with current applicable\nlaws and regulations, and material characteristics at time of disposal.\nMARPOL - see International Convention for the Prevention of Pollution from Ships (MARPOL 73/78) which provides\ntechnical aspects at controlling pollutions from ships.\nDISPOSAL RECOMMENDATIONS\nProduct is suitable for burning in an enclosed controlled burner for fuel value or disposal by supervised\nincineration at very high temperatures to prevent formation of undesirable combustion products.\nEmpty Container Warning Empty Container Warning (where applicable): Empty containers may contain residue\nand can be dangerous. Do not attempt to refill or clean containers without proper instructions. Empty drums should\nbe completely drained and safely stored until appropriately reconditioned or disposed. Empty containers should be\ntaken for recycling, recovery, or disposal through suitably qualified or licensed contractor and in accordance with\ngovernmental regulations. DO NOT PRESSURISE, CUT, WELD, BRAZE, SOLDER, DRILL, GRIND, OR EXPOSE\nSUCH CONTAINERS TO HEAT, FLAME, SPARKS, STATIC ELECTRICITY, OR OTHER SOURCES OF IGNITION.\nTHEY MAY EXPLODE AND CAUSE INJURY OR DEATH."}