{"GUID":"AkKsEQACHt+fl92lrPAIwg==","MATNR":"HZ-SOH","MAKTX":"Sodium hydroxide","WERKS":"0001","LGORT":"0100","LGOBE":"Lagerort WM&HU","SECTION_ID":11,"SECTION_HEADER":"Toxicological information","SECTION_CONTENT":"No acute toxicity information is available for this product\nNot listed\n1350 mg/kg (Rabbit)\nNot listed\nNo information available\nCauses severe burns by all exposure routes\nNo information available\nThe table below indicates whether each agency has listed any ingredient as a carcinogen.\nNot listed\nNot listed\nNot listed\nNot listed\nNot listed\nMutagenic effects have occurred in experimental animals.\nNo information available.\nNo information available.\nNo information available.\nNone known\nNo information available\nProduct is a corrosive material. Use of gastric lavage or emesis is contraindicated.\nPossible perforation of stomach or esophagus should be investigated: Ingestion causes\nsevere swelling, severe damage to the delicate tissue and danger of perforation\nNo information available\nSee actual entry in RTECS for complete information.","REVISED_CONTENT":"Product ID:HZ-SOH,Product Description:Sodium hydroxide,Storage Location:0100,Storage Location Description:Lagerort WM&HU,Plant:0001,Section Id:11,Section Header:Toxicological information,Section Content:No acute toxicity information is available for this product\nNot listed\n1350 mg/kg (Rabbit)\nNot listed\nNo information available\nCauses severe burns by all exposure routes\nNo information available\nThe table below indicates whether each agency has listed any ingredient as a carcinogen.\nNot listed\nNot listed\nNot listed\nNot listed\nNot listed\nMutagenic effects have occurred in experimental animals.\nNo information available.\nNo information available.\nNo information available.\nNone known\nNo information available\nProduct is a corrosive material. Use of gastric lavage or emesis is contraindicated.\nPossible perforation of stomach or esophagus should be investigated: Ingestion causes\nsevere swelling, severe damage to the delicate tissue and danger of perforation\nNo information available\nSee actual entry in RTECS for complete information."}