{"GUID":"AkKsEQACHt+fl92lptDIwg==","MATNR":"HZ-HYS","MAKTX":"Hydrogen sulfide","WERKS":"0001","LGORT":"0001","LGOBE":"Lager 0001","SECTION_ID":1,"SECTION_HEADER":"Identification","SECTION_CONTENT":"Product identifier\nProduct form\nSubstance name\nCAS-No.\nFormula\nOther means of identification\nRelevant identified uses of the substance or mixture and uses advised against\nUse of the substance/mixture\nDetails of the supplier of the safety data sheet\nEmergency telephone number\nEmergency number\n: Substance\n: Hydrogen sulfide\n: 7783-06-4\n: H2S\n: Dihydrogen Sulfide; Sulfur Hydride; Hydrogen Sulphide\n: Industrial and professional use\nLinde Inc.\n10 Riverview Drive\nDanbury, CT 06810-6268, USA\nwww.lindeus.com\nElectronics gas products 1-800-932-0624 or 1-908-329-9700\nLinde Inc. 1-844-44LINDE (1-844-445-4633)\nFor additional product information contact your local customer service.\n: Onsite Emergency: 1-800-645-4633\nCHEMTREC, 24 hr/day 7 days/week\n- Within USA: 1-800-424-9300, Outside USA: 001-703-527-3887\n(collect calls accepted, Contract 17729)","REVISED_CONTENT":"Product ID:HZ-HYS,Product Description:Hydrogen sulfide,Storage Location:0001,Storage Location Description:Lager 0001,Plant:0001,Section Id:1,Section Header:Identification,Section Content:Product identifier\nProduct form\nSubstance name\nCAS-No.\nFormula\nOther means of identification\nRelevant identified uses of the substance or mixture and uses advised against\nUse of the substance/mixture\nDetails of the supplier of the safety data sheet\nEmergency telephone number\nEmergency number\n: Substance\n: Hydrogen sulfide\n: 7783-06-4\n: H2S\n: Dihydrogen Sulfide; Sulfur Hydride; Hydrogen Sulphide\n: Industrial and professional use\nLinde Inc.\n10 Riverview Drive\nDanbury, CT 06810-6268, USA\nwww.lindeus.com\nElectronics gas products 1-800-932-0624 or 1-908-329-9700\nLinde Inc. 1-844-44LINDE (1-844-445-4633)\nFor additional product information contact your local customer service.\n: Onsite Emergency: 1-800-645-4633\nCHEMTREC, 24 hr/day 7 days/week\n- Within USA: 1-800-424-9300, Outside USA: 001-703-527-3887\n(collect calls accepted, Contract 17729)"}