{"GUID":"AkKsEQACHt+fl92lo1kIwg==","MATNR":"HZ-CLG","MAKTX":"Chlorine gas","WERKS":"0001","LGORT":"0001","LGOBE":"Lager 0001","SECTION_ID":15,"SECTION_HEADER":"Regulatory information","SECTION_CONTENT":"Safety, health and environmental regulations/legislation specific for the substance or mixture\nNo further relevant information available.\nSara\nSection 355 (extremely hazardous substances): Substance is listed.\nSection 313 (Specific toxic chemical listings): Substance is listed.\nTSCA (Toxic Substances Control Act): ACTIVE\nHazardous Air Pollutants Substance is listed.\nProposition 65\nChemicals known to cause cancer: Substance is not listed.\nChemicals known to cause reproductive toxicity for females: Substance is not listed.\nChemicals known to cause reproductive toxicity for males: Substance is not listed.","REVISED_CONTENT":"Product ID:HZ-CLG,Product Description:Chlorine gas,Storage Location:0001,Storage Location Description:Lager 0001,Plant:0001,Section Id:15,Section Header:Regulatory information,Section Content:Safety, health and environmental regulations/legislation specific for the substance or mixture\nNo further relevant information available.\nSara\nSection 355 (extremely hazardous substances): Substance is listed.\nSection 313 (Specific toxic chemical listings): Substance is listed.\nTSCA (Toxic Substances Control Act): ACTIVE\nHazardous Air Pollutants Substance is listed.\nProposition 65\nChemicals known to cause cancer: Substance is not listed.\nChemicals known to cause reproductive toxicity for females: Substance is not listed.\nChemicals known to cause reproductive toxicity for males: Substance is not listed."}