{"GUID":"AkKsEQACHt+fl92lptRowg==","MATNR":"HZ-LEA","MAKTX":"Lead","WERKS":"0001","LGORT":"0088","LGOBE":"Lager 0088 (WM)","SECTION_ID":14,"SECTION_HEADER":"Transport information","SECTION_CONTENT":"DOT\nUN-No\nProper Shipping Name\nProper technical name\nHazard Class\nPacking Group\nTDG\nUN-No\nUN3077\nENVIRONMENTALLY HAZARDOUS SUBSTANCES, SOLID, N.O.S.\nLead\n9\nIII\nUN3077\nIATA\nUN-No\nProper Shipping Name\nHazard Class\nPacking Group\nUN3077\nENVIRONMENTALLY HAZARDOUS SUBSTANCES, SOLID, N.O.S.\n9\nIII\nIMDG/IMO\nUN-No\nProper Shipping Name\nHazard Class\nPacking Group\nUN3077\nENVIRONMENTALLY HAZARDOUS SUBSTANCES, SOLID, N.O.S.\n9\nIII","REVISED_CONTENT":"Product ID:HZ-LEA,Product Description:Lead,Storage Location:0088,Storage Location Description:Lager 0088 (WM),Plant:0001,Section Id:14,Section Header:Transport information,Section Content:DOT\nUN-No\nProper Shipping Name\nProper technical name\nHazard Class\nPacking Group\nTDG\nUN-No\nUN3077\nENVIRONMENTALLY HAZARDOUS SUBSTANCES, SOLID, N.O.S.\nLead\n9\nIII\nUN3077\nIATA\nUN-No\nProper Shipping Name\nHazard Class\nPacking Group\nUN3077\nENVIRONMENTALLY HAZARDOUS SUBSTANCES, SOLID, N.O.S.\n9\nIII\nIMDG/IMO\nUN-No\nProper Shipping Name\nHazard Class\nPacking Group\nUN3077\nENVIRONMENTALLY HAZARDOUS SUBSTANCES, SOLID, N.O.S.\n9\nIII"}