{"GUID":"AkKsEQACHt+fl92lo14owg==","MATNR":"HZ-ETH","MAKTX":"Ethanol","WERKS":"0001","LGORT":"0001","LGOBE":"Lager 0001","SECTION_ID":8,"SECTION_HEADER":"Exposure controls / personal protection","SECTION_CONTENT":"· Additional information about design of technical systems: No further data; see item 7.\nControl parameters\nComponents with limit values that require monitoring at the workplace:\n64-17-5 ethanol\nPEL Long-term value: 1900 mg/m³, 1000 ppm\nREL Long-term value: 1900 mg/m³, 1000 ppm\nTLV Short-term value: 1880 mg/m³, 1000 ppm\n· Additional information: The lists that were valid during the creation were used as basis.\nExposure controls\nPersonal protective equipment:\nGeneral protective and hygienic measures:\nKeep away from foodstuffs, beverages and feed.\nImmediately remove all soiled and contaminated clothing.\nWash hands before breaks and at the end of work.\nStore protective clothing separately.\nAvoid contact with the eyes.\nAvoid contact with the eyes and skin.\n· Breathing equipment:\nWhen used as intended with Agilent instruments, the use of the product under normal laboratory conditions and\nwith standard practices does not result in significant airborne exposures and therefore respiratory protection is not\nneeded.\nUnder an emergency condition where a respirator is deemed necessary, use a NIOSH or equivalent approved\ndevice/equipment with appropriate organic or acid gas cartridge.","REVISED_CONTENT":"Product ID:HZ-ETH,Product Description:Ethanol,Storage Location:0001,Storage Location Description:Lager 0001,Plant:0001,Section Id:8,Section Header:Exposure controls / personal protection,Section Content:· Additional information about design of technical systems: No further data; see item 7.\nControl parameters\nComponents with limit values that require monitoring at the workplace:\n64-17-5 ethanol\nPEL Long-term value: 1900 mg/m³, 1000 ppm\nREL Long-term value: 1900 mg/m³, 1000 ppm\nTLV Short-term value: 1880 mg/m³, 1000 ppm\n· Additional information: The lists that were valid during the creation were used as basis.\nExposure controls\nPersonal protective equipment:\nGeneral protective and hygienic measures:\nKeep away from foodstuffs, beverages and feed.\nImmediately remove all soiled and contaminated clothing.\nWash hands before breaks and at the end of work.\nStore protective clothing separately.\nAvoid contact with the eyes.\nAvoid contact with the eyes and skin.\n· Breathing equipment:\nWhen used as intended with Agilent instruments, the use of the product under normal laboratory conditions and\nwith standard practices does not result in significant airborne exposures and therefore respiratory protection is not\nneeded.\nUnder an emergency condition where a respirator is deemed necessary, use a NIOSH or equivalent approved\ndevice/equipment with appropriate organic or acid gas cartridge."}