{"GUID":"AkKsEQACHt+fl92lpuLIwg==","MATNR":"HZ-NIT","MAKTX":"Nitrogen","WERKS":"0001","LGORT":"0001","LGOBE":"Lager 0001","SECTION_ID":1,"SECTION_HEADER":"Identification","SECTION_CONTENT":"1.1.\nIdentification\nProduct form\nSubstance name\nChemical name\nCAS-No.\nProduct code\n1.2.\nRecommended use and restrictions on use\nUse of the substance/mixture\n1.3.\nSupplier\nAir Liquide USA LLC and its affiliates\n9811 Katy Freeway, Suite 100\nHouston, TX 77024 - USA\nT 1-800-819-1704\nwww.us.airliquide.com\n1.4.\nEmergency telephone number\nEmergency number\n: Substance\n: Nitrogen\n: Nitrogen\n: 7727-37-9\n: SG-1001-00181\n: Test gas/Calibration gas.\n: Chemtrec: 1-800-424-9300","REVISED_CONTENT":"Product ID:HZ-NIT,Product Description:Nitrogen,Storage Location:0001,Storage Location Description:Lager 0001,Plant:0001,Section Id:1,Section Header:Identification,Section Content:1.1.\nIdentification\nProduct form\nSubstance name\nChemical name\nCAS-No.\nProduct code\n1.2.\nRecommended use and restrictions on use\nUse of the substance/mixture\n1.3.\nSupplier\nAir Liquide USA LLC and its affiliates\n9811 Katy Freeway, Suite 100\nHouston, TX 77024 - USA\nT 1-800-819-1704\nwww.us.airliquide.com\n1.4.\nEmergency telephone number\nEmergency number\n: Substance\n: Nitrogen\n: Nitrogen\n: 7727-37-9\n: SG-1001-00181\n: Test gas/Calibration gas.\n: Chemtrec: 1-800-424-9300"}