{"GUID":"AkKsEQACHt+fl92lrOlowg==","MATNR":"HZ-SAC","MAKTX":"Sulfuric acid","WERKS":"0001","LGORT":"0003","LGOBE":"Corrosive Items","SECTION_ID":6,"SECTION_HEADER":"Accidental release measures","SECTION_CONTENT":"Use personal protective equipment. Wear self-contained breathing apparatus and protective suit. Evacuate personnel to safe areas. Keep people away from and upwind of spill/leak. Ensure adequate ventilation. Avoid contact with skin, eyes and clothing. Avoid release to the environment. See Section 12 for additional ecological information. Soak up with inert absorbent material. Keep in suitable, closed containers for disposal.","REVISED_CONTENT":"Product ID:HZ-SAC,Product Description:Sulfuric acid,Storage Location:0003,Storage Location Description:Corrosive Items,Plant:0001,Section Id:6,Section Header:Accidental release measures,Section Content:Use personal protective equipment. Wear self-contained breathing apparatus and protective suit. Evacuate personnel to safe areas. Keep people away from and upwind of spill/leak. Ensure adequate ventilation. Avoid contact with skin, eyes and clothing. Avoid release to the environment. See Section 12 for additional ecological information. Soak up with inert absorbent material. Keep in suitable, closed containers for disposal."}