{"GUID":"AkKsEQACHt+fl92lo1ZIwg==","MATNR":"HZ-CHL","MAKTX":"Chlorine","WERKS":"0001","LGORT":"0001","LGOBE":"Lager 0001","SECTION_ID":9,"SECTION_HEADER":"Physical and chemical properties","SECTION_CONTENT":"9.1. Information on basic physical and chemical properties\nPhysical state\nAppearance\nColor\nOdor\nOdor threshold\npH\nMelting point\nFreezing point\nBoiling point\nCritical temperature\nCritical pressure\nFlash point\nRelative evaporation rate (butyl acetate=1)\nFlammability (solid, gas)\nVapor pressure\nRelative vapor density at 20 °C\nRelative density\nDensity\nMolecular mass\nRelative gas density\nSolubility\nPartition coefficient n-octanol/water (Log Pow)\nAuto-ignition temperature\nDecomposition temperature\nViscosity, kinematic\nViscosity, dynamic\nExplosion limits\nExplosive properties\nOxidizing properties\nCi\n9.2. Other information\nAdditional information\n: Gas\n: Greenish-yellow gas.\n: Greenish gas.\n: Pungent.\n: Odor threshold is subjective and inadequate to warn for overexposure\n0.23 mg/m³ (Dixon and Ikels)\n: If dissolved in water pH-value will be affected.\n: -101 °C\n: No data available\n: -32.95 °C\n: 144.75 °C\n: 7991 kPa\n: No data available\n: No data available\n: See Section 2.1 and 2.2\nNon flammable.\n: 3692.287318698 mbar\n: 2.473\n: 1.6\n: 2.7 kg/m³ (at 50 °C)\n: 70.906 g/mol\n: Heavier than air\n: Water: 8620 mg/l\n: Not applicable for inorganic products.\n: Not applicable - non flammable\n: No data available\n: No reliable data available.\n: No reliable data available.\n: Not applicable - non flammable\n: Not applicable (non-flammable gas).\n: Not combustible but enhances combustion of other substances. May cause or intensify fire;\noxidizer.\n: 0.7\n: Gas/vapor heavier than air. May accumulate in confined spaces, particularly at or below ground\nlevel","REVISED_CONTENT":"Product ID:HZ-CHL,Product Description:Chlorine,Storage Location:0001,Storage Location Description:Lager 0001,Plant:0001,Section Id:9,Section Header:Physical and chemical properties,Section Content:9.1. Information on basic physical and chemical properties\nPhysical state\nAppearance\nColor\nOdor\nOdor threshold\npH\nMelting point\nFreezing point\nBoiling point\nCritical temperature\nCritical pressure\nFlash point\nRelative evaporation rate (butyl acetate=1)\nFlammability (solid, gas)\nVapor pressure\nRelative vapor density at 20 °C\nRelative density\nDensity\nMolecular mass\nRelative gas density\nSolubility\nPartition coefficient n-octanol/water (Log Pow)\nAuto-ignition temperature\nDecomposition temperature\nViscosity, kinematic\nViscosity, dynamic\nExplosion limits\nExplosive properties\nOxidizing properties\nCi\n9.2. Other information\nAdditional information\n: Gas\n: Greenish-yellow gas.\n: Greenish gas.\n: Pungent.\n: Odor threshold is subjective and inadequate to warn for overexposure\n0.23 mg/m³ (Dixon and Ikels)\n: If dissolved in water pH-value will be affected.\n: -101 °C\n: No data available\n: -32.95 °C\n: 144.75 °C\n: 7991 kPa\n: No data available\n: No data available\n: See Section 2.1 and 2.2\nNon flammable.\n: 3692.287318698 mbar\n: 2.473\n: 1.6\n: 2.7 kg/m³ (at 50 °C)\n: 70.906 g/mol\n: Heavier than air\n: Water: 8620 mg/l\n: Not applicable for inorganic products.\n: Not applicable - non flammable\n: No data available\n: No reliable data available.\n: No reliable data available.\n: Not applicable - non flammable\n: Not applicable (non-flammable gas).\n: Not combustible but enhances combustion of other substances. May cause or intensify fire;\noxidizer.\n: 0.7\n: Gas/vapor heavier than air. May accumulate in confined spaces, particularly at or below ground\nlevel"}