{"GUID":"AkKsEQACHt+fl92lrPLowg==","MATNR":"HZ-SUL","MAKTX":"Sulfur","WERKS":"0001","LGORT":"0001","LGOBE":"Lager 0001","SECTION_ID":2,"SECTION_HEADER":"Hazard identification","SECTION_CONTENT":"2.1. Classification of the Substance or Mixture\nGHS-US Classification\nFlam. Sol. 2\nSkin Irrit. 2\nAquatic Acute 2\nComb. Dust\nH228\nH315\nH401\nFull text of hazard classes and H-statements: see Section 16.\n2.2.\nLabel Elements\nGHS-US Labeling\nHazard Pictograms (GHS-US)\nSignal Word (GHS-US)\nHazard Statements (GHS-US)\nPrecautionary Statements (GHS-US)\n: Warning\n: May form combustible dust concentrations in air.\nH228 - Flammable solid.\nH315 - Causes skin irritation.\nH401 - Toxic to aquatic life.\nP210 - Keep away from heat, sparks, open flames, hot surfaces. - No smoking.\nP240 - Ground/Bond container and receiving equipment.\nP241 - Use explosion-proof electrical, ventilating, and lighting equipment.\nP264 - Wash hands, forearms, and other exposed areas thoroughly after handling.\nP273 - Avoid release to the environment.\nP280 - Wear gloves, protective clothing, eye protection, face protection.\nP302+P352 - If on skin: Wash with plenty of water.\nP321 - Specific treatment (see Section 4 on this SDS).\nP332+P313 - If skin irritation occurs: Get medical advice/attention.","REVISED_CONTENT":"Product ID:HZ-SUL,Product Description:Sulfur,Storage Location:0001,Storage Location Description:Lager 0001,Plant:0001,Section Id:2,Section Header:Hazard identification,Section Content:2.1. Classification of the Substance or Mixture\nGHS-US Classification\nFlam. Sol. 2\nSkin Irrit. 2\nAquatic Acute 2\nComb. Dust\nH228\nH315\nH401\nFull text of hazard classes and H-statements: see Section 16.\n2.2.\nLabel Elements\nGHS-US Labeling\nHazard Pictograms (GHS-US)\nSignal Word (GHS-US)\nHazard Statements (GHS-US)\nPrecautionary Statements (GHS-US)\n: Warning\n: May form combustible dust concentrations in air.\nH228 - Flammable solid.\nH315 - Causes skin irritation.\nH401 - Toxic to aquatic life.\nP210 - Keep away from heat, sparks, open flames, hot surfaces. - No smoking.\nP240 - Ground/Bond container and receiving equipment.\nP241 - Use explosion-proof electrical, ventilating, and lighting equipment.\nP264 - Wash hands, forearms, and other exposed areas thoroughly after handling.\nP273 - Avoid release to the environment.\nP280 - Wear gloves, protective clothing, eye protection, face protection.\nP302+P352 - If on skin: Wash with plenty of water.\nP321 - Specific treatment (see Section 4 on this SDS).\nP332+P313 - If skin irritation occurs: Get medical advice/attention."}