{"GUID":"AkKsEQACHt+fl92loS8Iwg==","MATNR":"HZ-ACE","MAKTX":"Acetone","WERKS":"0001","LGORT":"0001","LGOBE":"Lager 0001","SECTION_ID":1,"SECTION_HEADER":"Identification","SECTION_CONTENT":"Product Name\nCat No. : AC167640000; AC167640025; AC167645000\nSynonyms 2-Propanone\nRecommended Use Laboratory chemicals.\nUses advised against No Information available\nDetails of the supplier of the safety data sheet\nCompany Fisher Scientific\nOne Reagent Lane\nFair Lawn, NJ 07410\nTel: (201) 796-7100\nEntity / Business Name Acros Organics\nOne Reagent Lane\nFair Lawn, NJ 07410\nEmergency Telephone Number\nFor information US call: 001-800-ACROS-01\n/ Europe call: +32 14 57 52 11\nEmergency Number US:001-201-796-7100 /\nEurope: +32 14 57 52 99\nCHEMTREC Tel. No.US: 001-800-424-9300 /\nEurope:001-703-527-3887","REVISED_CONTENT":"Product ID:HZ-ACE,Product Description:Acetone,Storage Location:0001,Storage Location Description:Lager 0001,Plant:0001,Section Id:1,Section Header:Identification,Section Content:Product Name\nCat No. : AC167640000; AC167640025; AC167645000\nSynonyms 2-Propanone\nRecommended Use Laboratory chemicals.\nUses advised against No Information available\nDetails of the supplier of the safety data sheet\nCompany Fisher Scientific\nOne Reagent Lane\nFair Lawn, NJ 07410\nTel: (201) 796-7100\nEntity / Business Name Acros Organics\nOne Reagent Lane\nFair Lawn, NJ 07410\nEmergency Telephone Number\nFor information US call: 001-800-ACROS-01\n/ Europe call: +32 14 57 52 11\nEmergency Number US:001-201-796-7100 /\nEurope: +32 14 57 52 99\nCHEMTREC Tel. No.US: 001-800-424-9300 /\nEurope:001-703-527-3887"}