{"GUID":"AkKsEQACHt+fl92lpuRIwg==","MATNR":"HZ-NIT","MAKTX":"Nitrogen","WERKS":"0001","LGORT":"0001","LGOBE":"Lager 0001","SECTION_ID":13,"SECTION_HEADER":"Disposal considerations","SECTION_CONTENT":"13.1.\nDisposal methods\nWaste treatment methods\nProduct/Packaging disposal recommendations\nAdditional information\n: Contact supplier if guidance is required. Do not discharge into any place where its accumulation could be dangerous. Ensure that the emission levels from local regulations or operating permits are not exceeded.\n: Refer to the CGA Pamphlet P-63 \"Disposal of Gases\" available at www.cganet.com for more guidance on suitable disposal methods.\n: None.","REVISED_CONTENT":"Product ID:HZ-NIT,Product Description:Nitrogen,Storage Location:0001,Storage Location Description:Lager 0001,Plant:0001,Section Id:13,Section Header:Disposal considerations,Section Content:13.1.\nDisposal methods\nWaste treatment methods\nProduct/Packaging disposal recommendations\nAdditional information\n: Contact supplier if guidance is required. Do not discharge into any place where its accumulation could be dangerous. Ensure that the emission levels from local regulations or operating permits are not exceeded.\n: Refer to the CGA Pamphlet P-63 \"Disposal of Gases\" available at www.cganet.com for more guidance on suitable disposal methods.\n: None."}