{"GUID":"AkKsEQACHt+fl92lpt7Iwg==","MATNR":"HZ-MET","MAKTX":"Methane","WERKS":"0001","LGORT":"0001","LGOBE":"Lager 0001","SECTION_ID":1,"SECTION_HEADER":"Identification","SECTION_CONTENT":"GHS product identifier : Methane\nChemical name : methane\nOther means of\nidentification : Methane or natural gas; Marsh gas; Methyl hydride; CH4; Fire Damp;\nProduct type : Gas.\nProduct use : Synthetic/Analytical chemistry.\nSynonym : Methane or natural gas; Marsh gas; Methyl hydride; CH4; Fire Damp;\nSDS # : 001033\nSupplier's details : Airgas USA, LLC and its affiliates\n259 North Radnor-Chester Road\nSuite 100\nRadnor, PA 19087-5283\n1-610-687-5253\n24-hour telephone : 1-866-734-3438","REVISED_CONTENT":"Product ID:HZ-MET,Product Description:Methane,Storage Location:0001,Storage Location Description:Lager 0001,Plant:0001,Section Id:1,Section Header:Identification,Section Content:GHS product identifier : Methane\nChemical name : methane\nOther means of\nidentification : Methane or natural gas; Marsh gas; Methyl hydride; CH4; Fire Damp;\nProduct type : Gas.\nProduct use : Synthetic/Analytical chemistry.\nSynonym : Methane or natural gas; Marsh gas; Methyl hydride; CH4; Fire Damp;\nSDS # : 001033\nSupplier's details : Airgas USA, LLC and its affiliates\n259 North Radnor-Chester Road\nSuite 100\nRadnor, PA 19087-5283\n1-610-687-5253\n24-hour telephone : 1-866-734-3438"}