{"GUID":"AkKsEQACHt+fl92lps7Iwg==","MATNR":"HZ-HYP","MAKTX":"Hydrogen Peroxide 3%","WERKS":"0001","LGORT":"0002","LGOBE":"Cold Storage","SECTION_ID":1,"SECTION_HEADER":"Identification","SECTION_CONTENT":"Hydrogen Peroxide 3%\nAC426000000; AC426000010; AC426000250; AC426001000\nNo information available\nLaboratory chemicals.\nCompany\nFisher Scientific\nOne Reagent Lane\nFair Lawn, NJ 07410\nTel: (201) 796-7100\nEntity / Business Name\nAcros Organics\nOne Reagent Lane\nFair Lawn, NJ 07410\nEmergency Telephone Number\nFor information US call: 001-800-ACROS-01\n/ Europe call: +32 14 57 52 11\nEmergency Number US:001-201-796-7100 /\nEurope: +32 14 57 52 99\nCHEMTREC Tel. No. US: 001-800-424-9300 /\nEurope:001-703-527-3887","REVISED_CONTENT":"Product ID:HZ-HYP,Product Description:Hydrogen Peroxide 3%,Storage Location:0002,Storage Location Description:Cold Storage,Plant:0001,Section Id:1,Section Header:Identification,Section Content:Hydrogen Peroxide 3%\nAC426000000; AC426000010; AC426000250; AC426001000\nNo information available\nLaboratory chemicals.\nCompany\nFisher Scientific\nOne Reagent Lane\nFair Lawn, NJ 07410\nTel: (201) 796-7100\nEntity / Business Name\nAcros Organics\nOne Reagent Lane\nFair Lawn, NJ 07410\nEmergency Telephone Number\nFor information US call: 001-800-ACROS-01\n/ Europe call: +32 14 57 52 11\nEmergency Number US:001-201-796-7100 /\nEurope: +32 14 57 52 99\nCHEMTREC Tel. No. US: 001-800-424-9300 /\nEurope:001-703-527-3887"}