{"GUID":"AkKsEQACHt+fl92lptoIwg==","MATNR":"HZ-MAL","MAKTX":"Malathion","WERKS":"0001","LGORT":"0088","LGOBE":"Lager 0088 (WM)","SECTION_ID":11,"SECTION_HEADER":"Toxicological information","SECTION_CONTENT":"11.1 Information on toxicological effects\nAcute toxicity\nLD50 Oral - Rat - 644 mg/kg\nRemarks: (RTECS)\nInhalation: No data available\nLD50 Dermal - Rabbit - 8,790 mg/kg\nRemarks: (IUCLID)\nSkin corrosion/irritation\nRemarks: No data available\nSerious eye damage/eye irritation\nEyes - Rabbit\nResult: No eye irritation\nRespiratory or skin sensitization\nMay cause allergic skin reaction. Classified according to Regulation (EU) 1272/2008, Annex\nVI (Table 3.1/3.2)\nGerm cell mutagenicity\nTest Type: Human\nTest system: leukocyte\nRemarks: Cytogenetic analysis\nTest Type: Human\nTest system: lymphocyte\nRemarks: Cytogenetic analysis\nTest Type: Human\nTest system: lymphocyte\nRemarks: DNA inhibition\nTest Type: Human\nTest system: fibroblast\nRemarks: Other mutation test systems\nTest Type: Human\nTest system: leukocyte\nRemarks: Sister chromatid exchange\nTest Type: Human\nTest system: fibroblast\nRemarks: Sister chromatid exchange\nTest Type: Hamster\nTest system: ovary\nRemarks: Cytogenetic analysis\nTest Type: Hamster\nTest system: Lungs\nRemarks: Cytogenetic analysis\nTest Type: Hamster\nTest system: Lungs\nRemarks: Sister chromatid exchange\nTest Type: Hamster\nTest system: ovary\nRemarks: Sister chromatid exchange\nTest Type: Human\nTest system: lymphocyte\nRemarks: Unscheduled DNA synthesis\nTest Type: Human\nTest system: lymphocyte\nRemarks: Micronucleus test\nSpecies: Mouse","REVISED_CONTENT":"Product ID:HZ-MAL,Product Description:Malathion,Storage Location:0088,Storage Location Description:Lager 0088 (WM),Plant:0001,Section Id:11,Section Header:Toxicological information,Section Content:11.1 Information on toxicological effects\nAcute toxicity\nLD50 Oral - Rat - 644 mg/kg\nRemarks: (RTECS)\nInhalation: No data available\nLD50 Dermal - Rabbit - 8,790 mg/kg\nRemarks: (IUCLID)\nSkin corrosion/irritation\nRemarks: No data available\nSerious eye damage/eye irritation\nEyes - Rabbit\nResult: No eye irritation\nRespiratory or skin sensitization\nMay cause allergic skin reaction. Classified according to Regulation (EU) 1272/2008, Annex\nVI (Table 3.1/3.2)\nGerm cell mutagenicity\nTest Type: Human\nTest system: leukocyte\nRemarks: Cytogenetic analysis\nTest Type: Human\nTest system: lymphocyte\nRemarks: Cytogenetic analysis\nTest Type: Human\nTest system: lymphocyte\nRemarks: DNA inhibition\nTest Type: Human\nTest system: fibroblast\nRemarks: Other mutation test systems\nTest Type: Human\nTest system: leukocyte\nRemarks: Sister chromatid exchange\nTest Type: Human\nTest system: fibroblast\nRemarks: Sister chromatid exchange\nTest Type: Hamster\nTest system: ovary\nRemarks: Cytogenetic analysis\nTest Type: Hamster\nTest system: Lungs\nRemarks: Cytogenetic analysis\nTest Type: Hamster\nTest system: Lungs\nRemarks: Sister chromatid exchange\nTest Type: Hamster\nTest system: ovary\nRemarks: Sister chromatid exchange\nTest Type: Human\nTest system: lymphocyte\nRemarks: Unscheduled DNA synthesis\nTest Type: Human\nTest system: lymphocyte\nRemarks: Micronucleus test\nSpecies: Mouse"}