{"GUID":"AkKsEQACHt+fl92lpsnIwg==","MATNR":"HZ-GLY","MAKTX":"Glyphosate","WERKS":"0001","LGORT":"0088","LGOBE":"Lager 0088 (WM)","SECTION_ID":9,"SECTION_HEADER":"Physical and chemical properties","SECTION_CONTENT":"Physical State Solid\nAppearance White to yellow\nOdor No information available\nOdor Threshold No information available\npH 2.5 @ 20°C 10 g/L aq.sol\nMelting Point/Range 230 °C / 446 °F\nBoiling Point/Range No information available\nFlash Point No information available\nEvaporation Rate Not applicable\nFlammability (solid,gas) No information available\nFlammability or explosive limits No data available\nUpper No data available\nLower No information available\nVapor Pressure Not applicable\nVapor Density No information available\nSpecific Gravity No information available\nSolubility Soluble in water\nPartition coefficient; n-octanol/water No data available\nAutoignition Temperature No information available\nDecomposition Temperature No information available\nViscosity Not applicable\nMolecular Formula C3 H8 N O5 P\nMolecular Weight 169.07","REVISED_CONTENT":"Product ID:HZ-GLY,Product Description:Glyphosate,Storage Location:0088,Storage Location Description:Lager 0088 (WM),Plant:0001,Section Id:9,Section Header:Physical and chemical properties,Section Content:Physical State Solid\nAppearance White to yellow\nOdor No information available\nOdor Threshold No information available\npH 2.5 @ 20°C 10 g/L aq.sol\nMelting Point/Range 230 °C / 446 °F\nBoiling Point/Range No information available\nFlash Point No information available\nEvaporation Rate Not applicable\nFlammability (solid,gas) No information available\nFlammability or explosive limits No data available\nUpper No data available\nLower No information available\nVapor Pressure Not applicable\nVapor Density No information available\nSpecific Gravity No information available\nSolubility Soluble in water\nPartition coefficient; n-octanol/water No data available\nAutoignition Temperature No information available\nDecomposition Temperature No information available\nViscosity Not applicable\nMolecular Formula C3 H8 N O5 P\nMolecular Weight 169.07"}