{"GUID":"AkKsEQACHt+fl92lrOFowg==","MATNR":"HZ-PLU","MAKTX":"Plutonium nitrate","WERKS":"0001","LGORT":"0088","LGOBE":"Lager 0088 (WM)","SECTION_ID":6,"SECTION_HEADER":"Accidental release measures","SECTION_CONTENT":"OCCUPATIONAL SPILL: Do not touch damaged containers or spilled material. Call\nradiation safety personnel for assistance. For small liquid spills, use absorbent pads or other\nnon-dispersible absorbent materials. Isolate the area to prevent unnecessary access by\nnonessential personnel. Enter spill area only to save life; use all practical means to control the\nspread of possibly contaminated materials. Uninjured persons and possibly contaminated\nequipment and materials should be kept from leaving until monitored by qualified radiation\nauthority. Cleanup should not be attempted except at the instruction of qualified radiation\nauthority.","REVISED_CONTENT":"Product ID:HZ-PLU,Product Description:Plutonium nitrate,Storage Location:0088,Storage Location Description:Lager 0088 (WM),Plant:0001,Section Id:6,Section Header:Accidental release measures,Section Content:OCCUPATIONAL SPILL: Do not touch damaged containers or spilled material. Call\nradiation safety personnel for assistance. For small liquid spills, use absorbent pads or other\nnon-dispersible absorbent materials. Isolate the area to prevent unnecessary access by\nnonessential personnel. Enter spill area only to save life; use all practical means to control the\nspread of possibly contaminated materials. Uninjured persons and possibly contaminated\nequipment and materials should be kept from leaving until monitored by qualified radiation\nauthority. Cleanup should not be attempted except at the instruction of qualified radiation\nauthority."}