{"GUID":"AkKsEQACHt+fl92lpuVowg==","MATNR":"HZ-OXY","MAKTX":"Oxygen","WERKS":"0001","LGORT":"0001","LGOBE":"Lager 0001","SECTION_ID":6,"SECTION_HEADER":"Accidental release measures","SECTION_CONTENT":"Personal precautions, protective equipment and emergency procedures\nFor non-emergency\npersonnel : No action shall be taken involving any personal risk or without suitable training.\nEvacuate surrounding areas. Keep unnecessary and unprotected personnel from\nentering. Shut off all ignition sources. No flares, smoking or flames in hazard area.\nAvoid breathing gas. Provide adequate ventilation. Wear appropriate respirator when\nventilation is inadequate. Put on appropriate personal protective equipment.\nFor emergency responders: If specialized clothing is required to deal with the spillage, take note of any information in\nSection 8 on suitable and unsuitable materials. See also the information in \"For non-\nemergency personnel\".\nEnvironmental precautions : Ensure emergency procedures to deal with accidental gas releases are in place to avoid\ncontamination of the environment. Inform the relevant authorities if the product has\ncaused environmental pollution (sewers, waterways, soil or air).","REVISED_CONTENT":"Product ID:HZ-OXY,Product Description:Oxygen,Storage Location:0001,Storage Location Description:Lager 0001,Plant:0001,Section Id:6,Section Header:Accidental release measures,Section Content:Personal precautions, protective equipment and emergency procedures\nFor non-emergency\npersonnel : No action shall be taken involving any personal risk or without suitable training.\nEvacuate surrounding areas. Keep unnecessary and unprotected personnel from\nentering. Shut off all ignition sources. No flares, smoking or flames in hazard area.\nAvoid breathing gas. Provide adequate ventilation. Wear appropriate respirator when\nventilation is inadequate. Put on appropriate personal protective equipment.\nFor emergency responders: If specialized clothing is required to deal with the spillage, take note of any information in\nSection 8 on suitable and unsuitable materials. See also the information in \"For non-\nemergency personnel\".\nEnvironmental precautions : Ensure emergency procedures to deal with accidental gas releases are in place to avoid\ncontamination of the environment. Inform the relevant authorities if the product has\ncaused environmental pollution (sewers, waterways, soil or air)."}