{"GUID":"AkKsEQACHt+fl92loTAowg==","MATNR":"HZ-ACE","MAKTX":"Acetone","WERKS":"0001","LGORT":"0001","LGOBE":"Lager 0001","SECTION_ID":10,"SECTION_HEADER":"Stability and reactivity","SECTION_CONTENT":"Reactive Hazard None known, based on information available\nStability Stable under normal conditions.\nConditions to Avoid Heat, flames and sparks. Incompatible products. Keep away from open flames, hot\nsurfaces and sources of ignition.\nIncompatible Materials Strong oxidizing agents, Strong reducing agents, Strong bases, Peroxides, Halogenated\ncompounds, Alkali metals, Amines\nHazardous Decomposition Products Carbon monoxide (CO), Carbon dioxide (CO2), Formaldehyde, Methanol\nHazardous Polymerization Hazardous polymerization does not occur.\nHazardous Reactions None under normal processing.","REVISED_CONTENT":"Product ID:HZ-ACE,Product Description:Acetone,Storage Location:0001,Storage Location Description:Lager 0001,Plant:0001,Section Id:10,Section Header:Stability and reactivity,Section Content:Reactive Hazard None known, based on information available\nStability Stable under normal conditions.\nConditions to Avoid Heat, flames and sparks. Incompatible products. Keep away from open flames, hot\nsurfaces and sources of ignition.\nIncompatible Materials Strong oxidizing agents, Strong reducing agents, Strong bases, Peroxides, Halogenated\ncompounds, Alkali metals, Amines\nHazardous Decomposition Products Carbon monoxide (CO), Carbon dioxide (CO2), Formaldehyde, Methanol\nHazardous Polymerization Hazardous polymerization does not occur.\nHazardous Reactions None under normal processing."}