{"GUID":"AkKsEQACHt+fl92lptqIwg==","MATNR":"HZ-MAL","MAKTX":"Malathion","WERKS":"0001","LGORT":"0088","LGOBE":"Lager 0088 (WM)","SECTION_ID":15,"SECTION_HEADER":"Regulatory information","SECTION_CONTENT":"SARA 302 Components\nThis material does not contain any components with a section 302 EHS TPQ.\nSARA 313 Components\nThe following components are subject to reporting levels established by SARA Title III,\nSection 313:\nMalathion\nCAS-No.\n121-75-5\nRevision Date\n2018-04-24\nSARA 311/312 Hazards\nAcute Health Hazard, Chronic Health Hazard\nMassachusetts Right To Know Components\nMalathion\nCAS-No.\n121-75-5\nRevision Date\n2018-04-24\nPennsylvania Right To Know Components\nMalathion\nCAS-No.\n121-75-5\nRevision Date\n2018-04-24\nCalifornia Prop. 65 Components\nwhich is/are known to the State of California to\ncause cancer. For more information go to\nwww.P65Warnings.ca.gov.Malathion\nCAS-No.\n121-75-5\nRevision Date\n2016-05-20","REVISED_CONTENT":"Product ID:HZ-MAL,Product Description:Malathion,Storage Location:0088,Storage Location Description:Lager 0088 (WM),Plant:0001,Section Id:15,Section Header:Regulatory information,Section Content:SARA 302 Components\nThis material does not contain any components with a section 302 EHS TPQ.\nSARA 313 Components\nThe following components are subject to reporting levels established by SARA Title III,\nSection 313:\nMalathion\nCAS-No.\n121-75-5\nRevision Date\n2018-04-24\nSARA 311/312 Hazards\nAcute Health Hazard, Chronic Health Hazard\nMassachusetts Right To Know Components\nMalathion\nCAS-No.\n121-75-5\nRevision Date\n2018-04-24\nPennsylvania Right To Know Components\nMalathion\nCAS-No.\n121-75-5\nRevision Date\n2018-04-24\nCalifornia Prop. 65 Components\nwhich is/are known to the State of California to\ncause cancer. For more information go to\nwww.P65Warnings.ca.gov.Malathion\nCAS-No.\n121-75-5\nRevision Date\n2016-05-20"}