{"GUID":"AkKsEQACHt+fl92lpt4Iwg==","MATNR":"HZ-MER","MAKTX":"Mercury","WERKS":"0001","LGORT":"0088","LGOBE":"Lager 0088 (WM)","SECTION_ID":11,"SECTION_HEADER":"Toxicological information","SECTION_CONTENT":"Acute Toxicity\nProduct Information\nComponent Information\nComponent\nMercury\nLD50 Oral\nNot listed\nLD50 Dermal\nNot listed\nLC50 Inhalation\nLC50 < 27 mg/m³ (Rat) 2 h\nToxicologically Synergistic\nProducts\nNo information available\nDelayed and immediate effects as well as chronic effects from short and long-term exposure\nIrritation\nNo information available\nSensitization\nNo information available\nCarcinogenicity\nComponent\nMercury\nCAS No\n7439-97-6\nThe table below indicates whether each agency has listed any ingredient as a carcinogen.\nIARC\nNot listed\nNTP\nNot listed\nACGIH\nNot listed\nOSHA\nNot listed\nMexico\nNot listed\nMutagenic Effects\nNo information available\nReproductive Effects\nNo information available.\nDevelopmental Effects\nMay cause harm to the unborn child.\nTeratogenicity\nNo information available.\nSTOT - single exposure\nNone known\nSTOT - repeated exposure\nCentral nervous system (CNS) Kidney Liver\nAspiration hazard\nNo information available\nSymptoms / effects, both acute and May cause central nervous system depression: May cause adverse kidney effects: May\ndela yed\ncause adverse liver effects: Symptoms may be delayed: Chronic exposure damages the\nbrain and the central nervous system\nEndocrine Disruptor Information\nNo information available\nOther Adverse Effects\nThe toxicological properties have not been fully investigated.\nEcotoxicity","REVISED_CONTENT":"Product ID:HZ-MER,Product Description:Mercury,Storage Location:0088,Storage Location Description:Lager 0088 (WM),Plant:0001,Section Id:11,Section Header:Toxicological information,Section Content:Acute Toxicity\nProduct Information\nComponent Information\nComponent\nMercury\nLD50 Oral\nNot listed\nLD50 Dermal\nNot listed\nLC50 Inhalation\nLC50 < 27 mg/m³ (Rat) 2 h\nToxicologically Synergistic\nProducts\nNo information available\nDelayed and immediate effects as well as chronic effects from short and long-term exposure\nIrritation\nNo information available\nSensitization\nNo information available\nCarcinogenicity\nComponent\nMercury\nCAS No\n7439-97-6\nThe table below indicates whether each agency has listed any ingredient as a carcinogen.\nIARC\nNot listed\nNTP\nNot listed\nACGIH\nNot listed\nOSHA\nNot listed\nMexico\nNot listed\nMutagenic Effects\nNo information available\nReproductive Effects\nNo information available.\nDevelopmental Effects\nMay cause harm to the unborn child.\nTeratogenicity\nNo information available.\nSTOT - single exposure\nNone known\nSTOT - repeated exposure\nCentral nervous system (CNS) Kidney Liver\nAspiration hazard\nNo information available\nSymptoms / effects, both acute and May cause central nervous system depression: May cause adverse kidney effects: May\ndela yed\ncause adverse liver effects: Symptoms may be delayed: Chronic exposure damages the\nbrain and the central nervous system\nEndocrine Disruptor Information\nNo information available\nOther Adverse Effects\nThe toxicological properties have not been fully investigated.\nEcotoxicity"}