{"GUID":"AkKsEQACHt+fl92lo1lIwg==","MATNR":"HZ-CMO","MAKTX":"Carbon monoxide","WERKS":"0001","LGORT":"0001","LGOBE":"Lager 0001","SECTION_ID":1,"SECTION_HEADER":"Identification","SECTION_CONTENT":"Identification\n1.1.\nProduct form\nSubstance name\nCAS-No.\nProduct code\nFormula\nSynonyms\n1.2.\nRecommended use and restrictions on use\nUse of the substance/mixture\n1.3.\nSupplier\n1.4.\nEmergency telephone number\nEmergency number\n: Substance\n: Carbon Monoxide\n: 630-08-0\n: SG-1001-00597\n: CO\n: Carbon monoxide, compressed / Compressed carbon monoxide / Carbon oxide (CO) / Carbon(II) oxide / Carbon oxide\n: Semiconductor Purposes\nScientific research and development\nManufacture of substances\n: Air Liquide USA LLC and its affiliates\n9811 Katy Freeway, Suite 100\nHouston, TX 77024 - USA\nT 1-800-819-1704\nwww.us.airliquide.com\n: Chemtrec: 1-800-424-9300","REVISED_CONTENT":"Product ID:HZ-CMO,Product Description:Carbon monoxide,Storage Location:0001,Storage Location Description:Lager 0001,Plant:0001,Section Id:1,Section Header:Identification,Section Content:Identification\n1.1.\nProduct form\nSubstance name\nCAS-No.\nProduct code\nFormula\nSynonyms\n1.2.\nRecommended use and restrictions on use\nUse of the substance/mixture\n1.3.\nSupplier\n1.4.\nEmergency telephone number\nEmergency number\n: Substance\n: Carbon Monoxide\n: 630-08-0\n: SG-1001-00597\n: CO\n: Carbon monoxide, compressed / Compressed carbon monoxide / Carbon oxide (CO) / Carbon(II) oxide / Carbon oxide\n: Semiconductor Purposes\nScientific research and development\nManufacture of substances\n: Air Liquide USA LLC and its affiliates\n9811 Katy Freeway, Suite 100\nHouston, TX 77024 - USA\nT 1-800-819-1704\nwww.us.airliquide.com\n: Chemtrec: 1-800-424-9300"}