{"GUID":"AkKsEQACHt+fl92lo1JIwg==","MATNR":"HZ-CAD","MAKTX":"Cadmium","WERKS":"0001","LGORT":"0088","LGOBE":"Lager 0088 (WM)","SECTION_ID":9,"SECTION_HEADER":"Physical and chemical properties","SECTION_CONTENT":"Physical state and appearance: Solid. (Lustrous solid.)\nOdor: Not available.\nTaste: Not available.\nMolecular Weight: 112.4 g/mole\nColor: Silvery.\npH (1% soln/water): Not applicable.\nBoiling Point: 765°C (1409°F)\nMelting Point: 320.9°C (609.6°F)\nCritical Temperature: Not available.\nSpecific Gravity: 8.64 (Water = 1)\nVapor Pressure: Not applicable.\nVapor Density: Not available.\nVolatility: Not available.\nOdor Threshold: Not available.\nWater/Oil Dist. Coeff.: Not available.\nIonicity (in Water): Not available.\nDispersion Properties: Not available.\nSolubility: Insoluble in cold water, hot water, methanol, diethyl ether, n-octanol.","REVISED_CONTENT":"Product ID:HZ-CAD,Product Description:Cadmium,Storage Location:0088,Storage Location Description:Lager 0088 (WM),Plant:0001,Section Id:9,Section Header:Physical and chemical properties,Section Content:Physical state and appearance: Solid. (Lustrous solid.)\nOdor: Not available.\nTaste: Not available.\nMolecular Weight: 112.4 g/mole\nColor: Silvery.\npH (1% soln/water): Not applicable.\nBoiling Point: 765°C (1409°F)\nMelting Point: 320.9°C (609.6°F)\nCritical Temperature: Not available.\nSpecific Gravity: 8.64 (Water = 1)\nVapor Pressure: Not applicable.\nVapor Density: Not available.\nVolatility: Not available.\nOdor Threshold: Not available.\nWater/Oil Dist. Coeff.: Not available.\nIonicity (in Water): Not available.\nDispersion Properties: Not available.\nSolubility: Insoluble in cold water, hot water, methanol, diethyl ether, n-octanol."}