{"GUID":"AkKsEQACHt+fl92lrObowg==","MATNR":"HZ-PRO","MAKTX":"Propane","WERKS":"0001","LGORT":"0001","LGOBE":"Lager 0001","SECTION_ID":2,"SECTION_HEADER":"Hazard identification","SECTION_CONTENT":"Extremely flammable gas\nContains gas under pressure; may explode if heated\nFlammable gases Category H220\n1\nGases under pressure\nLiquefied gas\nH280\nFull text of H statements: see section 16\nDanger\nH280 - Contains gas under pressure; may explode if heated\nH220 - Extremely flammable gas\nOSHA-H01 - May displace oxygen and cause rapid suffocation\nCGA-HG01 - May cause frostbite\nCGA-HG04 - May form explosive mixtures with air\nP202 - Do not handle until all safety precautions have been read and understood.\nP271 - Use only outdoors or in a well-ventilated area.\nP280 - Wear eye protection, face protection, protective gloves, protective clothing.\nP308+P313 - If exposed or concerned: Get medical advice/attention.\nP403 - Store in a well-ventilated place.\nP501 - Dispose of contents/container in accordance with local/regional/national/international\nregulations\nP302 - IF ON SKIN: Thaw frosted parts with lukewarm water. Do not rub affected area, Get\nimmediate medical advice/attention.\nP305+P351+P338 - If in eyes: Rinse cautiously with water for several minutes. Remove contact\nlenses, if present and easy to do. Continue rinsing\nP210 - Keep away from heat, hot surfaces, open flames, sparks. - No smoking.\nP377 - Leaking gas fire: Do not extinguish, unless leak can be stopped safely.\nP304+P340 - If inhaled: Remove person to fresh air and keep comfortable for breathing\nP381 - Eliminate all ignition sources if safe to do so.\nCGA-PG02 - Protect from sunlight when ambient temperature exceeds 52째C/125 째F\nCGA-PG05 - Use a back flow preventive device in the piping\nCGA-PG06 - Close valve after each use and when empty\nCGA-PG10 - Use only with equipment rated for cylinder pressure\nCGA-PG14 - Approach suspected leak area with caution\nCGA-PG21 - Open valve slowly","REVISED_CONTENT":"Product ID:HZ-PRO,Product Description:Propane,Storage Location:0001,Storage Location Description:Lager 0001,Plant:0001,Section Id:2,Section Header:Hazard identification,Section Content:Extremely flammable gas\nContains gas under pressure; may explode if heated\nFlammable gases Category H220\n1\nGases under pressure\nLiquefied gas\nH280\nFull text of H statements: see section 16\nDanger\nH280 - Contains gas under pressure; may explode if heated\nH220 - Extremely flammable gas\nOSHA-H01 - May displace oxygen and cause rapid suffocation\nCGA-HG01 - May cause frostbite\nCGA-HG04 - May form explosive mixtures with air\nP202 - Do not handle until all safety precautions have been read and understood.\nP271 - Use only outdoors or in a well-ventilated area.\nP280 - Wear eye protection, face protection, protective gloves, protective clothing.\nP308+P313 - If exposed or concerned: Get medical advice/attention.\nP403 - Store in a well-ventilated place.\nP501 - Dispose of contents/container in accordance with local/regional/national/international\nregulations\nP302 - IF ON SKIN: Thaw frosted parts with lukewarm water. Do not rub affected area, Get\nimmediate medical advice/attention.\nP305+P351+P338 - If in eyes: Rinse cautiously with water for several minutes. Remove contact\nlenses, if present and easy to do. Continue rinsing\nP210 - Keep away from heat, hot surfaces, open flames, sparks. - No smoking.\nP377 - Leaking gas fire: Do not extinguish, unless leak can be stopped safely.\nP304+P340 - If inhaled: Remove person to fresh air and keep comfortable for breathing\nP381 - Eliminate all ignition sources if safe to do so.\nCGA-PG02 - Protect from sunlight when ambient temperature exceeds 52째C/125 째F\nCGA-PG05 - Use a back flow preventive device in the piping\nCGA-PG06 - Close valve after each use and when empty\nCGA-PG10 - Use only with equipment rated for cylinder pressure\nCGA-PG14 - Approach suspected leak area with caution\nCGA-PG21 - Open valve slowly"}