{"GUID":"AkKsEQACHt+fl92lrP3Iwg==","MATNR":"HZ-URA","MAKTX":"URANIUM - WP","WERKS":"0001","LGORT":"0002","LGOBE":"Cold Storage","SECTION_ID":9,"SECTION_HEADER":"Physical and chemical properties","SECTION_CONTENT":"SECTION 9: Physical and chemical properties\n9.1 Information on basic physical and chemical properties\na) Appearance\nForm: liquid\nb) Odor\nNo data available\nc) Odor Threshold\nNo data available\nd) pH\nNo data available\ne) Melting\nNo data available\npoint/freezing point\nf) Initial boiling point\nNo data available\nand boiling range\ng) Flash point\n()No data available\nh) Evaporation rate\nNo data available\ni) Flammability (solid,\nNo data available\ngas)\nj) Upper/lower\nNo data available\nflammability or\nexplosive limits\nk) Vapor pressure\nNo data available\nl) Vapor density\nNo data available\nm) Density\nNo data available\nRelative density\nNo data available\nn) Water solubility\nsoluble\no) Partition coefficient:\nNo data available\nn-octanol/water\np) Autoignition\nNot applicable\ntemperature\nq) Decomposition\nNo data available\ntemperature\nr) Viscosity\nNo data available\ns) Explosive properties\nNot classified as explosive.\nt) Oxidizing properties\nnone\n9.2 Other safety information\nNo data available","REVISED_CONTENT":"Product ID:HZ-URA,Product Description:URANIUM - WP,Storage Location:0002,Storage Location Description:Cold Storage,Plant:0001,Section Id:9,Section Header:Physical and chemical properties,Section Content:SECTION 9: Physical and chemical properties\n9.1 Information on basic physical and chemical properties\na) Appearance\nForm: liquid\nb) Odor\nNo data available\nc) Odor Threshold\nNo data available\nd) pH\nNo data available\ne) Melting\nNo data available\npoint/freezing point\nf) Initial boiling point\nNo data available\nand boiling range\ng) Flash point\n()No data available\nh) Evaporation rate\nNo data available\ni) Flammability (solid,\nNo data available\ngas)\nj) Upper/lower\nNo data available\nflammability or\nexplosive limits\nk) Vapor pressure\nNo data available\nl) Vapor density\nNo data available\nm) Density\nNo data available\nRelative density\nNo data available\nn) Water solubility\nsoluble\no) Partition coefficient:\nNo data available\nn-octanol/water\np) Autoignition\nNot applicable\ntemperature\nq) Decomposition\nNo data available\ntemperature\nr) Viscosity\nNo data available\ns) Explosive properties\nNot classified as explosive.\nt) Oxidizing properties\nnone\n9.2 Other safety information\nNo data available"}