{"GUID":"AkKsEQACHt+fl92lptEowg==","MATNR":"HZ-HYS","MAKTX":"Hydrogen sulfide","WERKS":"0001","LGORT":"0001","LGOBE":"Lager 0001","SECTION_ID":4,"SECTION_HEADER":"First-aid measures","SECTION_CONTENT":"Description of first aid measures\nFirst-aid measures after inhalation\nFirst-aid measures after skin contact\nFirst-aid measures after eye contact\nFirst-aid measures after ingestion\nMost important symptoms and effects, both acute and delayed\nIndication of any immediate medical attention and special treatment needed\n: Remove to fresh air and keep at rest in a position comfortable for breathing. If not breathing,\ngive artificial respiration. If breathing is difficult, trained personnel should give oxygen. Call a\nphysician.\n: The liquid may cause frostbite. For exposure to liquid, immediately warm frostbite area with\nwarm water not to exceed 105째F (41째C). Water temperature should be tolerable to normal\nskin. Maintain skin warming for at least 15 minutes or until normal coloring and sensation have\nreturned to the affected area. In case of massive exposure, remove clothing while showering\nwith warm water. Seek medical evaluation and treatment as soon as possible.\n: Immediately flush eyes thoroughly with water for at least 15 minutes. Hold the eyelids open and\naway from the eyeballs to ensure that all surfaces are flushed thoroughly. Contact an\nophthalmologist immediately.\n: Ingestion is not considered a potential route of exposure.\nNo additional information available\nObtain medical assistance. Treat with corticosteroid spray as soon as possible after inhalation.","REVISED_CONTENT":"Product ID:HZ-HYS,Product Description:Hydrogen sulfide,Storage Location:0001,Storage Location Description:Lager 0001,Plant:0001,Section Id:4,Section Header:First-aid measures,Section Content:Description of first aid measures\nFirst-aid measures after inhalation\nFirst-aid measures after skin contact\nFirst-aid measures after eye contact\nFirst-aid measures after ingestion\nMost important symptoms and effects, both acute and delayed\nIndication of any immediate medical attention and special treatment needed\n: Remove to fresh air and keep at rest in a position comfortable for breathing. If not breathing,\ngive artificial respiration. If breathing is difficult, trained personnel should give oxygen. Call a\nphysician.\n: The liquid may cause frostbite. For exposure to liquid, immediately warm frostbite area with\nwarm water not to exceed 105째F (41째C). Water temperature should be tolerable to normal\nskin. Maintain skin warming for at least 15 minutes or until normal coloring and sensation have\nreturned to the affected area. In case of massive exposure, remove clothing while showering\nwith warm water. Seek medical evaluation and treatment as soon as possible.\n: Immediately flush eyes thoroughly with water for at least 15 minutes. Hold the eyelids open and\naway from the eyeballs to ensure that all surfaces are flushed thoroughly. Contact an\nophthalmologist immediately.\n: Ingestion is not considered a potential route of exposure.\nNo additional information available\nObtain medical assistance. Treat with corticosteroid spray as soon as possible after inhalation."}