{"GUID":"AkKsEQACHt+fl92lrPPowg==","MATNR":"HZ-SUL","MAKTX":"Sulfur","WERKS":"0001","LGORT":"0001","LGOBE":"Lager 0001","SECTION_ID":10,"SECTION_HEADER":"Stability and reactivity","SECTION_CONTENT":"10.1. Reactivity: Hazardous reactions will not occur under normal conditions.\n10.2. Chemical Stability: Flammable solid. May form flammable/explosive vapor-air mixture.\n10.3. Possibility of Hazardous Reactions: Hazardous polymerization will not occur.\n10.4.\nConditions to Avoid: Direct sunlight, extremely high or low temperatures, open flame, overheating, heat, sparks, avoid\nignition sources and incompatible materials.\n10.5. Incompatible Materials: Strong acids, strong bases, strong oxidizers, carbides, chlorates, nitrates, halogens, phosphorous,\nheavy metals.\n10.6. Hazardous Decomposition Products: None expected under normal conditions of use.","REVISED_CONTENT":"Product ID:HZ-SUL,Product Description:Sulfur,Storage Location:0001,Storage Location Description:Lager 0001,Plant:0001,Section Id:10,Section Header:Stability and reactivity,Section Content:10.1. Reactivity: Hazardous reactions will not occur under normal conditions.\n10.2. Chemical Stability: Flammable solid. May form flammable/explosive vapor-air mixture.\n10.3. Possibility of Hazardous Reactions: Hazardous polymerization will not occur.\n10.4.\nConditions to Avoid: Direct sunlight, extremely high or low temperatures, open flame, overheating, heat, sparks, avoid\nignition sources and incompatible materials.\n10.5. Incompatible Materials: Strong acids, strong bases, strong oxidizers, carbides, chlorates, nitrates, halogens, phosphorous,\nheavy metals.\n10.6. Hazardous Decomposition Products: None expected under normal conditions of use."}