{"GUID":"AkKsEQACHt+fl92lo1Yowg==","MATNR":"HZ-CHL","MAKTX":"Chlorine","WERKS":"0001","LGORT":"0001","LGOBE":"Lager 0001","SECTION_ID":8,"SECTION_HEADER":"Exposure controls / personal protection","SECTION_CONTENT":"8.1. Control parameters\nChlorine (7782-50-5)\nUSA - ACGIH - Occupational Exposure Limits\nACGIH OEL TWA [ppm]\nACGIH OEL STEL [ppm]\nACGIH chemical category\nUSA - OSHA - Occupational Exposure Limits\nOSHA PEL (Ceiling)\nOSHA PEL C [ppm]\nUSA - IDLH - Occupational Exposure Limits\nIDLH [ppm]\nUSA - NIOSH - Occupational Exposure Limits\nNIOSH REL (Ceiling)\nNIOSH REL C [ppm]\n8.2. Appropriate engineering controls\nAppropriate engineering controls\nEnvironmental exposure controls\n: Ensure exposure is below occupational exposure limits (where available). Provide adequate\ngeneral and local exhaust ventilation. Systems under pressure should be regularly checked for\nleakages. Consider the use of a work permit system e.g. for maintenance activities. Alarm\ndetectors should be used when toxic gases may be released.\n: Refer to local regulations for restriction of emissions to the atmosphere. See section 13 for\nspecific methods for waste gas treatment.\n8.3. Individual protection measures/Personal protective equipment\nPersonal protective equipment:\nAvoid all unnecessary exposure.\nHand protection:\nWear working gloves when handling gas containers. 29 CFR 1910.138: Hand protection. Wear chemically resistant protective gloves when making or\nbreaking process connections. Wear protective gloves.\nEye protection:\nWear safety glasses with side shields. Chemical goggles or face shield. 29 CFR 1910.133: Eye and Face Protection. Wear goggles and a face shield\nwhen transfilling or breaking transfer connections.","REVISED_CONTENT":"Product ID:HZ-CHL,Product Description:Chlorine,Storage Location:0001,Storage Location Description:Lager 0001,Plant:0001,Section Id:8,Section Header:Exposure controls / personal protection,Section Content:8.1. Control parameters\nChlorine (7782-50-5)\nUSA - ACGIH - Occupational Exposure Limits\nACGIH OEL TWA [ppm]\nACGIH OEL STEL [ppm]\nACGIH chemical category\nUSA - OSHA - Occupational Exposure Limits\nOSHA PEL (Ceiling)\nOSHA PEL C [ppm]\nUSA - IDLH - Occupational Exposure Limits\nIDLH [ppm]\nUSA - NIOSH - Occupational Exposure Limits\nNIOSH REL (Ceiling)\nNIOSH REL C [ppm]\n8.2. Appropriate engineering controls\nAppropriate engineering controls\nEnvironmental exposure controls\n: Ensure exposure is below occupational exposure limits (where available). Provide adequate\ngeneral and local exhaust ventilation. Systems under pressure should be regularly checked for\nleakages. Consider the use of a work permit system e.g. for maintenance activities. Alarm\ndetectors should be used when toxic gases may be released.\n: Refer to local regulations for restriction of emissions to the atmosphere. See section 13 for\nspecific methods for waste gas treatment.\n8.3. Individual protection measures/Personal protective equipment\nPersonal protective equipment:\nAvoid all unnecessary exposure.\nHand protection:\nWear working gloves when handling gas containers. 29 CFR 1910.138: Hand protection. Wear chemically resistant protective gloves when making or\nbreaking process connections. Wear protective gloves.\nEye protection:\nWear safety glasses with side shields. Chemical goggles or face shield. 29 CFR 1910.133: Eye and Face Protection. Wear goggles and a face shield\nwhen transfilling or breaking transfer connections."}