{"GUID":"AkKsEQACHt+fl92lrPMowg==","MATNR":"HZ-SUL","MAKTX":"Sulfur","WERKS":"0001","LGORT":"0001","LGOBE":"Lager 0001","SECTION_ID":4,"SECTION_HEADER":"First-aid measures","SECTION_CONTENT":"4.1. Description of First-aid Measures\nGeneral: Never give anything by mouth to an unconscious person. If you feel unwell, seek medical advice (show the label where\npossible).\nInhalation: When symptoms occur: go into open air and ventilate suspected area. Obtain medical attention if breathing difficulty\npersists.\nSkin Contact: Remove contaminated clothing. Drench affected area with water for at least 15 minutes. Wash contaminated clothing\nbefore reuse. If skin irritation occurs: Get medical advice/attention.\nEye Contact: Rinse cautiously with water for several minutes. Remove contact lenses, if present and easy to do. Continue rinsing.\nObtain medical attention if pain, blinking or redness persist.\nIngestion: Rinse mouth. Do NOT induce vomiting. Seek medical attention.\n4.2. Most Important Symptoms and Effects Both Acute and Delayed\nGeneral: Causes skin irritation. Risk of thermal burns on contact with molten product.\nInhalation: WARNING: irritating and toxic hydrogen sulfide gas may be present. Greater than 15-20 ppm continuous exposure can\ncause mucous membrane and respiratory tract irritation. 50-500 ppm can cause headache, nausea, and dizziness. Continued\nexposure at these levels can lead to loss of reasoning and balance, difficulty in breathing, fluid in the lungs, and possible loss of\nconsciousness. Greater than 500 ppm can cause rapid unconsciousness and death if not promptly revived.\nSkin Contact: Causes skin irritation. Risk of thermal burns on contact with molten product. Removal of solidified molten material\nfrom skin requires medical assistance. Contact with hot, molten metal will cause thermal burns.\nEye Contact: Risk of thermal burns on contact with molten product. May cause eye irritation.\nIngestion: Abdominal pain. May cause nausea, vomiting, and diarrhea. Ingestion is likely to be harmful or have adverse effects.\nChronic Symptoms: None expected under normal conditions of use.\n4.3. Indication of Any Immediate Medical Attention and Special Treatment Needed","REVISED_CONTENT":"Product ID:HZ-SUL,Product Description:Sulfur,Storage Location:0001,Storage Location Description:Lager 0001,Plant:0001,Section Id:4,Section Header:First-aid measures,Section Content:4.1. Description of First-aid Measures\nGeneral: Never give anything by mouth to an unconscious person. If you feel unwell, seek medical advice (show the label where\npossible).\nInhalation: When symptoms occur: go into open air and ventilate suspected area. Obtain medical attention if breathing difficulty\npersists.\nSkin Contact: Remove contaminated clothing. Drench affected area with water for at least 15 minutes. Wash contaminated clothing\nbefore reuse. If skin irritation occurs: Get medical advice/attention.\nEye Contact: Rinse cautiously with water for several minutes. Remove contact lenses, if present and easy to do. Continue rinsing.\nObtain medical attention if pain, blinking or redness persist.\nIngestion: Rinse mouth. Do NOT induce vomiting. Seek medical attention.\n4.2. Most Important Symptoms and Effects Both Acute and Delayed\nGeneral: Causes skin irritation. Risk of thermal burns on contact with molten product.\nInhalation: WARNING: irritating and toxic hydrogen sulfide gas may be present. Greater than 15-20 ppm continuous exposure can\ncause mucous membrane and respiratory tract irritation. 50-500 ppm can cause headache, nausea, and dizziness. Continued\nexposure at these levels can lead to loss of reasoning and balance, difficulty in breathing, fluid in the lungs, and possible loss of\nconsciousness. Greater than 500 ppm can cause rapid unconsciousness and death if not promptly revived.\nSkin Contact: Causes skin irritation. Risk of thermal burns on contact with molten product. Removal of solidified molten material\nfrom skin requires medical assistance. Contact with hot, molten metal will cause thermal burns.\nEye Contact: Risk of thermal burns on contact with molten product. May cause eye irritation.\nIngestion: Abdominal pain. May cause nausea, vomiting, and diarrhea. Ingestion is likely to be harmful or have adverse effects.\nChronic Symptoms: None expected under normal conditions of use.\n4.3. Indication of Any Immediate Medical Attention and Special Treatment Needed"}