{"GUID":"AkKsEQACHt+fl92lpugIwg==","MATNR":"HZ-PHO","MAKTX":"Phosphorus","WERKS":"0001","LGORT":"0088","LGOBE":"Lager 0088 (WM)","SECTION_ID":11,"SECTION_HEADER":"Toxicological information","SECTION_CONTENT":"11.1. Information on hazard classes as defined in Regulation (EC) No 1272/2008\nProduct Information\nNo acute toxicity information is available for this product\n(a) acute toxicity;\nOral\nDermal\nInhalation\nComponent\nSulfuric acid\nPoly(oxy-1.2-ethanediyl),\nalpha[4-(1,1,3,3-tetramethylbutyl)phenyl]-o\nmega-hydroxy (Triton X-100)\n(b) skin corrosion/irritation;\nCauses burns.\nBased on available data, the classification criteria are not met\nATE = > 2000 mg/kg\nNot classified\nNot classified\nLD50 Oral\nLD50 = 2140 mg/kg (Rat)\nLD50 = 1800 mg/kg (Rat)\nLD50 Dermal\nLC50 Inhalation\nLC50 = 0.375 mg/L (Rat) 4 h","REVISED_CONTENT":"Product ID:HZ-PHO,Product Description:Phosphorus,Storage Location:0088,Storage Location Description:Lager 0088 (WM),Plant:0001,Section Id:11,Section Header:Toxicological information,Section Content:11.1. Information on hazard classes as defined in Regulation (EC) No 1272/2008\nProduct Information\nNo acute toxicity information is available for this product\n(a) acute toxicity;\nOral\nDermal\nInhalation\nComponent\nSulfuric acid\nPoly(oxy-1.2-ethanediyl),\nalpha[4-(1,1,3,3-tetramethylbutyl)phenyl]-o\nmega-hydroxy (Triton X-100)\n(b) skin corrosion/irritation;\nCauses burns.\nBased on available data, the classification criteria are not met\nATE = > 2000 mg/kg\nNot classified\nNot classified\nLD50 Oral\nLD50 = 2140 mg/kg (Rat)\nLD50 = 1800 mg/kg (Rat)\nLD50 Dermal\nLC50 Inhalation\nLC50 = 0.375 mg/L (Rat) 4 h"}