{"GUID":"AkKsEQACHt+fl92lrOqIwg==","MATNR":"HZ-SAC","MAKTX":"Sulfuric acid","WERKS":"0001","LGORT":"0003","LGOBE":"Corrosive Items","SECTION_ID":15,"SECTION_HEADER":"Regulatory information","SECTION_CONTENT":"International Inventories TSCA DSL NDSL EINECS ELINCS NLP PICCS ENCS AICS IECSC KECL Component Sulfuric acid X X 231-639-5 X X X X X X Legend: X - Listed E - Indicates a substance that is the subject of a Section 5(e) Consent order under TSCA. F - Indicates a substance that is the subject of a Section 5(f) Rule under TSCA. N - Indicates a polymeric substance containing no free-radical initiator in its inventory name but is considered to cover the designated polymer made with any free-radical initiator regardless of the amount used. P - Indicates a commenced PMN substance R - Indicates a substance that is the subject of a Section 6 risk management rule under TSCA. S - Indicates a substance that is identified in a proposed or final Significant New Use Rule T - Indicates a substance that is the subject of a Section 4 test rule under TSCA. XU - Indicates a substance exempt from reporting under the Inventory Update Rule, i.e. Partial Updating of the TSCA Inventory Data Base Production and Site Reports (40 CFR 710(B). Y1 - Indicates an exempt polymer that has a number-average molecular weight of 1,000 or greater. Y2 - Indicates an exempt polymer that is a polyester and is made only from reactants included in a specified list of low concern reactants that comprises one of the eligibility criteria for the exemption rule. U.S. Federal Regulations TSCA 12(b) SARA 313 Component Sulfuric acid Not applicable SARA 311/312 Hazardous Categorization Acute Health Hazard Yes Chronic Health Hazard No Fire Hazard No Sudden Release of Pressure Hazard No Reactive Hazard Yes CAS-No 7664-93-9 Weight % >95 SARA 313 - Threshold Values % 1.0 Clean Water Act Component CWA - Hazardous Substances CWA - Reportable Quantities CWA - Toxic Pollutants CWA - Priority Pollutants Sulfuric acid X 1000 lb Clean Air Act Not applicable OSHA Occupational Safety and Health Administration Not applicable CERCLA This material, as supplied, contains one or more substances regulated as a hazardous substance under the Comprehensive Environmental Response Compensation and Liability Act (CERCLA) (40 CFR 302) Component Hazardous Substances RQs CERCLA EHS RQS Sulfuric acid 1000 lb 1000 lb California Proposition 65 Component CAS-No California Prop. 65 Prop 65 NSRL Category Sulfuric acid 7664-93-9 Carcinogen Carcinogen State Right-to-Know Component Massachusetts New Jersey Pennsylvania Illinois Rhode Island Sulfuric acid X X X X X U.S. Department of Transportation Reportable Quantity (RQ): Y DOT Marine Pollutant N DOT Severe Marine Pollutant N U.S. Department of Homeland Security This product does not contain any DHS chemicals. Other International Regulations No information available Mexico - Grade Canada This product has been classified in accordance with the hazard criteria of the Controlled Products Regulations (CPR) and the MSDS contains all the information required by the CPR WHMIS Hazard Class D1A Very toxic materials E Corrosive material Prepared By Regulatory Affairs Thermo Fisher Scientific Email: EMSDS.RA@thermofisher.com Creation Date 23-Jun-2009 Revision Date 20-Mar-2014","REVISED_CONTENT":"Product ID:HZ-SAC,Product Description:Sulfuric acid,Storage Location:0003,Storage Location Description:Corrosive Items,Plant:0001,Section Id:15,Section Header:Regulatory information,Section Content:International Inventories TSCA DSL NDSL EINECS ELINCS NLP PICCS ENCS AICS IECSC KECL Component Sulfuric acid X X 231-639-5 X X X X X X Legend: X - Listed E - Indicates a substance that is the subject of a Section 5(e) Consent order under TSCA. F - Indicates a substance that is the subject of a Section 5(f) Rule under TSCA. N - Indicates a polymeric substance containing no free-radical initiator in its inventory name but is considered to cover the designated polymer made with any free-radical initiator regardless of the amount used. P - Indicates a commenced PMN substance R - Indicates a substance that is the subject of a Section 6 risk management rule under TSCA. S - Indicates a substance that is identified in a proposed or final Significant New Use Rule T - Indicates a substance that is the subject of a Section 4 test rule under TSCA. XU - Indicates a substance exempt from reporting under the Inventory Update Rule, i.e. Partial Updating of the TSCA Inventory Data Base Production and Site Reports (40 CFR 710(B). Y1 - Indicates an exempt polymer that has a number-average molecular weight of 1,000 or greater. Y2 - Indicates an exempt polymer that is a polyester and is made only from reactants included in a specified list of low concern reactants that comprises one of the eligibility criteria for the exemption rule. U.S. Federal Regulations TSCA 12(b) SARA 313 Component Sulfuric acid Not applicable SARA 311/312 Hazardous Categorization Acute Health Hazard Yes Chronic Health Hazard No Fire Hazard No Sudden Release of Pressure Hazard No Reactive Hazard Yes CAS-No 7664-93-9 Weight % >95 SARA 313 - Threshold Values % 1.0 Clean Water Act Component CWA - Hazardous Substances CWA - Reportable Quantities CWA - Toxic Pollutants CWA - Priority Pollutants Sulfuric acid X 1000 lb Clean Air Act Not applicable OSHA Occupational Safety and Health Administration Not applicable CERCLA This material, as supplied, contains one or more substances regulated as a hazardous substance under the Comprehensive Environmental Response Compensation and Liability Act (CERCLA) (40 CFR 302) Component Hazardous Substances RQs CERCLA EHS RQS Sulfuric acid 1000 lb 1000 lb California Proposition 65 Component CAS-No California Prop. 65 Prop 65 NSRL Category Sulfuric acid 7664-93-9 Carcinogen Carcinogen State Right-to-Know Component Massachusetts New Jersey Pennsylvania Illinois Rhode Island Sulfuric acid X X X X X U.S. Department of Transportation Reportable Quantity (RQ): Y DOT Marine Pollutant N DOT Severe Marine Pollutant N U.S. Department of Homeland Security This product does not contain any DHS chemicals. Other International Regulations No information available Mexico - Grade Canada This product has been classified in accordance with the hazard criteria of the Controlled Products Regulations (CPR) and the MSDS contains all the information required by the CPR WHMIS Hazard Class D1A Very toxic materials E Corrosive material Prepared By Regulatory Affairs Thermo Fisher Scientific Email: EMSDS.RA@thermofisher.com Creation Date 23-Jun-2009 Revision Date 20-Mar-2014"}