{"GUID":"AkKsEQACHt+fl92lptHowg==","MATNR":"HZ-HYS","MAKTX":"Hydrogen sulfide","WERKS":"0001","LGORT":"0001","LGOBE":"Lager 0001","SECTION_ID":10,"SECTION_HEADER":"Stability and reactivity","SECTION_CONTENT":"Reactivity\nChemical stability\nPossibility of hazardous reactions\nConditions to avoid\nIncompatible materials\nHazardous decomposition products\n: No reactivity hazard other than the effects described in sub-sections below.\n: Stable under normal conditions.\n: May react violently with oxidants. Can form explosive mixture with air.\n: Avoid moisture in installation systems. Keep away from heat/sparks/open flames/hot surfaces. – No\nsmoking.\n: Ammonia. Bases. Bromine pentafluoride. Chlorine trifluoride. chromium trioxide. (and heat). Copper.\n(powdered). Fluorine. Lead. Lead oxide. Mercury. Nitric acid. Nitrogen trifluoride. nitrogen sulfide.\nOrganic compounds. Oxidizing agents. Oxygen difluoride. Rubber. Sodium. (and moisture). Water.\n: Thermal decomposition may produce: Sulfur. Hydrogen.","REVISED_CONTENT":"Product ID:HZ-HYS,Product Description:Hydrogen sulfide,Storage Location:0001,Storage Location Description:Lager 0001,Plant:0001,Section Id:10,Section Header:Stability and reactivity,Section Content:Reactivity\nChemical stability\nPossibility of hazardous reactions\nConditions to avoid\nIncompatible materials\nHazardous decomposition products\n: No reactivity hazard other than the effects described in sub-sections below.\n: Stable under normal conditions.\n: May react violently with oxidants. Can form explosive mixture with air.\n: Avoid moisture in installation systems. Keep away from heat/sparks/open flames/hot surfaces. – No\nsmoking.\n: Ammonia. Bases. Bromine pentafluoride. Chlorine trifluoride. chromium trioxide. (and heat). Copper.\n(powdered). Fluorine. Lead. Lead oxide. Mercury. Nitric acid. Nitrogen trifluoride. nitrogen sulfide.\nOrganic compounds. Oxidizing agents. Oxygen difluoride. Rubber. Sodium. (and moisture). Water.\n: Thermal decomposition may produce: Sulfur. Hydrogen."}