{"GUID":"AkKsEQACHt+fl92lptIowg==","MATNR":"HZ-HYS","MAKTX":"Hydrogen sulfide","WERKS":"0001","LGORT":"0001","LGOBE":"Lager 0001","SECTION_ID":12,"SECTION_HEADER":"Ecological information","SECTION_CONTENT":"Toxicity\nEcology - general\nHydrogen sulfide (7783-06-4)\nLC50 - Fish [1]\nLC50 - Fish [2]\nPersistence and degradability\nHydrogen sulfide (7783-06-4)\nPersistence and degradability\nBioaccumulative potential\nHydrogen sulfide (7783-06-4)\nBCF - Fish [1]\nPartition coefficient n-octanol/water (Log Pow)\nPartition coefficient n-octanol/water (Log Kow)\nBioaccumulative potential\nMobility in soil\nHydrogen sulfide (7783-06-4)\nMobility in soil\nEcology - soil\nOther adverse effects\nOther adverse effects\nEffect on the ozone layer\nEffect on global warming\n: Not classified\n: VERY TOXIC TO AQUATIC LIFE.\n: 0.0448 mg/l (Exposure time: 96 h - Species: Lepomis macrochirus [flow-through])\n: 0.016 mg/l (Exposure time: 96 h - Species: Pimephales promelas [flow-through])\n: Not applicable for inorganic products.\n: (no bioaccumulation expected)\n: Not applicable.\n: Not applicable.\n: No data available.\n: No data available.\n: Because of its high volatility, the product is unlikely to cause ground or water pollution.\n: May cause pH changes in aqueous ecological systems.\n: None.\n: No known effects from this product.","REVISED_CONTENT":"Product ID:HZ-HYS,Product Description:Hydrogen sulfide,Storage Location:0001,Storage Location Description:Lager 0001,Plant:0001,Section Id:12,Section Header:Ecological information,Section Content:Toxicity\nEcology - general\nHydrogen sulfide (7783-06-4)\nLC50 - Fish [1]\nLC50 - Fish [2]\nPersistence and degradability\nHydrogen sulfide (7783-06-4)\nPersistence and degradability\nBioaccumulative potential\nHydrogen sulfide (7783-06-4)\nBCF - Fish [1]\nPartition coefficient n-octanol/water (Log Pow)\nPartition coefficient n-octanol/water (Log Kow)\nBioaccumulative potential\nMobility in soil\nHydrogen sulfide (7783-06-4)\nMobility in soil\nEcology - soil\nOther adverse effects\nOther adverse effects\nEffect on the ozone layer\nEffect on global warming\n: Not classified\n: VERY TOXIC TO AQUATIC LIFE.\n: 0.0448 mg/l (Exposure time: 96 h - Species: Lepomis macrochirus [flow-through])\n: 0.016 mg/l (Exposure time: 96 h - Species: Pimephales promelas [flow-through])\n: Not applicable for inorganic products.\n: (no bioaccumulation expected)\n: Not applicable.\n: Not applicable.\n: No data available.\n: No data available.\n: Because of its high volatility, the product is unlikely to cause ground or water pollution.\n: May cause pH changes in aqueous ecological systems.\n: None.\n: No known effects from this product."}