{"GUID":"AkKsEQACHt+fl92lo1QIwg==","MATNR":"HZ-CES","MAKTX":"Cesium","WERKS":"0001","LGORT":"0088","LGOBE":"Lager 0088 (WM)","SECTION_ID":7,"SECTION_HEADER":"Handling and storage","SECTION_CONTENT":"SECTION 7: Handling and storage\n7.1 Precautions for safe handling\nAdvice on safe handling\nAvoid formation of dust and aerosols.Advice on safe handling\nFurther processing of solid materials may result in the formation of combustible dusts. The\npotential for combustible dust formation should be taken into consideration before\nadditional processing occurs.\nAdvice on protection against fire and explosion\nProvide appropriate exhaust ventilation at places where dust is formed. Keep away from\nsources of ignition - No smoking.\nHygiene measures\nHandle in accordance with good industrial hygiene and safety practice. Wash hands before\nbreaks and at the end of workday.\nFor precautions see section 2.2.\n7.2 Conditions for safe storage, including any incompatibilities\nStorage conditions\nKeep container tightly closed in a dry and well-ventilated place.\nNever allow product to get in contact with water during storage.\nHandle and store under inert gas. Air sensitive.\nStorage class\nStorage class (TRGS 510): 4.3: Hazardous materials, which set free flammable gases upon\ncontact with water\n7.3 Specific end use(s)\nApart from the uses mentioned in section 1.2 no other specific uses are stipulated","REVISED_CONTENT":"Product ID:HZ-CES,Product Description:Cesium,Storage Location:0088,Storage Location Description:Lager 0088 (WM),Plant:0001,Section Id:7,Section Header:Handling and storage,Section Content:SECTION 7: Handling and storage\n7.1 Precautions for safe handling\nAdvice on safe handling\nAvoid formation of dust and aerosols.Advice on safe handling\nFurther processing of solid materials may result in the formation of combustible dusts. The\npotential for combustible dust formation should be taken into consideration before\nadditional processing occurs.\nAdvice on protection against fire and explosion\nProvide appropriate exhaust ventilation at places where dust is formed. Keep away from\nsources of ignition - No smoking.\nHygiene measures\nHandle in accordance with good industrial hygiene and safety practice. Wash hands before\nbreaks and at the end of workday.\nFor precautions see section 2.2.\n7.2 Conditions for safe storage, including any incompatibilities\nStorage conditions\nKeep container tightly closed in a dry and well-ventilated place.\nNever allow product to get in contact with water during storage.\nHandle and store under inert gas. Air sensitive.\nStorage class\nStorage class (TRGS 510): 4.3: Hazardous materials, which set free flammable gases upon\ncontact with water\n7.3 Specific end use(s)\nApart from the uses mentioned in section 1.2 no other specific uses are stipulated"}