{"GUID":"AkKsEQACHt+fl92lptkowg==","MATNR":"HZ-MAL","MAKTX":"Malathion","WERKS":"0001","LGORT":"0088","LGOBE":"Lager 0088 (WM)","SECTION_ID":4,"SECTION_HEADER":"First-aid measures","SECTION_CONTENT":"4.1 Description of first-aid measures\nGeneral advice\nShow this material safety data sheet to the doctor in attendance.\nIf inhaled\nAfter inhalation: fresh air.\nIn case of skin contact\nIn case of skin contact: Take off immediately all contaminated clothing. Rinse skin with\nwater/ shower. Consult a physician.\nIn case of eye contact\nAfter eye contact: rinse out with plenty of water. Remove contact lenses.\nIf swallowed\nAfter swallowing: immediately make victim drink water (two glasses at most). Consult a\nphysician.\n4.2 Most important symptoms and effects, both acute and delayed\nThe most important known symptoms and effects are described in the labelling (see section\n2.2) and/or in section 11\n4.3 Indication of any immediate medical attention and special treatment needed\nNo data available","REVISED_CONTENT":"Product ID:HZ-MAL,Product Description:Malathion,Storage Location:0088,Storage Location Description:Lager 0088 (WM),Plant:0001,Section Id:4,Section Header:First-aid measures,Section Content:4.1 Description of first-aid measures\nGeneral advice\nShow this material safety data sheet to the doctor in attendance.\nIf inhaled\nAfter inhalation: fresh air.\nIn case of skin contact\nIn case of skin contact: Take off immediately all contaminated clothing. Rinse skin with\nwater/ shower. Consult a physician.\nIn case of eye contact\nAfter eye contact: rinse out with plenty of water. Remove contact lenses.\nIf swallowed\nAfter swallowing: immediately make victim drink water (two glasses at most). Consult a\nphysician.\n4.2 Most important symptoms and effects, both acute and delayed\nThe most important known symptoms and effects are described in the labelling (see section\n2.2) and/or in section 11\n4.3 Indication of any immediate medical attention and special treatment needed\nNo data available"}