{"GUID":"AkKsEQACHt+fl92lptFIwg==","MATNR":"HZ-HYS","MAKTX":"Hydrogen sulfide","WERKS":"0001","LGORT":"0001","LGOBE":"Lager 0001","SECTION_ID":5,"SECTION_HEADER":"Fire-fighting measures","SECTION_CONTENT":"Extinguishing media\nSuitable extinguishing media\nSpecial hazards arising from the substance or mixture\nFire hazard\nExplosion hazard\nReactivity\nAdvice for firefighters\nFirefighting instructions\nSpecial protective equipment for fire fighters\nOther information\n: Carbon dioxide, Dry chemical, Water spray or fog.\n: EXTREMELY FLAMMABLE GAS. If venting or leaking gas catches fire, do not extinguish\nflames. Flammable vapors may spread from leak, creating an explosive reignition hazard.\nVapors can be ignited by pilot lights, other flames, smoking, sparks, heaters, electrical\nequipment, static discharge, or other ignition sources at locations distant from product handling\npoint. Explosive atmospheres may linger. Before entering an area, especially a confined area,\ncheck the atmosphere with an appropriate device.\n: EXTREMELY FLAMMABLE GAS. Forms explosive mixtures with air and oxidizing agents.\n: No reactivity hazard other than the effects described in sub-sections below.\n: DANGER! Toxic, flammable liquefied gas\nEvacuate all personnel from the danger area. Use self-contained breathing apparatus (SCBA)\nand protective clothing. Immediately cool containers with water from maximum distance. Stop\nflow of gas if safe to do so, while continuing cooling water spray. Remove ignition sources if\nsafe to do so. Remove containers from area of fire if safe to do so. On-site fire brigades must\ncomply with OSHA 29 CFR 1910.156 and applicable standards under 29 CFR 1910 Subpart\nL-Fire Protection.\n: Standard protective clothing and equipment (Self Contained Breathing Apparatus) for fire\nfighters.\n: Containers are equipped with a pressure relief device. (Exceptions may exist where authorized\nby TC.).","REVISED_CONTENT":"Product ID:HZ-HYS,Product Description:Hydrogen sulfide,Storage Location:0001,Storage Location Description:Lager 0001,Plant:0001,Section Id:5,Section Header:Fire-fighting measures,Section Content:Extinguishing media\nSuitable extinguishing media\nSpecial hazards arising from the substance or mixture\nFire hazard\nExplosion hazard\nReactivity\nAdvice for firefighters\nFirefighting instructions\nSpecial protective equipment for fire fighters\nOther information\n: Carbon dioxide, Dry chemical, Water spray or fog.\n: EXTREMELY FLAMMABLE GAS. If venting or leaking gas catches fire, do not extinguish\nflames. Flammable vapors may spread from leak, creating an explosive reignition hazard.\nVapors can be ignited by pilot lights, other flames, smoking, sparks, heaters, electrical\nequipment, static discharge, or other ignition sources at locations distant from product handling\npoint. Explosive atmospheres may linger. Before entering an area, especially a confined area,\ncheck the atmosphere with an appropriate device.\n: EXTREMELY FLAMMABLE GAS. Forms explosive mixtures with air and oxidizing agents.\n: No reactivity hazard other than the effects described in sub-sections below.\n: DANGER! Toxic, flammable liquefied gas\nEvacuate all personnel from the danger area. Use self-contained breathing apparatus (SCBA)\nand protective clothing. Immediately cool containers with water from maximum distance. Stop\nflow of gas if safe to do so, while continuing cooling water spray. Remove ignition sources if\nsafe to do so. Remove containers from area of fire if safe to do so. On-site fire brigades must\ncomply with OSHA 29 CFR 1910.156 and applicable standards under 29 CFR 1910 Subpart\nL-Fire Protection.\n: Standard protective clothing and equipment (Self Contained Breathing Apparatus) for fire\nfighters.\n: Containers are equipped with a pressure relief device. (Exceptions may exist where authorized\nby TC.)."}