{"GUID":"AkKsEQACHt+fl92lo16Iwg==","MATNR":"HZ-ETH","MAKTX":"Ethanol","WERKS":"0001","LGORT":"0001","LGOBE":"Lager 0001","SECTION_ID":11,"SECTION_HEADER":"Toxicological information","SECTION_CONTENT":"· Information on toxicological effects\n• Acute toxicity:\nLD/LC50 values that are relevant for classification:\n64-17-5 ethanol\nOral\nLD50 >5,000 mg/kg (rat)\nInhalative LC50/4 h 20,000 mg/L (rat)\n· Primary irritant effect:\n· on the skin: No irritant effect.\non the eye: Irritating effect.\nSensitization: No sensitizing effects known.\nAdditional toxicological information:\nCarcinogenic categories\n· IARC (International Agency for Research on Cancer)\n· NTP (National Toxicology Program)\nSubstance is not listed.","REVISED_CONTENT":"Product ID:HZ-ETH,Product Description:Ethanol,Storage Location:0001,Storage Location Description:Lager 0001,Plant:0001,Section Id:11,Section Header:Toxicological information,Section Content:· Information on toxicological effects\n• Acute toxicity:\nLD/LC50 values that are relevant for classification:\n64-17-5 ethanol\nOral\nLD50 >5,000 mg/kg (rat)\nInhalative LC50/4 h 20,000 mg/L (rat)\n· Primary irritant effect:\n· on the skin: No irritant effect.\non the eye: Irritating effect.\nSensitization: No sensitizing effects known.\nAdditional toxicological information:\nCarcinogenic categories\n· IARC (International Agency for Research on Cancer)\n· NTP (National Toxicology Program)\nSubstance is not listed."}