{"GUID":"AkKsEQACHt+fl92lptzowg==","MATNR":"HZ-MER","MAKTX":"Mercury","WERKS":"0001","LGORT":"0088","LGOBE":"Lager 0088 (WM)","SECTION_ID":2,"SECTION_HEADER":"Hazard(s) identification","SECTION_CONTENT":"Classification\nThis chemical is considered hazardous by the 2012 OSHA Hazard Communication Standard (29 CFR 1910.1200)\nAcute Inhalation Toxicity - Vapors\nReproductive Toxicity\nSpecific target organ toxicity - (repeated exposure)\nTarget Organs - Central nervous system (CNS), Kidney, Liver.\nLabel Elements\nSignal Word\nDanger\nHazard Statements\nFatal if inhaled\nMay damage the unborn child\nCategory 2\nCategory 1B\nCategory 1\nCauses damage to organs through prolonged or repeated exposure","REVISED_CONTENT":"Product ID:HZ-MER,Product Description:Mercury,Storage Location:0088,Storage Location Description:Lager 0088 (WM),Plant:0001,Section Id:2,Section Header:Hazard(s) identification,Section Content:Classification\nThis chemical is considered hazardous by the 2012 OSHA Hazard Communication Standard (29 CFR 1910.1200)\nAcute Inhalation Toxicity - Vapors\nReproductive Toxicity\nSpecific target organ toxicity - (repeated exposure)\nTarget Organs - Central nervous system (CNS), Kidney, Liver.\nLabel Elements\nSignal Word\nDanger\nHazard Statements\nFatal if inhaled\nMay damage the unborn child\nCategory 2\nCategory 1B\nCategory 1\nCauses damage to organs through prolonged or repeated exposure"}