{"GUID":"AkKsEQACHt+fl92lpsvIwg==","MATNR":"HZ-HAC","MAKTX":"Hydrochloric acid","WERKS":"0001","LGORT":"0003","LGOBE":"Corrosive Items","SECTION_ID":9,"SECTION_HEADER":"Physical and chemical properties","SECTION_CONTENT":"Physical State\nAppearance\nOdor\nOdor Threshold\npH\nMelting Point/Range\nBoiling Point/Range\nFlash Point\nEvaporation Rate\nFlammability (solid,gas)\nFlammability or explosive limits\nUpper\nLower\nVapor Pressure\nVapor Density\nRelative Density\nSolubility\nPartition coefficient; n-octanol/water\nAutoignition Temperature\nDecomposition Temperature\nViscosity\nMolecular Formula\nMolecular Weight\nLiquid\nColorless\npungent\nNo information available\n< 1\n-35 °C/-31 °F\n57 °C / 135 °F @ 760 mmHg\nNo information available\nNo information available\nNot applicable\nNo data available\nNo data available\n125 mbar @ 20 °C\n1.27 (Air = 1.0)\n1.18\nSoluble in water\nNo data available\nNo information available\nNo information available\n1.8 mPa.s @ 15°C\nHCI.H2O\n36.46","REVISED_CONTENT":"Product ID:HZ-HAC,Product Description:Hydrochloric acid,Storage Location:0003,Storage Location Description:Corrosive Items,Plant:0001,Section Id:9,Section Header:Physical and chemical properties,Section Content:Physical State\nAppearance\nOdor\nOdor Threshold\npH\nMelting Point/Range\nBoiling Point/Range\nFlash Point\nEvaporation Rate\nFlammability (solid,gas)\nFlammability or explosive limits\nUpper\nLower\nVapor Pressure\nVapor Density\nRelative Density\nSolubility\nPartition coefficient; n-octanol/water\nAutoignition Temperature\nDecomposition Temperature\nViscosity\nMolecular Formula\nMolecular Weight\nLiquid\nColorless\npungent\nNo information available\n< 1\n-35 °C/-31 °F\n57 °C / 135 °F @ 760 mmHg\nNo information available\nNo information available\nNot applicable\nNo data available\nNo data available\n125 mbar @ 20 °C\n1.27 (Air = 1.0)\n1.18\nSoluble in water\nNo data available\nNo information available\nNo information available\n1.8 mPa.s @ 15°C\nHCI.H2O\n36.46"}