{"GUID":"AkKsEQACHt+fl92lrOhowg==","MATNR":"HZ-PRO","MAKTX":"Propane","WERKS":"0001","LGORT":"0001","LGOBE":"Lager 0001","SECTION_ID":14,"SECTION_HEADER":"Transport information","SECTION_CONTENT":"UN1978 Propane see also Petroleum gases, liquefied, 2.1\nUN1978\nPropane\nsee also Petroleum gases, liquefied\n2.1 - Class 2.1 - Flammable gas 49 CFR 173.115\n2.1 - Flammable gas\n304\n314;315\nG - Identifies PSN requiring a technical name\n19 - For domestic transportation only, the identification number UN1075 may be used in place\nof the identification number specified in column (4) of the 172.101 table. The identification\nnumber used must be consistent on package markings, shipping papers and emergency\nresponse information.\nT50 - When portable tank instruction T50 is referenced in Column (7) of the 172.101 Table, the\napplicable liquefied compressed gases are authorized to be transported in portable tanks in\naccordance with the requirements of 173.313 of this subchapter.\n306\nForbidden\n150 kg\nE- The material may be stowed \"on deck\" or \"under deck\" on a cargo vessel and on a\npassenger vessel carrying a number of passengers limited to not more than the larger of 25\npassengers, or one passenger per each 3 m of overall vessel length, but is prohibited from\ncarriage on passenger vessels in which the limiting number of passengers is exceeded, D - The\nmaterial must be stowed \"on deck only\" on a cargo vessel and on a passenger vessel carrying\na number of passengers limited to not more than the larger of 25 passengers or one passenger\nper each 3 m of overall vessel length, but the material is prohibited on passenger vessels in\nwhich the limiting number of passengers is exceeded.\n40 - Stow \"clear of living quarters\"\n115 (UN1075)\nNo supplementary information available.\nAvoid transport on vehicles where the load space is not separated from the driver's\ncompartment. Ensure vehicle driver is aware of the potential hazards of the load and knows\nwhat to do in the event of an accident or an emergency. Before transporting product containers:\nEnsure there is adequate ventilation. - Ensure that containers are firmly secured. - Ensure\ncylinder valve is closed and not leaking. - Ensure valve outlet cap nut or plug (where provided)\nis correctly fitted. - Ensure valve protection device (where provided) is correctly fitted.\nUN1978 PROPANE, 2.1\nUN1978\nPROPANE\n2.1 - Class 2.1 - Flammable Gas.\n88 - Despite the quantity limits in column 9 of Schedule 1 for these dangerous goods, a road\nvehicle is not a passenger carrying road vehicle unless the passengers in it are transported for\nhire or reward. SOR/2008-34\n3000\n0.125 L\nForbidden\n110 kg\nUN 1978 Propane, 2.1\n1978\nPropane\n2.1 - Flammable gases\n0\n115\nUN 1978 Propane, 2.1\n1978\nPropane\n2.1 Gases: Flammable","REVISED_CONTENT":"Product ID:HZ-PRO,Product Description:Propane,Storage Location:0001,Storage Location Description:Lager 0001,Plant:0001,Section Id:14,Section Header:Transport information,Section Content:UN1978 Propane see also Petroleum gases, liquefied, 2.1\nUN1978\nPropane\nsee also Petroleum gases, liquefied\n2.1 - Class 2.1 - Flammable gas 49 CFR 173.115\n2.1 - Flammable gas\n304\n314;315\nG - Identifies PSN requiring a technical name\n19 - For domestic transportation only, the identification number UN1075 may be used in place\nof the identification number specified in column (4) of the 172.101 table. The identification\nnumber used must be consistent on package markings, shipping papers and emergency\nresponse information.\nT50 - When portable tank instruction T50 is referenced in Column (7) of the 172.101 Table, the\napplicable liquefied compressed gases are authorized to be transported in portable tanks in\naccordance with the requirements of 173.313 of this subchapter.\n306\nForbidden\n150 kg\nE- The material may be stowed \"on deck\" or \"under deck\" on a cargo vessel and on a\npassenger vessel carrying a number of passengers limited to not more than the larger of 25\npassengers, or one passenger per each 3 m of overall vessel length, but is prohibited from\ncarriage on passenger vessels in which the limiting number of passengers is exceeded, D - The\nmaterial must be stowed \"on deck only\" on a cargo vessel and on a passenger vessel carrying\na number of passengers limited to not more than the larger of 25 passengers or one passenger\nper each 3 m of overall vessel length, but the material is prohibited on passenger vessels in\nwhich the limiting number of passengers is exceeded.\n40 - Stow \"clear of living quarters\"\n115 (UN1075)\nNo supplementary information available.\nAvoid transport on vehicles where the load space is not separated from the driver's\ncompartment. Ensure vehicle driver is aware of the potential hazards of the load and knows\nwhat to do in the event of an accident or an emergency. Before transporting product containers:\nEnsure there is adequate ventilation. - Ensure that containers are firmly secured. - Ensure\ncylinder valve is closed and not leaking. - Ensure valve outlet cap nut or plug (where provided)\nis correctly fitted. - Ensure valve protection device (where provided) is correctly fitted.\nUN1978 PROPANE, 2.1\nUN1978\nPROPANE\n2.1 - Class 2.1 - Flammable Gas.\n88 - Despite the quantity limits in column 9 of Schedule 1 for these dangerous goods, a road\nvehicle is not a passenger carrying road vehicle unless the passengers in it are transported for\nhire or reward. SOR/2008-34\n3000\n0.125 L\nForbidden\n110 kg\nUN 1978 Propane, 2.1\n1978\nPropane\n2.1 - Flammable gases\n0\n115\nUN 1978 Propane, 2.1\n1978\nPropane\n2.1 Gases: Flammable"}