{"GUID":"AkKsEQACHt+fl92lptkIwg==","MATNR":"HZ-MAL","MAKTX":"Malathion","WERKS":"0001","LGORT":"0088","LGOBE":"Lager 0088 (WM)","SECTION_ID":3,"SECTION_HEADER":"Composition / information on ingredients","SECTION_CONTENT":"3.1 Substances\nFormula\nMolecular weight\nCAS-No.\n: C10H19O6PS2\n: 330.36 g/mol\n: 121-75-5\nEC-No.\nIndex-No.\nComponent\nMalathion\n: 204-497-7\n: 015-041-00-X\nClassification\nConcentration\nAcute Tox. 4; Skin Sens.\n1; Carc. 1B; Aquatic Acute\n1; Aquatic Chronic 1;\nH302, H317, H350, H400,\nH410\nM-Factor - Aquatic Acute:\n100 - Aquatic Chronic: 100\nFor the full text of the H-Statements mentioned in this Section, see Section 16.","REVISED_CONTENT":"Product ID:HZ-MAL,Product Description:Malathion,Storage Location:0088,Storage Location Description:Lager 0088 (WM),Plant:0001,Section Id:3,Section Header:Composition / information on ingredients,Section Content:3.1 Substances\nFormula\nMolecular weight\nCAS-No.\n: C10H19O6PS2\n: 330.36 g/mol\n: 121-75-5\nEC-No.\nIndex-No.\nComponent\nMalathion\n: 204-497-7\n: 015-041-00-X\nClassification\nConcentration\nAcute Tox. 4; Skin Sens.\n1; Carc. 1B; Aquatic Acute\n1; Aquatic Chronic 1;\nH302, H317, H350, H400,\nH410\nM-Factor - Aquatic Acute:\n100 - Aquatic Chronic: 100\nFor the full text of the H-Statements mentioned in this Section, see Section 16."}