{"GUID":"AkKsEQACHt+fl92lrOSowg==","MATNR":"HZ-POH","MAKTX":"Potassium hydroxide","WERKS":"0001","LGORT":"0003","LGOBE":"Corrosive Items","SECTION_ID":16,"SECTION_HEADER":"Other information","SECTION_CONTENT":"NFPA Hazard ID\n0\n3\n1\nCOR\nFlammability\nHealth\nReactivity\nSpecial hazard.\nHazard rating: 0 - Minimal; 1 - Slight; 2 - Moderate; 3 - Serious; 4 - Severe; RNP - Rating not possible\nCOR: Corrosive\nIssue Date:\n01-07-2019\nRevision Information:\nNot relevant.\nVersion #: 1.1\nSource of information:\nSources of information used in preparing this SDS included one or more of\nthe following: results from in house or supplier toxicology studies, information\nfrom the Toxicology Data Network (TOXNET), European Chemical Agency\n(ECHA) substance dossiers, IARC Monographs, US National Toxicology\nProgram data, the Agency for Toxic Substances and Disease Registry, other\nmanufacturer's SDSs and other sources, as appropriate.\nFurther information:\nNo data available.","REVISED_CONTENT":"Product ID:HZ-POH,Product Description:Potassium hydroxide,Storage Location:0003,Storage Location Description:Corrosive Items,Plant:0001,Section Id:16,Section Header:Other information,Section Content:NFPA Hazard ID\n0\n3\n1\nCOR\nFlammability\nHealth\nReactivity\nSpecial hazard.\nHazard rating: 0 - Minimal; 1 - Slight; 2 - Moderate; 3 - Serious; 4 - Severe; RNP - Rating not possible\nCOR: Corrosive\nIssue Date:\n01-07-2019\nRevision Information:\nNot relevant.\nVersion #: 1.1\nSource of information:\nSources of information used in preparing this SDS included one or more of\nthe following: results from in house or supplier toxicology studies, information\nfrom the Toxicology Data Network (TOXNET), European Chemical Agency\n(ECHA) substance dossiers, IARC Monographs, US National Toxicology\nProgram data, the Agency for Toxic Substances and Disease Registry, other\nmanufacturer's SDSs and other sources, as appropriate.\nFurther information:\nNo data available."}