{"GUID":"AkKsEQACHt+fl92lo1cIwg==","MATNR":"HZ-CHL","MAKTX":"Chlorine","WERKS":"0001","LGORT":"0001","LGOBE":"Lager 0001","SECTION_ID":15,"SECTION_HEADER":"Regulatory information","SECTION_CONTENT":"15.1. US Federal regulations\nChlorine (7782-50-5)\nSubject to reporting requirements of United States SARA Section 313\nListed on EPA Hazardous Air Pollutant (HAPS)\nCERCLA RQ\nSection 302 EPCRA Reportable Quantity (RQ)\nSARA Section 302 Threshold Planning Quantity\n(TPQ)\nCommercial status of components according to the United States Environmental Protection Agency's Toxic Substances Control Act (TSCA):\nName\nChlorine\n15.2. International regulations\nCANADA\nChlorine (7782-50-5)\nListed on the Canadian DSL (Domestic Substances List)\n: 10 lb\n: 10 lb\n: 100 lb\nCAS-No.\n7782-50-5\nListing\nPresent\nCommercial\nstatus\nActive\nFlags","REVISED_CONTENT":"Product ID:HZ-CHL,Product Description:Chlorine,Storage Location:0001,Storage Location Description:Lager 0001,Plant:0001,Section Id:15,Section Header:Regulatory information,Section Content:15.1. US Federal regulations\nChlorine (7782-50-5)\nSubject to reporting requirements of United States SARA Section 313\nListed on EPA Hazardous Air Pollutant (HAPS)\nCERCLA RQ\nSection 302 EPCRA Reportable Quantity (RQ)\nSARA Section 302 Threshold Planning Quantity\n(TPQ)\nCommercial status of components according to the United States Environmental Protection Agency's Toxic Substances Control Act (TSCA):\nName\nChlorine\n15.2. International regulations\nCANADA\nChlorine (7782-50-5)\nListed on the Canadian DSL (Domestic Substances List)\n: 10 lb\n: 10 lb\n: 100 lb\nCAS-No.\n7782-50-5\nListing\nPresent\nCommercial\nstatus\nActive\nFlags"}