{"GUID":"AkKsEQACHt+fl92lrPUowg==","MATNR":"HZ-TNT","MAKTX":"TNT","WERKS":"0001","LGORT":"0002","LGOBE":"Cold Storage","SECTION_ID":4,"SECTION_HEADER":"First-aid measures","SECTION_CONTENT":"• Description of first aid measures\nGeneral information:\nImmediately remove any clothing soiled by the product.\nRemove breathing apparatus only after contaminated clothing have been completely removed.\nIn case of irregular breathing or respiratory arrest provide artificial respiration.\n• After inhalation:\nSupply fresh air or oxygen; call for doctor.\nIn case of unconsciousness place patient stably in side position for transportation.\n• After skin contact: Immediately wash with water and soap and rinse thoroughly.\n• After eye contact: Rinse opened eye for several minutes under running water. Then consult a doctor.\n• After swallowing: Do not give anything to eat or drink - Do not induce vomitting\n• Information for Doctor:\n· Most important symptoms and effects, both acute and delayed No further relevant information available.\n• Indication of any immediate medical attention and special treatment needed No further relevant information available.","REVISED_CONTENT":"Product ID:HZ-TNT,Product Description:TNT,Storage Location:0002,Storage Location Description:Cold Storage,Plant:0001,Section Id:4,Section Header:First-aid measures,Section Content:• Description of first aid measures\nGeneral information:\nImmediately remove any clothing soiled by the product.\nRemove breathing apparatus only after contaminated clothing have been completely removed.\nIn case of irregular breathing or respiratory arrest provide artificial respiration.\n• After inhalation:\nSupply fresh air or oxygen; call for doctor.\nIn case of unconsciousness place patient stably in side position for transportation.\n• After skin contact: Immediately wash with water and soap and rinse thoroughly.\n• After eye contact: Rinse opened eye for several minutes under running water. Then consult a doctor.\n• After swallowing: Do not give anything to eat or drink - Do not induce vomitting\n• Information for Doctor:\n· Most important symptoms and effects, both acute and delayed No further relevant information available.\n• Indication of any immediate medical attention and special treatment needed No further relevant information available."}