{"GUID":"AkKsEQACHt+fl92lpsxowg==","MATNR":"HZ-HAC","MAKTX":"Hydrochloric acid","WERKS":"0001","LGORT":"0003","LGOBE":"Corrosive Items","SECTION_ID":14,"SECTION_HEADER":"Transport information","SECTION_CONTENT":"DOT\nUN-No\nProper Shipping Name\nHazard Class\nPacking Group\nTDG\nUN-No\nProper Shipping Name\nHazard Class\nPacking Group\nIATA\nUN-No\nProper Shipping Name\nHazard Class\nPacking Group\nIMDG/IMO\nUN-No\nProper Shipping Name\nHazard Class\nPacking Group\nInternational Inventories\nComponent\nWater\nHydrochloric acid\nUN1789\nHYDROCHLORIC ACID\n8\nII\nUN1789\nHYDROCHLORIC ACID\n8\nII\nUN1789\nHydrochloric acid\n8\nUN1789\nHydrochloric acid\n8\nII\nTSCA DSL NDSL EINECS ELINCS NLP PICCS ENCS AICS IECSC KECL\nX\nX\nX\nX\n231-791-2\n231-595-7\nX\nX\nX\nX\nX\nX\nX\nX\nX\nLegend:\nX - Listed\nE - Indicates a substance that is the subject of a Section 5(e) Consent order under TSCA.\nF - Indicates a substance that is the subject of a Section 5(f) Rule under TSCA.\nN - Indicates a polymeric substance containing no free-radical initiator in its inventory name but is considered to cover the designated\npolymer made with any free-radical initiator regardless of the amount used.\nP - Indicates a commenced PMN substance\nR - Indicates a substance that is the subject of a Section 6 risk management rule under TSCA.\nS - Indicates a substance that is identified in a proposed or final Significant New Use Rule\nT - Indicates a substance that is the subject of a Section 4 test rule under TSCA.\nXU - Indicates a substance exempt from reporting under the Inventory Update Rule, i.e. Partial Updating of the TSCA Inventory Data Base\nProduction and Site Reports (40 CFR 710(B). \nY1 - Indicates an exempt polymer that has a number-average molecular weight of 1,000 or greater.","REVISED_CONTENT":"Product ID:HZ-HAC,Product Description:Hydrochloric acid,Storage Location:0003,Storage Location Description:Corrosive Items,Plant:0001,Section Id:14,Section Header:Transport information,Section Content:DOT\nUN-No\nProper Shipping Name\nHazard Class\nPacking Group\nTDG\nUN-No\nProper Shipping Name\nHazard Class\nPacking Group\nIATA\nUN-No\nProper Shipping Name\nHazard Class\nPacking Group\nIMDG/IMO\nUN-No\nProper Shipping Name\nHazard Class\nPacking Group\nInternational Inventories\nComponent\nWater\nHydrochloric acid\nUN1789\nHYDROCHLORIC ACID\n8\nII\nUN1789\nHYDROCHLORIC ACID\n8\nII\nUN1789\nHydrochloric acid\n8\nUN1789\nHydrochloric acid\n8\nII\nTSCA DSL NDSL EINECS ELINCS NLP PICCS ENCS AICS IECSC KECL\nX\nX\nX\nX\n231-791-2\n231-595-7\nX\nX\nX\nX\nX\nX\nX\nX\nX\nLegend:\nX - Listed\nE - Indicates a substance that is the subject of a Section 5(e) Consent order under TSCA.\nF - Indicates a substance that is the subject of a Section 5(f) Rule under TSCA.\nN - Indicates a polymeric substance containing no free-radical initiator in its inventory name but is considered to cover the designated\npolymer made with any free-radical initiator regardless of the amount used.\nP - Indicates a commenced PMN substance\nR - Indicates a substance that is the subject of a Section 6 risk management rule under TSCA.\nS - Indicates a substance that is identified in a proposed or final Significant New Use Rule\nT - Indicates a substance that is the subject of a Section 4 test rule under TSCA.\nXU - Indicates a substance exempt from reporting under the Inventory Update Rule, i.e. Partial Updating of the TSCA Inventory Data Base\nProduction and Site Reports (40 CFR 710(B). \nY1 - Indicates an exempt polymer that has a number-average molecular weight of 1,000 or greater."}