{"GUID":"AkKsEQACHt+fl92lrO6owg==","MATNR":"HZ-SOH","MAKTX":"Sodium hydroxide","WERKS":"0001","LGORT":"0003","LGOBE":"Corrosive Items","SECTION_ID":16,"SECTION_HEADER":"Other information","SECTION_CONTENT":"Regulatory Affairs\nThermo Fisher Scientific\nEmail: EMSDS.RA@thermofisher.com\n16-Jun-2009\n07-Aug-2015\n07-Aug-2015\nThis document has been updated to comply with the US OSHA HazCom 2012 Standard\nreplacing the current legislation under 29 CFR 1910.1200 to align with the Globally\nHarmonized System of Classification and Labeling of Chemicals (GHS)\nThe information provided on this Safety Data Sheet is correct to the best of our knowledge, information and belief at the","REVISED_CONTENT":"Product ID:HZ-SOH,Product Description:Sodium hydroxide,Storage Location:0003,Storage Location Description:Corrosive Items,Plant:0001,Section Id:16,Section Header:Other information,Section Content:Regulatory Affairs\nThermo Fisher Scientific\nEmail: EMSDS.RA@thermofisher.com\n16-Jun-2009\n07-Aug-2015\n07-Aug-2015\nThis document has been updated to comply with the US OSHA HazCom 2012 Standard\nreplacing the current legislation under 29 CFR 1910.1200 to align with the Globally\nHarmonized System of Classification and Labeling of Chemicals (GHS)\nThe information provided on this Safety Data Sheet is correct to the best of our knowledge, information and belief at the"}