{"GUID":"AkKsEQACHt+fl92loTbowg==","MATNR":"HZ-BUT","MAKTX":"Butane","WERKS":"0001","LGORT":"0001","LGOBE":"Lager 0001","SECTION_ID":16,"SECTION_HEADER":"Other information","SECTION_CONTENT":"SECTION 16: Other information\nFurther information\nThe above information is believed to be correct but does not purport to be all inclusive\nand shall be used only as a guide. The information in this document is based on the\npresent state of our knowledge and is applicable to the product with regard to\nappropriate safety precautions. It does not represent any guarantee of the properties of\nthe product. Sigma-Aldrich Corporation and its Affiliates shall not be held liable for any\ndamage resulting from handling or from contact with the above product. See\nwww.sigma-aldrich.com and/or the reverse side of invoice or packing slip for additional\nterms and conditions of sale.\nCopyright 2020 Sigma-Aldrich Co. LLC. License granted to make unlimited paper copies\nfor internal use only.\nThe branding on the header and/or footer of this document may temporarily not visually\nmatch the product purchased as we transition our branding. However, all of the\ninformation in the document regarding the product remains unchanged and matches the\nproduct ordered. For further information please contact mlsbranding@sial.com.\nVersion: 6.6","REVISED_CONTENT":"Product ID:HZ-BUT,Product Description:Butane,Storage Location:0001,Storage Location Description:Lager 0001,Plant:0001,Section Id:16,Section Header:Other information,Section Content:SECTION 16: Other information\nFurther information\nThe above information is believed to be correct but does not purport to be all inclusive\nand shall be used only as a guide. The information in this document is based on the\npresent state of our knowledge and is applicable to the product with regard to\nappropriate safety precautions. It does not represent any guarantee of the properties of\nthe product. Sigma-Aldrich Corporation and its Affiliates shall not be held liable for any\ndamage resulting from handling or from contact with the above product. See\nwww.sigma-aldrich.com and/or the reverse side of invoice or packing slip for additional\nterms and conditions of sale.\nCopyright 2020 Sigma-Aldrich Co. LLC. License granted to make unlimited paper copies\nfor internal use only.\nThe branding on the header and/or footer of this document may temporarily not visually\nmatch the product purchased as we transition our branding. However, all of the\ninformation in the document regarding the product remains unchanged and matches the\nproduct ordered. For further information please contact mlsbranding@sial.com.\nVersion: 6.6"}