{"GUID":"AkKsEQACHt+fl92lps9Iwg==","MATNR":"HZ-HYP","MAKTX":"Hydrogen Peroxide 3%","WERKS":"0001","LGORT":"0002","LGOBE":"Cold Storage","SECTION_ID":5,"SECTION_HEADER":"Fire-fighting measures","SECTION_CONTENT":"Unsuitable Extinguishing Media\nNo information available\nFlash Point\nNo information available\nMethod -\nNo information available\nAutoignition Temperature\nNo information available\nExplosion Limits\nUpper\nNo data available\nLower\nNo data available\nSensitivity to Mechanical Impact No information available\nSensitivity to Static Discharge No information available\nSpecific Hazards Arising from the Chemical\nNon-combustible. Containers may explode when heated.\nHazardous Combustion Products\noxygen\nProtective Equipment and Precautions for Firefighters\nAs in any fire, wear self-contained breathing apparatus pressure-demand, MSHA/NIOSH (approved or equivalent) and full\nprotective gear.\nNFPA\nHealth\n2\nFlammability\n0\nInstability\n1\nPhysical hazards\nN/A","REVISED_CONTENT":"Product ID:HZ-HYP,Product Description:Hydrogen Peroxide 3%,Storage Location:0002,Storage Location Description:Cold Storage,Plant:0001,Section Id:5,Section Header:Fire-fighting measures,Section Content:Unsuitable Extinguishing Media\nNo information available\nFlash Point\nNo information available\nMethod -\nNo information available\nAutoignition Temperature\nNo information available\nExplosion Limits\nUpper\nNo data available\nLower\nNo data available\nSensitivity to Mechanical Impact No information available\nSensitivity to Static Discharge No information available\nSpecific Hazards Arising from the Chemical\nNon-combustible. Containers may explode when heated.\nHazardous Combustion Products\noxygen\nProtective Equipment and Precautions for Firefighters\nAs in any fire, wear self-contained breathing apparatus pressure-demand, MSHA/NIOSH (approved or equivalent) and full\nprotective gear.\nNFPA\nHealth\n2\nFlammability\n0\nInstability\n1\nPhysical hazards\nN/A"}