{"GUID":"AkKsEQACHt+fl92lpt4owg==","MATNR":"HZ-MER","MAKTX":"Mercury","WERKS":"0001","LGORT":"0088","LGOBE":"Lager 0088 (WM)","SECTION_ID":12,"SECTION_HEADER":"Ecological information","SECTION_CONTENT":"Very toxic to aquatic organisms, may cause long-term adverse effects in the aquatic environment. The product contains following\nsubstances which are hazardous for the environment. Do not allow material to contaminate ground water system.\nComponent\nMercury\nFreshwater Algae\nNot listed\nFreshwater Fish\n0.9 mg/L LC50 96h\n0.18 mg/L LC50 96h\n0.16 mg/L LC50 96h\n0.5 mg/L LC50 96h\nMicrotox\nNot listed\nWater Flea\nNot listed\nPersistence and Degradability\nInsoluble in water May persist\nBioaccumulation/ Accumulation\nNo information available.\nMobility\nIs not likely mobile in the environment due its low water solubility.\nWaste Disposal Methods\nComponent\nMercury - 7439-97-6","REVISED_CONTENT":"Product ID:HZ-MER,Product Description:Mercury,Storage Location:0088,Storage Location Description:Lager 0088 (WM),Plant:0001,Section Id:12,Section Header:Ecological information,Section Content:Very toxic to aquatic organisms, may cause long-term adverse effects in the aquatic environment. The product contains following\nsubstances which are hazardous for the environment. Do not allow material to contaminate ground water system.\nComponent\nMercury\nFreshwater Algae\nNot listed\nFreshwater Fish\n0.9 mg/L LC50 96h\n0.18 mg/L LC50 96h\n0.16 mg/L LC50 96h\n0.5 mg/L LC50 96h\nMicrotox\nNot listed\nWater Flea\nNot listed\nPersistence and Degradability\nInsoluble in water May persist\nBioaccumulation/ Accumulation\nNo information available.\nMobility\nIs not likely mobile in the environment due its low water solubility.\nWaste Disposal Methods\nComponent\nMercury - 7439-97-6"}