{"GUID":"AkKsEQACHt+fl92lrOaowg==","MATNR":"HZ-PPM","MAKTX":"Potassium permanganate","WERKS":"0001","LGORT":"0088","LGOBE":"Lager 0088 (WM)","SECTION_ID":16,"SECTION_HEADER":"Other information","SECTION_CONTENT":"This product does not contain any Proposition 65 chemicals.\nComponent\nPotassium permanganate\nReportable Quantity (RQ):\nY\nDOT Marine Pollutant\nN\nDOT Severe Marine Pollutant\nN\nComponent\nPotassium permanganate\nNo information available\nComponent\nPotassium permanganate\nComponent\nPotassium permanganate\nComponent\nPotassium permanganate\nThis document has been updated to comply with the US OSHA HazCom 2012 Standard\nreplacing the current legislation under 29 CFR 1910.1200 to align with the Globally\nHarmonized System of Classification and Labeling of Chemicals (GHS).\nThe information provided in this Safety Data Sheet is correct to the best of our knowledge, information and belief at the\ndate of its publication. The information given is designed only as a guidance for safe handling, use, processing, storage,\ntransportation, disposal and release and is not to be considered a warranty or quality specification. The information\nrelates only to the specific material designated and may not be valid for such material used in combination with any other\nmaterials or in any process, unless specified in the text\nMassachusetts\nX\nNew Jersey\nX\nPennsylvania\nX\nIllinois\nX\nRhode Island\nX\nREACH (1907/2006) - Annex XIV\nSubstances Subject to\nAuthorization\nREACH (1907/2006) - Annex XVII -\nRestrictions on Certain Dangerous\nSubstances\nUse restricted. See item 75.\n(see link for restriction details)\nREACH Regulation (EC\n1907/2006) article 59 - Candidate\nList of Substances of Very High\nConcern (SVHC)\nhttps://echa.europa.eu/substances-restricted-under-reach\nCAS No\n7722-64-7\nCAS No\n7722-64-7\nListed\nNot applicable\nNot applicable\nNot applicable\nNot applicable\nNot applicable\nNot applicable\nNot applicable\nRegulatory Affairs\nThermo Fisher Scientific\nEmail: EMSDS.RA@thermofisher.com\n23-Oct-2009\n24-Dec-2021\n24-Dec-2021","REVISED_CONTENT":"Product ID:HZ-PPM,Product Description:Potassium permanganate,Storage Location:0088,Storage Location Description:Lager 0088 (WM),Plant:0001,Section Id:16,Section Header:Other information,Section Content:This product does not contain any Proposition 65 chemicals.\nComponent\nPotassium permanganate\nReportable Quantity (RQ):\nY\nDOT Marine Pollutant\nN\nDOT Severe Marine Pollutant\nN\nComponent\nPotassium permanganate\nNo information available\nComponent\nPotassium permanganate\nComponent\nPotassium permanganate\nComponent\nPotassium permanganate\nThis document has been updated to comply with the US OSHA HazCom 2012 Standard\nreplacing the current legislation under 29 CFR 1910.1200 to align with the Globally\nHarmonized System of Classification and Labeling of Chemicals (GHS).\nThe information provided in this Safety Data Sheet is correct to the best of our knowledge, information and belief at the\ndate of its publication. The information given is designed only as a guidance for safe handling, use, processing, storage,\ntransportation, disposal and release and is not to be considered a warranty or quality specification. The information\nrelates only to the specific material designated and may not be valid for such material used in combination with any other\nmaterials or in any process, unless specified in the text\nMassachusetts\nX\nNew Jersey\nX\nPennsylvania\nX\nIllinois\nX\nRhode Island\nX\nREACH (1907/2006) - Annex XIV\nSubstances Subject to\nAuthorization\nREACH (1907/2006) - Annex XVII -\nRestrictions on Certain Dangerous\nSubstances\nUse restricted. See item 75.\n(see link for restriction details)\nREACH Regulation (EC\n1907/2006) article 59 - Candidate\nList of Substances of Very High\nConcern (SVHC)\nhttps://echa.europa.eu/substances-restricted-under-reach\nCAS No\n7722-64-7\nCAS No\n7722-64-7\nListed\nNot applicable\nNot applicable\nNot applicable\nNot applicable\nNot applicable\nNot applicable\nNot applicable\nRegulatory Affairs\nThermo Fisher Scientific\nEmail: EMSDS.RA@thermofisher.com\n23-Oct-2009\n24-Dec-2021\n24-Dec-2021"}