{"GUID":"AkKsEQACHt+fl92lrPEowg==","MATNR":"HZ-SOM","MAKTX":"Sodium metal","WERKS":"0001","LGORT":"0001","LGOBE":"Lager 0001","SECTION_ID":4,"SECTION_HEADER":"First-aid measures","SECTION_CONTENT":"General information: It is advisable to have tongs, tweezers, scrapers or some kind of implement on hand to remove bits of metal from skin or clothing in\nthe event of an accident. Large amounts of water should be used to rinse or flood the area of contact as small amounts of water may do more harm than\ngood.\nINHALATION : Remove the victim to fresh air. Seek immediate medical attention.\nINGESTION: Quickly wipe material from mouth and rinse with water. Do not induce vomiting. Seek medical attention immediately.\nSKIN: Remove contaminated clothing if necessary. Brush off any visible solids. Wash the affected area with water for at least 15 minutes. Seek medical\nattention.\nEYES: Immediately flush eyes with copious amounts of water, including under eyelids for at least 10-15 minutes. A victim may need assistance in keeping\ntheir eyelids open. A 5% solution of boric acid may be used to neutralize any remaining caustic. Seek immediate medical attention.\nMost Important Symptoms/Effects, Acute and Delayed: May cause severe irritation and burns. See section 11 for more information.\nIndication of Immediate Medical Attention and Special Treatment: This product is corrosive and reacts violently with water. Treatment should first\nremove as much of the material as possible as quickly as possible and then flush with very large quantities of water. Ingestion presents a singular problem as\nemesis may produce esophageal damage and/or aspiration damage; dilution with water or other water-containing materials may produce a reaction that\nexacerbates the corrosive activity. Consideration may be given to gastric lavage with a large diameter tube for removal of material and then dilution with","REVISED_CONTENT":"Product ID:HZ-SOM,Product Description:Sodium metal,Storage Location:0001,Storage Location Description:Lager 0001,Plant:0001,Section Id:4,Section Header:First-aid measures,Section Content:General information: It is advisable to have tongs, tweezers, scrapers or some kind of implement on hand to remove bits of metal from skin or clothing in\nthe event of an accident. Large amounts of water should be used to rinse or flood the area of contact as small amounts of water may do more harm than\ngood.\nINHALATION : Remove the victim to fresh air. Seek immediate medical attention.\nINGESTION: Quickly wipe material from mouth and rinse with water. Do not induce vomiting. Seek medical attention immediately.\nSKIN: Remove contaminated clothing if necessary. Brush off any visible solids. Wash the affected area with water for at least 15 minutes. Seek medical\nattention.\nEYES: Immediately flush eyes with copious amounts of water, including under eyelids for at least 10-15 minutes. A victim may need assistance in keeping\ntheir eyelids open. A 5% solution of boric acid may be used to neutralize any remaining caustic. Seek immediate medical attention.\nMost Important Symptoms/Effects, Acute and Delayed: May cause severe irritation and burns. See section 11 for more information.\nIndication of Immediate Medical Attention and Special Treatment: This product is corrosive and reacts violently with water. Treatment should first\nremove as much of the material as possible as quickly as possible and then flush with very large quantities of water. Ingestion presents a singular problem as\nemesis may produce esophageal damage and/or aspiration damage; dilution with water or other water-containing materials may produce a reaction that\nexacerbates the corrosive activity. Consideration may be given to gastric lavage with a large diameter tube for removal of material and then dilution with"}