{"GUID":"AkKsEQACHt+fl92lo18Iwg==","MATNR":"HZ-ETH","MAKTX":"Ethanol","WERKS":"0001","LGORT":"0001","LGOBE":"Lager 0001","SECTION_ID":15,"SECTION_HEADER":"Regulatory information","SECTION_CONTENT":"路 Safety, health and environmental regulations/legislation specific for the substance or mixture\nSara\nSection 355 (extremely hazardous substances):\nSubstance is not listed.\nSection 313 (Specific toxic chemical listings):\nSubstance is not listed.\nTSCA (Toxic Substances Control Act):\nSubstance is listed.\n路 Proposition 65\nChemicals known to cause cancer:\nSubstance is not listed.\nChemicals known to cause reproductive toxicity for females:\nSubstance is not listed.\nChemicals known to cause reproductive toxicity for males:\nSubstance is not listed.\nChemicals known to cause developmental toxicity:\nSubstance is listed.","REVISED_CONTENT":"Product ID:HZ-ETH,Product Description:Ethanol,Storage Location:0001,Storage Location Description:Lager 0001,Plant:0001,Section Id:15,Section Header:Regulatory information,Section Content:路 Safety, health and environmental regulations/legislation specific for the substance or mixture\nSara\nSection 355 (extremely hazardous substances):\nSubstance is not listed.\nSection 313 (Specific toxic chemical listings):\nSubstance is not listed.\nTSCA (Toxic Substances Control Act):\nSubstance is listed.\n路 Proposition 65\nChemicals known to cause cancer:\nSubstance is not listed.\nChemicals known to cause reproductive toxicity for females:\nSubstance is not listed.\nChemicals known to cause reproductive toxicity for males:\nSubstance is not listed.\nChemicals known to cause developmental toxicity:\nSubstance is listed."}