{"GUID":"AkKsEQACHt+fl92lptwIwg==","MATNR":"HZ-MEO","MAKTX":"Methanol","WERKS":"0001","LGORT":"0001","LGOBE":"Lager 0001","SECTION_ID":11,"SECTION_HEADER":"Toxicological information","SECTION_CONTENT":"Toxicological information: LD50: (oral rat): 5628 mg/kg, LC50 (inhalation rat): 64000 ppm vol./4 h LDL0: (oral human): 143 mg/kg.\nNoncarcinogenic in animal experiments.\nOther information: If fumes inhaled: Irritations to the respiratory tracts. Upon contact with the skin: Risk of cutaneous absorption. Through\ncontact with the eyes: Irritations. If swallowed: nausea, vomiting, headaches, vertigo, intoxication, sight disorders,\nblindness (irreversible injury of the optic nerve). Systemic effects: acidosis, of the optic nerve). Systemic effects: acidosis, hypotension, anxiety, spasms, narcosis,\ncoma.","REVISED_CONTENT":"Product ID:HZ-MEO,Product Description:Methanol,Storage Location:0001,Storage Location Description:Lager 0001,Plant:0001,Section Id:11,Section Header:Toxicological information,Section Content:Toxicological information: LD50: (oral rat): 5628 mg/kg, LC50 (inhalation rat): 64000 ppm vol./4 h LDL0: (oral human): 143 mg/kg.\nNoncarcinogenic in animal experiments.\nOther information: If fumes inhaled: Irritations to the respiratory tracts. Upon contact with the skin: Risk of cutaneous absorption. Through\ncontact with the eyes: Irritations. If swallowed: nausea, vomiting, headaches, vertigo, intoxication, sight disorders,\nblindness (irreversible injury of the optic nerve). Systemic effects: acidosis, of the optic nerve). Systemic effects: acidosis, hypotension, anxiety, spasms, narcosis,\ncoma."}