{"GUID":"AkKsEQACHt+fl92loTJIwg==","MATNR":"HZ-ATR","MAKTX":"Atrazine","WERKS":"0001","LGORT":"0088","LGOBE":"Lager 0088 (WM)","SECTION_ID":11,"SECTION_HEADER":"Toxicological information","SECTION_CONTENT":"Routes of Entry: Skin contact. Eye contact. Ingestion. Inhalation.\nToxicity to Animals:\nLD50 (Oral, Rat): 672 mg/kg\nLD50 (Inhalation, Rat): 5,200 mg/m3\nLC50 (Skin, Rat): > 12500 mg/kg\nLD50 (Intraperitoneal, Rat): 235 mg/kg\nLD50 (Oral, Mouse): 850 mg/kg\nLD50 (Intraperitoneal, Mouse): 626 mg/kg\nLD50 (Oral, Rabbit): 750 mg/kg\nLD50 (Skin, Rabbit): 7500 mg/kg\nChronic Effects on Humans: Carcinogen: This product is or contains a component that is not classifiable as to its\ncarcinogenicity based on its IARC, ACGIH, NTP, or EPA classification. Carcinogenic by RTECS criteria.\nIARC CARCINOGEN LIST Rating: Group 3\nACGIH CARCINOGEN LIST Rating: A4\nTeratogen: Effects on embryo or fetus (Fetotoxicity).\nMutagen: Laboratory experiments have shown mutagenic effects; DNA damage\nReproductive Hazard: Maternal effects\nOther Toxic Effects on Humans: Skin Contact: May cause skin irritation.\nSkin Absorption: May be harmful if absorbed through the skin.\nEye Contact: Causes severe eye irritation.\nInhalation: May be harmful if inhaled. Material may be irritating to mucous membranes and upper respiratory tract.\nIngestion: Harmful if swallowed.\nSpecial Remarks on Toxicity to Animals: Not available.\nSpecial Remarks on Chronic Effects on Humans: Not available.\nSpecial Remarks on other Toxic Effects on Humans: Not available.","REVISED_CONTENT":"Product ID:HZ-ATR,Product Description:Atrazine,Storage Location:0088,Storage Location Description:Lager 0088 (WM),Plant:0001,Section Id:11,Section Header:Toxicological information,Section Content:Routes of Entry: Skin contact. Eye contact. Ingestion. Inhalation.\nToxicity to Animals:\nLD50 (Oral, Rat): 672 mg/kg\nLD50 (Inhalation, Rat): 5,200 mg/m3\nLC50 (Skin, Rat): > 12500 mg/kg\nLD50 (Intraperitoneal, Rat): 235 mg/kg\nLD50 (Oral, Mouse): 850 mg/kg\nLD50 (Intraperitoneal, Mouse): 626 mg/kg\nLD50 (Oral, Rabbit): 750 mg/kg\nLD50 (Skin, Rabbit): 7500 mg/kg\nChronic Effects on Humans: Carcinogen: This product is or contains a component that is not classifiable as to its\ncarcinogenicity based on its IARC, ACGIH, NTP, or EPA classification. Carcinogenic by RTECS criteria.\nIARC CARCINOGEN LIST Rating: Group 3\nACGIH CARCINOGEN LIST Rating: A4\nTeratogen: Effects on embryo or fetus (Fetotoxicity).\nMutagen: Laboratory experiments have shown mutagenic effects; DNA damage\nReproductive Hazard: Maternal effects\nOther Toxic Effects on Humans: Skin Contact: May cause skin irritation.\nSkin Absorption: May be harmful if absorbed through the skin.\nEye Contact: Causes severe eye irritation.\nInhalation: May be harmful if inhaled. Material may be irritating to mucous membranes and upper respiratory tract.\nIngestion: Harmful if swallowed.\nSpecial Remarks on Toxicity to Animals: Not available.\nSpecial Remarks on Chronic Effects on Humans: Not available.\nSpecial Remarks on other Toxic Effects on Humans: Not available."}