{"GUID":"AkKsEQACHt+fl92lpskowg==","MATNR":"HZ-GLY","MAKTX":"Glyphosate","WERKS":"0001","LGORT":"0088","LGOBE":"Lager 0088 (WM)","SECTION_ID":4,"SECTION_HEADER":"First-aid measures","SECTION_CONTENT":"General Advice If symptoms persist, call a physician.\nEye Contact Rinse immediately with plenty of water, also under the eyelids, for at least 15 minutes. Get\nmedical attention.\nSkin Contact Wash off immediately with plenty of water for at least 15 minutes. If skin irritation persists,\ncall a physician.\nInhalation Remove to fresh air. If not breathing, give artificial respiration. Get medical attention if\nsymptoms occur.\nIngestion Clean mouth with water and drink afterwards plenty of water. Get medical attention if\nsymptoms occur.\nMost important symptoms and effects Causes severe eye damage.\nNotes to Physician Treat symptomatically","REVISED_CONTENT":"Product ID:HZ-GLY,Product Description:Glyphosate,Storage Location:0088,Storage Location Description:Lager 0088 (WM),Plant:0001,Section Id:4,Section Header:First-aid measures,Section Content:General Advice If symptoms persist, call a physician.\nEye Contact Rinse immediately with plenty of water, also under the eyelids, for at least 15 minutes. Get\nmedical attention.\nSkin Contact Wash off immediately with plenty of water for at least 15 minutes. If skin irritation persists,\ncall a physician.\nInhalation Remove to fresh air. If not breathing, give artificial respiration. Get medical attention if\nsymptoms occur.\nIngestion Clean mouth with water and drink afterwards plenty of water. Get medical attention if\nsymptoms occur.\nMost important symptoms and effects Causes severe eye damage.\nNotes to Physician Treat symptomatically"}