{"GUID":"AkKsEQACHt+fl92lrPeowg==","MATNR":"HZ-TNT","MAKTX":"TNT","WERKS":"0001","LGORT":"0004","LGOBE":"Explosives","SECTION_ID":8,"SECTION_HEADER":"Exposure controls / personal protection","SECTION_CONTENT":"· Additional information about design of technical systems: No further data; see item 7.\nControl parameters\nComponents with limit values that require monitoring at the workplace:\n67-56-1 methanol\nPEL Long-term value: 260 mg/m³, 200 ppm\nREL Short-term value: 325 mg/m³, 250 ppm\nLong-term value: 260 mg/m³, 200 ppm\nSkin\nTLV Short-term value: 328 mg/m³, 250 ppm\nLong-term value: 262 mg/m³, 200 ppm\nSkin; BEI\n75-05-8 acetonitrile\nPEL Long-term value: 70 mg/m³, 40 ppm\nREL Long-term value: 34 mg/m³, 20 ppm\nTLV Long-term value: 34 mg/m³, 20 ppm\nSkin","REVISED_CONTENT":"Product ID:HZ-TNT,Product Description:TNT,Storage Location:0004,Storage Location Description:Explosives,Plant:0001,Section Id:8,Section Header:Exposure controls / personal protection,Section Content:· Additional information about design of technical systems: No further data; see item 7.\nControl parameters\nComponents with limit values that require monitoring at the workplace:\n67-56-1 methanol\nPEL Long-term value: 260 mg/m³, 200 ppm\nREL Short-term value: 325 mg/m³, 250 ppm\nLong-term value: 260 mg/m³, 200 ppm\nSkin\nTLV Short-term value: 328 mg/m³, 250 ppm\nLong-term value: 262 mg/m³, 200 ppm\nSkin; BEI\n75-05-8 acetonitrile\nPEL Long-term value: 70 mg/m³, 40 ppm\nREL Long-term value: 34 mg/m³, 20 ppm\nTLV Long-term value: 34 mg/m³, 20 ppm\nSkin"}