{"GUID":"AkKsEQACHt+fl92lpugowg==","MATNR":"HZ-PHO","MAKTX":"Phosphorus","WERKS":"0001","LGORT":"0088","LGOBE":"Lager 0088 (WM)","SECTION_ID":12,"SECTION_HEADER":"Ecological information","SECTION_CONTENT":"12.1. Toxicity\nEcotoxicity effects\nThis product contains the following substance(s) which are hazardous for the environment.\nComponent\nSulfuric acid\nFreshwater Fish\nLC50: > 500 mg/L, 96h\nstatic (Brachydanio\nrerio)\nLC50 = 8.9 mg/L 96H\nPoly(oxy-1.2-ethanediyl),\nalpha[4-(1,1,3,3-tetramethylbutyl)phenyl]-o\nmega-hydroxy (Triton X-100)\n12.2. Persistence and degradability\nNo information available\nDegradation in sewage\nWater Flea\nEC50: 29 mg/L/24h\nEC50 = 26 mg/L 48h\nFreshwater Algae\nMicrotox\nContains substances known to be hazardous to the environment or not degradable in waste","REVISED_CONTENT":"Product ID:HZ-PHO,Product Description:Phosphorus,Storage Location:0088,Storage Location Description:Lager 0088 (WM),Plant:0001,Section Id:12,Section Header:Ecological information,Section Content:12.1. Toxicity\nEcotoxicity effects\nThis product contains the following substance(s) which are hazardous for the environment.\nComponent\nSulfuric acid\nFreshwater Fish\nLC50: > 500 mg/L, 96h\nstatic (Brachydanio\nrerio)\nLC50 = 8.9 mg/L 96H\nPoly(oxy-1.2-ethanediyl),\nalpha[4-(1,1,3,3-tetramethylbutyl)phenyl]-o\nmega-hydroxy (Triton X-100)\n12.2. Persistence and degradability\nNo information available\nDegradation in sewage\nWater Flea\nEC50: 29 mg/L/24h\nEC50 = 26 mg/L 48h\nFreshwater Algae\nMicrotox\nContains substances known to be hazardous to the environment or not degradable in waste"}