{"GUID":"AkKsEQACHt+fl92lps4Iwg==","MATNR":"HZ-HEL","MAKTX":"Helium","WERKS":"0001","LGORT":"0001","LGOBE":"Lager 0001","SECTION_ID":11,"SECTION_HEADER":"Toxicological information","SECTION_CONTENT":"Information on likely routes of exposure\nIngestion\nNot likely, due to the form of the product.\nInhalation\nSuffocation (asphyxiant) hazard - if allowed to accumulate to concentrations that reduce oxygen\nbelow safe breathing levels.\nSkin contact\nContact with liquefied gas may cause frostbite.\nEye contact\nNot likely, due to the form of the product.\nSymptoms related to the\nphysical, chemical and\ntoxological characteristics\nExposure to rapidly expanding gas or vaporizing liquid may cause frostbite (\"cold burn\").\nInhalation: May cause drowsiness or dizziness. Unconsciousness. Very high exposure can cause\nsuffocation from lack of oxygen.\nInformation on toxicological effects\nAcute toxicity\nGas or vapor displaces oxygen available for breathing (asphyxiant).\nSkin corrosion/irritation\nNot classified.\nSerious eye damage/eye\nirritation\nNot classified.\nRespiratory or skin sensitization\nRespiratory sensitization\nNot classified.\nSkin sensitization\nNot classified.","REVISED_CONTENT":"Product ID:HZ-HEL,Product Description:Helium,Storage Location:0001,Storage Location Description:Lager 0001,Plant:0001,Section Id:11,Section Header:Toxicological information,Section Content:Information on likely routes of exposure\nIngestion\nNot likely, due to the form of the product.\nInhalation\nSuffocation (asphyxiant) hazard - if allowed to accumulate to concentrations that reduce oxygen\nbelow safe breathing levels.\nSkin contact\nContact with liquefied gas may cause frostbite.\nEye contact\nNot likely, due to the form of the product.\nSymptoms related to the\nphysical, chemical and\ntoxological characteristics\nExposure to rapidly expanding gas or vaporizing liquid may cause frostbite (\"cold burn\").\nInhalation: May cause drowsiness or dizziness. Unconsciousness. Very high exposure can cause\nsuffocation from lack of oxygen.\nInformation on toxicological effects\nAcute toxicity\nGas or vapor displaces oxygen available for breathing (asphyxiant).\nSkin corrosion/irritation\nNot classified.\nSerious eye damage/eye\nirritation\nNot classified.\nRespiratory or skin sensitization\nRespiratory sensitization\nNot classified.\nSkin sensitization\nNot classified."}