{"GUID":"AkKsEQACHt+fl92lps6Iwg==","MATNR":"HZ-HEL","MAKTX":"Helium","WERKS":"0001","LGORT":"0001","LGOBE":"Lager 0001","SECTION_ID":15,"SECTION_HEADER":"Regulatory information","SECTION_CONTENT":"US federal regulations\nThis product is a \"Hazardous Chemical\" as defined by the OSHA Hazard Communication\nStandard, 29 CFR 1910.1200.\nTSCA Section 12(b) Export Notification (40 CFR 707, Subpt. D)\nNot regulated.\nUS. OSHA Specifically Regulated Substances (29 CFR 1910.1001-1050)\nNot listed.\nCERCLA Hazardous Substance List (40 CFR 302.4)\nNot listed.\nSuperfund Amendments and Reauthorization Act of 1986 (SARA)\nHazard categories\nImmediate Hazard - No\nDelayed Hazard - No\nFire Hazard - No\nPressure Hazard - Yes\nReactivity Hazard - No\nSARA 302 Extremely hazardous substance\nNot listed.\nSARA 311/312 Hazardous\nchemical\nYes\nSARA 313 (TRI reporting)\nNot regulated.\nOther federal regulations\nClean Air Act (CAA) Section 112 Hazardous Air Pollutants (HAPS) List\nNot regulated.\nClean Air Act (CAA) Section 112(r) Accidental Release Prevention (40 CFR 68.130)\nNot regulated.\nSafe Drinking Water Act\n(SDWA)\nNot regulated.\nTotal food additive\nDirect food additive\nGRAS food additive\nFood and Drug\nAdministration (FDA)\nUS state regulations\nUS. Massachusetts RTK - Substance List\nHelium (CAS 7440-59-7)\nUS. New Jersey Worker and Community Right-to-Know Act\nHelium (CAS 7440-59-7)\nUS. Pennsylvania Worker and Community Right-to-Know Law\nHelium (CAS 7440-59-7)\nUS. Rhode Island RTK\nNot regulated.\nUS. California Proposition 65\nCalifornia Safe Drinking Water and Toxic Enforcement Act of 1986 (Proposition 65): This material is not known to contain\nany chemicals currently listed as carcinogens or reproductive toxins.\nUS - California Proposition 65 - Carcinogens & Reproductive Toxicity (CRT): Listed substance\nNot listed.\nInternational Inventories\nCountry(s) or region\nInventory name\nOn inventory (yes/no)*\nAustralia\nAustralian Inventory of Chemical Substances (AICS)\nYes\nCanada\nDomestic Substances List (DSL)\nYes\nCanada\nNon-Domestic Substances List (NDSL)\nNo\nChina\nInventory of Existing Chemical Substances in China (IECSC)\nYes\nEurope\nEuropean Inventory of Existing Commercial Chemical\nSubstances (EINECS)\nYes\nEurope\nEuropean List of Notified Chemical Substances (ELINCS)\nNo\nJapan\nInventory of Existing and New Chemical Substances (ENCS)\nNo\nKorea\nExisting Chemicals List (ECL)\nYes\nNew Zealand\nNew Zealand Inventory\nYes\nPhilippines\nPhilippine Inventory of Chemicals and Chemical Substances\n(PICCS)\nYes\nUnited States & Puerto Rico\nToxic Substances Control Act (TSCA) Inventory\nYes\n*A \"Yes\" indicates this product complies with the inventory requirements administered by the governing country(s).\nA \"No\" indicates that one or more components of the product are not listed or exempt from listing on the inventory administered by the governing\ncountry(s).","REVISED_CONTENT":"Product ID:HZ-HEL,Product Description:Helium,Storage Location:0001,Storage Location Description:Lager 0001,Plant:0001,Section Id:15,Section Header:Regulatory information,Section Content:US federal regulations\nThis product is a \"Hazardous Chemical\" as defined by the OSHA Hazard Communication\nStandard, 29 CFR 1910.1200.\nTSCA Section 12(b) Export Notification (40 CFR 707, Subpt. D)\nNot regulated.\nUS. OSHA Specifically Regulated Substances (29 CFR 1910.1001-1050)\nNot listed.\nCERCLA Hazardous Substance List (40 CFR 302.4)\nNot listed.\nSuperfund Amendments and Reauthorization Act of 1986 (SARA)\nHazard categories\nImmediate Hazard - No\nDelayed Hazard - No\nFire Hazard - No\nPressure Hazard - Yes\nReactivity Hazard - No\nSARA 302 Extremely hazardous substance\nNot listed.\nSARA 311/312 Hazardous\nchemical\nYes\nSARA 313 (TRI reporting)\nNot regulated.\nOther federal regulations\nClean Air Act (CAA) Section 112 Hazardous Air Pollutants (HAPS) List\nNot regulated.\nClean Air Act (CAA) Section 112(r) Accidental Release Prevention (40 CFR 68.130)\nNot regulated.\nSafe Drinking Water Act\n(SDWA)\nNot regulated.\nTotal food additive\nDirect food additive\nGRAS food additive\nFood and Drug\nAdministration (FDA)\nUS state regulations\nUS. Massachusetts RTK - Substance List\nHelium (CAS 7440-59-7)\nUS. New Jersey Worker and Community Right-to-Know Act\nHelium (CAS 7440-59-7)\nUS. Pennsylvania Worker and Community Right-to-Know Law\nHelium (CAS 7440-59-7)\nUS. Rhode Island RTK\nNot regulated.\nUS. California Proposition 65\nCalifornia Safe Drinking Water and Toxic Enforcement Act of 1986 (Proposition 65): This material is not known to contain\nany chemicals currently listed as carcinogens or reproductive toxins.\nUS - California Proposition 65 - Carcinogens & Reproductive Toxicity (CRT): Listed substance\nNot listed.\nInternational Inventories\nCountry(s) or region\nInventory name\nOn inventory (yes/no)*\nAustralia\nAustralian Inventory of Chemical Substances (AICS)\nYes\nCanada\nDomestic Substances List (DSL)\nYes\nCanada\nNon-Domestic Substances List (NDSL)\nNo\nChina\nInventory of Existing Chemical Substances in China (IECSC)\nYes\nEurope\nEuropean Inventory of Existing Commercial Chemical\nSubstances (EINECS)\nYes\nEurope\nEuropean List of Notified Chemical Substances (ELINCS)\nNo\nJapan\nInventory of Existing and New Chemical Substances (ENCS)\nNo\nKorea\nExisting Chemicals List (ECL)\nYes\nNew Zealand\nNew Zealand Inventory\nYes\nPhilippines\nPhilippine Inventory of Chemicals and Chemical Substances\n(PICCS)\nYes\nUnited States & Puerto Rico\nToxic Substances Control Act (TSCA) Inventory\nYes\n*A \"Yes\" indicates this product complies with the inventory requirements administered by the governing country(s).\nA \"No\" indicates that one or more components of the product are not listed or exempt from listing on the inventory administered by the governing\ncountry(s)."}