{"GUID":"AkKsEQACHt+fl92lpudIwg==","MATNR":"HZ-PHO","MAKTX":"Phosphorus","WERKS":"0001","LGORT":"0088","LGOBE":"Lager 0088 (WM)","SECTION_ID":5,"SECTION_HEADER":"Fire-fighting measures","SECTION_CONTENT":"5.1. Extinguishing media\nPowder. Do not use water or foam.\nExtinguishing media which must not be used for safety reasons\nDo not use water or foam.\n5.2. Special hazards arising from the substance or mixture\nThermal decomposition can lead to release of irritating gases and vapors.\nHazardous Combustion Products\nCarbon monoxide (CO), Carbon dioxide (CO2), Sulfur oxides.\n5.3. Advice for firefighters\nAs in any fire, wear self-contained breathing apparatus pressure-demand, MSHA/NIOSH (approved or equivalent) and full\nprotective gear.","REVISED_CONTENT":"Product ID:HZ-PHO,Product Description:Phosphorus,Storage Location:0088,Storage Location Description:Lager 0088 (WM),Plant:0001,Section Id:5,Section Header:Fire-fighting measures,Section Content:5.1. Extinguishing media\nPowder. Do not use water or foam.\nExtinguishing media which must not be used for safety reasons\nDo not use water or foam.\n5.2. Special hazards arising from the substance or mixture\nThermal decomposition can lead to release of irritating gases and vapors.\nHazardous Combustion Products\nCarbon monoxide (CO), Carbon dioxide (CO2), Sulfur oxides.\n5.3. Advice for firefighters\nAs in any fire, wear self-contained breathing apparatus pressure-demand, MSHA/NIOSH (approved or equivalent) and full\nprotective gear."}