{"GUID":"AkKsEQACHt+fl92lo1UIwg==","MATNR":"HZ-CES","MAKTX":"Cesium","WERKS":"0001","LGORT":"0088","LGOBE":"Lager 0088 (WM)","SECTION_ID":15,"SECTION_HEADER":"Regulatory information","SECTION_CONTENT":"SECTION 15: Regulatory information\nSARA 302 Components\nNo chemicals in this material are subject to the reporting requirements of SARA Title III,\nSection 302.\nSARA 313 Components\nThis material does not contain any chemical components with known CAS numbers that\nexceed the threshold (De Minimis) reporting levels established by SARA Title III, Section\n313.\nSARA 311/312 Hazards\nReactivity Hazard, Acute Health Hazard\nMassachusetts Right To Know Components\nNo components are subject to the Massachusetts Right to Know Act.\nPennsylvania Right To Know Components\nCaesium\nCAS-No.\n7440-46-2\nRevision Date\n2007-03-01\nNew Jersey Right To Know Components\nCaesium\nCAS-No.\n7440-46-2\nRevision Date\n2007-03-01\nCalifornia Prop. 65 Components\nThis product does not contain any chemicals known to the State of California to cause\ncancer, birth, or any other reproductive defects.","REVISED_CONTENT":"Product ID:HZ-CES,Product Description:Cesium,Storage Location:0088,Storage Location Description:Lager 0088 (WM),Plant:0001,Section Id:15,Section Header:Regulatory information,Section Content:SECTION 15: Regulatory information\nSARA 302 Components\nNo chemicals in this material are subject to the reporting requirements of SARA Title III,\nSection 302.\nSARA 313 Components\nThis material does not contain any chemical components with known CAS numbers that\nexceed the threshold (De Minimis) reporting levels established by SARA Title III, Section\n313.\nSARA 311/312 Hazards\nReactivity Hazard, Acute Health Hazard\nMassachusetts Right To Know Components\nNo components are subject to the Massachusetts Right to Know Act.\nPennsylvania Right To Know Components\nCaesium\nCAS-No.\n7440-46-2\nRevision Date\n2007-03-01\nNew Jersey Right To Know Components\nCaesium\nCAS-No.\n7440-46-2\nRevision Date\n2007-03-01\nCalifornia Prop. 65 Components\nThis product does not contain any chemicals known to the State of California to cause\ncancer, birth, or any other reproductive defects."}