{"GUID":"AkKsEQACHt+fl92lrOOIwg==","MATNR":"HZ-POH","MAKTX":"Potassium hydroxide","WERKS":"0001","LGORT":"0003","LGOBE":"Corrosive Items","SECTION_ID":7,"SECTION_HEADER":"Handling and storage","SECTION_CONTENT":"Precautions for safe handling:\nAvoid inhalation of dust and vapors. Do not get in eyes, on skin, on\nclothing. Do not taste or swallow. Wash hands thoroughly after handling.\nConditions for safe storage,\nincluding any\nincompatibilities:\nDo not eat, drink or smoke when using the product.\nDo not store in metal containers. Keep containers tightly closed. Store in\ncool, dry place. Store in a well-ventilated place.","REVISED_CONTENT":"Product ID:HZ-POH,Product Description:Potassium hydroxide,Storage Location:0003,Storage Location Description:Corrosive Items,Plant:0001,Section Id:7,Section Header:Handling and storage,Section Content:Precautions for safe handling:\nAvoid inhalation of dust and vapors. Do not get in eyes, on skin, on\nclothing. Do not taste or swallow. Wash hands thoroughly after handling.\nConditions for safe storage,\nincluding any\nincompatibilities:\nDo not eat, drink or smoke when using the product.\nDo not store in metal containers. Keep containers tightly closed. Store in\ncool, dry place. Store in a well-ventilated place."}