{"GUID":"AkKsEQACHt+fl92loTQIwg==","MATNR":"HZ-BEN","MAKTX":"Benzene","WERKS":"0001","LGORT":"0001","LGOBE":"Lager 0001","SECTION_ID":9,"SECTION_HEADER":"Physical and chemical properties","SECTION_CONTENT":"• Information on basic physical and chemical properties\nGeneral Information\n• Appearance:\nForm:\nColor:\nOdor:\nOdor threshold:\npH-value:\nChange in condition\nMelting point/Melting range:\nBoiling point/Boiling range:\nFlash point:\nFlammability (solid, gaseous):\n· Ignition temperature:\n• Decomposition temperature:\nAuto igniting:\n• Danger of explosion:\n• Explosion limits:\nLower:\nUpper:\n· Vapor pressure at 20 °C (68 °F):\nDensity at 20 °C (68 °F):\nRelative density\nVapor density\n· Evaporation rate","REVISED_CONTENT":"Product ID:HZ-BEN,Product Description:Benzene,Storage Location:0001,Storage Location Description:Lager 0001,Plant:0001,Section Id:9,Section Header:Physical and chemical properties,Section Content:• Information on basic physical and chemical properties\nGeneral Information\n• Appearance:\nForm:\nColor:\nOdor:\nOdor threshold:\npH-value:\nChange in condition\nMelting point/Melting range:\nBoiling point/Boiling range:\nFlash point:\nFlammability (solid, gaseous):\n· Ignition temperature:\n• Decomposition temperature:\nAuto igniting:\n• Danger of explosion:\n• Explosion limits:\nLower:\nUpper:\n· Vapor pressure at 20 °C (68 °F):\nDensity at 20 °C (68 °F):\nRelative density\nVapor density\n· Evaporation rate"}