{"GUID":"AkKsEQACHt+fl92lo1HIwg==","MATNR":"HZ-CAD","MAKTX":"Cadmium","WERKS":"0001","LGORT":"0088","LGOBE":"Lager 0088 (WM)","SECTION_ID":5,"SECTION_HEADER":"Fire-fighting measures","SECTION_CONTENT":"Flammability of the Product: May be combustible at high temperature.\nAuto-Ignition Temperature: 570째C (1058째F)\nFlash Points: Not available.\nFlammable Limits: Not available.\nProducts of Combustion: Some metallic oxides.\nFire Hazards in Presence of Various Substances:\nNon-flammable in presence of open flames and sparks, of heat, of oxidizing materials, of reducing materials, of combustible\nmaterials, of moisture.\nExplosion Hazards in Presence of Various Substances:\nRisks of explosion of the product in presence of mechanical impact: Not available. Risks of explosion of the product in\npresence of static discharge: Not available.\nFire Fighting Media and Instructions:\nSMALL FIRE: Use DRY chemical powder. LARGE FIRE: Use water spray, fog or foam. Do not use water jet.\nSpecial Remarks on Fire Hazards:\nMaterial in powder form, capable of creating a dust explosion. When heated to decomposition it emits toxic fumes.\nSpecial Remarks on Explosion Hazards: Not available.","REVISED_CONTENT":"Product ID:HZ-CAD,Product Description:Cadmium,Storage Location:0088,Storage Location Description:Lager 0088 (WM),Plant:0001,Section Id:5,Section Header:Fire-fighting measures,Section Content:Flammability of the Product: May be combustible at high temperature.\nAuto-Ignition Temperature: 570째C (1058째F)\nFlash Points: Not available.\nFlammable Limits: Not available.\nProducts of Combustion: Some metallic oxides.\nFire Hazards in Presence of Various Substances:\nNon-flammable in presence of open flames and sparks, of heat, of oxidizing materials, of reducing materials, of combustible\nmaterials, of moisture.\nExplosion Hazards in Presence of Various Substances:\nRisks of explosion of the product in presence of mechanical impact: Not available. Risks of explosion of the product in\npresence of static discharge: Not available.\nFire Fighting Media and Instructions:\nSMALL FIRE: Use DRY chemical powder. LARGE FIRE: Use water spray, fog or foam. Do not use water jet.\nSpecial Remarks on Fire Hazards:\nMaterial in powder form, capable of creating a dust explosion. When heated to decomposition it emits toxic fumes.\nSpecial Remarks on Explosion Hazards: Not available."}