{"GUID":"AkKsEQACHt+fl92lo1rIwg==","MATNR":"HZ-CMO","MAKTX":"Carbon monoxide","WERKS":"0001","LGORT":"0001","LGOBE":"Lager 0001","SECTION_ID":13,"SECTION_HEADER":"Disposal considerations","SECTION_CONTENT":"Disposal methods\nWaste treatment methods\nProduct/Packaging disposal recommendations\n: Contact supplier if guidance is required. Do not discharge into any place where its\naccumulation could be dangerous. Ensure that the emission levels from local regulations or\noperating permits are not exceeded. Waste gas should be flared through a suitable burner with\nflash back arrestor. Do not discharge into areas where there is a risk of forming an explosive\nmixture with air.\n: Refer to the CGA Pamphlet P-63 \"Disposal of Gases\" available at www.cganet.com for\nmore guidance on suitable disposal methods.","REVISED_CONTENT":"Product ID:HZ-CMO,Product Description:Carbon monoxide,Storage Location:0001,Storage Location Description:Lager 0001,Plant:0001,Section Id:13,Section Header:Disposal considerations,Section Content:Disposal methods\nWaste treatment methods\nProduct/Packaging disposal recommendations\n: Contact supplier if guidance is required. Do not discharge into any place where its\naccumulation could be dangerous. Ensure that the emission levels from local regulations or\noperating permits are not exceeded. Waste gas should be flared through a suitable burner with\nflash back arrestor. Do not discharge into areas where there is a risk of forming an explosive\nmixture with air.\n: Refer to the CGA Pamphlet P-63 \"Disposal of Gases\" available at www.cganet.com for\nmore guidance on suitable disposal methods."}