{"GUID":"AkKsEQACHt+fl92lpt2owg==","MATNR":"HZ-MER","MAKTX":"Mercury","WERKS":"0001","LGORT":"0088","LGOBE":"Lager 0088 (WM)","SECTION_ID":8,"SECTION_HEADER":"Exposure controls / personal protection","SECTION_CONTENT":"Exposure Guidelines\nComponent\nMercury\nACGIH TLV\nTWA: 0.025 mg/m³\nSkin\nOSHA PEL\n(Vacated) TWA: 0.05 mg/m³\nCeiling: 0.1 mg/m³\n(Vacated) STEL: 0.03 mg/m³\nSkin\n(Vacated) Ceiling: 0.1 mg/m³\nNIOSH\nIDLH: 10 mg/m³\nTWA: 0.05 mg/m³\nCeiling: 0.1 mg/m³\nMexico OEL (TWA)\nTWA: 0.025 mg/m³\nLegend\nACGIH - American Conference of Governmental Industrial Hygienists\nOSHA - Occupational Safety and Health Administration\nNIOSH: NIOSH - National Institute for Occupational Safety and Health\nEngineering Measures\nUse only under a chemical fume hood. Ensure adequate ventilation, especially in confined\nareas. Ensure that eyewash stations and safety showers are close to the workstation\nlocation.\nPersonal Protective Equipment\nEye/face Protection\nWear appropriate protective eyeglasses or chemical safety goggles as described by\nOSHA's eye and face protection regulations in 29 CFR 1910.133 or European Standard\nEN166.\nSkin and body protection\nWear appropriate protective gloves and clothing to prevent skin exposure.\nRespiratory Protection\nFollow the OSHA respirator regulations found in 29 CFR 1910.134 or European Standard\nEN 149. Use a NIOSH/MSHA or European Standard EN 149 approved respirator if\nexposure limits are exceeded or if irritation or other symptoms are experienced.\nRecommended Filter type:\nParticulates filter conforming to EN 143. or. Inorganic gases and vapours filter. Type B.\nGrey. conforming to EN14387.\nHygiene Measures\nHandle in accordance with good industrial hygiene and safety practice.","REVISED_CONTENT":"Product ID:HZ-MER,Product Description:Mercury,Storage Location:0088,Storage Location Description:Lager 0088 (WM),Plant:0001,Section Id:8,Section Header:Exposure controls / personal protection,Section Content:Exposure Guidelines\nComponent\nMercury\nACGIH TLV\nTWA: 0.025 mg/m³\nSkin\nOSHA PEL\n(Vacated) TWA: 0.05 mg/m³\nCeiling: 0.1 mg/m³\n(Vacated) STEL: 0.03 mg/m³\nSkin\n(Vacated) Ceiling: 0.1 mg/m³\nNIOSH\nIDLH: 10 mg/m³\nTWA: 0.05 mg/m³\nCeiling: 0.1 mg/m³\nMexico OEL (TWA)\nTWA: 0.025 mg/m³\nLegend\nACGIH - American Conference of Governmental Industrial Hygienists\nOSHA - Occupational Safety and Health Administration\nNIOSH: NIOSH - National Institute for Occupational Safety and Health\nEngineering Measures\nUse only under a chemical fume hood. Ensure adequate ventilation, especially in confined\nareas. Ensure that eyewash stations and safety showers are close to the workstation\nlocation.\nPersonal Protective Equipment\nEye/face Protection\nWear appropriate protective eyeglasses or chemical safety goggles as described by\nOSHA's eye and face protection regulations in 29 CFR 1910.133 or European Standard\nEN166.\nSkin and body protection\nWear appropriate protective gloves and clothing to prevent skin exposure.\nRespiratory Protection\nFollow the OSHA respirator regulations found in 29 CFR 1910.134 or European Standard\nEN 149. Use a NIOSH/MSHA or European Standard EN 149 approved respirator if\nexposure limits are exceeded or if irritation or other symptoms are experienced.\nRecommended Filter type:\nParticulates filter conforming to EN 143. or. Inorganic gases and vapours filter. Type B.\nGrey. conforming to EN14387.\nHygiene Measures\nHandle in accordance with good industrial hygiene and safety practice."}