{"GUID":"AkKsEQACHt+fl92lo15Iwg==","MATNR":"HZ-ETH","MAKTX":"Ethanol","WERKS":"0001","LGORT":"0001","LGOBE":"Lager 0001","SECTION_ID":9,"SECTION_HEADER":"Physical and chemical properties","SECTION_CONTENT":"· Information on basic physical and chemical properties\nGeneral Information\n• Appearance:\nForm:\nColor:\nOdor:\nOdor threshold:\n· pH-value:\n• Change in condition\nMelting point/Melting range:\nBoiling point/Boiling range:\nFlash point:\nFlammability (solid, gaseous):\n• Ignition temperature:\n· Decomposition temperature:\n· Auto igniting:\nDanger of explosion:\n· Explosion limits:\nLower:\nUpper:\nVapor pressure at 20 °C (68 °F):\n· Density at 20 °C (68 °F):\nFluid\nColorless\nAlcohol-like\nNot determined.\nNot determined.\nNot determined.\n-114.5 °C (-174.1 °F)\n78 °C (172.4 °F)\n13 °C (55.4 °F)\nNot applicable.\n425 °C (797 °F)\nNot determined.\nNot determined.\nProduct is not explosive. However, formation of explosive air/vapor\nmixtures are possible.\n3.5 Vol%\n15 Vol%\n45 hPa (33.8 mm Hg)\n0.8 g/cm³ (6.676 lbs/gal)","REVISED_CONTENT":"Product ID:HZ-ETH,Product Description:Ethanol,Storage Location:0001,Storage Location Description:Lager 0001,Plant:0001,Section Id:9,Section Header:Physical and chemical properties,Section Content:· Information on basic physical and chemical properties\nGeneral Information\n• Appearance:\nForm:\nColor:\nOdor:\nOdor threshold:\n· pH-value:\n• Change in condition\nMelting point/Melting range:\nBoiling point/Boiling range:\nFlash point:\nFlammability (solid, gaseous):\n• Ignition temperature:\n· Decomposition temperature:\n· Auto igniting:\nDanger of explosion:\n· Explosion limits:\nLower:\nUpper:\nVapor pressure at 20 °C (68 °F):\n· Density at 20 °C (68 °F):\nFluid\nColorless\nAlcohol-like\nNot determined.\nNot determined.\nNot determined.\n-114.5 °C (-174.1 °F)\n78 °C (172.4 °F)\n13 °C (55.4 °F)\nNot applicable.\n425 °C (797 °F)\nNot determined.\nNot determined.\nProduct is not explosive. However, formation of explosive air/vapor\nmixtures are possible.\n3.5 Vol%\n15 Vol%\n45 hPa (33.8 mm Hg)\n0.8 g/cm³ (6.676 lbs/gal)"}