{"GUID":"AkKsEQACHt+fl92lrPHowg==","MATNR":"HZ-SOM","MAKTX":"Sodium metal","WERKS":"0001","LGORT":"0001","LGOBE":"Lager 0001","SECTION_ID":10,"SECTION_HEADER":"Stability and reactivity","SECTION_CONTENT":"Reactivity: No data\nChemical Stability: Stable under recommended storage conditions.\nPossibility of Hazardous Reactions: Sodium reacts violently with water releasing flammable hydrogen gas.\nConditions to Avoid : Contact with air or water.\nIncompatible Materials: Water, alcohols, oxidizers, oxygen, carbon dioxide, halogens, halocarbons, acids, sulfur, sulfur dioxide, phosphorus, ammonia,\nchlorinated hydrocarbons, hydrogen peroxide, lead oxide, potassium oxides.\nHazardous Decomposition Products: Sodium oxides, hydrogen gas, sodium hydroxides.","REVISED_CONTENT":"Product ID:HZ-SOM,Product Description:Sodium metal,Storage Location:0001,Storage Location Description:Lager 0001,Plant:0001,Section Id:10,Section Header:Stability and reactivity,Section Content:Reactivity: No data\nChemical Stability: Stable under recommended storage conditions.\nPossibility of Hazardous Reactions: Sodium reacts violently with water releasing flammable hydrogen gas.\nConditions to Avoid : Contact with air or water.\nIncompatible Materials: Water, alcohols, oxidizers, oxygen, carbon dioxide, halogens, halocarbons, acids, sulfur, sulfur dioxide, phosphorus, ammonia,\nchlorinated hydrocarbons, hydrogen peroxide, lead oxide, potassium oxides.\nHazardous Decomposition Products: Sodium oxides, hydrogen gas, sodium hydroxides."}