{"GUID":"AkKsEQACHt+fl92lpt/owg==","MATNR":"HZ-MET","MAKTX":"Methane","WERKS":"0001","LGORT":"0001","LGOBE":"Lager 0001","SECTION_ID":10,"SECTION_HEADER":"Stability and reactivity","SECTION_CONTENT":"Reactivity : No specific test data related to reactivity available for this product or its ingredients.\nChemical stability : The product is stable.\nPossibility of hazardous\nreactions : Under normal conditions of storage and use, hazardous reactions will not occur.\nConditions to avoid : Avoid all possible sources of ignition (spark or flame). Do not pressurize, cut, weld,\nbraze, solder, drill, grind or expose containers to heat or sources of ignition.\nIncompatible materials : Oxidizers\nHazardous decomposition\nproducts : Under normal conditions of storage and use, hazardous decomposition products should\nnot be produced.\nHazardous polymerization : Under normal conditions of storage and use, hazardous polymerization will not occur.","REVISED_CONTENT":"Product ID:HZ-MET,Product Description:Methane,Storage Location:0001,Storage Location Description:Lager 0001,Plant:0001,Section Id:10,Section Header:Stability and reactivity,Section Content:Reactivity : No specific test data related to reactivity available for this product or its ingredients.\nChemical stability : The product is stable.\nPossibility of hazardous\nreactions : Under normal conditions of storage and use, hazardous reactions will not occur.\nConditions to avoid : Avoid all possible sources of ignition (spark or flame). Do not pressurize, cut, weld,\nbraze, solder, drill, grind or expose containers to heat or sources of ignition.\nIncompatible materials : Oxidizers\nHazardous decomposition\nproducts : Under normal conditions of storage and use, hazardous decomposition products should\nnot be produced.\nHazardous polymerization : Under normal conditions of storage and use, hazardous polymerization will not occur."}