{"GUID":"AkKsEQACHt+fl92lrONIwg==","MATNR":"HZ-POH","MAKTX":"Potassium hydroxide","WERKS":"0001","LGORT":"0003","LGOBE":"Corrosive Items","SECTION_ID":5,"SECTION_HEADER":"Fire-fighting measures","SECTION_CONTENT":"General Fire Hazards:\nNo unusual fire or explosion hazards noted.\nSuitable (and unsuitable) extinguishing media\nSuitable extinguishing\nmedia:\nWater spray, foam, dry powder or carbon dioxide.\nUnsuitable extinguishing\nmedia:\nNone known.\nSpecific hazards arising from\nthe chemical:\nFire may produce irritating, corrosive and/or toxic gases.\nSpecial protective equipment and precautions for firefighters\nSpecial fire fighting\nprocedures:\nMove containers from fire area if you can do so without risk. Use water\nspray to keep fire-exposed containers cool.\nSpecial protective equipment\nfor fire-fighters:\nFirefighters must use standard protective equipment including flame\nretardant coat, helmet with face shield, gloves, rubber boots, and in\nenclosed spaces, SCBA.","REVISED_CONTENT":"Product ID:HZ-POH,Product Description:Potassium hydroxide,Storage Location:0003,Storage Location Description:Corrosive Items,Plant:0001,Section Id:5,Section Header:Fire-fighting measures,Section Content:General Fire Hazards:\nNo unusual fire or explosion hazards noted.\nSuitable (and unsuitable) extinguishing media\nSuitable extinguishing\nmedia:\nWater spray, foam, dry powder or carbon dioxide.\nUnsuitable extinguishing\nmedia:\nNone known.\nSpecific hazards arising from\nthe chemical:\nFire may produce irritating, corrosive and/or toxic gases.\nSpecial protective equipment and precautions for firefighters\nSpecial fire fighting\nprocedures:\nMove containers from fire area if you can do so without risk. Use water\nspray to keep fire-exposed containers cool.\nSpecial protective equipment\nfor fire-fighters:\nFirefighters must use standard protective equipment including flame\nretardant coat, helmet with face shield, gloves, rubber boots, and in\nenclosed spaces, SCBA."}