{"GUID":"AkKsEQACHt+fl92lrOFIwg==","MATNR":"HZ-PLU","MAKTX":"Plutonium nitrate","WERKS":"0001","LGORT":"0088","LGOBE":"Lager 0088 (WM)","SECTION_ID":5,"SECTION_HEADER":"Fire-fighting measures","SECTION_CONTENT":"FIRE AND EXPLOSION HAZARD: Dangerous due to fire or explosion hazard in bulk form.\nDusts, powders, or vapors are flammable or explosive when exposed to heat or flames.\nEXTINGUISHING MEDIA: Dry chemical, carbon dioxide, water spray or regular foam. Refer to\nmost recent Emergency Response Guidebook, (ERG), developed jointly by Transport Canada (TC),\nthe U.S. Department of Transportation (DOT) and the Secretariat of Transportation and\nCommunications of Mexico (SCT).)","REVISED_CONTENT":"Product ID:HZ-PLU,Product Description:Plutonium nitrate,Storage Location:0088,Storage Location Description:Lager 0088 (WM),Plant:0001,Section Id:5,Section Header:Fire-fighting measures,Section Content:FIRE AND EXPLOSION HAZARD: Dangerous due to fire or explosion hazard in bulk form.\nDusts, powders, or vapors are flammable or explosive when exposed to heat or flames.\nEXTINGUISHING MEDIA: Dry chemical, carbon dioxide, water spray or regular foam. Refer to\nmost recent Emergency Response Guidebook, (ERG), developed jointly by Transport Canada (TC),\nthe U.S. Department of Transportation (DOT) and the Secretariat of Transportation and\nCommunications of Mexico (SCT).)"}