{"GUID":"AkKsEQACHt+fl92lrPFIwg==","MATNR":"HZ-SOM","MAKTX":"Sodium metal","WERKS":"0001","LGORT":"0001","LGOBE":"Lager 0001","SECTION_ID":5,"SECTION_HEADER":"Fire-fighting measures","SECTION_CONTENT":"Extinguishing Media: USE CLASS D metal extinguishing agent such as Met-L-X, dry soda ash (anhydrous Na 2 CO 3), dry sand or graphite powder. If the\nchosen extinguishing agent is capable of absorbing moisture, provision must be made to keep it dry.\nUnsuitable Extinguishing Media: DO NOT USE water, carbon dioxide or carbon tetrachloride.\nSpecific Hazards Arising from the Material: Reacts violently with water. Contact with water releases flammable gases. When heated to decomposition\nsodium may emit toxic fumes of sodium oxide and sodium hydroxide.\nSpecial Protective Equipment and Precautions for Firefighters: Full face, self-contained breathing apparatus and full protective clothing to prevent\ncontact with skin and eyes. Material can reignite after fire is initially extinguished. Never leave extinguished fire unattended. Alkali metal fires may produce\nlarge quantities of white, opaque smoke that is caustic and may react with nearby materials. Flames may be practically invisible.","REVISED_CONTENT":"Product ID:HZ-SOM,Product Description:Sodium metal,Storage Location:0001,Storage Location Description:Lager 0001,Plant:0001,Section Id:5,Section Header:Fire-fighting measures,Section Content:Extinguishing Media: USE CLASS D metal extinguishing agent such as Met-L-X, dry soda ash (anhydrous Na 2 CO 3), dry sand or graphite powder. If the\nchosen extinguishing agent is capable of absorbing moisture, provision must be made to keep it dry.\nUnsuitable Extinguishing Media: DO NOT USE water, carbon dioxide or carbon tetrachloride.\nSpecific Hazards Arising from the Material: Reacts violently with water. Contact with water releases flammable gases. When heated to decomposition\nsodium may emit toxic fumes of sodium oxide and sodium hydroxide.\nSpecial Protective Equipment and Precautions for Firefighters: Full face, self-contained breathing apparatus and full protective clothing to prevent\ncontact with skin and eyes. Material can reignite after fire is initially extinguished. Never leave extinguished fire unattended. Alkali metal fires may produce\nlarge quantities of white, opaque smoke that is caustic and may react with nearby materials. Flames may be practically invisible."}