{"GUID":"AkKsEQACHt+fl92lptOowg==","MATNR":"HZ-LEA","MAKTX":"Lead","WERKS":"0001","LGORT":"0088","LGOBE":"Lager 0088 (WM)","SECTION_ID":8,"SECTION_HEADER":"Exposure controls / personal protection","SECTION_CONTENT":"Exposure Guidelines\nComponent\nLead\nACGIH TLV\nTWA: 0.05 mg/m³\nOSHA PEL\nTWA: 50 µg/m³\nNIOSH IDLH\nIDLH: 100 mg/m³\nTWA: 0.050 mg/m³\nComponent\nLead\nLegend\nACGIH - American Conference of Governmental Industrial Hygienists\nOSHA - Occupational Safety and Health Administration\nNIOSH IDLH: The National Institute for Occupational Safety and Health Immediately Dangerous to Life or Health\nEngineering Measures\nQuebec\nTWA: 0.05 mg/m³\nMexico OEL (TWA)\nTWA: 0.15 mg/m³\nOntario TWAEV\nTWA: 0.05 mg/m³\nEnsure adequate ventilation, especially in confined areas.","REVISED_CONTENT":"Product ID:HZ-LEA,Product Description:Lead,Storage Location:0088,Storage Location Description:Lager 0088 (WM),Plant:0001,Section Id:8,Section Header:Exposure controls / personal protection,Section Content:Exposure Guidelines\nComponent\nLead\nACGIH TLV\nTWA: 0.05 mg/m³\nOSHA PEL\nTWA: 50 µg/m³\nNIOSH IDLH\nIDLH: 100 mg/m³\nTWA: 0.050 mg/m³\nComponent\nLead\nLegend\nACGIH - American Conference of Governmental Industrial Hygienists\nOSHA - Occupational Safety and Health Administration\nNIOSH IDLH: The National Institute for Occupational Safety and Health Immediately Dangerous to Life or Health\nEngineering Measures\nQuebec\nTWA: 0.05 mg/m³\nMexico OEL (TWA)\nTWA: 0.15 mg/m³\nOntario TWAEV\nTWA: 0.05 mg/m³\nEnsure adequate ventilation, especially in confined areas."}