{"GUID":"AkKsEQACHt+fl92lrPHIwg==","MATNR":"HZ-SOM","MAKTX":"Sodium metal","WERKS":"0001","LGORT":"0001","LGOBE":"Lager 0001","SECTION_ID":9,"SECTION_HEADER":"Physical and chemical properties","SECTION_CONTENT":"Appearance\nForm : Solid\nColor: Silver metallic\nOdor: Not determined\nOdor Threshold: Not determined\npH: N/A\nMelting Point : 97.8 °C\nBoiling Point : 883 °C\nFlash Point : N/A\nEvaporation Rate : N/A\nFlammability : Flammable solid\nUpper Flammable Limit : No data\nLower Flammable Limit : No data\nVapor Pressure : 1 mm at 439 °C\nVapor Density : N/A\nRelative Density (Specific Gravity) : 0.97 g/cc\nSolubility in H 20: Decomposes\nPartition Coefficient (n-octanol/water): Not determined\nAutoignition Temperature : No data\nDecomposition Temperature : No data\nViscosity: N/A","REVISED_CONTENT":"Product ID:HZ-SOM,Product Description:Sodium metal,Storage Location:0001,Storage Location Description:Lager 0001,Plant:0001,Section Id:9,Section Header:Physical and chemical properties,Section Content:Appearance\nForm : Solid\nColor: Silver metallic\nOdor: Not determined\nOdor Threshold: Not determined\npH: N/A\nMelting Point : 97.8 °C\nBoiling Point : 883 °C\nFlash Point : N/A\nEvaporation Rate : N/A\nFlammability : Flammable solid\nUpper Flammable Limit : No data\nLower Flammable Limit : No data\nVapor Pressure : 1 mm at 439 °C\nVapor Density : N/A\nRelative Density (Specific Gravity) : 0.97 g/cc\nSolubility in H 20: Decomposes\nPartition Coefficient (n-octanol/water): Not determined\nAutoignition Temperature : No data\nDecomposition Temperature : No data\nViscosity: N/A"}