{"GUID":"AkKsEQACHt+fl92lpt3Iwg==","MATNR":"HZ-MER","MAKTX":"Mercury","WERKS":"0001","LGORT":"0088","LGOBE":"Lager 0088 (WM)","SECTION_ID":9,"SECTION_HEADER":"Physical and chemical properties","SECTION_CONTENT":"Physical State\nAppearance\nOdor\nOdor Threshold\npH\nMelting Point/Range\nBoiling Point/Range\nFlash Point\nEvaporation Rate\nFlammability (solid,gas)\nFlammability or explosive limits\nUpper\nLower\nVapor Pressure\nVapor Density\nSpecific Gravity\nSolubility\nPartition coefficient; n-octanol/water\nAutoignition Temperature\nDecomposition Temperature\nViscosity\nMolecular Formula\nMolecular Weight\nLiquid\nSilver\nOdorless\nNo information available\nNot applicable\n-38.9 °C / -38 °F\n356.5 °C / 673.7 °F\nNo information available\nNo information available\nNot applicable\nNo data available\nNo data available\n0.01 hPa @ 20 °C\n7.0\n13.540\ninsoluble\nNo information available\nNo data available\nNo information available\n1.554 cP at 20 °C\nHg\n200.59","REVISED_CONTENT":"Product ID:HZ-MER,Product Description:Mercury,Storage Location:0088,Storage Location Description:Lager 0088 (WM),Plant:0001,Section Id:9,Section Header:Physical and chemical properties,Section Content:Physical State\nAppearance\nOdor\nOdor Threshold\npH\nMelting Point/Range\nBoiling Point/Range\nFlash Point\nEvaporation Rate\nFlammability (solid,gas)\nFlammability or explosive limits\nUpper\nLower\nVapor Pressure\nVapor Density\nSpecific Gravity\nSolubility\nPartition coefficient; n-octanol/water\nAutoignition Temperature\nDecomposition Temperature\nViscosity\nMolecular Formula\nMolecular Weight\nLiquid\nSilver\nOdorless\nNo information available\nNot applicable\n-38.9 °C / -38 °F\n356.5 °C / 673.7 °F\nNo information available\nNo information available\nNot applicable\nNo data available\nNo data available\n0.01 hPa @ 20 °C\n7.0\n13.540\ninsoluble\nNo information available\nNo data available\nNo information available\n1.554 cP at 20 °C\nHg\n200.59"}