{"GUID":"AkKsEQACHt+fl92lo1hIwg==","MATNR":"HZ-CLG","MAKTX":"Chlorine gas","WERKS":"0001","LGORT":"0001","LGOBE":"Lager 0001","SECTION_ID":9,"SECTION_HEADER":"Physical and chemical properties","SECTION_CONTENT":"Information on basic physical and chemical properties\nGeneral Information\nAppearance:\nForm:\nColor:\nOdor:\nOdor threshold:\n· pH-value:\nChange in condition\nMelting point/Melting range:\nBoiling point/Boiling range:\nFlash point:\nFlammability (solid, gaseous):\n· Decomposition temperature:\nAuto igniting:\n· Danger of explosion:\nExplosion limits:\nLower:\nUpper:\nVapor pressure at 20 °C (68 °F):\nDensity at 20 °C (68 °F):","REVISED_CONTENT":"Product ID:HZ-CLG,Product Description:Chlorine gas,Storage Location:0001,Storage Location Description:Lager 0001,Plant:0001,Section Id:9,Section Header:Physical and chemical properties,Section Content:Information on basic physical and chemical properties\nGeneral Information\nAppearance:\nForm:\nColor:\nOdor:\nOdor threshold:\n· pH-value:\nChange in condition\nMelting point/Melting range:\nBoiling point/Boiling range:\nFlash point:\nFlammability (solid, gaseous):\n· Decomposition temperature:\nAuto igniting:\n· Danger of explosion:\nExplosion limits:\nLower:\nUpper:\nVapor pressure at 20 °C (68 °F):\nDensity at 20 °C (68 °F):"}