{"GUID":"AkKsEQACHt+fl92loTYowg==","MATNR":"HZ-BUT","MAKTX":"Butane","WERKS":"0001","LGORT":"0001","LGOBE":"Lager 0001","SECTION_ID":10,"SECTION_HEADER":"Stability and reactivity","SECTION_CONTENT":"SECTION 10: Stability and reactivity\n10.1 Reactivity\nNo data available\n10.2 Chemical stability\nThe product is chemically stable under standard ambient conditions (room temperature).\n10.3 Possibility of hazardous reactions\nNo data available\n10.4 Conditions to avoid\nno information available\n10.5 Incompatible materials\nStrong oxidizing agents\n10.6 Hazardous decomposition products\nIn the event of fire: see section 5","REVISED_CONTENT":"Product ID:HZ-BUT,Product Description:Butane,Storage Location:0001,Storage Location Description:Lager 0001,Plant:0001,Section Id:10,Section Header:Stability and reactivity,Section Content:SECTION 10: Stability and reactivity\n10.1 Reactivity\nNo data available\n10.2 Chemical stability\nThe product is chemically stable under standard ambient conditions (room temperature).\n10.3 Possibility of hazardous reactions\nNo data available\n10.4 Conditions to avoid\nno information available\n10.5 Incompatible materials\nStrong oxidizing agents\n10.6 Hazardous decomposition products\nIn the event of fire: see section 5"}