{"GUID":"AkKsEQACHt+fl92lpudowg==","MATNR":"HZ-PHO","MAKTX":"Phosphorus","WERKS":"0001","LGORT":"0088","LGOBE":"Lager 0088 (WM)","SECTION_ID":6,"SECTION_HEADER":"Accidental release measures","SECTION_CONTENT":"6.1. Personal precautions, protective equipment and emergency procedures\nUse personal protective equipment as required. Ensure adequate ventilation.\n6.2. Environmental precautions\nPrevent product from entering drains. Do not flush into surface water or sanitary sewer system. Should not be released into the\nenvironment.\n6.3. Methods and material for containment and cleaning up\nSoak up with inert absorbent material. Keep in suitable, closed containers for disposal.\n6.4. Reference to other sections\nRefer to protective measures listed in Sections 8 and 13.","REVISED_CONTENT":"Product ID:HZ-PHO,Product Description:Phosphorus,Storage Location:0088,Storage Location Description:Lager 0088 (WM),Plant:0001,Section Id:6,Section Header:Accidental release measures,Section Content:6.1. Personal precautions, protective equipment and emergency procedures\nUse personal protective equipment as required. Ensure adequate ventilation.\n6.2. Environmental precautions\nPrevent product from entering drains. Do not flush into surface water or sanitary sewer system. Should not be released into the\nenvironment.\n6.3. Methods and material for containment and cleaning up\nSoak up with inert absorbent material. Keep in suitable, closed containers for disposal.\n6.4. Reference to other sections\nRefer to protective measures listed in Sections 8 and 13."}