{"GUID":"AkKsEQACHt+fl92lo1bowg==","MATNR":"HZ-CHL","MAKTX":"Chlorine","WERKS":"0001","LGORT":"0001","LGOBE":"Lager 0001","SECTION_ID":14,"SECTION_HEADER":"Transport information","SECTION_CONTENT":"In accordance with DOT/TDG/IMDG / IATA\n14.1. UN number\nDOT NA No\nUN-No. (TDG)\nUN-No. (IMDG)\nUN-No. (IATA)\n14.2. UN proper shipping name\nProper Shipping Name (DOT)\nProper Shipping Name\nProper Shipping Name (IMDG)\nProper Shipping Name (IATA)\n14.3. Transport hazard class(es)\nDOT\nTransport hazard class(es) (DOT)\nHazard labels (DOT)\nTDG\nTransport hazard class(es) (TDG)\nHazard labels (TDG)\nIMDG\nTransport hazard class(es) (IMDG)\n: UN1017\n: UN1017\n: 1017\n: Forbidden\n: Chlorine\n: CHLORINE\n: Not applicable\n: Not applicable\n: 2.3 (5.1, 8)\n: 2.3, 5.1, 8\n: 2.3 (5.1, 8)\n: 2.3, 5.1, 8\n: 2","REVISED_CONTENT":"Product ID:HZ-CHL,Product Description:Chlorine,Storage Location:0001,Storage Location Description:Lager 0001,Plant:0001,Section Id:14,Section Header:Transport information,Section Content:In accordance with DOT/TDG/IMDG / IATA\n14.1. UN number\nDOT NA No\nUN-No. (TDG)\nUN-No. (IMDG)\nUN-No. (IATA)\n14.2. UN proper shipping name\nProper Shipping Name (DOT)\nProper Shipping Name\nProper Shipping Name (IMDG)\nProper Shipping Name (IATA)\n14.3. Transport hazard class(es)\nDOT\nTransport hazard class(es) (DOT)\nHazard labels (DOT)\nTDG\nTransport hazard class(es) (TDG)\nHazard labels (TDG)\nIMDG\nTransport hazard class(es) (IMDG)\n: UN1017\n: UN1017\n: 1017\n: Forbidden\n: Chlorine\n: CHLORINE\n: Not applicable\n: Not applicable\n: 2.3 (5.1, 8)\n: 2.3, 5.1, 8\n: 2.3 (5.1, 8)\n: 2.3, 5.1, 8\n: 2"}