{"GUID":"AkKsEQACHt+fl92lrOnowg==","MATNR":"HZ-SAC","MAKTX":"Sulfuric acid","WERKS":"0001","LGORT":"0003","LGOBE":"Corrosive Items","SECTION_ID":10,"SECTION_HEADER":"Stability and reactivity","SECTION_CONTENT":"Reactive Hazard Yes Stability Water reactive. Hygroscopic. Conditions to Avoid Incompatible products. Excess heat. Exposure to moist air or water. Incompatible Materials Strong oxidizing agents, Combustible material, Bases, Organic materials, Reducing agents, Powdered metals, Peroxides Hazardous Decomposition Products Hydrogen, Sulfur oxides Hazardous Polymerization Hazardous polymerization does not occur. Hazardous Reactions Contact with metals may evolve flammable hydrogen gas. Reacts violently with water. Acute Toxicity","REVISED_CONTENT":"Product ID:HZ-SAC,Product Description:Sulfuric acid,Storage Location:0003,Storage Location Description:Corrosive Items,Plant:0001,Section Id:10,Section Header:Stability and reactivity,Section Content:Reactive Hazard Yes Stability Water reactive. Hygroscopic. Conditions to Avoid Incompatible products. Excess heat. Exposure to moist air or water. Incompatible Materials Strong oxidizing agents, Combustible material, Bases, Organic materials, Reducing agents, Powdered metals, Peroxides Hazardous Decomposition Products Hydrogen, Sulfur oxides Hazardous Polymerization Hazardous polymerization does not occur. Hazardous Reactions Contact with metals may evolve flammable hydrogen gas. Reacts violently with water. Acute Toxicity"}