{"GUID":"AkKsEQACHt+fl92lptCowg==","MATNR":"HZ-HYP","MAKTX":"Hydrogen Peroxide 3%","WERKS":"0001","LGORT":"0002","LGOBE":"Cold Storage","SECTION_ID":16,"SECTION_HEADER":"Other information","SECTION_CONTENT":"Regulatory Affairs\nThermo Fisher Scientific\nEmail: EMSDS.RA@thermofisher.com\nCreation Date\n09-Jun-2009\nRevision Date\n10-Apr-2014\nPrint Date\n10-Apr-2014\nRevision Summary\nThis document has been updated to comply with the US OSHA HazCom 2012 Standard\nreplacing the current legislation under 29 CFR 1910.1200 to align with the Globally\nHarmonized System of Classification and Labeling of Chemicals (GHS)\nDisclaimer\nThe information provided on this Safety Data Sheet is correct to the best of our knowledge, information and belief at the\ndate of its publication. The information given is designed only as a guide for safe handling, use, processing, storage,\ntransportation, disposal and release and is not to be considered as a warranty or quality specification. The information\nrelates only to the specific material designated and may not be valid for such material used in combination with any other\nmaterial or in any process, unless specified in the text.","REVISED_CONTENT":"Product ID:HZ-HYP,Product Description:Hydrogen Peroxide 3%,Storage Location:0002,Storage Location Description:Cold Storage,Plant:0001,Section Id:16,Section Header:Other information,Section Content:Regulatory Affairs\nThermo Fisher Scientific\nEmail: EMSDS.RA@thermofisher.com\nCreation Date\n09-Jun-2009\nRevision Date\n10-Apr-2014\nPrint Date\n10-Apr-2014\nRevision Summary\nThis document has been updated to comply with the US OSHA HazCom 2012 Standard\nreplacing the current legislation under 29 CFR 1910.1200 to align with the Globally\nHarmonized System of Classification and Labeling of Chemicals (GHS)\nDisclaimer\nThe information provided on this Safety Data Sheet is correct to the best of our knowledge, information and belief at the\ndate of its publication. The information given is designed only as a guide for safe handling, use, processing, storage,\ntransportation, disposal and release and is not to be considered as a warranty or quality specification. The information\nrelates only to the specific material designated and may not be valid for such material used in combination with any other\nmaterial or in any process, unless specified in the text."}