{"GUID":"AkKsEQACHt+fl92lptoowg==","MATNR":"HZ-MAL","MAKTX":"Malathion","WERKS":"0001","LGORT":"0088","LGOBE":"Lager 0088 (WM)","SECTION_ID":12,"SECTION_HEADER":"Ecological information","SECTION_CONTENT":"12.1 Toxicity\nToxicity to fish\nToxicity to daphnia\nLC50 - Fish - 0.252 mg/l 96 h\nEC50 - Daphnia magna (Water flea) - 0.002 mg/l 48 h\nand other aquatic\ninvertebrates\nToxicity to algae\nToxicity to\nRemarks: (ECOTOX Database)\nEC50 - Pseudokirchneriella subcapitata (green algae) - 4.06 mg/l\n72 h\n(OECD Test Guideline 201)\nNOEC - Ptychocheilus lucius - 1.68 mg/l 32 d\nfish(Chronic toxicity) Remarks: (ECOTOX Database)\n12.2 Persistence and degradability\nNo data available\n12.3 Bioaccumulative potential\nBioaccumulation\n12.4 Mobility in soil\nNo data available\nOryzias latipes - 168 h\n12.8 µg/l(Malathion)\nBioconcentration factor (BCF): 12\nRemarks: Can accumulate in aquatic organisms.","REVISED_CONTENT":"Product ID:HZ-MAL,Product Description:Malathion,Storage Location:0088,Storage Location Description:Lager 0088 (WM),Plant:0001,Section Id:12,Section Header:Ecological information,Section Content:12.1 Toxicity\nToxicity to fish\nToxicity to daphnia\nLC50 - Fish - 0.252 mg/l 96 h\nEC50 - Daphnia magna (Water flea) - 0.002 mg/l 48 h\nand other aquatic\ninvertebrates\nToxicity to algae\nToxicity to\nRemarks: (ECOTOX Database)\nEC50 - Pseudokirchneriella subcapitata (green algae) - 4.06 mg/l\n72 h\n(OECD Test Guideline 201)\nNOEC - Ptychocheilus lucius - 1.68 mg/l 32 d\nfish(Chronic toxicity) Remarks: (ECOTOX Database)\n12.2 Persistence and degradability\nNo data available\n12.3 Bioaccumulative potential\nBioaccumulation\n12.4 Mobility in soil\nNo data available\nOryzias latipes - 168 h\n12.8 µg/l(Malathion)\nBioconcentration factor (BCF): 12\nRemarks: Can accumulate in aquatic organisms."}