{"GUID":"AkKsEQACHt+fl92lpuCowg==","MATNR":"HZ-MET","MAKTX":"Methane","WERKS":"0001","LGORT":"0001","LGOBE":"Lager 0001","SECTION_ID":16,"SECTION_HEADER":"Other information","SECTION_CONTENT":"References : Not available.\nNotice to reader\nTo the best of our knowledge, the information contained herein is accurate. However, neither the above-named\nsupplier, nor any of its subsidiaries, assumes any liability whatsoever for the accuracy or completeness of the\ninformation contained herein.\nFinal determination of suitability of any material is the sole responsibility of the user. All materials may present\nunknown hazards and should be used with caution. Although certain hazards are described herein, we cannot\nguarantee that these are the only hazards that exist.","REVISED_CONTENT":"Product ID:HZ-MET,Product Description:Methane,Storage Location:0001,Storage Location Description:Lager 0001,Plant:0001,Section Id:16,Section Header:Other information,Section Content:References : Not available.\nNotice to reader\nTo the best of our knowledge, the information contained herein is accurate. However, neither the above-named\nsupplier, nor any of its subsidiaries, assumes any liability whatsoever for the accuracy or completeness of the\ninformation contained herein.\nFinal determination of suitability of any material is the sole responsibility of the user. All materials may present\nunknown hazards and should be used with caution. Although certain hazards are described herein, we cannot\nguarantee that these are the only hazards that exist."}