{"GUID":"AkKsEQACHt+fl92lrPTIwg==","MATNR":"HZ-TNT","MAKTX":"TNT","WERKS":"0001","LGORT":"0002","LGOBE":"Cold Storage","SECTION_ID":1,"SECTION_HEADER":"Identification","SECTION_CONTENT":"• Product identifier\n• Product Name: TNT\n• Part Number: S-3501\n• Application of the substance / the mixture Certified Reference Material\n• Details of the supplier of the safety data sheet\n• Manufacturer/Supplier:\nSPEX CertiPrep, LLC.\n203 Norcross Ave, Metuchen,\nNJ 08840 USA\n• Information department: product safety department\n• Emergency telephone number:\nEmergency Phone Number (24 hours)\nCHEMTREC (800-424-9300)\nOutside US: 703-527-3887","REVISED_CONTENT":"Product ID:HZ-TNT,Product Description:TNT,Storage Location:0002,Storage Location Description:Cold Storage,Plant:0001,Section Id:1,Section Header:Identification,Section Content:• Product identifier\n• Product Name: TNT\n• Part Number: S-3501\n• Application of the substance / the mixture Certified Reference Material\n• Details of the supplier of the safety data sheet\n• Manufacturer/Supplier:\nSPEX CertiPrep, LLC.\n203 Norcross Ave, Metuchen,\nNJ 08840 USA\n• Information department: product safety department\n• Emergency telephone number:\nEmergency Phone Number (24 hours)\nCHEMTREC (800-424-9300)\nOutside US: 703-527-3887"}