{"GUID":"AkKsEQACHt+fl92lrPSowg==","MATNR":"HZ-SUL","MAKTX":"Sulfur","WERKS":"0001","LGORT":"0001","LGOBE":"Lager 0001","SECTION_ID":16,"SECTION_HEADER":"Other information","SECTION_CONTENT":"16.1. Other Information, Including Date of Preparation or Last Revision\nDate of Preparation or Latest\nRevision\nOther Information\n: 10/23/2018\n: This document has been prepared in accordance with the SDS requirements of the OSHA\nHazard Communication Standard 29 CFR 1910.1200 and Canada's Hazardous Products\nRegulations (HPR) SOR/2015-17.\nGHS Full Text Phrases:\nAcute Tox. 2 (Inhalation:gas)\nAquatic Acute 1\nAquatic Acute 2\nAquatic Acute 3\nComb. Dust\nEye Irrit. 2A\nFlam. Gas 1\nFlam. Sol. 2\nPress. Gas (Liq.)\nSkin Irrit. 2\nSTOT SE 3\nH220\nH228\nH280\nH315\nH319\nH330\nH335\nH400\nH401\nH402\nNFPA Health Hazard\nNFPA Fire Hazard\nNFPA Reactivity Hazard\n: Acute toxicity (inhalation:gas) Category 2\nHazardous to the aquatic environment - Acute Hazard Category 1\nHazardous to the aquatic environment - Acute Hazard Category 2\nHazardous to the aquatic environment - Acute Hazard Category 3\nCombustible Dust\nSerious eye damage/eye irritation Category 2A\nFlammable gases Category 1\nFlammable solids Category 2\nGases under pressure Liquefied gas\nSkin corrosion/irritation Category 2\nSpecific target organ toxicity (single exposure) Category 3\nExtremely flammable gas\nFlammable solid\nContains gas under pressure; may explode if heated\nCauses skin irritation\nCauses serious eye irritation\nFatal if inhaled\nMay cause respiratory irritation\nVery toxic to aquatic life\nToxic to aquatic life\nHarmful to aquatic life\n2 - Materials that, under emergency conditions, can cause\ntemporary incapacitation or residual injury.\n1 - Materials that must be preheated before ignition can\noccur.\n0 - Material that in themselves are normally stable, even\nunder fire conditions.\n1\n2\n0\nThis information is based on our current knowledge and is intended to describe the product for the purposes of health, safety and\nenvironmental requirements only. It should not therefore be construed as guaranteeing any specific property of the product.","REVISED_CONTENT":"Product ID:HZ-SUL,Product Description:Sulfur,Storage Location:0001,Storage Location Description:Lager 0001,Plant:0001,Section Id:16,Section Header:Other information,Section Content:16.1. Other Information, Including Date of Preparation or Last Revision\nDate of Preparation or Latest\nRevision\nOther Information\n: 10/23/2018\n: This document has been prepared in accordance with the SDS requirements of the OSHA\nHazard Communication Standard 29 CFR 1910.1200 and Canada's Hazardous Products\nRegulations (HPR) SOR/2015-17.\nGHS Full Text Phrases:\nAcute Tox. 2 (Inhalation:gas)\nAquatic Acute 1\nAquatic Acute 2\nAquatic Acute 3\nComb. Dust\nEye Irrit. 2A\nFlam. Gas 1\nFlam. Sol. 2\nPress. Gas (Liq.)\nSkin Irrit. 2\nSTOT SE 3\nH220\nH228\nH280\nH315\nH319\nH330\nH335\nH400\nH401\nH402\nNFPA Health Hazard\nNFPA Fire Hazard\nNFPA Reactivity Hazard\n: Acute toxicity (inhalation:gas) Category 2\nHazardous to the aquatic environment - Acute Hazard Category 1\nHazardous to the aquatic environment - Acute Hazard Category 2\nHazardous to the aquatic environment - Acute Hazard Category 3\nCombustible Dust\nSerious eye damage/eye irritation Category 2A\nFlammable gases Category 1\nFlammable solids Category 2\nGases under pressure Liquefied gas\nSkin corrosion/irritation Category 2\nSpecific target organ toxicity (single exposure) Category 3\nExtremely flammable gas\nFlammable solid\nContains gas under pressure; may explode if heated\nCauses skin irritation\nCauses serious eye irritation\nFatal if inhaled\nMay cause respiratory irritation\nVery toxic to aquatic life\nToxic to aquatic life\nHarmful to aquatic life\n2 - Materials that, under emergency conditions, can cause\ntemporary incapacitation or residual injury.\n1 - Materials that must be preheated before ignition can\noccur.\n0 - Material that in themselves are normally stable, even\nunder fire conditions.\n1\n2\n0\nThis information is based on our current knowledge and is intended to describe the product for the purposes of health, safety and\nenvironmental requirements only. It should not therefore be construed as guaranteeing any specific property of the product."}