{"GUID":"AkKsEQACHt+fl92lrPoowg==","MATNR":"HZ-TOL","MAKTX":"Toluene","WERKS":"0001","LGORT":"0001","LGOBE":"Lager 0001","SECTION_ID":12,"SECTION_HEADER":"Ecological information","SECTION_CONTENT":"The product contains following substances which are hazardous for the environment. Contains a substance which is:. Toxic to\naquatic organisms.\nComponent\nToluene\nFreshwater Algae\nEC50: = 12.5 mg/L, 72h\nstatic (Pseudokirchneriella\nsubcapitata)\nEC50: > 433 mg/L, 96h\n(Pseudokirchneriella\nsubcapitata)\nPersistence is unlikely\nFreshwater Fish\n50-70 mg/L LC50 96 h\n5-7 mg/L LC50 96 h\n15-19 mg/L LC50 96 h\n28 mg/L LC50 96 h\n12 mg/L LC50 96 h\nMicrotox\nEC50 = 19.7 mg/L 30 min\nWater Flea\nEC50: = 11.5 mg/L, 48h\n(Daphnia magna)\nEC50: 5.46- 9.83 mg/L, 48h\nStatic (Daphnia magna)\nPersistence and Degradability\nBioaccumulation/ Accumulation\nMobility\nNo information available.\nIs not likely mobile in the environment due its low water solubility.","REVISED_CONTENT":"Product ID:HZ-TOL,Product Description:Toluene,Storage Location:0001,Storage Location Description:Lager 0001,Plant:0001,Section Id:12,Section Header:Ecological information,Section Content:The product contains following substances which are hazardous for the environment. Contains a substance which is:. Toxic to\naquatic organisms.\nComponent\nToluene\nFreshwater Algae\nEC50: = 12.5 mg/L, 72h\nstatic (Pseudokirchneriella\nsubcapitata)\nEC50: > 433 mg/L, 96h\n(Pseudokirchneriella\nsubcapitata)\nPersistence is unlikely\nFreshwater Fish\n50-70 mg/L LC50 96 h\n5-7 mg/L LC50 96 h\n15-19 mg/L LC50 96 h\n28 mg/L LC50 96 h\n12 mg/L LC50 96 h\nMicrotox\nEC50 = 19.7 mg/L 30 min\nWater Flea\nEC50: = 11.5 mg/L, 48h\n(Daphnia magna)\nEC50: 5.46- 9.83 mg/L, 48h\nStatic (Daphnia magna)\nPersistence and Degradability\nBioaccumulation/ Accumulation\nMobility\nNo information available.\nIs not likely mobile in the environment due its low water solubility."}