{"GUID":"AkKsEQACHt+fl92lo1wowg==","MATNR":"HZ-DYN","MAKTX":"Dynamite Gray","WERKS":"0001","LGORT":"0004","LGOBE":"Explosives","SECTION_ID":8,"SECTION_HEADER":"Exposure controls / personal protection","SECTION_CONTENT":"Control parameters\nOccupational exposure limits\nIngredient name\nTitanium dioxide\nAppropriate engineering controls\nEnvironmental exposure controls\n:\nExposure limits\nOSHA PEL 1989 (1989-03-01)\nPEL: Permissible Exposure Level 10 mg/m3 Form: Total dust\nOSHA PEL (1993-06-30)\nPEL: Permissible Exposure Level 15 mg/m3 Form: Total dust\nNIOSH REL (1994-06-01)\nACGIH TLV (1996-05-18)\nTLV-TWA: Threshold Limit Value - Time weighted average PEL:\nPermissible Exposure Level 10 mg/m3\nGood general ventilation should be sufficient to control worker\nexposure to airborne contaminants.\nEmissions from ventilation or work process equipment should be\nchecked to ensure they comply with the requirements of","REVISED_CONTENT":"Product ID:HZ-DYN,Product Description:Dynamite Gray,Storage Location:0004,Storage Location Description:Explosives,Plant:0001,Section Id:8,Section Header:Exposure controls / personal protection,Section Content:Control parameters\nOccupational exposure limits\nIngredient name\nTitanium dioxide\nAppropriate engineering controls\nEnvironmental exposure controls\n:\nExposure limits\nOSHA PEL 1989 (1989-03-01)\nPEL: Permissible Exposure Level 10 mg/m3 Form: Total dust\nOSHA PEL (1993-06-30)\nPEL: Permissible Exposure Level 15 mg/m3 Form: Total dust\nNIOSH REL (1994-06-01)\nACGIH TLV (1996-05-18)\nTLV-TWA: Threshold Limit Value - Time weighted average PEL:\nPermissible Exposure Level 10 mg/m3\nGood general ventilation should be sufficient to control worker\nexposure to airborne contaminants.\nEmissions from ventilation or work process equipment should be\nchecked to ensure they comply with the requirements of"}