{"GUID":"AkKsEQACHt+fl92lrPVIwg==","MATNR":"HZ-TNT","MAKTX":"TNT","WERKS":"0001","LGORT":"0002","LGOBE":"Cold Storage","SECTION_ID":5,"SECTION_HEADER":"Fire-fighting measures","SECTION_CONTENT":"• Extinguishing media\n• Suitable extinguishing agents: CO2, extinguishing powder or water spray. Fight larger fires with water spray or alcohol resistant foam.\n• For safety reasons unsuitable extinguishing agents: Water with full jet\nSpecial hazards arising from the substance or mixture During heating or in case of fire poisonous gases are produced.\n• Advice for firefighters\n• Protective equipment: Mouth respiratory protective device.","REVISED_CONTENT":"Product ID:HZ-TNT,Product Description:TNT,Storage Location:0002,Storage Location Description:Cold Storage,Plant:0001,Section Id:5,Section Header:Fire-fighting measures,Section Content:• Extinguishing media\n• Suitable extinguishing agents: CO2, extinguishing powder or water spray. Fight larger fires with water spray or alcohol resistant foam.\n• For safety reasons unsuitable extinguishing agents: Water with full jet\nSpecial hazards arising from the substance or mixture During heating or in case of fire poisonous gases are produced.\n• Advice for firefighters\n• Protective equipment: Mouth respiratory protective device."}