{"GUID":"AkKsEQACHt+fl92lptMowg==","MATNR":"HZ-LEA","MAKTX":"Lead","WERKS":"0001","LGORT":"0088","LGOBE":"Lager 0088 (WM)","SECTION_ID":4,"SECTION_HEADER":"First-aid measures","SECTION_CONTENT":"Eye Contact\nSkin Contact\nInhalation\nIngestion\nMost important symptoms/effects\nNotes to Physician\nImmediate medical attention is required. Rinse immediately with plenty of water, also under\nthe eyelids, for at least 15 minutes.\nWash off immediately with soap and plenty of water while removing all contaminated\nclothes and shoes. Immediate medical attention is required.\nRemove from exposure, lie down. Move to fresh air. If breathing is difficult, give oxygen. If\nnot breathing, give artificial respiration. Immediate medical attention is required.\nCall a physician immediately. Clean mouth with water.\nNo information available.\nTreat symptomatically","REVISED_CONTENT":"Product ID:HZ-LEA,Product Description:Lead,Storage Location:0088,Storage Location Description:Lager 0088 (WM),Plant:0001,Section Id:4,Section Header:First-aid measures,Section Content:Eye Contact\nSkin Contact\nInhalation\nIngestion\nMost important symptoms/effects\nNotes to Physician\nImmediate medical attention is required. Rinse immediately with plenty of water, also under\nthe eyelids, for at least 15 minutes.\nWash off immediately with soap and plenty of water while removing all contaminated\nclothes and shoes. Immediate medical attention is required.\nRemove from exposure, lie down. Move to fresh air. If breathing is difficult, give oxygen. If\nnot breathing, give artificial respiration. Immediate medical attention is required.\nCall a physician immediately. Clean mouth with water.\nNo information available.\nTreat symptomatically"}