{"GUID":"AkKsEQACHt+fl92lpt/Iwg==","MATNR":"HZ-MET","MAKTX":"Methane","WERKS":"0001","LGORT":"0001","LGOBE":"Lager 0001","SECTION_ID":9,"SECTION_HEADER":"Physical and chemical properties","SECTION_CONTENT":"Appearance\nPhysical state : Gas. [Compressed gas.]\nColor : Colorless.\nOdor : Odorless.\nOdor threshold : Not available.\npH : Not available.\nMelting point : -187.6°C (-305.7°F)\nBoiling point : -161.48°C (-258.7°F)\nCritical temperature : -82.45°C (-116.4°F)\nFlash point : Closed cup: -104°C (-155.2°F)\nEvaporation rate : Not available.\nFlammability (solid, gas) : Extremely flammable in the presence of the following materials or conditions: open\nflames, sparks and static discharge and oxidizing materials.\nLower and upper explosive\n(flammable) limits : Lower: 5%\nUpper: 14%\nVapor pressure : Not available.\nVapor density : 0.6 (Air = 1)\nSpecific Volume (ft 3/lb) : 23.6407\nGas Density (lb/ft³) : 0.0423 (25°C / 77 to °F)\nRelative density : Not applicable.\nSolubility : Not available.\nSolubility in water : 0.02 g/l\nPartition coefficient: n-\noctanol/water : 1.09\nAuto-ignition temperature : 537°C (998.6°F)\nDecomposition temperature: Not available.\nViscosity : Not applicable.\nFlow time (ISO 2431) : Not available.\nMolecular weight : 16.05 g/mole\nAerosol product : Not available.\nHeat of combustion : -50048542 J/kg","REVISED_CONTENT":"Product ID:HZ-MET,Product Description:Methane,Storage Location:0001,Storage Location Description:Lager 0001,Plant:0001,Section Id:9,Section Header:Physical and chemical properties,Section Content:Appearance\nPhysical state : Gas. [Compressed gas.]\nColor : Colorless.\nOdor : Odorless.\nOdor threshold : Not available.\npH : Not available.\nMelting point : -187.6°C (-305.7°F)\nBoiling point : -161.48°C (-258.7°F)\nCritical temperature : -82.45°C (-116.4°F)\nFlash point : Closed cup: -104°C (-155.2°F)\nEvaporation rate : Not available.\nFlammability (solid, gas) : Extremely flammable in the presence of the following materials or conditions: open\nflames, sparks and static discharge and oxidizing materials.\nLower and upper explosive\n(flammable) limits : Lower: 5%\nUpper: 14%\nVapor pressure : Not available.\nVapor density : 0.6 (Air = 1)\nSpecific Volume (ft 3/lb) : 23.6407\nGas Density (lb/ft³) : 0.0423 (25°C / 77 to °F)\nRelative density : Not applicable.\nSolubility : Not available.\nSolubility in water : 0.02 g/l\nPartition coefficient: n-\noctanol/water : 1.09\nAuto-ignition temperature : 537°C (998.6°F)\nDecomposition temperature: Not available.\nViscosity : Not applicable.\nFlow time (ISO 2431) : Not available.\nMolecular weight : 16.05 g/mole\nAerosol product : Not available.\nHeat of combustion : -50048542 J/kg"}