{"GUID":"AkKsEQACHt+fl92lo1nowg==","MATNR":"HZ-CMO","MAKTX":"Carbon monoxide","WERKS":"0001","LGORT":"0001","LGOBE":"Lager 0001","SECTION_ID":6,"SECTION_HEADER":"Accidental release measures","SECTION_CONTENT":"Personal precautions, protective equipment and emergency procedures\nGeneral measures\nFor non-emergency personnel\nProtective equipment\nEmergency procedures\nFor emergency responders\nProtective equipment\nEmergency procedures\nEnvironmental precautions\nMethods and material for containment and cleaning up\nFor containment\nMethods for cleaning up\nMethods and material for containment and\ncleaning up\nReference to other sections\n: Ensure adequate ventilation.\n: Wear protective equipment consistent with the site emergency plan.\n: Evacuate personnel to a safe area. Close doors and windows of adjacent premises. Keep\ncontainers closed. Mark the danger area. Seal off low-lying areas. Keep upwind.\n: Standard protective clothing and equipment (e.g, Self Contained Breathing Apparatus) for fire\nfighters. Equip cleanup crew with proper protection.\n: Evacuate and limit access. Ventilate area. Remove ignition sources. Monitor concentration of\nreleased product. Consider the risk of potentially explosive atmospheres. Wear self-contained\nbreathing apparatus when entering atmospheres of unknown contaminant concentration until\nproven to be safe.\n: Try to stop release if without risk.\n: Try to stop release if without risk.\n: Dispose of contents/container in accordance with local/regional/national/international\nregulations.\n: Ventilate area.\n: See also Sections 8 and 13.","REVISED_CONTENT":"Product ID:HZ-CMO,Product Description:Carbon monoxide,Storage Location:0001,Storage Location Description:Lager 0001,Plant:0001,Section Id:6,Section Header:Accidental release measures,Section Content:Personal precautions, protective equipment and emergency procedures\nGeneral measures\nFor non-emergency personnel\nProtective equipment\nEmergency procedures\nFor emergency responders\nProtective equipment\nEmergency procedures\nEnvironmental precautions\nMethods and material for containment and cleaning up\nFor containment\nMethods for cleaning up\nMethods and material for containment and\ncleaning up\nReference to other sections\n: Ensure adequate ventilation.\n: Wear protective equipment consistent with the site emergency plan.\n: Evacuate personnel to a safe area. Close doors and windows of adjacent premises. Keep\ncontainers closed. Mark the danger area. Seal off low-lying areas. Keep upwind.\n: Standard protective clothing and equipment (e.g, Self Contained Breathing Apparatus) for fire\nfighters. Equip cleanup crew with proper protection.\n: Evacuate and limit access. Ventilate area. Remove ignition sources. Monitor concentration of\nreleased product. Consider the risk of potentially explosive atmospheres. Wear self-contained\nbreathing apparatus when entering atmospheres of unknown contaminant concentration until\nproven to be safe.\n: Try to stop release if without risk.\n: Try to stop release if without risk.\n: Dispose of contents/container in accordance with local/regional/national/international\nregulations.\n: Ventilate area.\n: See also Sections 8 and 13."}