{"GUID":"AkKsEQACHt+fl92lo1tIwg==","MATNR":"HZ-DYN","MAKTX":"Dynamite Gray","WERKS":"0001","LGORT":"0004","LGOBE":"Explosives","SECTION_ID":1,"SECTION_HEADER":"Identification","SECTION_CONTENT":"GHS product identifier\n:\nDYNAMITE GRAY\nChemical name\n:\nMixture\nCAS number\n:\nMixture\nOther means of identification\n:\nCC10227370\nProduct type\n:\nsolid\nRelevant identified uses of the substance or mixture and uses advised against\nProduct use\n:\nIndustrial applications. Plastics.\nSupplier's details\n:\nPOLYONE CORPORATION\n33587 Walker Road, Avon Lake, OH 44012\n1 (440) 930-1000 or 1 (866) POLYONE\nEmergency telephone number\n(with hours of operation)\n:\nCHEMTREC 1-800-424-9300 (24hrs for spill, leak, fire, exposure\nor accident).CHEMTREC 1-800-424-9300 (24hrs for spill, leak, fire,\nexposure or accident).","REVISED_CONTENT":"Product ID:HZ-DYN,Product Description:Dynamite Gray,Storage Location:0004,Storage Location Description:Explosives,Plant:0001,Section Id:1,Section Header:Identification,Section Content:GHS product identifier\n:\nDYNAMITE GRAY\nChemical name\n:\nMixture\nCAS number\n:\nMixture\nOther means of identification\n:\nCC10227370\nProduct type\n:\nsolid\nRelevant identified uses of the substance or mixture and uses advised against\nProduct use\n:\nIndustrial applications. Plastics.\nSupplier's details\n:\nPOLYONE CORPORATION\n33587 Walker Road, Avon Lake, OH 44012\n1 (440) 930-1000 or 1 (866) POLYONE\nEmergency telephone number\n(with hours of operation)\n:\nCHEMTREC 1-800-424-9300 (24hrs for spill, leak, fire, exposure\nor accident).CHEMTREC 1-800-424-9300 (24hrs for spill, leak, fire,\nexposure or accident)."}