{"GUID":"AkKsEQACHt+fl92lo11Iwg==","MATNR":"HZ-ETH","MAKTX":"Ethanol","WERKS":"0001","LGORT":"0001","LGOBE":"Lager 0001","SECTION_ID":1,"SECTION_HEADER":"Identification","SECTION_CONTENT":"• Product identifier\n• Trade name: Ethanol\nPart number: N-2431, N-2431-100MG\nCAS Number:\n64-17-5\n• EC number:\n200-578-6\n• Index number:\n603-002-00-5\n· Application of the substance / the mixture Reagents and Standards for Analytical Chemical Laboratory Use\n• Details of the supplier of the safety data sheet\nManufacturer/Supplier:\nAgilent Technologies, Inc.\n5301 Stevens Creek Blvd.\nSanta Clara, CA 95051 USA\n• Information department:\nTelephone: 800-227-9770\ne-mail: pdl-msds_author@agilent.com\nEmergency telephone number: CHEMTREC®: 1-800-424-9300","REVISED_CONTENT":"Product ID:HZ-ETH,Product Description:Ethanol,Storage Location:0001,Storage Location Description:Lager 0001,Plant:0001,Section Id:1,Section Header:Identification,Section Content:• Product identifier\n• Trade name: Ethanol\nPart number: N-2431, N-2431-100MG\nCAS Number:\n64-17-5\n• EC number:\n200-578-6\n• Index number:\n603-002-00-5\n· Application of the substance / the mixture Reagents and Standards for Analytical Chemical Laboratory Use\n• Details of the supplier of the safety data sheet\nManufacturer/Supplier:\nAgilent Technologies, Inc.\n5301 Stevens Creek Blvd.\nSanta Clara, CA 95051 USA\n• Information department:\nTelephone: 800-227-9770\ne-mail: pdl-msds_author@agilent.com\nEmergency telephone number: CHEMTREC®: 1-800-424-9300"}