{"GUID":"AkKsEQACHt+fl92lrP4owg==","MATNR":"HZ-URA","MAKTX":"URANIUM - WP","WERKS":"0001","LGORT":"0002","LGOBE":"Cold Storage","SECTION_ID":12,"SECTION_HEADER":"Ecological information","SECTION_CONTENT":"SECTION 12: Ecological information\n12.1 Toxicity\nMixture\nNo data available\n12.2 Persistence and degradability\nNo data available\n12.3 Bioaccumulative potential\nNo data available\n12.4 Mobility in soil\nNo data available\n12.5 Results of PBT and vPvB assessment\nPBT/vPvB assessment not available as chemical safety assessment not required/not\nconducted\n12.6 Endocrine disrupting properties\nNo data available\n12.7 Other adverse effects\nNo data available\nComponents\nnitric acid\nNo data available","REVISED_CONTENT":"Product ID:HZ-URA,Product Description:URANIUM - WP,Storage Location:0002,Storage Location Description:Cold Storage,Plant:0001,Section Id:12,Section Header:Ecological information,Section Content:SECTION 12: Ecological information\n12.1 Toxicity\nMixture\nNo data available\n12.2 Persistence and degradability\nNo data available\n12.3 Bioaccumulative potential\nNo data available\n12.4 Mobility in soil\nNo data available\n12.5 Results of PBT and vPvB assessment\nPBT/vPvB assessment not available as chemical safety assessment not required/not\nconducted\n12.6 Endocrine disrupting properties\nNo data available\n12.7 Other adverse effects\nNo data available\nComponents\nnitric acid\nNo data available"}