{"GUID":"AkKsEQACHt+fl92lpuWIwg==","MATNR":"HZ-OXY","MAKTX":"Oxygen","WERKS":"0001","LGORT":"0001","LGOBE":"Lager 0001","SECTION_ID":7,"SECTION_HEADER":"Handling and storage","SECTION_CONTENT":"Protective measures : Put on appropriate personal protective equipment (see Section 8). Contains gas under\npressure. Avoid breathing gas. Do not puncture or incinerate container. Use\nequipment rated for cylinder pressure. Close valve after each use and when empty.\nProtect cylinders from physical damage; do not drag, roll, slide, or drop. Use a suitable\nhand truck for cylinder movement.\nAdvice on general\noccupational hygiene : Avoid contact with eyes, skin and clothing. Empty containers retain product residue\nand can be hazardous. Keep away from clothing, incompatible materials and\ncombustible materials. Keep reduction valves free from grease and oil.\nEating, drinking and smoking should be prohibited in areas where this material is\nhandled, stored and processed. Workers should wash hands and face before eating,\ndrinking and smoking. Remove contaminated clothing and protective equipment before\nentering eating areas. See also Section 8 for additional information on hygiene\nmeasures.\nConditions for safe storage, : Store in accordance with local regulations. Store in a segregated and approved area.\nStore away from direct sunlight in a dry, cool and well-ventilated area, away from\nincompatible materials (see Section 10). Cylinders should be stored upright, with valve\nprotection cap in place, and firmly secured to prevent falling or being knocked over.\nCylinder temperatures should not exceed 52 째C (125 째F). Separate from reducing\nagents and combustible materials. Store away from grease and oil. Keep container\ntightly closed and sealed until ready for use. See Section 10 for incompatible materials\nbefore handling or use.","REVISED_CONTENT":"Product ID:HZ-OXY,Product Description:Oxygen,Storage Location:0001,Storage Location Description:Lager 0001,Plant:0001,Section Id:7,Section Header:Handling and storage,Section Content:Protective measures : Put on appropriate personal protective equipment (see Section 8). Contains gas under\npressure. Avoid breathing gas. Do not puncture or incinerate container. Use\nequipment rated for cylinder pressure. Close valve after each use and when empty.\nProtect cylinders from physical damage; do not drag, roll, slide, or drop. Use a suitable\nhand truck for cylinder movement.\nAdvice on general\noccupational hygiene : Avoid contact with eyes, skin and clothing. Empty containers retain product residue\nand can be hazardous. Keep away from clothing, incompatible materials and\ncombustible materials. Keep reduction valves free from grease and oil.\nEating, drinking and smoking should be prohibited in areas where this material is\nhandled, stored and processed. Workers should wash hands and face before eating,\ndrinking and smoking. Remove contaminated clothing and protective equipment before\nentering eating areas. See also Section 8 for additional information on hygiene\nmeasures.\nConditions for safe storage, : Store in accordance with local regulations. Store in a segregated and approved area.\nStore away from direct sunlight in a dry, cool and well-ventilated area, away from\nincompatible materials (see Section 10). Cylinders should be stored upright, with valve\nprotection cap in place, and firmly secured to prevent falling or being knocked over.\nCylinder temperatures should not exceed 52 째C (125 째F). Separate from reducing\nagents and combustible materials. Store away from grease and oil. Keep container\ntightly closed and sealed until ready for use. See Section 10 for incompatible materials\nbefore handling or use."}