{"GUID":"AkKsEQACHt+fl92lps5owg==","MATNR":"HZ-HEL","MAKTX":"Helium","WERKS":"0001","LGORT":"0001","LGOBE":"Lager 0001","SECTION_ID":14,"SECTION_HEADER":"Transport information","SECTION_CONTENT":"DOT\nUN number\nUN1046\nUN proper shipping name\nHelium, compressed\nTransport hazard class(es)\nClass\n2.2\nSubsidiary risk\nNot applicable.\nPacking group\nSpecial precautions for user\nRead safety instructions, SDS and emergency procedures before handling.\nPackaging exceptions\nPackaging non bulk\n306, 307\nPackaging bulk\n302\nIATA\nUN number\nUN1046\nUN proper shipping name\nHelium, compressed\nTransport hazard class(es)\nClass\n2.2\nSubsidiary risk\nNot applicable.\nPacking group\nEnvironmental hazards\nERG Code\nNo.\n2L\nSpecial precautions for user\nRead safety instructions, SDS and emergency procedures before handling.\nIMDG\nUN number\nUN1046\nUN proper shipping name\nHELIUM, COMPRESSED\nTransport hazard class(es)\nClass\n2.2\nSubsidiary risk\nNot applicable.\nPacking group\nEnvironmental hazards\nMarine pollutant\nNo.\nEmS\nF-C, S-V\nSpecial precautions for user\nRead safety instructions, SDS and emergency procedures before handling.\nTransport in bulk according to\nAnnex II of MARPOL 73/78 and\nthe IBC Code\nNot applicable.","REVISED_CONTENT":"Product ID:HZ-HEL,Product Description:Helium,Storage Location:0001,Storage Location Description:Lager 0001,Plant:0001,Section Id:14,Section Header:Transport information,Section Content:DOT\nUN number\nUN1046\nUN proper shipping name\nHelium, compressed\nTransport hazard class(es)\nClass\n2.2\nSubsidiary risk\nNot applicable.\nPacking group\nSpecial precautions for user\nRead safety instructions, SDS and emergency procedures before handling.\nPackaging exceptions\nPackaging non bulk\n306, 307\nPackaging bulk\n302\nIATA\nUN number\nUN1046\nUN proper shipping name\nHelium, compressed\nTransport hazard class(es)\nClass\n2.2\nSubsidiary risk\nNot applicable.\nPacking group\nEnvironmental hazards\nERG Code\nNo.\n2L\nSpecial precautions for user\nRead safety instructions, SDS and emergency procedures before handling.\nIMDG\nUN number\nUN1046\nUN proper shipping name\nHELIUM, COMPRESSED\nTransport hazard class(es)\nClass\n2.2\nSubsidiary risk\nNot applicable.\nPacking group\nEnvironmental hazards\nMarine pollutant\nNo.\nEmS\nF-C, S-V\nSpecial precautions for user\nRead safety instructions, SDS and emergency procedures before handling.\nTransport in bulk according to\nAnnex II of MARPOL 73/78 and\nthe IBC Code\nNot applicable."}