{"GUID":"AkKsEQACHt+fl92lpszIwg==","MATNR":"HZ-HEL","MAKTX":"Helium","WERKS":"0001","LGORT":"0001","LGOBE":"Lager 0001","SECTION_ID":1,"SECTION_HEADER":"Identification","SECTION_CONTENT":"Product identifier\nHelium\nOther means of identification\nSDS number\nWC032\nSynonyms\nHELIUM-4\nRecommended use\nNot available.\nRecommended restrictions\nNone known.\nManufacturer / Importer / Supplier / Distributor information\nManufacturer/Supplier\nWorthington Cylinders\nAddress\n200 Old Wilson Bridge Road\nColumbus, OH 43085\nUnited States\nE-mail address:\nSDSRequest@worthingtonindustries.com\nTelephone Number:\n877-324-4091\nCHEMTREC - 24 HOURS:\n(800) 424-9300 (CCN 24850)","REVISED_CONTENT":"Product ID:HZ-HEL,Product Description:Helium,Storage Location:0001,Storage Location Description:Lager 0001,Plant:0001,Section Id:1,Section Header:Identification,Section Content:Product identifier\nHelium\nOther means of identification\nSDS number\nWC032\nSynonyms\nHELIUM-4\nRecommended use\nNot available.\nRecommended restrictions\nNone known.\nManufacturer / Importer / Supplier / Distributor information\nManufacturer/Supplier\nWorthington Cylinders\nAddress\n200 Old Wilson Bridge Road\nColumbus, OH 43085\nUnited States\nE-mail address:\nSDSRequest@worthingtonindustries.com\nTelephone Number:\n877-324-4091\nCHEMTREC - 24 HOURS:\n(800) 424-9300 (CCN 24850)"}