{"GUID":"AkKsEQACHt+fl92lrO0owg==","MATNR":"HZ-SOH","MAKTX":"Sodium hydroxide","WERKS":"0001","LGORT":"0003","LGOBE":"Corrosive Items","SECTION_ID":4,"SECTION_HEADER":"First-aid measures","SECTION_CONTENT":"Immediate medical attention is required. Show this safety data sheet to the doctor in\nattendance.\nRinse immediately with plenty of water, also under the eyelids, for at least 15 minutes.\nImmediate medical attention is required. Keep eye wide open while rinsing.\nWash off immediately with soap and plenty of water while removing all contaminated\nclothes and shoes. Call a physician immediately.\nMove to fresh air. If breathing is difficult, give oxygen. Do not use mouth-to-mouth\nresuscitation if victim ingested or inhaled the substance; induce artificial respiration with a\nrespiratory medical device. Call a physician or Poison Control Center immediately.\nDo not induce vomiting. Immediate medical attention is required. Never give anything by\nmouth to an unconscious person. Drink plenty of water.\nCauses burns by all exposure routes.. Product is a corrosive material. Use of gastric\nlavage or emesis is contraindicated. Possible perforation of stomach or esophagus should\nbe investigated: Ingestion causes severe swelling, severe damage to the delicate tissue\nand danger of perforation","REVISED_CONTENT":"Product ID:HZ-SOH,Product Description:Sodium hydroxide,Storage Location:0003,Storage Location Description:Corrosive Items,Plant:0001,Section Id:4,Section Header:First-aid measures,Section Content:Immediate medical attention is required. Show this safety data sheet to the doctor in\nattendance.\nRinse immediately with plenty of water, also under the eyelids, for at least 15 minutes.\nImmediate medical attention is required. Keep eye wide open while rinsing.\nWash off immediately with soap and plenty of water while removing all contaminated\nclothes and shoes. Call a physician immediately.\nMove to fresh air. If breathing is difficult, give oxygen. Do not use mouth-to-mouth\nresuscitation if victim ingested or inhaled the substance; induce artificial respiration with a\nrespiratory medical device. Call a physician or Poison Control Center immediately.\nDo not induce vomiting. Immediate medical attention is required. Never give anything by\nmouth to an unconscious person. Drink plenty of water.\nCauses burns by all exposure routes.. Product is a corrosive material. Use of gastric\nlavage or emesis is contraindicated. Possible perforation of stomach or esophagus should\nbe investigated: Ingestion causes severe swelling, severe damage to the delicate tissue\nand danger of perforation"}