{"GUID":"AkKsEQACHt+fl92lpuiowg==","MATNR":"HZ-PHO","MAKTX":"Phosphorus","WERKS":"0001","LGORT":"0088","LGOBE":"Lager 0088 (WM)","SECTION_ID":16,"SECTION_HEADER":"Other information","SECTION_CONTENT":"Full text of H-Statements referred to under sections 2 and 3\nH302 - Harmful if swallowed\nH314 - Causes severe skin burns and eye damage\nH318 - Causes serious eye damage\nH411 - Toxic to aquatic life with long lasting effects\nH412 - Harmful to aquatic life with long lasting effects\nH290 - May be corrosive to metals\nLegend\nCAS - Chemical Abstracts Service\nEINECS/ELINCS - European Inventory of Existing Commercial Chemical\nSubstances/EU List of Notified Chemical Substances\nPICCS - Philippines Inventory of Chemicals and Chemical Substances\nIECSC - Chinese Inventory of Existing Chemical Substances\nKECL - Korean Existing and Evaluated Chemical Substances\nWEL - Workplace Exposure Limit\nACGIH - American Conference of Governmental Industrial Hygienists\nDNEL - Derived No Effect Level\nRPE - Respiratory Protective Equipment\nLC50 - Lethal Concentration 50%\nNOEC - No Observed Effect Concentration\nPBT - Persistent, Bioaccumulative, Toxic\nTSCA - United States Toxic Substances Control Act Section 8(b)\nInventory\nDSL/NDSL - Canadian Domestic Substances List/Non-Domestic\nSubstances List\nENCS - Japanese Existing and New Chemical Substances\nAICS - Australian Inventory of Chemical Substances\nNZIoC - New Zealand Inventory of Chemicals\nTWA - Time Weighted Average\nIARC - International Agency for Research on Cancer\nPredicted No Effect Concentration (PNEC)\nLD50 Lethal Dose 50%\nEC50 - Effective Concentration 50%\nPOW - Partition coefficient Octanol:Water\nvPvB - very Persistent, very Bioaccumulative\nADR - European Agreement Concerning the International Carriage of\nDangerous Goods by Road\nIMO/IMDG - International Maritime Organization/International Maritime\nDangerous Goods Code\nOECD - Organisation for Economic Co-operation and Development\nBCF - Bioconcentration factor\nKey literature references and sources for data\nhttps://echa.europa.eu/information-on-chemicals\nSuppliers safety data sheet, Chemadvisor - LOLI, Merck index, RTECS\nHealth Hazards\nCalculation method\nTraining Advice\nChemical hazard awareness training, incorporating labelling, Safety Data Sheets (SDS), Personal Protective Equipment (PPE)\nand hygiene.\nVersion\n4\nRevision Date\n24-Nov-2020\nReason for revision\nSDS section(s) updated, 2, 6, 8, 11, 12, 13, 16.\nDisclaimer\nThe information provided in this Safety Data Sheet is correct to the best of our knowledge, information and belief at the date of its\npublication. The information given is designed only as a guidance for safe handling, use, processing, storage, transportation, disposal\nand release and is not to be considered a warranty or quality specification. The information relates only to the specific material\ndesignated and may not be valid for such material used in combination with any other materials or in any process, unless specified in the\ntext\nICAO/IATA - International Civil Aviation Organization/International Air\nTransport Association\nMARPOL - International Convention for the Prevention of Pollution from\nShips\nATE - Acute Toxicity Estimate\nVOC (volatile organic compound)","REVISED_CONTENT":"Product ID:HZ-PHO,Product Description:Phosphorus,Storage Location:0088,Storage Location Description:Lager 0088 (WM),Plant:0001,Section Id:16,Section Header:Other information,Section Content:Full text of H-Statements referred to under sections 2 and 3\nH302 - Harmful if swallowed\nH314 - Causes severe skin burns and eye damage\nH318 - Causes serious eye damage\nH411 - Toxic to aquatic life with long lasting effects\nH412 - Harmful to aquatic life with long lasting effects\nH290 - May be corrosive to metals\nLegend\nCAS - Chemical Abstracts Service\nEINECS/ELINCS - European Inventory of Existing Commercial Chemical\nSubstances/EU List of Notified Chemical Substances\nPICCS - Philippines Inventory of Chemicals and Chemical Substances\nIECSC - Chinese Inventory of Existing Chemical Substances\nKECL - Korean Existing and Evaluated Chemical Substances\nWEL - Workplace Exposure Limit\nACGIH - American Conference of Governmental Industrial Hygienists\nDNEL - Derived No Effect Level\nRPE - Respiratory Protective Equipment\nLC50 - Lethal Concentration 50%\nNOEC - No Observed Effect Concentration\nPBT - Persistent, Bioaccumulative, Toxic\nTSCA - United States Toxic Substances Control Act Section 8(b)\nInventory\nDSL/NDSL - Canadian Domestic Substances List/Non-Domestic\nSubstances List\nENCS - Japanese Existing and New Chemical Substances\nAICS - Australian Inventory of Chemical Substances\nNZIoC - New Zealand Inventory of Chemicals\nTWA - Time Weighted Average\nIARC - International Agency for Research on Cancer\nPredicted No Effect Concentration (PNEC)\nLD50 Lethal Dose 50%\nEC50 - Effective Concentration 50%\nPOW - Partition coefficient Octanol:Water\nvPvB - very Persistent, very Bioaccumulative\nADR - European Agreement Concerning the International Carriage of\nDangerous Goods by Road\nIMO/IMDG - International Maritime Organization/International Maritime\nDangerous Goods Code\nOECD - Organisation for Economic Co-operation and Development\nBCF - Bioconcentration factor\nKey literature references and sources for data\nhttps://echa.europa.eu/information-on-chemicals\nSuppliers safety data sheet, Chemadvisor - LOLI, Merck index, RTECS\nHealth Hazards\nCalculation method\nTraining Advice\nChemical hazard awareness training, incorporating labelling, Safety Data Sheets (SDS), Personal Protective Equipment (PPE)\nand hygiene.\nVersion\n4\nRevision Date\n24-Nov-2020\nReason for revision\nSDS section(s) updated, 2, 6, 8, 11, 12, 13, 16.\nDisclaimer\nThe information provided in this Safety Data Sheet is correct to the best of our knowledge, information and belief at the date of its\npublication. The information given is designed only as a guidance for safe handling, use, processing, storage, transportation, disposal\nand release and is not to be considered a warranty or quality specification. The information relates only to the specific material\ndesignated and may not be valid for such material used in combination with any other materials or in any process, unless specified in the\ntext\nICAO/IATA - International Civil Aviation Organization/International Air\nTransport Association\nMARPOL - International Convention for the Prevention of Pollution from\nShips\nATE - Acute Toxicity Estimate\nVOC (volatile organic compound)"}