{"GUID":"AkKsEQACHt+fl92lo1Iowg==","MATNR":"HZ-CAD","MAKTX":"Cadmium","WERKS":"0001","LGORT":"0088","LGOBE":"Lager 0088 (WM)","SECTION_ID":8,"SECTION_HEADER":"Exposure controls / personal protection","SECTION_CONTENT":"Engineering Controls:\nUse process enclosures, local exhaust ventilation, or other engineering controls to keep airborne levels below recommended\nexposure limits. If user operations generate dust, fume or mist, use ventilation to keep exposure to airborne contaminants\nbelow the exposure limit.\nPersonal Protection: Safety glasses. Lab coat. Dust respirator. Be sure to use an approved/certified respirator or equivalent.\nGloves.\nPersonal Protection in Case of a Large Spill:\nSplash goggles. Full suit. Dust respirator. Boots. Gloves. A self contained breathing apparatus should be used to avoid\ninhalation of the product. Suggested protective clothing might not be sufficient; consult a specialist BEFORE handling this\nproduct.\nExposure Limits:\nTWA: 0.01 (ppm) Consult local authorities for acceptable exposure limits.","REVISED_CONTENT":"Product ID:HZ-CAD,Product Description:Cadmium,Storage Location:0088,Storage Location Description:Lager 0088 (WM),Plant:0001,Section Id:8,Section Header:Exposure controls / personal protection,Section Content:Engineering Controls:\nUse process enclosures, local exhaust ventilation, or other engineering controls to keep airborne levels below recommended\nexposure limits. If user operations generate dust, fume or mist, use ventilation to keep exposure to airborne contaminants\nbelow the exposure limit.\nPersonal Protection: Safety glasses. Lab coat. Dust respirator. Be sure to use an approved/certified respirator or equivalent.\nGloves.\nPersonal Protection in Case of a Large Spill:\nSplash goggles. Full suit. Dust respirator. Boots. Gloves. A self contained breathing apparatus should be used to avoid\ninhalation of the product. Suggested protective clothing might not be sufficient; consult a specialist BEFORE handling this\nproduct.\nExposure Limits:\nTWA: 0.01 (ppm) Consult local authorities for acceptable exposure limits."}