{"GUID":"AkKsEQACHt+fl92lpuhowg==","MATNR":"HZ-PHO","MAKTX":"Phosphorus","WERKS":"0001","LGORT":"0088","LGOBE":"Lager 0088 (WM)","SECTION_ID":14,"SECTION_HEADER":"Transport information","SECTION_CONTENT":"IMDG/IMO\nUN2796\nSULPHURIC ACID (with 51%\nor less acid)\n8\nII\nADR\nUN2796\nSULPHURIC ACID (with 51%\nor less acid)\n8\nII\nIATA\nUN2796\nSULPHURIC ACID (with 51%\nor less acid)\n8\nII\n14.1. UN number\n14.2. UN proper shipping name\n14.3. Transport hazard class(es)\n14.4. Packing group\n14.5. Environmental hazards\nNo hazards identified\n14.6. Special precautions for user\nNo special precautions required\n14.7. Maritime transport in bulk according to IMO instruments\nNot applicable, packaged goods","REVISED_CONTENT":"Product ID:HZ-PHO,Product Description:Phosphorus,Storage Location:0088,Storage Location Description:Lager 0088 (WM),Plant:0001,Section Id:14,Section Header:Transport information,Section Content:IMDG/IMO\nUN2796\nSULPHURIC ACID (with 51%\nor less acid)\n8\nII\nADR\nUN2796\nSULPHURIC ACID (with 51%\nor less acid)\n8\nII\nIATA\nUN2796\nSULPHURIC ACID (with 51%\nor less acid)\n8\nII\n14.1. UN number\n14.2. UN proper shipping name\n14.3. Transport hazard class(es)\n14.4. Packing group\n14.5. Environmental hazards\nNo hazards identified\n14.6. Special precautions for user\nNo special precautions required\n14.7. Maritime transport in bulk according to IMO instruments\nNot applicable, packaged goods"}