{"GUID":"AkKsEQACHt+fl92lrP5owg==","MATNR":"HZ-URA","MAKTX":"URANIUM - WP","WERKS":"0001","LGORT":"0002","LGOBE":"Cold Storage","SECTION_ID":14,"SECTION_HEADER":"Transport information","SECTION_CONTENT":"SECTION 14: Transport information\nDOT (US)\nUN number: 3264 Class: 8\nPacking group: III\nProper shipping name: Corrosive liquid, acidic, inorganic, n.o.s. (nitric acid)\nReportable Quantity (RQ):\nPoison Inhalation Hazard: No\nIMDG\nUN number: 3264 Class: 8\nPacking group: III\nEMS-No: F-A, S-B\nProper shipping name: CORROSIVE LIQUID, ACIDIC, INORGANIC, N.O.S. (nitric acid)\nIATA\nUN number: 3264 Class: 8\nPacking group: III\nProper shipping name: Corrosive liquid, acidic, inorganic, n.o.s. (nitric acid)","REVISED_CONTENT":"Product ID:HZ-URA,Product Description:URANIUM - WP,Storage Location:0002,Storage Location Description:Cold Storage,Plant:0001,Section Id:14,Section Header:Transport information,Section Content:SECTION 14: Transport information\nDOT (US)\nUN number: 3264 Class: 8\nPacking group: III\nProper shipping name: Corrosive liquid, acidic, inorganic, n.o.s. (nitric acid)\nReportable Quantity (RQ):\nPoison Inhalation Hazard: No\nIMDG\nUN number: 3264 Class: 8\nPacking group: III\nEMS-No: F-A, S-B\nProper shipping name: CORROSIVE LIQUID, ACIDIC, INORGANIC, N.O.S. (nitric acid)\nIATA\nUN number: 3264 Class: 8\nPacking group: III\nProper shipping name: Corrosive liquid, acidic, inorganic, n.o.s. (nitric acid)"}