{"GUID":"AkKsEQACHt+fl92lpuUIwg==","MATNR":"HZ-OXY","MAKTX":"Oxygen","WERKS":"0001","LGORT":"0001","LGOBE":"Lager 0001","SECTION_ID":3,"SECTION_HEADER":"Composition / information on ingredients","SECTION_CONTENT":"Substance/mixture : Substance\nChemical name\nidentification : oxygen\nOther means of\nidentification : Molecular oxygen; Oxygen molecule; Pure oxygen; O2; UN 1072; Dioxygen; Oxygen\nUSP, Aviator's Breathing Oxygen (ABO)\nProduct code : 001043\nCAS number/other identifiers\nCAS number : 7782-44-7\nIngredient name\noxygen\n%\n100\nCAS number\n7782-44-7\nAny concentration shown as a range is to protect confidentiality or is due to batch variation.\nThere are no additional ingredients present which, within the current knowledge of the supplier and in the\nconcentrations applicable, are classified as hazardous to health or the environment and hence require reporting\nin this section.\nOccupational exposure limits, if available, are listed in Section 8.","REVISED_CONTENT":"Product ID:HZ-OXY,Product Description:Oxygen,Storage Location:0001,Storage Location Description:Lager 0001,Plant:0001,Section Id:3,Section Header:Composition / information on ingredients,Section Content:Substance/mixture : Substance\nChemical name\nidentification : oxygen\nOther means of\nidentification : Molecular oxygen; Oxygen molecule; Pure oxygen; O2; UN 1072; Dioxygen; Oxygen\nUSP, Aviator's Breathing Oxygen (ABO)\nProduct code : 001043\nCAS number/other identifiers\nCAS number : 7782-44-7\nIngredient name\noxygen\n%\n100\nCAS number\n7782-44-7\nAny concentration shown as a range is to protect confidentiality or is due to batch variation.\nThere are no additional ingredients present which, within the current knowledge of the supplier and in the\nconcentrations applicable, are classified as hazardous to health or the environment and hence require reporting\nin this section.\nOccupational exposure limits, if available, are listed in Section 8."}