{"GUID":"AkKsEQACHt+fl92lptfIwg==","MATNR":"HZ-MAG","MAKTX":"Magnesium","WERKS":"0001","LGORT":"0001","LGOBE":"Lager 0001","SECTION_ID":9,"SECTION_HEADER":"Physical and chemical properties","SECTION_CONTENT":"Physical State\nAppearance\nOdor\nOdor Threshold\npH\nMelting Point/Range\nBoiling Point/Range\nFlash Point\nEvaporation Rate\nFlammability (solid,gas)\nFlammability or explosive limits\nUpper\nLower\nVapor Pressure\nVapor Density\nSpecific Gravity\nSolubility\nPartition coefficient; n-octanol/water\nAutoignition Temperature\nDecomposition Temperature\nViscosity\nMolecular Formula\nMolecular Weight\nSolid\nSilver\nOdorless\nNo information available\n7\n651 °C / 1203.8 °F\n1107 °C / 2024.6 °F\n500 °C / 932 °F\nNot applicable\nNo information available\nNo data available\nNo data available\nnegligible\nNot applicable\nNo information available\nNo information available\nNo data available\n472.8 °C / 883 °F\nNo information available\nNot applicable\nMg\n24.3","REVISED_CONTENT":"Product ID:HZ-MAG,Product Description:Magnesium,Storage Location:0001,Storage Location Description:Lager 0001,Plant:0001,Section Id:9,Section Header:Physical and chemical properties,Section Content:Physical State\nAppearance\nOdor\nOdor Threshold\npH\nMelting Point/Range\nBoiling Point/Range\nFlash Point\nEvaporation Rate\nFlammability (solid,gas)\nFlammability or explosive limits\nUpper\nLower\nVapor Pressure\nVapor Density\nSpecific Gravity\nSolubility\nPartition coefficient; n-octanol/water\nAutoignition Temperature\nDecomposition Temperature\nViscosity\nMolecular Formula\nMolecular Weight\nSolid\nSilver\nOdorless\nNo information available\n7\n651 °C / 1203.8 °F\n1107 °C / 2024.6 °F\n500 °C / 932 °F\nNot applicable\nNo information available\nNo data available\nNo data available\nnegligible\nNot applicable\nNo information available\nNo information available\nNo data available\n472.8 °C / 883 °F\nNo information available\nNot applicable\nMg\n24.3"}