{"GUID":"AkKsEQACHt+fl92lpsuowg==","MATNR":"HZ-HAC","MAKTX":"Hydrochloric acid","WERKS":"0001","LGORT":"0003","LGOBE":"Corrosive Items","SECTION_ID":8,"SECTION_HEADER":"Exposure controls / personal protection","SECTION_CONTENT":"Exposure Guidelines\nComponent\nHydrochloric acid\nACGIH TLV\nCeiling: 2 ppm\nOSHA PEL\nCeiling: 5 ppm\nCeiling: 7 mg/m³\n(Vacated) Ceiling: 5 ppm\n(Vacated) Ceiling: 7 mg/m³\nNIOSH IDLH\nIDLH: 50 ppm\nCeiling: 5 ppm\nCeiling: 7 mg/m³\nComponent\nHydrochloric acid\nQuebec\nCeiling: 5 ppm\nMexico OEL (TWA)\nCeiling: 7.5 mg/m³\nOntario TWAEV\nCeiling: 5 ppm\nCeiling: 7 mg/m³\nCEV: 2 ppm\nLegend\nACGIH - American Conference of Governmental Industrial Hygienists\nOSHA - Occupational Safety and Health Administration\nNIOSH IDLH: The National Institute for Occupational Safety and Health Immediately Dangerous to Life or Health\nEngineering Measures\nEnsure that eyewash stations and safety showers are close to the workstation location.\nPersonal Protective Equipment\nEye/face Protection\nWear appropriate protective eyeglasses or chemical safety goggles as described by\nOSHA's eye and face protection regulations in 29 CFR 1910.133 or European Standard\nEN166.\nSkin and body protection\nWear appropriate protective gloves and clothing to prevent skin exposure.\nRespiratory Protection\nFollow the OSHA respirator regulations found in 29 CFR 1910.134 or European Standard\nEN 149. Use a NIOSH/MSHA or European Standard EN 149 approved respirator if\nexposure limits are exceeded or if irritation or other symptoms are experienced.\nHygiene Measures\nHandle in accordance with good industrial hygiene and safety practice.","REVISED_CONTENT":"Product ID:HZ-HAC,Product Description:Hydrochloric acid,Storage Location:0003,Storage Location Description:Corrosive Items,Plant:0001,Section Id:8,Section Header:Exposure controls / personal protection,Section Content:Exposure Guidelines\nComponent\nHydrochloric acid\nACGIH TLV\nCeiling: 2 ppm\nOSHA PEL\nCeiling: 5 ppm\nCeiling: 7 mg/m³\n(Vacated) Ceiling: 5 ppm\n(Vacated) Ceiling: 7 mg/m³\nNIOSH IDLH\nIDLH: 50 ppm\nCeiling: 5 ppm\nCeiling: 7 mg/m³\nComponent\nHydrochloric acid\nQuebec\nCeiling: 5 ppm\nMexico OEL (TWA)\nCeiling: 7.5 mg/m³\nOntario TWAEV\nCeiling: 5 ppm\nCeiling: 7 mg/m³\nCEV: 2 ppm\nLegend\nACGIH - American Conference of Governmental Industrial Hygienists\nOSHA - Occupational Safety and Health Administration\nNIOSH IDLH: The National Institute for Occupational Safety and Health Immediately Dangerous to Life or Health\nEngineering Measures\nEnsure that eyewash stations and safety showers are close to the workstation location.\nPersonal Protective Equipment\nEye/face Protection\nWear appropriate protective eyeglasses or chemical safety goggles as described by\nOSHA's eye and face protection regulations in 29 CFR 1910.133 or European Standard\nEN166.\nSkin and body protection\nWear appropriate protective gloves and clothing to prevent skin exposure.\nRespiratory Protection\nFollow the OSHA respirator regulations found in 29 CFR 1910.134 or European Standard\nEN 149. Use a NIOSH/MSHA or European Standard EN 149 approved respirator if\nexposure limits are exceeded or if irritation or other symptoms are experienced.\nHygiene Measures\nHandle in accordance with good industrial hygiene and safety practice."}