{"GUID":"AkKsEQACHt+fl92lpt7owg==","MATNR":"HZ-MET","MAKTX":"Methane","WERKS":"0001","LGORT":"0001","LGOBE":"Lager 0001","SECTION_ID":2,"SECTION_HEADER":"Hazard identification","SECTION_CONTENT":"OSHA/HCS status : This material is considered hazardous by the OSHA Hazard Communication Standard\n(29 CFR 1910.1200).\nClassification of the\nsubstance or mixture : FLAMMABLE GASES - Category 1\nGASES UNDER PRESSURE - Compressed gas\nGHS label elements\nHazard pictograms : \nSignal word : Danger\nHazard statements : Extremely flammable gas.\nMay form explosive mixtures with air.\nContains gas under pressure; may explode if heated.\nMay displace oxygen and cause rapid suffocation.","REVISED_CONTENT":"Product ID:HZ-MET,Product Description:Methane,Storage Location:0001,Storage Location Description:Lager 0001,Plant:0001,Section Id:2,Section Header:Hazard identification,Section Content:OSHA/HCS status : This material is considered hazardous by the OSHA Hazard Communication Standard\n(29 CFR 1910.1200).\nClassification of the\nsubstance or mixture : FLAMMABLE GASES - Category 1\nGASES UNDER PRESSURE - Compressed gas\nGHS label elements\nHazard pictograms : \nSignal word : Danger\nHazard statements : Extremely flammable gas.\nMay form explosive mixtures with air.\nContains gas under pressure; may explode if heated.\nMay displace oxygen and cause rapid suffocation."}