{"GUID":"AkKsEQACHt+fl92loTPIwg==","MATNR":"HZ-BEN","MAKTX":"Benzene","WERKS":"0001","LGORT":"0001","LGOBE":"Lager 0001","SECTION_ID":7,"SECTION_HEADER":"Handling and storage","SECTION_CONTENT":"Handling:\nPrecautions for safe handling\nEnsure good ventilation/exhaustion at the workplace.\nOpen and handle receptacle with care.\nPrevent formation of aerosols.\n路 Information about protection against explosions and fires:\nKeep ignition sources away - Do not smoke.\nProtect against electrostatic charges.\nKeep respiratory protective device available.\nConditions for safe storage, including any incompatibilities\nStorage:\n路 Requirements to be met by storerooms and receptacles: Store in a cool location.\nInformation about storage in one common storage facility: Not required.\nFurther information about storage conditions:\nKeep receptacle tightly sealed.\nStore in cool, dry conditions in well sealed receptacles.","REVISED_CONTENT":"Product ID:HZ-BEN,Product Description:Benzene,Storage Location:0001,Storage Location Description:Lager 0001,Plant:0001,Section Id:7,Section Header:Handling and storage,Section Content:Handling:\nPrecautions for safe handling\nEnsure good ventilation/exhaustion at the workplace.\nOpen and handle receptacle with care.\nPrevent formation of aerosols.\n路 Information about protection against explosions and fires:\nKeep ignition sources away - Do not smoke.\nProtect against electrostatic charges.\nKeep respiratory protective device available.\nConditions for safe storage, including any incompatibilities\nStorage:\n路 Requirements to be met by storerooms and receptacles: Store in a cool location.\nInformation about storage in one common storage facility: Not required.\nFurther information about storage conditions:\nKeep receptacle tightly sealed.\nStore in cool, dry conditions in well sealed receptacles."}