{"GUID":"AkKsEQACHt+fl92lrOdowg==","MATNR":"HZ-PRO","MAKTX":"Propane","WERKS":"0001","LGORT":"0001","LGOBE":"Lager 0001","SECTION_ID":6,"SECTION_HEADER":"Accidental release measures","SECTION_CONTENT":"Ensure adequate ventilation.\nWear protective equipment consistent with the site emergency plan.\nEvacuate personnel to a safe area. Close doors and windows of adjacent premises. Keep\ncontainers closed. Mark the danger area. Seal off low-lying areas. Keep upwind.\nStandard protective clothing and equipment (e.g, Self Contained Breathing Apparatus) for fire\nfighters. Equip cleanup crew with proper protection.\nEvacuate and limit access. Ventilate area. Remove ignition sources. Monitor concentration of\nreleased product. Consider the risk of potentially explosive atmospheres. Wear self-contained\nbreathing apparatus when entering atmospheres of unknown contaminant concentration until\nproven to be safe.\nTry to stop release if without risk.\nTry to stop release if without risk.\nDispose of contents/container in accordance with local/regional/national/international\nregulations.\nVentilate area.\nSee also Sections 8 and 13.","REVISED_CONTENT":"Product ID:HZ-PRO,Product Description:Propane,Storage Location:0001,Storage Location Description:Lager 0001,Plant:0001,Section Id:6,Section Header:Accidental release measures,Section Content:Ensure adequate ventilation.\nWear protective equipment consistent with the site emergency plan.\nEvacuate personnel to a safe area. Close doors and windows of adjacent premises. Keep\ncontainers closed. Mark the danger area. Seal off low-lying areas. Keep upwind.\nStandard protective clothing and equipment (e.g, Self Contained Breathing Apparatus) for fire\nfighters. Equip cleanup crew with proper protection.\nEvacuate and limit access. Ventilate area. Remove ignition sources. Monitor concentration of\nreleased product. Consider the risk of potentially explosive atmospheres. Wear self-contained\nbreathing apparatus when entering atmospheres of unknown contaminant concentration until\nproven to be safe.\nTry to stop release if without risk.\nTry to stop release if without risk.\nDispose of contents/container in accordance with local/regional/national/international\nregulations.\nVentilate area.\nSee also Sections 8 and 13."}