{"GUID":"AkKsEQACHt+fl92lptPIwg==","MATNR":"HZ-LEA","MAKTX":"Lead","WERKS":"0001","LGORT":"0088","LGOBE":"Lager 0088 (WM)","SECTION_ID":9,"SECTION_HEADER":"Physical and chemical properties","SECTION_CONTENT":"Physical State\nAppearance\nOdor\nOdor Threshold\npH\nMelting Point/Range\nBoiling Point/Range\nFlash Point\nEvaporation Rate\nFlammability (solid,gas)\nFlammability or explosive limits\nUpper\nLower\nVapor Pressure\nVapor Density\nRelative Density\nSolubility\nPartition coefficient; n-octanol/water\nAutoignition Temperature\nDecomposition Temperature\nViscosity\nMolecular Formula\nMolecular Weight\nSolid\nGrey\nOdorless\nNo information available\nNot applicable\n327.4 °C / 621.3 °F\n1740 °C / 3164 °F\nNo information available\nNo information available\nNo information available\nNo data available\nNo data available\nNo information available\nNo information available\n11.3\nNo information available\nNo data available\nNo information available\nNo information available\nPb\n207.19","REVISED_CONTENT":"Product ID:HZ-LEA,Product Description:Lead,Storage Location:0088,Storage Location Description:Lager 0088 (WM),Plant:0001,Section Id:9,Section Header:Physical and chemical properties,Section Content:Physical State\nAppearance\nOdor\nOdor Threshold\npH\nMelting Point/Range\nBoiling Point/Range\nFlash Point\nEvaporation Rate\nFlammability (solid,gas)\nFlammability or explosive limits\nUpper\nLower\nVapor Pressure\nVapor Density\nRelative Density\nSolubility\nPartition coefficient; n-octanol/water\nAutoignition Temperature\nDecomposition Temperature\nViscosity\nMolecular Formula\nMolecular Weight\nSolid\nGrey\nOdorless\nNo information available\nNot applicable\n327.4 °C / 621.3 °F\n1740 °C / 3164 °F\nNo information available\nNo information available\nNo information available\nNo data available\nNo data available\nNo information available\nNo information available\n11.3\nNo information available\nNo data available\nNo information available\nNo information available\nPb\n207.19"}