{"GUID":"AkKsEQACHt+fl92lrOdIwg==","MATNR":"HZ-PRO","MAKTX":"Propane","WERKS":"0001","LGORT":"0001","LGOBE":"Lager 0001","SECTION_ID":5,"SECTION_HEADER":"Fire-fighting measures","SECTION_CONTENT":"Use extinguishing media appropriate for surrounding fire.\nDo not use water jet to extinguish.\nThis product is flammable.\nHeat may build pressure, rupturing closed containers, spreading fire and increasing risk of\nburns and injuries. May form flammable/explosive vapor-air mixture.\nNone known.\nIncomplete combustion may form carbon monoxide.\nIn case of fire: Evacuate area. Fight fire remotely due to the risk of explosion. Use water spray\nor fog for cooling exposed containers. Exercise caution when fighting any chemical fire.","REVISED_CONTENT":"Product ID:HZ-PRO,Product Description:Propane,Storage Location:0001,Storage Location Description:Lager 0001,Plant:0001,Section Id:5,Section Header:Fire-fighting measures,Section Content:Use extinguishing media appropriate for surrounding fire.\nDo not use water jet to extinguish.\nThis product is flammable.\nHeat may build pressure, rupturing closed containers, spreading fire and increasing risk of\nburns and injuries. May form flammable/explosive vapor-air mixture.\nNone known.\nIncomplete combustion may form carbon monoxide.\nIn case of fire: Evacuate area. Fight fire remotely due to the risk of explosion. Use water spray\nor fog for cooling exposed containers. Exercise caution when fighting any chemical fire."}