{"GUID":"AkKsEQACHt+fl92lpsqIwg==","MATNR":"HZ-GLY","MAKTX":"Glyphosate","WERKS":"0001","LGORT":"0088","LGOBE":"Lager 0088 (WM)","SECTION_ID":15,"SECTION_HEADER":"Regulatory information","SECTION_CONTENT":"United States of America Inventory\nComponent\nGlycine, N-(phosphonomethyl)-\nLegend:\nTSCA US EPA (TSCA) - Toxic Substances Control Act, (40 CFR Part 710)\nX - Listed\n'-' - Not Listed\nTSCA 12(b) - Notices of Export\nInternational Inventories\nCanada (DSL/NDSL), Europe (EINECS/ELINCS/NLP), Philippines (PICCS), Japan (ENCS), Japan (ISHL), Australia (AICS), China (IECSC), Korea\n(KECL).\nComponent\nGlycine, N-(phosphonomethyl)-\nU.S. Federal Regulations\nSARA 313\nSARA 311/312 Hazard Categories","REVISED_CONTENT":"Product ID:HZ-GLY,Product Description:Glyphosate,Storage Location:0088,Storage Location Description:Lager 0088 (WM),Plant:0001,Section Id:15,Section Header:Regulatory information,Section Content:United States of America Inventory\nComponent\nGlycine, N-(phosphonomethyl)-\nLegend:\nTSCA US EPA (TSCA) - Toxic Substances Control Act, (40 CFR Part 710)\nX - Listed\n'-' - Not Listed\nTSCA 12(b) - Notices of Export\nInternational Inventories\nCanada (DSL/NDSL), Europe (EINECS/ELINCS/NLP), Philippines (PICCS), Japan (ENCS), Japan (ISHL), Australia (AICS), China (IECSC), Korea\n(KECL).\nComponent\nGlycine, N-(phosphonomethyl)-\nU.S. Federal Regulations\nSARA 313\nSARA 311/312 Hazard Categories"}