{"GUID":"AkKsEQACHt+fl92loS/Iwg==","MATNR":"HZ-ACE","MAKTX":"Acetone","WERKS":"0001","LGORT":"0001","LGOBE":"Lager 0001","SECTION_ID":7,"SECTION_HEADER":"Handling and storage","SECTION_CONTENT":"Handling Wear personal protective equipment. Ensure adequate ventilation. Keep away from open\nflames, hot surfaces and sources of ignition. Take precautionary measures against static\ndischarges. Use only non-sparking tools. Use explosion-proof equipment. Do not breathe\nvapors or spray mist. Do not get in eyes, on skin, or on clothing. To avoid ignition of vapors\nby static electricity discharge, all metal parts of the equipment must be grounded.\nStorage Flammables area. Keep containers tightly closed in a dry, cool and well-ventilated place.\nKeep away from heat and sources of ignition. Keep container tightly closed in a dry and\nwell-ventilated place.","REVISED_CONTENT":"Product ID:HZ-ACE,Product Description:Acetone,Storage Location:0001,Storage Location Description:Lager 0001,Plant:0001,Section Id:7,Section Header:Handling and storage,Section Content:Handling Wear personal protective equipment. Ensure adequate ventilation. Keep away from open\nflames, hot surfaces and sources of ignition. Take precautionary measures against static\ndischarges. Use only non-sparking tools. Use explosion-proof equipment. Do not breathe\nvapors or spray mist. Do not get in eyes, on skin, or on clothing. To avoid ignition of vapors\nby static electricity discharge, all metal parts of the equipment must be grounded.\nStorage Flammables area. Keep containers tightly closed in a dry, cool and well-ventilated place.\nKeep away from heat and sources of ignition. Keep container tightly closed in a dry and\nwell-ventilated place."}