{"GUID":"AkKsEQACHt+fl92lpt9owg==","MATNR":"HZ-MET","MAKTX":"Methane","WERKS":"0001","LGORT":"0001","LGOBE":"Lager 0001","SECTION_ID":6,"SECTION_HEADER":"Accidental release measures","SECTION_CONTENT":"Personal precautions, protective equipment and emergency procedures\nFor non-emergency\npersonnel : Accidental releases pose a serious fire or explosion hazard. No action shall be taken\ninvolving any personal risk or without suitable training. Evacuate surrounding areas.\nKeep unnecessary and unprotected personnel from entering. Shut off all ignition\nsources. No flares, smoking or flames in hazard area. Avoid breathing gas. Provide\nadequate ventilation. Wear appropriate respirator when ventilation is inadequate. Put\non appropriate personal protective equipment.\nFor emergency responders : If specialized clothing is required to deal with the spillage, take note of any information in\nSection 8 on suitable and unsuitable materials. See also the information in \"For non-\nemergency personnel\".\nEnvironmental precautions : Ensure emergency procedures to deal with accidental gas releases are in place to avoid\ncontamination of the environment. Inform the relevant authorities if the product has\ncaused environmental pollution (sewers, waterways, soil or air).\nMethods and materials for containment and cleaning up\nSmall spill : Immediately contact emergency personnel. Stop leak if without risk. Use spark-proof\ntools and explosion-proof equipment.\nLarge spill : Immediately contact emergency personnel. Stop leak if without risk. Use spark-proof\ntools and explosion-proof equipment. Note: see Section 1 for emergency contact\ninformation and Section 13 for waste disposal.","REVISED_CONTENT":"Product ID:HZ-MET,Product Description:Methane,Storage Location:0001,Storage Location Description:Lager 0001,Plant:0001,Section Id:6,Section Header:Accidental release measures,Section Content:Personal precautions, protective equipment and emergency procedures\nFor non-emergency\npersonnel : Accidental releases pose a serious fire or explosion hazard. No action shall be taken\ninvolving any personal risk or without suitable training. Evacuate surrounding areas.\nKeep unnecessary and unprotected personnel from entering. Shut off all ignition\nsources. No flares, smoking or flames in hazard area. Avoid breathing gas. Provide\nadequate ventilation. Wear appropriate respirator when ventilation is inadequate. Put\non appropriate personal protective equipment.\nFor emergency responders : If specialized clothing is required to deal with the spillage, take note of any information in\nSection 8 on suitable and unsuitable materials. See also the information in \"For non-\nemergency personnel\".\nEnvironmental precautions : Ensure emergency procedures to deal with accidental gas releases are in place to avoid\ncontamination of the environment. Inform the relevant authorities if the product has\ncaused environmental pollution (sewers, waterways, soil or air).\nMethods and materials for containment and cleaning up\nSmall spill : Immediately contact emergency personnel. Stop leak if without risk. Use spark-proof\ntools and explosion-proof equipment.\nLarge spill : Immediately contact emergency personnel. Stop leak if without risk. Use spark-proof\ntools and explosion-proof equipment. Note: see Section 1 for emergency contact\ninformation and Section 13 for waste disposal."}