{"GUID":"AkKsEQACHt+fl92lptDowg==","MATNR":"HZ-HYS","MAKTX":"Hydrogen sulfide","WERKS":"0001","LGORT":"0001","LGOBE":"Lager 0001","SECTION_ID":2,"SECTION_HEADER":"Hazard identification","SECTION_CONTENT":"Classification of the substance or mixture\nGHS-US classification\nFlam. Gas 1\nPress. Gas (Liq.)\nAcute Tox. 2 (Inhalation: gas)\nSTOT SE 3\nAquatic Acute 1\nLabel elements\nGHS US labelling\nHazard pictograms (GHS US)\nSignal word (GHS US)\nHazard statements (GHS US)\nEN (English)\n: H220\nH280\nH330\nH335\nH400\nGHS02\nGHS04\nGHS06\nGHS07\nGHS09\n: Danger\n: H220 - EXTREMELY FLAMMABLE GAS\nH280 - CONTAINS GAS UNDER PRESSURE; MAY EXPLODE IF HEATED\nH330 - FATAL IF INHALED\nH335 - MAY CAUSE RESPIRATORY IRRITATION.\nH400 - VERY TOXIC TO AQUATIC LIFE\nCGA-HG01 - MAY CAUSE FROSTBITE.\nCGA-HG04 - MAY FORM EXPLOSIVE MIXTURES WITH AIR\nCGA-HG11SYMPTOMS MAY BE DELAYED\nCGA-HG16- EXTENDED EXPOSURE TO GAS REDUCES THE ABILITY TO SMELL\nSULFIDES.","REVISED_CONTENT":"Product ID:HZ-HYS,Product Description:Hydrogen sulfide,Storage Location:0001,Storage Location Description:Lager 0001,Plant:0001,Section Id:2,Section Header:Hazard identification,Section Content:Classification of the substance or mixture\nGHS-US classification\nFlam. Gas 1\nPress. Gas (Liq.)\nAcute Tox. 2 (Inhalation: gas)\nSTOT SE 3\nAquatic Acute 1\nLabel elements\nGHS US labelling\nHazard pictograms (GHS US)\nSignal word (GHS US)\nHazard statements (GHS US)\nEN (English)\n: H220\nH280\nH330\nH335\nH400\nGHS02\nGHS04\nGHS06\nGHS07\nGHS09\n: Danger\n: H220 - EXTREMELY FLAMMABLE GAS\nH280 - CONTAINS GAS UNDER PRESSURE; MAY EXPLODE IF HEATED\nH330 - FATAL IF INHALED\nH335 - MAY CAUSE RESPIRATORY IRRITATION.\nH400 - VERY TOXIC TO AQUATIC LIFE\nCGA-HG01 - MAY CAUSE FROSTBITE.\nCGA-HG04 - MAY FORM EXPLOSIVE MIXTURES WITH AIR\nCGA-HG11SYMPTOMS MAY BE DELAYED\nCGA-HG16- EXTENDED EXPOSURE TO GAS REDUCES THE ABILITY TO SMELL\nSULFIDES."}