{"GUID":"AkKsEQACHt+fl92lo1Sowg==","MATNR":"HZ-CES","MAKTX":"Cesium","WERKS":"0001","LGORT":"0088","LGOBE":"Lager 0088 (WM)","SECTION_ID":12,"SECTION_HEADER":"Ecological information","SECTION_CONTENT":"SECTION 12: Ecological information\n12.1 Toxicity\nNo data available\n12.2 Persistence and degradability\nThe methods for determining biodegradability are not applicable to inorganic substances.\n12.3 Bioaccumulative potential\nNo data available\n12.4 Mobility in soil\nNo data available\n12.5 Results of PBT and vPvB assessment\nPBT/vPvB assessment not available as chemical safety assessment not required/not\nconducted\n12.6 Other adverse effects\nNo data available","REVISED_CONTENT":"Product ID:HZ-CES,Product Description:Cesium,Storage Location:0088,Storage Location Description:Lager 0088 (WM),Plant:0001,Section Id:12,Section Header:Ecological information,Section Content:SECTION 12: Ecological information\n12.1 Toxicity\nNo data available\n12.2 Persistence and degradability\nThe methods for determining biodegradability are not applicable to inorganic substances.\n12.3 Bioaccumulative potential\nNo data available\n12.4 Mobility in soil\nNo data available\n12.5 Results of PBT and vPvB assessment\nPBT/vPvB assessment not available as chemical safety assessment not required/not\nconducted\n12.6 Other adverse effects\nNo data available"}