{"GUID":"AkKsEQACHt+fl92lo1mIwg==","MATNR":"HZ-CMO","MAKTX":"Carbon monoxide","WERKS":"0001","LGORT":"0001","LGOBE":"Lager 0001","SECTION_ID":3,"SECTION_HEADER":"Composition / information on ingredients","SECTION_CONTENT":"Classification of the substance or mixture\n2.1.\nGHS US classification\nFlammable gases Category\n1\nGases under pressure\nCompressed gas\nAcute toxicity\n(inhalation:gas) Category 3\nReproductive toxicity\nCategory 1A\nSpecific target organ\ntoxicity (repeated exposure)\nCategory 1\n: H220\n: H280\n: H331\n: H360\n: H372\nExtremely flammable gas\nContains gas under pressure; may explode if heated\nToxic if inhaled\nMay damage fertility or the unborn child\nCauses damage to organs (central nervous system) through prolonged or repeated exposure\n(Inhalation)\nFull text of H statements: see section 16\n2.2.\nGHS Label elements, including precautionary statements\nGHS US labeling\nHazard pictograms (GHS US)\nSignal word (GHS US)\nHazard statements (GHS US)\nPrecautionary statements (GHS US)\n: Danger\n: H220 - Extremely flammable gas\nH280 - Contains gas under pressure; may explode if heated\nH331 - Toxic if inhaled\nH360 - May damage fertility or the unborn child\nH372 - Causes damage to organs (central nervous system) through prolonged or repeated\nexposure (Inhalation)\nCGA-HG04 - May form explosive mixtures with air\nCGA-HG10 - Asphyxiating even with adequate oxygen\n: P201 - Obtain special instructions before use.\nP202 - Do not handle until all safety precautions have been read and understood.\nP210 - Keep away from heat, hot surfaces, open flames, sparks. - No smoking.\nP260 - Do not breathe gas.","REVISED_CONTENT":"Product ID:HZ-CMO,Product Description:Carbon monoxide,Storage Location:0001,Storage Location Description:Lager 0001,Plant:0001,Section Id:3,Section Header:Composition / information on ingredients,Section Content:Classification of the substance or mixture\n2.1.\nGHS US classification\nFlammable gases Category\n1\nGases under pressure\nCompressed gas\nAcute toxicity\n(inhalation:gas) Category 3\nReproductive toxicity\nCategory 1A\nSpecific target organ\ntoxicity (repeated exposure)\nCategory 1\n: H220\n: H280\n: H331\n: H360\n: H372\nExtremely flammable gas\nContains gas under pressure; may explode if heated\nToxic if inhaled\nMay damage fertility or the unborn child\nCauses damage to organs (central nervous system) through prolonged or repeated exposure\n(Inhalation)\nFull text of H statements: see section 16\n2.2.\nGHS Label elements, including precautionary statements\nGHS US labeling\nHazard pictograms (GHS US)\nSignal word (GHS US)\nHazard statements (GHS US)\nPrecautionary statements (GHS US)\n: Danger\n: H220 - Extremely flammable gas\nH280 - Contains gas under pressure; may explode if heated\nH331 - Toxic if inhaled\nH360 - May damage fertility or the unborn child\nH372 - Causes damage to organs (central nervous system) through prolonged or repeated\nexposure (Inhalation)\nCGA-HG04 - May form explosive mixtures with air\nCGA-HG10 - Asphyxiating even with adequate oxygen\n: P201 - Obtain special instructions before use.\nP202 - Do not handle until all safety precautions have been read and understood.\nP210 - Keep away from heat, hot surfaces, open flames, sparks. - No smoking.\nP260 - Do not breathe gas."}