{"GUID":"AkKsEQACHt+fl92lpt5owg==","MATNR":"HZ-MER","MAKTX":"Mercury","WERKS":"0001","LGORT":"0088","LGOBE":"Lager 0088 (WM)","SECTION_ID":14,"SECTION_HEADER":"Transport information","SECTION_CONTENT":"DOT\nUN-No\nUN2809\nProper Shipping Name\nMercury\nHazard Class\n8\nSubsidiary Hazard Class\n6.1\nPacking Group\nIII\nT DG\nUN-No\nUN2809\nIATA\nProper Shipping Name\nHazard Class\nPacking Group\nUN-No\nProper Shipping Name\nHazard Class\nSubsidiary Hazard Class\nPacking Group\nIMDG/IMO\nUN-No\nUN2809\nProper Shipping Name\nHazard Class\nSubsidiary Hazard Class\nPacking Group\nMercury\n8\nIII\nUN2809\nMercury\n8\n6.1\nIII\nUN2809\nMercury\n8\n6.1\nIII","REVISED_CONTENT":"Product ID:HZ-MER,Product Description:Mercury,Storage Location:0088,Storage Location Description:Lager 0088 (WM),Plant:0001,Section Id:14,Section Header:Transport information,Section Content:DOT\nUN-No\nUN2809\nProper Shipping Name\nMercury\nHazard Class\n8\nSubsidiary Hazard Class\n6.1\nPacking Group\nIII\nT DG\nUN-No\nUN2809\nIATA\nProper Shipping Name\nHazard Class\nPacking Group\nUN-No\nProper Shipping Name\nHazard Class\nSubsidiary Hazard Class\nPacking Group\nIMDG/IMO\nUN-No\nUN2809\nProper Shipping Name\nHazard Class\nSubsidiary Hazard Class\nPacking Group\nMercury\n8\nIII\nUN2809\nMercury\n8\n6.1\nIII\nUN2809\nMercury\n8\n6.1\nIII"}