{"GUID":"AkKsEQACHt+fl92lptcowg==","MATNR":"HZ-MAG","MAKTX":"Magnesium","WERKS":"0001","LGORT":"0001","LGOBE":"Lager 0001","SECTION_ID":4,"SECTION_HEADER":"First-aid measures","SECTION_CONTENT":"Eye Contact\nRinse immediately with plenty of water, also under the eyelids, for at least 15 minutes.\nObtain medical attention.\nSkin Contact\nWash off immediately with plenty of water for at least 15 minutes. Obtain medical attention.\nInhalation\nRemove from exposure, lie down. Move to fresh air. If breathing is difficult, give oxygen. If\nnot breathing, give artificial respiration.\nIngestion\nDo not induce vomiting. Get medical attention.\nMost important symptoms/effects\nNo information available.\nNotes to Physician\nTreat symptomatically","REVISED_CONTENT":"Product ID:HZ-MAG,Product Description:Magnesium,Storage Location:0001,Storage Location Description:Lager 0001,Plant:0001,Section Id:4,Section Header:First-aid measures,Section Content:Eye Contact\nRinse immediately with plenty of water, also under the eyelids, for at least 15 minutes.\nObtain medical attention.\nSkin Contact\nWash off immediately with plenty of water for at least 15 minutes. Obtain medical attention.\nInhalation\nRemove from exposure, lie down. Move to fresh air. If breathing is difficult, give oxygen. If\nnot breathing, give artificial respiration.\nIngestion\nDo not induce vomiting. Get medical attention.\nMost important symptoms/effects\nNo information available.\nNotes to Physician\nTreat symptomatically"}