{"GUID":"AkKsEQACHt+fl92lrP2owg==","MATNR":"HZ-URA","MAKTX":"URANIUM - WP","WERKS":"0001","LGORT":"0002","LGOBE":"Cold Storage","SECTION_ID":8,"SECTION_HEADER":"Exposure controls / personal protection","SECTION_CONTENT":"SECTION 8: Exposure controls/personal protection\n8.1 Control parameters\nIngredients with workplace control parameters\nComponent\nCAS-No.\nValue\nControl\nparameters\nBasis\nnitric acid\n7697-37-2\nTWA\n2 ppm\nUSA. ACGIH Threshold Limit\nValues (TLV)\nSTEL\n4 ppm\nUSA. ACGIH Threshold Limit\nValues (TLV)\nST\n4 ppm\nUSA. NIOSH Recommended\n10 mg/m3\nExposure Limits\nTWA\n2 ppm\nUSA. NIOSH Recommended\n5 mg/m3\nExposure Limits\nTWA\n2 ppm\nUSA. Occupational Exposure\n5 mg/m3\nLimits (OSHA) - Table Z-1\nLimits for Air Contaminants\nPEL\n2 ppm\n5 mg/m3\nCalifornia permissible exposure\nlimits for chemical\ncontaminants (Title 8, Article\n107)\nSTEL\n4 ppm\n10 mg/m3\nCalifornia permissible exposure\nlimits for chemical\ncontaminants (Title 8, Article\n107)","REVISED_CONTENT":"Product ID:HZ-URA,Product Description:URANIUM - WP,Storage Location:0002,Storage Location Description:Cold Storage,Plant:0001,Section Id:8,Section Header:Exposure controls / personal protection,Section Content:SECTION 8: Exposure controls/personal protection\n8.1 Control parameters\nIngredients with workplace control parameters\nComponent\nCAS-No.\nValue\nControl\nparameters\nBasis\nnitric acid\n7697-37-2\nTWA\n2 ppm\nUSA. ACGIH Threshold Limit\nValues (TLV)\nSTEL\n4 ppm\nUSA. ACGIH Threshold Limit\nValues (TLV)\nST\n4 ppm\nUSA. NIOSH Recommended\n10 mg/m3\nExposure Limits\nTWA\n2 ppm\nUSA. NIOSH Recommended\n5 mg/m3\nExposure Limits\nTWA\n2 ppm\nUSA. Occupational Exposure\n5 mg/m3\nLimits (OSHA) - Table Z-1\nLimits for Air Contaminants\nPEL\n2 ppm\n5 mg/m3\nCalifornia permissible exposure\nlimits for chemical\ncontaminants (Title 8, Article\n107)\nSTEL\n4 ppm\n10 mg/m3\nCalifornia permissible exposure\nlimits for chemical\ncontaminants (Title 8, Article\n107)"}