{"GUID":"AkKsEQACHt+fl92lrO6Iwg==","MATNR":"HZ-SOH","MAKTX":"Sodium hydroxide","WERKS":"0001","LGORT":"0003","LGOBE":"Corrosive Items","SECTION_ID":15,"SECTION_HEADER":"Regulatory information","SECTION_CONTENT":"All of the components in the product are on the following Inventory lists: X = listed\nInternational Inventories\nX\nX\n215-185-5\nX\nX\nX\nX\nX\nX\nX\nLegend:\nX - Listed\nE - Indicates a substance that is the subject of a Section 5(e) Consent order under TSCA.\nF - Indicates a substance that is the subject of a Section 5(f) Rule under TSCA.\nN - Indicates a polymeric substance containing no free-radical initiator in its inventory name but is considered to cover the designated\npolymer made with any free-radical initiator regardless of the amount used.\nP - Indicates a commenced PMN substance\nR - Indicates a substance that is the subject of a Section 6 risk management rule under TSCA.\nS - Indicates a substance that is identified in a proposed or final Significant New Use Rule\nT - Indicates a substance that is the subject of a Section 4 test rule under TSCA.\nXU - Indicates a substance exempt from reporting under the Inventory Update Rule, i.e. Partial Updating of the TSCA Inventory Data Base\nProduction and Site Reports (40 CFR 710(B)).\nY1 - Indicates an exempt polymer that has a number-average molecular weight of 1,000 or greater.\nY2 - Indicates an exempt polymer that is a polyester and is made only from reactants included in a specified list of low concern reactants\nthat comprises one of the eligibility criteria for the exemption rule.\nU.S. Federal Regulations\nNot applicable\nNot applicable\nSARA 311/312 Hazardous Categorization\nYes\nYes\nNo\nNo\nYes\nClean Water Act\nCWA - Hazardous\nSubstances\nCWA - Reportable\nQuantities\nCWA - Toxic Pollutants CWA - Priority Pollutants","REVISED_CONTENT":"Product ID:HZ-SOH,Product Description:Sodium hydroxide,Storage Location:0003,Storage Location Description:Corrosive Items,Plant:0001,Section Id:15,Section Header:Regulatory information,Section Content:All of the components in the product are on the following Inventory lists: X = listed\nInternational Inventories\nX\nX\n215-185-5\nX\nX\nX\nX\nX\nX\nX\nLegend:\nX - Listed\nE - Indicates a substance that is the subject of a Section 5(e) Consent order under TSCA.\nF - Indicates a substance that is the subject of a Section 5(f) Rule under TSCA.\nN - Indicates a polymeric substance containing no free-radical initiator in its inventory name but is considered to cover the designated\npolymer made with any free-radical initiator regardless of the amount used.\nP - Indicates a commenced PMN substance\nR - Indicates a substance that is the subject of a Section 6 risk management rule under TSCA.\nS - Indicates a substance that is identified in a proposed or final Significant New Use Rule\nT - Indicates a substance that is the subject of a Section 4 test rule under TSCA.\nXU - Indicates a substance exempt from reporting under the Inventory Update Rule, i.e. Partial Updating of the TSCA Inventory Data Base\nProduction and Site Reports (40 CFR 710(B)).\nY1 - Indicates an exempt polymer that has a number-average molecular weight of 1,000 or greater.\nY2 - Indicates an exempt polymer that is a polyester and is made only from reactants included in a specified list of low concern reactants\nthat comprises one of the eligibility criteria for the exemption rule.\nU.S. Federal Regulations\nNot applicable\nNot applicable\nSARA 311/312 Hazardous Categorization\nYes\nYes\nNo\nNo\nYes\nClean Water Act\nCWA - Hazardous\nSubstances\nCWA - Reportable\nQuantities\nCWA - Toxic Pollutants CWA - Priority Pollutants"}