{"GUID":"AkKsEQACHt+fl92lpsyowg==","MATNR":"HZ-HAC","MAKTX":"Hydrochloric acid","WERKS":"0001","LGORT":"0003","LGOBE":"Corrosive Items","SECTION_ID":16,"SECTION_HEADER":"Other information","SECTION_CONTENT":"Prepared By\nCreation Date\nRevision Date\nPrint Date\nRevision Summary\nDisclaimer\nRegulatory Affairs\nThermo Fisher Scientific\nEmail: EMSDS.RA@thermofisher.com\n24-Aug-2009\n02-Apr-2014\n02-Apr-2014\nThis document has been updated to comply with the US OSHA HazCom 2012 Standard\nreplacing the current legislation under 29 CFR 1910.1200 to align with the Globally\nHarmonized System of Classification and Labeling of Chemicals (GHS)\nThe information provided on this Safety Data Sheet is correct to the best of our knowledge, information and belief at the\ndate of its publication. The information given is designed only as a guide for safe handling, use, processing, storage,\ntransportation, disposal and release and is not to be considered as a warranty or quality specification. The information\nrelates only to the specific material designated and may not be valid for such material used in combination with any other\nmaterial or in any process, unless specified in the text.","REVISED_CONTENT":"Product ID:HZ-HAC,Product Description:Hydrochloric acid,Storage Location:0003,Storage Location Description:Corrosive Items,Plant:0001,Section Id:16,Section Header:Other information,Section Content:Prepared By\nCreation Date\nRevision Date\nPrint Date\nRevision Summary\nDisclaimer\nRegulatory Affairs\nThermo Fisher Scientific\nEmail: EMSDS.RA@thermofisher.com\n24-Aug-2009\n02-Apr-2014\n02-Apr-2014\nThis document has been updated to comply with the US OSHA HazCom 2012 Standard\nreplacing the current legislation under 29 CFR 1910.1200 to align with the Globally\nHarmonized System of Classification and Labeling of Chemicals (GHS)\nThe information provided on this Safety Data Sheet is correct to the best of our knowledge, information and belief at the\ndate of its publication. The information given is designed only as a guide for safe handling, use, processing, storage,\ntransportation, disposal and release and is not to be considered as a warranty or quality specification. The information\nrelates only to the specific material designated and may not be valid for such material used in combination with any other\nmaterial or in any process, unless specified in the text."}