{"GUID":"AkKsEQACHt+fl92lptSowg==","MATNR":"HZ-LEA","MAKTX":"Lead","WERKS":"0001","LGORT":"0088","LGOBE":"Lager 0088 (WM)","SECTION_ID":16,"SECTION_HEADER":"Other information","SECTION_CONTENT":"OSHA Occupational Safety and Health Administration\nNot applicable\nComponent\nLead\nSpecifically Regulated Chemicals\n30 µg/m³ Action Level\n50 µg/m³ TWA\nHighly Hazardous Chemicals\nCERCLA\nThis material, as supplied, contains one or more substances regulated as a hazardous substance under the Comprehensive\nEnvironmental Response Compensation and Liability Act (CERCLA) (40 CFR 302)\nComponent\nLead\nHazardous Substances RQs\n10 lb\nCERCLA EHS RQS\nCalifornia Proposition 65\nComponent\nLead\nCAS-No\n7439-92-1\nThis product contains the following Proposition 65 chemicals:\nCalifornia Prop. 65\nCarcinogen\nDevelopmental\nFemale Reproductive\nMale Reproductive\nProp 65 NSRL\n15 µg/day\nCategory\nDevelopmental\nCarcinogen\nState Right-to-Know\nComponent\nLead\nMassachusetts\nX\nNew Jersey\nX\nPennsylvania\nX\nIllinois\nX\nRhode Island\nX\nU.S. Department of Transportation\nReportable Quantity (RQ):\nDOT Marine Pollutant\nDOT Severe Marine Pollutant\nN\nN\nN\nU.S. Department of Homeland Security\nThis product does not contain any DHS chemicals.\nOther International Regulations\nMexico - Grade\nNo information available\nCanada\nThis product has been classified in accordance with the hazard criteria of the Controlled Products Regulations (CPR) and\nthe MSDS contains all the information required by the CPR\nWHMIS Hazard Class\nT\nD1B Toxic materials\nD2A Very toxic materials\nPrepared By\nCreation Date\nRevision Date\nPrint Date\nRegulatory Affairs\nThermo Fisher Scientific\nEmail: EMSDS.RA@thermofisher.com\n11-Nov-2011\n01-Dec-2014\n01-Dec-2014\nRevision Summary\nDisclaimer\nThis document has been updated to comply with the US OSHA HazCom 2012 Standard\nreplacing the current legislation under 29 CFR 1910.1200 to align with the Globally\nHarmonized System of Classification and Labeling of Chemicals (GHS)\nThe information provided on this Safety Data Sheet is correct to the best of our knowledge, information and belief at the\ndate of its publication. The information given is designed only as a guide for safe handling, use, processing, storage,\ntransportation, disposal and release and is not to be considered as a warranty or quality specification. The information\nrelates only to the specific material designated and may not be valid for such material used in combination with any other\nmaterial or in any process, unless specified in the text.\nEnd of SDS","REVISED_CONTENT":"Product ID:HZ-LEA,Product Description:Lead,Storage Location:0088,Storage Location Description:Lager 0088 (WM),Plant:0001,Section Id:16,Section Header:Other information,Section Content:OSHA Occupational Safety and Health Administration\nNot applicable\nComponent\nLead\nSpecifically Regulated Chemicals\n30 µg/m³ Action Level\n50 µg/m³ TWA\nHighly Hazardous Chemicals\nCERCLA\nThis material, as supplied, contains one or more substances regulated as a hazardous substance under the Comprehensive\nEnvironmental Response Compensation and Liability Act (CERCLA) (40 CFR 302)\nComponent\nLead\nHazardous Substances RQs\n10 lb\nCERCLA EHS RQS\nCalifornia Proposition 65\nComponent\nLead\nCAS-No\n7439-92-1\nThis product contains the following Proposition 65 chemicals:\nCalifornia Prop. 65\nCarcinogen\nDevelopmental\nFemale Reproductive\nMale Reproductive\nProp 65 NSRL\n15 µg/day\nCategory\nDevelopmental\nCarcinogen\nState Right-to-Know\nComponent\nLead\nMassachusetts\nX\nNew Jersey\nX\nPennsylvania\nX\nIllinois\nX\nRhode Island\nX\nU.S. Department of Transportation\nReportable Quantity (RQ):\nDOT Marine Pollutant\nDOT Severe Marine Pollutant\nN\nN\nN\nU.S. Department of Homeland Security\nThis product does not contain any DHS chemicals.\nOther International Regulations\nMexico - Grade\nNo information available\nCanada\nThis product has been classified in accordance with the hazard criteria of the Controlled Products Regulations (CPR) and\nthe MSDS contains all the information required by the CPR\nWHMIS Hazard Class\nT\nD1B Toxic materials\nD2A Very toxic materials\nPrepared By\nCreation Date\nRevision Date\nPrint Date\nRegulatory Affairs\nThermo Fisher Scientific\nEmail: EMSDS.RA@thermofisher.com\n11-Nov-2011\n01-Dec-2014\n01-Dec-2014\nRevision Summary\nDisclaimer\nThis document has been updated to comply with the US OSHA HazCom 2012 Standard\nreplacing the current legislation under 29 CFR 1910.1200 to align with the Globally\nHarmonized System of Classification and Labeling of Chemicals (GHS)\nThe information provided on this Safety Data Sheet is correct to the best of our knowledge, information and belief at the\ndate of its publication. The information given is designed only as a guide for safe handling, use, processing, storage,\ntransportation, disposal and release and is not to be considered as a warranty or quality specification. The information\nrelates only to the specific material designated and may not be valid for such material used in combination with any other\nmaterial or in any process, unless specified in the text.\nEnd of SDS"}