{"GUID":"AkKsEQACHt+fl92lrOLIwg==","MATNR":"HZ-POH","MAKTX":"Potassium hydroxide","WERKS":"0001","LGORT":"0003","LGOBE":"Corrosive Items","SECTION_ID":1,"SECTION_HEADER":"Identification","SECTION_CONTENT":"Product identifier: Potassium Hydroxide\nOther means of identification\nSynonyms:\nCaustic Potash, Potassium Hydrate\nProduct No.:\n3116, 3140, 3141, 3146, 3150, 3152, 3794, 6598, 6976, 6984,\n7815\nRecommended restrictions\nRecommended use: For Laboratory, Research or Manufacturing Use.\nRestrictions on use: Not determined.\nDetails of the supplier of the safety data sheet\nCompany Name:\nAvantor Performance Materials, LLC\nAddress:\n100 Matsonford Rd, Suite 200\nRadnor, PA 19087\nTelephone:\nCustomer Service: 855-282-6867\nContact Person:\nProduct Information Compliance\nE-mail:\ninfo@avantormaterials.com\nEmergency telephone number:\nCHEMTREC: 1-800-424-9300 within US and Canada","REVISED_CONTENT":"Product ID:HZ-POH,Product Description:Potassium hydroxide,Storage Location:0003,Storage Location Description:Corrosive Items,Plant:0001,Section Id:1,Section Header:Identification,Section Content:Product identifier: Potassium Hydroxide\nOther means of identification\nSynonyms:\nCaustic Potash, Potassium Hydrate\nProduct No.:\n3116, 3140, 3141, 3146, 3150, 3152, 3794, 6598, 6976, 6984,\n7815\nRecommended restrictions\nRecommended use: For Laboratory, Research or Manufacturing Use.\nRestrictions on use: Not determined.\nDetails of the supplier of the safety data sheet\nCompany Name:\nAvantor Performance Materials, LLC\nAddress:\n100 Matsonford Rd, Suite 200\nRadnor, PA 19087\nTelephone:\nCustomer Service: 855-282-6867\nContact Person:\nProduct Information Compliance\nE-mail:\ninfo@avantormaterials.com\nEmergency telephone number:\nCHEMTREC: 1-800-424-9300 within US and Canada"}