{"GUID":"AkKsEQACHt+fl92lpt8owg==","MATNR":"HZ-MET","MAKTX":"Methane","WERKS":"0001","LGORT":"0001","LGOBE":"Lager 0001","SECTION_ID":4,"SECTION_HEADER":"First-aid measures","SECTION_CONTENT":"Description of necessary first aid measures\nEye contact : Immediately flush eyes with plenty of water, occasionally lifting the upper and lower\neyelids. Check for and remove any contact lenses. Continue to rinse for at least 10\nminutes. Get medical attention if irritation occurs.\nInhalation : Remove victim to fresh air and keep at rest in a position comfortable for breathing. If\nnot breathing, if breathing is irregular or if respiratory arrest occurs, provide artificial\nrespiration or oxygen by trained personnel. It may be dangerous to the person providing\naid to give mouth-to-mouth resuscitation. Get medical attention if adverse health effects\npersist or are severe. If unconscious, place in recovery position and get medical\nattention immediately. Maintain an open airway. Loosen tight clothing such as a collar,\ntie, belt or waistband.\nSkin contact : Wash contaminated skin with soap and water. Remove contaminated clothing and\nshoes. To avoid the risk of static discharges and gas ignition, soak contaminated\nclothing thoroughly with water before removing it. Get medical attention if symptoms\noccur. Wash clothing before reuse. Clean shoes thoroughly before reuse.\nIngestion : As this product is a gas, refer to the inhalation section.","REVISED_CONTENT":"Product ID:HZ-MET,Product Description:Methane,Storage Location:0001,Storage Location Description:Lager 0001,Plant:0001,Section Id:4,Section Header:First-aid measures,Section Content:Description of necessary first aid measures\nEye contact : Immediately flush eyes with plenty of water, occasionally lifting the upper and lower\neyelids. Check for and remove any contact lenses. Continue to rinse for at least 10\nminutes. Get medical attention if irritation occurs.\nInhalation : Remove victim to fresh air and keep at rest in a position comfortable for breathing. If\nnot breathing, if breathing is irregular or if respiratory arrest occurs, provide artificial\nrespiration or oxygen by trained personnel. It may be dangerous to the person providing\naid to give mouth-to-mouth resuscitation. Get medical attention if adverse health effects\npersist or are severe. If unconscious, place in recovery position and get medical\nattention immediately. Maintain an open airway. Loosen tight clothing such as a collar,\ntie, belt or waistband.\nSkin contact : Wash contaminated skin with soap and water. Remove contaminated clothing and\nshoes. To avoid the risk of static discharges and gas ignition, soak contaminated\nclothing thoroughly with water before removing it. Get medical attention if symptoms\noccur. Wash clothing before reuse. Clean shoes thoroughly before reuse.\nIngestion : As this product is a gas, refer to the inhalation section."}