{"GUID":"AkKsEQACHt+fl92lrOmowg==","MATNR":"HZ-SAC","MAKTX":"Sulfuric acid","WERKS":"0001","LGORT":"0003","LGOBE":"Corrosive Items","SECTION_ID":8,"SECTION_HEADER":"Exposure controls / personal protection","SECTION_CONTENT":"Component Sulfuric acid ACGIH TLV TWA: 0.2 mg/m³ OSHA PEL (Vacated) TWA: 1 mg/m³ NIOSH IDLH IDLH: 15 mg/m³ TWA: 1 mg/m³ Component Sulfuric acid Quebec TWA: 1 mg/m³ STEL: 3 mg/m³ Mexico OEL (TWA) TWA: 1 mg/m³ Ontario TWAEV TWA: 0.2 mg/m³ Legend ACGIH - American Conference of Governmental Industrial Hygienists OSHA - Occupational Safety and Health Administration NIOSH IDLH: The National Institute for Occupational Safety and Health Immediately Dangerous to Life or Health Engineering Measures Use only under a chemical fume hood. Ensure that eyewash stations and safety showers are close to the workstation location. Ensure adequate ventilation, especially in confined areas. Personal Protective Equipment","REVISED_CONTENT":"Product ID:HZ-SAC,Product Description:Sulfuric acid,Storage Location:0003,Storage Location Description:Corrosive Items,Plant:0001,Section Id:8,Section Header:Exposure controls / personal protection,Section Content:Component Sulfuric acid ACGIH TLV TWA: 0.2 mg/m³ OSHA PEL (Vacated) TWA: 1 mg/m³ NIOSH IDLH IDLH: 15 mg/m³ TWA: 1 mg/m³ Component Sulfuric acid Quebec TWA: 1 mg/m³ STEL: 3 mg/m³ Mexico OEL (TWA) TWA: 1 mg/m³ Ontario TWAEV TWA: 0.2 mg/m³ Legend ACGIH - American Conference of Governmental Industrial Hygienists OSHA - Occupational Safety and Health Administration NIOSH IDLH: The National Institute for Occupational Safety and Health Immediately Dangerous to Life or Health Engineering Measures Use only under a chemical fume hood. Ensure that eyewash stations and safety showers are close to the workstation location. Ensure adequate ventilation, especially in confined areas. Personal Protective Equipment"}