{"GUID":"AkKsEQACHt+fl92lrOYIwg==","MATNR":"HZ-PPM","MAKTX":"Potassium permanganate","WERKS":"0001","LGORT":"0088","LGOBE":"Lager 0088 (WM)","SECTION_ID":11,"SECTION_HEADER":"Toxicological information","SECTION_CONTENT":"Category 4.\nLD50 Oral\nLD50 = 750 mg/kg (Rat)\nLD50 Dermal\nLD50 > 2000 mg/kg (Rat)\nLC50 Inhalation\nNot listed\nNo information available\nCauses severe irritation and or burns\nNo information available\nThe table below indicates whether each agency has listed any ingredient as a carcinogen.\nComponent\nPotassium\npermanganate\nCAS No\n7722-64-7\nIARC\nNot listed\nNTP\nNot listed\nACGIH\nNot listed\nOSHA\nNot listed\nMexico\nNot listed\nNo information available\nPossible risk of harm to the unborn child.\nNo information available.\nNo information available.\nRespiratory system Central nervous system (CNS)\nBrain\nNo information available\nProduct is a corrosive material. Use of gastric lavage or emesis is contraindicated.\nPossible perforation of stomach or esophagus should be investigated: Ingestion causes\nsevere swelling, severe damage to the delicate tissue and danger of perforation\nNo information available\nThe toxicological properties have not been fully investigated.","REVISED_CONTENT":"Product ID:HZ-PPM,Product Description:Potassium permanganate,Storage Location:0088,Storage Location Description:Lager 0088 (WM),Plant:0001,Section Id:11,Section Header:Toxicological information,Section Content:Category 4.\nLD50 Oral\nLD50 = 750 mg/kg (Rat)\nLD50 Dermal\nLD50 > 2000 mg/kg (Rat)\nLC50 Inhalation\nNot listed\nNo information available\nCauses severe irritation and or burns\nNo information available\nThe table below indicates whether each agency has listed any ingredient as a carcinogen.\nComponent\nPotassium\npermanganate\nCAS No\n7722-64-7\nIARC\nNot listed\nNTP\nNot listed\nACGIH\nNot listed\nOSHA\nNot listed\nMexico\nNot listed\nNo information available\nPossible risk of harm to the unborn child.\nNo information available.\nNo information available.\nRespiratory system Central nervous system (CNS)\nBrain\nNo information available\nProduct is a corrosive material. Use of gastric lavage or emesis is contraindicated.\nPossible perforation of stomach or esophagus should be investigated: Ingestion causes\nsevere swelling, severe damage to the delicate tissue and danger of perforation\nNo information available\nThe toxicological properties have not been fully investigated."}