{"GUID":"AkKsEQACHt+fl92loS8owg==","MATNR":"HZ-ACE","MAKTX":"Acetone","WERKS":"0001","LGORT":"0001","LGOBE":"Lager 0001","SECTION_ID":2,"SECTION_HEADER":"Hazard(s) identification","SECTION_CONTENT":"Classification\nThis chemical is considered hazardous by the 2012 OSHA Hazard Communication Standard (29 CFR 1910.1200)\nFlammable liquids Category 2\nSerious Eye Damage/Eye Irritation Category 2\nSpecific target organ toxicity (single exposure) Category 3\nTarget Organs - Central nervous system (CNS).\nSpecific target organ toxicity - (repeated exposure) Category 2\nTarget Organs - Kidney, Liver, spleen, Blood.\nLabel Elements\nSignal Word Danger\nHazard Statements\nHighly flammable liquid and vapor\nCauses serious eye irritation\nMay cause drowsiness or dizziness\nMay cause damage to organs through prolonged or repeated exposure","REVISED_CONTENT":"Product ID:HZ-ACE,Product Description:Acetone,Storage Location:0001,Storage Location Description:Lager 0001,Plant:0001,Section Id:2,Section Header:Hazard(s) identification,Section Content:Classification\nThis chemical is considered hazardous by the 2012 OSHA Hazard Communication Standard (29 CFR 1910.1200)\nFlammable liquids Category 2\nSerious Eye Damage/Eye Irritation Category 2\nSpecific target organ toxicity (single exposure) Category 3\nTarget Organs - Central nervous system (CNS).\nSpecific target organ toxicity - (repeated exposure) Category 2\nTarget Organs - Kidney, Liver, spleen, Blood.\nLabel Elements\nSignal Word Danger\nHazard Statements\nHighly flammable liquid and vapor\nCauses serious eye irritation\nMay cause drowsiness or dizziness\nMay cause damage to organs through prolonged or repeated exposure"}