{"GUID":"AkKsEQACHt+fl92lrPVowg==","MATNR":"HZ-TNT","MAKTX":"TNT","WERKS":"0001","LGORT":"0002","LGOBE":"Cold Storage","SECTION_ID":6,"SECTION_HEADER":"Accidental release measures","SECTION_CONTENT":"• Personal precautions, protective equipment and emergency procedures\nMount respiratory protective device.\nWear protective equipment. Keep unprotected persons away.\nEnvironmental precautions: Do not allow to enter sewers/ surface or ground water.\n• Methods and material for containment and cleaning up:\nAbsorb with liquid-binding material (sand, diatomite, acid binders, universal binders, sawdust).\nDispose contaminated material as waste according to item 13.","REVISED_CONTENT":"Product ID:HZ-TNT,Product Description:TNT,Storage Location:0002,Storage Location Description:Cold Storage,Plant:0001,Section Id:6,Section Header:Accidental release measures,Section Content:• Personal precautions, protective equipment and emergency procedures\nMount respiratory protective device.\nWear protective equipment. Keep unprotected persons away.\nEnvironmental precautions: Do not allow to enter sewers/ surface or ground water.\n• Methods and material for containment and cleaning up:\nAbsorb with liquid-binding material (sand, diatomite, acid binders, universal binders, sawdust).\nDispose contaminated material as waste according to item 13."}