{"GUID":"AkKsEQACHt+fl92lpuAIwg==","MATNR":"HZ-MET","MAKTX":"Methane","WERKS":"0001","LGORT":"0001","LGOBE":"Lager 0001","SECTION_ID":11,"SECTION_HEADER":"Toxicological information","SECTION_CONTENT":"Information on toxicological effects\nAcute toxicity\nNot available.\nIrritation/Corrosion\nNot available.\nSensitization\nNot available.\nMutagenicity\nNot available.\nCarcinogenicity\nNot available.\nReproductive toxicity\nNot available.\nTeratogenicity\nNot available.\nSpecific target organ toxicity (single exposure)\nNot available.\nSpecific target organ toxicity (repeated exposure)\nNot available.\nAspiration hazard\nNot available.\nInformation on the likely\nroutes of exposure\nPotential acute health effects\nEye contact\nInhalation : Not available.\n: Contact with rapidly expanding gas may cause burns or frostbite.\n: No known significant effects or critical hazards.","REVISED_CONTENT":"Product ID:HZ-MET,Product Description:Methane,Storage Location:0001,Storage Location Description:Lager 0001,Plant:0001,Section Id:11,Section Header:Toxicological information,Section Content:Information on toxicological effects\nAcute toxicity\nNot available.\nIrritation/Corrosion\nNot available.\nSensitization\nNot available.\nMutagenicity\nNot available.\nCarcinogenicity\nNot available.\nReproductive toxicity\nNot available.\nTeratogenicity\nNot available.\nSpecific target organ toxicity (single exposure)\nNot available.\nSpecific target organ toxicity (repeated exposure)\nNot available.\nAspiration hazard\nNot available.\nInformation on the likely\nroutes of exposure\nPotential acute health effects\nEye contact\nInhalation : Not available.\n: Contact with rapidly expanding gas may cause burns or frostbite.\n: No known significant effects or critical hazards."}