{"GUID":"AkKsEQACHt+fl92lpuIowg==","MATNR":"HZ-NAC","MAKTX":"Nitric acid","WERKS":"0001","LGORT":"0003","LGOBE":"Corrosive Items","SECTION_ID":12,"SECTION_HEADER":"Ecological information","SECTION_CONTENT":"Ecotoxicity effects\nToxicity to fish : Note: no data available\nToxicity to daphnia and other\naquatic invertebrates : Note: no data available\nToxicity to algae : Note: no data available\nElimination information (persistence and degradability)\nBiodegradability : Note: Not applicable\nThe methods for determining biodegradability are not\napplicable to inorganic substances.\nFurther information on ecology\nEcotoxicology Assessment\nResults of PBT assessment : Not applicable\nAdditional ecological\ninformation : Neutralisation will reduce ecotoxic effects.","REVISED_CONTENT":"Product ID:HZ-NAC,Product Description:Nitric acid,Storage Location:0003,Storage Location Description:Corrosive Items,Plant:0001,Section Id:12,Section Header:Ecological information,Section Content:Ecotoxicity effects\nToxicity to fish : Note: no data available\nToxicity to daphnia and other\naquatic invertebrates : Note: no data available\nToxicity to algae : Note: no data available\nElimination information (persistence and degradability)\nBiodegradability : Note: Not applicable\nThe methods for determining biodegradability are not\napplicable to inorganic substances.\nFurther information on ecology\nEcotoxicology Assessment\nResults of PBT assessment : Not applicable\nAdditional ecological\ninformation : Neutralisation will reduce ecotoxic effects."}