{"GUID":"AkKsEQACHt+fl92lrOnIwg==","MATNR":"HZ-SAC","MAKTX":"Sulfuric acid","WERKS":"0001","LGORT":"0003","LGOBE":"Corrosive Items","SECTION_ID":9,"SECTION_HEADER":"Physical and chemical properties","SECTION_CONTENT":"Physical State Liquid Appearance Colorless Odor Odorless Odor Threshold No information available pH 1 1N aq.sol Melting Point/Range 10 °C / 50 °F Boiling Point/Range 290 °C / 554 °F Flash Point No information available Evaporation Rate No information available Flammability (solid,gas) Not applicable Flammability or explosive limits Upper No data available Lower No data available Vapor Pressure 1 mmHg @ 146 °C Vapor Density No information available Relative Density 1.840 Solubility No information available Partition coefficient; n-octanol/water No data available Autoignition Temperature No information available Decomposition temperature 340 °C Viscosity 21mPa.s @ 25 °C Molecular Formula H2 O4 S Molecular Weight 98.07","REVISED_CONTENT":"Product ID:HZ-SAC,Product Description:Sulfuric acid,Storage Location:0003,Storage Location Description:Corrosive Items,Plant:0001,Section Id:9,Section Header:Physical and chemical properties,Section Content:Physical State Liquid Appearance Colorless Odor Odorless Odor Threshold No information available pH 1 1N aq.sol Melting Point/Range 10 °C / 50 °F Boiling Point/Range 290 °C / 554 °F Flash Point No information available Evaporation Rate No information available Flammability (solid,gas) Not applicable Flammability or explosive limits Upper No data available Lower No data available Vapor Pressure 1 mmHg @ 146 °C Vapor Density No information available Relative Density 1.840 Solubility No information available Partition coefficient; n-octanol/water No data available Autoignition Temperature No information available Decomposition temperature 340 °C Viscosity 21mPa.s @ 25 °C Molecular Formula H2 O4 S Molecular Weight 98.07"}