{"GUID":"AkKsEQACHt+fl92lpufowg==","MATNR":"HZ-PHO","MAKTX":"Phosphorus","WERKS":"0001","LGORT":"0088","LGOBE":"Lager 0088 (WM)","SECTION_ID":10,"SECTION_HEADER":"Stability and reactivity","SECTION_CONTENT":"10.1. Reactivity\nNone known, based on information available\n10.2. Chemical stability\nStable under normal conditions\n10.3. Possibility of hazardous reactions\nNo information available.\n10.4. Conditions to avoid\nExcess heat. Incompatible products.\n10.5. Incompatible materials\nBases. Strong reducing agents. Metals. Finely powdered metals. Organic materials.\n10.6. Hazardous decomposition products\nCarbon monoxide (CO). Carbon dioxide (CO2). Sulfur oxides.","REVISED_CONTENT":"Product ID:HZ-PHO,Product Description:Phosphorus,Storage Location:0088,Storage Location Description:Lager 0088 (WM),Plant:0001,Section Id:10,Section Header:Stability and reactivity,Section Content:10.1. Reactivity\nNone known, based on information available\n10.2. Chemical stability\nStable under normal conditions\n10.3. Possibility of hazardous reactions\nNo information available.\n10.4. Conditions to avoid\nExcess heat. Incompatible products.\n10.5. Incompatible materials\nBases. Strong reducing agents. Metals. Finely powdered metals. Organic materials.\n10.6. Hazardous decomposition products\nCarbon monoxide (CO). Carbon dioxide (CO2). Sulfur oxides."}