{"GUID":"AkKsEQACHt+fl92lrPmIwg==","MATNR":"HZ-TOL","MAKTX":"Toluene","WERKS":"0001","LGORT":"0001","LGOBE":"Lager 0001","SECTION_ID":7,"SECTION_HEADER":"Handling and storage","SECTION_CONTENT":"Wear personal protective equipment/face protection. Do not get in eyes, on skin, or on\nclothing. Avoid ingestion and inhalation. Ensure adequate ventilation. Keep away from open\nflames, hot surfaces and sources of ignition. Use only non-sparking tools. To avoid ignition\nof vapors by static electricity discharge, all metal parts of the equipment must be grounded.\nTake precautionary measures against static discharges.\nKeep containers tightly closed in a dry, cool and well-ventilated place. Flammables area.\nKeep away from heat, sparks and flame. Incompatible Materials. Strong oxidizing agents.\nStrong acids. Strong bases. Halogenated compounds.","REVISED_CONTENT":"Product ID:HZ-TOL,Product Description:Toluene,Storage Location:0001,Storage Location Description:Lager 0001,Plant:0001,Section Id:7,Section Header:Handling and storage,Section Content:Wear personal protective equipment/face protection. Do not get in eyes, on skin, or on\nclothing. Avoid ingestion and inhalation. Ensure adequate ventilation. Keep away from open\nflames, hot surfaces and sources of ignition. Use only non-sparking tools. To avoid ignition\nof vapors by static electricity discharge, all metal parts of the equipment must be grounded.\nTake precautionary measures against static discharges.\nKeep containers tightly closed in a dry, cool and well-ventilated place. Flammables area.\nKeep away from heat, sparks and flame. Incompatible Materials. Strong oxidizing agents.\nStrong acids. Strong bases. Halogenated compounds."}