{"GUID":"AkKsEQACHt+fl92lpsrowg==","MATNR":"HZ-HAC","MAKTX":"Hydrochloric acid","WERKS":"0001","LGORT":"0003","LGOBE":"Corrosive Items","SECTION_ID":2,"SECTION_HEADER":"Hazard(s) identification","SECTION_CONTENT":"Classification\nThis chemical is considered hazardous by the 2012 OSHA Hazard Communication Standard (29 CFR 1910.1200)\nCorrosive to metals\nSkin Corrosion/irritation\nSerious Eye Damage/Eye Irritation\nSpecific target organ toxicity (single exposure)\nTarget Organs - Respiratory system.\nSpecific target organ toxicity - (repeated exposure)\nTarget Organs - Kidney, Liver.\nLabel Elements\nSignal Word\nDanger\nHazard Statements\nMay be corrosive to metals\nCauses severe skin burns and eye damage\nMay cause respiratory irritation\nMay cause damage to organs through prolonged or repeated exposure","REVISED_CONTENT":"Product ID:HZ-HAC,Product Description:Hydrochloric acid,Storage Location:0003,Storage Location Description:Corrosive Items,Plant:0001,Section Id:2,Section Header:Hazard(s) identification,Section Content:Classification\nThis chemical is considered hazardous by the 2012 OSHA Hazard Communication Standard (29 CFR 1910.1200)\nCorrosive to metals\nSkin Corrosion/irritation\nSerious Eye Damage/Eye Irritation\nSpecific target organ toxicity (single exposure)\nTarget Organs - Respiratory system.\nSpecific target organ toxicity - (repeated exposure)\nTarget Organs - Kidney, Liver.\nLabel Elements\nSignal Word\nDanger\nHazard Statements\nMay be corrosive to metals\nCauses severe skin burns and eye damage\nMay cause respiratory irritation\nMay cause damage to organs through prolonged or repeated exposure"}