{"GUID":"AkKsEQACHt+fl92lptdIwg==","MATNR":"HZ-MAG","MAKTX":"Magnesium","WERKS":"0001","LGORT":"0001","LGOBE":"Lager 0001","SECTION_ID":5,"SECTION_HEADER":"Fire-fighting measures","SECTION_CONTENT":"Suitable Extinguishing Media\nDry chemical. approved class D extinguishers. clay. sodium carbonate. Do not use a solid\nwater stream as it may scatter and spread fire.\nUnsuitable Extinguishing Media\nNo information available\nFlash Point\n500 °C / 932 °F\nMethod -\nNo information available\nAutoignition Temperature\n472.8 °C / 883 °F\nExplosion Limits\nUpper\nNo data available\nLower\nNo data available\nSensitivity to Mechanical Impact No information available","REVISED_CONTENT":"Product ID:HZ-MAG,Product Description:Magnesium,Storage Location:0001,Storage Location Description:Lager 0001,Plant:0001,Section Id:5,Section Header:Fire-fighting measures,Section Content:Suitable Extinguishing Media\nDry chemical. approved class D extinguishers. clay. sodium carbonate. Do not use a solid\nwater stream as it may scatter and spread fire.\nUnsuitable Extinguishing Media\nNo information available\nFlash Point\n500 °C / 932 °F\nMethod -\nNo information available\nAutoignition Temperature\n472.8 °C / 883 °F\nExplosion Limits\nUpper\nNo data available\nLower\nNo data available\nSensitivity to Mechanical Impact No information available"}