{"GUID":"AkKsEQACHt+fl92lrOIIwg==","MATNR":"HZ-PLU","MAKTX":"Plutonium nitrate","WERKS":"0001","LGORT":"0088","LGOBE":"Lager 0088 (WM)","SECTION_ID":11,"SECTION_HEADER":"Toxicological information","SECTION_CONTENT":"PLUTONIUM NITRATE:\nCARCINOGEN STATUS – None as a chemical. However, exposure to ionizing radiation may\ncause cancer and plutonium may be carcinogenic when internally deposited.\nACUTE TOXICITY LEVEL - No data available.\nTARGET EFFECTS - Plutonium in the body most often accumulates in the lungs, lymph nodes,\nliver and skeleton. Lesser, yet significant quantities may also be found in the gonads, spleen, and","REVISED_CONTENT":"Product ID:HZ-PLU,Product Description:Plutonium nitrate,Storage Location:0088,Storage Location Description:Lager 0088 (WM),Plant:0001,Section Id:11,Section Header:Toxicological information,Section Content:PLUTONIUM NITRATE:\nCARCINOGEN STATUS – None as a chemical. However, exposure to ionizing radiation may\ncause cancer and plutonium may be carcinogenic when internally deposited.\nACUTE TOXICITY LEVEL - No data available.\nTARGET EFFECTS - Plutonium in the body most often accumulates in the lungs, lymph nodes,\nliver and skeleton. Lesser, yet significant quantities may also be found in the gonads, spleen, and"}