{"GUID":"AkKsEQACHt+fl92lrOWowg==","MATNR":"HZ-PPM","MAKTX":"Potassium permanganate","WERKS":"0001","LGORT":"0088","LGOBE":"Lager 0088 (WM)","SECTION_ID":8,"SECTION_HEADER":"Exposure controls / personal protection","SECTION_CONTENT":"Component\nPotassium permanganate\nACGIH TLV\nTWA: 0.02 mg/m³\nTWA: 0.1 mg/m³\nOSHA PEL\n(Vacated) Ceiling: 5 mg/m³\nCeiling: 5 mg/m³\nNIOSH IDLH\nIDLH: 500 mg/m³\nTWA: 1 mg/m³\nSTEL: 3 mg/m³\nMexico OEL (TWA)\nTWA: 0.2 mg/m³\nLegend\nACGIH - American Conference of Governmental Industrial Hygienists\nOSHA - Occupational Safety and Health Administration\nNIOSH IDLH: NIOSH - National Institute for Occupational Safety and Health\nEngineering Measures\nEnsure that eyewash stations and safety showers are close to the workstation location.\nPersonal Protective Equipment\nEnsure adequate ventilation, especially in confined areas.\nEye/face Protection\nWear appropriate protective eyeglasses or chemical safety goggles as described by\nOSHA's eye and face protection regulations in 29 CFR 1910.133 or European Standard\nEN166.\nSkin and body protection\nWear appropriate protective gloves and clothing to prevent skin exposure.\nRespiratory Protection\nFollow the OSHA respirator regulations found in 29 CFR 1910.134 or European Standard\nEN 149. Use a NIOSH/MSHA or European Standard EN 149 approved respirator if\nexposure limits are exceeded or if irritation or other symptoms are experienced.\nHygiene Measures\nHandle in accordance with good industrial hygiene and safety practice.","REVISED_CONTENT":"Product ID:HZ-PPM,Product Description:Potassium permanganate,Storage Location:0088,Storage Location Description:Lager 0088 (WM),Plant:0001,Section Id:8,Section Header:Exposure controls / personal protection,Section Content:Component\nPotassium permanganate\nACGIH TLV\nTWA: 0.02 mg/m³\nTWA: 0.1 mg/m³\nOSHA PEL\n(Vacated) Ceiling: 5 mg/m³\nCeiling: 5 mg/m³\nNIOSH IDLH\nIDLH: 500 mg/m³\nTWA: 1 mg/m³\nSTEL: 3 mg/m³\nMexico OEL (TWA)\nTWA: 0.2 mg/m³\nLegend\nACGIH - American Conference of Governmental Industrial Hygienists\nOSHA - Occupational Safety and Health Administration\nNIOSH IDLH: NIOSH - National Institute for Occupational Safety and Health\nEngineering Measures\nEnsure that eyewash stations and safety showers are close to the workstation location.\nPersonal Protective Equipment\nEnsure adequate ventilation, especially in confined areas.\nEye/face Protection\nWear appropriate protective eyeglasses or chemical safety goggles as described by\nOSHA's eye and face protection regulations in 29 CFR 1910.133 or European Standard\nEN166.\nSkin and body protection\nWear appropriate protective gloves and clothing to prevent skin exposure.\nRespiratory Protection\nFollow the OSHA respirator regulations found in 29 CFR 1910.134 or European Standard\nEN 149. Use a NIOSH/MSHA or European Standard EN 149 approved respirator if\nexposure limits are exceeded or if irritation or other symptoms are experienced.\nHygiene Measures\nHandle in accordance with good industrial hygiene and safety practice."}