{"GUID":"AkKsEQACHt+fl92loTaIwg==","MATNR":"HZ-BUT","MAKTX":"Butane","WERKS":"0001","LGORT":"0001","LGOBE":"Lager 0001","SECTION_ID":13,"SECTION_HEADER":"Disposal considerations","SECTION_CONTENT":"SECTION 13: Disposal considerations\n13.1 Waste treatment methods\nProduct\nWaste material must be disposed of in accordance with the national and local regulations.\nLeave chemicals in original containers. No mixing with other waste. Handle uncleaned\ncontainers like the product itself. Pressurised gas bottle: dispose of only in empty\ncondition! See www.retrologistik.com for processes regarding the return of chemicals and\ncontainers, or contact us there if you have further questions.","REVISED_CONTENT":"Product ID:HZ-BUT,Product Description:Butane,Storage Location:0001,Storage Location Description:Lager 0001,Plant:0001,Section Id:13,Section Header:Disposal considerations,Section Content:SECTION 13: Disposal considerations\n13.1 Waste treatment methods\nProduct\nWaste material must be disposed of in accordance with the national and local regulations.\nLeave chemicals in original containers. No mixing with other waste. Handle uncleaned\ncontainers like the product itself. Pressurised gas bottle: dispose of only in empty\ncondition! See www.retrologistik.com for processes regarding the return of chemicals and\ncontainers, or contact us there if you have further questions."}