{"GUID":"AkKsEQACHt+fl92lptNIwg==","MATNR":"HZ-LEA","MAKTX":"Lead","WERKS":"0001","LGORT":"0088","LGOBE":"Lager 0088 (WM)","SECTION_ID":5,"SECTION_HEADER":"Fire-fighting measures","SECTION_CONTENT":"Suitable Extinguishing Media\nUnsuitable Extinguishing Media\nFlash Point\nMethod -\nAutoignition Temperature\nExplosion Limits\nUpper\nLower\nSensitivity to Mechanical Impact\nSensitivity to Static Discharge\nSpecific Hazards Arising from the Chemical\nHazardous Combustion Products\nProtective Equipment and Precautions for Firefighters\nNFPA\nUse extinguishing measures that are appropriate to local circumstances and the\nsurrounding environment.\nNo information available\nNo information available\nNo information available\nNo information available\nNo information available\nNo data available\nNo data available\nNo information available\nNo information available\nNon-combustible.\nlead oxides lead\nAs in any fire, wear self-contained breathing apparatus pressure-demand, MSHA/NIOSH (approved or equivalent) and full\nprotective gear.\nHealth\n2\nFlammability\n0\nInstability\n0\nPhysical hazards\nN/A","REVISED_CONTENT":"Product ID:HZ-LEA,Product Description:Lead,Storage Location:0088,Storage Location Description:Lager 0088 (WM),Plant:0001,Section Id:5,Section Header:Fire-fighting measures,Section Content:Suitable Extinguishing Media\nUnsuitable Extinguishing Media\nFlash Point\nMethod -\nAutoignition Temperature\nExplosion Limits\nUpper\nLower\nSensitivity to Mechanical Impact\nSensitivity to Static Discharge\nSpecific Hazards Arising from the Chemical\nHazardous Combustion Products\nProtective Equipment and Precautions for Firefighters\nNFPA\nUse extinguishing measures that are appropriate to local circumstances and the\nsurrounding environment.\nNo information available\nNo information available\nNo information available\nNo information available\nNo information available\nNo data available\nNo data available\nNo information available\nNo information available\nNon-combustible.\nlead oxides lead\nAs in any fire, wear self-contained breathing apparatus pressure-demand, MSHA/NIOSH (approved or equivalent) and full\nprotective gear.\nHealth\n2\nFlammability\n0\nInstability\n0\nPhysical hazards\nN/A"}