{"GUID":"AkKsEQACHt+fl92lrPNowg==","MATNR":"HZ-SUL","MAKTX":"Sulfur","WERKS":"0001","LGORT":"0001","LGOBE":"Lager 0001","SECTION_ID":6,"SECTION_HEADER":"Accidental release measures","SECTION_CONTENT":"6.1.\nPersonal Precautions, Protective Equipment and Emergency Procedures\nGeneral Measures: Use special care to avoid static electric charges. Keep away from heat, sparks, open flames, hot surfaces. – No\nsmoking. Avoid generating dust. Do not allow product to spread into the environment. Avoid all contact with skin, eyes, or clothing.\nAvoid breathing dust.\n6.1.1.\nFor Non-Emergency Personnel\nProtective Equipment: Use appropriate personal protective equipment (PPE).\nEmergency Procedures: Evacuate unnecessary personnel.\n6.1.2.\nFor Emergency Personnel\nProtective Equipment: Equip cleanup crew with proper protection.\nEmergency Procedures: Ventilate area.\n6.2.\nEnvironmental Precautions\nPrevent entry to sewers and public waters. Avoid release to the environment.\n6.3.\nMethods and Materials for Containment and Cleaning Up\nFor Containment: Contain any spills with dikes or absorbents to prevent migration and entry into sewers or streams.\nMethods for Cleaning Up: Clean up spills immediately and dispose of waste safely. Eliminate all ignition sources. In case of fire: Stop\nleak if safe to do so. If melted: allow liquid to solidify before taking it up. Take up mechanically (sweeping, shoveling) and collect in\nsuitable container for disposal. Use only non-sparking tools.\n6.4. Reference to Other Sections\nSee Section 8, Exposure Controls and Personal Protection. See Section 13, Disposal Considerations.","REVISED_CONTENT":"Product ID:HZ-SUL,Product Description:Sulfur,Storage Location:0001,Storage Location Description:Lager 0001,Plant:0001,Section Id:6,Section Header:Accidental release measures,Section Content:6.1.\nPersonal Precautions, Protective Equipment and Emergency Procedures\nGeneral Measures: Use special care to avoid static electric charges. Keep away from heat, sparks, open flames, hot surfaces. – No\nsmoking. Avoid generating dust. Do not allow product to spread into the environment. Avoid all contact with skin, eyes, or clothing.\nAvoid breathing dust.\n6.1.1.\nFor Non-Emergency Personnel\nProtective Equipment: Use appropriate personal protective equipment (PPE).\nEmergency Procedures: Evacuate unnecessary personnel.\n6.1.2.\nFor Emergency Personnel\nProtective Equipment: Equip cleanup crew with proper protection.\nEmergency Procedures: Ventilate area.\n6.2.\nEnvironmental Precautions\nPrevent entry to sewers and public waters. Avoid release to the environment.\n6.3.\nMethods and Materials for Containment and Cleaning Up\nFor Containment: Contain any spills with dikes or absorbents to prevent migration and entry into sewers or streams.\nMethods for Cleaning Up: Clean up spills immediately and dispose of waste safely. Eliminate all ignition sources. In case of fire: Stop\nleak if safe to do so. If melted: allow liquid to solidify before taking it up. Take up mechanically (sweeping, shoveling) and collect in\nsuitable container for disposal. Use only non-sparking tools.\n6.4. Reference to Other Sections\nSee Section 8, Exposure Controls and Personal Protection. See Section 13, Disposal Considerations."}