{"GUID":"AkKsEQACHt+fl92lpuQIwg==","MATNR":"HZ-NIT","MAKTX":"Nitrogen","WERKS":"0001","LGORT":"0001","LGOBE":"Lager 0001","SECTION_ID":11,"SECTION_HEADER":"Toxicological information","SECTION_CONTENT":"11.1.\nInformation on toxicological effects\nLikely routes of exposure\n: Inhalation\nAcute toxicity\n: Not classified\nNitrogen (7727-37-9)\nLC50 inhalation rat (ppm)\nNitrogen (7727-37-9)\nLC50 inhalation rat (ppm)\nATE US (gases)\nSkin corrosion/irritation\nSerious eye damage/irritation\nRespiratory or skin sensitization\nGerm cell mutagenicity\nCarcinogenicity\nReproductive toxicity\nSpecific target organ toxicity - single exposure\nSpecific target organ toxicity - repeated exposure\nAspiration hazard\nSymptoms/effects after inhalation\nSymptoms/effects after skin contact\nSymptoms/effects after eye contact\nSymptoms/effects after ingestion\nSymptoms/effects upon intravenous administration\nChronic symptoms\n: 820000 ppm/4h\n: 820000 ppm/4h\n: 820000.000 ppmV/4h\n: Not classified\n: Not classified\n: Not classified\n: Not classified\n: Not classified\n: Not classified\n: Not classified\n: Not classified\n: Not classified\n: May displace oxygen and cause rapid suffocation. If you feel unwell, seek medical advice.\n: Adverse effects not expected from this product.\n: Adverse effects not expected from this product.\n: Ingestion is not considered a potential route of exposure.\n: Not known.\n: None known.","REVISED_CONTENT":"Product ID:HZ-NIT,Product Description:Nitrogen,Storage Location:0001,Storage Location Description:Lager 0001,Plant:0001,Section Id:11,Section Header:Toxicological information,Section Content:11.1.\nInformation on toxicological effects\nLikely routes of exposure\n: Inhalation\nAcute toxicity\n: Not classified\nNitrogen (7727-37-9)\nLC50 inhalation rat (ppm)\nNitrogen (7727-37-9)\nLC50 inhalation rat (ppm)\nATE US (gases)\nSkin corrosion/irritation\nSerious eye damage/irritation\nRespiratory or skin sensitization\nGerm cell mutagenicity\nCarcinogenicity\nReproductive toxicity\nSpecific target organ toxicity - single exposure\nSpecific target organ toxicity - repeated exposure\nAspiration hazard\nSymptoms/effects after inhalation\nSymptoms/effects after skin contact\nSymptoms/effects after eye contact\nSymptoms/effects after ingestion\nSymptoms/effects upon intravenous administration\nChronic symptoms\n: 820000 ppm/4h\n: 820000 ppm/4h\n: 820000.000 ppmV/4h\n: Not classified\n: Not classified\n: Not classified\n: Not classified\n: Not classified\n: Not classified\n: Not classified\n: Not classified\n: Not classified\n: May displace oxygen and cause rapid suffocation. If you feel unwell, seek medical advice.\n: Adverse effects not expected from this product.\n: Adverse effects not expected from this product.\n: Ingestion is not considered a potential route of exposure.\n: Not known.\n: None known."}