{"GUID":"AkKsEQACHt+fl92loTMowg==","MATNR":"HZ-BEN","MAKTX":"Benzene","WERKS":"0001","LGORT":"0001","LGOBE":"Lager 0001","SECTION_ID":2,"SECTION_HEADER":"Hazard(s) identification","SECTION_CONTENT":"• Classification of the substance or mixture\nGHS02 Flame\nFlam. Liq. 2 H225 Highly flammable liquid and vapor.\nGHS06 Skull and crossbones\nAcute Tox. 1 H310 Fatal in contact with skin.\nGHS08 Health hazard\nMuta. 1B\nH340 May cause genetic defects.\nCarc. 1A\nH350 May cause cancer.\nSTOT RE 1\nH372 Causes damage to organs through prolonged or repeated exposure.\nAsp. Tox. 1\nH304 May be fatal if swallowed and enters airways.\n! GHS07\nSkin Irrit. 2 H315 Causes skin irritation.\nEye Irrit. 2A H319 Causes serious eye irritation.\n• Label elements\nGHS label elements The substance is classified and labeled according to the Globally Harmonized System (GHS).","REVISED_CONTENT":"Product ID:HZ-BEN,Product Description:Benzene,Storage Location:0001,Storage Location Description:Lager 0001,Plant:0001,Section Id:2,Section Header:Hazard(s) identification,Section Content:• Classification of the substance or mixture\nGHS02 Flame\nFlam. Liq. 2 H225 Highly flammable liquid and vapor.\nGHS06 Skull and crossbones\nAcute Tox. 1 H310 Fatal in contact with skin.\nGHS08 Health hazard\nMuta. 1B\nH340 May cause genetic defects.\nCarc. 1A\nH350 May cause cancer.\nSTOT RE 1\nH372 Causes damage to organs through prolonged or repeated exposure.\nAsp. Tox. 1\nH304 May be fatal if swallowed and enters airways.\n! GHS07\nSkin Irrit. 2 H315 Causes skin irritation.\nEye Irrit. 2A H319 Causes serious eye irritation.\n• Label elements\nGHS label elements The substance is classified and labeled according to the Globally Harmonized System (GHS)."}