{"GUID":"AkKsEQACHt+fl92lo1iIwg==","MATNR":"HZ-CLG","MAKTX":"Chlorine gas","WERKS":"0001","LGORT":"0001","LGOBE":"Lager 0001","SECTION_ID":11,"SECTION_HEADER":"Toxicological information","SECTION_CONTENT":"· Information on toxicological effects\n• Acute toxicity:\nLD/LC50 values that are relevant for classification:\nInhalative LC50/4h|100 mg/l (ATE)\nPrimary irritant effect:\non the skin: Irritant to skin and mucous membranes.\non the eye: Irritating effect.\nSensitization: No sensitizing effects known.\nAdditional toxicological information:\nCarcinogenic categories\nIARC (International Agency for Research on Cancer) Substance is not listed.\nNTP (National Toxicology Program) Substance is not listed.\nOSHA-Ca (Occupational Safety & Health Administration) Substance is not listed.","REVISED_CONTENT":"Product ID:HZ-CLG,Product Description:Chlorine gas,Storage Location:0001,Storage Location Description:Lager 0001,Plant:0001,Section Id:11,Section Header:Toxicological information,Section Content:· Information on toxicological effects\n• Acute toxicity:\nLD/LC50 values that are relevant for classification:\nInhalative LC50/4h|100 mg/l (ATE)\nPrimary irritant effect:\non the skin: Irritant to skin and mucous membranes.\non the eye: Irritating effect.\nSensitization: No sensitizing effects known.\nAdditional toxicological information:\nCarcinogenic categories\nIARC (International Agency for Research on Cancer) Substance is not listed.\nNTP (National Toxicology Program) Substance is not listed.\nOSHA-Ca (Occupational Safety & Health Administration) Substance is not listed."}