{"GUID":"AkKsEQACHt+fl92lpsyIwg==","MATNR":"HZ-HAC","MAKTX":"Hydrochloric acid","WERKS":"0001","LGORT":"0003","LGOBE":"Corrosive Items","SECTION_ID":15,"SECTION_HEADER":"Regulatory information","SECTION_CONTENT":"U.S. Federal Regulations\nTSCA 12(b)\nNot applicable\nSARA 313\nComponent\nHydrochloric acid\nCAS-No\n7647-01-0\nWeight %\n35-38\nSARA 313 - Threshold\nValues %\n1.0\nSARA 311/312 Hazardous Categorization\nAcute Health Hazard\nChronic Health Hazard\nFire Hazard\nSudden Release of Pressure Hazard\nReactive Hazard\nYes\nYes\nNo\nNo\nNo\nClean Water Act\nComponent\nCWA - Hazardous\nSubstances\nHydrochloric acid\nX\nCWA - Reportable\nQuantities\n5000 lb\nCWA - Toxic Pollutants CWA - Priority Pollutants\nClass 1 Ozone Depletors\nClass 2 Ozone Depletors\nClean Air Act\nComponent\nHydrochloric acid\nHAPS Data\nX\nOSHA Occupational Safety and Health Administration\nNot applicable\nCERCLA\nComponent\nHydrochloric acid\nSpecifically Regulated Chemicals\nHighly Hazardous Chemicals\nTQ: 5000 lb\nThis material, as supplied, contains one or more substances regulated as a hazardous substance under the Comprehensive\nEnvironmental Response Compensation and Liability Act (CERCLA) (40 CFR 302)\nComponent\nHydrochloric acid\nHazardous Substances RQs\n5000 lb\nCERCLA EHS RQS\n5000 lb\nCalifornia Proposition 65\nThis product does not contain any Proposition 65 chemicals\nState Right-to-Know\nComponent\nWater\nHydrochloric acid\nMassachusetts\nX\nNew Jersey\nX\nPennsylvania\nX\nIllinois\nX\nRhode Island\nX\nU.S. Department of Transportation\nReportable Quantity (RQ):\nDOT Marine Pollutant\nDOT Severe Marine Pollutant\nY\nN\nN\nU.S. Department of Homeland Security\nThis product contains the following DHS chemicals:\nComponent\nHydrochloric acid\nDHS Chemical Facility Anti-Terrorism Standard\n0 lb STQ (anhydrous); 11250 lb STQ (37% concentration or\ngreater)\nOther International Regulations","REVISED_CONTENT":"Product ID:HZ-HAC,Product Description:Hydrochloric acid,Storage Location:0003,Storage Location Description:Corrosive Items,Plant:0001,Section Id:15,Section Header:Regulatory information,Section Content:U.S. Federal Regulations\nTSCA 12(b)\nNot applicable\nSARA 313\nComponent\nHydrochloric acid\nCAS-No\n7647-01-0\nWeight %\n35-38\nSARA 313 - Threshold\nValues %\n1.0\nSARA 311/312 Hazardous Categorization\nAcute Health Hazard\nChronic Health Hazard\nFire Hazard\nSudden Release of Pressure Hazard\nReactive Hazard\nYes\nYes\nNo\nNo\nNo\nClean Water Act\nComponent\nCWA - Hazardous\nSubstances\nHydrochloric acid\nX\nCWA - Reportable\nQuantities\n5000 lb\nCWA - Toxic Pollutants CWA - Priority Pollutants\nClass 1 Ozone Depletors\nClass 2 Ozone Depletors\nClean Air Act\nComponent\nHydrochloric acid\nHAPS Data\nX\nOSHA Occupational Safety and Health Administration\nNot applicable\nCERCLA\nComponent\nHydrochloric acid\nSpecifically Regulated Chemicals\nHighly Hazardous Chemicals\nTQ: 5000 lb\nThis material, as supplied, contains one or more substances regulated as a hazardous substance under the Comprehensive\nEnvironmental Response Compensation and Liability Act (CERCLA) (40 CFR 302)\nComponent\nHydrochloric acid\nHazardous Substances RQs\n5000 lb\nCERCLA EHS RQS\n5000 lb\nCalifornia Proposition 65\nThis product does not contain any Proposition 65 chemicals\nState Right-to-Know\nComponent\nWater\nHydrochloric acid\nMassachusetts\nX\nNew Jersey\nX\nPennsylvania\nX\nIllinois\nX\nRhode Island\nX\nU.S. Department of Transportation\nReportable Quantity (RQ):\nDOT Marine Pollutant\nDOT Severe Marine Pollutant\nY\nN\nN\nU.S. Department of Homeland Security\nThis product contains the following DHS chemicals:\nComponent\nHydrochloric acid\nDHS Chemical Facility Anti-Terrorism Standard\n0 lb STQ (anhydrous); 11250 lb STQ (37% concentration or\ngreater)\nOther International Regulations"}