{"GUID":"AkKsEQACHt+fl92lpuQowg==","MATNR":"HZ-NIT","MAKTX":"Nitrogen","WERKS":"0001","LGORT":"0001","LGOBE":"Lager 0001","SECTION_ID":12,"SECTION_HEADER":"Ecological information","SECTION_CONTENT":"12.1. Toxicity\nNo additional information available\n12.2. Persistence and degradability\nNitrogen (7727-37-9)\nPersistence and degradability\n12.3. Bioaccumulative potential\nNitrogen (7727-37-9)\nLog Pow\nBioaccumulative potential\n12.4. Mobility in soil\nNitrogen (7727-37-9)\nEcology - soil\n12.5.\nOther adverse effects\nEffect on global warming\nGWPmix comment\n: No ecological damage caused by this product.\n: Not applicable for inorganic gases.\n: No ecological damage caused by this product.\n: No ecological damage caused by this product.\n: No known effects from this product.\n: No known effects from this product.","REVISED_CONTENT":"Product ID:HZ-NIT,Product Description:Nitrogen,Storage Location:0001,Storage Location Description:Lager 0001,Plant:0001,Section Id:12,Section Header:Ecological information,Section Content:12.1. Toxicity\nNo additional information available\n12.2. Persistence and degradability\nNitrogen (7727-37-9)\nPersistence and degradability\n12.3. Bioaccumulative potential\nNitrogen (7727-37-9)\nLog Pow\nBioaccumulative potential\n12.4. Mobility in soil\nNitrogen (7727-37-9)\nEcology - soil\n12.5.\nOther adverse effects\nEffect on global warming\nGWPmix comment\n: No ecological damage caused by this product.\n: Not applicable for inorganic gases.\n: No ecological damage caused by this product.\n: No ecological damage caused by this product.\n: No known effects from this product.\n: No known effects from this product."}