{"GUID":"AkKsEQACHt+fl92lpuHIwg==","MATNR":"HZ-NAC","MAKTX":"Nitric acid","WERKS":"0001","LGORT":"0003","LGOBE":"Corrosive Items","SECTION_ID":9,"SECTION_HEADER":"Physical and chemical properties","SECTION_CONTENT":"Physical state : liquid\nColor : colourless\nOdor : weak\nOdor threshold : Note: no data available\npH : < 1\nMelting point/range : -31 °C\nBoiling point/boiling range : 122 °C at 1,013 hPa\nFlash point : Note: Not applicable\nEvaporation rate : Note: no data available\nFlammability : Not applicable\nLower explosion limit : Note: Not applicable\nUpper explosion limit : Note: Not applicable\nVapor pressure : 50 hPa\nat 50 °C(122 °F)\nVapor density : Note: no data available\nDensity : 1.400 - 1.480 g/cm3 at 20 °C\nWater solubility : Note: completely miscible\nPartition coefficient:\nn-octanol/water : Note: no data available\nIgnition temperature : Note: Not applicable\nAuto-ignition temperature : Note: not auto-flammable\nViscosity, dynamic : Note: no data available\nViscosity, kinematic : Note: no data available\nMolecular weight : 63.01 g/mol\nBulk density : Note: Not applicable\nCorrosivity : Note: Corrosive to metals","REVISED_CONTENT":"Product ID:HZ-NAC,Product Description:Nitric acid,Storage Location:0003,Storage Location Description:Corrosive Items,Plant:0001,Section Id:9,Section Header:Physical and chemical properties,Section Content:Physical state : liquid\nColor : colourless\nOdor : weak\nOdor threshold : Note: no data available\npH : < 1\nMelting point/range : -31 °C\nBoiling point/boiling range : 122 °C at 1,013 hPa\nFlash point : Note: Not applicable\nEvaporation rate : Note: no data available\nFlammability : Not applicable\nLower explosion limit : Note: Not applicable\nUpper explosion limit : Note: Not applicable\nVapor pressure : 50 hPa\nat 50 °C(122 °F)\nVapor density : Note: no data available\nDensity : 1.400 - 1.480 g/cm3 at 20 °C\nWater solubility : Note: completely miscible\nPartition coefficient:\nn-octanol/water : Note: no data available\nIgnition temperature : Note: Not applicable\nAuto-ignition temperature : Note: not auto-flammable\nViscosity, dynamic : Note: no data available\nViscosity, kinematic : Note: no data available\nMolecular weight : 63.01 g/mol\nBulk density : Note: Not applicable\nCorrosivity : Note: Corrosive to metals"}