{"GUID":"AkKsEQACHt+fl92lpuLowg==","MATNR":"HZ-NIT","MAKTX":"Nitrogen","WERKS":"0001","LGORT":"0001","LGOBE":"Lager 0001","SECTION_ID":2,"SECTION_HEADER":"Hazard(s) identification","SECTION_CONTENT":"Classification of the substance or mixture\n2.1.\nGHS-US classification\nGases under pressure\nCompressed gas\nH280\n: Contains gas under pressure; may explode if heated\nFull text of H statements: see section 16\n2.2.\nGHS Label elements, including precautionary statements\nGHS-US labeling\nHazard pictograms (GHS-US)\nGHS04\nSignal word (GHS-US)\nHazard statements (GHS-US)\nPrecautionary statements (GHS-US)\n2.3.\nOther hazards which do not result in classification\nNo additional information available\n2.4. Unknown acute toxicity (GHS US)\nNot applicable\n: Warning\n: H280 - Contains gas under pressure; may explode if heated\nOSHA-H01 - May displace oxygen and cause rapid suffocation\n: P202 - Do not handle until all safety precautions have been read and understood.\nP271 - Use only outdoors or in a well-ventilated area.\nP280 - Wear protective clothing, protective gloves, eye protection, face protection.\nP308+P313 - If exposed or concerned: Get medical advice/attention.\nP403 - Store in a well-ventilated place.\nP501 - Dispose of contents/container in accordance with local/regional/national/international regulations\nP304+P340 - If inhaled: Remove person to fresh air and keep comfortable for breathing\nCGA-PG02 - Protect from sunlight when ambient temperature exceeds 52째C/125 째F\nCGA-PG05 - Use a back flow preventive device in the piping\nCGA-PG06 - Close valve after each use and when empty\nCGA-PG10 - Use only with equipment rated for cylinder pressure\nCGA-PG14 - Approach suspected leak area with caution\nCGA-PG21 - Open valve slowly","REVISED_CONTENT":"Product ID:HZ-NIT,Product Description:Nitrogen,Storage Location:0001,Storage Location Description:Lager 0001,Plant:0001,Section Id:2,Section Header:Hazard(s) identification,Section Content:Classification of the substance or mixture\n2.1.\nGHS-US classification\nGases under pressure\nCompressed gas\nH280\n: Contains gas under pressure; may explode if heated\nFull text of H statements: see section 16\n2.2.\nGHS Label elements, including precautionary statements\nGHS-US labeling\nHazard pictograms (GHS-US)\nGHS04\nSignal word (GHS-US)\nHazard statements (GHS-US)\nPrecautionary statements (GHS-US)\n2.3.\nOther hazards which do not result in classification\nNo additional information available\n2.4. Unknown acute toxicity (GHS US)\nNot applicable\n: Warning\n: H280 - Contains gas under pressure; may explode if heated\nOSHA-H01 - May displace oxygen and cause rapid suffocation\n: P202 - Do not handle until all safety precautions have been read and understood.\nP271 - Use only outdoors or in a well-ventilated area.\nP280 - Wear protective clothing, protective gloves, eye protection, face protection.\nP308+P313 - If exposed or concerned: Get medical advice/attention.\nP403 - Store in a well-ventilated place.\nP501 - Dispose of contents/container in accordance with local/regional/national/international regulations\nP304+P340 - If inhaled: Remove person to fresh air and keep comfortable for breathing\nCGA-PG02 - Protect from sunlight when ambient temperature exceeds 52째C/125 째F\nCGA-PG05 - Use a back flow preventive device in the piping\nCGA-PG06 - Close valve after each use and when empty\nCGA-PG10 - Use only with equipment rated for cylinder pressure\nCGA-PG14 - Approach suspected leak area with caution\nCGA-PG21 - Open valve slowly"}