{"GUID":"AkKsEQACHt+fl92loTLowg==","MATNR":"HZ-ATR","MAKTX":"Atrazine","WERKS":"0001","LGORT":"0088","LGOBE":"Lager 0088 (WM)","SECTION_ID":16,"SECTION_HEADER":"Other information","SECTION_CONTENT":"References: Not available.\nOther Special Considerations: Not available.\nCreated: 10/10/2006 10:40:32 AM\nLast Updated: 11/12/2008 10:16:35 AM\nDisclaimer\nThis product is offered by bioWORLD for research, laboratory or further manufacturing use. Not for human use or\nconsumption.\nThe information above is believed to be accurate and represents the best information currently available to us. However, we\nmake no warranty of merchantability or any other warranty, express or implied, with respect to such information, and we\nassume no liability resulting from its use. Users should make their own investigations to determine the suitability of the\ninformation for their particular purposes.In no event shall Bio-World.com be liable for any claims, losses, or damages of any\nthird party or for lost profits or any special, indirect,incidental,consequential or exemplary damages, howsoever arising,\neven if Bio-World.com has been advised of the possibility of such damages.","REVISED_CONTENT":"Product ID:HZ-ATR,Product Description:Atrazine,Storage Location:0088,Storage Location Description:Lager 0088 (WM),Plant:0001,Section Id:16,Section Header:Other information,Section Content:References: Not available.\nOther Special Considerations: Not available.\nCreated: 10/10/2006 10:40:32 AM\nLast Updated: 11/12/2008 10:16:35 AM\nDisclaimer\nThis product is offered by bioWORLD for research, laboratory or further manufacturing use. Not for human use or\nconsumption.\nThe information above is believed to be accurate and represents the best information currently available to us. However, we\nmake no warranty of merchantability or any other warranty, express or implied, with respect to such information, and we\nassume no liability resulting from its use. Users should make their own investigations to determine the suitability of the\ninformation for their particular purposes.In no event shall Bio-World.com be liable for any claims, losses, or damages of any\nthird party or for lost profits or any special, indirect,incidental,consequential or exemplary damages, howsoever arising,\neven if Bio-World.com has been advised of the possibility of such damages."}