{"GUID":"AkKsEQACHt+fl92lrOUowg==","MATNR":"HZ-PPM","MAKTX":"Potassium permanganate","WERKS":"0001","LGORT":"0088","LGOBE":"Lager 0088 (WM)","SECTION_ID":4,"SECTION_HEADER":"First-aid measures","SECTION_CONTENT":"General Advice\nShow this safety data sheet to the doctor in attendance. Immediate medical attention is\nrequired.\nEye Contact\nRinse immediately with plenty of water, also under the eyelids, for at least 15 minutes.\nImmediate medical attention is required. Keep eye wide open while rinsing.\nSkin Contact\nWash off immediately with soap and plenty of water while removing all contaminated\nclothes and shoes. Call a physician immediately.\nInhalation\nRemove to fresh air. If not breathing, give artificial respiration. Call a physician or poison\ncontrol center immediately. Do not use mouth-to-mouth method if victim ingested or inhaled\nthe substance; give artificial respiration with the aid of a pocket mask equipped with a\none-way valve or other proper respiratory medical device.\nIngestion\nImmediate medical attention is required. Do NOT induce vomiting. Drink plenty of water.\nNever give anything by mouth to an unconscious person.\nMost important symptoms and\neffects\nCauses burns by all exposure routes. Product is a corrosive material. Use of gastric\nlavage or emesis is contraindicated. Possible perforation of stomach or esophagus should\nbe investigated: Ingestion causes severe swelling, severe damage to the delicate tissue\nand danger of perforation\nNotes to Physician\nTreat symptomatically","REVISED_CONTENT":"Product ID:HZ-PPM,Product Description:Potassium permanganate,Storage Location:0088,Storage Location Description:Lager 0088 (WM),Plant:0001,Section Id:4,Section Header:First-aid measures,Section Content:General Advice\nShow this safety data sheet to the doctor in attendance. Immediate medical attention is\nrequired.\nEye Contact\nRinse immediately with plenty of water, also under the eyelids, for at least 15 minutes.\nImmediate medical attention is required. Keep eye wide open while rinsing.\nSkin Contact\nWash off immediately with soap and plenty of water while removing all contaminated\nclothes and shoes. Call a physician immediately.\nInhalation\nRemove to fresh air. If not breathing, give artificial respiration. Call a physician or poison\ncontrol center immediately. Do not use mouth-to-mouth method if victim ingested or inhaled\nthe substance; give artificial respiration with the aid of a pocket mask equipped with a\none-way valve or other proper respiratory medical device.\nIngestion\nImmediate medical attention is required. Do NOT induce vomiting. Drink plenty of water.\nNever give anything by mouth to an unconscious person.\nMost important symptoms and\neffects\nCauses burns by all exposure routes. Product is a corrosive material. Use of gastric\nlavage or emesis is contraindicated. Possible perforation of stomach or esophagus should\nbe investigated: Ingestion causes severe swelling, severe damage to the delicate tissue\nand danger of perforation\nNotes to Physician\nTreat symptomatically"}