{"GUID":"AkKsEQACHt+fl92lpuFIwg==","MATNR":"HZ-NAC","MAKTX":"Nitric acid","WERKS":"0001","LGORT":"0003","LGOBE":"Corrosive Items","SECTION_ID":5,"SECTION_HEADER":"Fire-fighting measures","SECTION_CONTENT":"Suitable extinguishing media : Water spray\nFoam\nCarbon dioxide (CO2)\nDry powder\nUnsuitable extinguishing\nmedia : Dry sodium carbonate\nHigh volume water jet\nSpecific hazards during\nfirefighting : May intensify fire; oxidizer.\nContact with metals liberates hydrogen gas.\nCool closed containers exposed to fire with water spray.\nIn case of fire hazardous decomposition products may be\nproduced such as:\nnitrogen oxides (NOx)\nSpecial protective equipment\nfor firefighters : Wear self-contained breathing apparatus and protective suit.\nNo unprotected exposed skin areas.\nFurther information : Use extinguishing measures that are appropriate to local\ncircumstances and the surrounding environment.\nThe product itself does not burn.\nCollect contaminated fire extinguishing water separately. This\nmust not be discharged into drains.","REVISED_CONTENT":"Product ID:HZ-NAC,Product Description:Nitric acid,Storage Location:0003,Storage Location Description:Corrosive Items,Plant:0001,Section Id:5,Section Header:Fire-fighting measures,Section Content:Suitable extinguishing media : Water spray\nFoam\nCarbon dioxide (CO2)\nDry powder\nUnsuitable extinguishing\nmedia : Dry sodium carbonate\nHigh volume water jet\nSpecific hazards during\nfirefighting : May intensify fire; oxidizer.\nContact with metals liberates hydrogen gas.\nCool closed containers exposed to fire with water spray.\nIn case of fire hazardous decomposition products may be\nproduced such as:\nnitrogen oxides (NOx)\nSpecial protective equipment\nfor firefighters : Wear self-contained breathing apparatus and protective suit.\nNo unprotected exposed skin areas.\nFurther information : Use extinguishing measures that are appropriate to local\ncircumstances and the surrounding environment.\nThe product itself does not burn.\nCollect contaminated fire extinguishing water separately. This\nmust not be discharged into drains."}