{"GUID":"AkKsEQACHt+fl92lptJIwg==","MATNR":"HZ-HYS","MAKTX":"Hydrogen sulfide","WERKS":"0001","LGORT":"0001","LGOBE":"Lager 0001","SECTION_ID":13,"SECTION_HEADER":"Disposal considerations","SECTION_CONTENT":"Waste treatment methods\nRegional legislation (waste)\nProduct/Packaging disposal recommendations\n: U.S. - RCRA (Resource Conservation Recovery Act) - Hazardous Constituents - Appendix VIII\nto 40 CFR 261. U.S. - RCRA (Resource Conservation Recovery Act) - U Series Wastes -\nAcutely Toxic Wastes Other Hazardous Characteristics.\n: Do not attempt to dispose of residual or unused quantities. Return container to supplier.","REVISED_CONTENT":"Product ID:HZ-HYS,Product Description:Hydrogen sulfide,Storage Location:0001,Storage Location Description:Lager 0001,Plant:0001,Section Id:13,Section Header:Disposal considerations,Section Content:Waste treatment methods\nRegional legislation (waste)\nProduct/Packaging disposal recommendations\n: U.S. - RCRA (Resource Conservation Recovery Act) - Hazardous Constituents - Appendix VIII\nto 40 CFR 261. U.S. - RCRA (Resource Conservation Recovery Act) - U Series Wastes -\nAcutely Toxic Wastes Other Hazardous Characteristics.\n: Do not attempt to dispose of residual or unused quantities. Return container to supplier."}