{"GUID":"AkKsEQACHt+fl92lpsnowg==","MATNR":"HZ-GLY","MAKTX":"Glyphosate","WERKS":"0001","LGORT":"0088","LGOBE":"Lager 0088 (WM)","SECTION_ID":10,"SECTION_HEADER":"Stability and reactivity","SECTION_CONTENT":"Reactive Hazard None known, based on information available\nStability Stable under normal conditions.\nConditions to Avoid Extremes of temperature and direct sunlight.\nIncompatible Materials Strong oxidizing agents, Metals, Strong acids, Bases\nHazardous Decomposition Products Carbon monoxide (CO), Carbon dioxide (CO2), Nitrogen oxides (NOx), Oxides of\nphosphorus\nHazardous Polymerization Hazardous polymerization does not occur.\nHazardous Reactions None under normal processing.","REVISED_CONTENT":"Product ID:HZ-GLY,Product Description:Glyphosate,Storage Location:0088,Storage Location Description:Lager 0088 (WM),Plant:0001,Section Id:10,Section Header:Stability and reactivity,Section Content:Reactive Hazard None known, based on information available\nStability Stable under normal conditions.\nConditions to Avoid Extremes of temperature and direct sunlight.\nIncompatible Materials Strong oxidizing agents, Metals, Strong acids, Bases\nHazardous Decomposition Products Carbon monoxide (CO), Carbon dioxide (CO2), Nitrogen oxides (NOx), Oxides of\nphosphorus\nHazardous Polymerization Hazardous polymerization does not occur.\nHazardous Reactions None under normal processing."}