{"GUID":"AkKsEQACHt+fl92loS+owg==","MATNR":"HZ-ACE","MAKTX":"Acetone","WERKS":"0001","LGORT":"0001","LGOBE":"Lager 0001","SECTION_ID":6,"SECTION_HEADER":"Accidental release measures","SECTION_CONTENT":"Personal Precautions Use personal protective equipment. Ensure adequate ventilation. Remove all sources of\nignition. Take precautionary measures against static discharges. Keep people away from\nand upwind of spill/leak. Avoid contact with skin, eyes and inhalation of vapors.\nEnvironmental Precautions Should not be released into the environment.\nMethods for Containment and Clean Remove all sources of ignition. Take precautionary measures against static discharges.\nUp Soak up with inert absorbent material. Keep in suitable, closed containers for disposal. Use\nspark-proof tools and explosion-proof equipment.","REVISED_CONTENT":"Product ID:HZ-ACE,Product Description:Acetone,Storage Location:0001,Storage Location Description:Lager 0001,Plant:0001,Section Id:6,Section Header:Accidental release measures,Section Content:Personal Precautions Use personal protective equipment. Ensure adequate ventilation. Remove all sources of\nignition. Take precautionary measures against static discharges. Keep people away from\nand upwind of spill/leak. Avoid contact with skin, eyes and inhalation of vapors.\nEnvironmental Precautions Should not be released into the environment.\nMethods for Containment and Clean Remove all sources of ignition. Take precautionary measures against static discharges.\nUp Soak up with inert absorbent material. Keep in suitable, closed containers for disposal. Use\nspark-proof tools and explosion-proof equipment."}