{"GUID":"AkKsEQACHt+fl92lrOWIwg==","MATNR":"HZ-PPM","MAKTX":"Potassium permanganate","WERKS":"0001","LGORT":"0088","LGOBE":"Lager 0088 (WM)","SECTION_ID":7,"SECTION_HEADER":"Handling and storage","SECTION_CONTENT":"Wear personal protective equipment/face protection. Do not get in eyes, on skin, or on\nclothing. Use only under a chemical fume hood. Do not breathe dust. Do not ingest. If\nswallowed then seek immediate medical assistance. Keep away from clothing and other\ncombustible materials.\nKeep containers tightly closed in a dry, cool and well-ventilated place. Corrosives area. Do\nnot store near combustible materials. Incompatible Materials. Reducing Agent. Strong\nacids. Strong reducing agents. Combustible material.","REVISED_CONTENT":"Product ID:HZ-PPM,Product Description:Potassium permanganate,Storage Location:0088,Storage Location Description:Lager 0088 (WM),Plant:0001,Section Id:7,Section Header:Handling and storage,Section Content:Wear personal protective equipment/face protection. Do not get in eyes, on skin, or on\nclothing. Use only under a chemical fume hood. Do not breathe dust. Do not ingest. If\nswallowed then seek immediate medical assistance. Keep away from clothing and other\ncombustible materials.\nKeep containers tightly closed in a dry, cool and well-ventilated place. Corrosives area. Do\nnot store near combustible materials. Incompatible Materials. Reducing Agent. Strong\nacids. Strong reducing agents. Combustible material."}