{"GUID":"AkKsEQACHt+fl92lpuFowg==","MATNR":"HZ-NAC","MAKTX":"Nitric acid","WERKS":"0001","LGORT":"0003","LGOBE":"Corrosive Items","SECTION_ID":6,"SECTION_HEADER":"Accidental release measures","SECTION_CONTENT":"Personal precautions,\nprotective equipment and\nemergency procedures : Immediately evacuate personnel to safe areas.\n: Wear personal protective equipment. Unprotected persons\nmust be kept away.\nKeep people away from and upwind of spill/leak.\nRemove all sources of ignition.\nEnsure adequate ventilation.\nDo not breathe vapours or spray mist.\nDo not get in eyes, on skin, or on clothing.\nEnvironmental precautions : Prevent further leakage or spillage if safe to do so.\nDischarge into the environment must be avoided.\nDo not flush into surface water or sanitary sewer system.\nPrevent product from entering drains.\nCollect contaminated fire extinguishing water separately. This\nmust not be discharged into drains.\nMethods and materials for\ncontainment and cleaning\nup : Ventilate the area.\nWith acids neutralization takes place under development of\nheat.\nNeutralise with the following product(s):\nlime\nSoak up with inert absorbent material.\nSweep up and shovel into suitable containers for disposal.\nDispose of in accordance with local regulations.","REVISED_CONTENT":"Product ID:HZ-NAC,Product Description:Nitric acid,Storage Location:0003,Storage Location Description:Corrosive Items,Plant:0001,Section Id:6,Section Header:Accidental release measures,Section Content:Personal precautions,\nprotective equipment and\nemergency procedures : Immediately evacuate personnel to safe areas.\n: Wear personal protective equipment. Unprotected persons\nmust be kept away.\nKeep people away from and upwind of spill/leak.\nRemove all sources of ignition.\nEnsure adequate ventilation.\nDo not breathe vapours or spray mist.\nDo not get in eyes, on skin, or on clothing.\nEnvironmental precautions : Prevent further leakage or spillage if safe to do so.\nDischarge into the environment must be avoided.\nDo not flush into surface water or sanitary sewer system.\nPrevent product from entering drains.\nCollect contaminated fire extinguishing water separately. This\nmust not be discharged into drains.\nMethods and materials for\ncontainment and cleaning\nup : Ventilate the area.\nWith acids neutralization takes place under development of\nheat.\nNeutralise with the following product(s):\nlime\nSoak up with inert absorbent material.\nSweep up and shovel into suitable containers for disposal.\nDispose of in accordance with local regulations."}