{"GUID":"AkKsEQACHt+fl92lptnIwg==","MATNR":"HZ-MAL","MAKTX":"Malathion","WERKS":"0001","LGORT":"0088","LGOBE":"Lager 0088 (WM)","SECTION_ID":9,"SECTION_HEADER":"Physical and chemical properties","SECTION_CONTENT":"9.1 Information on basic physical and chemical properties\na) Appearance\nForm: liquid\nb) Odor\nColor: colorless\nc) Odor Threshold\nNo data available\nd) pH\nNo data available\ne) Melting\npoint/freezing point\nNo data available\nMelting point: 2.9 °C (37.2 °F)\nf) Initial boiling point\nand boiling range\n156 157 °C 313 - 315 °F at 0.9 hPa\ng) Flash point\n()No data available\nh) Evaporation rate\nNo data available\ni) Flammability (solid,\ngas)","REVISED_CONTENT":"Product ID:HZ-MAL,Product Description:Malathion,Storage Location:0088,Storage Location Description:Lager 0088 (WM),Plant:0001,Section Id:9,Section Header:Physical and chemical properties,Section Content:9.1 Information on basic physical and chemical properties\na) Appearance\nForm: liquid\nb) Odor\nColor: colorless\nc) Odor Threshold\nNo data available\nd) pH\nNo data available\ne) Melting\npoint/freezing point\nNo data available\nMelting point: 2.9 °C (37.2 °F)\nf) Initial boiling point\nand boiling range\n156 157 °C 313 - 315 °F at 0.9 hPa\ng) Flash point\n()No data available\nh) Evaporation rate\nNo data available\ni) Flammability (solid,\ngas)"}