{"GUID":"AkKsEQACHt+fl92lpt1Iwg==","MATNR":"HZ-MER","MAKTX":"Mercury","WERKS":"0001","LGORT":"0088","LGOBE":"Lager 0088 (WM)","SECTION_ID":5,"SECTION_HEADER":"Fire-fighting measures","SECTION_CONTENT":"Suitable Extinguishing Media\nWater spray, carbon dioxide (CO2), dry chemical, alcohol-resistant foam.\nUnsuitable Extinguishing Media\nNo information available\nFlash Point\nNo information available\nMethod -\nAutoignition Temperature\nNo information available\nExplosion Limits\nUpper\nNo information available\nLower\nNo data available\nSensitivity to Mechanical Impact\nNo information available\nSensitivity to Static Discharge\nNo data available\nSpecific Hazards Arising from the Chemical\nVery toxic. Non-combustible, substance itself does not burn but may decompose upon heating to produce corrosive and/or toxic\nfumes. Keep product and empty container away from heat and sources of ignition. Do not allow run-off from fire-fighting to enter\ndrains or water courses.\nHazardous Combustion Products\nMercury oxide. Toxic fumes.\nProtective Equipment and Precautions for Firefighters\nAs in any fire, wear self-contained breathing apparatus pressure-demand, MSHA/NIOSH (approved or equivalent) and full\nprotective gear. Thermal decomposition can lead to release of irritating gases and vapors.","REVISED_CONTENT":"Product ID:HZ-MER,Product Description:Mercury,Storage Location:0088,Storage Location Description:Lager 0088 (WM),Plant:0001,Section Id:5,Section Header:Fire-fighting measures,Section Content:Suitable Extinguishing Media\nWater spray, carbon dioxide (CO2), dry chemical, alcohol-resistant foam.\nUnsuitable Extinguishing Media\nNo information available\nFlash Point\nNo information available\nMethod -\nAutoignition Temperature\nNo information available\nExplosion Limits\nUpper\nNo information available\nLower\nNo data available\nSensitivity to Mechanical Impact\nNo information available\nSensitivity to Static Discharge\nNo data available\nSpecific Hazards Arising from the Chemical\nVery toxic. Non-combustible, substance itself does not burn but may decompose upon heating to produce corrosive and/or toxic\nfumes. Keep product and empty container away from heat and sources of ignition. Do not allow run-off from fire-fighting to enter\ndrains or water courses.\nHazardous Combustion Products\nMercury oxide. Toxic fumes.\nProtective Equipment and Precautions for Firefighters\nAs in any fire, wear self-contained breathing apparatus pressure-demand, MSHA/NIOSH (approved or equivalent) and full\nprotective gear. Thermal decomposition can lead to release of irritating gases and vapors."}