{"GUID":"AkKsEQACHt+fl92lps3Iwg==","MATNR":"HZ-HEL","MAKTX":"Helium","WERKS":"0001","LGORT":"0001","LGOBE":"Lager 0001","SECTION_ID":9,"SECTION_HEADER":"Physical and chemical properties","SECTION_CONTENT":"Appearance\nCompressed gas.\nPhysical state\nGas.\nForm\nCompressed gas.\nColor\nColorless.\nOdor\nOdorless.\nOdor threshold\nNot applicable.\npH\nNot applicable.\nMelting point/freezing point\n-457.87 °F (-272.15 °C)\nInitial boiling point and boiling\nrange\n-452.02 °F (-268.9 °C)\nEvaporation rate\nNot applicable.\nFlammability (solid, gas)\nNot available.\nFlash point\nNot applicable.\nUpper/lower flammability or explosive limits\nFlammability limit - lower\nNot applicable.\n(%)\nFlammability limit - upper\nNot applicable.\n(%)\nExplosive limit - lower (%)\nNot available.\nExplosive limit - upper (%)\nNot available.\nVapor pressure\nNot applicable.\nVapor density\n0.000165 g/ml @ 21 °C.\nRelative density\nNot available.\nSolubility(ies)\nSolubility (water)\nNegligible in water.\nPartition coefficient\n(n-octanol/water)\nNo data available.\nAuto-ignition temperature\nNot applicable.\nDecomposition temperature\nNot available.\nViscosity\nNot available.\nOther information\nMolecular formula\nHe\nMolecular weight\n4 g/mol\nPercent volatile\n100% v/v","REVISED_CONTENT":"Product ID:HZ-HEL,Product Description:Helium,Storage Location:0001,Storage Location Description:Lager 0001,Plant:0001,Section Id:9,Section Header:Physical and chemical properties,Section Content:Appearance\nCompressed gas.\nPhysical state\nGas.\nForm\nCompressed gas.\nColor\nColorless.\nOdor\nOdorless.\nOdor threshold\nNot applicable.\npH\nNot applicable.\nMelting point/freezing point\n-457.87 °F (-272.15 °C)\nInitial boiling point and boiling\nrange\n-452.02 °F (-268.9 °C)\nEvaporation rate\nNot applicable.\nFlammability (solid, gas)\nNot available.\nFlash point\nNot applicable.\nUpper/lower flammability or explosive limits\nFlammability limit - lower\nNot applicable.\n(%)\nFlammability limit - upper\nNot applicable.\n(%)\nExplosive limit - lower (%)\nNot available.\nExplosive limit - upper (%)\nNot available.\nVapor pressure\nNot applicable.\nVapor density\n0.000165 g/ml @ 21 °C.\nRelative density\nNot available.\nSolubility(ies)\nSolubility (water)\nNegligible in water.\nPartition coefficient\n(n-octanol/water)\nNo data available.\nAuto-ignition temperature\nNot applicable.\nDecomposition temperature\nNot available.\nViscosity\nNot available.\nOther information\nMolecular formula\nHe\nMolecular weight\n4 g/mol\nPercent volatile\n100% v/v"}