{"GUID":"AkKsEQACHt+fl92lptgowg==","MATNR":"HZ-MAG","MAKTX":"Magnesium","WERKS":"0001","LGORT":"0001","LGOBE":"Lager 0001","SECTION_ID":12,"SECTION_HEADER":"Ecological information","SECTION_CONTENT":"Ecotoxicity\nDo not empty into drains.\nPersistence and Degradability\nInsoluble in water\nBioaccumulation/ Accumulation\nNo information available.\nMobility\nIs not likely mobile in the environment due its low water solubility.\nWaste Disposal Methods\nChemical waste generators must determine whether a discarded chemical is classified as a\nhazardous waste. Chemical waste generators must also consult local, regional, and\nnational hazardous waste regulations to ensure complete and accurate classification.","REVISED_CONTENT":"Product ID:HZ-MAG,Product Description:Magnesium,Storage Location:0001,Storage Location Description:Lager 0001,Plant:0001,Section Id:12,Section Header:Ecological information,Section Content:Ecotoxicity\nDo not empty into drains.\nPersistence and Degradability\nInsoluble in water\nBioaccumulation/ Accumulation\nNo information available.\nMobility\nIs not likely mobile in the environment due its low water solubility.\nWaste Disposal Methods\nChemical waste generators must determine whether a discarded chemical is classified as a\nhazardous waste. Chemical waste generators must also consult local, regional, and\nnational hazardous waste regulations to ensure complete and accurate classification."}