{"GUID":"AkKsEQACHt+fl92lptvowg==","MATNR":"HZ-MEO","MAKTX":"Methanol","WERKS":"0001","LGORT":"0001","LGOBE":"Lager 0001","SECTION_ID":10,"SECTION_HEADER":"Stability and reactivity","SECTION_CONTENT":"Conditions to be avioded: no information available\nSubstances to be avoided: acid chlorides, alkali metals, alkaline earth metals, hydrides, zinc diethyl, halogens, oxiding agents (acids,\nsalts of oxyhalogenic acids, halogen oxides, chromic anhydride, nitric acid, chromosulfuric acid).\nHazardous decomposition products: no information available\nOther information: hygroscopic. Explosible with air. Unsuitable working materials: various plastics, aluminium, zinc alloys","REVISED_CONTENT":"Product ID:HZ-MEO,Product Description:Methanol,Storage Location:0001,Storage Location Description:Lager 0001,Plant:0001,Section Id:10,Section Header:Stability and reactivity,Section Content:Conditions to be avioded: no information available\nSubstances to be avoided: acid chlorides, alkali metals, alkaline earth metals, hydrides, zinc diethyl, halogens, oxiding agents (acids,\nsalts of oxyhalogenic acids, halogen oxides, chromic anhydride, nitric acid, chromosulfuric acid).\nHazardous decomposition products: no information available\nOther information: hygroscopic. Explosible with air. Unsuitable working materials: various plastics, aluminium, zinc alloys"}