{"GUID":"AkKsEQACHt+fl92lpuJowg==","MATNR":"HZ-NAC","MAKTX":"Nitric acid","WERKS":"0001","LGORT":"0003","LGOBE":"Corrosive Items","SECTION_ID":14,"SECTION_HEADER":"Transport information","SECTION_CONTENT":"DOT\nUN/ID No. : UN 2031\nProper shipping name : Nitric acid\nClass : 8\nPacking group : ||\nHazard Labels : 8 (5.1)\nIATA\nUN/ID No. : UN 2031\nDescription of the goods : Nitric acid\nClass : 8\nPackaging group : ||\nHazard Labels : 8 (5.1)\nPacking instruction (cargo\naircraft) : 855\nIMDG\nUN/ID No. : UN 2031\nDescription of the goods : Nitric acid\nClass : 8\nPacking group : ||\nHazard Labels : 8 (5.1)\nEmS Number : F-A, S-Q\nMarine pollutant : no\nIMDG Code segregation group 1 – ACIDS,","REVISED_CONTENT":"Product ID:HZ-NAC,Product Description:Nitric acid,Storage Location:0003,Storage Location Description:Corrosive Items,Plant:0001,Section Id:14,Section Header:Transport information,Section Content:DOT\nUN/ID No. : UN 2031\nProper shipping name : Nitric acid\nClass : 8\nPacking group : ||\nHazard Labels : 8 (5.1)\nIATA\nUN/ID No. : UN 2031\nDescription of the goods : Nitric acid\nClass : 8\nPackaging group : ||\nHazard Labels : 8 (5.1)\nPacking instruction (cargo\naircraft) : 855\nIMDG\nUN/ID No. : UN 2031\nDescription of the goods : Nitric acid\nClass : 8\nPacking group : ||\nHazard Labels : 8 (5.1)\nEmS Number : F-A, S-Q\nMarine pollutant : no\nIMDG Code segregation group 1 – ACIDS,"}