{"GUID":"AkKsEQACHt+fl92lps1Iwg==","MATNR":"HZ-HEL","MAKTX":"Helium","WERKS":"0001","LGORT":"0001","LGOBE":"Lager 0001","SECTION_ID":5,"SECTION_HEADER":"Fire-fighting measures","SECTION_CONTENT":"Suitable extinguishing media\nCool containers exposed to heat with water spray and remove container, if no risk is involved.\nUnsuitable extinguishing\nmedia\nNone known.\nSpecific hazards arising from\nthe chemical\nContents under pressure. Pressurized container may explode when exposed to heat or flame.\nSpecial protective equipment\nand precautions for firefighters\nSelf-contained breathing apparatus and full protective clothing must be worn in case of fire.\nFire-fighting\nequipment/instructions\nMove containers from fire area if you can do so without risk.\nSpecific methods\nUse standard firefighting procedures and consider the hazards of other involved materials.\nGeneral fire hazards\nNo unusual fire or explosion hazards noted.","REVISED_CONTENT":"Product ID:HZ-HEL,Product Description:Helium,Storage Location:0001,Storage Location Description:Lager 0001,Plant:0001,Section Id:5,Section Header:Fire-fighting measures,Section Content:Suitable extinguishing media\nCool containers exposed to heat with water spray and remove container, if no risk is involved.\nUnsuitable extinguishing\nmedia\nNone known.\nSpecific hazards arising from\nthe chemical\nContents under pressure. Pressurized container may explode when exposed to heat or flame.\nSpecial protective equipment\nand precautions for firefighters\nSelf-contained breathing apparatus and full protective clothing must be worn in case of fire.\nFire-fighting\nequipment/instructions\nMove containers from fire area if you can do so without risk.\nSpecific methods\nUse standard firefighting procedures and consider the hazards of other involved materials.\nGeneral fire hazards\nNo unusual fire or explosion hazards noted."}