{"GUID":"AkKsEQACHt+fl92lo1VIwg==","MATNR":"HZ-CHL","MAKTX":"Chlorine","WERKS":"0001","LGORT":"0001","LGOBE":"Lager 0001","SECTION_ID":1,"SECTION_HEADER":"Identification","SECTION_CONTENT":"1.1. Identification\nProduct form\nSubstance name\nCAS-No.\nProduct code\n: Substance\n: Chlorine\n: 7782-50-5\n: SG-1001-01518\n1.2. Recommended use and restrictions on use\nUse of the substance/mixture\n: Test gas/Calibration gas.\n1.3. Supplier\nAir Liquide USA LLC and its affiliates\n9811 Katy Freeway, Suite 100\nHouston, TX, 77024\nUSA\nT 1-800-819-1704\nwww.us.airliquide.com\n1.4. Emergency telephone number\nEmergency number\n: Chemtrec: 1-800-424-9300","REVISED_CONTENT":"Product ID:HZ-CHL,Product Description:Chlorine,Storage Location:0001,Storage Location Description:Lager 0001,Plant:0001,Section Id:1,Section Header:Identification,Section Content:1.1. Identification\nProduct form\nSubstance name\nCAS-No.\nProduct code\n: Substance\n: Chlorine\n: 7782-50-5\n: SG-1001-01518\n1.2. Recommended use and restrictions on use\nUse of the substance/mixture\n: Test gas/Calibration gas.\n1.3. Supplier\nAir Liquide USA LLC and its affiliates\n9811 Katy Freeway, Suite 100\nHouston, TX, 77024\nUSA\nT 1-800-819-1704\nwww.us.airliquide.com\n1.4. Emergency telephone number\nEmergency number\n: Chemtrec: 1-800-424-9300"}