{"GUID":"AkKsEQACHt+fl92lo1bIwg==","MATNR":"HZ-CHL","MAKTX":"Chlorine","WERKS":"0001","LGORT":"0001","LGOBE":"Lager 0001","SECTION_ID":13,"SECTION_HEADER":"Disposal considerations","SECTION_CONTENT":"13.1. Disposal methods\nWaste treatment methods\nProduct/Packaging disposal recommendations\nEcology - waste materials\n: Contact supplier if guidance is required. Do not discharge into any place where its accumulation\ncould be dangerous. Ensure that the emission levels from local regulations or operating permits\nare not exceeded.\n: Refer to the CGA Pamphlet P-63 \"Disposal of Gases\" available at www.cganet.com for\nmore guidance on suitable disposal methods. Dispose in a safe manner in accordance with\nlocal/national regulations. Dispose of contents/container in accordance with\nlocal/regional/national/international regulations.\n: Hazardous waste due to toxicity. Avoid release to the environment.","REVISED_CONTENT":"Product ID:HZ-CHL,Product Description:Chlorine,Storage Location:0001,Storage Location Description:Lager 0001,Plant:0001,Section Id:13,Section Header:Disposal considerations,Section Content:13.1. Disposal methods\nWaste treatment methods\nProduct/Packaging disposal recommendations\nEcology - waste materials\n: Contact supplier if guidance is required. Do not discharge into any place where its accumulation\ncould be dangerous. Ensure that the emission levels from local regulations or operating permits\nare not exceeded.\n: Refer to the CGA Pamphlet P-63 \"Disposal of Gases\" available at www.cganet.com for\nmore guidance on suitable disposal methods. Dispose in a safe manner in accordance with\nlocal/national regulations. Dispose of contents/container in accordance with\nlocal/regional/national/international regulations.\n: Hazardous waste due to toxicity. Avoid release to the environment."}