{"GUID":"AkKsEQACHt+fl92lpuPowg==","MATNR":"HZ-NIT","MAKTX":"Nitrogen","WERKS":"0001","LGORT":"0001","LGOBE":"Lager 0001","SECTION_ID":10,"SECTION_HEADER":"Stability and reactivity","SECTION_CONTENT":"10.1.\nReactivity\nNone known.\n10.2.\nChemical stability\nStable under normal conditions.\n10.3.\nPossibility of hazardous reactions\nNone known.\n10.4.\nConditions to avoid\nNone under recommended storage and handling conditions (see section 7).\n10.5. Incompatible materials\nNone known.\n10.6.\nHazardous decomposition products\nUnder normal conditions of storage and use, hazardous decomposition products should not be produced.","REVISED_CONTENT":"Product ID:HZ-NIT,Product Description:Nitrogen,Storage Location:0001,Storage Location Description:Lager 0001,Plant:0001,Section Id:10,Section Header:Stability and reactivity,Section Content:10.1.\nReactivity\nNone known.\n10.2.\nChemical stability\nStable under normal conditions.\n10.3.\nPossibility of hazardous reactions\nNone known.\n10.4.\nConditions to avoid\nNone under recommended storage and handling conditions (see section 7).\n10.5. Incompatible materials\nNone known.\n10.6.\nHazardous decomposition products\nUnder normal conditions of storage and use, hazardous decomposition products should not be produced."}