{"GUID":"AkKsEQACHt+fl92lptdowg==","MATNR":"HZ-MAG","MAKTX":"Magnesium","WERKS":"0001","LGORT":"0001","LGOBE":"Lager 0001","SECTION_ID":6,"SECTION_HEADER":"Accidental release measures","SECTION_CONTENT":"Use personal protective equipment. Ensure adequate ventilation. Avoid dust formation.\nRemove all sources of ignition.\nSee Section 12 for additional ecological information.\nMethods for Containment and Clean Sweep up or vacuum up spillage and collect in suitable container for disposal. Avoid dust\nUp\nformation. Remove all sources of ignition. Ground and bond containers when transferring\nmaterial. Use spark-proof tools and explosion-proof equipment.","REVISED_CONTENT":"Product ID:HZ-MAG,Product Description:Magnesium,Storage Location:0001,Storage Location Description:Lager 0001,Plant:0001,Section Id:6,Section Header:Accidental release measures,Section Content:Use personal protective equipment. Ensure adequate ventilation. Avoid dust formation.\nRemove all sources of ignition.\nSee Section 12 for additional ecological information.\nMethods for Containment and Clean Sweep up or vacuum up spillage and collect in suitable container for disposal. Avoid dust\nUp\nformation. Remove all sources of ignition. Ground and bond containers when transferring\nmaterial. Use spark-proof tools and explosion-proof equipment."}