{"GUID":"AkKsEQACHt+fl92lpuGowg==","MATNR":"HZ-NAC","MAKTX":"Nitric acid","WERKS":"0001","LGORT":"0003","LGOBE":"Corrosive Items","SECTION_ID":8,"SECTION_HEADER":"Exposure controls / personal protection","SECTION_CONTENT":"Protective measures : Ensure that eyewash stations and safety showers are close to\nthe workstation location.\nLegal requirements are to be considered in regard of the\nselection, use and care of personal protective equipment.\nDo not breathe vapours or spray mist.\nDo not get in eyes, on skin, or on clothing.\nEngineering measures : Use with local exhaust ventilation.\nEye protection : Face-shield\nSafety goggles\nHand protection : Impervious gloves\nGloves must be inspected prior to use.\nReplace when worn.\nSkin and body protection : Wear suitable protective equipment.\nWear as appropriate:\nComplete suit protecting against chemicals\nRespiratory protection : In case of insufficient ventilation, wear suitable respiratory\nequipment.\nHygiene measures : Separate rooms are required for washing, showering and\nchanging clothes.\nContaminated work clothing should not be allowed out of the\nworkplace.\nTake off all contaminated clothing immediately.\nRemove and wash contaminated clothing before re-use.\nWhen using do not eat or drink.\nWash hands before breaks and at the end of workday.","REVISED_CONTENT":"Product ID:HZ-NAC,Product Description:Nitric acid,Storage Location:0003,Storage Location Description:Corrosive Items,Plant:0001,Section Id:8,Section Header:Exposure controls / personal protection,Section Content:Protective measures : Ensure that eyewash stations and safety showers are close to\nthe workstation location.\nLegal requirements are to be considered in regard of the\nselection, use and care of personal protective equipment.\nDo not breathe vapours or spray mist.\nDo not get in eyes, on skin, or on clothing.\nEngineering measures : Use with local exhaust ventilation.\nEye protection : Face-shield\nSafety goggles\nHand protection : Impervious gloves\nGloves must be inspected prior to use.\nReplace when worn.\nSkin and body protection : Wear suitable protective equipment.\nWear as appropriate:\nComplete suit protecting against chemicals\nRespiratory protection : In case of insufficient ventilation, wear suitable respiratory\nequipment.\nHygiene measures : Separate rooms are required for washing, showering and\nchanging clothes.\nContaminated work clothing should not be allowed out of the\nworkplace.\nTake off all contaminated clothing immediately.\nRemove and wash contaminated clothing before re-use.\nWhen using do not eat or drink.\nWash hands before breaks and at the end of workday."}