{"GUID":"AkKsEQACHt+fl92lpsmowg==","MATNR":"HZ-GLY","MAKTX":"Glyphosate","WERKS":"0001","LGORT":"0088","LGOBE":"Lager 0088 (WM)","SECTION_ID":8,"SECTION_HEADER":"Exposure controls / personal protection","SECTION_CONTENT":"Exposure Guidelines This product does not contain any hazardous materials with occupational exposure\nlimitsestablished by the region specific regulatory bodies.\nEngineering Measures Ensure that eyewash stations and safety showers are close to the workstation location.\nPersonal Protective Equipment\nEye/face Protection Wear appropriate protective eyeglasses or chemical safety goggles as described by\nOSHA's eye and face protection regulations in 29 CFR 1910.133 or European Standard\nEN166.\nSkin and body protection Wear appropriate protective gloves and clothing to prevent skin exposure.\nRespiratory Protection Follow the OSHA respirator regulations found in 29 CFR 1910.134 or European Standard\nEN 149. Use a NIOSH/MSHA or European Standard EN 149 approved respirator if\nexposure limits are exceeded or if irritation or other symptoms are experienced.","REVISED_CONTENT":"Product ID:HZ-GLY,Product Description:Glyphosate,Storage Location:0088,Storage Location Description:Lager 0088 (WM),Plant:0001,Section Id:8,Section Header:Exposure controls / personal protection,Section Content:Exposure Guidelines This product does not contain any hazardous materials with occupational exposure\nlimitsestablished by the region specific regulatory bodies.\nEngineering Measures Ensure that eyewash stations and safety showers are close to the workstation location.\nPersonal Protective Equipment\nEye/face Protection Wear appropriate protective eyeglasses or chemical safety goggles as described by\nOSHA's eye and face protection regulations in 29 CFR 1910.133 or European Standard\nEN166.\nSkin and body protection Wear appropriate protective gloves and clothing to prevent skin exposure.\nRespiratory Protection Follow the OSHA respirator regulations found in 29 CFR 1910.134 or European Standard\nEN 149. Use a NIOSH/MSHA or European Standard EN 149 approved respirator if\nexposure limits are exceeded or if irritation or other symptoms are experienced."}