{"GUID":"AkKsEQACHt+fl92lptvIwg==","MATNR":"HZ-MEO","MAKTX":"Methanol","WERKS":"0001","LGORT":"0001","LGOBE":"Lager 0001","SECTION_ID":9,"SECTION_HEADER":"Physical and chemical properties","SECTION_CONTENT":"Form: liquid\nColour: colourless\nOdour: characteristic ethanolic\npH value: not available\nMelting point: -98°C\nBoiling point: 65°C\nAutoignition temperature: 455°C\nFlash point: 11°C\nExplosion limit:\nlower: 5,5 Vol%\nupper: 36,5 Vol%\ndynamic viscosity: (20°C): 0,597 mPa*s\nkinematical viscosity:\nVapour pressure: 128 mbar (20°C)\nDensity: 0,79 g/cm³ (20°C)\nBulk density: not applicable\nSolublity:\nin water: soluble\nin organic solvents: not available\nlog P(w/o): -0,74","REVISED_CONTENT":"Product ID:HZ-MEO,Product Description:Methanol,Storage Location:0001,Storage Location Description:Lager 0001,Plant:0001,Section Id:9,Section Header:Physical and chemical properties,Section Content:Form: liquid\nColour: colourless\nOdour: characteristic ethanolic\npH value: not available\nMelting point: -98°C\nBoiling point: 65°C\nAutoignition temperature: 455°C\nFlash point: 11°C\nExplosion limit:\nlower: 5,5 Vol%\nupper: 36,5 Vol%\ndynamic viscosity: (20°C): 0,597 mPa*s\nkinematical viscosity:\nVapour pressure: 128 mbar (20°C)\nDensity: 0,79 g/cm³ (20°C)\nBulk density: not applicable\nSolublity:\nin water: soluble\nin organic solvents: not available\nlog P(w/o): -0,74"}