{"GUID":"AkKsEQACHt+fl92lrO9owg==","MATNR":"HZ-SOH","MAKTX":"Sodium hydroxide","WERKS":"0001","LGORT":"0100","LGOBE":"Lagerort WM&HU","SECTION_ID":6,"SECTION_HEADER":"Accidental release measures","SECTION_CONTENT":"Use personal protective equipment. Evacuate personnel to safe areas. Avoid contact with\nskin, eyes and clothing.\nDo not allow material to contaminate ground water system. Should not be released into the\nenvironment. Do not flush into surface water or sanitary sewer system. See Section 12 for\nadditional ecological information.\nAvoid dust formation. Sweep up or vacuum up spillage and collect in suitable container for\ndisposal.","REVISED_CONTENT":"Product ID:HZ-SOH,Product Description:Sodium hydroxide,Storage Location:0100,Storage Location Description:Lagerort WM&HU,Plant:0001,Section Id:6,Section Header:Accidental release measures,Section Content:Use personal protective equipment. Evacuate personnel to safe areas. Avoid contact with\nskin, eyes and clothing.\nDo not allow material to contaminate ground water system. Should not be released into the\nenvironment. Do not flush into surface water or sanitary sewer system. See Section 12 for\nadditional ecological information.\nAvoid dust formation. Sweep up or vacuum up spillage and collect in suitable container for\ndisposal."}