{"GUID":"AkKsEQACHt+fl92lrOOowg==","MATNR":"HZ-POH","MAKTX":"Potassium hydroxide","WERKS":"0001","LGORT":"0003","LGOBE":"Corrosive Items","SECTION_ID":8,"SECTION_HEADER":"Exposure controls / personal protection","SECTION_CONTENT":"Control Parameters\nOccupational Exposure Limits\nChemical Identity\nType\nExposure Limit Values\nPotassium hydroxide\nCeiling\n2 mg/m3\nCeil_Time\n2 mg/m3\nCeiling\n2 mg/m3\nAN ESL\n2 µg/m3\nST ESL\n20 µg/m3\nCeiling\n2 mg/m3\nSource\nUS. ACGIH Threshold Limit Values (2011)\nUS. NIOSH: Pocket Guide to Chemical\nHazards (2016)\nUS. OSHA Table Z-1-A (29 CFR 1910.1000)\n(1989)\nUS. Tennessee. OELs. Occupational Exposure\nLimits, Table Z1A (06 2008)\nUS. Texas. Effects Screening Levels (Texas\nCommission on Environmental Quality) (03\n2014)\nUS. Texas. Effects Screening Levels (Texas\nCommission on Environmental Quality) (03\n2014)\nUS. California Code of Regulations, Title 8,\nSection 5155. Airborne Contaminants (08\n2010)\nAppropriate Engineering\nControls\nNo data available.\nIndividual protection measures, such as personal protective equipment\nGeneral information:\nGood general ventilation (typically 10 air changes per hour) should be used.\nVentilation rates should be matched to conditions. If applicable, use\nprocess enclosures, local exhaust ventilation, or other engineering controls\nto maintain airborne levels below recommended exposure limits. If\nexposure limits have not been established, maintain airborne levels to an\nacceptable level. An eye wash and safety shower must be available in the\nimmediate work area.\nEye/face protection:\nWear safety glasses with side shields (or goggles) and a face shield.\nSkin Protection\nChemical resistant gloves\nHand Protection:\nOther:\nWear appropriate clothing to prevent reasonably probable skin contact.\nRespiratory Protection:\nIn case of inadequate ventilation use suitable respirator. High-efficiency\nparticulate respirator with full facepiece.\nHygiene measures:\nProvide eyewash station and safety shower. Observe good industrial\nhygiene practices. Wash hands before breaks and immediately after\nhandling the product. Wash contaminated clothing before reuse. Avoid\ncontact with eyes, skin, and clothing.","REVISED_CONTENT":"Product ID:HZ-POH,Product Description:Potassium hydroxide,Storage Location:0003,Storage Location Description:Corrosive Items,Plant:0001,Section Id:8,Section Header:Exposure controls / personal protection,Section Content:Control Parameters\nOccupational Exposure Limits\nChemical Identity\nType\nExposure Limit Values\nPotassium hydroxide\nCeiling\n2 mg/m3\nCeil_Time\n2 mg/m3\nCeiling\n2 mg/m3\nAN ESL\n2 µg/m3\nST ESL\n20 µg/m3\nCeiling\n2 mg/m3\nSource\nUS. ACGIH Threshold Limit Values (2011)\nUS. NIOSH: Pocket Guide to Chemical\nHazards (2016)\nUS. OSHA Table Z-1-A (29 CFR 1910.1000)\n(1989)\nUS. Tennessee. OELs. Occupational Exposure\nLimits, Table Z1A (06 2008)\nUS. Texas. Effects Screening Levels (Texas\nCommission on Environmental Quality) (03\n2014)\nUS. Texas. Effects Screening Levels (Texas\nCommission on Environmental Quality) (03\n2014)\nUS. California Code of Regulations, Title 8,\nSection 5155. Airborne Contaminants (08\n2010)\nAppropriate Engineering\nControls\nNo data available.\nIndividual protection measures, such as personal protective equipment\nGeneral information:\nGood general ventilation (typically 10 air changes per hour) should be used.\nVentilation rates should be matched to conditions. If applicable, use\nprocess enclosures, local exhaust ventilation, or other engineering controls\nto maintain airborne levels below recommended exposure limits. If\nexposure limits have not been established, maintain airborne levels to an\nacceptable level. An eye wash and safety shower must be available in the\nimmediate work area.\nEye/face protection:\nWear safety glasses with side shields (or goggles) and a face shield.\nSkin Protection\nChemical resistant gloves\nHand Protection:\nOther:\nWear appropriate clothing to prevent reasonably probable skin contact.\nRespiratory Protection:\nIn case of inadequate ventilation use suitable respirator. High-efficiency\nparticulate respirator with full facepiece.\nHygiene measures:\nProvide eyewash station and safety shower. Observe good industrial\nhygiene practices. Wash hands before breaks and immediately after\nhandling the product. Wash contaminated clothing before reuse. Avoid\ncontact with eyes, skin, and clothing."}