{"GUID":"AkKsEQACHt+fl92lpsrIwg==","MATNR":"HZ-HAC","MAKTX":"Hydrochloric acid","WERKS":"0001","LGORT":"0003","LGOBE":"Corrosive Items","SECTION_ID":1,"SECTION_HEADER":"Identification","SECTION_CONTENT":"Hydrochloric acid\nAC423790000; AC423790025; AC423790026; AC423790250;\nAC423790251; AC423795000; AC423795001\nMuriatic acid; Hydrogen chloride; HCI\nLaboratory chemicals.\nNo Information available\nDetails of the supplier of the safety data sheet\nCompany\nFisher Scientific\nOne Reagent Lane\nFair Lawn, NJ 07410\nTel: (201) 796-7100\nEntity / Business Name\nAcros Organics\nOne Reagent Lane\nFair Lawn, NJ 07410\nEmergency Telephone Number\nFor information US call: 001-800-ACROS-01\n/ Europe call: +32 14 57 52 11\nEmergency Number US:001-201-796-7100 /\nEurope: +32 14 57 52 99\nCHEMTREC Tel. No.US:001-800-424-9300 /\nEurope:001-703-527-3887","REVISED_CONTENT":"Product ID:HZ-HAC,Product Description:Hydrochloric acid,Storage Location:0003,Storage Location Description:Corrosive Items,Plant:0001,Section Id:1,Section Header:Identification,Section Content:Hydrochloric acid\nAC423790000; AC423790025; AC423790026; AC423790250;\nAC423790251; AC423795000; AC423795001\nMuriatic acid; Hydrogen chloride; HCI\nLaboratory chemicals.\nNo Information available\nDetails of the supplier of the safety data sheet\nCompany\nFisher Scientific\nOne Reagent Lane\nFair Lawn, NJ 07410\nTel: (201) 796-7100\nEntity / Business Name\nAcros Organics\nOne Reagent Lane\nFair Lawn, NJ 07410\nEmergency Telephone Number\nFor information US call: 001-800-ACROS-01\n/ Europe call: +32 14 57 52 11\nEmergency Number US:001-201-796-7100 /\nEurope: +32 14 57 52 99\nCHEMTREC Tel. No.US:001-800-424-9300 /\nEurope:001-703-527-3887"}