{"GUID":"AkKsEQACHt+fl92lo19Iwg==","MATNR":"HZ-GAS","MAKTX":"Gasoline","WERKS":"0001","LGORT":"0001","LGOBE":"Lager 0001","SECTION_ID":1,"SECTION_HEADER":"Identification","SECTION_CONTENT":"PRODUCT\nProduct Name:\nGASOLINE\nProduct Description:\nHydrocarbons and Additives\nProduct Code:\n708439\nIntended Use:\nFuel\nMARPOL Annex I Category: Gasoline and spirits\nSee Section 14 for transportation information related to the Bill of Lading, other shipping documents\nCOMPANY IDENTIFICATION\nCountry\nCompany\nInternational Sales\nExxonMobil Marine Fuels\nErmyn House\nMP 31 Ermyn Way\nLeatherhead,\nKT22 8UX\nAustralia\nMOBIL OIL AUSTRALIA PTY LTD\nΑ.Β.Ν. 88 004 052 984\n12 Riverside Quay\nSouthbank\nVictoria 3006\nAustralia\nBelgium\nExxonMobil Petroleum & Chemical BVBA\nPolderdijkweg\nHaven 447-2030\nAntwerpen, Belgium\nCanada\nImperial Oil\n505 Quarry Park Boulevard SE\nCalgary, AB T2C 5N1 Canada\nFiji\nMobil Oil Australia Pty Ltd - t/a Mobil Oil Fiji\nLevel 6, ANZ House,\n25 Victoria Parade,\nSuva, Fiji Islands\nFrance\nEsso SAF\nTour Manhattan La Defense 2\n5/6 Place de l'Iris\n92400 Courbevoie\nFrance\nHong Kong\nExxonMobil Hong Kong Limited:\n2201, 22/F, Central Plaza\n18 Harbour Road, Wanchai, Hong Kong\nItaly\nEsso Italiana SRL\nViale Castello della Magliana 25\nRome 00148 Italy\nNew Zealand\nMobil Oil New Zealand Limited\nVero Centre\n48 Shortland Street\nAuckland 1140\nUK\nEmergency Telephone Number\n(UK) (+44) (0) 23 8089 1558\n+1 609 737 4411\n+32 (0) 487 545 780\n1-866-232-9563\n+1 609 737 4411\n+33 08 1000 3353\n+1 609 737 4411\n+39 0382 24444\nNational Poison Center +64 3 479 7248\nFreephone 0800 764 766","REVISED_CONTENT":"Product ID:HZ-GAS,Product Description:Gasoline,Storage Location:0001,Storage Location Description:Lager 0001,Plant:0001,Section Id:1,Section Header:Identification,Section Content:PRODUCT\nProduct Name:\nGASOLINE\nProduct Description:\nHydrocarbons and Additives\nProduct Code:\n708439\nIntended Use:\nFuel\nMARPOL Annex I Category: Gasoline and spirits\nSee Section 14 for transportation information related to the Bill of Lading, other shipping documents\nCOMPANY IDENTIFICATION\nCountry\nCompany\nInternational Sales\nExxonMobil Marine Fuels\nErmyn House\nMP 31 Ermyn Way\nLeatherhead,\nKT22 8UX\nAustralia\nMOBIL OIL AUSTRALIA PTY LTD\nΑ.Β.Ν. 88 004 052 984\n12 Riverside Quay\nSouthbank\nVictoria 3006\nAustralia\nBelgium\nExxonMobil Petroleum & Chemical BVBA\nPolderdijkweg\nHaven 447-2030\nAntwerpen, Belgium\nCanada\nImperial Oil\n505 Quarry Park Boulevard SE\nCalgary, AB T2C 5N1 Canada\nFiji\nMobil Oil Australia Pty Ltd - t/a Mobil Oil Fiji\nLevel 6, ANZ House,\n25 Victoria Parade,\nSuva, Fiji Islands\nFrance\nEsso SAF\nTour Manhattan La Defense 2\n5/6 Place de l'Iris\n92400 Courbevoie\nFrance\nHong Kong\nExxonMobil Hong Kong Limited:\n2201, 22/F, Central Plaza\n18 Harbour Road, Wanchai, Hong Kong\nItaly\nEsso Italiana SRL\nViale Castello della Magliana 25\nRome 00148 Italy\nNew Zealand\nMobil Oil New Zealand Limited\nVero Centre\n48 Shortland Street\nAuckland 1140\nUK\nEmergency Telephone Number\n(UK) (+44) (0) 23 8089 1558\n+1 609 737 4411\n+32 (0) 487 545 780\n1-866-232-9563\n+1 609 737 4411\n+33 08 1000 3353\n+1 609 737 4411\n+39 0382 24444\nNational Poison Center +64 3 479 7248\nFreephone 0800 764 766"}