{"GUID":"AkKsEQACHt+fl92lrOJowg==","MATNR":"HZ-PLU","MAKTX":"Plutonium nitrate","WERKS":"0001","LGORT":"0088","LGOBE":"Lager 0088 (WM)","SECTION_ID":14,"SECTION_HEADER":"Transport information","SECTION_CONTENT":"The U.S. Department of Transportation (D.O.T.) Code of Federal Regulations (49 CFR Parts\n100-185), the International Air Transportation Association (IATA), International Civil\nAviation Organization (ICAO) and International Maritime Organization (IMDG) are all\nfactored into the classification and transport of material.\nProper Shipping Name:\nHazard Class:\nN/ID Number:\nSpecial Information:\nPacking Group:","REVISED_CONTENT":"Product ID:HZ-PLU,Product Description:Plutonium nitrate,Storage Location:0088,Storage Location Description:Lager 0088 (WM),Plant:0001,Section Id:14,Section Header:Transport information,Section Content:The U.S. Department of Transportation (D.O.T.) Code of Federal Regulations (49 CFR Parts\n100-185), the International Air Transportation Association (IATA), International Civil\nAviation Organization (ICAO) and International Maritime Organization (IMDG) are all\nfactored into the classification and transport of material.\nProper Shipping Name:\nHazard Class:\nN/ID Number:\nSpecial Information:\nPacking Group:"}