{"GUID":"AkKsEQACHt+fl92lpuDowg==","MATNR":"HZ-NAC","MAKTX":"Nitric acid","WERKS":"0001","LGORT":"0003","LGOBE":"Corrosive Items","SECTION_ID":2,"SECTION_HEADER":"Hazard identification","SECTION_CONTENT":"Emergency Overview\nForm : liquid\nColor : colourless\nOdor : weak\nClassification of the substance or mixture\nClassification of the substance\nor mixture : Oxidizing liquids, Category 3\nCorrosive to metals, Category 1\nSkin corrosion, Category 1A\nSerious eye damage, Category 1\nAcute toxicity, Category 3\nGHS Label elements, including precautionary statements\nSymbol(s) : \nSignal word : Danger\nHazard statements : May intensify fire; oxidizer.\nMay be corrosive to metals.\nCauses severe skin burns and eye damage.\nToxic if inhaled.\nPrecautionary statements : Prevention:\nKeep away from heat.\nKeep/ Store away from clothing/ combustible materials.\nTake any precaution to avoid mixing with combustibles.\nKeep only in original container.\nWash skin thoroughly after handling.\nWear protective gloves/protective clothing/eye protection/face\nprotection.\nResponse:\nIF SWALLOWED: Rinse mouth. Do NOT induce vomiting.\nIF ON SKIN (or hair): Remove/ Take off immediately all\ncontaminated clothing. Rinse skin with water/ shower.\nIF INHALED: Remove victim to fresh air and keep at rest in a\nposition comfortable for breathing.\nIF IN EYES: Rinse cautiously with water for several minutes.\nRemove contact lenses, if present and easy to do. Continue\nrinsing.\nImmediately call a POISON CENTER/ doctor.\nWash contaminated clothing before reuse.\nIn case of fire: Use dry sand, dry chemical or alcohol-resistant\nfoam for extinction.\nAbsorb spillage to prevent material damage.\nStorage:\nStore locked up.\nStore in corrosive resistant container with a resistant inner liner.\nDisposal:\nDispose of contents/ container to an approved waste disposal\nplant.\nHazards not otherwise\nclassified : Corrosive to the respiratory tract.\nCarcinogenicity\nNo component of this product present at levels greater than or equal to 0.1% is identified as a known or\nanticipated carcinogen by NTP, IARC, or OSHA.","REVISED_CONTENT":"Product ID:HZ-NAC,Product Description:Nitric acid,Storage Location:0003,Storage Location Description:Corrosive Items,Plant:0001,Section Id:2,Section Header:Hazard identification,Section Content:Emergency Overview\nForm : liquid\nColor : colourless\nOdor : weak\nClassification of the substance or mixture\nClassification of the substance\nor mixture : Oxidizing liquids, Category 3\nCorrosive to metals, Category 1\nSkin corrosion, Category 1A\nSerious eye damage, Category 1\nAcute toxicity, Category 3\nGHS Label elements, including precautionary statements\nSymbol(s) : \nSignal word : Danger\nHazard statements : May intensify fire; oxidizer.\nMay be corrosive to metals.\nCauses severe skin burns and eye damage.\nToxic if inhaled.\nPrecautionary statements : Prevention:\nKeep away from heat.\nKeep/ Store away from clothing/ combustible materials.\nTake any precaution to avoid mixing with combustibles.\nKeep only in original container.\nWash skin thoroughly after handling.\nWear protective gloves/protective clothing/eye protection/face\nprotection.\nResponse:\nIF SWALLOWED: Rinse mouth. Do NOT induce vomiting.\nIF ON SKIN (or hair): Remove/ Take off immediately all\ncontaminated clothing. Rinse skin with water/ shower.\nIF INHALED: Remove victim to fresh air and keep at rest in a\nposition comfortable for breathing.\nIF IN EYES: Rinse cautiously with water for several minutes.\nRemove contact lenses, if present and easy to do. Continue\nrinsing.\nImmediately call a POISON CENTER/ doctor.\nWash contaminated clothing before reuse.\nIn case of fire: Use dry sand, dry chemical or alcohol-resistant\nfoam for extinction.\nAbsorb spillage to prevent material damage.\nStorage:\nStore locked up.\nStore in corrosive resistant container with a resistant inner liner.\nDisposal:\nDispose of contents/ container to an approved waste disposal\nplant.\nHazards not otherwise\nclassified : Corrosive to the respiratory tract.\nCarcinogenicity\nNo component of this product present at levels greater than or equal to 0.1% is identified as a known or\nanticipated carcinogen by NTP, IARC, or OSHA."}