{"GUID":"AkKsEQACHt+fl92lo1MIwg==","MATNR":"HZ-CAD","MAKTX":"Cadmium","WERKS":"0001","LGORT":"0088","LGOBE":"Lager 0088 (WM)","SECTION_ID":15,"SECTION_HEADER":"Regulatory information","SECTION_CONTENT":"Federal and State Regulations:\nCalifornia prop. 65: This product contains the following ingredients for which the State of California has found to cause cancer,\nbirth defects or other reproductive harm, which would require a warning under the statute: Cadmium California prop. 65: This\nproduct contains the following ingredients for which the State of California has found to cause cancer which would require\na warning under the statute: Cadmium Pennsylvania RTK: Cadmium Massachusetts RTK: Cadmium TSCA 8(b) inventory:\nCadmium SARA 313 toxic chemical notification and release reporting: Cadmium CERCLA: Hazardous substances.: Cadmium\nOther Regulations: OSHA: Hazardous by definition of Hazard Communication Standard (29 CFR 1910.1200).\nOther Classifications:\nWHMIS (Canada):\nCLASS D-1A: Material causing immediate and serious toxic effects (VERY TOXIC). CLASS D-2A: Material causing other toxic\neffects (VERY TOXIC).\nDSCL (EEC):\nR26- Very toxic by inhalation. R45- May cause cancer.\nHMIS (U.S.A.):\nHealth Hazard: 3\nFire Hazard: 1\nReactivity: 0\nPersonal Protection: E\nNational Fire Protection Association (U.S.A.):\nHealth: 3\nFlammability: 1\nReactivity: 0\nSpecific hazard:\nProtective Equipment:\nGloves. Lab coat. Dust respirator. Be sure to use an approved/certified respirator or equivalent. Wear appropriate respirator\nwhen ventilation is inadequate. Safety glasses.","REVISED_CONTENT":"Product ID:HZ-CAD,Product Description:Cadmium,Storage Location:0088,Storage Location Description:Lager 0088 (WM),Plant:0001,Section Id:15,Section Header:Regulatory information,Section Content:Federal and State Regulations:\nCalifornia prop. 65: This product contains the following ingredients for which the State of California has found to cause cancer,\nbirth defects or other reproductive harm, which would require a warning under the statute: Cadmium California prop. 65: This\nproduct contains the following ingredients for which the State of California has found to cause cancer which would require\na warning under the statute: Cadmium Pennsylvania RTK: Cadmium Massachusetts RTK: Cadmium TSCA 8(b) inventory:\nCadmium SARA 313 toxic chemical notification and release reporting: Cadmium CERCLA: Hazardous substances.: Cadmium\nOther Regulations: OSHA: Hazardous by definition of Hazard Communication Standard (29 CFR 1910.1200).\nOther Classifications:\nWHMIS (Canada):\nCLASS D-1A: Material causing immediate and serious toxic effects (VERY TOXIC). CLASS D-2A: Material causing other toxic\neffects (VERY TOXIC).\nDSCL (EEC):\nR26- Very toxic by inhalation. R45- May cause cancer.\nHMIS (U.S.A.):\nHealth Hazard: 3\nFire Hazard: 1\nReactivity: 0\nPersonal Protection: E\nNational Fire Protection Association (U.S.A.):\nHealth: 3\nFlammability: 1\nReactivity: 0\nSpecific hazard:\nProtective Equipment:\nGloves. Lab coat. Dust respirator. Be sure to use an approved/certified respirator or equivalent. Wear appropriate respirator\nwhen ventilation is inadequate. Safety glasses."}