{"GUID":"AkKsEQACHt+fl92loTZowg==","MATNR":"HZ-BUT","MAKTX":"Butane","WERKS":"0001","LGORT":"0001","LGOBE":"Lager 0001","SECTION_ID":12,"SECTION_HEADER":"Ecological information","SECTION_CONTENT":"SECTION 12: Ecological information\n12.1 Toxicity\nNo data available\n12.2 Persistence and degradability\nNo data available\n12.3 Bioaccumulative potential\nNo data available\n12.4 Mobility in soil\nNo data available\n12.5 Results of PBT and vPvB assessment\nPBT/vPvB assessment not available as chemical safety assessment not required/not\nconducted\n12.6 Endocrine disrupting properties\nNo data available\n12.7 Other adverse effects\nNo data available","REVISED_CONTENT":"Product ID:HZ-BUT,Product Description:Butane,Storage Location:0001,Storage Location Description:Lager 0001,Plant:0001,Section Id:12,Section Header:Ecological information,Section Content:SECTION 12: Ecological information\n12.1 Toxicity\nNo data available\n12.2 Persistence and degradability\nNo data available\n12.3 Bioaccumulative potential\nNo data available\n12.4 Mobility in soil\nNo data available\n12.5 Results of PBT and vPvB assessment\nPBT/vPvB assessment not available as chemical safety assessment not required/not\nconducted\n12.6 Endocrine disrupting properties\nNo data available\n12.7 Other adverse effects\nNo data available"}