{"GUID":"AkKsEQACHt+fl92lo1vowg==","MATNR":"HZ-DYN","MAKTX":"Dynamite Gray","WERKS":"0001","LGORT":"0004","LGOBE":"Explosives","SECTION_ID":6,"SECTION_HEADER":"Accidental release measures","SECTION_CONTENT":"Personal precautions, protective equipment and emergency procedures\nFor non-emergency personnel\n:\nNo action shall be taken involving any personal risk or without\nsuitable training. Evacuate surrounding areas. Keep unnecessary and\nunprotected personnel from entering. Do not touch or walk through\nspilled material. Put on appropriate personal protective equipment.\nIf specialised clothing is required to deal with the spillage, take note of\nany information in Section 8 on suitable and unsuitable materials. See\nalso the information in \"For non-emergency personnel\".\nFor emergency responders\n:\nEnvironmental precautions\n:\nAvoid dispersal of spilled material and runoff and contact with soil,\nwaterways, drains and sewers. Inform the relevant authorities if the\nproduct has caused environmental pollution (sewers, waterways, soil\nor air).\nMethods and materials for containment and cleaning up\nSmall spill\n:\nMove containers from spill area. Vacuum or sweep up material and\nplace in a designated, labeled waste container. Dispose of via a\nlicensed waste disposal contractor.\nLarge spill\n:\nMove containers from spill area. Prevent entry into sewers, water\ncourses, basements or confined areas. Vacuum or sweep up material\nand place in a designated, labeled waste container. Dispose of via a\nlicensed waste disposal contractor. Note: see Section 1 for emergency","REVISED_CONTENT":"Product ID:HZ-DYN,Product Description:Dynamite Gray,Storage Location:0004,Storage Location Description:Explosives,Plant:0001,Section Id:6,Section Header:Accidental release measures,Section Content:Personal precautions, protective equipment and emergency procedures\nFor non-emergency personnel\n:\nNo action shall be taken involving any personal risk or without\nsuitable training. Evacuate surrounding areas. Keep unnecessary and\nunprotected personnel from entering. Do not touch or walk through\nspilled material. Put on appropriate personal protective equipment.\nIf specialised clothing is required to deal with the spillage, take note of\nany information in Section 8 on suitable and unsuitable materials. See\nalso the information in \"For non-emergency personnel\".\nFor emergency responders\n:\nEnvironmental precautions\n:\nAvoid dispersal of spilled material and runoff and contact with soil,\nwaterways, drains and sewers. Inform the relevant authorities if the\nproduct has caused environmental pollution (sewers, waterways, soil\nor air).\nMethods and materials for containment and cleaning up\nSmall spill\n:\nMove containers from spill area. Vacuum or sweep up material and\nplace in a designated, labeled waste container. Dispose of via a\nlicensed waste disposal contractor.\nLarge spill\n:\nMove containers from spill area. Prevent entry into sewers, water\ncourses, basements or confined areas. Vacuum or sweep up material\nand place in a designated, labeled waste container. Dispose of via a\nlicensed waste disposal contractor. Note: see Section 1 for emergency"}