{"GUID":"AkKsEQACHt+fl92lrORowg==","MATNR":"HZ-POH","MAKTX":"Potassium hydroxide","WERKS":"0001","LGORT":"0003","LGOBE":"Corrosive Items","SECTION_ID":14,"SECTION_HEADER":"Transport information","SECTION_CONTENT":"DOT\nUN Number:\nUN 1813\nUN Proper Shipping Name:\nPotassium hydroxide, solid\nTransport Hazard Class(es)\nClass:\n8\nLabel(s):\n8\nPacking Group:\n||\nMarine Pollutant:\nNo\nSpecial precautions for user:\nKeep away from acids.\nIMDG\nUN Number:\nUN 1813\nUN Proper Shipping Name:\nPOTASSIUM HYDROXIDE, SOLID\nTransport Hazard Class(es)\nClass:\n8\nLabel(s):\n8\nEmS No.:\nF-A, S-B\nPacking Group:\n||\nMarine Pollutant:\nNo\nSpecial precautions for user:\nKeep away from acids.\nIATA\nUN Number:\nUN 1813\nProper Shipping Name:\nPotassium hydroxide, solid\nTransport Hazard Class(es):\nClass:\n8\nLabel(s):\n8\nPacking Group:\nNo\nMarine Pollutant:\nKeep away from acids.","REVISED_CONTENT":"Product ID:HZ-POH,Product Description:Potassium hydroxide,Storage Location:0003,Storage Location Description:Corrosive Items,Plant:0001,Section Id:14,Section Header:Transport information,Section Content:DOT\nUN Number:\nUN 1813\nUN Proper Shipping Name:\nPotassium hydroxide, solid\nTransport Hazard Class(es)\nClass:\n8\nLabel(s):\n8\nPacking Group:\n||\nMarine Pollutant:\nNo\nSpecial precautions for user:\nKeep away from acids.\nIMDG\nUN Number:\nUN 1813\nUN Proper Shipping Name:\nPOTASSIUM HYDROXIDE, SOLID\nTransport Hazard Class(es)\nClass:\n8\nLabel(s):\n8\nEmS No.:\nF-A, S-B\nPacking Group:\n||\nMarine Pollutant:\nNo\nSpecial precautions for user:\nKeep away from acids.\nIATA\nUN Number:\nUN 1813\nProper Shipping Name:\nPotassium hydroxide, solid\nTransport Hazard Class(es):\nClass:\n8\nLabel(s):\n8\nPacking Group:\nNo\nMarine Pollutant:\nKeep away from acids."}