{"GUID":"AkKsEQACHt+fl92lo1TIwg==","MATNR":"HZ-CES","MAKTX":"Cesium","WERKS":"0001","LGORT":"0088","LGOBE":"Lager 0088 (WM)","SECTION_ID":13,"SECTION_HEADER":"Disposal considerations","SECTION_CONTENT":"SECTION 13: Disposal considerations\n13.1 Waste treatment methods\nProduct\nBurn in a chemical incinerator equipped with an afterburner and scrubber but exert extra\ncare in igniting as this material is highly flammable. Offer surplus and non-recyclable\nsolutions to a licensed disposal company. Contact a licensed professional waste disposal\nservice to dispose of this material. Dissolve or mix the material with a combustible\nsolvent and burn in a chemical incinerator equipped with an afterburner and scrubber.\nContaminated packaging\nDispose of as unused product.","REVISED_CONTENT":"Product ID:HZ-CES,Product Description:Cesium,Storage Location:0088,Storage Location Description:Lager 0088 (WM),Plant:0001,Section Id:13,Section Header:Disposal considerations,Section Content:SECTION 13: Disposal considerations\n13.1 Waste treatment methods\nProduct\nBurn in a chemical incinerator equipped with an afterburner and scrubber but exert extra\ncare in igniting as this material is highly flammable. Offer surplus and non-recyclable\nsolutions to a licensed disposal company. Contact a licensed professional waste disposal\nservice to dispose of this material. Dissolve or mix the material with a combustible\nsolvent and burn in a chemical incinerator equipped with an afterburner and scrubber.\nContaminated packaging\nDispose of as unused product."}