{"GUID":"AkKsEQACHt+fl92lo1powg==","MATNR":"HZ-CMO","MAKTX":"Carbon monoxide","WERKS":"0001","LGORT":"0001","LGOBE":"Lager 0001","SECTION_ID":10,"SECTION_HEADER":"Stability and reactivity","SECTION_CONTENT":"Reactivity\nChemical stability\nPossibility of hazardous reactions\nConditions to avoid\nIncompatible materials\nHazardous decomposition products\n: None known.\n: Stable under normal conditions.\n: Can form explosive mixture with air.\n: None under recommended storage and handling conditions (see section 7).\n: Oxidizing materials. Air.\n: Under normal conditions of storage and use, hazardous decomposition products should not be produced.","REVISED_CONTENT":"Product ID:HZ-CMO,Product Description:Carbon monoxide,Storage Location:0001,Storage Location Description:Lager 0001,Plant:0001,Section Id:10,Section Header:Stability and reactivity,Section Content:Reactivity\nChemical stability\nPossibility of hazardous reactions\nConditions to avoid\nIncompatible materials\nHazardous decomposition products\n: None known.\n: Stable under normal conditions.\n: Can form explosive mixture with air.\n: None under recommended storage and handling conditions (see section 7).\n: Oxidizing materials. Air.\n: Under normal conditions of storage and use, hazardous decomposition products should not be produced."}