{"GUID":"AkKsEQACHt+fl92loTbIwg==","MATNR":"HZ-BUT","MAKTX":"Butane","WERKS":"0001","LGORT":"0001","LGOBE":"Lager 0001","SECTION_ID":15,"SECTION_HEADER":"Regulatory information","SECTION_CONTENT":"SECTION 15: Regulatory information\nSARA 302 Components\nThis material does not contain any components with a section 302 EHS TPQ.\nSARA 313 Components\nThis material does not contain any chemical components with known CAS numbers that\nexceed the threshold (De Minimis) reporting levels established by SARA Title III, Section\n313.\nSARA 311/312 Hazards\nFire Hazard, Chronic Health Hazard\nMassachusetts Right To Know Components\nNo components are subject to the Massachusetts Right to Know Act.","REVISED_CONTENT":"Product ID:HZ-BUT,Product Description:Butane,Storage Location:0001,Storage Location Description:Lager 0001,Plant:0001,Section Id:15,Section Header:Regulatory information,Section Content:SECTION 15: Regulatory information\nSARA 302 Components\nThis material does not contain any components with a section 302 EHS TPQ.\nSARA 313 Components\nThis material does not contain any chemical components with known CAS numbers that\nexceed the threshold (De Minimis) reporting levels established by SARA Title III, Section\n313.\nSARA 311/312 Hazards\nFire Hazard, Chronic Health Hazard\nMassachusetts Right To Know Components\nNo components are subject to the Massachusetts Right to Know Act."}