{"GUID":"AkKsEQACHt+fl92loTRIwg==","MATNR":"HZ-BEN","MAKTX":"Benzene","WERKS":"0001","LGORT":"0001","LGOBE":"Lager 0001","SECTION_ID":11,"SECTION_HEADER":"Toxicological information","SECTION_CONTENT":"• Information on toxicological effects\n• Acute toxicity:\n•LD/LC50 values that are relevant for classification:\nATE (Acute Toxicity Estimate)\nOral\nLD50\n3,340 mg/kg (rat)\nDermal LD50\n48 mg/kg (mouse)\n71-43-2 benzene\nOral\nLD50\n3,340 mg/kg (rat)\nDermal LD50\n48 mg/kg (mouse)\n>8,260 mg/kg (rabbit)\nInhalative LC50/4 h 9,980 mg/L (mouse)\nPrimary irritant effect:\non the skin: Irritant to skin and mucous membranes.\non the eye: Irritating effect.\nSensitization: No sensitizing effects known.\nAdditional toxicological information: Danger through skin absorption.\nCarcinogenic categories\n· IARC (International Agency for Research on Cancer)","REVISED_CONTENT":"Product ID:HZ-BEN,Product Description:Benzene,Storage Location:0001,Storage Location Description:Lager 0001,Plant:0001,Section Id:11,Section Header:Toxicological information,Section Content:• Information on toxicological effects\n• Acute toxicity:\n•LD/LC50 values that are relevant for classification:\nATE (Acute Toxicity Estimate)\nOral\nLD50\n3,340 mg/kg (rat)\nDermal LD50\n48 mg/kg (mouse)\n71-43-2 benzene\nOral\nLD50\n3,340 mg/kg (rat)\nDermal LD50\n48 mg/kg (mouse)\n>8,260 mg/kg (rabbit)\nInhalative LC50/4 h 9,980 mg/L (mouse)\nPrimary irritant effect:\non the skin: Irritant to skin and mucous membranes.\non the eye: Irritating effect.\nSensitization: No sensitizing effects known.\nAdditional toxicological information: Danger through skin absorption.\nCarcinogenic categories\n· IARC (International Agency for Research on Cancer)"}