{"GUID":"AkKsEQACHt+fl92lrPkowg==","MATNR":"HZ-TOL","MAKTX":"Toluene","WERKS":"0001","LGORT":"0001","LGOBE":"Lager 0001","SECTION_ID":4,"SECTION_HEADER":"First-aid measures","SECTION_CONTENT":"General Advice\nIf symptoms persist, call a physician.\nEye Contact\nRinse immediately with plenty of water, also under the eyelids, for at least 15 minutes. Get\nmedical attention.\nSkin Contact\nWash off immediately with plenty of water for at least 15 minutes. If skin irritation persists,\ncall a physician.\nInhalation\nRemove to fresh air. If not breathing, give artificial respiration. Get medical attention if\nsymptoms occur. Risk of serious damage to the lungs (by aspiration).\nIngestion\nClean mouth with water and drink afterwards plenty of water. Do NOT induce vomiting. Call\na physician or poison control center immediately. If vomiting occurs naturally, have victim\nlean forward.\nMost important symptoms and\neffects\nCauses central nervous system depression: Inhalation of high vapor concentrations may\ncause symptoms like headache, dizziness, tiredness, nausea and vomiting\nNotes to Physician\nTreat symptomatically","REVISED_CONTENT":"Product ID:HZ-TOL,Product Description:Toluene,Storage Location:0001,Storage Location Description:Lager 0001,Plant:0001,Section Id:4,Section Header:First-aid measures,Section Content:General Advice\nIf symptoms persist, call a physician.\nEye Contact\nRinse immediately with plenty of water, also under the eyelids, for at least 15 minutes. Get\nmedical attention.\nSkin Contact\nWash off immediately with plenty of water for at least 15 minutes. If skin irritation persists,\ncall a physician.\nInhalation\nRemove to fresh air. If not breathing, give artificial respiration. Get medical attention if\nsymptoms occur. Risk of serious damage to the lungs (by aspiration).\nIngestion\nClean mouth with water and drink afterwards plenty of water. Do NOT induce vomiting. Call\na physician or poison control center immediately. If vomiting occurs naturally, have victim\nlean forward.\nMost important symptoms and\neffects\nCauses central nervous system depression: Inhalation of high vapor concentrations may\ncause symptoms like headache, dizziness, tiredness, nausea and vomiting\nNotes to Physician\nTreat symptomatically"}