{"GUID":"AkKsEQACHt+fl92lrOVowg==","MATNR":"HZ-PPM","MAKTX":"Potassium permanganate","WERKS":"0001","LGORT":"0088","LGOBE":"Lager 0088 (WM)","SECTION_ID":6,"SECTION_HEADER":"Accidental release measures","SECTION_CONTENT":"Do not flush into surface water or sanitary sewer system. Do not allow material to\ncontaminate ground water system. Prevent product from entering drains. Local authorities\nshould be advised if significant spillages cannot be contained. Should not be released into\nthe environment.\nSweep up and shovel into suitable containers for disposal. Avoid dust formation. Soak up\nwith inert absorbent material. Keep in suitable, closed containers for disposal. Sweep up\nand shovel into suitable containers for disposal.","REVISED_CONTENT":"Product ID:HZ-PPM,Product Description:Potassium permanganate,Storage Location:0088,Storage Location Description:Lager 0088 (WM),Plant:0001,Section Id:6,Section Header:Accidental release measures,Section Content:Do not flush into surface water or sanitary sewer system. Do not allow material to\ncontaminate ground water system. Prevent product from entering drains. Local authorities\nshould be advised if significant spillages cannot be contained. Should not be released into\nthe environment.\nSweep up and shovel into suitable containers for disposal. Avoid dust formation. Soak up\nwith inert absorbent material. Keep in suitable, closed containers for disposal. Sweep up\nand shovel into suitable containers for disposal."}