{"GUID":"AkKsEQACHt+fl92lrOfIwg==","MATNR":"HZ-PRO","MAKTX":"Propane","WERKS":"0001","LGORT":"0001","LGOBE":"Lager 0001","SECTION_ID":9,"SECTION_HEADER":"Physical and chemical properties","SECTION_CONTENT":"Gas\nColorless gas.\nColourless.\nOdorless Stenchant often added.\nNo data available\nNot applicable.\n-187.69 °C\n-187.69 °C\n-42.04 °C\n97.65 °C\n4248 kPa\nNot applicable for gases and gas mixtures.\nNo data available\nNot applicable for gases and gas mixtures.\nSee Section 2.1 and 2.2\n756.9 kPa at 21.1 °C\nNo data available\nNo data available\n1.858 kg/m³ at 21.1 °C\n44.11 g/mol\n1.52\nWater: No data available\n2.36\n450 °C\nNo data available\nNo data available\nNot applicable.\n2.2-9.5 vol%\nWithout adequate ventilation formation of explosive mixtures may be possible.\nNone.\nPress. Gas (Liq.)\nGas/vapor heavier than air. May accumulate in confined spaces, particularly at or below ground\nlevel","REVISED_CONTENT":"Product ID:HZ-PRO,Product Description:Propane,Storage Location:0001,Storage Location Description:Lager 0001,Plant:0001,Section Id:9,Section Header:Physical and chemical properties,Section Content:Gas\nColorless gas.\nColourless.\nOdorless Stenchant often added.\nNo data available\nNot applicable.\n-187.69 °C\n-187.69 °C\n-42.04 °C\n97.65 °C\n4248 kPa\nNot applicable for gases and gas mixtures.\nNo data available\nNot applicable for gases and gas mixtures.\nSee Section 2.1 and 2.2\n756.9 kPa at 21.1 °C\nNo data available\nNo data available\n1.858 kg/m³ at 21.1 °C\n44.11 g/mol\n1.52\nWater: No data available\n2.36\n450 °C\nNo data available\nNo data available\nNot applicable.\n2.2-9.5 vol%\nWithout adequate ventilation formation of explosive mixtures may be possible.\nNone.\nPress. Gas (Liq.)\nGas/vapor heavier than air. May accumulate in confined spaces, particularly at or below ground\nlevel"}