{"GUID":"AkKsEQACHt+fl92lpttIwg==","MATNR":"HZ-MEO","MAKTX":"Methanol","WERKS":"0001","LGORT":"0001","LGOBE":"Lager 0001","SECTION_ID":5,"SECTION_HEADER":"Fire-fighting measures","SECTION_CONTENT":"Suitable extinguishing media: CO2, foam, water, powder\nSpecial risk: combustible. Vapours heavier than air. Formation of explosible mixtures possible with air. Keep away from sources of fire.\nTake measures to prevent electrostatic charging. Development of hazardous gases or vapours possible in the event of fire.\nSpecial protective equipment for fire fighting:\nOther information: no further requirements\nPrevent fire-fighting water from entering surface water or groundwater. Cool container with spray water from a safe distance.\nContain escaping vapours with water.","REVISED_CONTENT":"Product ID:HZ-MEO,Product Description:Methanol,Storage Location:0001,Storage Location Description:Lager 0001,Plant:0001,Section Id:5,Section Header:Fire-fighting measures,Section Content:Suitable extinguishing media: CO2, foam, water, powder\nSpecial risk: combustible. Vapours heavier than air. Formation of explosible mixtures possible with air. Keep away from sources of fire.\nTake measures to prevent electrostatic charging. Development of hazardous gases or vapours possible in the event of fire.\nSpecial protective equipment for fire fighting:\nOther information: no further requirements\nPrevent fire-fighting water from entering surface water or groundwater. Cool container with spray water from a safe distance.\nContain escaping vapours with water."}