{"GUID":"AkKsEQACHt+fl92lo1Mowg==","MATNR":"HZ-CAD","MAKTX":"Cadmium","WERKS":"0001","LGORT":"0088","LGOBE":"Lager 0088 (WM)","SECTION_ID":16,"SECTION_HEADER":"Other information","SECTION_CONTENT":"References:\n-Hawley, G.G.. The Condensed Chemical Dictionary, 11e ed., New York N.Y., Van Nostrand Reinold, 1987. -Liste des produits\npurs tératogènes, mutagènes, cancérogènes. Répertoire toxicologique de la Commission de la Santé et de la Sécurité du\nTravail du Québec. -Material safety data sheet emitted by: la Commission de la Santé et de la Sécurité du Travail du Québec.\n-SAX, N.I. Dangerous Properties of Indutrial Materials. Toronto, Van Nostrand Reinold, 6e ed. 1984. -The Sigma-Aldrich\nLibrary of Chemical Safety Data, Edition II. -Guide de la loi et du règlement sur le transport des marchandises dangeureuses\nau canada. Centre de conformité internatinal Ltée. 1986.\nOther Special Considerations: Not available.\nCreated: 10/09/2005 04:29 PM","REVISED_CONTENT":"Product ID:HZ-CAD,Product Description:Cadmium,Storage Location:0088,Storage Location Description:Lager 0088 (WM),Plant:0001,Section Id:16,Section Header:Other information,Section Content:References:\n-Hawley, G.G.. The Condensed Chemical Dictionary, 11e ed., New York N.Y., Van Nostrand Reinold, 1987. -Liste des produits\npurs tératogènes, mutagènes, cancérogènes. Répertoire toxicologique de la Commission de la Santé et de la Sécurité du\nTravail du Québec. -Material safety data sheet emitted by: la Commission de la Santé et de la Sécurité du Travail du Québec.\n-SAX, N.I. Dangerous Properties of Indutrial Materials. Toronto, Van Nostrand Reinold, 6e ed. 1984. -The Sigma-Aldrich\nLibrary of Chemical Safety Data, Edition II. -Guide de la loi et du règlement sur le transport des marchandises dangeureuses\nau canada. Centre de conformité internatinal Ltée. 1986.\nOther Special Considerations: Not available.\nCreated: 10/09/2005 04:29 PM"}