{"GUID":"AkKsEQACHt+fl92lo1vIwg==","MATNR":"HZ-DYN","MAKTX":"Dynamite Gray","WERKS":"0001","LGORT":"0004","LGOBE":"Explosives","SECTION_ID":5,"SECTION_HEADER":"Fire-fighting measures","SECTION_CONTENT":"Extinguishing media\nSuitable extinguishing media\nUnsuitable extinguishing media\nSpecific hazards arising from the\nchemical\nHazardous thermal\ndecomposition products\nSpecial protective actions for fire-\nfighters\nSpecial protective equipment for\nfire-fighters\n:\nIn case of fire, use water spray (fog), foam, dry chemical or CO2.\nNone known.\nNo specific fire or explosion hazard.\nDecomposition products may include the following materials:\ncarbon dioxide\ncarbon monoxide\nnitrogen oxides\nmetal oxide/oxides\nPromptly isolate the scene by removing all persons from the vicinity\nof the incident if there is a fire. No action shall be taken involving any\npersonal risk or without suitable training.\nFire-fighters should wear appropriate protective equipment and self-\ncontained breathing apparatus (SCBA) with a full face-piece operated\nin positive pressure mode.","REVISED_CONTENT":"Product ID:HZ-DYN,Product Description:Dynamite Gray,Storage Location:0004,Storage Location Description:Explosives,Plant:0001,Section Id:5,Section Header:Fire-fighting measures,Section Content:Extinguishing media\nSuitable extinguishing media\nUnsuitable extinguishing media\nSpecific hazards arising from the\nchemical\nHazardous thermal\ndecomposition products\nSpecial protective actions for fire-\nfighters\nSpecial protective equipment for\nfire-fighters\n:\nIn case of fire, use water spray (fog), foam, dry chemical or CO2.\nNone known.\nNo specific fire or explosion hazard.\nDecomposition products may include the following materials:\ncarbon dioxide\ncarbon monoxide\nnitrogen oxides\nmetal oxide/oxides\nPromptly isolate the scene by removing all persons from the vicinity\nof the incident if there is a fire. No action shall be taken involving any\npersonal risk or without suitable training.\nFire-fighters should wear appropriate protective equipment and self-\ncontained breathing apparatus (SCBA) with a full face-piece operated\nin positive pressure mode."}