{"GUID":"AkKsEQACHt+fl92lpt9Iwg==","MATNR":"HZ-MET","MAKTX":"Methane","WERKS":"0001","LGORT":"0001","LGOBE":"Lager 0001","SECTION_ID":5,"SECTION_HEADER":"Fire-fighting measures","SECTION_CONTENT":"Extinguishing media\nSuitable extinguishing\nmedia : Use an extinguishing agent suitable for the surrounding fire.\nUnsuitable extinguishing\nmedia : None known.\nSpecific hazards arising\nfrom the chemical : Contains gas under pressure. Extremely flammable gas. In a fire or if heated, a\npressure increase will occur and the container may burst, with the risk of a subsequent\nexplosion.\nHazardous thermal\ndecomposition products : Decomposition products may include the following materials:\ncarbon dioxide\ncarbon monoxide\nSpecial protective actions\nfor fire-fighters : Promptly isolate the scene by removing all persons from the vicinity of the incident if\nthere is a fire. No action shall be taken involving any personal risk or without suitable\ntraining. Contact supplier immediately for specialist advice. Move containers from fire\narea if this can be done without risk. Use water spray to keep fire-exposed containers\ncool. If involved in fire, shut off flow immediately if it can be done without risk. If this is\nimpossible, withdraw from area and allow fire to burn. Fight fire from protected location\nor maximum possible distance. Eliminate all ignition sources if safe to do so.\nSpecial protective\nequipment for fire-fighters : Fire-fighters should wear appropriate protective equipment and self-contained breathing\napparatus (SCBA) with a full face-piece operated in positive pressure mode.","REVISED_CONTENT":"Product ID:HZ-MET,Product Description:Methane,Storage Location:0001,Storage Location Description:Lager 0001,Plant:0001,Section Id:5,Section Header:Fire-fighting measures,Section Content:Extinguishing media\nSuitable extinguishing\nmedia : Use an extinguishing agent suitable for the surrounding fire.\nUnsuitable extinguishing\nmedia : None known.\nSpecific hazards arising\nfrom the chemical : Contains gas under pressure. Extremely flammable gas. In a fire or if heated, a\npressure increase will occur and the container may burst, with the risk of a subsequent\nexplosion.\nHazardous thermal\ndecomposition products : Decomposition products may include the following materials:\ncarbon dioxide\ncarbon monoxide\nSpecial protective actions\nfor fire-fighters : Promptly isolate the scene by removing all persons from the vicinity of the incident if\nthere is a fire. No action shall be taken involving any personal risk or without suitable\ntraining. Contact supplier immediately for specialist advice. Move containers from fire\narea if this can be done without risk. Use water spray to keep fire-exposed containers\ncool. If involved in fire, shut off flow immediately if it can be done without risk. If this is\nimpossible, withdraw from area and allow fire to burn. Fight fire from protected location\nor maximum possible distance. Eliminate all ignition sources if safe to do so.\nSpecial protective\nequipment for fire-fighters : Fire-fighters should wear appropriate protective equipment and self-contained breathing\napparatus (SCBA) with a full face-piece operated in positive pressure mode."}