{"GUID":"AkKsEQACHt+fl92lo1pIwg==","MATNR":"HZ-CMO","MAKTX":"Carbon monoxide","WERKS":"0001","LGORT":"0001","LGOBE":"Lager 0001","SECTION_ID":9,"SECTION_HEADER":"Physical and chemical properties","SECTION_CONTENT":"Information on basic physical and chemical properties\nPhysical state\nAppearance\nColor\nOdor\nOdor threshold\npH\nMelting point\nFreezing point\nBoiling point\nCritical temperature\nCritical pressure\nFlash point\nRelative evaporation rate (butyl acetate=1)\nRelative evaporation rate (ether=1)\nFlammability (solid, gas)\nVapor pressure\nRelative vapor density at 20 °C\nRelative density\nMolecular mass\nRelative gas density\nSolubility\nLog Pow\nAuto-ignition temperature\nViscosity, kinematic\nViscosity, dynamic\nExplosion limits\nExplosive properties\nOxidizing properties\nDecomposition temperature\nOther information\nGas group\n: Gas\n: Clear, colorless gas.\n: Colorless\n: Odorless\n: No data available\n: Not applicable.\n: No data available\n: -205 °C\n: -191.5 °C\n: -139.25 °C\n: 3499 kPa\n: No data available\n: No data available\n: Not applicable for gases and gas mixtures.\n: No data available\n: No data available\n: No data available\n: No data available\n: 28.01 g/mol\n: 0.968 Similar to air\n: No data available\n: 1.78\n: 605 °C\n: No data available\n: No data available\n: Not applicable.\n: Lower explosive limit (LEL): 12.5 vol%\nUEL: 74 vol %\n: Without adequate ventilation formation of explosive mixtures may be possible.\n: None.\n: Compressed gas","REVISED_CONTENT":"Product ID:HZ-CMO,Product Description:Carbon monoxide,Storage Location:0001,Storage Location Description:Lager 0001,Plant:0001,Section Id:9,Section Header:Physical and chemical properties,Section Content:Information on basic physical and chemical properties\nPhysical state\nAppearance\nColor\nOdor\nOdor threshold\npH\nMelting point\nFreezing point\nBoiling point\nCritical temperature\nCritical pressure\nFlash point\nRelative evaporation rate (butyl acetate=1)\nRelative evaporation rate (ether=1)\nFlammability (solid, gas)\nVapor pressure\nRelative vapor density at 20 °C\nRelative density\nMolecular mass\nRelative gas density\nSolubility\nLog Pow\nAuto-ignition temperature\nViscosity, kinematic\nViscosity, dynamic\nExplosion limits\nExplosive properties\nOxidizing properties\nDecomposition temperature\nOther information\nGas group\n: Gas\n: Clear, colorless gas.\n: Colorless\n: Odorless\n: No data available\n: Not applicable.\n: No data available\n: -205 °C\n: -191.5 °C\n: -139.25 °C\n: 3499 kPa\n: No data available\n: No data available\n: Not applicable for gases and gas mixtures.\n: No data available\n: No data available\n: No data available\n: No data available\n: 28.01 g/mol\n: 0.968 Similar to air\n: No data available\n: 1.78\n: 605 °C\n: No data available\n: No data available\n: Not applicable.\n: Lower explosive limit (LEL): 12.5 vol%\nUEL: 74 vol %\n: Without adequate ventilation formation of explosive mixtures may be possible.\n: None.\n: Compressed gas"}