{"GUID":"AkKsEQACHt+fl92lrPtowg==","MATNR":"HZ-TOL","MAKTX":"Toluene","WERKS":"0001","LGORT":"0002","LGOBE":"Cold Storage","SECTION_ID":6,"SECTION_HEADER":"Accidental release measures","SECTION_CONTENT":"Personal Precautions\nUse personal protective equipment as required. Ensure adequate ventilation. Remove all\nsources of ignition. Take precautionary measures against static discharges.\nEnvironmental Precautions\nDo not flush into surface water or sanitary sewer system.\nMethods for Containment and Clean\nUp\nSoak up with inert absorbent material. Keep in suitable, closed containers for disposal.\nRemove all sources of ignition. Use spark-proof tools and explosion-proof equipment.","REVISED_CONTENT":"Product ID:HZ-TOL,Product Description:Toluene,Storage Location:0002,Storage Location Description:Cold Storage,Plant:0001,Section Id:6,Section Header:Accidental release measures,Section Content:Personal Precautions\nUse personal protective equipment as required. Ensure adequate ventilation. Remove all\nsources of ignition. Take precautionary measures against static discharges.\nEnvironmental Precautions\nDo not flush into surface water or sanitary sewer system.\nMethods for Containment and Clean\nUp\nSoak up with inert absorbent material. Keep in suitable, closed containers for disposal.\nRemove all sources of ignition. Use spark-proof tools and explosion-proof equipment."}