{"GUID":"AkKsEQACHt+fl92lpssowg==","MATNR":"HZ-HAC","MAKTX":"Hydrochloric acid","WERKS":"0001","LGORT":"0003","LGOBE":"Corrosive Items","SECTION_ID":4,"SECTION_HEADER":"First-aid measures","SECTION_CONTENT":"Eye Contact\nRinse immediately with plenty of water, also under the eyelids, for at least 15 minutes.\nImmediate medical attention is required.\nSkin Contact\nWash off immediately with plenty of water for at least 15 minutes. Immediate medical\nattention is required.\nInhalation\nMove to fresh air. If breathing is difficult, give oxygen. Do not use mouth-to-mouth\nresuscitation if victim ingested or inhaled the substance; induce artificial respiration with a\nrespiratory medical device. Immediate medical attention is required.\nIngestion\nDo not induce vomiting. Call a physician or Poison Control Center immediately.","REVISED_CONTENT":"Product ID:HZ-HAC,Product Description:Hydrochloric acid,Storage Location:0003,Storage Location Description:Corrosive Items,Plant:0001,Section Id:4,Section Header:First-aid measures,Section Content:Eye Contact\nRinse immediately with plenty of water, also under the eyelids, for at least 15 minutes.\nImmediate medical attention is required.\nSkin Contact\nWash off immediately with plenty of water for at least 15 minutes. Immediate medical\nattention is required.\nInhalation\nMove to fresh air. If breathing is difficult, give oxygen. Do not use mouth-to-mouth\nresuscitation if victim ingested or inhaled the substance; induce artificial respiration with a\nrespiratory medical device. Immediate medical attention is required.\nIngestion\nDo not induce vomiting. Call a physician or Poison Control Center immediately."}