{"GUID":"AkKsEQACHt+fl92lrODIwg==","MATNR":"HZ-PLU","MAKTX":"Plutonium nitrate","WERKS":"0001","LGORT":"0088","LGOBE":"Lager 0088 (WM)","SECTION_ID":1,"SECTION_HEADER":"Identification","SECTION_CONTENT":"NBL Program Office\nU. S. Department of Energy,\n1 Science.gov Way,\nOak Ridge, TN 37830\n1-865-576-0598\nEmergency Phone Numbers: 1-865-576-0598\nChemical Name: Plutonium Nitrate, 100%\nOther Identifiers: Plutonium in Nitrate Form; Plutonium Isotopic Standard; CRM 128; CRM\n130; CRM 131; CRM 144\nUse and Restriction: This material is prepared for use as a standard or inter-laboratory\ncomparison programs at analytical laboratories, which routinely handle uranium and/or\nplutonium. NBL expects that recipients of their material are in compliance with 29 CFR\n1910.1200(h) which requires employers to provide employees with effective information\nand training in hazardous chemicals in their work area.\nChemical Family: Metal nitrate. Radioactive.","REVISED_CONTENT":"Product ID:HZ-PLU,Product Description:Plutonium nitrate,Storage Location:0088,Storage Location Description:Lager 0088 (WM),Plant:0001,Section Id:1,Section Header:Identification,Section Content:NBL Program Office\nU. S. Department of Energy,\n1 Science.gov Way,\nOak Ridge, TN 37830\n1-865-576-0598\nEmergency Phone Numbers: 1-865-576-0598\nChemical Name: Plutonium Nitrate, 100%\nOther Identifiers: Plutonium in Nitrate Form; Plutonium Isotopic Standard; CRM 128; CRM\n130; CRM 131; CRM 144\nUse and Restriction: This material is prepared for use as a standard or inter-laboratory\ncomparison programs at analytical laboratories, which routinely handle uranium and/or\nplutonium. NBL expects that recipients of their material are in compliance with 29 CFR\n1910.1200(h) which requires employers to provide employees with effective information\nand training in hazardous chemicals in their work area.\nChemical Family: Metal nitrate. Radioactive."}