{"GUID":"AkKsEQACHt+fl92lo1towg==","MATNR":"HZ-DYN","MAKTX":"Dynamite Gray","WERKS":"0001","LGORT":"0004","LGOBE":"Explosives","SECTION_ID":2,"SECTION_HEADER":"Hazard identification","SECTION_CONTENT":"This mixture has not been evaluated as a whole. Information provided on the health effects of this product is based\non individual components. All ingredients are bound and potential for hazardous exposure as shipped is minimal.\nHowever, some vapors may be released upon heating and the end-user (fabricator) must take the necessary\nprecautions (mechanical ventilation, respiratory protection, etc.) to protect employees from exposure.After handling,\nalways wash hands thoroughly with soap and water.\nOSHA/HCS status\n:\nWhile this material is not considered hazardous by the OSHA Hazard\nCommunication Standard (29 CFR 1910.1200), this SDS contains\nvaluable information critical to the safe handling and proper use of the\nproduct. This SDS should be retained and available for employees and\nother users of this product.\nClassification of the substance or\nmixture\nGHS label elements\n:\nNot classified.\n:\nNo signal word.\nNo known significant effects or critical hazards.\nNot applicable.\nNot applicable.\nNot applicable.\nNot applicable.\nNot applicable.\nNone known.\nNone known.","REVISED_CONTENT":"Product ID:HZ-DYN,Product Description:Dynamite Gray,Storage Location:0004,Storage Location Description:Explosives,Plant:0001,Section Id:2,Section Header:Hazard identification,Section Content:This mixture has not been evaluated as a whole. Information provided on the health effects of this product is based\non individual components. All ingredients are bound and potential for hazardous exposure as shipped is minimal.\nHowever, some vapors may be released upon heating and the end-user (fabricator) must take the necessary\nprecautions (mechanical ventilation, respiratory protection, etc.) to protect employees from exposure.After handling,\nalways wash hands thoroughly with soap and water.\nOSHA/HCS status\n:\nWhile this material is not considered hazardous by the OSHA Hazard\nCommunication Standard (29 CFR 1910.1200), this SDS contains\nvaluable information critical to the safe handling and proper use of the\nproduct. This SDS should be retained and available for employees and\nother users of this product.\nClassification of the substance or\nmixture\nGHS label elements\n:\nNot classified.\n:\nNo signal word.\nNo known significant effects or critical hazards.\nNot applicable.\nNot applicable.\nNot applicable.\nNot applicable.\nNot applicable.\nNone known.\nNone known."}