{"GUID":"AkKsEQACHt+fl92lpuOowg==","MATNR":"HZ-NIT","MAKTX":"Nitrogen","WERKS":"0001","LGORT":"0001","LGOBE":"Lager 0001","SECTION_ID":8,"SECTION_HEADER":"Exposure controls / personal protection","SECTION_CONTENT":"8.1. Control parameters\nNitrogen (7727-37-9)\nACGIH\nRemark (ACGIH)\nSimple Asphyxiant\n8.2. Appropriate engineering controls\nAppropriate engineering controls\nEnvironmental exposure controls\n8.3.\nIndividual protection measures/Personal protective equipment\nHand protection:\nWear working gloves when handling gas containers. 29 CFR 1910.138: Hand protection\nEye protection:\nWear safety glasses with side shields. 29 CFR 1910.133: Eye and Face Protection\nSkin and body protection:\nWear suitable protective clothing, e.g. lab coats, coveralls or flame resistant clothing.\nRespiratory protection:\nNone necessary during normal and routine operations.\n: Ensure exposure is below occupational exposure limits (where available). Provide adequate general and local exhaust ventilation. Systems under pressure should be regularly checked for leakages. Oxygen detectors should be used when asphyxiating gases may be released. Consider the use of a work permit system e.g. for maintenance activities.\n: Refer to local regulations for restriction of emissions to the atmosphere. See section 13 for specific methods for waste gas treatment.","REVISED_CONTENT":"Product ID:HZ-NIT,Product Description:Nitrogen,Storage Location:0001,Storage Location Description:Lager 0001,Plant:0001,Section Id:8,Section Header:Exposure controls / personal protection,Section Content:8.1. Control parameters\nNitrogen (7727-37-9)\nACGIH\nRemark (ACGIH)\nSimple Asphyxiant\n8.2. Appropriate engineering controls\nAppropriate engineering controls\nEnvironmental exposure controls\n8.3.\nIndividual protection measures/Personal protective equipment\nHand protection:\nWear working gloves when handling gas containers. 29 CFR 1910.138: Hand protection\nEye protection:\nWear safety glasses with side shields. 29 CFR 1910.133: Eye and Face Protection\nSkin and body protection:\nWear suitable protective clothing, e.g. lab coats, coveralls or flame resistant clothing.\nRespiratory protection:\nNone necessary during normal and routine operations.\n: Ensure exposure is below occupational exposure limits (where available). Provide adequate general and local exhaust ventilation. Systems under pressure should be regularly checked for leakages. Oxygen detectors should be used when asphyxiating gases may be released. Consider the use of a work permit system e.g. for maintenance activities.\n: Refer to local regulations for restriction of emissions to the atmosphere. See section 13 for specific methods for waste gas treatment."}