{"GUID":"AkKsEQACHt+fl92lpsqowg==","MATNR":"HZ-GLY","MAKTX":"Glyphosate","WERKS":"0001","LGORT":"0088","LGOBE":"Lager 0088 (WM)","SECTION_ID":16,"SECTION_HEADER":"Other information","SECTION_CONTENT":"Prepared By Regulatory Affairs\nThermo Fisher Scientific\nEmail: EMSDS.RA@thermofisher.com\nCreation Date 05-Feb-2020\nRevision Date 24-Dec-2021\nPrint Date 24-Dec-2021\nRevision Summary This document has been updated to comply with the US OSHA HazCom 2012 Standard\nreplacing the current legislation under 29 CFR 1910.1200 to align with the Globally\nHarmonized System of Classification and Labeling of Chemicals (GHS).\nDisclaimer The information provided in this Safety Data Sheet is correct to the best of our knowledge, information and belief at the\ndate of its publication. The information given is designed only as a guidance for safe handling, use, processing, storage,\ntransportation, disposal and release and is not to be considered a warranty or quality specification. The information\nrelates only to the specific material designated and may not be valid for such material used in combination with any other\nmaterials or in any process, unless specified in the text\nEnd of SDS","REVISED_CONTENT":"Product ID:HZ-GLY,Product Description:Glyphosate,Storage Location:0088,Storage Location Description:Lager 0088 (WM),Plant:0001,Section Id:16,Section Header:Other information,Section Content:Prepared By Regulatory Affairs\nThermo Fisher Scientific\nEmail: EMSDS.RA@thermofisher.com\nCreation Date 05-Feb-2020\nRevision Date 24-Dec-2021\nPrint Date 24-Dec-2021\nRevision Summary This document has been updated to comply with the US OSHA HazCom 2012 Standard\nreplacing the current legislation under 29 CFR 1910.1200 to align with the Globally\nHarmonized System of Classification and Labeling of Chemicals (GHS).\nDisclaimer The information provided in this Safety Data Sheet is correct to the best of our knowledge, information and belief at the\ndate of its publication. The information given is designed only as a guidance for safe handling, use, processing, storage,\ntransportation, disposal and release and is not to be considered a warranty or quality specification. The information\nrelates only to the specific material designated and may not be valid for such material used in combination with any other\nmaterials or in any process, unless specified in the text\nEnd of SDS"}