{"GUID":"AkKsEQACHt+fl92lrPQowg==","MATNR":"HZ-SUL","MAKTX":"Sulfur","WERKS":"0001","LGORT":"0001","LGOBE":"Lager 0001","SECTION_ID":12,"SECTION_HEADER":"Ecological information","SECTION_CONTENT":"12.1.\nToxicity\nEcology - General: Toxic to aquatic life.\nSulfur (7704-34-9)\nLC50 Fish 1\nEC50 Daphnia 1\nLC50 Fish 2\nHydrogen sulfide (7783-06-4)\nLC50 Fish 1\nLC50 Fish 2\n12.2.\nPersistence and Degradability\nNot available\n12.3. Bioaccumulative Potential\nSulfur\nBioaccumulative Potential\nHydrogen sulfide (7783-06-4)\nBCF Fish 1\nLog Pow\n12.4. Mobility in Soil\nNot available\n12.5. Other Adverse Effects\nNot available\nOther Information: Avoid release to the environment.","REVISED_CONTENT":"Product ID:HZ-SUL,Product Description:Sulfur,Storage Location:0001,Storage Location Description:Lager 0001,Plant:0001,Section Id:12,Section Header:Ecological information,Section Content:12.1.\nToxicity\nEcology - General: Toxic to aquatic life.\nSulfur (7704-34-9)\nLC50 Fish 1\nEC50 Daphnia 1\nLC50 Fish 2\nHydrogen sulfide (7783-06-4)\nLC50 Fish 1\nLC50 Fish 2\n12.2.\nPersistence and Degradability\nNot available\n12.3. Bioaccumulative Potential\nSulfur\nBioaccumulative Potential\nHydrogen sulfide (7783-06-4)\nBCF Fish 1\nLog Pow\n12.4. Mobility in Soil\nNot available\n12.5. Other Adverse Effects\nNot available\nOther Information: Avoid release to the environment."}