{"GUID":"AkKsEQACHt+fl92lo1RIwg==","MATNR":"HZ-CES","MAKTX":"Cesium","WERKS":"0001","LGORT":"0088","LGOBE":"Lager 0088 (WM)","SECTION_ID":9,"SECTION_HEADER":"Physical and chemical properties","SECTION_CONTENT":"SECTION 9: Physical and chemical properties\n9.1 Information on basic physical and chemical properties\na) Appearance\nForm: Ingots\nb) Odor\nNo data available\nc) Odor Threshold\nNo data available\nd) pH\nNo data available\ne) Melting\npoint/freezing point\nMelting point/range: 28.5 °C (83.3 °F) - lit.\nf) Initial boiling point\nand boiling range\n705 °C 1301 °F - lit.\ng) Flash point\n()Not applicable\nh) Evaporation rate\nNo data available\ni) Flammability (solid,\ngas)\nNo data available\nj) Upper/lower\nflammability or\nexplosive limits\nNo data available\nk) Vapor pressure\n1 hPa at 279 °C (534 °F)\n1) Vapor density\nNo data available\nm) Density\n1.873 g/mL at 25 °C (77 °F) - lit.\nRelative density\nNo data available\nn) Water solubility\nNo data available\no) Partition coefficient:\nn-octanol/water\nNo data available\np) Autoignition\nNo data available\ntemperature\nq) Decomposition\nNo data available\ntemperature\nr) Viscosity\nNo data available\ns) Explosive properties\nNo data available\nt) Oxidizing properties\nNo data available\n9.2 Other safety information\nNo data available","REVISED_CONTENT":"Product ID:HZ-CES,Product Description:Cesium,Storage Location:0088,Storage Location Description:Lager 0088 (WM),Plant:0001,Section Id:9,Section Header:Physical and chemical properties,Section Content:SECTION 9: Physical and chemical properties\n9.1 Information on basic physical and chemical properties\na) Appearance\nForm: Ingots\nb) Odor\nNo data available\nc) Odor Threshold\nNo data available\nd) pH\nNo data available\ne) Melting\npoint/freezing point\nMelting point/range: 28.5 °C (83.3 °F) - lit.\nf) Initial boiling point\nand boiling range\n705 °C 1301 °F - lit.\ng) Flash point\n()Not applicable\nh) Evaporation rate\nNo data available\ni) Flammability (solid,\ngas)\nNo data available\nj) Upper/lower\nflammability or\nexplosive limits\nNo data available\nk) Vapor pressure\n1 hPa at 279 °C (534 °F)\n1) Vapor density\nNo data available\nm) Density\n1.873 g/mL at 25 °C (77 °F) - lit.\nRelative density\nNo data available\nn) Water solubility\nNo data available\no) Partition coefficient:\nn-octanol/water\nNo data available\np) Autoignition\nNo data available\ntemperature\nq) Decomposition\nNo data available\ntemperature\nr) Viscosity\nNo data available\ns) Explosive properties\nNo data available\nt) Oxidizing properties\nNo data available\n9.2 Other safety information\nNo data available"}