{"GUID":"AkKsEQACHt+fl92lptjIwg==","MATNR":"HZ-MAL","MAKTX":"Malathion","WERKS":"0001","LGORT":"0088","LGOBE":"Lager 0088 (WM)","SECTION_ID":1,"SECTION_HEADER":"Identification","SECTION_CONTENT":"1.1 Product identifiers\nProduct name\n: Malathion\nProduct Number\n: 36143\nBrand\n: Sigma-Aldrich\nIndex-No.\n:\n015-041-00-X\n:\n121-75-5\nCAS-No.\n1.2 Relevant identified uses of the substance or mixture and uses advised against\nIdentified uses\n: Laboratory chemicals, Synthesis of substances\n1.3 Details of the supplier of the safety data sheet\nCompany\nTelephone\nFax\n: Sigma-Aldrich Inc.\n3050 SPRUCE ST\n: ST. LOUIS MO 63103\nUNITED STATES\n: +1 314 771-5765\n+1 800 325-5052\n1.4 Emergency telephone\nEmergency Phone #\n: 800-424-9300 CHEMTREC (USA) +1-703-\n527-3887 CHEMTREC (International) 24\nHours/day; 7 Days/week","REVISED_CONTENT":"Product ID:HZ-MAL,Product Description:Malathion,Storage Location:0088,Storage Location Description:Lager 0088 (WM),Plant:0001,Section Id:1,Section Header:Identification,Section Content:1.1 Product identifiers\nProduct name\n: Malathion\nProduct Number\n: 36143\nBrand\n: Sigma-Aldrich\nIndex-No.\n:\n015-041-00-X\n:\n121-75-5\nCAS-No.\n1.2 Relevant identified uses of the substance or mixture and uses advised against\nIdentified uses\n: Laboratory chemicals, Synthesis of substances\n1.3 Details of the supplier of the safety data sheet\nCompany\nTelephone\nFax\n: Sigma-Aldrich Inc.\n3050 SPRUCE ST\n: ST. LOUIS MO 63103\nUNITED STATES\n: +1 314 771-5765\n+1 800 325-5052\n1.4 Emergency telephone\nEmergency Phone #\n: 800-424-9300 CHEMTREC (USA) +1-703-\n527-3887 CHEMTREC (International) 24\nHours/day; 7 Days/week"}