{"GUID":"AkKsEQACHt+fl92lpuGIwg==","MATNR":"HZ-NAC","MAKTX":"Nitric acid","WERKS":"0001","LGORT":"0003","LGOBE":"Corrosive Items","SECTION_ID":7,"SECTION_HEADER":"Handling and storage","SECTION_CONTENT":"Handling\nPrecautions for safe\nhandling : Wear personal protective equipment.\nUse only in well-ventilated areas.\nWhen diluting, add acids to water, never the other way around.\nOn dilution or dissolving in water, considerable heating always\noccurs.\nDo not breathe vapours or spray mist.\nDo not get in eyes, on skin, or on clothing.\nAdvice on protection against:\nfire and explosion : Keep away from combustible material.\nThe product itself does not burn.\nStorage\nConditions for safe storage,\nincluding any\nincompatibilities : Store in original container.\nKeep containers tightly closed in a dry, cool and well-ventilated\nplace.\nStore away from incompatible substances.\nDo not store near combustible materials.\nStore in a place accessible by authorized persons only.","REVISED_CONTENT":"Product ID:HZ-NAC,Product Description:Nitric acid,Storage Location:0003,Storage Location Description:Corrosive Items,Plant:0001,Section Id:7,Section Header:Handling and storage,Section Content:Handling\nPrecautions for safe\nhandling : Wear personal protective equipment.\nUse only in well-ventilated areas.\nWhen diluting, add acids to water, never the other way around.\nOn dilution or dissolving in water, considerable heating always\noccurs.\nDo not breathe vapours or spray mist.\nDo not get in eyes, on skin, or on clothing.\nAdvice on protection against:\nfire and explosion : Keep away from combustible material.\nThe product itself does not burn.\nStorage\nConditions for safe storage,\nincluding any\nincompatibilities : Store in original container.\nKeep containers tightly closed in a dry, cool and well-ventilated\nplace.\nStore away from incompatible substances.\nDo not store near combustible materials.\nStore in a place accessible by authorized persons only."}