{"GUID":"AkKsEQACHt+fl92lrPzowg==","MATNR":"HZ-URA","MAKTX":"URANIUM - WP","WERKS":"0001","LGORT":"0002","LGOBE":"Cold Storage","SECTION_ID":2,"SECTION_HEADER":"Hazard identification","SECTION_CONTENT":"SECTION 2: Hazards identification\n2.1 Classification of the substance or mixture\nGHS Classification in accordance with 29 CFR 1910 (OSHA HCS)\nCorrosive to Metals (Category 1), H290\nSkin irritation (Category 2), H315\nSerious eye damage (Category 1), H318\nFor the full text of the H-Statements mentioned in this Section, see Section 16.\n2.2 GHS Label elements, including precautionary statements\nPictogram\nSignal word\nHazard statement(s)\nH290\nH315\nH318\nDanger\nMay be corrosive to metals.\nCauses skin irritation.\nCauses serious eye damage.","REVISED_CONTENT":"Product ID:HZ-URA,Product Description:URANIUM - WP,Storage Location:0002,Storage Location Description:Cold Storage,Plant:0001,Section Id:2,Section Header:Hazard identification,Section Content:SECTION 2: Hazards identification\n2.1 Classification of the substance or mixture\nGHS Classification in accordance with 29 CFR 1910 (OSHA HCS)\nCorrosive to Metals (Category 1), H290\nSkin irritation (Category 2), H315\nSerious eye damage (Category 1), H318\nFor the full text of the H-Statements mentioned in this Section, see Section 16.\n2.2 GHS Label elements, including precautionary statements\nPictogram\nSignal word\nHazard statement(s)\nH290\nH315\nH318\nDanger\nMay be corrosive to metals.\nCauses skin irritation.\nCauses serious eye damage."}