{"GUID":"AkKsEQACHt+fl92lptsowg==","MATNR":"HZ-MEO","MAKTX":"Methanol","WERKS":"0001","LGORT":"0001","LGOBE":"Lager 0001","SECTION_ID":4,"SECTION_HEADER":"First-aid measures","SECTION_CONTENT":"After eye contact: rinse out with plenty of water with the eyelid held wide open. Call in ophtalmologist.\nAfter skin contact: wash off with plenty of water. Take off contaminated clothing.\nAfter swallowing: fresh air. Make victim drink ethanol (e.g. 1 drinking glass of a 40% alcoholic beverage). Call in physician, mantioning\nmethanol ingestion. If breathing stops: immediately apply mouth- to- mouth resuscitation.\nAfter inhalation: fresh air. If necessary, apply mouth- to- mouth resuscitation or mechanical ventilation.","REVISED_CONTENT":"Product ID:HZ-MEO,Product Description:Methanol,Storage Location:0001,Storage Location Description:Lager 0001,Plant:0001,Section Id:4,Section Header:First-aid measures,Section Content:After eye contact: rinse out with plenty of water with the eyelid held wide open. Call in ophtalmologist.\nAfter skin contact: wash off with plenty of water. Take off contaminated clothing.\nAfter swallowing: fresh air. Make victim drink ethanol (e.g. 1 drinking glass of a 40% alcoholic beverage). Call in physician, mantioning\nmethanol ingestion. If breathing stops: immediately apply mouth- to- mouth resuscitation.\nAfter inhalation: fresh air. If necessary, apply mouth- to- mouth resuscitation or mechanical ventilation."}