{"GUID":"AkKsEQACHt+fl92lo18owg==","MATNR":"HZ-ETH","MAKTX":"Ethanol","WERKS":"0001","LGORT":"0001","LGOBE":"Lager 0001","SECTION_ID":16,"SECTION_HEADER":"Other information","SECTION_CONTENT":"The information contained in this document is based on Agilent's state of knowledge at the time of preparation.\nNo warranty as to its accurateness, completeness or suitability for a particular purpose is expressed or implied.\n· Department issuing SDS: Document Control / Regulatory\nContact: regulatory@ultrasci.com\nDate of preparation / last revision 04/11/2019 / 1\n· Abbreviations and acronyms:\nADR: Accord européen sur le transport des marchandises dangereuses par Route (European Agreement concerning the International Carriage\nof Dangerous Goods by Road)\nIMDG: International Maritime Code for Dangerous Goods\nDOT: US Department of Transportation\nIATA: International Air Transport Association\nACGIH: American Conference of Governmental Industrial Hygienists\nEINECS: European Inventory of Existing Commercial Chemical Substances\nCAS: Chemical Abstracts Service (division of the American Chemical Society)\nNFPA: National Fire Protection Association (USA)\nHMIS: Hazardous Materials Identification System (USA)\nVOC: Volatile Organic Compounds (USA, EU)\nLC50: Lethal concentration, 50 percent\nLD50: Lethal dose, 50 percent\nPBT: Persistent, Bioaccumulative and Toxic\nvPvB: very Persistent and very Bioaccumulative\nNIOSH: National Institute for Occupational Safety\nOSHA: Occupational Safety & Health\nTLV: Threshold Limit Value\nPEL: Permissible Exposure Limit\nREL: Recommended Exposure Limit\nFlam. Liq. 2: Flammable liquids - Category 2\nEye Irrit. 2A: Serious eye damage/eye irritation - Category 2A\nCarc. 1A: Carcinogenicity - Category 1A\n* Data compared to the previous version altered.","REVISED_CONTENT":"Product ID:HZ-ETH,Product Description:Ethanol,Storage Location:0001,Storage Location Description:Lager 0001,Plant:0001,Section Id:16,Section Header:Other information,Section Content:The information contained in this document is based on Agilent's state of knowledge at the time of preparation.\nNo warranty as to its accurateness, completeness or suitability for a particular purpose is expressed or implied.\n· Department issuing SDS: Document Control / Regulatory\nContact: regulatory@ultrasci.com\nDate of preparation / last revision 04/11/2019 / 1\n· Abbreviations and acronyms:\nADR: Accord européen sur le transport des marchandises dangereuses par Route (European Agreement concerning the International Carriage\nof Dangerous Goods by Road)\nIMDG: International Maritime Code for Dangerous Goods\nDOT: US Department of Transportation\nIATA: International Air Transport Association\nACGIH: American Conference of Governmental Industrial Hygienists\nEINECS: European Inventory of Existing Commercial Chemical Substances\nCAS: Chemical Abstracts Service (division of the American Chemical Society)\nNFPA: National Fire Protection Association (USA)\nHMIS: Hazardous Materials Identification System (USA)\nVOC: Volatile Organic Compounds (USA, EU)\nLC50: Lethal concentration, 50 percent\nLD50: Lethal dose, 50 percent\nPBT: Persistent, Bioaccumulative and Toxic\nvPvB: very Persistent and very Bioaccumulative\nNIOSH: National Institute for Occupational Safety\nOSHA: Occupational Safety & Health\nTLV: Threshold Limit Value\nPEL: Permissible Exposure Limit\nREL: Recommended Exposure Limit\nFlam. Liq. 2: Flammable liquids - Category 2\nEye Irrit. 2A: Serious eye damage/eye irritation - Category 2A\nCarc. 1A: Carcinogenicity - Category 1A\n* Data compared to the previous version altered."}