{"GUID":"AkKsEQACHt+fl92lpt6owg==","MATNR":"HZ-MER","MAKTX":"Mercury","WERKS":"0001","LGORT":"0088","LGOBE":"Lager 0088 (WM)","SECTION_ID":16,"SECTION_HEADER":"Other information","SECTION_CONTENT":"Prepared By\nHealth, Safety and Environmental Department\nEmail: chem.techinfo@thermofisher.com\nwww.thermofisher.com\nCreation Date\n20-Aug-2014\nRevision Date\n09-Feb-2024\nPrint Date\n09-Feb-2024\nRevision Summary\nNew emergency telephone response service provider.\nDisclaimer\nThe information provided in this Safety Data Sheet is correct to the best of our knowledge, information and belief at the\ndate of its publication. The information given is designed only as a guidance for safe handling, use, processing, storage,\ntransportation, disposal and release and is not to be considered a warranty or quality specification. The information\nrelates only to the specific material designated and may not be valid for such material used in combination with any other\nmaterials or in any process, unless specified in the text","REVISED_CONTENT":"Product ID:HZ-MER,Product Description:Mercury,Storage Location:0088,Storage Location Description:Lager 0088 (WM),Plant:0001,Section Id:16,Section Header:Other information,Section Content:Prepared By\nHealth, Safety and Environmental Department\nEmail: chem.techinfo@thermofisher.com\nwww.thermofisher.com\nCreation Date\n20-Aug-2014\nRevision Date\n09-Feb-2024\nPrint Date\n09-Feb-2024\nRevision Summary\nNew emergency telephone response service provider.\nDisclaimer\nThe information provided in this Safety Data Sheet is correct to the best of our knowledge, information and belief at the\ndate of its publication. The information given is designed only as a guidance for safe handling, use, processing, storage,\ntransportation, disposal and release and is not to be considered a warranty or quality specification. The information\nrelates only to the specific material designated and may not be valid for such material used in combination with any other\nmaterials or in any process, unless specified in the text"}