{"GUID":"AkKsEQACHt+fl92lrPIIwg==","MATNR":"HZ-SOM","MAKTX":"Sodium metal","WERKS":"0001","LGORT":"0001","LGOBE":"Lager 0001","SECTION_ID":11,"SECTION_HEADER":"Toxicological information","SECTION_CONTENT":"Likely Routes of Exposure: Product as shipped does not present an inhalation or contact hazard. However subsequent operations may create dusts or\nfumes or debris which could be inhaled or come into contact with skin or eyes.\nSymptoms of Exposure: Inhalation of dust will severely irritate the nasal cavity and respiratory tract. Ingestion will cause burns and perforations of the\ngastrointestinal tract. Severe thermal burns, corrosion and ulceration of the skin any eyes may occur on direct contact.\nAcute and Chronic Effects: Sodium reacts readily with moisture to form caustic and highly corrosive sodium hydroxide with evolution of heat. Corrosive\nmaterials are acutely destructive to the respiratory tract, eyes, skin and digestive tract. Eye contact may result in permanent damage and complete vision\nloss. Inhalation may result in respiratory effects such as inflammation, edema, and chemical pneumonitis. May cause coughing, wheezing, laryngitis, shortness\nof breath, headache, nausea, and vomiting. Ingestion may cause damage to the mouth, throat and esophagus. May cause skin burns or irritation depending\non the severity of the exposure.\nAcute Toxicity: LD50 intraperitoneal - mouse - 4g/kg\nCarcinogenicit y: NTP : Not identified as carcinogenic IARC: Not identified as carcinogenic\nTo the best of our knowledge the chemical, physical and toxicological characteristics of the substance are not fully known.","REVISED_CONTENT":"Product ID:HZ-SOM,Product Description:Sodium metal,Storage Location:0001,Storage Location Description:Lager 0001,Plant:0001,Section Id:11,Section Header:Toxicological information,Section Content:Likely Routes of Exposure: Product as shipped does not present an inhalation or contact hazard. However subsequent operations may create dusts or\nfumes or debris which could be inhaled or come into contact with skin or eyes.\nSymptoms of Exposure: Inhalation of dust will severely irritate the nasal cavity and respiratory tract. Ingestion will cause burns and perforations of the\ngastrointestinal tract. Severe thermal burns, corrosion and ulceration of the skin any eyes may occur on direct contact.\nAcute and Chronic Effects: Sodium reacts readily with moisture to form caustic and highly corrosive sodium hydroxide with evolution of heat. Corrosive\nmaterials are acutely destructive to the respiratory tract, eyes, skin and digestive tract. Eye contact may result in permanent damage and complete vision\nloss. Inhalation may result in respiratory effects such as inflammation, edema, and chemical pneumonitis. May cause coughing, wheezing, laryngitis, shortness\nof breath, headache, nausea, and vomiting. Ingestion may cause damage to the mouth, throat and esophagus. May cause skin burns or irritation depending\non the severity of the exposure.\nAcute Toxicity: LD50 intraperitoneal - mouse - 4g/kg\nCarcinogenicit y: NTP : Not identified as carcinogenic IARC: Not identified as carcinogenic\nTo the best of our knowledge the chemical, physical and toxicological characteristics of the substance are not fully known."}