{"GUID":"AkKsEQACHt+fl92loTDowg==","MATNR":"HZ-ACE","MAKTX":"Acetone","WERKS":"0001","LGORT":"0001","LGOBE":"Lager 0001","SECTION_ID":16,"SECTION_HEADER":"Other information","SECTION_CONTENT":"Prepared By Regulatory Affairs\nThermo Fisher Scientific\nEmail: EMSDS.RA@thermofisher.com\nCreation Date 28-Apr-2009\nRevision Date 12-Mar-2014\nPrint Date 12-Mar-2014\nRevision Summary This document has been updated to comply with the US OSHA HazCom 2012 Standard\nreplacing the current legislation under 29 CFR 1910.1200 to align with the Globally\nHarmonized System of Classification and Labeling of Chemicals (GHS)\nDisclaimer The information provided on this Safety Data Sheet is correct to the best of our knowledge, information and belief at the\ndate of its publication. The information given is designed only as a guide for safe handling, use, processing, storage,\ntransportation, disposal and release and is not to be considered as a warranty or quality specification. The information\nrelates only to the specific material designated and may not be valid for such material used in combination with any other\nmaterial or in any process, unless specified in the text.","REVISED_CONTENT":"Product ID:HZ-ACE,Product Description:Acetone,Storage Location:0001,Storage Location Description:Lager 0001,Plant:0001,Section Id:16,Section Header:Other information,Section Content:Prepared By Regulatory Affairs\nThermo Fisher Scientific\nEmail: EMSDS.RA@thermofisher.com\nCreation Date 28-Apr-2009\nRevision Date 12-Mar-2014\nPrint Date 12-Mar-2014\nRevision Summary This document has been updated to comply with the US OSHA HazCom 2012 Standard\nreplacing the current legislation under 29 CFR 1910.1200 to align with the Globally\nHarmonized System of Classification and Labeling of Chemicals (GHS)\nDisclaimer The information provided on this Safety Data Sheet is correct to the best of our knowledge, information and belief at the\ndate of its publication. The information given is designed only as a guide for safe handling, use, processing, storage,\ntransportation, disposal and release and is not to be considered as a warranty or quality specification. The information\nrelates only to the specific material designated and may not be valid for such material used in combination with any other\nmaterial or in any process, unless specified in the text."}