{"GUID":"AkKsEQACHt+fl92lps0owg==","MATNR":"HZ-HEL","MAKTX":"Helium","WERKS":"0001","LGORT":"0001","LGOBE":"Lager 0001","SECTION_ID":4,"SECTION_HEADER":"First-aid measures","SECTION_CONTENT":"Inhalation\nMove to fresh air. If breathing is difficult, remove to fresh air and keep at rest in a position\ncomfortable for breathing. Call a physician if symptoms develop or persist.\nSkin contact\nFrostbite: Do not remove clothes, but flush with copious amounts of lukewarm water. Get medical\nattention if any discomfort continues.\nEye contact\nFrostbite: Immediately and briefly flush with lukewarm, gently flowing water. Cover both eyes with\na sterile dressing. Immediately obtain medical attention. GAS: Not applicable. No effects expected.","REVISED_CONTENT":"Product ID:HZ-HEL,Product Description:Helium,Storage Location:0001,Storage Location Description:Lager 0001,Plant:0001,Section Id:4,Section Header:First-aid measures,Section Content:Inhalation\nMove to fresh air. If breathing is difficult, remove to fresh air and keep at rest in a position\ncomfortable for breathing. Call a physician if symptoms develop or persist.\nSkin contact\nFrostbite: Do not remove clothes, but flush with copious amounts of lukewarm water. Get medical\nattention if any discomfort continues.\nEye contact\nFrostbite: Immediately and briefly flush with lukewarm, gently flowing water. Cover both eyes with\na sterile dressing. Immediately obtain medical attention. GAS: Not applicable. No effects expected."}