{"GUID":"AkKsEQACHt+fl92lptgIwg==","MATNR":"HZ-MAG","MAKTX":"Magnesium","WERKS":"0001","LGORT":"0001","LGOBE":"Lager 0001","SECTION_ID":11,"SECTION_HEADER":"Toxicological information","SECTION_CONTENT":"Acute Toxicity\nComponent Information\nComponent\nMagnesium\nToxicologically Synergistic\nProducts\nLD50 Oral\n230 mg/kg (Rat)\nNo information available\nLD50 Dermal\nNot listed\nLC50 Inhalation\nNot listed\nDelayed and immediate effects as well as chronic effects from short and long-term exposure\nIrritation\nMay cause irritation\nSensitization\nNo information available\nCarcinogenicity\nThe table below indicates whether each agency has listed any ingredient as a carcinogen.\nComponent\nCAS-No\nIARC\nNTP\nACGIH\nOSHA\nMexico\nMagnesium\n7439-95-4\nNot listed\nNot listed\nNot listed\nNot listed\nNot listed","REVISED_CONTENT":"Product ID:HZ-MAG,Product Description:Magnesium,Storage Location:0001,Storage Location Description:Lager 0001,Plant:0001,Section Id:11,Section Header:Toxicological information,Section Content:Acute Toxicity\nComponent Information\nComponent\nMagnesium\nToxicologically Synergistic\nProducts\nLD50 Oral\n230 mg/kg (Rat)\nNo information available\nLD50 Dermal\nNot listed\nLC50 Inhalation\nNot listed\nDelayed and immediate effects as well as chronic effects from short and long-term exposure\nIrritation\nMay cause irritation\nSensitization\nNo information available\nCarcinogenicity\nThe table below indicates whether each agency has listed any ingredient as a carcinogen.\nComponent\nCAS-No\nIARC\nNTP\nACGIH\nOSHA\nMexico\nMagnesium\n7439-95-4\nNot listed\nNot listed\nNot listed\nNot listed\nNot listed"}