{"GUID":"AkKsEQACHt+fl92loTFowg==","MATNR":"HZ-ATR","MAKTX":"Atrazine","WERKS":"0001","LGORT":"0088","LGOBE":"Lager 0088 (WM)","SECTION_ID":4,"SECTION_HEADER":"First-aid measures","SECTION_CONTENT":"Eye Contact: In case of contact with eyes, flush with copious amounts of water for at least 15 minutes. Assure adequate\nflushing by separating the eyelids with fingers. Call a physician.\nSkin Contact: In case of skin contact, flush with copious amounts of water for at least 15 minutes. Remove contaminated\nclothing and shoes. Call a physician.\nSerious Skin Contact: Wash with a disinfectant soap and cover the contaminated skin with an anti-bacterial cream. Seek\nmedical attention.\nInhalation: If inhaled, remove to fresh air. If not breathing give artificial respiration. If breathing is difficult, give oxygen.\nSerious Inhalation: Not available.\nIngestion: If swallowed, wash out mouth with water provided person is conscious. Call a physician.\nSerious Ingestion: Not available.","REVISED_CONTENT":"Product ID:HZ-ATR,Product Description:Atrazine,Storage Location:0088,Storage Location Description:Lager 0088 (WM),Plant:0001,Section Id:4,Section Header:First-aid measures,Section Content:Eye Contact: In case of contact with eyes, flush with copious amounts of water for at least 15 minutes. Assure adequate\nflushing by separating the eyelids with fingers. Call a physician.\nSkin Contact: In case of skin contact, flush with copious amounts of water for at least 15 minutes. Remove contaminated\nclothing and shoes. Call a physician.\nSerious Skin Contact: Wash with a disinfectant soap and cover the contaminated skin with an anti-bacterial cream. Seek\nmedical attention.\nInhalation: If inhaled, remove to fresh air. If not breathing give artificial respiration. If breathing is difficult, give oxygen.\nSerious Inhalation: Not available.\nIngestion: If swallowed, wash out mouth with water provided person is conscious. Call a physician.\nSerious Ingestion: Not available."}