{"GUID":"AkKsEQACHt+fl92lpt+Iwg==","MATNR":"HZ-MET","MAKTX":"Methane","WERKS":"0001","LGORT":"0001","LGOBE":"Lager 0001","SECTION_ID":7,"SECTION_HEADER":"Handling and storage","SECTION_CONTENT":"Precautions for safe handling\nProtective measures : Put on appropriate personal protective equipment (see Section 8). Contains gas under\npressure. Avoid breathing gas. Use only with adequate ventilation. Wear appropriate\nrespirator when ventilation is inadequate. Do not enter storage areas and confined\nspaces unless adequately ventilated. Do not puncture or incinerate container. Use\nequipment rated for cylinder pressure. Close valve after each use and when empty.\nProtect cylinders from physical damage; do not drag, roll, slide, or drop. Use a suitable\nhand truck for cylinder movement.\nUse only non-sparking tools. Avoid contact with eyes, skin and clothing. Empty\ncontainers retain product residue and can be hazardous. Store and use away from heat,\nsparks, open flame or any other ignition source. Use explosion-proof electrical\n(ventilating, lighting and material handling) equipment.\nAdvice on general\noccupational hygiene : Eating, drinking and smoking should be prohibited in areas where this material is\nhandled, stored and processed. Workers should wash hands and face before eating,\ndrinking and smoking. Remove contaminated clothing and protective equipment before\nentering eating areas. See also Section 8 for additional information on hygiene\nmeasures.\nConditions for safe storage,\nincluding any\nincompatibilities : Store in accordance with local regulations. Store in a segregated and approved area.\nStore away from direct sunlight in a dry, cool and well-ventilated area, away from\nincompatible materials (see Section 10). Eliminate all ignition sources. Cylinders\nshould be stored upright, with valve protection cap in place, and firmly secured to\nprevent falling or being knocked over. Cylinder temperatures should not exceed 52 째C\n(125 째F). Keep container tightly closed and sealed until ready for use. See Section 10\nfor incompatible materials before handling or use.","REVISED_CONTENT":"Product ID:HZ-MET,Product Description:Methane,Storage Location:0001,Storage Location Description:Lager 0001,Plant:0001,Section Id:7,Section Header:Handling and storage,Section Content:Precautions for safe handling\nProtective measures : Put on appropriate personal protective equipment (see Section 8). Contains gas under\npressure. Avoid breathing gas. Use only with adequate ventilation. Wear appropriate\nrespirator when ventilation is inadequate. Do not enter storage areas and confined\nspaces unless adequately ventilated. Do not puncture or incinerate container. Use\nequipment rated for cylinder pressure. Close valve after each use and when empty.\nProtect cylinders from physical damage; do not drag, roll, slide, or drop. Use a suitable\nhand truck for cylinder movement.\nUse only non-sparking tools. Avoid contact with eyes, skin and clothing. Empty\ncontainers retain product residue and can be hazardous. Store and use away from heat,\nsparks, open flame or any other ignition source. Use explosion-proof electrical\n(ventilating, lighting and material handling) equipment.\nAdvice on general\noccupational hygiene : Eating, drinking and smoking should be prohibited in areas where this material is\nhandled, stored and processed. Workers should wash hands and face before eating,\ndrinking and smoking. Remove contaminated clothing and protective equipment before\nentering eating areas. See also Section 8 for additional information on hygiene\nmeasures.\nConditions for safe storage,\nincluding any\nincompatibilities : Store in accordance with local regulations. Store in a segregated and approved area.\nStore away from direct sunlight in a dry, cool and well-ventilated area, away from\nincompatible materials (see Section 10). Eliminate all ignition sources. Cylinders\nshould be stored upright, with valve protection cap in place, and firmly secured to\nprevent falling or being knocked over. Cylinder temperatures should not exceed 52 째C\n(125 째F). Keep container tightly closed and sealed until ready for use. See Section 10\nfor incompatible materials before handling or use."}