{"GUID":"AkKsEQACHt+fl92lrPgIwg==","MATNR":"HZ-TNT","MAKTX":"TNT","WERKS":"0001","LGORT":"0004","LGOBE":"Explosives","SECTION_ID":11,"SECTION_HEADER":"Toxicological information","SECTION_CONTENT":"• Information on toxicological effects\n• Acute toxicity:\n• LD/LC50 values that are relevant for classification:\n67-56-1 methanol\nOral LD50 5,628 mg/kg (rat)\nDermal LD50 15,800 mg/kg (rabbit)\nPrimary irritant effect:\n· on the eye: No irritating effect.\nSensitization: No sensitizing effects known.\nAdditional toxicological information:\nThe product shows the following dangers according to internally approved calculation methods for preparations:\nToxic\nCarcinogenic categories\nIARC (International Agency for Research on Cancer)\n118-96-7 2,4,6-trinitrotoluene\n· NTP (National Toxicology Program)\nNone of the ingredients is listed.\n• OSHA-Ca (Occupational Safety & Health Administration)\nNone of the ingredients is listed.","REVISED_CONTENT":"Product ID:HZ-TNT,Product Description:TNT,Storage Location:0004,Storage Location Description:Explosives,Plant:0001,Section Id:11,Section Header:Toxicological information,Section Content:• Information on toxicological effects\n• Acute toxicity:\n• LD/LC50 values that are relevant for classification:\n67-56-1 methanol\nOral LD50 5,628 mg/kg (rat)\nDermal LD50 15,800 mg/kg (rabbit)\nPrimary irritant effect:\n· on the eye: No irritating effect.\nSensitization: No sensitizing effects known.\nAdditional toxicological information:\nThe product shows the following dangers according to internally approved calculation methods for preparations:\nToxic\nCarcinogenic categories\nIARC (International Agency for Research on Cancer)\n118-96-7 2,4,6-trinitrotoluene\n· NTP (National Toxicology Program)\nNone of the ingredients is listed.\n• OSHA-Ca (Occupational Safety & Health Administration)\nNone of the ingredients is listed."}