{"GUID":"AkKsEQACHt+fl92lptGowg==","MATNR":"HZ-HYS","MAKTX":"Hydrogen sulfide","WERKS":"0001","LGORT":"0001","LGOBE":"Lager 0001","SECTION_ID":8,"SECTION_HEADER":"Exposure controls / personal protection","SECTION_CONTENT":"Control parameters\nHydrogen sulfide (7783-06-4)\nACGIH\nACGIH OEL TWA [ppm]\nACGIH\nACGIH OEL STEL [ppm]\nUSA OSHA\nOSHA PEL C [ppm]\nUSA IDLH\nIDLH [ppm]\nExposure controls\nAppropriate engineering controls\nEye protection\n: 1 ppm\n: 5 ppm\n: 20 ppm\n: 100 ppm\n: Use corrosion-resistant equipment. Use an explosion-proof local exhaust system. Local\nexhaust and general ventilation must be adequate to meet exposure standards. MECHANICAL\n(GENERAL): Inadequate - Use only in a closed system. Use explosion proof equipment and\nlighting.\n: Wear safety glasses when handling cylinders; vapor-proof goggles and a face shield during\ncylinder changeout or whenever contact with product is possible. Select eye protection in\naccordance with OSHA 29 CFR 1910.133.","REVISED_CONTENT":"Product ID:HZ-HYS,Product Description:Hydrogen sulfide,Storage Location:0001,Storage Location Description:Lager 0001,Plant:0001,Section Id:8,Section Header:Exposure controls / personal protection,Section Content:Control parameters\nHydrogen sulfide (7783-06-4)\nACGIH\nACGIH OEL TWA [ppm]\nACGIH\nACGIH OEL STEL [ppm]\nUSA OSHA\nOSHA PEL C [ppm]\nUSA IDLH\nIDLH [ppm]\nExposure controls\nAppropriate engineering controls\nEye protection\n: 1 ppm\n: 5 ppm\n: 20 ppm\n: 100 ppm\n: Use corrosion-resistant equipment. Use an explosion-proof local exhaust system. Local\nexhaust and general ventilation must be adequate to meet exposure standards. MECHANICAL\n(GENERAL): Inadequate - Use only in a closed system. Use explosion proof equipment and\nlighting.\n: Wear safety glasses when handling cylinders; vapor-proof goggles and a face shield during\ncylinder changeout or whenever contact with product is possible. Select eye protection in\naccordance with OSHA 29 CFR 1910.133."}