{"GUID":"AkKsEQACHt+fl92lrOMowg==","MATNR":"HZ-POH","MAKTX":"Potassium hydroxide","WERKS":"0001","LGORT":"0003","LGOBE":"Corrosive Items","SECTION_ID":4,"SECTION_HEADER":"First-aid measures","SECTION_CONTENT":"General information:\nGet medical advice/attention if you feel unwell. Show this safety data sheet\nto the doctor in attendance.\nIngestion:\nCall a physician or poison control center immediately. Do NOT induce\nvomiting. If vomiting occurs, keep head low so that stomach content doesn't\nget into the lungs.\nInhalation:\nMove to fresh air. Call a physician or poison control center immediately.\nApply artificial respiration if victim is not breathing If breathing is difficult,\ngive oxygen.","REVISED_CONTENT":"Product ID:HZ-POH,Product Description:Potassium hydroxide,Storage Location:0003,Storage Location Description:Corrosive Items,Plant:0001,Section Id:4,Section Header:First-aid measures,Section Content:General information:\nGet medical advice/attention if you feel unwell. Show this safety data sheet\nto the doctor in attendance.\nIngestion:\nCall a physician or poison control center immediately. Do NOT induce\nvomiting. If vomiting occurs, keep head low so that stomach content doesn't\nget into the lungs.\nInhalation:\nMove to fresh air. Call a physician or poison control center immediately.\nApply artificial respiration if victim is not breathing If breathing is difficult,\ngive oxygen."}