{"GUID":"AkKsEQACHt+fl92lptAIwg==","MATNR":"HZ-HYP","MAKTX":"Hydrogen Peroxide 3%","WERKS":"0001","LGORT":"0002","LGOBE":"Cold Storage","SECTION_ID":11,"SECTION_HEADER":"Toxicological information","SECTION_CONTENT":"Acute Toxicity\nProduct Information\nComponent Information\nComponent\nHydrogen peroxide\nToxicologically Synergistic\nProducts\nLD50 Oral\n376 mg/kg (Rat) (90%)\n910 mg/kg (Rat) (20-60%)\n1518 mg/kg (Rat) (8-20% sol)\nNo information available\nLD50 Dermal\n>2000 mg/kg (Rabbit)\nLC50 Inhalation\n2 g/m³ (Rat) 4 h\nDelayed and immediate effects as well as chronic effects from short and long-term exposure\nIrritation\nSensitization\nCarcinogenicity\nComponent\nWater\nHydrogen peroxide\nCAS-No\n7732-18-5\n7722-84-1\nSevere eye irritant\nNo information available\nThe table below indicates whether each agency has listed any ingredient as a carcinogen.\nIARC\nNot listed\nNTP\nNot listed\nNot listed\nNot listed\nIARC: (International Agency for Research on Cancer)\nACGIH\nNot listed\nA3\nOSHA\nNot listed\nNot listed\nIARC: (International Agency for Research on Cancer)\nGroup 1 - Carcinogenic to Humans\nGroup 2A - Probably Carcinogenic to Humans\nACGIH: (American Conference of Governmental Industrial\nGroup 2B - Possibly Carcinogenic to Humans\nMexico\nNot listed\nA3\nGroup 3 - Not Classifiable as to Carcinogenicity to Humans\nA1 - Known Human Carcinogen\nHygienists)","REVISED_CONTENT":"Product ID:HZ-HYP,Product Description:Hydrogen Peroxide 3%,Storage Location:0002,Storage Location Description:Cold Storage,Plant:0001,Section Id:11,Section Header:Toxicological information,Section Content:Acute Toxicity\nProduct Information\nComponent Information\nComponent\nHydrogen peroxide\nToxicologically Synergistic\nProducts\nLD50 Oral\n376 mg/kg (Rat) (90%)\n910 mg/kg (Rat) (20-60%)\n1518 mg/kg (Rat) (8-20% sol)\nNo information available\nLD50 Dermal\n>2000 mg/kg (Rabbit)\nLC50 Inhalation\n2 g/m³ (Rat) 4 h\nDelayed and immediate effects as well as chronic effects from short and long-term exposure\nIrritation\nSensitization\nCarcinogenicity\nComponent\nWater\nHydrogen peroxide\nCAS-No\n7732-18-5\n7722-84-1\nSevere eye irritant\nNo information available\nThe table below indicates whether each agency has listed any ingredient as a carcinogen.\nIARC\nNot listed\nNTP\nNot listed\nNot listed\nNot listed\nIARC: (International Agency for Research on Cancer)\nACGIH\nNot listed\nA3\nOSHA\nNot listed\nNot listed\nIARC: (International Agency for Research on Cancer)\nGroup 1 - Carcinogenic to Humans\nGroup 2A - Probably Carcinogenic to Humans\nACGIH: (American Conference of Governmental Industrial\nGroup 2B - Possibly Carcinogenic to Humans\nMexico\nNot listed\nA3\nGroup 3 - Not Classifiable as to Carcinogenicity to Humans\nA1 - Known Human Carcinogen\nHygienists)"}