{"GUID":"AkKsEQACHt+fl92lrQBowg==","MATNR":"HZ-URA","MAKTX":"URANIUM - WP","WERKS":"0001","LGORT":"0088","LGOBE":"Lager 0088 (WM)","SECTION_ID":14,"SECTION_HEADER":"Transport information","SECTION_CONTENT":"SECTION 14: Transport information\nDOT (US)\nUN number: 3264 Class: 8\nPacking group: III\nProper shipping name: Corrosive liquid, acidic, inorganic, n.o.s. (nitric acid)\nReportable Quantity (RQ):\nPoison Inhalation Hazard: No\nIMDG\nUN number: 3264 Class: 8\nPacking group: III\nEMS-No: F-A, S-B\nProper shipping name: CORROSIVE LIQUID, ACIDIC, INORGANIC, N.O.S. (nitric acid)\nIATA\nUN number: 3264 Class: 8\nPacking group: III\nProper shipping name: Corrosive liquid, acidic, inorganic, n.o.s. (nitric acid)","REVISED_CONTENT":"Product ID:HZ-URA,Product Description:URANIUM - WP,Storage Location:0088,Storage Location Description:Lager 0088 (WM),Plant:0001,Section Id:14,Section Header:Transport information,Section Content:SECTION 14: Transport information\nDOT (US)\nUN number: 3264 Class: 8\nPacking group: III\nProper shipping name: Corrosive liquid, acidic, inorganic, n.o.s. (nitric acid)\nReportable Quantity (RQ):\nPoison Inhalation Hazard: No\nIMDG\nUN number: 3264 Class: 8\nPacking group: III\nEMS-No: F-A, S-B\nProper shipping name: CORROSIVE LIQUID, ACIDIC, INORGANIC, N.O.S. (nitric acid)\nIATA\nUN number: 3264 Class: 8\nPacking group: III\nProper shipping name: Corrosive liquid, acidic, inorganic, n.o.s. (nitric acid)"}