{"GUID":"AkKsEQACHt+fl92loTXIwg==","MATNR":"HZ-BUT","MAKTX":"Butane","WERKS":"0001","LGORT":"0001","LGOBE":"Lager 0001","SECTION_ID":7,"SECTION_HEADER":"Handling and storage","SECTION_CONTENT":"SECTION 7: Handling and storage\n7.1 Precautions for safe handling\nFor precautions see section 2.2.\n7.2 Conditions for safe storage, including any incompatibilities\nStorage conditions\nTightly closed. Keep away from combustible materials and sources of ignition.\nContents under pressure.\nStorage class\nStorage class (TRGS 510): 2A: Gases\n7.3 Specific end use(s)\nApart from the uses mentioned in section 1.2 no other specific uses are stipulated","REVISED_CONTENT":"Product ID:HZ-BUT,Product Description:Butane,Storage Location:0001,Storage Location Description:Lager 0001,Plant:0001,Section Id:7,Section Header:Handling and storage,Section Content:SECTION 7: Handling and storage\n7.1 Precautions for safe handling\nFor precautions see section 2.2.\n7.2 Conditions for safe storage, including any incompatibilities\nStorage conditions\nTightly closed. Keep away from combustible materials and sources of ignition.\nContents under pressure.\nStorage class\nStorage class (TRGS 510): 2A: Gases\n7.3 Specific end use(s)\nApart from the uses mentioned in section 1.2 no other specific uses are stipulated"}