{"GUID":"AkKsEQACHt+fl92lrPyIwg==","MATNR":"HZ-TOL","MAKTX":"Toluene","WERKS":"0001","LGORT":"0002","LGOBE":"Cold Storage","SECTION_ID":15,"SECTION_HEADER":"Regulatory information","SECTION_CONTENT":"United States of America Inventory\nLegend:\nTSCA US EPA (TSCA) - Toxic Substances Control Act, (40 CFR Part 710)\nX - Listed\n'-' - Not Listed\nTSCA 12(b) - Notices of Export\nNot applicable\nInternational Inventories\nCanada (DSL/NDSL), Europe (EINECS/ELINCS/NLP), Philippines (PICCS), Japan (ENCS), Japan (ISHL), Australia (AICS), China (IECSC), Korea\n(KECL).\nComponent\nToluene\nCAS No\n108-88-3\nDSL\nX\nNDSL EINECS PICCS ENCS\nX\nX\nX\nISHL AICS IECSC\nX\nX\nX\nKECL\nKE-33936\nKECL - NIER number or KE number (http://ncis.nier.go.kr/en/main.do)\nU.S. Federal Regulations\nSARA 313\nComponent\nToluene\nCAS No\nWeight %\n108-88-3\n<=100\nSARA 311/312 Hazard Categories\nSee section 2 for more information\nCWA (Clean Water Act)\nComponent\nToluene\nCWA - Hazardous\nSubstances\nX\nCWA - Reportable\nQuantities\n1000 lb\nCWA - Toxic Pollutants CWA - Priority Pollutants\nX\nX\nClean Air Act\nComponent\nToluene\nHAPS Data\nX\nClass 1 Ozone Depletors\nClass 2 Ozone Depletors\nOSHA - Occupational Safety and\nHealth Administration\nNot applicable","REVISED_CONTENT":"Product ID:HZ-TOL,Product Description:Toluene,Storage Location:0002,Storage Location Description:Cold Storage,Plant:0001,Section Id:15,Section Header:Regulatory information,Section Content:United States of America Inventory\nLegend:\nTSCA US EPA (TSCA) - Toxic Substances Control Act, (40 CFR Part 710)\nX - Listed\n'-' - Not Listed\nTSCA 12(b) - Notices of Export\nNot applicable\nInternational Inventories\nCanada (DSL/NDSL), Europe (EINECS/ELINCS/NLP), Philippines (PICCS), Japan (ENCS), Japan (ISHL), Australia (AICS), China (IECSC), Korea\n(KECL).\nComponent\nToluene\nCAS No\n108-88-3\nDSL\nX\nNDSL EINECS PICCS ENCS\nX\nX\nX\nISHL AICS IECSC\nX\nX\nX\nKECL\nKE-33936\nKECL - NIER number or KE number (http://ncis.nier.go.kr/en/main.do)\nU.S. Federal Regulations\nSARA 313\nComponent\nToluene\nCAS No\nWeight %\n108-88-3\n<=100\nSARA 311/312 Hazard Categories\nSee section 2 for more information\nCWA (Clean Water Act)\nComponent\nToluene\nCWA - Hazardous\nSubstances\nX\nCWA - Reportable\nQuantities\n1000 lb\nCWA - Toxic Pollutants CWA - Priority Pollutants\nX\nX\nClean Air Act\nComponent\nToluene\nHAPS Data\nX\nClass 1 Ozone Depletors\nClass 2 Ozone Depletors\nOSHA - Occupational Safety and\nHealth Administration\nNot applicable"}