{"GUID":"AkKsEQACHt+fl92loTWowg==","MATNR":"HZ-BUT","MAKTX":"Butane","WERKS":"0001","LGORT":"0001","LGOBE":"Lager 0001","SECTION_ID":6,"SECTION_HEADER":"Accidental release measures","SECTION_CONTENT":"SECTION 6: Accidental release measures\n6.1 Personal precautions, protective equipment and emergency procedures\nAdvice for non-emergency personnel: Do not breathe gas. Avoid substance contact.\nEnsure adequate ventilation. Evacuate the danger area, observe emergency procedures,\nconsult an expert.\nFor personal protection see section 8.\n6.2 Environmental precautions\nNo special precautionary measures necessary.\n6.3 Methods and materials for containment and cleaning up\nObserve possible material restrictions (see sections 7 and 10). Stop flow of gas, move\nleaking cylinder to open air if without risk.\n6.4 Reference to other sections\nFor disposal see section 13.","REVISED_CONTENT":"Product ID:HZ-BUT,Product Description:Butane,Storage Location:0001,Storage Location Description:Lager 0001,Plant:0001,Section Id:6,Section Header:Accidental release measures,Section Content:SECTION 6: Accidental release measures\n6.1 Personal precautions, protective equipment and emergency procedures\nAdvice for non-emergency personnel: Do not breathe gas. Avoid substance contact.\nEnsure adequate ventilation. Evacuate the danger area, observe emergency procedures,\nconsult an expert.\nFor personal protection see section 8.\n6.2 Environmental precautions\nNo special precautionary measures necessary.\n6.3 Methods and materials for containment and cleaning up\nObserve possible material restrictions (see sections 7 and 10). Stop flow of gas, move\nleaking cylinder to open air if without risk.\n6.4 Reference to other sections\nFor disposal see section 13."}