{"GUID":"AkKsEQACHt+fl92lrOiIwg==","MATNR":"HZ-PRO","MAKTX":"Propane","WERKS":"0001","LGORT":"0001","LGOBE":"Lager 0001","SECTION_ID":15,"SECTION_HEADER":"Regulatory information","SECTION_CONTENT":"Listed on the United States TSCA (Toxic Substances Control Act) inventory\nListed on the Canadian DSL (Domestic Substances List)\nListed on the EEC inventory EINECS (European Inventory of Existing Commercial Chemical Substances)\nListed on the AICS (Australian Inventory of Chemical Substances)\nListed on IECSC (Inventory of Existing Chemical Substances Produced or Imported in China)\nListed on the Japanese ENCS (Existing & New Chemical Substances) inventory\nListed on the Japanese ISHL (Industrial Safety and Health Law)\nListed on the Korean ECL (Existing Chemicals List)\nListed on NZIoC (New Zealand Inventory of Chemicals)\nListed on PICCS (Philippines Inventory of Chemicals and Chemical Substances)\nListed on INSQ (Mexican National Inventory of Chemical Substances)\nListed on CICR (Turkish Inventory and Control of Chemicals)\nListed on the TCSI (Taiwan Chemical Substance Inventory)\nU.S. - Massachusetts - Right To Know List\nU.S. - New Jersey - Right to Know Hazardous Substance List\nU.S. - Pennsylvania - RTK (Right to Know) List","REVISED_CONTENT":"Product ID:HZ-PRO,Product Description:Propane,Storage Location:0001,Storage Location Description:Lager 0001,Plant:0001,Section Id:15,Section Header:Regulatory information,Section Content:Listed on the United States TSCA (Toxic Substances Control Act) inventory\nListed on the Canadian DSL (Domestic Substances List)\nListed on the EEC inventory EINECS (European Inventory of Existing Commercial Chemical Substances)\nListed on the AICS (Australian Inventory of Chemical Substances)\nListed on IECSC (Inventory of Existing Chemical Substances Produced or Imported in China)\nListed on the Japanese ENCS (Existing & New Chemical Substances) inventory\nListed on the Japanese ISHL (Industrial Safety and Health Law)\nListed on the Korean ECL (Existing Chemicals List)\nListed on NZIoC (New Zealand Inventory of Chemicals)\nListed on PICCS (Philippines Inventory of Chemicals and Chemical Substances)\nListed on INSQ (Mexican National Inventory of Chemical Substances)\nListed on CICR (Turkish Inventory and Control of Chemicals)\nListed on the TCSI (Taiwan Chemical Substance Inventory)\nU.S. - Massachusetts - Right To Know List\nU.S. - New Jersey - Right to Know Hazardous Substance List\nU.S. - Pennsylvania - RTK (Right to Know) List"}