{"GUID":"AkKsEQACHt+fl92lrP2Iwg==","MATNR":"HZ-URA","MAKTX":"URANIUM - WP","WERKS":"0001","LGORT":"0002","LGOBE":"Cold Storage","SECTION_ID":7,"SECTION_HEADER":"Handling and storage","SECTION_CONTENT":"SECTION 7: Handling and storage\n7.1 Precautions for safe handling\nFor precautions see section 2.2.\n7.2 Conditions for safe storage, including any incompatibilities\nStorage conditions\nNo metal containers.\nTightly closed.\nStore at Room Temperature.\nStorage class\nStorage class (TRGS 510): 8B: Non-combustible, corrosive hazardous materials\n7.3 Specific end use(s)\nApart from the uses mentioned in section 1.2 no other specific uses are stipulated","REVISED_CONTENT":"Product ID:HZ-URA,Product Description:URANIUM - WP,Storage Location:0002,Storage Location Description:Cold Storage,Plant:0001,Section Id:7,Section Header:Handling and storage,Section Content:SECTION 7: Handling and storage\n7.1 Precautions for safe handling\nFor precautions see section 2.2.\n7.2 Conditions for safe storage, including any incompatibilities\nStorage conditions\nNo metal containers.\nTightly closed.\nStore at Room Temperature.\nStorage class\nStorage class (TRGS 510): 8B: Non-combustible, corrosive hazardous materials\n7.3 Specific end use(s)\nApart from the uses mentioned in section 1.2 no other specific uses are stipulated"}