{"GUID":"AkKsEQACHt+fl92lo1gIwg==","MATNR":"HZ-CLG","MAKTX":"Chlorine gas","WERKS":"0001","LGORT":"0001","LGOBE":"Lager 0001","SECTION_ID":7,"SECTION_HEADER":"Handling and storage","SECTION_CONTENT":"Handling:\nPrecautions for safe handling\nEnsure good ventilation/exhaustion at the workplace.\nOpen and handle receptacle with care.\nOnly handle and refill product in closed systems.\nInformation about protection against explosions and fires: Keep respiratory protective device available.\nConditions for safe storage, including any incompatibilities\nStorage:\nRequirements to be met by storerooms and receptacles: No special requirements.\nInformation about storage in one common storage facility: Not required.\nFurther information about storage conditions: Keep receptacle tightly sealed.\nSpecific end use(s) No further relevant information available.","REVISED_CONTENT":"Product ID:HZ-CLG,Product Description:Chlorine gas,Storage Location:0001,Storage Location Description:Lager 0001,Plant:0001,Section Id:7,Section Header:Handling and storage,Section Content:Handling:\nPrecautions for safe handling\nEnsure good ventilation/exhaustion at the workplace.\nOpen and handle receptacle with care.\nOnly handle and refill product in closed systems.\nInformation about protection against explosions and fires: Keep respiratory protective device available.\nConditions for safe storage, including any incompatibilities\nStorage:\nRequirements to be met by storerooms and receptacles: No special requirements.\nInformation about storage in one common storage facility: Not required.\nFurther information about storage conditions: Keep receptacle tightly sealed.\nSpecific end use(s) No further relevant information available."}