{"GUID":"AkKsEQACHt+fl92lpteowg==","MATNR":"HZ-MAG","MAKTX":"Magnesium","WERKS":"0001","LGORT":"0001","LGOBE":"Lager 0001","SECTION_ID":8,"SECTION_HEADER":"Exposure controls / personal protection","SECTION_CONTENT":"This product does not contain any hazardous materials with occupational exposure limits\nestablished by the region specific regulatory bodies.\nEngineering Measures\nEnsure adequate ventilation, especially in confined areas. Use explosion-proof\nelectrical/ventilating/lighting/equipment. Ensure that eyewash stations and safety showers\nare close to the workstation location.\nPersonal Protective Equipment\nEye/face Protection\nWear appropriate protective eyeglasses or chemical safety goggles as described by\nOSHA's eye and face protection regulations in 29 CFR 1910.133 or European Standard\nEN166.\nSkin and body protection\nWear appropriate protective gloves and clothing to prevent skin exposure.\nRespiratory Protection\nFollow the OSHA respirator regulations found in 29 CFR 1910.134 or European Standard\nEN 149. Use a NIOSH/MSHA or European Standard EN 149 approved respirator if\nexposure limits are exceeded or if irritation or other symptoms are experienced.\nHygiene Measures\nHandle in accordance with good industrial hygiene and safety practice.","REVISED_CONTENT":"Product ID:HZ-MAG,Product Description:Magnesium,Storage Location:0001,Storage Location Description:Lager 0001,Plant:0001,Section Id:8,Section Header:Exposure controls / personal protection,Section Content:This product does not contain any hazardous materials with occupational exposure limits\nestablished by the region specific regulatory bodies.\nEngineering Measures\nEnsure adequate ventilation, especially in confined areas. Use explosion-proof\nelectrical/ventilating/lighting/equipment. Ensure that eyewash stations and safety showers\nare close to the workstation location.\nPersonal Protective Equipment\nEye/face Protection\nWear appropriate protective eyeglasses or chemical safety goggles as described by\nOSHA's eye and face protection regulations in 29 CFR 1910.133 or European Standard\nEN166.\nSkin and body protection\nWear appropriate protective gloves and clothing to prevent skin exposure.\nRespiratory Protection\nFollow the OSHA respirator regulations found in 29 CFR 1910.134 or European Standard\nEN 149. Use a NIOSH/MSHA or European Standard EN 149 approved respirator if\nexposure limits are exceeded or if irritation or other symptoms are experienced.\nHygiene Measures\nHandle in accordance with good industrial hygiene and safety practice."}