{"GUID":"AkKsEQACHt+fl92lpuOIwg==","MATNR":"HZ-NIT","MAKTX":"Nitrogen","WERKS":"0001","LGORT":"0001","LGOBE":"Lager 0001","SECTION_ID":7,"SECTION_HEADER":"Handling and storage","SECTION_CONTENT":"7.1.\nPrecautions for safe handling\nAdditional hazards when processed\nPrecautions for safe handling\nHygiene measures\n7.2. Conditions for safe storage, including any incompatibilities\nTechnical measures\nStorage conditions\nIncompatible products\nIncompatible materials\n: Pressurized container: Do not pierce or burn, even after use. Use only with equipment rated for cylinder pressure.\n: Do not handle until all safety precautions have been read and understood. Use only outdoors or in a well-ventilated area.\n: Do not eat, drink or smoke when using this product.\n: Comply with applicable regulations.\n: Do not expose to temperatures exceeding 52 째C/ 125 째F. Keep container closed when not in use. Protect cylinders from physical damage; do not drag, roll, slide or drop.\n: None known.\n: None known.","REVISED_CONTENT":"Product ID:HZ-NIT,Product Description:Nitrogen,Storage Location:0001,Storage Location Description:Lager 0001,Plant:0001,Section Id:7,Section Header:Handling and storage,Section Content:7.1.\nPrecautions for safe handling\nAdditional hazards when processed\nPrecautions for safe handling\nHygiene measures\n7.2. Conditions for safe storage, including any incompatibilities\nTechnical measures\nStorage conditions\nIncompatible products\nIncompatible materials\n: Pressurized container: Do not pierce or burn, even after use. Use only with equipment rated for cylinder pressure.\n: Do not handle until all safety precautions have been read and understood. Use only outdoors or in a well-ventilated area.\n: Do not eat, drink or smoke when using this product.\n: Comply with applicable regulations.\n: Do not expose to temperatures exceeding 52 째C/ 125 째F. Keep container closed when not in use. Protect cylinders from physical damage; do not drag, roll, slide or drop.\n: None known.\n: None known."}