{"GUID":"AkKsEQACHt+fl92lrOVIwg==","MATNR":"HZ-PPM","MAKTX":"Potassium permanganate","WERKS":"0001","LGORT":"0088","LGOBE":"Lager 0088 (WM)","SECTION_ID":5,"SECTION_HEADER":"Fire-fighting measures","SECTION_CONTENT":"Suitable Extinguishing Media\nCO 2, dry chemical, dry sand, alcohol-resistant foam.\nUnsuitable Extinguishing Media\nNo information available\nFlash Point\nNo information available\nMethod -\nNot applicable\nAutoignition Temperature\nNo information available\nExplosion Limits\nUpper\nNo data available\nLower\nNo data available\nOxidizing Properties\nOxidizer\nSensitivity to Mechanical Impact No information available\nSensitivity to Static Discharge No information available\nSpecific Hazards Arising from the Chemical\nThe product causes burns of eyes, skin and mucous membranes. Oxidizer: Contact with combustible/organic material may cause\nfire. May ignite combustibles (wood paper, oil, clothing, etc.). Do not allow run-off from fire-fighting to enter drains or water courses.\nHazardous Combustion Products\nHeavy metal oxides. Potassium oxides.\nProtective Equipment and Precautions for Firefighters\nAs in any fire, wear self-contained breathing apparatus pressure-demand, MSHA/NIOSH (approved or equivalent) and full\nprotective gear. Thermal decomposition can lead to release of irritating gases and vapors.\nNFPA\nHealth\n3\nFlammability\n0\nInstability\n2\nPhysical hazards\nOX\nPersonal Precautions\nUse personal protective equipment as required. Evacuate personnel to safe areas. Avoid\ncontact with skin, eyes or clothing.","REVISED_CONTENT":"Product ID:HZ-PPM,Product Description:Potassium permanganate,Storage Location:0088,Storage Location Description:Lager 0088 (WM),Plant:0001,Section Id:5,Section Header:Fire-fighting measures,Section Content:Suitable Extinguishing Media\nCO 2, dry chemical, dry sand, alcohol-resistant foam.\nUnsuitable Extinguishing Media\nNo information available\nFlash Point\nNo information available\nMethod -\nNot applicable\nAutoignition Temperature\nNo information available\nExplosion Limits\nUpper\nNo data available\nLower\nNo data available\nOxidizing Properties\nOxidizer\nSensitivity to Mechanical Impact No information available\nSensitivity to Static Discharge No information available\nSpecific Hazards Arising from the Chemical\nThe product causes burns of eyes, skin and mucous membranes. Oxidizer: Contact with combustible/organic material may cause\nfire. May ignite combustibles (wood paper, oil, clothing, etc.). Do not allow run-off from fire-fighting to enter drains or water courses.\nHazardous Combustion Products\nHeavy metal oxides. Potassium oxides.\nProtective Equipment and Precautions for Firefighters\nAs in any fire, wear self-contained breathing apparatus pressure-demand, MSHA/NIOSH (approved or equivalent) and full\nprotective gear. Thermal decomposition can lead to release of irritating gases and vapors.\nNFPA\nHealth\n3\nFlammability\n0\nInstability\n2\nPhysical hazards\nOX\nPersonal Precautions\nUse personal protective equipment as required. Evacuate personnel to safe areas. Avoid\ncontact with skin, eyes or clothing."}