{"GUID":"AkKsEQACHt+fl92lpuPIwg==","MATNR":"HZ-NIT","MAKTX":"Nitrogen","WERKS":"0001","LGORT":"0001","LGOBE":"Lager 0001","SECTION_ID":9,"SECTION_HEADER":"Physical and chemical properties","SECTION_CONTENT":"9.1. Information on basic physical and chemical properties\nPhysical state\nAppearance\nColor\nOdor\nOdor threshold\npH\nMelting point\nFreezing point\nBoiling point\nFlash point\nRelative evaporation rate (butyl acetate=1)\nRelative evaporation rate (ether=1)\nFlammability (solid, gas)\nVapor pressure\nRelative vapor density at 20 °C\nRelative density\nSpecific gravity / density\nMolecular mass\nRelative gas density\nSolubility\nLog Pow\nAuto-ignition temperature\nDecomposition temperature\nViscosity\nViscosity, kinematic\nViscosity, dynamic\nExplosion limits\nExplosive properties\nOxidizing properties\n9.2.\nOther information\nAdditional information\n: Gas\n: Clear, colorless gas.\n: Colorless\n: Odorless\n: No data available\n: No data available\n: -210 °C\n: No data available\n: -195.5 °C\n: No data available\n: No data available\n: Not applicable for gas-mixtures.\n: See Section 2.1 and 2.2\n: 760\n: 0.967\n: No data available\n: 1.2506 g/l\n: 28.0134 g/mol\n: Similar to air.\n: Water: 1.485 g/100cm³\n: No data available\n: No data available\n: No data available\n: 0.01787 cP\n: No data available\n: Not applicable - not flammable\n: No data available\n: None.\n: None","REVISED_CONTENT":"Product ID:HZ-NIT,Product Description:Nitrogen,Storage Location:0001,Storage Location Description:Lager 0001,Plant:0001,Section Id:9,Section Header:Physical and chemical properties,Section Content:9.1. Information on basic physical and chemical properties\nPhysical state\nAppearance\nColor\nOdor\nOdor threshold\npH\nMelting point\nFreezing point\nBoiling point\nFlash point\nRelative evaporation rate (butyl acetate=1)\nRelative evaporation rate (ether=1)\nFlammability (solid, gas)\nVapor pressure\nRelative vapor density at 20 °C\nRelative density\nSpecific gravity / density\nMolecular mass\nRelative gas density\nSolubility\nLog Pow\nAuto-ignition temperature\nDecomposition temperature\nViscosity\nViscosity, kinematic\nViscosity, dynamic\nExplosion limits\nExplosive properties\nOxidizing properties\n9.2.\nOther information\nAdditional information\n: Gas\n: Clear, colorless gas.\n: Colorless\n: Odorless\n: No data available\n: No data available\n: -210 °C\n: No data available\n: -195.5 °C\n: No data available\n: No data available\n: Not applicable for gas-mixtures.\n: See Section 2.1 and 2.2\n: 760\n: 0.967\n: No data available\n: 1.2506 g/l\n: 28.0134 g/mol\n: Similar to air.\n: Water: 1.485 g/100cm³\n: No data available\n: No data available\n: No data available\n: 0.01787 cP\n: No data available\n: Not applicable - not flammable\n: No data available\n: None.\n: None"}