{"GUID":"AkKsEQACHt+fl92lpuSIwg==","MATNR":"HZ-NIT","MAKTX":"Nitrogen","WERKS":"0001","LGORT":"0001","LGOBE":"Lager 0001","SECTION_ID":15,"SECTION_HEADER":"Regulatory information","SECTION_CONTENT":"15.1. US Federal regulations\nNitrogen (7727-37-9)\n: Listed on the United States TSCA (Toxic Substances Control Act) inventory\n15.2. International regulations\nCANADA\nNitrogen (7727-37-9)\nListed on the Canadian DSL (Domestic Substances List)\nEU-Regulations\nNitrogen (7727-37-9)\nListed on the EEC inventory EINECS (European Inventory of Existing Commercial Chemical Substances)\nNational regulations\nNitrogen (7727-37-9)\nListed on the AICS (Australian Inventory of Chemical Substances)\nListed on IECSC (Inventory of Existing Chemical Substances Produced or Imported in China)\nListed on the Korean ECL (Existing Chemicals List)\nListed on NZIoC (New Zealand Inventory of Chemicals)\nListed on PICCS (Philippines Inventory of Chemicals and Chemical Substances)\nListed on INSQ (Mexican National Inventory of Chemical Substances)\nListed on the TCSI (Taiwan Chemical Substance Inventory)\n15.3. US State regulations\nNitrogen (7727-37-9)\nU.S. - Massachusetts - Right To Know List\nU.S. - New Jersey - Right to Know Hazardous Substance List\nU.S. - Pennsylvania - RTK (Right to Know) List","REVISED_CONTENT":"Product ID:HZ-NIT,Product Description:Nitrogen,Storage Location:0001,Storage Location Description:Lager 0001,Plant:0001,Section Id:15,Section Header:Regulatory information,Section Content:15.1. US Federal regulations\nNitrogen (7727-37-9)\n: Listed on the United States TSCA (Toxic Substances Control Act) inventory\n15.2. International regulations\nCANADA\nNitrogen (7727-37-9)\nListed on the Canadian DSL (Domestic Substances List)\nEU-Regulations\nNitrogen (7727-37-9)\nListed on the EEC inventory EINECS (European Inventory of Existing Commercial Chemical Substances)\nNational regulations\nNitrogen (7727-37-9)\nListed on the AICS (Australian Inventory of Chemical Substances)\nListed on IECSC (Inventory of Existing Chemical Substances Produced or Imported in China)\nListed on the Korean ECL (Existing Chemicals List)\nListed on NZIoC (New Zealand Inventory of Chemicals)\nListed on PICCS (Philippines Inventory of Chemicals and Chemical Substances)\nListed on INSQ (Mexican National Inventory of Chemical Substances)\nListed on the TCSI (Taiwan Chemical Substance Inventory)\n15.3. US State regulations\nNitrogen (7727-37-9)\nU.S. - Massachusetts - Right To Know List\nU.S. - New Jersey - Right to Know Hazardous Substance List\nU.S. - Pennsylvania - RTK (Right to Know) List"}