{"GUID":"AkKsEQACHt+fl92lrPnIwg==","MATNR":"HZ-TOL","MAKTX":"Toluene","WERKS":"0001","LGORT":"0001","LGOBE":"Lager 0001","SECTION_ID":9,"SECTION_HEADER":"Physical and chemical properties","SECTION_CONTENT":"Physical State\nLiquid\nAppearance\nColorless\nOdor\naromatic\nOdor Threshold\n1.74 ppm\npH\nNo information available\nMelting Point/Range\n-95 °C/-139 °F\nBoiling Point/Range\n111 °C / 231.8 °F @ 760 mmHg\nFlash Point\n4 °C / 39.2 °F\nEvaporation Rate\n2.4 (Butyl acetate = 1.0)\nFlammability (solid,gas)\nNot applicable\nFlammability or explosive limits\nUpper\n7.1 vol %\nLower\n1.1 vol %\nVapor Pressure\n29 mbar @ 20 °C\nVapor Density\n3.1\nSpecific Gravity\n0.866\nSolubility\nInsoluble in water\nPartition coefficient; n-octanol/water\nNo data available\nAutoignition Temperature\n535 °C / 995 °F\nDecomposition Temperature\nNo information available\nViscosity\n0.6 mPa.s @ 20 °C\nMolecular Formula\nC7 H8\nMolecular Weight\n92.14","REVISED_CONTENT":"Product ID:HZ-TOL,Product Description:Toluene,Storage Location:0001,Storage Location Description:Lager 0001,Plant:0001,Section Id:9,Section Header:Physical and chemical properties,Section Content:Physical State\nLiquid\nAppearance\nColorless\nOdor\naromatic\nOdor Threshold\n1.74 ppm\npH\nNo information available\nMelting Point/Range\n-95 °C/-139 °F\nBoiling Point/Range\n111 °C / 231.8 °F @ 760 mmHg\nFlash Point\n4 °C / 39.2 °F\nEvaporation Rate\n2.4 (Butyl acetate = 1.0)\nFlammability (solid,gas)\nNot applicable\nFlammability or explosive limits\nUpper\n7.1 vol %\nLower\n1.1 vol %\nVapor Pressure\n29 mbar @ 20 °C\nVapor Density\n3.1\nSpecific Gravity\n0.866\nSolubility\nInsoluble in water\nPartition coefficient; n-octanol/water\nNo data available\nAutoignition Temperature\n535 °C / 995 °F\nDecomposition Temperature\nNo information available\nViscosity\n0.6 mPa.s @ 20 °C\nMolecular Formula\nC7 H8\nMolecular Weight\n92.14"}