{"GUID":"AkKsEQACHt+fl92lrPFowg==","MATNR":"HZ-SOM","MAKTX":"Sodium metal","WERKS":"0001","LGORT":"0001","LGOBE":"Lager 0001","SECTION_ID":6,"SECTION_HEADER":"Accidental release measures","SECTION_CONTENT":"Personal Precautions, Protective Equipment, and Emergency Procedures: Wear appropriate respiratory and protective equipment specified in section\n8. Isolate spill area and provide ventilation. Avoid breathing dust or fume. Avoid contact with skin and eyes. Eliminate all sources of ignition.\nMethods and Materials for Containment and Cleaning Up: The material may ignite spontaneously in air. Burning material may release toxic fumes.\nLeave the area unless fitted with a self-contained breathing apparatus. Use completely dry non-sparking tools only. Do not use water for clean-up. Soda ash\n(powdered lime) or dry sand should be used to completely smother and cover any small spill that occurs. Sweep or scoop up. Place in a dry metal container\nequipped with a lid and replace the lid promptly. This can be done even if the metal is burning. With the lid in place oxygen will be excluded and the fire will\ngo out.\nEnvironmental Precautions: Do not allow to enter drains or to be released to the environment.","REVISED_CONTENT":"Product ID:HZ-SOM,Product Description:Sodium metal,Storage Location:0001,Storage Location Description:Lager 0001,Plant:0001,Section Id:6,Section Header:Accidental release measures,Section Content:Personal Precautions, Protective Equipment, and Emergency Procedures: Wear appropriate respiratory and protective equipment specified in section\n8. Isolate spill area and provide ventilation. Avoid breathing dust or fume. Avoid contact with skin and eyes. Eliminate all sources of ignition.\nMethods and Materials for Containment and Cleaning Up: The material may ignite spontaneously in air. Burning material may release toxic fumes.\nLeave the area unless fitted with a self-contained breathing apparatus. Use completely dry non-sparking tools only. Do not use water for clean-up. Soda ash\n(powdered lime) or dry sand should be used to completely smother and cover any small spill that occurs. Sweep or scoop up. Place in a dry metal container\nequipped with a lid and replace the lid promptly. This can be done even if the metal is burning. With the lid in place oxygen will be excluded and the fire will\ngo out.\nEnvironmental Precautions: Do not allow to enter drains or to be released to the environment."}