{"GUID":"AkKsEQACHt+fl92lrOQowg==","MATNR":"HZ-POH","MAKTX":"Potassium hydroxide","WERKS":"0001","LGORT":"0003","LGOBE":"Corrosive Items","SECTION_ID":12,"SECTION_HEADER":"Ecological information","SECTION_CONTENT":"Ecotoxicity:\nAcute hazards to the aquatic environment:\nFish\nProduct:\nNo data available.\nSpecified substance(s):\nPotassium hydroxide\nLC 50 (Western mosquitofish (Gambusia affinis), 96 h): 80 mg/l\nLC 50 (Gambusia affinis, 96 h): 80 mg/l\nNOAEL (Gambusia affinis, 96 h): 56 mg/l\nAquatic Invertebrates\nProduct:\nNo data available.\nChronic hazards to the aquatic environment:\nFish\nProduct:\nNo data available.\nAquatic Invertebrates\nProduct:\nNo data available.\nToxicity to Aquatic Plants\nProduct:\nNo data available.\nPersistence and Degradability\nBiodegradation\nProduct:\nExpected to be readily biodegradable.\nBOD/COD Ratio\nProduct:\nNo data available.\nBioaccumulative potential\nBioconcentration Factor (BCF)\nProduct:\nNo data available on bioaccumulation.\nPartition Coefficient n-octanol / water (log Kow)\nProduct:\nNo data available.","REVISED_CONTENT":"Product ID:HZ-POH,Product Description:Potassium hydroxide,Storage Location:0003,Storage Location Description:Corrosive Items,Plant:0001,Section Id:12,Section Header:Ecological information,Section Content:Ecotoxicity:\nAcute hazards to the aquatic environment:\nFish\nProduct:\nNo data available.\nSpecified substance(s):\nPotassium hydroxide\nLC 50 (Western mosquitofish (Gambusia affinis), 96 h): 80 mg/l\nLC 50 (Gambusia affinis, 96 h): 80 mg/l\nNOAEL (Gambusia affinis, 96 h): 56 mg/l\nAquatic Invertebrates\nProduct:\nNo data available.\nChronic hazards to the aquatic environment:\nFish\nProduct:\nNo data available.\nAquatic Invertebrates\nProduct:\nNo data available.\nToxicity to Aquatic Plants\nProduct:\nNo data available.\nPersistence and Degradability\nBiodegradation\nProduct:\nExpected to be readily biodegradable.\nBOD/COD Ratio\nProduct:\nNo data available.\nBioaccumulative potential\nBioconcentration Factor (BCF)\nProduct:\nNo data available on bioaccumulation.\nPartition Coefficient n-octanol / water (log Kow)\nProduct:\nNo data available."}