{"GUID":"AkKsEQACHt+fl92lpufIwg==","MATNR":"HZ-PHO","MAKTX":"Phosphorus","WERKS":"0001","LGORT":"0088","LGOBE":"Lager 0088 (WM)","SECTION_ID":9,"SECTION_HEADER":"Physical and chemical properties","SECTION_CONTENT":"9.1. Information on basic physical and chemical properties\nAppearance\nPhysical State\nOdor\nOdor Threshold\npH\nMelting Point/Range\nSoftening Point\nBoiling Point/Range\nFlash Point\nEvaporation Rate\nFlammability (solid,gas)\nExplosion Limits\nColorless\nLiquid\nOdorless\nNo data available\n1\nNo data available\nNo data available\nNot applicable\nNot applicable\nNo data available\nNo information available\nNo data available\nMethod - No information available\nVapor Pressure\nVapor Density\nSpecific Gravity / Density\nBulk Density\nWater Solubility\nSolubility in other solvents\nPartition Coefficient (n-octanol/water)\nAutoignition Temperature\nDecomposition Temperature\nViscosity\nExplosive Properties\nOxidizing Properties\nNo data available\nNo data available\nNo data available\nNo data available\nSoluble in water\nNo information available\nNo data available\nNo data available\nNo data available\nNo data available\nNo information available\nNo information available\n9.2. Other information\nNo data available\n(Air = 1.0)","REVISED_CONTENT":"Product ID:HZ-PHO,Product Description:Phosphorus,Storage Location:0088,Storage Location Description:Lager 0088 (WM),Plant:0001,Section Id:9,Section Header:Physical and chemical properties,Section Content:9.1. Information on basic physical and chemical properties\nAppearance\nPhysical State\nOdor\nOdor Threshold\npH\nMelting Point/Range\nSoftening Point\nBoiling Point/Range\nFlash Point\nEvaporation Rate\nFlammability (solid,gas)\nExplosion Limits\nColorless\nLiquid\nOdorless\nNo data available\n1\nNo data available\nNo data available\nNot applicable\nNot applicable\nNo data available\nNo information available\nNo data available\nMethod - No information available\nVapor Pressure\nVapor Density\nSpecific Gravity / Density\nBulk Density\nWater Solubility\nSolubility in other solvents\nPartition Coefficient (n-octanol/water)\nAutoignition Temperature\nDecomposition Temperature\nViscosity\nExplosive Properties\nOxidizing Properties\nNo data available\nNo data available\nNo data available\nNo data available\nSoluble in water\nNo information available\nNo data available\nNo data available\nNo data available\nNo data available\nNo information available\nNo information available\n9.2. Other information\nNo data available\n(Air = 1.0)"}