{"GUID":"AkKsEQACHt+fl92lptCIwg==","MATNR":"HZ-HYP","MAKTX":"Hydrogen Peroxide 3%","WERKS":"0001","LGORT":"0002","LGOBE":"Cold Storage","SECTION_ID":15,"SECTION_HEADER":"Regulatory information","SECTION_CONTENT":"International Inventories\nComponent\nTSCA\nWater\nX\nHydrogen peroxide\nX\nDSL NDSL EINECS ELINCS NLP PICCS ENCS AICS IECSC KECL\n231-791-2\nX\nX\nX\nX\nX\nX\nX\nX\n231-765-0\nX\nX\nX\nX\nX\nX\nX\nX\nLegend:\nX - Listed\nE - Indicates a substance that is the subject of a Section 5(e) Consent order under TSCA.\nF - Indicates a substance that is the subject of a Section 5(f) Rule under TSCA.\nN - Indicates a polymeric substance containing no free-radical initiator in its inventory name but is considered to cover the designated\npolymer made with any free-radical initiator regardless of the amount used.\nP - Indicates a commenced PMN substance\nR - Indicates a substance that is the subject of a Section 6 risk management rule under TSCA.\nS - Indicates a substance that is identified in a proposed or final Significant New Use Rule\nT - Indicates a substance that is the subject of a Section 4 test rule under TSCA.\nXU - Indicates a substance exempt from reporting under the Inventory Update Rule, i.e. Partial Updating of the TSCA Inventory Data Base\nProduction and Site Reports (40 CFR 710(Β). \nY1 - Indicates an exempt polymer that has a number-average molecular weight of 1,000 or greater.\nY2 - Indicates an exempt polymer that is a polyester and is made only from reactants included in a specified list of low concern reactants\nthat comprises one of the eligibility criteria for the exemption rule.\nU.S. Federal Regulations\nTSCA 12(b)\nSARA 313\nNot applicable\nNot applicable\nSARA 311/312 Hazardous Categorization\nAcute Health Hazard\nChronic Health Hazard\nFire Hazard\nSudden Release of Pressure Hazard\nReactive Hazard\nClean Water Act\nClean Air Act\nYes\nNo\nNo\nNo\nNo\nNot applicable\nNot applicable\nOSHA Occupational Safety and Health Administration\nNot applicable\nCERCLA\nComponent\nHydrogen peroxide\nSpecifically Regulated Chemicals\nHighly Hazardous Chemicals\nTQ: 7500 lb\nThis material, as supplied, contains one or more substances regulated as a hazardous substance under the Comprehensive\nEnvironmental Response Compensation and Liability Act (CERCLA) (40 CFR 302)\nComponent\nHydrogen peroxide\nHazardous Substances RQs\nCERCLA EHS RQS\n1000 lb\nCalifornia Proposition 65\nThis product does not contain any Proposition 65 chemicals\nState Right-to-Know\nComponent\nWater\nHydrogen peroxide\nMassachusetts\nX\nNew Jersey\nX\nPennsylvania\nX\nX\nIllinois\nRhode Island\nX\nU.S. Department of Transportation\nReportable Quantity (RQ):\nDOT Marine Pollutant\nDOT Severe Marine Pollutant\nN\nN\nN\nU.S. Department of Homeland Security\nThis product contains the following DHS chemicals:","REVISED_CONTENT":"Product ID:HZ-HYP,Product Description:Hydrogen Peroxide 3%,Storage Location:0002,Storage Location Description:Cold Storage,Plant:0001,Section Id:15,Section Header:Regulatory information,Section Content:International Inventories\nComponent\nTSCA\nWater\nX\nHydrogen peroxide\nX\nDSL NDSL EINECS ELINCS NLP PICCS ENCS AICS IECSC KECL\n231-791-2\nX\nX\nX\nX\nX\nX\nX\nX\n231-765-0\nX\nX\nX\nX\nX\nX\nX\nX\nLegend:\nX - Listed\nE - Indicates a substance that is the subject of a Section 5(e) Consent order under TSCA.\nF - Indicates a substance that is the subject of a Section 5(f) Rule under TSCA.\nN - Indicates a polymeric substance containing no free-radical initiator in its inventory name but is considered to cover the designated\npolymer made with any free-radical initiator regardless of the amount used.\nP - Indicates a commenced PMN substance\nR - Indicates a substance that is the subject of a Section 6 risk management rule under TSCA.\nS - Indicates a substance that is identified in a proposed or final Significant New Use Rule\nT - Indicates a substance that is the subject of a Section 4 test rule under TSCA.\nXU - Indicates a substance exempt from reporting under the Inventory Update Rule, i.e. Partial Updating of the TSCA Inventory Data Base\nProduction and Site Reports (40 CFR 710(Β). \nY1 - Indicates an exempt polymer that has a number-average molecular weight of 1,000 or greater.\nY2 - Indicates an exempt polymer that is a polyester and is made only from reactants included in a specified list of low concern reactants\nthat comprises one of the eligibility criteria for the exemption rule.\nU.S. Federal Regulations\nTSCA 12(b)\nSARA 313\nNot applicable\nNot applicable\nSARA 311/312 Hazardous Categorization\nAcute Health Hazard\nChronic Health Hazard\nFire Hazard\nSudden Release of Pressure Hazard\nReactive Hazard\nClean Water Act\nClean Air Act\nYes\nNo\nNo\nNo\nNo\nNot applicable\nNot applicable\nOSHA Occupational Safety and Health Administration\nNot applicable\nCERCLA\nComponent\nHydrogen peroxide\nSpecifically Regulated Chemicals\nHighly Hazardous Chemicals\nTQ: 7500 lb\nThis material, as supplied, contains one or more substances regulated as a hazardous substance under the Comprehensive\nEnvironmental Response Compensation and Liability Act (CERCLA) (40 CFR 302)\nComponent\nHydrogen peroxide\nHazardous Substances RQs\nCERCLA EHS RQS\n1000 lb\nCalifornia Proposition 65\nThis product does not contain any Proposition 65 chemicals\nState Right-to-Know\nComponent\nWater\nHydrogen peroxide\nMassachusetts\nX\nNew Jersey\nX\nPennsylvania\nX\nX\nIllinois\nRhode Island\nX\nU.S. Department of Transportation\nReportable Quantity (RQ):\nDOT Marine Pollutant\nDOT Severe Marine Pollutant\nN\nN\nN\nU.S. Department of Homeland Security\nThis product contains the following DHS chemicals:"}