{"GUID":"AkKsEQACHt+fl92lo1SIwg==","MATNR":"HZ-CES","MAKTX":"Cesium","WERKS":"0001","LGORT":"0088","LGOBE":"Lager 0088 (WM)","SECTION_ID":11,"SECTION_HEADER":"Toxicological information","SECTION_CONTENT":"SECTION 11: Toxicological information\n11.1 Information on toxicological effects\nAcute toxicity\nOral: No data available\nInhalation: No data available\nDermal: No data available\nNo data available\nSkin corrosion/irritation\nNo data available\nSerious eye damage/eye irritation\nNo data available\nRespiratory or skin sensitization\nNo data available\nGerm cell mutagenicity\nNo data available\nCarcinogenicity\nIARC:\nNo ingredient of this product present at levels greater than or equal to 0.1% is\nidentified as probable, possible or confirmed human carcinogen by IARC.\nACGIH:\nNo ingredient of this product present at levels greater than or equal to 0.1% is\nidentified as a carcinogen or potential carcinogen by ACGIH.\nNTP:\nNo ingredient of this product present at levels greater than or equal to 0.1% is\nidentified as a known or anticipated carcinogen by NTP.\nOSHA:\nNo component of this product present at levels greater than or equal to 0.1% is\non OSHA's list of regulated carcinogens.\nReproductive toxicity\nNo data available\nSpecific target organ toxicity - single exposure\nNo data available\nSpecific target organ toxicity - repeated exposure\nNo data available\nAspiration hazard\nNo data available\n11.2 Additional Information\nRTECS: FK9225000\nMaterial is extremely destructive to tissue of the mucous membranes and upper respiratory\ntract, eyes, and skin., Cough, Shortness of breath, Headache, Nausea\nTo the best of our knowledge, the chemical, physical, and toxicological properties have not\nbeen thoroughly investigated.","REVISED_CONTENT":"Product ID:HZ-CES,Product Description:Cesium,Storage Location:0088,Storage Location Description:Lager 0088 (WM),Plant:0001,Section Id:11,Section Header:Toxicological information,Section Content:SECTION 11: Toxicological information\n11.1 Information on toxicological effects\nAcute toxicity\nOral: No data available\nInhalation: No data available\nDermal: No data available\nNo data available\nSkin corrosion/irritation\nNo data available\nSerious eye damage/eye irritation\nNo data available\nRespiratory or skin sensitization\nNo data available\nGerm cell mutagenicity\nNo data available\nCarcinogenicity\nIARC:\nNo ingredient of this product present at levels greater than or equal to 0.1% is\nidentified as probable, possible or confirmed human carcinogen by IARC.\nACGIH:\nNo ingredient of this product present at levels greater than or equal to 0.1% is\nidentified as a carcinogen or potential carcinogen by ACGIH.\nNTP:\nNo ingredient of this product present at levels greater than or equal to 0.1% is\nidentified as a known or anticipated carcinogen by NTP.\nOSHA:\nNo component of this product present at levels greater than or equal to 0.1% is\non OSHA's list of regulated carcinogens.\nReproductive toxicity\nNo data available\nSpecific target organ toxicity - single exposure\nNo data available\nSpecific target organ toxicity - repeated exposure\nNo data available\nAspiration hazard\nNo data available\n11.2 Additional Information\nRTECS: FK9225000\nMaterial is extremely destructive to tissue of the mucous membranes and upper respiratory\ntract, eyes, and skin., Cough, Shortness of breath, Headache, Nausea\nTo the best of our knowledge, the chemical, physical, and toxicological properties have not\nbeen thoroughly investigated."}