{"GUID":"AkKsEQACHt+fl92lrOaIwg==","MATNR":"HZ-PPM","MAKTX":"Potassium permanganate","WERKS":"0001","LGORT":"0088","LGOBE":"Lager 0088 (WM)","SECTION_ID":15,"SECTION_HEADER":"Regulatory information","SECTION_CONTENT":"Component\nPotassium permanganate\nLegend:\nTSCA - EPA (TSCA) - Toxic Substances Control Act, (40 CFR Part 710)\nX - Listed\n'-' - Not Listed\nTSCA 12(b) - Notices of Export\nNot applicable\nComponent\nPotassium permanganate\nKECL - NIER number or KE number (http://ncis.nier.go.kr/en/main.do)\nComponent\nPotassium permanganate\nSARA 311/312 Hazard Categories\nSee section 2 for more information\nComponent\nPotassium permanganate\nClean Air Act\nComponent\nPotassium permanganate\nThis material, as supplied, contains one or more substances regulated as a hazardous\nsubstance under the Comprehensive Environmental Response Compensation and Liability\nAct (CERCLA) (40 CFR 302)\nComponent\nPotassium permanganate\nCAS No\n7722-64-7\nCAS No\n7722-64-7\nCAS No\n7722-64-7\nCAS No\n7722-64-7\nCAS No\n7722-64-7\nTSCA\nX\nDSL\nX\nNDSL\nX\nEINECS\n231-760-3\nPICCS\nX\nENCS\nX\nISHL\nX\nWeight %\n>95\nSARA 313 - Threshold\nValues %\n1.0\nAICS\nX\nIECSC\nX\nCWA - Hazardous\nSubstances\nX\nHAPS Data\nX\nNot applicable\nCWA - Reportable\nQuantities\n100 lb\nKECL\nKE-29180\nHazardous Substances RQs\n100 lb\nCWA - Toxic Pollutants CWA - Priority Pollutants\nClass 1 Ozone Depletors\nClass 2 Ozone Depletors\nCERCLA EHS RQS","REVISED_CONTENT":"Product ID:HZ-PPM,Product Description:Potassium permanganate,Storage Location:0088,Storage Location Description:Lager 0088 (WM),Plant:0001,Section Id:15,Section Header:Regulatory information,Section Content:Component\nPotassium permanganate\nLegend:\nTSCA - EPA (TSCA) - Toxic Substances Control Act, (40 CFR Part 710)\nX - Listed\n'-' - Not Listed\nTSCA 12(b) - Notices of Export\nNot applicable\nComponent\nPotassium permanganate\nKECL - NIER number or KE number (http://ncis.nier.go.kr/en/main.do)\nComponent\nPotassium permanganate\nSARA 311/312 Hazard Categories\nSee section 2 for more information\nComponent\nPotassium permanganate\nClean Air Act\nComponent\nPotassium permanganate\nThis material, as supplied, contains one or more substances regulated as a hazardous\nsubstance under the Comprehensive Environmental Response Compensation and Liability\nAct (CERCLA) (40 CFR 302)\nComponent\nPotassium permanganate\nCAS No\n7722-64-7\nCAS No\n7722-64-7\nCAS No\n7722-64-7\nCAS No\n7722-64-7\nCAS No\n7722-64-7\nTSCA\nX\nDSL\nX\nNDSL\nX\nEINECS\n231-760-3\nPICCS\nX\nENCS\nX\nISHL\nX\nWeight %\n>95\nSARA 313 - Threshold\nValues %\n1.0\nAICS\nX\nIECSC\nX\nCWA - Hazardous\nSubstances\nX\nHAPS Data\nX\nNot applicable\nCWA - Reportable\nQuantities\n100 lb\nKECL\nKE-29180\nHazardous Substances RQs\n100 lb\nCWA - Toxic Pollutants CWA - Priority Pollutants\nClass 1 Ozone Depletors\nClass 2 Ozone Depletors\nCERCLA EHS RQS"}