{"GUID":"AkKsEQACHt+fl92lo1+owg==","MATNR":"HZ-GAS","MAKTX":"Gasoline","WERKS":"0001","LGORT":"0001","LGOBE":"Lager 0001","SECTION_ID":4,"SECTION_HEADER":"First-aid measures","SECTION_CONTENT":"INHALATION\nImmediately remove from further exposure. Get immediate medical assistance. For those providing\nassistance, avoid exposure to yourself or others. Use adequate respiratory protection. Give supplemental\noxygen, if available. If breathing has stopped, assist ventilation with a mechanical device.\nSKIN CONTACT\nWash contact areas with soap and water. Remove contaminated clothing. Launder contaminated clothing\nbefore reuse. If product is injected into or under the skin, or into any part of the body, regardless of the\nappearance of the wound or its size, the individual should be evaluated immediately by a physician as a\nsurgical emergency. Even though initial symptoms from high pressure injection may be minimal or absent, early\nsurgical treatment within the first few hours may significantly reduce the ultimate extent of injury.\nEYE CONTACT\nFlush thoroughly with water. If irritation occurs, get medical assistance.\nINGESTION\nSeek immediate medical attention. Do not induce vomiting.\nACUTE AND DELAYED SYMPTOMS/EFFECTS\nSee Toxicological Section","REVISED_CONTENT":"Product ID:HZ-GAS,Product Description:Gasoline,Storage Location:0001,Storage Location Description:Lager 0001,Plant:0001,Section Id:4,Section Header:First-aid measures,Section Content:INHALATION\nImmediately remove from further exposure. Get immediate medical assistance. For those providing\nassistance, avoid exposure to yourself or others. Use adequate respiratory protection. Give supplemental\noxygen, if available. If breathing has stopped, assist ventilation with a mechanical device.\nSKIN CONTACT\nWash contact areas with soap and water. Remove contaminated clothing. Launder contaminated clothing\nbefore reuse. If product is injected into or under the skin, or into any part of the body, regardless of the\nappearance of the wound or its size, the individual should be evaluated immediately by a physician as a\nsurgical emergency. Even though initial symptoms from high pressure injection may be minimal or absent, early\nsurgical treatment within the first few hours may significantly reduce the ultimate extent of injury.\nEYE CONTACT\nFlush thoroughly with water. If irritation occurs, get medical assistance.\nINGESTION\nSeek immediate medical attention. Do not induce vomiting.\nACUTE AND DELAYED SYMPTOMS/EFFECTS\nSee Toxicological Section"}