{"GUID":"AkKsEQACHt+fl92lptzIwg==","MATNR":"HZ-MER","MAKTX":"Mercury","WERKS":"0001","LGORT":"0088","LGOBE":"Lager 0088 (WM)","SECTION_ID":1,"SECTION_HEADER":"Identification","SECTION_CONTENT":"Product Name\nMercury\nCat No. :\nA11075\nCAS No\n7439-97-6\nSynonyms\nQuicksilver\nRecommended Use\nLaboratory chemicals.\nUses advised against\nFood, drug, pesticide or biocidal product use.\nDetails of the supplier of the safety data sheet\nCompany\nThermo Fisher Scientific Chemicals, Inc.\n30 Bond Street\nWard Hill, MA 01835-8099\nTel: 800-343-0660\nFax: 800-322-4757\nEmergency Telephone Number\nFor information US call: 001-800-227-6701 / Europe call: +32 14 57 52 11\nEmergency Number US:001-201-796-7100 / Europe: +32 14 57 52 99\nCHEMTREC Tel. No. US:001-800-424-9300 / Europe:001-703-527-3887","REVISED_CONTENT":"Product ID:HZ-MER,Product Description:Mercury,Storage Location:0088,Storage Location Description:Lager 0088 (WM),Plant:0001,Section Id:1,Section Header:Identification,Section Content:Product Name\nMercury\nCat No. :\nA11075\nCAS No\n7439-97-6\nSynonyms\nQuicksilver\nRecommended Use\nLaboratory chemicals.\nUses advised against\nFood, drug, pesticide or biocidal product use.\nDetails of the supplier of the safety data sheet\nCompany\nThermo Fisher Scientific Chemicals, Inc.\n30 Bond Street\nWard Hill, MA 01835-8099\nTel: 800-343-0660\nFax: 800-322-4757\nEmergency Telephone Number\nFor information US call: 001-800-227-6701 / Europe call: +32 14 57 52 11\nEmergency Number US:001-201-796-7100 / Europe: +32 14 57 52 99\nCHEMTREC Tel. No. US:001-800-424-9300 / Europe:001-703-527-3887"}