{"GUID":"AkKsEQACHt+fl92lptKIwg==","MATNR":"HZ-HYS","MAKTX":"Hydrogen sulfide","WERKS":"0001","LGORT":"0001","LGOBE":"Lager 0001","SECTION_ID":15,"SECTION_HEADER":"Regulatory information","SECTION_CONTENT":"US Federal regulations\nHydrogen sulfide (7783-06-4)\nListed on the United States TSCA (Toxic Substances Control Act) inventory\nListed on the United States SARA Section 302\nSubject to reporting requirements of United States SARA Section 313\nCERCLA RQ\nSARA Section 302 Threshold Planning Quantity (TPQ)\nSARA Section 313 - Emission Reporting\nInternational regulations\nCANADA\nHydrogen sulfide (7783-06-4)\nListed on the Canadian DSL (Domestic Substances List)\nEU-Regulations\nHydrogen sulfide (7783-06-4)\nListed on the EEC inventory EINECS (European Inventory of Existing Commercial Chemical Substances)\nNational regulations\nHydrogen sulfide (7783-06-4)\nListed introduction on Australian Industrial Chemicals Introduction Scheme (AICIS Inventory)\nListed on IECSC (Inventory of Existing Chemical Substances Produced or Imported in China)\nListed on the Japanese ENCS (Existing New Chemical Substances) inventory\nListed on the Japanese ISHL (Industrial Safety and Health Law)\nListed on KECL/KECI (Korean Existing Chemicals Inventory)\nListed on NZIoC (New Zealand Inventory of Chemicals)\nListed on PICCS (Philippines Inventory of Chemicals and Chemical Substances)\nListed on the Canadian IDL (Ingredient Disclosure List)\nListed on INSQ (Mexican National Inventory of Chemical Substances)\nListed on the TCSI (Taiwan Chemical Substance Inventory)\nUS State regulations\nHydrogen sulfide(7783-06-4)\nU.S. - California - Proposition 65 - Carcinogens List\nU.S. - California - Proposition 65 - Developmental Toxicity\nU.S. - California - Proposition 65 - Reproductive Toxicity - Female\nU.S. - California - Proposition 65 - Reproductive Toxicity - Male\nState or local regulations\n: 100 lb\n: 500 lb\n: 1%\n: No\n: No\n: No\n: No\n: U.S. - Massachusetts - Right To Know List\nU.S. - New Jersey - Right to Know Hazardous Substance List\nU.S. - Pennsylvania - RTK (Right to Know) - Environmental Hazard List\nU.S. - Pennsylvania - RTK (Right to Know) List","REVISED_CONTENT":"Product ID:HZ-HYS,Product Description:Hydrogen sulfide,Storage Location:0001,Storage Location Description:Lager 0001,Plant:0001,Section Id:15,Section Header:Regulatory information,Section Content:US Federal regulations\nHydrogen sulfide (7783-06-4)\nListed on the United States TSCA (Toxic Substances Control Act) inventory\nListed on the United States SARA Section 302\nSubject to reporting requirements of United States SARA Section 313\nCERCLA RQ\nSARA Section 302 Threshold Planning Quantity (TPQ)\nSARA Section 313 - Emission Reporting\nInternational regulations\nCANADA\nHydrogen sulfide (7783-06-4)\nListed on the Canadian DSL (Domestic Substances List)\nEU-Regulations\nHydrogen sulfide (7783-06-4)\nListed on the EEC inventory EINECS (European Inventory of Existing Commercial Chemical Substances)\nNational regulations\nHydrogen sulfide (7783-06-4)\nListed introduction on Australian Industrial Chemicals Introduction Scheme (AICIS Inventory)\nListed on IECSC (Inventory of Existing Chemical Substances Produced or Imported in China)\nListed on the Japanese ENCS (Existing New Chemical Substances) inventory\nListed on the Japanese ISHL (Industrial Safety and Health Law)\nListed on KECL/KECI (Korean Existing Chemicals Inventory)\nListed on NZIoC (New Zealand Inventory of Chemicals)\nListed on PICCS (Philippines Inventory of Chemicals and Chemical Substances)\nListed on the Canadian IDL (Ingredient Disclosure List)\nListed on INSQ (Mexican National Inventory of Chemical Substances)\nListed on the TCSI (Taiwan Chemical Substance Inventory)\nUS State regulations\nHydrogen sulfide(7783-06-4)\nU.S. - California - Proposition 65 - Carcinogens List\nU.S. - California - Proposition 65 - Developmental Toxicity\nU.S. - California - Proposition 65 - Reproductive Toxicity - Female\nU.S. - California - Proposition 65 - Reproductive Toxicity - Male\nState or local regulations\n: 100 lb\n: 500 lb\n: 1%\n: No\n: No\n: No\n: No\n: U.S. - Massachusetts - Right To Know List\nU.S. - New Jersey - Right to Know Hazardous Substance List\nU.S. - Pennsylvania - RTK (Right to Know) - Environmental Hazard List\nU.S. - Pennsylvania - RTK (Right to Know) List"}