{"GUID":"AkKsEQACHt+fl92lpt8Iwg==","MATNR":"HZ-MET","MAKTX":"Methane","WERKS":"0001","LGORT":"0001","LGOBE":"Lager 0001","SECTION_ID":3,"SECTION_HEADER":"Composition / information on ingredients","SECTION_CONTENT":"Substance/mixture : Substance\nChemical name : methane\nOther means of\nidentification : Methane or natural gas; Marsh gas; Methyl hydride; CH4; Fire Damp;\nProduct code : 001033\nCAS number/other identifiers\nCAS number : 74-82-8\nIngredient name\nmethane\n%\n100\nAny concentration shown as a range is to protect confidentiality or is due to batch variation.\nCAS number\n74-82-8\nThere are no additional ingredients present which, within the current knowledge of the supplier and in the\nconcentrations applicable, are classified as hazardous to health or the environment and hence require reporting\nin this section.\nOccupational exposure limits, if available, are listed in Section 8.","REVISED_CONTENT":"Product ID:HZ-MET,Product Description:Methane,Storage Location:0001,Storage Location Description:Lager 0001,Plant:0001,Section Id:3,Section Header:Composition / information on ingredients,Section Content:Substance/mixture : Substance\nChemical name : methane\nOther means of\nidentification : Methane or natural gas; Marsh gas; Methyl hydride; CH4; Fire Damp;\nProduct code : 001033\nCAS number/other identifiers\nCAS number : 74-82-8\nIngredient name\nmethane\n%\n100\nAny concentration shown as a range is to protect confidentiality or is due to batch variation.\nCAS number\n74-82-8\nThere are no additional ingredients present which, within the current knowledge of the supplier and in the\nconcentrations applicable, are classified as hazardous to health or the environment and hence require reporting\nin this section.\nOccupational exposure limits, if available, are listed in Section 8."}