{"GUID":"AkKsEQACHt+fl92loTXowg==","MATNR":"HZ-BUT","MAKTX":"Butane","WERKS":"0001","LGORT":"0001","LGOBE":"Lager 0001","SECTION_ID":8,"SECTION_HEADER":"Exposure controls / personal protection","SECTION_CONTENT":"SECTION 8: Exposure controls/personal protection\n8.1 Control parameters\nIngredients with workplace control parameters\nComponent\nButane\nCAS-No.\nValue\nControl\nparameters\n106-97-8\nTWA\n800 ppm\nTWA\n1,900 mg/m3\n800 ppm\n1,900 mg/m3\n800 ppm\nBasis\nUSA. NIOSH Recommended\nExposure Limits\nUSA. OSHA - TABLE Z-1 Limits\nfor Air Contaminants\n1910.1000\nPEL\nCalifornia permissible exposure\n1,900 mg/m3\nlimits for chemical\ncontaminants (Title 8, Article\n107)\nSTEL\n1,000 ppm\nUSA. ACGIH Threshold Limit\nValues (TLV)\n8.2 Exposure controls\nAppropriate engineering controls\nChange contaminated clothing. Wash hands after working with substance.\nPersonal protective equipment\nEye/face protection\nUse equipment for eye protection tested and approved under appropriate\ngovernment standards such as NIOSH (US) or EN 166(EU). Safety glasses\nSkin protection\nrequired\nBody Protection\nFlame retardant antistatic protective clothing.\nRespiratory protection\nrequired when vapours/mists are generated. Our recommendations on filtering\nrespiratory protection are based on the following standards: DIN EN 143, DIN 14387\nand other accompanying standards relating to the used respiratory protection\nsystem.\nControl of environmental exposure\nNo special precautionary measures necessary.","REVISED_CONTENT":"Product ID:HZ-BUT,Product Description:Butane,Storage Location:0001,Storage Location Description:Lager 0001,Plant:0001,Section Id:8,Section Header:Exposure controls / personal protection,Section Content:SECTION 8: Exposure controls/personal protection\n8.1 Control parameters\nIngredients with workplace control parameters\nComponent\nButane\nCAS-No.\nValue\nControl\nparameters\n106-97-8\nTWA\n800 ppm\nTWA\n1,900 mg/m3\n800 ppm\n1,900 mg/m3\n800 ppm\nBasis\nUSA. NIOSH Recommended\nExposure Limits\nUSA. OSHA - TABLE Z-1 Limits\nfor Air Contaminants\n1910.1000\nPEL\nCalifornia permissible exposure\n1,900 mg/m3\nlimits for chemical\ncontaminants (Title 8, Article\n107)\nSTEL\n1,000 ppm\nUSA. ACGIH Threshold Limit\nValues (TLV)\n8.2 Exposure controls\nAppropriate engineering controls\nChange contaminated clothing. Wash hands after working with substance.\nPersonal protective equipment\nEye/face protection\nUse equipment for eye protection tested and approved under appropriate\ngovernment standards such as NIOSH (US) or EN 166(EU). Safety glasses\nSkin protection\nrequired\nBody Protection\nFlame retardant antistatic protective clothing.\nRespiratory protection\nrequired when vapours/mists are generated. Our recommendations on filtering\nrespiratory protection are based on the following standards: DIN EN 143, DIN 14387\nand other accompanying standards relating to the used respiratory protection\nsystem.\nControl of environmental exposure\nNo special precautionary measures necessary."}