{"GUID":"AkKsEQACHt+fl92lo1sIwg==","MATNR":"HZ-CMO","MAKTX":"Carbon monoxide","WERKS":"0001","LGORT":"0001","LGOBE":"Lager 0001","SECTION_ID":15,"SECTION_HEADER":"Regulatory information","SECTION_CONTENT":"US Federal regulations\nCarbon Monoxide (630-08-0)\n: Listed on the United States TSCA (Toxic Substances Control Act) inventory\nInternational regulations\nCANADA\nCarbon Monoxide (630-08-0)\n: Listed on the Canadian DSL (Domestic Substances List)\nEU-Regulations\nCarbon Monoxide (630-08-0)\n: Listed on the EEC inventory EINECS (European Inventory of Existing Commercial Chemical Substances)\nNational regulations","REVISED_CONTENT":"Product ID:HZ-CMO,Product Description:Carbon monoxide,Storage Location:0001,Storage Location Description:Lager 0001,Plant:0001,Section Id:15,Section Header:Regulatory information,Section Content:US Federal regulations\nCarbon Monoxide (630-08-0)\n: Listed on the United States TSCA (Toxic Substances Control Act) inventory\nInternational regulations\nCANADA\nCarbon Monoxide (630-08-0)\n: Listed on the Canadian DSL (Domestic Substances List)\nEU-Regulations\nCarbon Monoxide (630-08-0)\n: Listed on the EEC inventory EINECS (European Inventory of Existing Commercial Chemical Substances)\nNational regulations"}