{"GUID":"AkKsEQACHt+fl92lptaowg==","MATNR":"HZ-LIT","MAKTX":"Lithium","WERKS":"0001","LGORT":"0001","LGOBE":"Lager 0001","SECTION_ID":16,"SECTION_HEADER":"OTHER INFORMATION","SECTION_CONTENT":"This Safety Data Sheet (SDS) is for guidance and is based upon information and tests believed to be reliable. Flinn Scientific, Inc. makes no guarantee of the accuracy\nor completeness of the data and shall not be liable for any damages relating thereto. The data is offered solely for your consideration, investigation, and verification.\nThe data should not be confused with local, state, federal or insurance mandates, regulations, or requirements and CONSTITUTE NO WARRANTY. Any use of this\ndata and information must be determined by the science instructor to be in accordance with applicable local, state or federal laws and regulations. The conditions or\nmethods of handling, storage, use and disposal of the product(s) described are beyond the control of Flinn Scientific, Inc. and may be beyond our knowledge. FOR\nTHIS AND OTHER REASONS, WE DO NOT ASSUME RESPONSIBILITY AND EXPRESSLY DISCLAIM LIABILITY FOR LOSS, DAMAGE OR\nEXPENSE ARISING OUT OF OR IN ANY WAY CONNECTED WITH THE HANDLING, STORAGE, USE OR DISPOSAL OF THIS PRODUCT(S).\nN.A. = Not available, not all health aspects of this substance have been fully investigated.\nN/A = Not applicable\nConsult your copy of the Flinn Science Catalog/Reference Manual for additional information about laboratory chemicals.\nRevision Date: March 21, 2014","REVISED_CONTENT":"Product ID:HZ-LIT,Product Description:Lithium,Storage Location:0001,Storage Location Description:Lager 0001,Plant:0001,Section Id:16,Section Header:OTHER INFORMATION,Section Content:This Safety Data Sheet (SDS) is for guidance and is based upon information and tests believed to be reliable. Flinn Scientific, Inc. makes no guarantee of the accuracy\nor completeness of the data and shall not be liable for any damages relating thereto. The data is offered solely for your consideration, investigation, and verification.\nThe data should not be confused with local, state, federal or insurance mandates, regulations, or requirements and CONSTITUTE NO WARRANTY. Any use of this\ndata and information must be determined by the science instructor to be in accordance with applicable local, state or federal laws and regulations. The conditions or\nmethods of handling, storage, use and disposal of the product(s) described are beyond the control of Flinn Scientific, Inc. and may be beyond our knowledge. FOR\nTHIS AND OTHER REASONS, WE DO NOT ASSUME RESPONSIBILITY AND EXPRESSLY DISCLAIM LIABILITY FOR LOSS, DAMAGE OR\nEXPENSE ARISING OUT OF OR IN ANY WAY CONNECTED WITH THE HANDLING, STORAGE, USE OR DISPOSAL OF THIS PRODUCT(S).\nN.A. = Not available, not all health aspects of this substance have been fully investigated.\nN/A = Not applicable\nConsult your copy of the Flinn Science Catalog/Reference Manual for additional information about laboratory chemicals.\nRevision Date: March 21, 2014"}