{"GUID":"AkKsEQACHt+fl92lrP9Iwg==","MATNR":"HZ-URA","MAKTX":"URANIUM - WP","WERKS":"0001","LGORT":"0088","LGOBE":"Lager 0088 (WM)","SECTION_ID":5,"SECTION_HEADER":"Fire-fighting measures","SECTION_CONTENT":"SECTION 5: Firefighting measures\n5.1 Extinguishing media\nSuitable extinguishing media\nUse extinguishing measures that are appropriate to local circumstances and the\nsurrounding environment.\nUnsuitable extinguishing media\nFor this substance/mixture no limitations of extinguishing agents are given.\n5.2 Special hazards arising from the substance or mixture\nNitrogen oxides (NOx)\nNot combustible.\nAmbient fire may liberate hazardous vapours.\n5.3 Advice for firefighters\nStay in danger area only with self-contained breathing apparatus. Prevent skin contact by\nkeeping a safe distance or by wearing suitable protective clothing.\n5.4 Further information\nSuppress (knock down) gases/vapors/mists with a water spray jet. Prevent fire\nextinguishing water from contaminating surface water or the ground water system.","REVISED_CONTENT":"Product ID:HZ-URA,Product Description:URANIUM - WP,Storage Location:0088,Storage Location Description:Lager 0088 (WM),Plant:0001,Section Id:5,Section Header:Fire-fighting measures,Section Content:SECTION 5: Firefighting measures\n5.1 Extinguishing media\nSuitable extinguishing media\nUse extinguishing measures that are appropriate to local circumstances and the\nsurrounding environment.\nUnsuitable extinguishing media\nFor this substance/mixture no limitations of extinguishing agents are given.\n5.2 Special hazards arising from the substance or mixture\nNitrogen oxides (NOx)\nNot combustible.\nAmbient fire may liberate hazardous vapours.\n5.3 Advice for firefighters\nStay in danger area only with self-contained breathing apparatus. Prevent skin contact by\nkeeping a safe distance or by wearing suitable protective clothing.\n5.4 Further information\nSuppress (knock down) gases/vapors/mists with a water spray jet. Prevent fire\nextinguishing water from contaminating surface water or the ground water system."}