{"GUID":"AkKsEQACHt+fl92lrOqowg==","MATNR":"HZ-SAC","MAKTX":"Sulfuric acid","WERKS":"0001","LGORT":"0003","LGOBE":"Corrosive Items","SECTION_ID":16,"SECTION_HEADER":"Other information","SECTION_CONTENT":"Print Date 20-Mar-2014 Revision Summary This document has been updated to comply with the US OSHA HazCom 2012 Standard replacing the current legislation under 29 CFR 1910.1200 to align with the Globally Harmonized System of Classification and Labeling of Chemicals (GHS) Disclaimer The information provided on this Safety Data Sheet is correct to the best of our knowledge, information and belief at the date of its publication. The information given is designed only as a guide for safe handling, use, processing, storage, transportation, disposal and release and is not to be considered as a warranty or quality specification. The information relates only to the specific material designated and may not be valid for such material used in combination with any other material or in any process, unless specified in the text. End of SDS","REVISED_CONTENT":"Product ID:HZ-SAC,Product Description:Sulfuric acid,Storage Location:0003,Storage Location Description:Corrosive Items,Plant:0001,Section Id:16,Section Header:Other information,Section Content:Print Date 20-Mar-2014 Revision Summary This document has been updated to comply with the US OSHA HazCom 2012 Standard replacing the current legislation under 29 CFR 1910.1200 to align with the Globally Harmonized System of Classification and Labeling of Chemicals (GHS) Disclaimer The information provided on this Safety Data Sheet is correct to the best of our knowledge, information and belief at the date of its publication. The information given is designed only as a guide for safe handling, use, processing, storage, transportation, disposal and release and is not to be considered as a warranty or quality specification. The information relates only to the specific material designated and may not be valid for such material used in combination with any other material or in any process, unless specified in the text. End of SDS"}