{"GUID":"AkKsEQACHt+fl92lpucIwg==","MATNR":"HZ-PHO","MAKTX":"Phosphorus","WERKS":"0001","LGORT":"0088","LGOBE":"Lager 0088 (WM)","SECTION_ID":3,"SECTION_HEADER":"Composition / information on ingredients","SECTION_CONTENT":"3.2. Mixtures\nComponent\nSulfuric acid\n(CAS #: 7664-93-9)\nPoly(oxy-1.2-ethanediyl),\nalpha[4-(1,1,3,3-tetramethylbutyl)phenyl]-omega-hydroxy\n(Triton X-100)\n(CAS #: 9002-93-1)\nComponent\nSulfuric acid\nPoly(oxy-1.2-ethanediyl),\nalpha[4-(1,1,3,3-tetramethylbutyl)phenyl]-omega-hydroxy\n(Triton X-100)\nFull text of Hazard Statements: see section 16\nWeight %\n5-<10\n1-<3\nCLP Classification - Regulation (EC) No\n1272/2008\nSkin Corr. 1A (H314)\nEye Dam. 1 (H318)\nAcute Tox. 4 (H302)\nAquatic Chronic 2 (H411)\nReach Registration Number\n01-2119458838-20-XXXX\nNA\nREACH regulation (EC\n1907/2006) article 56 -\nCandidate List of Substance\nof Very High Concern\n(SVHC)","REVISED_CONTENT":"Product ID:HZ-PHO,Product Description:Phosphorus,Storage Location:0088,Storage Location Description:Lager 0088 (WM),Plant:0001,Section Id:3,Section Header:Composition / information on ingredients,Section Content:3.2. Mixtures\nComponent\nSulfuric acid\n(CAS #: 7664-93-9)\nPoly(oxy-1.2-ethanediyl),\nalpha[4-(1,1,3,3-tetramethylbutyl)phenyl]-omega-hydroxy\n(Triton X-100)\n(CAS #: 9002-93-1)\nComponent\nSulfuric acid\nPoly(oxy-1.2-ethanediyl),\nalpha[4-(1,1,3,3-tetramethylbutyl)phenyl]-omega-hydroxy\n(Triton X-100)\nFull text of Hazard Statements: see section 16\nWeight %\n5-<10\n1-<3\nCLP Classification - Regulation (EC) No\n1272/2008\nSkin Corr. 1A (H314)\nEye Dam. 1 (H318)\nAcute Tox. 4 (H302)\nAquatic Chronic 2 (H411)\nReach Registration Number\n01-2119458838-20-XXXX\nNA\nREACH regulation (EC\n1907/2006) article 56 -\nCandidate List of Substance\nof Very High Concern\n(SVHC)"}