{"GUID":"AkKsEQACHt+fl92lo1+Iwg==","MATNR":"HZ-GAS","MAKTX":"Gasoline","WERKS":"0001","LGORT":"0001","LGOBE":"Lager 0001","SECTION_ID":3,"SECTION_HEADER":"Composition / information on ingredients","SECTION_CONTENT":"This material is defined as a mixture.\nHazardous Substance(s) or Complex Substance(s) required for disclosure\nName\nETHYL ALCOHOL\nETHYL TERT-BUTYL ETHER\nGASOLINE\nISOBUTYL ALCOHOL\nISOPROPYL ALCOHOL\nMETHYL ALCOHOL\nMETHYL-TERT-BUTYL ETHER\nTERT-BUTYL ALCOHOL\nCAS#\n64-17-5\n637-92-3\n86290-81-5\n78-83-1\n67-63-0\n67-56-1\n1634-04-4\n75-65-0\nConcentration*\n0-5%\n0-15%\n> 85%\n0-10%\n0-10%\n0 - <3%\n0-15%\n0-7%\nGHS Hazard Codes\nH225, H319(2A)\nH225, H336, H402\nH224, H304, H336,\nH340(1B), H350(1B),\nH361(D), H315, H401, H411\nH226, H335, H336, H315,\nH318\nH225, H305, H336,\nH319(2A)\nH225, H301, H311, H331,\nH370\nH225, H303, H305, H315\nH225, H303, H305, H332,\nH335, H336\nHazardous Constituent(s) Contained in Complex Substance(s) required for disclosure\nName\nBenzene\nToluene\nCAS#\n71-43-2\n108-88-3\nConcentration*\n0.1 - 1.0%\n> 5.0%\nGHS Hazard Codes\nH225, H303, H304,\nH340(1B), H350(1A), H315,\nH319(2A), H372, H401\nH225, H304, H336,\nH361(D), H315, H373, H401,\nH412\n* All concentrations are percent by weight unless ingredient is a gas. Gas concentrations are in percent by volume.\nNOTE:\nOxygenates may be present up to the maximum permitted by European Standard EN228.","REVISED_CONTENT":"Product ID:HZ-GAS,Product Description:Gasoline,Storage Location:0001,Storage Location Description:Lager 0001,Plant:0001,Section Id:3,Section Header:Composition / information on ingredients,Section Content:This material is defined as a mixture.\nHazardous Substance(s) or Complex Substance(s) required for disclosure\nName\nETHYL ALCOHOL\nETHYL TERT-BUTYL ETHER\nGASOLINE\nISOBUTYL ALCOHOL\nISOPROPYL ALCOHOL\nMETHYL ALCOHOL\nMETHYL-TERT-BUTYL ETHER\nTERT-BUTYL ALCOHOL\nCAS#\n64-17-5\n637-92-3\n86290-81-5\n78-83-1\n67-63-0\n67-56-1\n1634-04-4\n75-65-0\nConcentration*\n0-5%\n0-15%\n> 85%\n0-10%\n0-10%\n0 - <3%\n0-15%\n0-7%\nGHS Hazard Codes\nH225, H319(2A)\nH225, H336, H402\nH224, H304, H336,\nH340(1B), H350(1B),\nH361(D), H315, H401, H411\nH226, H335, H336, H315,\nH318\nH225, H305, H336,\nH319(2A)\nH225, H301, H311, H331,\nH370\nH225, H303, H305, H315\nH225, H303, H305, H332,\nH335, H336\nHazardous Constituent(s) Contained in Complex Substance(s) required for disclosure\nName\nBenzene\nToluene\nCAS#\n71-43-2\n108-88-3\nConcentration*\n0.1 - 1.0%\n> 5.0%\nGHS Hazard Codes\nH225, H303, H304,\nH340(1B), H350(1A), H315,\nH319(2A), H372, H401\nH225, H304, H336,\nH361(D), H315, H373, H401,\nH412\n* All concentrations are percent by weight unless ingredient is a gas. Gas concentrations are in percent by volume.\nNOTE:\nOxygenates may be present up to the maximum permitted by European Standard EN228."}