{"GUID":"AkKsEQACHt+fl92lps+owg==","MATNR":"HZ-HYP","MAKTX":"Hydrogen Peroxide 3%","WERKS":"0001","LGORT":"0002","LGOBE":"Cold Storage","SECTION_ID":8,"SECTION_HEADER":"Exposure controls / personal protection","SECTION_CONTENT":"Exposure Guidelines\nComponent\nHydrogen peroxide\nACGIH TLV\nTWA: 1 ppm\nOSHA PEL\n(Vacated) TWA: 1 ppm\n(Vacated) TWA: 1.4 mg/m³\nTWA: 1 ppm\nNIOSH IDLH\nIDLH: 75 ppm\nTWA: 1 ppm\nTWA: 1.4 mg/m³\nLegend\nTWA: 1.4 mg/m³\nComponent\nQuebec\nMexico OEL (TWA)\nOntario TWAEV\nHydrogen peroxide\nTWA: 1 ppm\nTWA: 1.4 mg/m³\nTWA: 1 ppm\nTWA: 1.5 mg/m³\nSTEL: 2 ppm\nSTEL: 3 mg/m³\nTWA: 1 ppm\nACGIH - American Conference of Governmental Industrial Hygienists\nOSHA - Occupational Safety and Health Administration\nNIOSH IDLH: The National Institute for Occupational Safety and Health Immediately Dangerous to Life or Health\nEngineering Measures\nNone under normal use conditions.\nPersonal Protective Equipment\nEye/face Protection\nWear appropriate protective eyeglasses or chemical safety goggles as described by\nOSHA's eye and face protection regulations in 29 CFR 1910.133 or European Standard\nEN166.\nSkin and body protection\nWear appropriate protective gloves and clothing to prevent skin exposure.\nRespiratory Protection\nNo protective equipment is needed under normal use conditions.\nHygiene Measures\nHandle in accordance with good industrial hygiene and safety practice.","REVISED_CONTENT":"Product ID:HZ-HYP,Product Description:Hydrogen Peroxide 3%,Storage Location:0002,Storage Location Description:Cold Storage,Plant:0001,Section Id:8,Section Header:Exposure controls / personal protection,Section Content:Exposure Guidelines\nComponent\nHydrogen peroxide\nACGIH TLV\nTWA: 1 ppm\nOSHA PEL\n(Vacated) TWA: 1 ppm\n(Vacated) TWA: 1.4 mg/m³\nTWA: 1 ppm\nNIOSH IDLH\nIDLH: 75 ppm\nTWA: 1 ppm\nTWA: 1.4 mg/m³\nLegend\nTWA: 1.4 mg/m³\nComponent\nQuebec\nMexico OEL (TWA)\nOntario TWAEV\nHydrogen peroxide\nTWA: 1 ppm\nTWA: 1.4 mg/m³\nTWA: 1 ppm\nTWA: 1.5 mg/m³\nSTEL: 2 ppm\nSTEL: 3 mg/m³\nTWA: 1 ppm\nACGIH - American Conference of Governmental Industrial Hygienists\nOSHA - Occupational Safety and Health Administration\nNIOSH IDLH: The National Institute for Occupational Safety and Health Immediately Dangerous to Life or Health\nEngineering Measures\nNone under normal use conditions.\nPersonal Protective Equipment\nEye/face Protection\nWear appropriate protective eyeglasses or chemical safety goggles as described by\nOSHA's eye and face protection regulations in 29 CFR 1910.133 or European Standard\nEN166.\nSkin and body protection\nWear appropriate protective gloves and clothing to prevent skin exposure.\nRespiratory Protection\nNo protective equipment is needed under normal use conditions.\nHygiene Measures\nHandle in accordance with good industrial hygiene and safety practice."}