{"GUID":"AkKsEQACHt+fl92lo1Vowg==","MATNR":"HZ-CHL","MAKTX":"Chlorine","WERKS":"0001","LGORT":"0001","LGOBE":"Lager 0001","SECTION_ID":2,"SECTION_HEADER":"Hazard identification","SECTION_CONTENT":"2.1. Classification of the substance or mixture\nGHS US classification\nOxidizing gases Category 1\nGases under pressure Compressed gas\nAcute toxicity (inhalation:gas) Category 2\nSkin corrosion/irritation Category 1A\nSerious eye damage/eye irritation Category 1\nSpecific target organ toxicity - Single exposure, Category 3,\nRespiratory tract irritation\nFull text of H statements: see section 16\n2.2. GHS Label elements, including precautionary statements\nGHS US labeling\nHazard pictograms (GHS US)\nSignal word (GHS US)\nHazard statements (GHS US)\n: Danger\n: H270 - May cause or intensify fire; oxidizer\nH280 - Contains gas under pressure; may explode if heated\nH314 - Causes severe skin burns and eye damage\nH318 - Causes serious eye damage\nH330 Fatal if inhaled\nCGA-HG22 - Corrosive to the respiratory tract","REVISED_CONTENT":"Product ID:HZ-CHL,Product Description:Chlorine,Storage Location:0001,Storage Location Description:Lager 0001,Plant:0001,Section Id:2,Section Header:Hazard identification,Section Content:2.1. Classification of the substance or mixture\nGHS US classification\nOxidizing gases Category 1\nGases under pressure Compressed gas\nAcute toxicity (inhalation:gas) Category 2\nSkin corrosion/irritation Category 1A\nSerious eye damage/eye irritation Category 1\nSpecific target organ toxicity - Single exposure, Category 3,\nRespiratory tract irritation\nFull text of H statements: see section 16\n2.2. GHS Label elements, including precautionary statements\nGHS US labeling\nHazard pictograms (GHS US)\nSignal word (GHS US)\nHazard statements (GHS US)\n: Danger\n: H270 - May cause or intensify fire; oxidizer\nH280 - Contains gas under pressure; may explode if heated\nH314 - Causes severe skin burns and eye damage\nH318 - Causes serious eye damage\nH330 Fatal if inhaled\nCGA-HG22 - Corrosive to the respiratory tract"}