{"GUID":"AkKsEQACHt+fl92lo1IIwg==","MATNR":"HZ-CAD","MAKTX":"Cadmium","WERKS":"0001","LGORT":"0088","LGOBE":"Lager 0088 (WM)","SECTION_ID":7,"SECTION_HEADER":"Handling and storage","SECTION_CONTENT":"Precautions:\nKeep locked up Keep away from heat. Keep away from sources of ignition. Empty containers pose a fire risk, evaporate the\nresidue under a fume hood. Ground all equipment containing material. Do not ingest. Do not breathe dust. Wear suitable\nprotective clothing In case of insufficient ventilation, wear suitable respiratory equipment If ingested, seek medical advice\nimmediately and show the container or the label. Keep away from incompatibles such as oxidizing agents.\nStorage:\nKeep container dry. Keep in a cool place. Ground all equipment containing material. Keep container tightly closed. Keep in a\ncool, well-ventilated place. Highly toxic or infectious materials should be stored in a separate locked safety storage cabinet or\nroom.","REVISED_CONTENT":"Product ID:HZ-CAD,Product Description:Cadmium,Storage Location:0088,Storage Location Description:Lager 0088 (WM),Plant:0001,Section Id:7,Section Header:Handling and storage,Section Content:Precautions:\nKeep locked up Keep away from heat. Keep away from sources of ignition. Empty containers pose a fire risk, evaporate the\nresidue under a fume hood. Ground all equipment containing material. Do not ingest. Do not breathe dust. Wear suitable\nprotective clothing In case of insufficient ventilation, wear suitable respiratory equipment If ingested, seek medical advice\nimmediately and show the container or the label. Keep away from incompatibles such as oxidizing agents.\nStorage:\nKeep container dry. Keep in a cool place. Ground all equipment containing material. Keep container tightly closed. Keep in a\ncool, well-ventilated place. Highly toxic or infectious materials should be stored in a separate locked safety storage cabinet or\nroom."}