{"GUID":"AkKsEQACHt+fl92lptIIwg==","MATNR":"HZ-HYS","MAKTX":"Hydrogen sulfide","WERKS":"0001","LGORT":"0001","LGOBE":"Lager 0001","SECTION_ID":11,"SECTION_HEADER":"Toxicological information","SECTION_CONTENT":"Information on toxicological effects\nAcute toxicity (oral)\nAcute toxicity (dermal)\nAcute toxicity (inhalation)\nHydrogen sulfide (\f)7783-06-4\nLC50 Inhalation - Rat\nLC50 Inhalation - Rat [ppm]\nATE US (gases)\nATE US (vapours)\nATE US (dust, mist)\nSkin corrosion/irritation\nSerious eye damage/irritation\nRespiratory or skin sensitisation\nGerm cell mutagenicity\nCarcinogenicity\nReproductive toxicity\nSTOT-single exposure\nSTOT-repeated exposure\nAspiration hazard\n: Not classified\n: Not classified\n: FATAL IF INHALED.\n: 700 mg/m³ (Exposure time: 4 h)\n: 356 ppm/4h\n: 356 ppmv/4h\n: 0.99 mg/l/4h\n: 0.99 mg/l/4h\n: Not classified\n: Not classified\n: Not classified\n: Not classified\n: Not classified\n: Not classified\n: MAY CAUSE RESPIRATORY IRRITATION.\n: Not classified\n: Not classified","REVISED_CONTENT":"Product ID:HZ-HYS,Product Description:Hydrogen sulfide,Storage Location:0001,Storage Location Description:Lager 0001,Plant:0001,Section Id:11,Section Header:Toxicological information,Section Content:Information on toxicological effects\nAcute toxicity (oral)\nAcute toxicity (dermal)\nAcute toxicity (inhalation)\nHydrogen sulfide (\f)7783-06-4\nLC50 Inhalation - Rat\nLC50 Inhalation - Rat [ppm]\nATE US (gases)\nATE US (vapours)\nATE US (dust, mist)\nSkin corrosion/irritation\nSerious eye damage/irritation\nRespiratory or skin sensitisation\nGerm cell mutagenicity\nCarcinogenicity\nReproductive toxicity\nSTOT-single exposure\nSTOT-repeated exposure\nAspiration hazard\n: Not classified\n: Not classified\n: FATAL IF INHALED.\n: 700 mg/m³ (Exposure time: 4 h)\n: 356 ppm/4h\n: 356 ppmv/4h\n: 0.99 mg/l/4h\n: 0.99 mg/l/4h\n: Not classified\n: Not classified\n: Not classified\n: Not classified\n: Not classified\n: Not classified\n: MAY CAUSE RESPIRATORY IRRITATION.\n: Not classified\n: Not classified"}