{"GUID":"AkKsEQACHt+fl92lrPzIwg==","MATNR":"HZ-URA","MAKTX":"URANIUM - WP","WERKS":"0001","LGORT":"0002","LGOBE":"Cold Storage","SECTION_ID":1,"SECTION_HEADER":"Identification","SECTION_CONTENT":"SECTION 1: Identification of the substance/mixture and of the company/undertaking\n1.1 Product identifiers\nProduct name\n: Uranium - WP\nProduct Number\n: QC1209\nBrand\n: Sigma-Aldrich\n1.2 Relevant identified uses of the substance or mixture and uses advised against\nIdentified uses\n: Laboratory chemicals, Synthesis of substances\n1.3 Details of the supplier of the safety data sheet\nCompany\n: Sigma-Aldrich Inc.\nTelephone\n: +1 314 771-5765\nFax\n: +1 800 325-5052\n1.4 Emergency telephone\nEmergency Phone #\n: 800-424-9300 CHEMTREC (USA) +1-703-\n527-3887 CHEMTREC (International) 24\nHours/day; 7 Days/week","REVISED_CONTENT":"Product ID:HZ-URA,Product Description:URANIUM - WP,Storage Location:0002,Storage Location Description:Cold Storage,Plant:0001,Section Id:1,Section Header:Identification,Section Content:SECTION 1: Identification of the substance/mixture and of the company/undertaking\n1.1 Product identifiers\nProduct name\n: Uranium - WP\nProduct Number\n: QC1209\nBrand\n: Sigma-Aldrich\n1.2 Relevant identified uses of the substance or mixture and uses advised against\nIdentified uses\n: Laboratory chemicals, Synthesis of substances\n1.3 Details of the supplier of the safety data sheet\nCompany\n: Sigma-Aldrich Inc.\nTelephone\n: +1 314 771-5765\nFax\n: +1 800 325-5052\n1.4 Emergency telephone\nEmergency Phone #\n: 800-424-9300 CHEMTREC (USA) +1-703-\n527-3887 CHEMTREC (International) 24\nHours/day; 7 Days/week"}