{"GUID":"AkKsEQACHt+fl92lptbowg==","MATNR":"HZ-MAG","MAKTX":"Magnesium","WERKS":"0001","LGORT":"0001","LGOBE":"Lager 0001","SECTION_ID":2,"SECTION_HEADER":"Hazard(s) identification","SECTION_CONTENT":"This chemical is considered hazardous by the 2012 OSHA Hazard Communication Standard (29 CFR 1910.1200)\nFlammable solids\nSelf-heating substances and mixtures\nSubstances/mixtures which, in contact with water, emit\nflammable gases\nLabel Elements\nSignal Word\nDanger\nHazard Statements\nFlammable solid\nSelf-heating in large quantities; may catch fire\nIn contact with water releases flammable gas\nCategory 1\nCategory 2\nCategory 2","REVISED_CONTENT":"Product ID:HZ-MAG,Product Description:Magnesium,Storage Location:0001,Storage Location Description:Lager 0001,Plant:0001,Section Id:2,Section Header:Hazard(s) identification,Section Content:This chemical is considered hazardous by the 2012 OSHA Hazard Communication Standard (29 CFR 1910.1200)\nFlammable solids\nSelf-heating substances and mixtures\nSubstances/mixtures which, in contact with water, emit\nflammable gases\nLabel Elements\nSignal Word\nDanger\nHazard Statements\nFlammable solid\nSelf-heating in large quantities; may catch fire\nIn contact with water releases flammable gas\nCategory 1\nCategory 2\nCategory 2"}