{"GUID":"AkKsEQACHt+fl92lpt2Iwg==","MATNR":"HZ-MER","MAKTX":"Mercury","WERKS":"0001","LGORT":"0088","LGOBE":"Lager 0088 (WM)","SECTION_ID":7,"SECTION_HEADER":"Handling and storage","SECTION_CONTENT":"Handling\nWear personal protective equipment/face protection. Do not get in eyes, on skin, or on\nclothing. Use only under a chemical fume hood. Do not breathe mist/vapors/spray. Do not\ningest. If swallowed then seek immediate medical assistance.\nStorage.\nKeep containers tightly closed in a dry, cool and well-ventilated place. Do not store in metal\ncontainers. Incompatible Materials. Strong oxidizing agents. Ammonia. Metals. Halogens.","REVISED_CONTENT":"Product ID:HZ-MER,Product Description:Mercury,Storage Location:0088,Storage Location Description:Lager 0088 (WM),Plant:0001,Section Id:7,Section Header:Handling and storage,Section Content:Handling\nWear personal protective equipment/face protection. Do not get in eyes, on skin, or on\nclothing. Use only under a chemical fume hood. Do not breathe mist/vapors/spray. Do not\ningest. If swallowed then seek immediate medical assistance.\nStorage.\nKeep containers tightly closed in a dry, cool and well-ventilated place. Do not store in metal\ncontainers. Incompatible Materials. Strong oxidizing agents. Ammonia. Metals. Halogens."}