{"GUID":"AkKsEQACHt+fl92lo1aIwg==","MATNR":"HZ-CHL","MAKTX":"Chlorine","WERKS":"0001","LGORT":"0001","LGOBE":"Lager 0001","SECTION_ID":11,"SECTION_HEADER":"Toxicological information","SECTION_CONTENT":"11.1. Information on toxicological effects\nAcute toxicity (oral)\nAcute toxicity (dermal)\nAcute toxicity (inhalation)\nChlorine (7782-50-5)\nLD50 oral rat\nLC50 Inhalation - Rat [ppm]\nATE US (gases)\nATE US (vapors)\nATE US (dust, mist)\nSkin corrosion/irritation\nSerious eye damage/irritation\nRespiratory or skin sensitization\nGerm cell mutagenicity\nCarcinogenicity\nReproductive toxicity\nSTOT-single exposure\nSTOT-repeated exposure\nAspiration hazard\nViscosity, kinematic\nPotential Adverse human health effects and\nsymptoms\nSymptoms/effects\n: Not classified\n: Not classified\n: Fatal if inhaled.\n6800 mg/kg\n146.5 ppm/4h\n146.5 ppmV/4h\n0.86 mg/l/4h\n0.86 mg/l/4h\n: Causes severe skin burns.\npH: If dissolved in water pH-value will be affected.\n: Causes serious eye damage.\npH: If dissolved in water pH-value will be affected.\n: Not classified\n: Not classified\n: Not classified\n: Not classified\n: May cause respiratory irritation.\n: Not classified\n: Not classified\n: No reliable data available.\n: Based on available data, the classification criteria are not met. Fatal if inhaled.\n: Causes severe skin burns and eye damage.","REVISED_CONTENT":"Product ID:HZ-CHL,Product Description:Chlorine,Storage Location:0001,Storage Location Description:Lager 0001,Plant:0001,Section Id:11,Section Header:Toxicological information,Section Content:11.1. Information on toxicological effects\nAcute toxicity (oral)\nAcute toxicity (dermal)\nAcute toxicity (inhalation)\nChlorine (7782-50-5)\nLD50 oral rat\nLC50 Inhalation - Rat [ppm]\nATE US (gases)\nATE US (vapors)\nATE US (dust, mist)\nSkin corrosion/irritation\nSerious eye damage/irritation\nRespiratory or skin sensitization\nGerm cell mutagenicity\nCarcinogenicity\nReproductive toxicity\nSTOT-single exposure\nSTOT-repeated exposure\nAspiration hazard\nViscosity, kinematic\nPotential Adverse human health effects and\nsymptoms\nSymptoms/effects\n: Not classified\n: Not classified\n: Fatal if inhaled.\n6800 mg/kg\n146.5 ppm/4h\n146.5 ppmV/4h\n0.86 mg/l/4h\n0.86 mg/l/4h\n: Causes severe skin burns.\npH: If dissolved in water pH-value will be affected.\n: Causes serious eye damage.\npH: If dissolved in water pH-value will be affected.\n: Not classified\n: Not classified\n: Not classified\n: Not classified\n: May cause respiratory irritation.\n: Not classified\n: Not classified\n: No reliable data available.\n: Based on available data, the classification criteria are not met. Fatal if inhaled.\n: Causes severe skin burns and eye damage."}