{"GUID":"AkKsEQACHt+fl92lptJowg==","MATNR":"HZ-HYS","MAKTX":"Hydrogen sulfide","WERKS":"0001","LGORT":"0001","LGOBE":"Lager 0001","SECTION_ID":14,"SECTION_HEADER":"Transport information","SECTION_CONTENT":"In accordance with DOT\nTransport document description (DOT)\nUN-No.(DOT)\nProper Shipping Name (DOT)\nClass (DOT)\nHazard labels (DOT)\nDOT Special Provisions (49 CFR 172.102)\nAdditional information\nEmergency Response Guide (ERG) Number\n: UN1053 Hydrogen sulfide, 2.3\n: UN1053\n: Hydrogen sulfide\n: 2.3 - Class 2.3 - Poisonous gas 49 CFR 173.115\n: Poison Gas\n2.3 - Poison gas\n2.1 - Flammable gas\n: 2 - This material is poisonous by inhalation (see 171.8 of this subchapter) in Hazard Zone B\n(see 173.116(a) or 173.133(a) of this subchapter), and must be described as an inhalation\nhazard under the provisions of this subchapter.\nB9 - Bottom outlets are not authorized.\nB14 - Each bulk packaging, except a tank car or a multi-unit-tank car tank, must be insulated\nwith an insulating material so that the overall thermal conductance at 15.5 C (60 F) is no more\nthan 1.5333 kilojoules per hour per square meter per degree Celsius (0.075 Btu per hour per\nsquare foot per degree Fahrenheit) temperature differential. Insulating materials must not\npromote corrosion to steel when wet.\nN89 - When steel UN pressure receptacles are used, only those bearing the \"H\" mark are\nauthorized.\n: 117","REVISED_CONTENT":"Product ID:HZ-HYS,Product Description:Hydrogen sulfide,Storage Location:0001,Storage Location Description:Lager 0001,Plant:0001,Section Id:14,Section Header:Transport information,Section Content:In accordance with DOT\nTransport document description (DOT)\nUN-No.(DOT)\nProper Shipping Name (DOT)\nClass (DOT)\nHazard labels (DOT)\nDOT Special Provisions (49 CFR 172.102)\nAdditional information\nEmergency Response Guide (ERG) Number\n: UN1053 Hydrogen sulfide, 2.3\n: UN1053\n: Hydrogen sulfide\n: 2.3 - Class 2.3 - Poisonous gas 49 CFR 173.115\n: Poison Gas\n2.3 - Poison gas\n2.1 - Flammable gas\n: 2 - This material is poisonous by inhalation (see 171.8 of this subchapter) in Hazard Zone B\n(see 173.116(a) or 173.133(a) of this subchapter), and must be described as an inhalation\nhazard under the provisions of this subchapter.\nB9 - Bottom outlets are not authorized.\nB14 - Each bulk packaging, except a tank car or a multi-unit-tank car tank, must be insulated\nwith an insulating material so that the overall thermal conductance at 15.5 C (60 F) is no more\nthan 1.5333 kilojoules per hour per square meter per degree Celsius (0.075 Btu per hour per\nsquare foot per degree Fahrenheit) temperature differential. Insulating materials must not\npromote corrosion to steel when wet.\nN89 - When steel UN pressure receptacles are used, only those bearing the \"H\" mark are\nauthorized.\n: 117"}