{"GUID":"AkKsEQACHt+fl92loTLIwg==","MATNR":"HZ-ATR","MAKTX":"Atrazine","WERKS":"0001","LGORT":"0088","LGOBE":"Lager 0088 (WM)","SECTION_ID":15,"SECTION_HEADER":"Regulatory information","SECTION_CONTENT":"Federal and State Regulations: TSCA 8(b) inventory: Atrazine\nOther Regulations: EU DIRECTIVES CLASSIFICATION\nSymbol of Danger: Xn-N\nIndication of Danger: Harmful. Dangerous for the environment.\nR: 43-48/22-50/53\nRisk Statements: May cause sensitization by skin contact.\nHarmful: danger of serious damage to health by prolonged exposure if swallowed. Very toxic to aquatic organisms, may\ncause long-term adverse effects in the aquatic environment.\nS: 36/37-60-61\nSafety Statements: Wear suitable protective clothing and gloves. This material and its container must be disposed of as\nhazardous waste. Avoid release to the environment. Refer to special instructions/safety data sheets.\nOther Classifications:\nWHMIS(Canada): Not available.\nDSCL(EEC): Not available.\nHMIS(U.S.A):\nHealth Hazard: 2\nFire Hazard: 0\nReactivity: 0\nPersonal Protection:\nNational Fire Protection Association (U.S.A):\nHealth: 2\nFlammability: 0\nReactivity: 0\nSpecific hazard:\nProtective Equipment: Gloves. Lab coat. Dust respirator. Be sure to use an approved/certified respirator or equivalent.\nSafety goggles.","REVISED_CONTENT":"Product ID:HZ-ATR,Product Description:Atrazine,Storage Location:0088,Storage Location Description:Lager 0088 (WM),Plant:0001,Section Id:15,Section Header:Regulatory information,Section Content:Federal and State Regulations: TSCA 8(b) inventory: Atrazine\nOther Regulations: EU DIRECTIVES CLASSIFICATION\nSymbol of Danger: Xn-N\nIndication of Danger: Harmful. Dangerous for the environment.\nR: 43-48/22-50/53\nRisk Statements: May cause sensitization by skin contact.\nHarmful: danger of serious damage to health by prolonged exposure if swallowed. Very toxic to aquatic organisms, may\ncause long-term adverse effects in the aquatic environment.\nS: 36/37-60-61\nSafety Statements: Wear suitable protective clothing and gloves. This material and its container must be disposed of as\nhazardous waste. Avoid release to the environment. Refer to special instructions/safety data sheets.\nOther Classifications:\nWHMIS(Canada): Not available.\nDSCL(EEC): Not available.\nHMIS(U.S.A):\nHealth Hazard: 2\nFire Hazard: 0\nReactivity: 0\nPersonal Protection:\nNational Fire Protection Association (U.S.A):\nHealth: 2\nFlammability: 0\nReactivity: 0\nSpecific hazard:\nProtective Equipment: Gloves. Lab coat. Dust respirator. Be sure to use an approved/certified respirator or equivalent.\nSafety goggles."}