{"GUID":"AkKsEQACHt+fl92lptlowg==","MATNR":"HZ-MAL","MAKTX":"Malathion","WERKS":"0001","LGORT":"0088","LGOBE":"Lager 0088 (WM)","SECTION_ID":6,"SECTION_HEADER":"Accidental release measures","SECTION_CONTENT":"6.1 Personal precautions, protective equipment and emergency procedures\nAdvice for non-emergency personnel: Do not breathe vapors, aerosols. Avoid substance\ncontact. Ensure adequate ventilation. Evacuate the danger area, observe emergency\nprocedures, consult an expert.\nFor personal protection see section 8.\n6.2 Environmental precautions\nDo not let product enter drains.\n6.3 Methods and materials for containment and cleaning up\nCover drains. Collect, bind, and pump off spills. Observe possible material restrictions\n(see sections 7 and 10). Take up with liquid-absorbent material (e.g. Chemizorb® ).\nDispose of properly. Clean up affected area.\n6.4 Reference to other sections\nFor disposal see section 13.","REVISED_CONTENT":"Product ID:HZ-MAL,Product Description:Malathion,Storage Location:0088,Storage Location Description:Lager 0088 (WM),Plant:0001,Section Id:6,Section Header:Accidental release measures,Section Content:6.1 Personal precautions, protective equipment and emergency procedures\nAdvice for non-emergency personnel: Do not breathe vapors, aerosols. Avoid substance\ncontact. Ensure adequate ventilation. Evacuate the danger area, observe emergency\nprocedures, consult an expert.\nFor personal protection see section 8.\n6.2 Environmental precautions\nDo not let product enter drains.\n6.3 Methods and materials for containment and cleaning up\nCover drains. Collect, bind, and pump off spills. Observe possible material restrictions\n(see sections 7 and 10). Take up with liquid-absorbent material (e.g. Chemizorb® ).\nDispose of properly. Clean up affected area.\n6.4 Reference to other sections\nFor disposal see section 13."}