{"GUID":"AkKsEQACHt+fl92lptjowg==","MATNR":"HZ-MAL","MAKTX":"Malathion","WERKS":"0001","LGORT":"0088","LGOBE":"Lager 0088 (WM)","SECTION_ID":2,"SECTION_HEADER":"Hazard identification","SECTION_CONTENT":"2.1 Classification of the substance or mixture\nGHS Classification in accordance with 29 CFR 1910 (OSHA HCS)\nAcute toxicity, Oral (Category 4), H302\nSkin sensitization (Category 1), H317\nCarcinogenicity (Category 1B), H350\nShort-term (acute) aquatic hazard (Category 1), H400\nLong-term (chronic) aquatic hazard (Category 1), H410\nFor the full text of the H-Statements mentioned in this Section, see Section 16.\n2.2 GHS Label elements, including precautionary statements\nPictogram\n!\nDanger\nSignal Word","REVISED_CONTENT":"Product ID:HZ-MAL,Product Description:Malathion,Storage Location:0088,Storage Location Description:Lager 0088 (WM),Plant:0001,Section Id:2,Section Header:Hazard identification,Section Content:2.1 Classification of the substance or mixture\nGHS Classification in accordance with 29 CFR 1910 (OSHA HCS)\nAcute toxicity, Oral (Category 4), H302\nSkin sensitization (Category 1), H317\nCarcinogenicity (Category 1B), H350\nShort-term (acute) aquatic hazard (Category 1), H400\nLong-term (chronic) aquatic hazard (Category 1), H410\nFor the full text of the H-Statements mentioned in this Section, see Section 16.\n2.2 GHS Label elements, including precautionary statements\nPictogram\n!\nDanger\nSignal Word"}