{"GUID":"AkKsEQACHt+fl92lrPOowg==","MATNR":"HZ-SUL","MAKTX":"Sulfur","WERKS":"0001","LGORT":"0001","LGOBE":"Lager 0001","SECTION_ID":8,"SECTION_HEADER":"Exposure controls / personal protection","SECTION_CONTENT":"8.1.\nControl Parameters\nFor substances listed in Section 3 that are not listed here, there are no established Exposure limits from the manufacturer, supplier,\nimporter, or the appropriate advisory agency including: ACGIH (TLV), AIHA (WEEL), NIOSH (REL), OSHA (PEL), or Canadian provincial\ngovernments.\nSulfur (7704-34-9)\nAlberta\nHydrogen sulfide (7783-06-4)\nUSA ACGIH\nUSA ACGIH\nUSA OSHA\nUSA OSHA\nUSA NIOSH\nUSA NIOSH\nUSA IDLH\nUS IDLH (ppm)\nAlberta\nAlberta\nAlberta\nAlberta\nOEL TWA (mg/m³)\nACGIH TWA (ppm)\nACGIH STEL (ppm)\nOSHA PEL (Ceiling) (ppm)\nAcceptable Maximum Peak Above The\nNIOSH REL (ceiling) (ppm)\nAcceptable Ceiling Concentration For An\n8-Hr Shift\nNIOSH REL (ceiling) (mg/m³)\nOEL Ceiling (mg/m³)\nOEL Ceiling (ppm)\nOEL TWA (mg/m³)\nOEL TWA (ppm)\nBritish Columbia\nOEL Ceiling (ppm)\nManitoba\nOEL STEL (ppm)\nManitoba\nOEL TWA (ppm)\nNew Brunswick\nOEL STEL (mg/m³)\nNew Brunswick\nOEL STEL (ppm)\nNew Brunswick\nOEL TWA (mg/m³)\nNew Brunswick\nOEL TWA (ppm)\nNewfoundland & Labrador OEL STEL (ppm)","REVISED_CONTENT":"Product ID:HZ-SUL,Product Description:Sulfur,Storage Location:0001,Storage Location Description:Lager 0001,Plant:0001,Section Id:8,Section Header:Exposure controls / personal protection,Section Content:8.1.\nControl Parameters\nFor substances listed in Section 3 that are not listed here, there are no established Exposure limits from the manufacturer, supplier,\nimporter, or the appropriate advisory agency including: ACGIH (TLV), AIHA (WEEL), NIOSH (REL), OSHA (PEL), or Canadian provincial\ngovernments.\nSulfur (7704-34-9)\nAlberta\nHydrogen sulfide (7783-06-4)\nUSA ACGIH\nUSA ACGIH\nUSA OSHA\nUSA OSHA\nUSA NIOSH\nUSA NIOSH\nUSA IDLH\nUS IDLH (ppm)\nAlberta\nAlberta\nAlberta\nAlberta\nOEL TWA (mg/m³)\nACGIH TWA (ppm)\nACGIH STEL (ppm)\nOSHA PEL (Ceiling) (ppm)\nAcceptable Maximum Peak Above The\nNIOSH REL (ceiling) (ppm)\nAcceptable Ceiling Concentration For An\n8-Hr Shift\nNIOSH REL (ceiling) (mg/m³)\nOEL Ceiling (mg/m³)\nOEL Ceiling (ppm)\nOEL TWA (mg/m³)\nOEL TWA (ppm)\nBritish Columbia\nOEL Ceiling (ppm)\nManitoba\nOEL STEL (ppm)\nManitoba\nOEL TWA (ppm)\nNew Brunswick\nOEL STEL (mg/m³)\nNew Brunswick\nOEL STEL (ppm)\nNew Brunswick\nOEL TWA (mg/m³)\nNew Brunswick\nOEL TWA (ppm)\nNewfoundland & Labrador OEL STEL (ppm)"}