{"GUID":"AkKsEQACHt+fl92lpuZowg==","MATNR":"HZ-OXY","MAKTX":"Oxygen","WERKS":"0001","LGORT":"0001","LGOBE":"Lager 0001","SECTION_ID":14,"SECTION_HEADER":"Transport information","SECTION_CONTENT":"DOT\nTDG\nMexico\nIMDG\nIATA\nUN number : UN1072\nUN1072\nUN1072\nUN1072\nUN1072\nUN proper\nshipping name : OXYGEN,\nCOMPRESSED\nOXYGEN,\nCOMPRESSED\nOXYGEN,\nCOMPRESSED\nOXYGEN,\nCOMPRESSED\nOXYGEN,\nCOMPRESSED\nTransport\nhazard class(es) : 2.2 (5.1)\n2.2\n2.2 (5.1)\n2.2 (5.1)\n2.2 (5.1)\nNON-FLAMMABLE GAS\nOXIDIZER\n5.1\n2\nPacking group : No.\nNo.\nNo.\nNo.\nNo.\nEnvironmental\nhazards : No.\nNo.\nNo.\nNo.\nNo.\n\"Refer to CFR 49 (or authority having jurisdiction) to determine the information required for shipment of the\nproduct.\"\nAdditional information\nDOT Classification : Limited quantity Yes.\nQuantity limitation Passenger aircraft/rail: 75 kg. Cargo aircraft: 150 kg.\nSpecial provisions A52\nTDG Classification : Product classified as per the following sections of the Transportation of Dangerous\nGoods Regulations: 2.13-2.17 (Class 2), 2.23-2.25 (Class 5).\nExplosive Limit and Limited Quantity Index 0.125\nERAP Index 3000\nPassenger Carrying Vessel Index 50\nPassenger Carrying Road or Rail Index 75\nIATA : Special provisions 42\nQuantity limitation Passenger and Cargo Aircraft: 75 kg. Cargo Aircraft Only: 150 kg.\nSpecial precautions for user: Transport within user's premises: always transport in closed containers that are\nupright and secure. Ensure that persons transporting the product know what to do in the\nevent of an accident or spillage.\nTransport in bulk according\nto IMO instruments : Not available.","REVISED_CONTENT":"Product ID:HZ-OXY,Product Description:Oxygen,Storage Location:0001,Storage Location Description:Lager 0001,Plant:0001,Section Id:14,Section Header:Transport information,Section Content:DOT\nTDG\nMexico\nIMDG\nIATA\nUN number : UN1072\nUN1072\nUN1072\nUN1072\nUN1072\nUN proper\nshipping name : OXYGEN,\nCOMPRESSED\nOXYGEN,\nCOMPRESSED\nOXYGEN,\nCOMPRESSED\nOXYGEN,\nCOMPRESSED\nOXYGEN,\nCOMPRESSED\nTransport\nhazard class(es) : 2.2 (5.1)\n2.2\n2.2 (5.1)\n2.2 (5.1)\n2.2 (5.1)\nNON-FLAMMABLE GAS\nOXIDIZER\n5.1\n2\nPacking group : No.\nNo.\nNo.\nNo.\nNo.\nEnvironmental\nhazards : No.\nNo.\nNo.\nNo.\nNo.\n\"Refer to CFR 49 (or authority having jurisdiction) to determine the information required for shipment of the\nproduct.\"\nAdditional information\nDOT Classification : Limited quantity Yes.\nQuantity limitation Passenger aircraft/rail: 75 kg. Cargo aircraft: 150 kg.\nSpecial provisions A52\nTDG Classification : Product classified as per the following sections of the Transportation of Dangerous\nGoods Regulations: 2.13-2.17 (Class 2), 2.23-2.25 (Class 5).\nExplosive Limit and Limited Quantity Index 0.125\nERAP Index 3000\nPassenger Carrying Vessel Index 50\nPassenger Carrying Road or Rail Index 75\nIATA : Special provisions 42\nQuantity limitation Passenger and Cargo Aircraft: 75 kg. Cargo Aircraft Only: 150 kg.\nSpecial precautions for user: Transport within user's premises: always transport in closed containers that are\nupright and secure. Ensure that persons transporting the product know what to do in the\nevent of an accident or spillage.\nTransport in bulk according\nto IMO instruments : Not available."}