{"GUID":"AkKsEQACHt+fl92lo1GIwg==","MATNR":"HZ-CAD","MAKTX":"Cadmium","WERKS":"0001","LGORT":"0088","LGOBE":"Lager 0088 (WM)","SECTION_ID":3,"SECTION_HEADER":"Hazard identification","SECTION_CONTENT":"Potential Acute Health Effects:\nHazardous in case of ingestion, of inhalation. Slightly hazardous in case of skin contact (irritant, sensitizer), of eye contact\n(irritant). Severe over-exposure can result in death.\nPotential Chronic Health Effects:\nCARCINOGENIC EFFECTS: Classified A2 (Suspected for human.) by ACGIH, 2 (Reasonably anticipated.) by NTP.\nMUTAGENIC EFFECTS: Not available. TERATOGENIC EFFECTS: Not available. DEVELOPMENTAL TOXICITY: Not\navailable. The substance is toxic to kidneys, lungs, liver. Repeated or prolonged exposure to the substance can produce\ntarget organs damage. Repeated exposure to an highly toxic material may produce general deterioration of health by an\naccumulation in one or many human organs.","REVISED_CONTENT":"Product ID:HZ-CAD,Product Description:Cadmium,Storage Location:0088,Storage Location Description:Lager 0088 (WM),Plant:0001,Section Id:3,Section Header:Hazard identification,Section Content:Potential Acute Health Effects:\nHazardous in case of ingestion, of inhalation. Slightly hazardous in case of skin contact (irritant, sensitizer), of eye contact\n(irritant). Severe over-exposure can result in death.\nPotential Chronic Health Effects:\nCARCINOGENIC EFFECTS: Classified A2 (Suspected for human.) by ACGIH, 2 (Reasonably anticipated.) by NTP.\nMUTAGENIC EFFECTS: Not available. TERATOGENIC EFFECTS: Not available. DEVELOPMENTAL TOXICITY: Not\navailable. The substance is toxic to kidneys, lungs, liver. Repeated or prolonged exposure to the substance can produce\ntarget organs damage. Repeated exposure to an highly toxic material may produce general deterioration of health by an\naccumulation in one or many human organs."}