{"GUID":"AkKsEQACHt+fl92lrO2owg==","MATNR":"HZ-SOH","MAKTX":"Sodium hydroxide","WERKS":"0001","LGORT":"0003","LGOBE":"Corrosive Items","SECTION_ID":8,"SECTION_HEADER":"Exposure controls / personal protection","SECTION_CONTENT":"Use only under a chemical fume hood. Ensure that eyewash stations and safety showers\nare close to the workstation location.\nWear appropriate protective eyeglasses or chemical safety goggles as described by\nOSHA's eye and face protection regulations in 29 CFR 1910.133 or European Standard\nEN166. Tightly fitting safety goggles. Face-shield.\nLong sleeved clothing.\nFollow the OSHA respirator regulations found in 29 CFR 1910.134 or European Standard\nEN 149. Use a NIOSH/MSHA or European Standard EN 149 approved respirator if\nexposure limits are exceeded or if irritation or other symptoms are experienced.\nHandle in accordance with good industrial hygiene and safety practice.","REVISED_CONTENT":"Product ID:HZ-SOH,Product Description:Sodium hydroxide,Storage Location:0003,Storage Location Description:Corrosive Items,Plant:0001,Section Id:8,Section Header:Exposure controls / personal protection,Section Content:Use only under a chemical fume hood. Ensure that eyewash stations and safety showers\nare close to the workstation location.\nWear appropriate protective eyeglasses or chemical safety goggles as described by\nOSHA's eye and face protection regulations in 29 CFR 1910.133 or European Standard\nEN166. Tightly fitting safety goggles. Face-shield.\nLong sleeved clothing.\nFollow the OSHA respirator regulations found in 29 CFR 1910.134 or European Standard\nEN 149. Use a NIOSH/MSHA or European Standard EN 149 approved respirator if\nexposure limits are exceeded or if irritation or other symptoms are experienced.\nHandle in accordance with good industrial hygiene and safety practice."}