{"GUID":"AkKsEQACHt+fl92lo1/owg==","MATNR":"HZ-GAS","MAKTX":"Gasoline","WERKS":"0001","LGORT":"0001","LGOBE":"Lager 0001","SECTION_ID":6,"SECTION_HEADER":"Accidental release measures","SECTION_CONTENT":"NOTIFICATION PROCEDURES\nIn the event of a spill or accidental release, notify relevant authorities in accordance with all applicable\nregulations.\nPROTECTIVE MEASURES\nAvoid contact with spilled material. Warn or evacuate occupants in surrounding and downwind areas if\nrequired, due to toxicity or flammability of the material. See Section 5 for fire fighting information. See the\nHazard Identification Section for Significant Hazards. See Section 4 for First Aid Advice. See Section 8 for\nadvice on the minimum requirements for personal protective equipment. Additional protective measures may be\nnecessary, depending on the specific circumstances and/or the expert judgment of the emergency responders.\nFor emergency responders: Respiratory protection: half-face or full-face respirator with filter(s) for organic\nvapor and, when applicable, H2S, or Self Contained Breathing Apparatus (SCBA) can be used depending on\nthe size of spill and potential level of exposure. If the exposure cannot be completely characterized or an","REVISED_CONTENT":"Product ID:HZ-GAS,Product Description:Gasoline,Storage Location:0001,Storage Location Description:Lager 0001,Plant:0001,Section Id:6,Section Header:Accidental release measures,Section Content:NOTIFICATION PROCEDURES\nIn the event of a spill or accidental release, notify relevant authorities in accordance with all applicable\nregulations.\nPROTECTIVE MEASURES\nAvoid contact with spilled material. Warn or evacuate occupants in surrounding and downwind areas if\nrequired, due to toxicity or flammability of the material. See Section 5 for fire fighting information. See the\nHazard Identification Section for Significant Hazards. See Section 4 for First Aid Advice. See Section 8 for\nadvice on the minimum requirements for personal protective equipment. Additional protective measures may be\nnecessary, depending on the specific circumstances and/or the expert judgment of the emergency responders.\nFor emergency responders: Respiratory protection: half-face or full-face respirator with filter(s) for organic\nvapor and, when applicable, H2S, or Self Contained Breathing Apparatus (SCBA) can be used depending on\nthe size of spill and potential level of exposure. If the exposure cannot be completely characterized or an"}