{"GUID":"AkKsEQACHt+fl92lpubowg==","MATNR":"HZ-PHO","MAKTX":"Phosphorus","WERKS":"0001","LGORT":"0088","LGOBE":"Lager 0088 (WM)","SECTION_ID":2,"SECTION_HEADER":"Hazard identification","SECTION_CONTENT":"2.1. Classification of the substance or mixture\nCLP Classification - Regulation (EC) No 1272/2008\nSubstances/mixtures corrosive to metal\nSkin Corrosion/Irritation\nSerious Eye Damage/Eye Irritation\nChronic aquatic toxicity\n2.2. Label elements\nCategory 1 (H290)\nCategory 1 A (H314)\nCategory 1 (H318)\nCategory 3 (H412)\nSignal Word\nHazard Statements\nH290 - May be corrosive to metals\nH314 - Causes severe skin burns and eye damage\nH412 - Harmful to aquatic life with long lasting effects\nPrecautionary Statements\nP280 - Wear protective gloves/protective clothing/eye protection/face protection\nP305 + P351 + P338 - IF IN EYES: Rinse cautiously with water for several minutes. Remove contact lenses, if present and\neasy to do. Continue rinsing\nP273 - Avoid release to the environment\nP303 + P361+P353 - IF ON SKIN (or hair): Take off immediately all contaminated clothing. Rinse skin with water or shower\n2.3. Other hazards\nContains a known or suspected endocrine disruptor\nIncluded in the list established in accordance with Article 59(1) for having endocrine disrupting properties","REVISED_CONTENT":"Product ID:HZ-PHO,Product Description:Phosphorus,Storage Location:0088,Storage Location Description:Lager 0088 (WM),Plant:0001,Section Id:2,Section Header:Hazard identification,Section Content:2.1. Classification of the substance or mixture\nCLP Classification - Regulation (EC) No 1272/2008\nSubstances/mixtures corrosive to metal\nSkin Corrosion/Irritation\nSerious Eye Damage/Eye Irritation\nChronic aquatic toxicity\n2.2. Label elements\nCategory 1 (H290)\nCategory 1 A (H314)\nCategory 1 (H318)\nCategory 3 (H412)\nSignal Word\nHazard Statements\nH290 - May be corrosive to metals\nH314 - Causes severe skin burns and eye damage\nH412 - Harmful to aquatic life with long lasting effects\nPrecautionary Statements\nP280 - Wear protective gloves/protective clothing/eye protection/face protection\nP305 + P351 + P338 - IF IN EYES: Rinse cautiously with water for several minutes. Remove contact lenses, if present and\neasy to do. Continue rinsing\nP273 - Avoid release to the environment\nP303 + P361+P353 - IF ON SKIN (or hair): Take off immediately all contaminated clothing. Rinse skin with water or shower\n2.3. Other hazards\nContains a known or suspected endocrine disruptor\nIncluded in the list established in accordance with Article 59(1) for having endocrine disrupting properties"}