{"GUID":"AkKsEQACHt+fl92lpueowg==","MATNR":"HZ-PHO","MAKTX":"Phosphorus","WERKS":"0001","LGORT":"0088","LGOBE":"Lager 0088 (WM)","SECTION_ID":8,"SECTION_HEADER":"Exposure controls / personal protection","SECTION_CONTENT":"8.1. Control parameters\nComponent Exposure Limits\nComponent\nSulfuric acid\nFinland\nTWA: 0.05 mg/m³ 8 tunteina\nSTEL: 0.1 mg/m³ 15\nminuutteina\nEuropean Union\nTWA: 0.05 mg/m³ (8h)\nSTEL: 0.1 mg/m³ 15\nminuutteina\nThe United Kingdom\nSTEL: 0.15 mg/m³ 15 min\nTWA: 0.05 mg/m³ 8 hr\nComponent\nSulfuric acid\nSweden\nIndicative STEL: 0.2 mg/m³\n15 minuter\nTLV: 0.1 mg/m³ 8 timmar.\nNorway\nTWA: 0.1 mg/m³ 8 timer\nSTEL: 0.3 mg/m³ 15\nminutter. value calculated\nDenmark\nTWA: 0.1 mg/m³ (8\nStunden). AGW - exposure\nfactor 1\nGermany\nTWA: 0.1 mg/m³ (8\nStunden). MAK\nHöhepunkt: 0.1 mg/m³\nFrance\nTWA: 0.05 mg/m³ 8 timer TWA/VME: 0.05 mg/m³ (8\nheures).","REVISED_CONTENT":"Product ID:HZ-PHO,Product Description:Phosphorus,Storage Location:0088,Storage Location Description:Lager 0088 (WM),Plant:0001,Section Id:8,Section Header:Exposure controls / personal protection,Section Content:8.1. Control parameters\nComponent Exposure Limits\nComponent\nSulfuric acid\nFinland\nTWA: 0.05 mg/m³ 8 tunteina\nSTEL: 0.1 mg/m³ 15\nminuutteina\nEuropean Union\nTWA: 0.05 mg/m³ (8h)\nSTEL: 0.1 mg/m³ 15\nminuutteina\nThe United Kingdom\nSTEL: 0.15 mg/m³ 15 min\nTWA: 0.05 mg/m³ 8 hr\nComponent\nSulfuric acid\nSweden\nIndicative STEL: 0.2 mg/m³\n15 minuter\nTLV: 0.1 mg/m³ 8 timmar.\nNorway\nTWA: 0.1 mg/m³ 8 timer\nSTEL: 0.3 mg/m³ 15\nminutter. value calculated\nDenmark\nTWA: 0.1 mg/m³ (8\nStunden). AGW - exposure\nfactor 1\nGermany\nTWA: 0.1 mg/m³ (8\nStunden). MAK\nHöhepunkt: 0.1 mg/m³\nFrance\nTWA: 0.05 mg/m³ 8 timer TWA/VME: 0.05 mg/m³ (8\nheures)."}