{"GUID":"AkKsEQACHt+fl92lo1Wowg==","MATNR":"HZ-CHL","MAKTX":"Chlorine","WERKS":"0001","LGORT":"0001","LGOBE":"Lager 0001","SECTION_ID":4,"SECTION_HEADER":"First-aid measures","SECTION_CONTENT":"4.1. Description of first aid measures\nFirst-aid measures general\nFirst-aid measures after inhalation\nFirst-aid measures after skin contact\nFirst-aid measures after eye contact\nFirst-aid measures after ingestion\n: Never give anything by mouth to an unconscious person. If you feel unwell, seek medical advice\n(show the label where possible).\n: Remove victim to fresh air and keep at rest in a position comfortable for breathing. Immediately\ncall a poison center or doctor/physician. Specific treatment is urgent (see supplemental first aid\ninstruction on this label). Call a POISON CENTER or doctor/physician if you feel unwell.\n: Remove/Take off immediately all contaminated clothing. Rinse skin with water/shower. Wash\ncontaminated clothing before reuse. Immediately call a poison center or doctor/physician.\n: Rinse immediately with plenty of water for 15 minutes. Remove contact lenses, if present and\neasy to do. Continue rinsing. Get immediate medical advice/attention. Rinse cautiously with\nwater for several minutes. Immediately call a poison center or doctor/physician.\n: Ingestion is not considered a potential route of exposure. Rinse mouth. Do NOT induce vomiting.\nImmediately call a poison center or doctor/physician.\n4.2. Most important symptoms and effects (acute and delayed)\nPotential Adverse human health effects and\nsymptoms\nSymptoms/effects\nSymptoms/effects after inhalation\nSymptoms/effects after skin contact\nSymptoms/effects after eye contact\nSymptoms/effects after ingestion\nSymptoms/effects upon intravenous administration\nMost important symptoms and effects, both acute\nand delayed\nChronic symptoms\n: Based on available data, the classification criteria are not met. Fatal if inhaled.\n: Causes severe skin burns and eye damage.\n: Fatal if inhaled. Corrosive to the respiratory tract. Fatal if inhaled. May cause respiratory\nirritation.\n: Causes severe skin burns and eye damage.\n: Causes serious eye damage.\n: Ingestion is not considered a potential route of exposure.\n: Not known.\n: May cause irritation to cornea (with temporary disturbance to vision). May cause irritation to skin.\nMaterial is destructive to tissue of the mucuous membranes and upper respiratory tract. Cough,\nshortness of breath, headache, nausea. Refer to section 11.\n: Adverse effects not expected from this product.\n4.3. Immediate medical attention and special treatment, if necessary\nIf you feel unwell, seek medical advice. If breathing is difficult, give oxygen.","REVISED_CONTENT":"Product ID:HZ-CHL,Product Description:Chlorine,Storage Location:0001,Storage Location Description:Lager 0001,Plant:0001,Section Id:4,Section Header:First-aid measures,Section Content:4.1. Description of first aid measures\nFirst-aid measures general\nFirst-aid measures after inhalation\nFirst-aid measures after skin contact\nFirst-aid measures after eye contact\nFirst-aid measures after ingestion\n: Never give anything by mouth to an unconscious person. If you feel unwell, seek medical advice\n(show the label where possible).\n: Remove victim to fresh air and keep at rest in a position comfortable for breathing. Immediately\ncall a poison center or doctor/physician. Specific treatment is urgent (see supplemental first aid\ninstruction on this label). Call a POISON CENTER or doctor/physician if you feel unwell.\n: Remove/Take off immediately all contaminated clothing. Rinse skin with water/shower. Wash\ncontaminated clothing before reuse. Immediately call a poison center or doctor/physician.\n: Rinse immediately with plenty of water for 15 minutes. Remove contact lenses, if present and\neasy to do. Continue rinsing. Get immediate medical advice/attention. Rinse cautiously with\nwater for several minutes. Immediately call a poison center or doctor/physician.\n: Ingestion is not considered a potential route of exposure. Rinse mouth. Do NOT induce vomiting.\nImmediately call a poison center or doctor/physician.\n4.2. Most important symptoms and effects (acute and delayed)\nPotential Adverse human health effects and\nsymptoms\nSymptoms/effects\nSymptoms/effects after inhalation\nSymptoms/effects after skin contact\nSymptoms/effects after eye contact\nSymptoms/effects after ingestion\nSymptoms/effects upon intravenous administration\nMost important symptoms and effects, both acute\nand delayed\nChronic symptoms\n: Based on available data, the classification criteria are not met. Fatal if inhaled.\n: Causes severe skin burns and eye damage.\n: Fatal if inhaled. Corrosive to the respiratory tract. Fatal if inhaled. May cause respiratory\nirritation.\n: Causes severe skin burns and eye damage.\n: Causes serious eye damage.\n: Ingestion is not considered a potential route of exposure.\n: Not known.\n: May cause irritation to cornea (with temporary disturbance to vision). May cause irritation to skin.\nMaterial is destructive to tissue of the mucuous membranes and upper respiratory tract. Cough,\nshortness of breath, headache, nausea. Refer to section 11.\n: Adverse effects not expected from this product.\n4.3. Immediate medical attention and special treatment, if necessary\nIf you feel unwell, seek medical advice. If breathing is difficult, give oxygen."}