{"GUID":"AkKsEQACHt+fl92lpt0owg==","MATNR":"HZ-MER","MAKTX":"Mercury","WERKS":"0001","LGORT":"0088","LGOBE":"Lager 0088 (WM)","SECTION_ID":4,"SECTION_HEADER":"First-aid measures","SECTION_CONTENT":"General Advice\nShow this safety data sheet to the doctor in attendance. Immediate medical attention is\nrequired.\nEye Contact\nRinse immediately with plenty of water, also under the eyelids, for at least 15 minutes.\nImmediate medical attention is required.\nSkin Contact\nWash off immediately with plenty of water for at least 15 minutes. Immediate medical\nattention is required.\nInhalation\nRemove to fresh air. If not breathing, give artificial respiration. Do not use mouth-to-mouth\nmethod if victim ingested or inhaled the substance; give artificial respiration with the aid of a\npocket mask equipped with a one-way valve or other proper respiratory medical device.\nImmediate medical attention is required.\nIngestion\nDo NOT induce vomiting. Call a physician or poison control center immediately.\nMost important symptoms and\nNeurological disorders. May cause central nervous system depression: May cause adverse","REVISED_CONTENT":"Product ID:HZ-MER,Product Description:Mercury,Storage Location:0088,Storage Location Description:Lager 0088 (WM),Plant:0001,Section Id:4,Section Header:First-aid measures,Section Content:General Advice\nShow this safety data sheet to the doctor in attendance. Immediate medical attention is\nrequired.\nEye Contact\nRinse immediately with plenty of water, also under the eyelids, for at least 15 minutes.\nImmediate medical attention is required.\nSkin Contact\nWash off immediately with plenty of water for at least 15 minutes. Immediate medical\nattention is required.\nInhalation\nRemove to fresh air. If not breathing, give artificial respiration. Do not use mouth-to-mouth\nmethod if victim ingested or inhaled the substance; give artificial respiration with the aid of a\npocket mask equipped with a one-way valve or other proper respiratory medical device.\nImmediate medical attention is required.\nIngestion\nDo NOT induce vomiting. Call a physician or poison control center immediately.\nMost important symptoms and\nNeurological disorders. May cause central nervous system depression: May cause adverse"}