{"GUID":"AkKsEQACHt+fl92lo1Rowg==","MATNR":"HZ-CES","MAKTX":"Cesium","WERKS":"0001","LGORT":"0088","LGOBE":"Lager 0088 (WM)","SECTION_ID":10,"SECTION_HEADER":"Stability and reactivity","SECTION_CONTENT":"SECTION 10: Stability and reactivity\n10.1 Reactivity\nNo data available\n10.2 Chemical stability\nStable under recommended storage conditions.\n10.3 Possibility of hazardous reactions\nReacts violently with water.\n10.4 Conditions to avoid\nExposure to moisture.\n10.5 Incompatible materials\nDo not store near acids., Phosphorus, Halogens, Alcohols, Oxygen, Reacts violently with\nwater.\n10.6 Hazardous decomposition products\nReacts with water to form: - Reacts with water to liberate flammable and/or explosive gas.\nIn the event of fire: see section 5","REVISED_CONTENT":"Product ID:HZ-CES,Product Description:Cesium,Storage Location:0088,Storage Location Description:Lager 0088 (WM),Plant:0001,Section Id:10,Section Header:Stability and reactivity,Section Content:SECTION 10: Stability and reactivity\n10.1 Reactivity\nNo data available\n10.2 Chemical stability\nStable under recommended storage conditions.\n10.3 Possibility of hazardous reactions\nReacts violently with water.\n10.4 Conditions to avoid\nExposure to moisture.\n10.5 Incompatible materials\nDo not store near acids., Phosphorus, Halogens, Alcohols, Oxygen, Reacts violently with\nwater.\n10.6 Hazardous decomposition products\nReacts with water to form: - Reacts with water to liberate flammable and/or explosive gas.\nIn the event of fire: see section 5"}