{"GUID":"AkKsEQACHt+fl92lo1Oowg==","MATNR":"HZ-CES","MAKTX":"Cesium","WERKS":"0001","LGORT":"0088","LGOBE":"Lager 0088 (WM)","SECTION_ID":4,"SECTION_HEADER":"First-aid measures","SECTION_CONTENT":"SECTION 4: First aid measures\n4.1 Description of first-aid measures\nGeneral advice\nConsult a physician. Show this material safety data sheet to the doctor in attendance.Move\nout of dangerous area.\nIf inhaled\nIf breathed in, move person into fresh air. If not breathing, give artificial respiration.\nConsult a physician.\nIn case of skin contact\nTake off contaminated clothing and shoes immediately. Wash off with soap and plenty of\nwater. Consult a physician.\nIn case of eye contact\nRinse thoroughly with plenty of water for at least 15 minutes and consult a\nphysician.Continue rinsing eyes during transport to hospital.\nIf swallowed\nDo NOT induce vomiting. Never give anything by mouth to an unconscious person. Rinse\nmouth with water. Consult a physician.\n4.2 Most important symptoms and effects, both acute and delayed\nThe most important known symptoms and effects are described in the labelling (see section\n2.2) and/or in section 11\n4.3 Indication of any immediate medical attention and special treatment needed\nNo data available","REVISED_CONTENT":"Product ID:HZ-CES,Product Description:Cesium,Storage Location:0088,Storage Location Description:Lager 0088 (WM),Plant:0001,Section Id:4,Section Header:First-aid measures,Section Content:SECTION 4: First aid measures\n4.1 Description of first-aid measures\nGeneral advice\nConsult a physician. Show this material safety data sheet to the doctor in attendance.Move\nout of dangerous area.\nIf inhaled\nIf breathed in, move person into fresh air. If not breathing, give artificial respiration.\nConsult a physician.\nIn case of skin contact\nTake off contaminated clothing and shoes immediately. Wash off with soap and plenty of\nwater. Consult a physician.\nIn case of eye contact\nRinse thoroughly with plenty of water for at least 15 minutes and consult a\nphysician.Continue rinsing eyes during transport to hospital.\nIf swallowed\nDo NOT induce vomiting. Never give anything by mouth to an unconscious person. Rinse\nmouth with water. Consult a physician.\n4.2 Most important symptoms and effects, both acute and delayed\nThe most important known symptoms and effects are described in the labelling (see section\n2.2) and/or in section 11\n4.3 Indication of any immediate medical attention and special treatment needed\nNo data available"}