{"GUID":"AkKsEQACHt+fl92lo12owg==","MATNR":"HZ-ETH","MAKTX":"Ethanol","WERKS":"0001","LGORT":"0001","LGOBE":"Lager 0001","SECTION_ID":4,"SECTION_HEADER":"First-aid measures","SECTION_CONTENT":"Description of first aid measures\nGeneral information: Immediately remove any clothing soiled by the product.\nAfter inhalation: Supply fresh air; consult doctor in case of complaints.\nAfter skin contact: Immediately rinse with water.\nAfter eye contact:\nRinse opened eye for several minutes under running water. If symptoms persist, consult a doctor.\nAfter swallowing: If symptoms persist consult doctor.\nInformation for doctor:\nMost important symptoms and effects, both acute and delayed No further relevant information available.\n• Indication of any immediate medical attention and special treatment needed\nNo further relevant information available.","REVISED_CONTENT":"Product ID:HZ-ETH,Product Description:Ethanol,Storage Location:0001,Storage Location Description:Lager 0001,Plant:0001,Section Id:4,Section Header:First-aid measures,Section Content:Description of first aid measures\nGeneral information: Immediately remove any clothing soiled by the product.\nAfter inhalation: Supply fresh air; consult doctor in case of complaints.\nAfter skin contact: Immediately rinse with water.\nAfter eye contact:\nRinse opened eye for several minutes under running water. If symptoms persist, consult a doctor.\nAfter swallowing: If symptoms persist consult doctor.\nInformation for doctor:\nMost important symptoms and effects, both acute and delayed No further relevant information available.\n• Indication of any immediate medical attention and special treatment needed\nNo further relevant information available."}