{"GUID":"AkKsEQACHt+fl92loTZIwg==","MATNR":"HZ-BUT","MAKTX":"Butane","WERKS":"0001","LGORT":"0001","LGOBE":"Lager 0001","SECTION_ID":11,"SECTION_HEADER":"Toxicological information","SECTION_CONTENT":"SECTION 11: Toxicological information\n11.1 Information on toxicological effects\nAcute toxicity\nOral: No data available\nLC50 Inhalation - Rat - 4h - 658,000 mg/m3 - gas\nDermal: No data available\nNo data available\nSkin corrosion/irritation\nNo data available\nSerious eye damage/eye irritation\nNo data available\nRespiratory or skin sensitization\nNo data available\nGerm cell mutagenicity\nNo data available\nCarcinogenicity\nIARC:\nNTP:\nOSHA:\nNo ingredient of this product present at levels greater than or equal to 0.1% is\nidentified as probable, possible or confirmed human carcinogen by IARC.\nNo ingredient of this product present at levels greater than or equal to 0.1% is\nidentified as a known or anticipated carcinogen by NTP.\nNo component of this product present at levels greater than or equal to 0.1% is\non OSHA's list of regulated carcinogens.\nReproductive toxicity\nNo data available\nSpecific target organ toxicity - single exposure\nNo data available\nSpecific target organ toxicity - repeated exposure\nNo data available\nAspiration hazard\nNo data available","REVISED_CONTENT":"Product ID:HZ-BUT,Product Description:Butane,Storage Location:0001,Storage Location Description:Lager 0001,Plant:0001,Section Id:11,Section Header:Toxicological information,Section Content:SECTION 11: Toxicological information\n11.1 Information on toxicological effects\nAcute toxicity\nOral: No data available\nLC50 Inhalation - Rat - 4h - 658,000 mg/m3 - gas\nDermal: No data available\nNo data available\nSkin corrosion/irritation\nNo data available\nSerious eye damage/eye irritation\nNo data available\nRespiratory or skin sensitization\nNo data available\nGerm cell mutagenicity\nNo data available\nCarcinogenicity\nIARC:\nNTP:\nOSHA:\nNo ingredient of this product present at levels greater than or equal to 0.1% is\nidentified as probable, possible or confirmed human carcinogen by IARC.\nNo ingredient of this product present at levels greater than or equal to 0.1% is\nidentified as a known or anticipated carcinogen by NTP.\nNo component of this product present at levels greater than or equal to 0.1% is\non OSHA's list of regulated carcinogens.\nReproductive toxicity\nNo data available\nSpecific target organ toxicity - single exposure\nNo data available\nSpecific target organ toxicity - repeated exposure\nNo data available\nAspiration hazard\nNo data available"}