{"GUID":"AkKsEQACHt+fl92lrO1Iwg==","MATNR":"HZ-SOH","MAKTX":"Sodium hydroxide","WERKS":"0001","LGORT":"0003","LGOBE":"Corrosive Items","SECTION_ID":5,"SECTION_HEADER":"Fire-fighting measures","SECTION_CONTENT":"CO 2, dry chemical, dry sand, alcohol-resistant foam.\nCarbon dioxide (CO2), Water\nNo information available\nNo information available\nNo data available\nNo data available\nNo information available\nNo information available\nThe product causes burns of eyes, skin and mucous membranes.\nSodium oxides Hydrogen\nAs in any fire, wear self-contained breathing apparatus pressure-demand, MSHA/NIOSH (approved or equivalent) and full\nprotective gear. Thermal decomposition can lead to release of irritating gases and vapors.","REVISED_CONTENT":"Product ID:HZ-SOH,Product Description:Sodium hydroxide,Storage Location:0003,Storage Location Description:Corrosive Items,Plant:0001,Section Id:5,Section Header:Fire-fighting measures,Section Content:CO 2, dry chemical, dry sand, alcohol-resistant foam.\nCarbon dioxide (CO2), Water\nNo information available\nNo information available\nNo data available\nNo data available\nNo information available\nNo information available\nThe product causes burns of eyes, skin and mucous membranes.\nSodium oxides Hydrogen\nAs in any fire, wear self-contained breathing apparatus pressure-demand, MSHA/NIOSH (approved or equivalent) and full\nprotective gear. Thermal decomposition can lead to release of irritating gases and vapors."}