{"GUID":"AkKsEQACHt+fl92lo1oIwg==","MATNR":"HZ-CMO","MAKTX":"Carbon monoxide","WERKS":"0001","LGORT":"0001","LGOBE":"Lager 0001","SECTION_ID":7,"SECTION_HEADER":"Handling and storage","SECTION_CONTENT":"Precautions for safe handling\nAdditional hazards when processed\nPrecautions for safe handling\nHygiene measures\n: Pressurized container: Do not pierce or burn, even after use. Use only with equipment rated for\ncylinder pressure. Close valve after each use and when empty. Handle empty containers with\ncare because residual vapors are flammable. In use, may form flammable vapor-air mixture.\n: Do not handle until all safety precautions have been read and understood. Use only outdoors or\nin a well-ventilated area. Keep away from heat/sparks/open flames/hot surfaces. – No smoking.\nUse only non-sparking tools.\n: Do not eat, drink or smoke when using this product.","REVISED_CONTENT":"Product ID:HZ-CMO,Product Description:Carbon monoxide,Storage Location:0001,Storage Location Description:Lager 0001,Plant:0001,Section Id:7,Section Header:Handling and storage,Section Content:Precautions for safe handling\nAdditional hazards when processed\nPrecautions for safe handling\nHygiene measures\n: Pressurized container: Do not pierce or burn, even after use. Use only with equipment rated for\ncylinder pressure. Close valve after each use and when empty. Handle empty containers with\ncare because residual vapors are flammable. In use, may form flammable vapor-air mixture.\n: Do not handle until all safety precautions have been read and understood. Use only outdoors or\nin a well-ventilated area. Keep away from heat/sparks/open flames/hot surfaces. – No smoking.\nUse only non-sparking tools.\n: Do not eat, drink or smoke when using this product."}