{"GUID":"AkKsEQACHt+fl92lrPeIwg==","MATNR":"HZ-TNT","MAKTX":"TNT","WERKS":"0001","LGORT":"0004","LGOBE":"Explosives","SECTION_ID":7,"SECTION_HEADER":"Handling and storage","SECTION_CONTENT":"• Handling:\n• Precautions for safe handling\nEnsure good ventilation/exhaustion at the workplace.\nOpen and handle receptacle with care.\nPrevent formation of aerosols.\n• Information about protection against explosions and fires:\nKeep ignition sources away - Do not smoke.\nProtect against electrostatic charges.\nKeep respiratory protective device available.\nConditions for safe storage, including any incompatibilities\nStorage:\nRequirements to be met by storerooms and receptacles: Store in a cool location.\n• Information about storage in one common storage facility: Not required.\nFurther information about storage conditions:\nKeep receptacle tightly sealed.\nStore in cool, dry conditions in well sealed receptacles.\n• Specific end use(s) No further relevant information available.","REVISED_CONTENT":"Product ID:HZ-TNT,Product Description:TNT,Storage Location:0004,Storage Location Description:Explosives,Plant:0001,Section Id:7,Section Header:Handling and storage,Section Content:• Handling:\n• Precautions for safe handling\nEnsure good ventilation/exhaustion at the workplace.\nOpen and handle receptacle with care.\nPrevent formation of aerosols.\n• Information about protection against explosions and fires:\nKeep ignition sources away - Do not smoke.\nProtect against electrostatic charges.\nKeep respiratory protective device available.\nConditions for safe storage, including any incompatibilities\nStorage:\nRequirements to be met by storerooms and receptacles: Store in a cool location.\n• Information about storage in one common storage facility: Not required.\nFurther information about storage conditions:\nKeep receptacle tightly sealed.\nStore in cool, dry conditions in well sealed receptacles.\n• Specific end use(s) No further relevant information available."}