{"GUID":"AkKsEQACHt+fl92lrQBIwg==","MATNR":"HZ-URA","MAKTX":"URANIUM - WP","WERKS":"0001","LGORT":"0088","LGOBE":"Lager 0088 (WM)","SECTION_ID":13,"SECTION_HEADER":"Disposal considerations","SECTION_CONTENT":"SECTION 13: Disposal considerations\n13.1 Waste treatment methods\nProduct\nWaste material must be disposed of in accordance with the national and local regulations.\nLeave chemicals in original containers. No mixing with other waste. Handle uncleaned\ncontainers like the product itself. See www.retrologistik.com for processes regarding the\nreturn of chemicals and containers, or contact us there if you have further questions.","REVISED_CONTENT":"Product ID:HZ-URA,Product Description:URANIUM - WP,Storage Location:0088,Storage Location Description:Lager 0088 (WM),Plant:0001,Section Id:13,Section Header:Disposal considerations,Section Content:SECTION 13: Disposal considerations\n13.1 Waste treatment methods\nProduct\nWaste material must be disposed of in accordance with the national and local regulations.\nLeave chemicals in original containers. No mixing with other waste. Handle uncleaned\ncontainers like the product itself. See www.retrologistik.com for processes regarding the\nreturn of chemicals and containers, or contact us there if you have further questions."}