{"GUID":"AkKsEQACHt+fl92lpucowg==","MATNR":"HZ-PHO","MAKTX":"Phosphorus","WERKS":"0001","LGORT":"0088","LGOBE":"Lager 0088 (WM)","SECTION_ID":4,"SECTION_HEADER":"First-aid measures","SECTION_CONTENT":"4.1. Description of first aid measures\nGeneral Advice\nFor further assistance, contact your local Poison Control Center.\nInhalation\nGet medical attention if symptoms occur.\nSkin Contact\nWash off immediately with soap and plenty of water while removing all contaminated clothes and shoes. Get medical attention\nimmediately if symptoms occur.\nEye Contact\nIn case of eye contact, remove contact lens and rinse immediately with plenty of water, also under the eyelids, for at least 15\nminutes. Get medical attention immediately if irritation persists.\nIngestion\nDo NOT induce vomiting. Call a physician or poison control center immediately. Clean mouth with water and drink afterwards\nplenty of water.\n4.2. Most important symptoms and effects, both acute and delayed\nNo information available.\n4.3. Indication of any immediate medical attention and special treatment needed\nTreat symptomatically.","REVISED_CONTENT":"Product ID:HZ-PHO,Product Description:Phosphorus,Storage Location:0088,Storage Location Description:Lager 0088 (WM),Plant:0001,Section Id:4,Section Header:First-aid measures,Section Content:4.1. Description of first aid measures\nGeneral Advice\nFor further assistance, contact your local Poison Control Center.\nInhalation\nGet medical attention if symptoms occur.\nSkin Contact\nWash off immediately with soap and plenty of water while removing all contaminated clothes and shoes. Get medical attention\nimmediately if symptoms occur.\nEye Contact\nIn case of eye contact, remove contact lens and rinse immediately with plenty of water, also under the eyelids, for at least 15\nminutes. Get medical attention immediately if irritation persists.\nIngestion\nDo NOT induce vomiting. Call a physician or poison control center immediately. Clean mouth with water and drink afterwards\nplenty of water.\n4.2. Most important symptoms and effects, both acute and delayed\nNo information available.\n4.3. Indication of any immediate medical attention and special treatment needed\nTreat symptomatically."}